id,abstract,author,cites,cites_id,journal,number,pages,publisher,title,url,volume,year,citation_link,id_citations
9154,"Genotypes (A to H) of hepatitis B virus (HBV) influence liver disease progression and response to antiviral therapy in HBV-infected patients. Several methods have been developed for rapid genotyping of HBV strains. However, some of these methods may not be suitable for developing countries. The performance of INNO-LiPA HBV Genotyping assay (LiPA), direct DNA sequencing and subtractive PCR-RFLP of genotype-specific HBV genome regions were evaluated for accurately determining the HBV genotypes by analyzing sera (n = 80) samples from chronic HBV patients. Both, LiPA and DNA sequencing identified 63, 4 and 13 HBV strains as belonging to genotype D, genotype A and mixed genotype A and D, respectively. On the contrary, the PCR-RFLP-based method correctly identified all 4 genotype A but only 56 of 63 genotype D strains. Seven genotype D strains yielded indeterminate results. DNA sequence comparisons showed that a single nucleotide change in the target region generated an additional restriction site for Nla IV that compromised the accuracy of this method. Furthermore, all the mixed genotype A and D strains were identified only as genotype A strains. The data show that the PCR-RFLP-based method incorrectly identified some genotype D strains and failed to identify mixed genotype infections while LiPA and DNA sequencing yielded accurate results.",Maisa M Ali and Fuad Hasan and Suhail Ahmad and Widad Al-Nakib,32,8817604422646501842,Virology journal,1,1-5,BioMed Central,"Comparative evaluation of INNO-LiPA HBV assay, direct DNA sequencing and subtractive PCR-RFLP for genotyping of clinical HBV isolates",https://virologyj.biomedcentral.com/articles/10.1186/1743-422X-7-111,7,2010,/scholar?cites=8817604422646501842,ggyoQ3UAAAAJ:PR6Y55bgFSsC
9155,"UCON is a highly flexible and expressive usage control model which allows an object owner to specify detailed usage control policies to be evaluated on a remote platform. Assurance of correct enforcement is mandatory for the establishment of trust on the remote platform claiming to implement UCON. Without such an assurance, there is no way of knowing whether the policies attached to the objects will be enforced as expected. Remote attestation, an important component of Trusted Computing, is highly suitable for establishing such an assurance. Existing approaches towards remote attestation work at a very coarse-grained level and mostly only measure binary hashes of the applications on the remote platform. Solutions at this level of abstraction cannot provide assurance to a challenger regarding behavior of a remote platform concerning enforcement of the owner’s policies. In this paper, we provide a …",Mohammad Nauman and Masoom Alam and Xinwen Zhang and Tamleek Ali,32,1705300513108447499,,,63-80,"Springer, Berlin, Heidelberg",Remote attestation of attribute updates and information flows in a UCON system,https://link.springer.com/chapter/10.1007/978-3-642-00587-9_5,,2009,/scholar?cites=1705300513108447499,ggyoQ3UAAAAJ:Tyk-4Ss8FVUC
9156,"BACKGROUND: National legislation in Pakistan regulating blood banks has been introduced several times, but has never been passed. To support provincial-level efforts to develop legislation we conducted a study to evaluate blood-banking practices in Karachi, Pakistan, to identify areas that could be improved. METHODS: Thirty-seven blood banks were randomly selected from a list of 87 Karachi blood banks. The research team interviewed blood bank personnel, inspected available facilities and equipment, and observed blood collection using structured questionnaires and observation forms. RESULTS: Of the 37 selected facilities, 25 were operational and 24 agreed to participate. Twelve (50%) of the facilities reported regularly utilizing paid blood donors, while only six (25%) actively recruited volunteer donors. During observation only 8% of facilities asked donors about injecting drug use, and none asked …",Stephen Luby and Rafique Khanani and Maliha Zia and Zuleikha Vellani and Mohsin Ali and Abdul Haleem Qureshi and Aamir J Khan and Syed Abdul Mujeeb and Sharaf Ali Shah and Susan Fisher-Hoch,32,5043887738020600292,JPMA. The Journal of the Pakistan Medical Association,1 Suppl 1,S25,,"Evaluation of blood bank practices in Karachi, Pakistan, and the government's response.",https://www.ncbi.nlm.nih.gov/pubmed/16689480,56,2006,/scholar?cites=5043887738020600292,ggyoQ3UAAAAJ:-6RzNnnwWf8C
9157,"The synthesis, conformational analysis, and electronic absorption spectrum of a soluble, conformationally constrained porphyrin dimer linked via a buta-1,3-diyne unit attached to the β-pyrrolic positions is reported.",Jeffrey J Gosper and Mukhtar Ali,32,3354809036846489723,"Journal of the Chemical Society, Chemical Communications",14,1707-1708,The Royal Society of Chemistry,A conformationally constrained conjugated porphyrin dimer,https://pubs.rsc.org/en/content/articlehtml/1994/c3/c39940001707,,1994,/scholar?cites=3354809036846489723,ggyoQ3UAAAAJ:1wZ_wKGpLuwC
9158,"Level of risk management implementation is a core element in the success of enterprise risk management (ERM) system. However, most of the Malaysian firms are less likely to implement risk management practices. Therefore, their enterprise risk management (ERM) system is not performing well to mitigate potential risks. To resolve this problem, the current study focused on internal and external audit effectiveness. Thus, the prime objective of this study is to highlight the importance of risk management implementation with the help of internal and external effectiveness to enhance enterprise risk management (ERM). To achieve this objective three hypothesis are developed concerning the relationship of the audit with the level of risk management implementation, and the relationship between the level of risk management implementation and enterprise risk management (ERM) system. It is found that internal and external audit has a significant positive relationship with the level of risk management implementation. Moreover, it is found that level of risk management implementation has a significant positive relationship with enterprise risk management (ERM) system. Finally, this study can help Malaysian firms to develop a better enterprise risk management (ERM) system by mitigating the problem of risk management implementation.",Faiza Hashmi Waseem-Ul-Hameed and Mohsin Ali and Muhammad Arif,31,4348218833978805941,Asian Journal of Multidisciplinary Studies,11,,,Enterprise risk management (ERM) system: Implementation problem and role of audit effectiveness in Malaysian firms,https://core.ac.uk/download/pdf/229682213.pdf,5,2017,/scholar?cites=4348218833978805941,ggyoQ3UAAAAJ:aOEnwurrEPcC
9159,"Proper management of hospital waste is a critical concern in many countries of the world. Pakistan is the sixth most populous country in the world, with one of the highest urbanisation and population growth rates in South Asia. Data and analyses regarding hospital waste management practices in Pakistan are scarce in scientific literature. This study was meant to determine waste management practices at selected hospitals in a major city in Pakistan, Gujranwala. A total of 12 different hospitals were selected for the survey, which involved quantification of waste generation rates and investigation of waste management practices. The results were analysed using linear regression. The weighted average total, general and infectious hospital waste generation rates were found to be 0.667, 0.497 and 0.17 kg bed-day−1, respectively. Of the total, 73.85% consisted of general, 25.8% consisted of hazardous infectious and …",Mustafa Ali and Wenping Wang and Nawaz Chaudhry,31,10083137527267207186,Waste Management & Research,1,87-90,SAGE Publications,Management of wastes from hospitals: A case study in Pakistan,https://journals.sagepub.com/doi/abs/10.1177/0734242X15616474,34,2016,/scholar?cites=10083137527267207186,ggyoQ3UAAAAJ:XJogQLJr2CkC
9160,"The study highlights the functional and semantic properties of the last address of the Holy Prophet (PBUH). The study is based upon Halliday’s (1985) SFL Mood analysis. The data obtained from the last address of the Holy Prophet (PBUH) are analyzed in tables. The analysis of 56 clauses reveals that 32 are declarative, 22 are imperative; whereas, only one is interrogative clause. A brief discussion explains the functional structural meanings based on clausal Mood classification. The study of the religious text discusses interpersonal metafunction of language. It highlights the power relations of the participants. The study fills the gap of SFL based linguistic study of the religious texts. The research shall act as a torch light for young researchers for further investigation in this regard.",Mehwish Noor and Moazzam Ali and Fakharh Muhabat and Bahram Kazemian,31,17659405184827496301,"International Journal of Language and Linguistics. Special Issue: Critical Discourse Analysis, Rhetoric, and Grammatical Metaphor in Political and Advertisement Discourses",5-1,1-9,,Systemic functional linguistics mood analysis of the last address of the holy prophet (pbuh),https://papers.ssrn.com/sol3/papers.cfm?abstract_id=2604000,3,2015,/scholar?cites=17659405184827496301,ggyoQ3UAAAAJ:327GGIiaIgIC
9161,"Stress among medical students induced by academic pressures is on the rise among the student population in Pakistan and other parts of the world. Our study examined the relationship between two different systems employed to assess academic performance and the levels of stress among students at two different medical schools in Karachi, Pakistan.A sample consisting of 387 medical students enrolled in pre-clinical years was taken from two universities, one employing the semester examination system with grade point average (GPA) scores (a tiered system) and the other employing an annual examination system with only pass/fail grading. A pre-designed, self-administered questionnaire was distributed. Test anxiety levels were assessed by The Westside Test Anxiety Scale (WTAS). Overall stress was evaluated using the Perceived Stress Scale (PSS).There were 82 males and 301 …",Madiha Ali and Hamna Asim and Ahmed Iqbal Edhi and Muhammad Daniya Hashmi and Muhammad Shahjahan Khan and Farah Naz and Kanza Noor Qaiser and Sidra Masud Qureshi and Mohammad Faizan Zahid and Imtiaz Jehan,31,2580787400100687723,Medical education online,1,27706,Taylor & Francis,Does academic assessment system type affect levels of academic stress in medical students? A cross-sectional study from Pakistan,https://www.tandfonline.com/doi/abs/10.3402/meo.v20.27706,20,2015,/scholar?cites=2580787400100687723,ggyoQ3UAAAAJ:uWy0R8PweswC
9162,"Response of seed cotton yield to various plant populations and planting methods was studied at Adaptive Research Farm, Vehari, Pakistan during 2007 and 2008. Cotton variety CIM-496 was planted under three populations (88888, 59260 and 44444 plants/ha) maintained with plant spacings of 15, 22.5 and 30 cm, respectively and three planting methods viz. flat planting, ridge planting and bed planting in 75 cm apart rows. Average of two years data indicated that seed cotton yield was significantly higher in 59260 plants per hectare (2474 kg/ha) followed by 44444 (2324 kg/ha) and 88888 plants (2238 kg/ha). Among planting methods, bed planting gave significantly higher seed cotton yield (2290 kg/ha) than others.",Mushtaq Ali and Liaqat Ali and Muhammad Sattar and Muhammad Anjum Ali,31,2941316710101590461,J. Agric. Res,2,163-169,,Response of seed cotton yield to various plant populations and planting methods,https://apply.jar.punjab.gov.pk/upload/1374661095_83_34__163Paper-No.5.pdf,48,2010,/scholar?cites=2941316710101590461,ggyoQ3UAAAAJ:D2lc7i8A8ooC
9163,"Organic semiconducting materials are being extensively studied for the fabrication of electric, electronic and optoelectronic devices [1-4]. Most of these devices are usually fabricated in sandwich configuration and this structure requires the deposition of organic thin films on transparent conductive electrodes using vacuum evaporator or spin coater. On top of these films, metallic electrodes are deposited, which often damage the active material.Surface type organic thin film structures represent a simple, low cost and versatile alternative to the devices built in sandwich configuration. Because of these advantages, there is a growing interest in the fabrication and study of surface type optoelectronic devices employing organic semiconductors [5-7]. Also the surface type devices are very suitable for exploring the low cost and simple device fabrication techniques, such as spin or drop-coating, screen printing, inkjet printing, etc. Surface type structures offer simple and low cost technology for investigating the different properties of organic materials, such as light sensitivity, electroluminescence [6], effect of humidity [7], charge transport [5] etc. The materials possessing these properties are then employed in the fabrication of a wide range of electric, electronic and photonic devices. In [5], surface-type organic photodetector has been studied. Organic photocapacitors have been investigated",M Saleem and MH Sayyad and Kh S Karimov and Z Ahmad and Mutabar Shah and M Yaseen and I Khokhar and M Ali,31,717120391909653354,Journal of Optoelectronics and Advanced Materials,6,1468,INOE & INFM,"Synthesis and photocapacitive studies of Cu (II) 5, 10, 15, 20-tetrakis (4'-isopropylphenyl) porphyrin",https://www.researchgate.net/profile/Zubair_Ahmad10/publication/215500106_Synthesis_and_photocapacitive_studies_of_Cu_II_5101520-tetrakis_4'-isopropylphenylPorphyrin/links/5750732f08aef67d0d890b11/Synthesis-and-photocapacitive-studies-of-Cu-II-5-10-15-20-tetrakis-4-isopropylphenylPorphyrin.pdf,10,2008,/scholar?cites=717120391909653354,ggyoQ3UAAAAJ:RJNGbXJAtMsC
9164,"Coal and gas outburst disasters can cause serious casualties and property losses, which can be effectively avoided by means of early warning. In this paper, based on the theoretical analysis of the electromagnetic radiation (EMR) response law of mining-induced coal and gas outburst, this paper studied the variation law and precursory characteristics of EMR signals before and after the outburst. The results show that: (1) Coal and gas outburst is induced under the disturbance of mining and promoted by gas pressure and highly concentrated mining stress. (2) The EMR signal is related to changes in stress state, fracturing activity and gas flow state in the process of mining, and the increase of the outburst danger will change characteristics of EMR signal in time and frequency domains. (3) In the time domain, the EMR intensity is positively correlated with the outburst danger of coal seam. The variable coefficient of …",Liming Qiu and Zhonghui Li and Enyuan Wang and Zhentang Liu and Jianchun Ou and Xuelong Li and Muhammad Ali and Younian Zhang and Shankui Xia,30,7915347429865710677,Journal of Loss Prevention in the Process Industries,,206-215,Elsevier,Characteristics and precursor information of electromagnetic signals of mining-induced coal and gas outburst,https://www.sciencedirect.com/science/article/pii/S0950423017310045,54,2018,/scholar?cites=7915347429865710677,ggyoQ3UAAAAJ:2mus-XyGPC0C
9165,"This review article summarises the possible mechanisms of the protein-ligand interaction, folding, misfolding, aggregation and inhibition of protein aggregates. Under certain stressed condition the folding process deviates from its path and results into misfolding and aggregation of proteins. So aggregates have to be inhibited in order to cure the diseases. In some cases of protein-ligand interaction studies we have seen that the interaction of a protein with more than one ligand may show both type of quenching mechanisms i.e. dynamic as well as static quenching rather than single type of quenching mechanism, that result can be entirely different by the result of binding study utilising single ligand. So, likewise it is hypothesized that if the aggregates are inhibited by using more than one inhibitor may give more fruitful results rather than application of single inhibitor in inhibition and disaggregation of the preformed …",Tajalli Ilm Chandel and Masihuz Zaman and Mohsin Vahid Khan and Maroof Ali and Gulam Rabbani and Mohd Ishtikhar and Rizwan Hasan Khan,30,9359370542337301010,,,1115-1129,Elsevier,"A mechanistic insight into protein-ligand interaction, folding, misfolding, aggregation and inhibition of protein aggregates: An overview",https://www.sciencedirect.com/science/article/pii/S0141813017330994,106,2018,/scholar?cites=9359370542337301010,ggyoQ3UAAAAJ:S_fw-_riRmcC
9166,"In this work, the effect of a new nanocomposite material on the photodegradation of methylene blue is demonstrated. The nanocomposite is synthesized by the combination of cupric oxide (CuO) with graphene nanoplatelets (GNPs) and characterized by XRD, FE-SEM, FTIR, Raman, and UV–vis spectroscopy. Interestingly, the inclusion of GNPs with CuO enhances the photocatalytic properties of nanocomposite without tweaking inherent properties such as the conductive nature of GNPs. Within 80 min of exposure to the solar light, a 99.44% photodegradation of methylene blue is achieved, which is much better than using CuO alone, for which the degradation is only 75%. The much-improved photocatalytic performance of the nanocomposite is a consequence of low bandgap energy of GCuO as well as the conducting nature of GNPs, that causes fast photo excitation of electrons and lengthens the recombination …",Aqsa Arshad and Javed Iqbal and M Siddiq and M Umair Ali and Ahmed Ali and Hassan Shabbir and Usama Bin Nazeer and M Shahbaz Saleem,30,7063170240207886016,Ceramics International,14,10654-10660,Elsevier,Solar light triggered catalytic performance of graphene-CuO nanocomposite for waste water treatment,https://www.sciencedirect.com/science/article/pii/S0272884217305473,43,2017,/scholar?cites=7063170240207886016,ggyoQ3UAAAAJ:08ZZubdj9fEC
9167,"Cyclic di‑AMP (c-di-AMP) is a second signaling molecule involved in the regulation of bacterial physiological processes and interaction between pathogen and host. However, the regulatory network mediated by c-di-AMP in Mycobacterium remains obscure. In M. smegmatis, a diadenylate cyclase (DAC) was reported recently, but there is still no investigation on c-di-AMP phosphodiesterase (PDE). Here, we provide a systematic study on signaling mechanism of c-di-AMP PDE in M. smegmatis. Based on our enzymatic analysis, MsPDE (MSMEG_2630), which contained a DHH-DHHA1 domain, displayed a 200-fold higher hydrolytic efficiency (k cat/K m) to c-di-AMP than to c-di-GMP. MsPDE was capable of converting c-di-AMP to pApA and AMP, and hydrolyzing pApA to AMP. Site-directed mutations in DHH and DHHA1 revealed that DHH domain was critical for the phosphodiesterase activity. To explore the …",Qing Tang and Yunchao Luo and Cao Zheng and Kang Yin and Maria Kanwal Ali and Xinfeng Li and Jin He,30,6856382427731291746,International journal of biological sciences,7,813,Ivyspring International Publisher,Functional analysis of a c-di-AMP-specific phosphodiesterase MsPDE from Mycobacterium smegmatis,https://www.ncbi.nlm.nih.gov/pmc/articles/PMC4466462/,11,2015,/scholar?cites=6856382427731291746,ggyoQ3UAAAAJ:i_QFVEgXGzMC
9168,"The paper presents an incremental development of the methodology for chilled water system design optimization. Initially, the system configuration parameters are varied with fixed design conditions to confirm the established best practice design criteria, followed by a comprehensive system design optimization. The implemented simulation-based optimization approach couples the Dymola/Modelica dynamic modeling and simulation program with GenOpt generic optimization program to find optimal system configuration. A dynamic system model is developed to vary and simulate different chilled water system configurations. Optimization of the chilled water system is achieved at both design and configuration level using five design variables. Two discrete variables are related to system configuration: number of chillers and number of cooling towers and three continuous variables are related to system design …",Muzaffar Ali and Vladimir Vukovic and Mukhtar Hussain Sahir and Giuliano Fontanella,30,12104591734125371575,Energy and Buildings,,111-122,Elsevier,Energy analysis of chilled water system configurations using simulation-based optimization,https://www.sciencedirect.com/science/article/pii/S0378778812006603,59,2013,/scholar?cites=12104591734125371575,ggyoQ3UAAAAJ:x21FZCSn4ZoC
9169,"If G is a connected graph, the distance d (u, v) between two vertices u, v€ V (G) is the length of a shortest path between them. Let VV=(u1, w2,..., we] be an ordered set of vertices of G and let v be a vertex of G. The representation r (v| W) of v with respect to W is the k-tuple (d (v, w), d (v, w),.........., d (v, w)). If distinct vertices of C have distinct representations with respect to W, then W is called a resolving set or locating set for G. A resolving set of minimum cardinality is called a basis for G and this cardinality is the metric dimension of C, denoted by din (C). A family (7 of connected graphs is a family with constant metric dimension if din (G) does not depend upon the choice of C in G. In this paper, we are dealing with the study of metric dimension of Möbius ladders. We prove that Möbius ladder M, constitute a fanily of cubic graphs with constant metric dimension and only three vertices suffice to resolve all the vertices of …",Murtaza Ali and Gohar Ali and Muhammad Imran and Abdul Qudair Baig and Muhammad Kashif Shafiq,30,17190021609876918597,Ars Comb.,,403-410,,On the metric dimension of Mobius ladders.,https://www.researchgate.net/profile/Muhammad_Imran8/publication/267474657_On_the_metric_dimension_of_Mobius_ladders/links/553b5c910cf245bdd764723c/On-the-metric-dimension-of-Moebius-ladders.pdf,105,2012,/scholar?cites=17190021609876918597,ggyoQ3UAAAAJ:6KBr9xvF6m4C
9170,"This study tried to determine the influence of set of explanatory variables on the capital structure determination for Pakistani non-financial firms by using panel data. This study also finds the applicability of two capital structure theories (pecking order theory and trade-off theory) in Pakistani non-financial sector. This study used five previously studied variables (profitability, size, growth, tangibility of assets, non-debt tax shield), and added three new variables (tax, liquidity and payout), which were not used previously in Pakistani context. This research used data from 336 non-financial firms over the period of 5 years (2005-2009). This study used fixed effect random model regression analysis to analyze determinants of capital structure. The results showed that industry type play important role in determining capital structure. The results showed that out of eight variables five (size, tangibility of assets, non-debt tax shields, liquidity and payout) are statistically significantly related to leverage, remaining three are statistically insignificantly related with leverage. Two expected relation are accepted while six are rejected after empirical analysis. This study identifies that industry type, liquidity and payout ratio play important role, whereas tax does not play important role in identifying capital structure Pakistani non-financial firms.",Fawad Ahmad and Rao Umer Nasir and Mohsin Ali and Wasim Ullah,30,11057974893600404122,African Journal of Business Management,28,11375-11385,,Extension of determinants of capital structure: Evidence from Pakistani non-financial firms,https://papers.ssrn.com/sol3/papers.cfm?abstract_id=1964901,5,2011,/scholar?cites=11057974893600404122,ggyoQ3UAAAAJ:CNPyR2KL9-0C
9171,"Little is known about the effect of hemodialysis (HD) on gas exchange in subjects with chronic obstructive pulmonary disease (COPD). The purpose of this study was to examine blood gases and pH in COPD patients undergoing HD with bicarbonate dialysate. We studied thirteen subjects with COPD and thirteen controls (CON). All were dialyzed for 4 hrs against a bicarbonate HD solution. Blood gases, pH and HCO3 − were initially analyzed (t0) and, during HD, at 30 min (t0.5), 1 hr (t1) and 4 hrs (t4). At t0, a statistically significant difference was observed for PO2 (CON: 84.7±3.60, COPD: 72.19±4.92; p<0.001). For the first hr, PO2 decreased, and at t1, oxygen was required for 6 COPD subjects. By t4, there was no significant difference in PO2 between groups. The alveolar-arterial gradient (ΔA-a) remained different between groups (P<0.001, all times), with increasing ΔA-a for both groups up to t1 and decreasing …",Maria Alfakir and Mahmoud Q Moammar and Muhammad I Ali and Eid Alhatem and Ryan D Curran and Rani M Saoud and Chandra Chandran and M Anees Khan and Vincent A DeBari,30,12522891516310976018,Annals of Clinical & Laboratory Science,4,315-320,Association of Clinical Scientists,Pulmonary gas exchange during hemodialysis: a comparison of subjects with and without COPD on bicarbonate hemodialysis,http://www.annclinlabsci.org/content/41/4/315.short,41,2011,/scholar?cites=12522891516310976018,ggyoQ3UAAAAJ:tgXRM5oPLYQC
