id,abstract,author,cites,cites_id,journal,number,pages,publisher,title,url,volume,year,citation_link,id_citations
10242,"Technology and organizational behavior issues that are barriers to the commercial success of expert systems are discussed. The issues include interfacing and integrating with existing systems, picking the correct problem, fulfilling development goals, representing knowledge, acquiring knowledge, validating and maintaining the system, deploying and introducing expert systems in an organization, and managing organizational behavior after development is complete. It is argued that overcoming these barriers requires technology-transfer methods that account for an expert system's size and the structure and culture of the organizations involved. Examples of the technology transfer of expert systems are presented.< >",H Raghav Rao,5,12693370295902711895,IEEE Expert,2,5-10,IEEE,Technology transfer: Making expert systems commercially successful,https://ieeexplore.ieee.org/abstract/document/129277/,7,1992,/scholar?cites=12693370295902711895,y1pwDooAAAAJ:D_sINldO8mEC
10243,,H Raghav Rao,5,15503995687249674931,Information Systems Management,3,42-47,,The technology transfer of expert systems,http://scholar.google.com/scholar?cluster=15503995687249674931&hl=en&oi=scholarr,8,1991,/scholar?cites=15503995687249674931,y1pwDooAAAAJ:yqoGN6RLRZoC
10244,"The Zika Virus brought spread fear not only because of its direct impact on many lives but also due to the various cyber-rumor messages spread across social media (Valecha et al., 2017). It is not surprising that several medical societies, WHO, CDC, etc. have put in their best efforts in educating people about the situation. Due to the significant time taken by those organizations in providing factual information, there has been a widespread problem of rumors associated with health information. When health information is manipulated, it results in frustration, panic and disturbances among the lives of general people. It comes as no surprise that the Atlantic states,“of all the categories of [misinformation], health news is the worst.” 1The dark side of social media in the form of cyber-rumors has motivated many researchers in behavioral Information Systems to study the core nature of the message (Oh et al., 2018). A key element for successful health-related cyber-rumor management is “to understand what makes citizens prone to engaging in [health-related] cyber-rumor sharing”(Kwon & Rao, 2017; p. 307). Prior literature in the rumor context has investigated polarity of a rumor in a news channel (Oh et al., 2013). It has found that most of the rumors that spread in case of a disaster scenario possess negative sentiment. In this paper, we focus on another characteristic of the cyber-rumor message–distance from point of interest (Kwon et al., 2017).",Tejaswi Volety and Rohit Valecha and Naga Vemprala and Hazel Kwon and Raghav Rao,4,9535058929098325629,,,,,Cyber-rumor sharing: the case of Zika virus,https://aisel.aisnet.org/amcis2018/DataScience/Presentations/1/,,2018,/scholar?cites=9535058929098325629,y1pwDooAAAAJ:IfvCfoBprpQC
10245,"The purpose of this study is to methodologically replicate the model presented by D’Arcy et al.(2014) using a new sampling frame that consists of employees in a single organization–a large academic institution in Canada (N= 150). This is in contrast to the original study, which used a large, demographically diverse sample of online panel respondents that spanned multiple organizations and industries. Our replication results confirm the results of the original study, and in doing so, support the theoretical position that security-related stress induces moral disengagement of information security policy (ISP) violations, which in turn increases ISP violation intention. The findings also indirectly support the viability of online panel respondents for studies of employees’ security-related intentions. Having established the robustness of the D’Arcy et al.(2014) model across two sampling frames, we recommend future conceptual replications that employ alternate measures of security-related stress and more rigorous research designs that capture the relationships between security-related stress, moral disengagement, and ISP violations.",John D’Arcy and Tejaswini Herath and Myung-Seong Yim and N Kichan and HR Rao,4,12059155159776008251,AIS Transactions on Replication Research,8,1-17,,Employee moral disengagement in response to stressful information security requirements: a methodological replication of a coping-based model,https://aisel.aisnet.org/trr/vol4/iss1/8/,4,2018,/scholar?cites=12059155159776008251,y1pwDooAAAAJ:5-tCjTwfAdEC
10246,"The Protection Motivation Theory is a leading framework to study individuals’ information security behaviors such as identity theft protection, but the effects of its two components, namely threat appraisal and coping appraisal, vary across studies. This study examines the issue based on an integrated Protection Motivation-Precaution Adoption Process Model. We suggest that the effects of perceived threat (including perceived vulnerability and perceived severity) and perceived coping efficacy (including perceived response efficacy and self-efficacy) on individuals’ intentions to adopt identity protection service are influenced by the stage of the person in the behavioral change process: for individuals in the action stage, their intention is influenced more by perceived coping efficacy but less by perceived threat, compared to those in the pre-action stage. An online survey via Qualtrics Research Suite partially confirms our expectation. An implication of the study is to deliver stage-targeted information to individuals to effectively motivate them to adopt the service.",Yuan Li and Jingguo Wang and H Raghav Rao,4,18051073752627362779,,,,,Adoption of Identity Protection Service: An Integrated Protection Motivation–Precaution Adoption Process Model,https://aisel.aisnet.org/amcis2017/InformationSystems/Presentations/23/,,2017,/scholar?cites=18051073752627362779,y1pwDooAAAAJ:xoCRtiy2jdkC
10247,"Prior studies showed that some users tend to act against their stated privacy concerns (a phenomenon commonly known as privacy paradox). In this study, we adopt the dual process theory as our theoretical basis to account for conscious and unconscious modes of individual decision making processes to examine privacy paradox in order to gain an understanding of the reasons which cause inconsistency between privacy concern and information disclosure. We also posit that privacy paradox can occur due to the conscious mode (affected by bounded rationality) as well as unconscious biases.",Zahra Aivazpour and Rohit Valecha and Raghav H Rao,4,14425007774083638466,,,,,Unpacking privacy paradox: A dual process theory approach,https://aisel.aisnet.org/amcis2017/InformationSystems/Presentations/41/,,2017,/scholar?cites=14425007774083638466,y1pwDooAAAAJ:Qwfv3SoyJx4C
10248,In this document we describe a theoretical approach to modeling public emotional response cycles to crisis events. We also provide a preliminary theoretical approach to modeling crisis communication propagation that is counter intuitive to existing belief and literature regarding emotionally charged language and discussion artifact dispersion. The data set used to test these theories is contextualized by the OPM data breach of 2015 and consists of twitter data corresponding to the ensuing discussion following public notification that the breach had occurred. The resulting analysis reveals that an adapted Kübler-Ross model fits the aggregated public emotional response cycle and that emotionally charged language is negatively associated with messages the disperse more than average.,Eric Bachura and Rohit Valecha and Rui Chen and Raghav H Rao,4,9029982497658979399,,,,,Modeling public response to data breaches,https://aisel.aisnet.org/amcis2017/InformationSystems/Presentations/43/,,2017,/scholar?cites=9029982497658979399,y1pwDooAAAAJ:GCDlZl827dEC
10249," Social Network Services (SNS), for example Twitter, play a significant role in the way people share their emotions about specific events. Emotions can spread via SNS and can spur people’s future actions. Therefore, during extreme events, disaster response agencies need to manage emotions appropriately via SNS. In this research, we investigate the Twitter verse associated with an event - the Boston Bombing context. We focus on tweets in the context of hazard-describing keywords (Explosion, Bomb), important event timelines, and the related changes in emotions over time. We compare the results with a corpus of tweets collected at the same time that are not associated with the above hazard- describing keywords. A sentiment analysis shows anger was the most strongly expressed emotion in both groups. However, there were statistical differences in Anxiety and Sadness among the two groups over time.",Jaeung Lee and Basma Abdul Rehman and Manish Agrawal and H Raghav Rao,4,4269854776891211233,,,1-14,"Springer, Cham",Sentiment analysis of Twitter users over time: the case of the Boston bombing tragedy,https://link.springer.com/chapter/10.1007/978-3-319-45408-5_1,,2015,/scholar?cites=4269854776891211233,y1pwDooAAAAJ:LPtt_HFRSbwC
10250,"Resilience has been studied extensively in humans but less attention has been paid to organizational resilience in hospital organizations. This research aims to offer solutions for effective management of extreme events in hospitals by investigating the antecedents of healthcare workers' perceptions of organizational resilience. The theory of organizational resilience was used to examine the role of information privacy, information security, information access, leadership during emergencies, employee empowerment, and emergency training. A total of 402 survey responses were analyzed using Partial Least Squares regression. This is a research in progress.",Victoria Kisekka and Raj Sharman and Raghav Rao and Shambhu Upadhyaya,4,17633209961680568840,,,,,Investigating the antecedents of healthcare workers' perceptions of organizational resilience in hospitals,https://aisel.aisnet.org/icis2015/proceedings/IShealth/10/,,2015,/scholar?cites=17633209961680568840,y1pwDooAAAAJ:IuYOVjjUQBMC
10251,"Access control models are implemented to mitigate the risks of unauthorized access in Electronic Health Records (EHRs). These models provide authorization with the help of security policies, wherein the protected resource is governed by one or more policies that exactly specify what attributes a requester needs to fulfill in order to obtain access. However, due to the increasing complexity of current healthcare system, defining and implementing policies are becoming more and more difficult. In this research-inprogress paper, we present an Activity Theory driven methodology to formalize access control policies that can be used in enforcing patient’s privacy consent in a healthcare setting. In order to account for the transitivity in health workflows, we extend the Activity Theory to include “organizational interconnectedness” within the health workflows.",Rohit Valecha and Mandvika Kashyap and Swathi Rajeev and Raghav Rao and Shambhu Upadhyaya,4,3098937004261149061,,,,,An activity theory approach to specification of access control policies in transitive health workflows,https://aisel.aisnet.org/icis2014/proceedings/ISHealthcare/30/,,2014,/scholar?cites=3098937004261149061,y1pwDooAAAAJ:PDAgwb0ELvkC
10252,"This article analyzes competition among mediation service providers that match clients and vendors in a horizontally differentiated market. This is an issue that is important for decision support of mediators in determining pricing and service strategies. We present a simulation model to simultaneously represent search as well as the behaviors of clients, vendors, and multiple competing mediators. Among our findings: intermediaries find it optimal to offer registration fee incentives and derive revenues from transaction fees from successful matches; as switching costs increase, incumbent utilities increase and entrant utilities decrease; expertise, modeled as the ability of mediators to assess vendor attributes accurately, is a powerful competitive weapon for entrants to erode the incumbent intermediary's first mover advantage. On the other hand, client satisfaction is an instrument for an incumbent intermediary to deter …",Manish Agrawal and Govind Hariharan and H Raghav Rao and Rajiv Kishore,4,3973251077626741130,Journal of organizational computing and electronic commerce,3,169-199,Taylor & Francis,"Competition in mediation services: Modeling the role of expertise, satisfaction, and switching costs",https://www.tandfonline.com/doi/abs/10.1080/10919392.2013.807711,23,2013,/scholar?cites=3973251077626741130,y1pwDooAAAAJ:35r97b3x0nAC
10253,"The migration to Electronic Health Records (EHR) has raised issues with respect to security and privacy. One such issue that has become a concern for the healthcare providers, insurance companies and pharmacies is Patient Health Information (PHI) leak. Borrowing from Document Control Domain (DCD) literature, in this paper, we develop a methodology for detection and mitigation of PHI leaks by employing Activity Theory to elucidate the complex activities in the transitive workflow.",Rohit Valecha and Shambhu Upadhyaya and Raghav Rao and Arun Keepanasseril,4,7271284356374397122,,,,,An Activity Theory Approach to Leak Detection and Mitigation in Personal Health Information (PHI),https://pdfs.semanticscholar.org/a238/d1a30ae13ba1819e756a3b94cd4da45502fd.pdf,1,2012,/scholar?cites=7271284356374397122,y1pwDooAAAAJ:3DOefFFSZ7MC
10254,"Due to differences in governance structure, training, applicable polices, legal requirements and culture, the nature of operations vary based on agency, county, population, leadership, etc. This leads to serious challenges during multi-agency response to emergencies. The different agencies are required to work together to effectively and efficiently respond to an emergency incident. The paper contributes to research in areas of inter-agency collaboration and emergency management. With the help of case study, this paper aims to explore factors that impact inter-agency collaboration to generate design principles that are useful to designing better systems to mitigate critical incidents. In addition, with the help of interviews with four experts (two fire chiefs and two dispatchers) and raw incident communication reports, we identify system, communication, information, and interoperability issues.",Roht Valecha and Raj Sharman and Raghav Rao and Shambhu Upadhyaya,4,5419599287062876707,,,,,Design principles for emergency collaborative systems: A situation awareness study of Buffalo plane crash,https://aisel.aisnet.org/amcis2012/proceedings/SystemsAnalysis/8/,,2012,/scholar?cites=5419599287062876707,y1pwDooAAAAJ:IrOsW1AMYYMC
10255,"We have recently witnessed an uptake in the number of campus related incidents. School administrations are increasingly concerned about notification systems to alert students against the incidents and to provide advice on actions that they would like the students to take. However whether students appropriately react to notifications sent by these systems are still less understood. This paper develops and validates an instrument to measure the critical factors (subjective norm, threat appraisal, message efficacy, and media richness) that motivate students to comply with the directions in the notifications. The instrument has been validated through a pretest, followed by a pilot test, finally a main field test based on the data collected from a large Northeastern university. This research attempts to inform both theory and practice, and will help develop policy suggestions on what can be done to improve compliance with emergency notifications on university campus.",Wencui Han and Serkan Ada and Raj Sharman and H Raghav Rao and Joseph Brennan,4,4843656881618018932,,,,,Critical Success Factors to Improve Compliance with Campus Emergency Notifications.,https://pdfs.semanticscholar.org/0896/872204eb89ed1828c377b4deb375c7466b7e.pdf,,2011,/scholar?cites=4843656881618018932,y1pwDooAAAAJ:IRz6iEL74y4C
10256,"Research has shown that an adverse security event such as a security breach negatively affects stock price and market valuation of the company. Such events result in substantial loss of reputation and engenders negative corporate image in company’s stakeholders. Under such crises, literature has demonstrated that companies devise crisis response strategies to counter the negative effects of the crisis. Use of mass communication has been pivotal in informing the stakeholders of company’s post-crisis actions. Media announcements about positive security initiatives are considered as a crisis response mechanism after a security breach. Our research investigates how content of these announcements impact company’s stock price. We examine impact of use of certain frames, in media announcements, on stock price.",Manish Gupta and Raj Sharman and HR Rao,4,16094087553683613601,6th Annual Symposium on Information Assurance (ASIA’11),,45-51,,Framing effects of crisis response communications on market valuation of breached firms,http://www.academia.edu/download/30772340/ASIA11Proceedings.pdf#page=54,,2011,/scholar?cites=16094087553683613601,y1pwDooAAAAJ:N5tVd3kTz84C
10257,"The study explores determinants of the prominence of public information sources in Twitter. Twitter users are conceptualized as the “gated” who play an active role in selecting and distributing news sources through their Twitter messages. Using Twitter data on the Israel-Gaza conflict, the study identifies three determinants that characterize information sources: whether they are produced by mainstream media, whether they are filtered through aggregator services, and the number of in-links to the source media generated by the online public.",Onook Oh and Kyounghee Kwon and Manish Agrawal and H Raghav Rao,4,12890880655117105980,,,,,Choice of Information: A Study of Twitter News Sharing during the 2009 Israel-Gaza Conflict,https://aisel.aisnet.org/icis2011/proceedings/issues/1/,,2011,/scholar?cites=12890880655117105980,y1pwDooAAAAJ:oNZyr7d5Mn4C
10258,,O Oh and M Agrawal and HR Rao,4,110741128548624842,"Proceedings of Centre of Excellence for National Security (CENS), Singapore",,,,Analysis of tweets and rumors during the Mumbai terrorist attack of November 2008,http://scholar.google.com/scholar?cluster=110741128548624842&hl=en&oi=scholarr,,2010,/scholar?cites=110741128548624842,y1pwDooAAAAJ:ooaom_WTAwIC
10259,"This paper elucidates the social, ethical, cultural, technical, and legal implications / challenges around the implementation of a biometric based unique identification (UID) number project. The Indian government has undertaken a huge effort to issue UID numbers to its residents. Apart from possible challenges that are expected in the implementation of UID, the paper also draws parallels from Social Security Number system in the US. We discuss the setbacks of using the Social Security Number as a unique identifier and how to avoid them with the system being proposed in India. We discuss the various biometric techniques used and a few recommendations associated with the use of biometrics.",Haricharan Rengamani and Ponnurangam Kumaraguru and Rajarshi Chakraborty and H Raghav Rao,4,2982086114826457730,,,146-153,"Springer, Berlin, Heidelberg",The unique identification number project: challenges and recommendations,https://link.springer.com/chapter/10.1007/978-3-642-12595-9_19,,2010,/scholar?cites=2982086114826457730,y1pwDooAAAAJ:ZfRJV9d4-WMC
10260,This study examines the impact of perceived risk and organizational resilience on information systems success process in the context of hospitals. The research model was tested with the data collected from three of the hospitals in the Western New York area that were affected by a major snowstorm that was labeled as a federal disaster. The analysis and results appear. Theoretical and practical implications of this study and future research directions are discussed.,Insu Park and Raj Sharman and H Raghav Rao and S Upadhyaya,4,16318950273300289728,,,181-185,"Springer, Berlin, Heidelberg",On the Two Factors Affecting Information Systems Success in the Extreme Event Context,https://link.springer.com/chapter/10.1007/978-3-642-17449-0_18,,2009,/scholar?cites=16318950273300289728,y1pwDooAAAAJ:_Ybze24A_UAC
10261,,P Singh and P Singh and I Park and J Lee and HR Rao,4,18217617082941479675,,,,IGI Publishers,Information sharing: a study of information attributes and their relative significance during catastrophic events. Cyber-Security and Global Information Assurance: Threat …,http://scholar.google.com/scholar?cluster=18217617082941479675&hl=en&oi=scholarr,,2009,/scholar?cites=18217617082941479675,y1pwDooAAAAJ:lIeuKFitLToC
10262,"This poster reports findings from a study that analyzed the role of task complexity in public acceptance of e-government compliance services. Two government compliance services in two different service domains were examined in a questionnaire survey that yielded 150 usable responses from current or prospective users of the services. The results suggest that citizens adopt different decision criteria for different types of e-Gov compliance services. More specifically, functional usefulness of an e-Gov service becomes a more important criterion when the compliance service involves difficult tasks. In contrast, if the task of compliance is simple, the e-Gov service provider's competence in online operations becomes a more important factor of potential users' decisions. The findings can help e-Gov initiatives evaluate and prioritize G2C e-Gov service development projects by identifying services more readily acceptable to …",JinKyu Lee and H Raghav Rao,4,12506777720802815489,,,363-364,Digital Government Society of North America,Complexity of compliance tasks and user acceptance of G2C online compliance services,https://dl.acm.org/citation.cfm?id=1367894,,2008,/scholar?cites=12506777720802815489,y1pwDooAAAAJ:738O_yMBCRsC
10263,,Matthew L Smith and Merel E Noorman and Aaron K Martin and Craig Van Slyke and France Bélanger and Richard D Johnson and Ross Hightower and Daniel Simon and Kai Fischbach and Detlef Schoder and Andrew Schwarz and Michel Kalika and Hajer Kefi and Colleen Schwarz and Dahui Li and Patrick YK Chau and Kelly J Fadel and Susan A Brown and Susan A Sherer and Rui Chen and H Raghav Rao and Raj Sharman and Shambhu J Upadhyaya and Jinki Kim and Chuan-Hoo Tan and Wee-Kek Tan and Hock-Hai Teo and Jun He and Lee A Freeman and Randall F Young and John Windsor and Shirish C Srivastava and Thompson SH Teo and Michael Rosemann and Jan Recker and Iris Vessey and Martin Yuecheng Yu and Karl R Lang and Nanda Kumar and Nicole L Beebe and V Srinivasan Rao and Heikki Topi and Joseph S Valacich and Ryan T Wright and Kate Kaiser and Jay F Nunamaker Jr and Janice C Sipior and Gert Jan de Vreede,4,2457579603901603886,,,,,Panel Reports,https://aisel.aisnet.org/cais/vol26/iss1/,,2006,/scholar?cites=2457579603901603886,y1pwDooAAAAJ:1DsIQWDZLl8C
10264,"It is important to know how vulnerable systems are for a wide variety of reasons. Information Systems managers have the duty to advise senior management of the level of risks faced by the information systems. Therefore an assessment of the level of risk is necessary. Research work in this area is in its infancy. Further, the efforts are varied and deal with different aspects of the issue. There is no coherent approach. This paper provides a review of the literature and will be presenting a framework for analysis and development of metrics for security at the conference.",Raj Sharman and Raghav Rao and Shambhu Upadhyaya,4,2628481379204832236,AMCIS 2004 Proceedings,,181,,Metrics for information security-a literature review,https://aisel.aisnet.org/cgi/viewcontent.cgi?article=1757&context=amcis2004,,2004,/scholar?cites=2628481379204832236,y1pwDooAAAAJ:K1TAGxA9IWwC
10265,,DJ Kim and SD Braynov and HR Rao,4,347470361928081969,Proceedings of the Seventh Americas Conference in Information Systems,,2-5,,Y. Song (2001).‘A B-to-C Trust Model for Online Exchanges’,http://scholar.google.com/scholar?cluster=347470361928081969&hl=en&oi=scholarr,,2001,/scholar?cites=347470361928081969,y1pwDooAAAAJ:F9fV5C73w3QC
10266,,R Kishore and HR Rao and ME Swinarski,4,9673458719178375779,"Proceedings of the 7th Americas conference on information systems, Boston",,,,Impact of ASP capabilities on application service quality,http://scholar.google.com/scholar?cluster=9673458719178375779&hl=en&oi=scholarr,,2001,/scholar?cites=9673458719178375779,y1pwDooAAAAJ:r_AWSJRzSzQC
10267,,A Bhatnagar and S Misra and HR Rao,4,18359733335940584895,"Convenience, and",,,,On risk,http://scholar.google.com/scholar?cluster=18359733335940584895&hl=en&oi=scholarr,,2000,/scholar?cites=18359733335940584895,y1pwDooAAAAJ:AHdEip9mkN0C
