id,abstract,author,cites,cites_id,journal,number,pages,publisher,title,url,volume,year,citation_link,id_citations
9000,"In this article, we report on the fabrication and characterization of Ti2AlC, Ti2AlN, and Ti2AlC0.5N0.5. Reactive hot isostatic pressing (hipping) at ≈40 MPa of the appropriate mixtures of Ti, Al4C3 graphite, and/or AlN powders for 15 hours at 1300 °C yields predominantly single-phase samples of Ti2AlC0.5N0.5, 30 hours at 1300 °C yields predominantly single-phase samples of Ti2AlC. Despite our best efforts, samples of Ti2AlN (hot isostatic pressed (hipped) at 1400 °C for 48 hours) contain anywhere between 10 and 15 vol pct of ancillary phases. At ≈25 µM, the average grain sizes of Ti2AlC0.5N0.5 and Ti2AlC are comparable and are significantly smaller than those of Ti2AlN, at ≈100 µm. All samples are fully dense and readily machinable. The room-temperature deformation under compression of the end-members is noncatastrophic or graceful. At room temperature, solid-solution strengthening is …",MW Barsoum and T El-Raghy and M Ali,579,10981085029539888737,Metallurgical and Materials Transactions A,7,1857-1865,Springer-Verlag,"Processing and characterization of Ti2AlC, Ti2AlN, and Ti2AlC0.5N0.5",https://link.springer.com/article/10.1007/s11661-006-0243-3,31,2000,/scholar?cites=10981085029539888737,ggyoQ3UAAAAJ:9w-KRoa3VEQC
9001,"The trace metals are frequently encountered as mixtures of essential and non-essential elements. Therefore, evaluation of their toxic effects individually does not offer a realistic estimate of their impact on biological processes. We studied effects of a mixture of four essential and toxic metals (Cu, Cd, Fe and Ni) on biochemical and morphological characteristics of the gills of a biomarker freshwater fish Channa punctata (Bloch) using environmentally relevant concentrations. Fish were exposed to metal mixture through tank water for 7, 15 and 30 days. Biochemical studies as well as light microscopy (LM) and scanning electron microscopy (SEM) revealed significant metal exposure-induced alterations in gills. Besides ultastructural changes, activities of antioxidant enzymes such catalase (CAT), glutathione S-transferase (GST) and superoxide dismutase (SOD) were significantly altered in the gills of exposed fish. The …",Suwarna Pandey and Suhel Parvez and Rizwan Ahamd Ansari and Mehboob Ali and Manpreet Kaur and Faisal Hayat and Firoz Ahmad and Sheikh Raisuddin,275,5961799328860115022,Chemico-biological interactions,3,183-192,Elsevier,"Effects of exposure to multiple trace metals on biochemical, histological and ultrastructural features of gills of a freshwater fish, Channa punctata Bloch",https://www.sciencedirect.com/science/article/pii/S0009279708002664,174,2008,/scholar?cites=5961799328860115022,ggyoQ3UAAAAJ:Ns2bVKt8YxIC
9002,"Ionic liquids have shown their potential as a solvent media for many enzymatic reactions as well as protein preservation, because of their unusual characteristics. It is also observed that change in cation or anion alters the physiochemical properties of the ionic liquids, which in turn influence the enzymatic reactions by altering the structure, activity, enatioselectivity, and stability of the enzymes. Thus, it is utmost need of the researchers to have full understanding of these influences created by ionic liquids before choosing or developing an ionic liquid to serve as solvent media for enzymatic reaction or protein preservation. So, in the present review, we try to shed light on effects of ionic liquids chemistry on structure, stability, and activity of enzymes, which will be helpful for the researchers in various biocatalytic applications.",Mu Naushad and Zied Abdullah ALOthman and Abbul Bashar Khan and Maroof Ali,237,10088663942678815842,,4,555-560,Elsevier,"Effect of ionic liquid on activity, stability, and structure of enzymes: a review",https://www.sciencedirect.com/science/article/pii/S014181301200236X,51,2012,/scholar?cites=10088663942678815842,ggyoQ3UAAAAJ:f13iAvnbnnYC
9003,This study seeks to examine the relationship between rewards and employee performance as well as to identify the relationship between extrinsic and intrinsic rewards. The study explored factors determining extrinsic and intrinsic rewards and their impact on employee performance and actions to influence the commercial banks for a consideration of a more systematic and structured approach to acknowledge employee’s efforts which would in turn prosper high performance culture in commercial banks of Bangladesh. Descriptive statistics based frequency tables and graphs were used in the study to provide information on demographic variables. The results are investigated in terms of descriptive statistics followed by inferential statistics on the variables. A total of 200 questionnaires were distributed to employees of the commercial bank and a total of 180 employees completed the questionnaire properly. The result indicate that there is a statistical significant relationship between all of the independent variables with dependent variables employee work performance and all the independent variables have a positive influence on employee work performance.,Serena Aktar and Muhammad Kamruzzaman Sachu and Md Emran Ali,222,9800011650648670028,IOSR Journal of Business and Management,2,9-15,,The impact of rewards on employee performance in commercial banks of Bangladesh: an empirical study,https://pdfs.semanticscholar.org/50b1/b9b6ec885144386a27f7063d6971471f2422.pdf,6,2012,/scholar?cites=9800011650648670028,ggyoQ3UAAAAJ:dfsIfKJdRG4C
9004,"Polymer/fullerene solar cells are printed on paper using a combination of gravure and flexographic printing techniques. The printed paper photovoltaic cells are free from expensive electrodes made with indium–tin oxide, silver, or gold. Oxidized zinc film is used as the electron‐collecting layer.        ",Arved Hübler and Bystrik Trnovec and Tino Zillger and Moazzam Ali and Nora Wetzold and Markus Mingebach and Alexander Wagenpfahl and Carsten Deibel and Vladimir Dyakonov,222,12021361661528310269,Advanced Energy Materials,6,1018-1022,WILEY‐VCH Verlag,Printed paper photovoltaic cells,https://onlinelibrary.wiley.com/doi/abs/10.1002/aenm.201100394,1,2011,/scholar?cites=12021361661528310269,ggyoQ3UAAAAJ:DIubQTN3OvUC
9005,"Since 1990, South Asia has experienced a resurgence of kala-azar (visceral leishmaniasis). To determine risk factors for kala-azar, we performed cross-sectional surveys over a 3-year period in a Bangladeshi community. By history, active case detection, and serologic screening, 155 of 2,356 residents had kala-azar with onset from 2000 to 2003. Risk was highest for persons 3–45 years of age, and no significant difference by sex was seen. In age-adjusted multivariable models, 3 factors were identified: proximity to a previous kala-azar patient (odds ratio [OR] 25.4, 95% confidence interval [CI] 15–44 within household; OR 3.2 95% CI 1.7–6.1 within 50 m), bed net use in summer (OR 0.7, 95% CI 0.53–0.93), and cattle per 1,000 m 2 (OR 0.8, 95% CI 0.70–0.94]). No difference was seen by income, education, or occupation; land ownership or other assets; housing materials and condition; or keeping goats or chickens …",Caryn Bern and Allen W Hightower and Rajib Chowdhury and Mustakim Ali and Josef Amann and Yukiko Wagatsuma and Rashidul Haque and Katie Kurkjian and Louise E Vaz and Moarrita Begum and Tangin Akter and Catherine B Cetre-Sossah and Indu B Ahluwalia and Ellen Dotson and W Evan Secor and Robert F Breiman and James H Maguire,211,12240551715294714204,Emerging infectious diseases,5,655,Centers for Disease Control and Prevention,Risk factors for kala-azar in Bangladesh,https://www.ncbi.nlm.nih.gov/pmc/articles/pmc3320384/,11,2005,/scholar?cites=12240551715294714204,ggyoQ3UAAAAJ:6Dd5luMImnEC
9006,"Of 57 male children, aged 5 months to 21/2 years with rotavirus diarrhœa, 28 were given oral therapy with sucrose electrolyte solution and 29 were given glucose electrolyte solution in a randomised double-blind trial. All were rehydrated and remained so on oral therapy alone. These patients were compared with 44 children, also with rotavirus, who were treated only with intravenous hydration. The oral therapy and intravenous therapy groups did not differ clinically in the rate of rehydration or the rate of purging. Vomiting did not prevent the giving of oral therapy during hospital admission. Bangladeshi children with rotavirus diarrhœa have a defect of carbohydrate digestion but this defect does not prevent the use of a sugar electrolyte solution for oral hydration.",DavidA Sack and Abu Eusof and MichaelH Merson and RobertE Black and AzadM AK Chowdhury and MD Akbar Ali and Sirajul Islam and KennethH Brown,207,10763734698046311658,The Lancet,8084,280-283,Elsevier,Oral hydration in rotavirus diarrhoea: a double blind comparison of sucrose with glucose electrolyte solution,https://www.sciencedirect.com/science/article/pii/S0140673678916872,312,1978,/scholar?cites=10763734698046311658,ggyoQ3UAAAAJ:GtqhT-R7ZnwC
9007,"Third generation biodiesel production from microalgae currently necessitates many stages, some of which are complex and energy consuming, cell disruption is such an example. Microalgal strains which are prime candidates for oil extraction normally possess a robust cell wall which prevents the release of intracellular products, and breaking them can be energy intensive. This study investigated several laboratory scale methods (solid and liquid shear, thermolysis, and microwave and laser treatments) to disrupt Nannochloropsis oculata cells with a view to monitor the treatment efficiency and induced damage traits. Bright field microscopy analysis was used to quantify the reduction of intact cells as a function of time, whilst measuring the treatment’s cumulative energy requirements. A figure of merit was defined to assess the relative energy consumption, taking into consideration the percentage disruption, energy …",Jonathan R McMillan and Ian A Watson and Mehmood Ali and Weaam Jaafar,178,610288278110301759,Applied energy,,128-134,Elsevier,"Evaluation and comparison of algal cell disruption methods: microwave, waterbath, blender, ultrasonic and laser treatment",https://www.sciencedirect.com/science/article/pii/S0306261912006605,103,2013,/scholar?cites=610288278110301759,ggyoQ3UAAAAJ:BAanoTsO0WEC
9008,"Walnut (Juglans regia L.) is extensively used in traditional systems of medicine for                 treatment of various ailments. It is described as an anticancer, tonic, blood                 purifier and detoxifier agent. The present study was undertaken to investigate                 modulatory effects of walnut extract on the toxicity of an anticancer drug,                 cyclophosphamide (CP) with special reference to protection against disruption of                 drug metabolizing and antioxidant enzymes. Plant extract+CP group animals                 showed restoration in the level of cytochrome P450 (CYP) content and in the                 activities of glutathione S-transferase (GST), glutathione peroxidase (GP) and                 catalase (CAT) in both liver and kidneys. But plant extract restored the activity of                 super oxide dismutase (SOD) and the level of reduced glutathione (GSH) in the                 kidneys only when compared with CP-treated …",R Haque and B Bin-Hafeez and S Parvez and S Pandey and I Sayeed and M Ali and S Raisuddin,169,10231612408370907103,Human & experimental toxicology,9,473-480,Sage Publications,Aqueous extract of walnut (Juglans regia L.) protects mice against cyclophosphamideinduced biochemical toxicity,https://journals.sagepub.com/doi/abs/10.1191/0960327103ht388oa,22,2003,/scholar?cites=10231612408370907103,ggyoQ3UAAAAJ:5bFWG3eDk9wC
9009,"Candida lusitaniae is an emerging human pathogen that, unlike other fungal pathogens, frequently develops resistance to the commonly used antifungal agent amphotericin B. Amphotericin B is a member of the polyene class of antifungal drugs, which impair fungal cell membrane integrity. Here we analyzed mechanisms contributing to amphotericin B resistance in C. lusitaniae. Sensitivity to polyenes in the related fungi Saccharomyces cerevisiae and Candida albicans requires the ergosterol biosynthetic gene ERG6. In an effort to understand the mechanisms contributing to amphotericin B resistance in C. lusitaniae, we isolated the ERG6 gene and created a C. lusitaniae erg6Δ strain. This mutant strain exhibited a growth defect, was resistant to amphotericin B, and was hypersensitive to other sterol inhibitors. Based on the similarities between the phenotypes of the erg6Δ mutant and clinical isolates of C. lusitaniae …",Laura Y Young and Christina M Hull and Joseph Heitman,147,443664565102368006,Antimicrobial agents and chemotherapy,9,2717-2724,American Society for Microbiology Journals,Disruption of ergosterol biosynthesis confers resistance to amphotericin B in Candida lusitaniae,https://aac.asm.org/content/47/9/2717.short,47,2003,/scholar?cites=443664565102368006,ggyoQ3UAAAAJ:epqYDVWIO7EC
9010,"The paper proposes an innovative probabilistic clustering concept for aggregate modeling of wind farms (WFs). The proposed technique determines the number of equivalent turbines that can be used to represent large WF during the year in system studies. Support vector clustering (SVC) technique is used to cluster wind turbines (WTs) based on WF layout and incoming wind. These clusters are then arranged into groups, and finally through analysis of wind at the site, equivalent number of WTs for WF representation is determined. The method is demonstrated on a WF consisting of 49 WTs connected to the grid through two transmission lines. Dynamic responses of the aggregate model of the WF are compared against responses of the full WF model for various wind scenarios.",Muhammad Ali and Irinel-Sorin Ilie and Jovica V Milanovic and Gianfranco Chicco,143,3165206384324530957,IEEE Transactions on Power Systems,1,309-316,IEEE,Wind farm model aggregation using probabilistic clustering,https://ieeexplore.ieee.org/abstract/document/6238339/,28,2012,/scholar?cites=3165206384324530957,ggyoQ3UAAAAJ:tzM49s52ZIMC
9011,"The present experimental investigation focuses on the passive cooling of electronic devices by using phase change material (PCM) based pin-fin heat sinks to increase reliability, to ensure sufficiently lower temperature, to stretch the operating duration and to improve the functionality of installed features. Paraffin wax is used as a PCM and filled in heat sinks made of aluminum. As the thermal conductivity of PCM is very low, aluminum square fins are used as thermal conductivity enhancer (TCE). A volume fraction of TCE is kept constant at 9% and the uniform heat flux is applied to finned and un-finned heat sinks. An un-finned heat sink is used for base line comparison. Fin thicknesses of TCE of 1 mm, 2 mm, and 3 mm with square cross sectional area are investigated with a constant height of 20 mm. Volume fractions of PCM are varied as 0.00, 0.33, 0.66 and 1.00 for each heat sink to determine the thermal …",Adeel Arshad and Hafiz Muhammad Ali and Muzaffar Ali and Shehryar Manzoor,136,13546961828780587511,Applied Thermal Engineering,,143-155,Pergamon,Thermal performance of phase change material (PCM) based pin-finned heat sinks for electronics devices: Effect of pin thickness and PCM volume fraction,https://www.sciencedirect.com/science/article/pii/S1359431116323894,112,2017,/scholar?cites=13546961828780587511,ggyoQ3UAAAAJ:7H_jS4BsgvYC
9012,"To determine the protective efficacy (PE) of three doses of oral B subunit-killed whole cell (BS-WC) or killed whole cell-only (WC) vaccines against cholera, a clinical trial was conducted among 62285 children over 2 years and adult women in rural Bangladesh. During 5 years of follow-up, there were 144 cases of cholera in the BS-WC group (PE=49%; P<0.001), 150 in the WC group (PE=47%; P<0.001), and 283 in the K12 group. Protection by each vaccine was evident only during the first three years of follow-up; long-term protection of young children was observed only against classical but not El Tor cholera; 3-year protection against both cholera biotypes occurred among older persons, but at a higher level against classical cholera.",FPL Van Loon and JD Clemens and J Chakraborty and MR Rao and BA Kay and David Allen Sack and Md Yunus and Md Ali and AM Svennerholm and J Holmgren,134,187784566950258461,Vaccine,2,162-166,Elsevier,Field trial of inactivated oral cholera vaccines in Bangladesh: results from 5 years of follow-up,https://www.sciencedirect.com/science/article/pii/0264410X9500122H,14,1996,/scholar?cites=187784566950258461,ggyoQ3UAAAAJ:LWqeokA2EBkC
9013,"Based on case studies of six small exporting Pakistani enterprises, this preliminary study considers the relevance of models of internationalization to small scale enterprises from developing economies. The results show little support for most existing models, although the importance of contacts and connections in all aspects of internationalization is supportive of network theory. The stability of exporting relationships involving agents/wholesalers/importers is linked to the production orientation of the enterprises. Policy implications concern the need for greater marketing awareness and training in small firms; and for improved links with overseas distributors and with ethnic Pakistani communities abroad.",Mohammad Zafarullah and Mujahid Ali and Stephen Young,133,10173328988033401705,Journal of Global Marketing,3,21-40,Taylor & Francis Group,The internationalization of the small firm in developing countries—exploratory research from Pakistan,https://www.tandfonline.com/doi/abs/10.1300/J042v11n03_03,11,1997,/scholar?cites=10173328988033401705,ggyoQ3UAAAAJ:w0F2JDEymm0C
9014,"Maize silage has become the major forage component in the ration of dairy cows over the last few decades. This review provides information on the mean content and variability in chemical composition, fatty acid (FA) profile and ensiling quality of maize silages, and discusses the major factors which cause these variations. In addition, the effect of the broad range in chemical composition of maize silages on the total tract digestibility of dietary nutrients, milk production and milk composition of dairy cows is quantified and discussed. Finally, the optimum inclusion level of maize silage in the ration of dairy cows for milk production and composition is reviewed. The data showed that the nutritive value of maize silages is highly variable and that most of this variation is caused by large differences in maturity at harvest. Maize silages ensiled at a very early stage (dry matter (DM) < 250 g kg−1) were particularly low in starch …",Nazir A Khan and Peiqiang Yu and Mubarak Ali and John W Cone and Wouter H Hendriks,127,11494465098010663976,Journal of the Science of Food and Agriculture,2,238-252,"John Wiley & Sons, Ltd",Nutritive value of maize silage in relation to dairy cow performance and milk quality,https://onlinelibrary.wiley.com/doi/abs/10.1002/jsfa.6703,95,2015,/scholar?cites=11494465098010663976,ggyoQ3UAAAAJ:45AZ0Vt6gvEC
9015,Off-grid electricity generation using renewable energy technologies has become a more reliable source to fulfill the needs of rural areas at limited level without considering conventional resources. The main purpose of this study was to propose an economical and optimized design for electricity generation using hybrid energy source PV/Biomass for an agricultural farm and a residential community centered in a small village of district Layyah in the Punjab province of Pakistan. The electric load data was collected for the irrigation and residential needs. Hybrid Optimization Model for Electric Renewable (HOMER) was used to design and perform techno-economic analysis to meet the load requirements using PV/biomass hybrid configuration. The solar irradiance data and the available biomass potential on the farm was used in the HOMER software to perform the analysis. Total net present cost (NPC) and cost of …,M Kashif Shahzad and Adeem Zahid and Tanzeel ur Rashid and Mirza Abdullah Rehan and Muzaffar Ali and Mueen Ahmad,125,5334599333087343129,Renewable energy,,264-273,Pergamon,Techno-economic feasibility analysis of a solar-biomass off grid system for the electrification of remote rural areas in Pakistan using HOMER software,https://www.sciencedirect.com/science/article/pii/S0960148117300411,106,2017,/scholar?cites=5334599333087343129,ggyoQ3UAAAAJ:nPTYJWkExTIC
9016,"In this, Part II of a two-part study, the oxidation kinetics in air of the ternary compounds and are reported. For the first two compounds, in the 1000-1100 C temperature range and for short times (≈ 20 h) the oxidation kinetics are parabolic. The parabolic rate constants are for and for At 900 C, the kinetics are quasi-linear, and up to 100 h the outermost layers that form are almost pure rutile, dense, and protective. For the second pair, at short times (< 10 h) the oxidation kinetics are parabolic at all temperatures examined (800-1100 C), but become linear at longer times. The values are for and for In all cases, the scales that form are comprised mainly of a rutile-based solid solution, where and some The oxidation occurs by the inward diffusion of oxygen and the outward diffusion of Al and Ti. The C and N atoms are presumed to also diffuse outward through the oxide layer. At the low oxygen partial pressure side, the ions …",MW Barsoum and N Tzenov and A Procopio and T El-Raghy and M Ali,125,14634752608875526,Journal of The Electrochemical Society,8,C551,IOP Publishing,"Oxidation of Ti n+ 1AlX n (n= 1 3 and X= C, N): II. Experimental Results",https://iopscience.iop.org/article/10.1149/1.1380256/meta,148,2001,/scholar?cites=14634752608875526,ggyoQ3UAAAAJ:8EvVLpklxGMC
9017,"We examined the epidemiology of kala-azar and asymptomatic leishmanial infection measured by serologic and leishmanin skin test results in a Bangladeshi community. In a subset, we measured serum retinol, zinc and C-reactive protein (CRP). Kala-azar and seroconversion incidence were 15.6 and 63.1 per 1,000 person-years, respectively. Proximity to a previous kala-azar case increased the likelihood of both kala-azar and asymptomatic infection. Bed net use protected against kala-azar (rate ratio = 0.35, P < 0.01), but not subclinical infection (rate ratio = 1.1, P = 0.82). Kala-azar patients were younger (P < 0.001) and reported lower red meat consumption (P < 0.01) than asymptomatic seropositive individuals. Retinol and zinc levels were lower in current kala-azar patients and those who later developed kala-azar compared with uninfected and asymptomatically infected subjects. The CRP levels were higher in …",Caryn Bern and Rashidul Haque and Rajib Chowdhury and Mustakim Ali and Katie M Kurkjian and Louise Vaz and Josef Amann and MA Wahed and Yukiko Wagatsuma and Robert F Breiman and John Williamson and W Evan Secor and James H Maguire,115,8828409043093899979,The American journal of tropical medicine and hygiene,5,909-914,The American Society of Tropical Medicine and Hygiene,The epidemiology of visceral leishmaniasis and asymptomatic leishmanial infection in a highly endemic Bangladeshi village,https://www.ajtmh.org/content/journals/10.4269/ajtmh.2007.76.909,76,2007,/scholar?cites=8828409043093899979,ggyoQ3UAAAAJ:ZnWe2zbntUIC
9018,"Ingestion of button batteries has been seen with increasing frequency over the past decade1,2. In a small number of reported cases, their impaction in the esophagus has led to serious, sometimes fatal, complications. The management of these cases has varied from expectant, supportive therapy to early surgical intervention. The authors report 2 pediatric patients in whom esophageal perforation developed after impaction of a disc battery. Both were treated conservatively with successful outcomes.",Lubna Samad and Mohsin Ali and Hasan Ramzi,114,12138599021324949367,Journal of pediatric surgery,10,1527-1531,WB Saunders,Button battery ingestion: hazards of esophageal impaction,https://www.sciencedirect.com/science/article/pii/S0022346899901197,34,1999,/scholar?cites=12138599021324949367,ggyoQ3UAAAAJ:q-HalDI95KYC
9019,"Visceral leishmaniasis, or kala azar (KA), affects the rural poor, causing significant morbidity and mortality. We examined the epidemiologic, social, and economic impact of KA in a village in Bangladesh. A population-based survey among 2,348 people demonstrated a KA incidence of 2% per year from 2000 to 2002, with a case-fatality rate of 19% among adult women, compared with 6–8% among other demographic groups. Kala azar cases were geographically clustered in certain sections of the village. Anti-leishmanial drug shortages and the high cost of diagnosis and treatment caused substantial emotional and economic hardship for affected families. Communities wanted to learn more about KA, and were willing to take collective action to confront the problems it causes. To decrease the KA burden in endemic areas, community efforts should be supplemented with effective treatment programs to ensure access …",Indu B Ahluwalia and Caryn Bern and Cristiane Costa and Tangin Akter and Rajib Chowdhury and Mustakim Ali and Didarul Alam and Eben Kenah and Josef Amann and Meghla Islam and Yukiko Wagatsuma and Rashidul Haque and Robert F Breiman and James H Maguire,112,11853022149335187249,The American journal of tropical medicine and hygiene,6,624-628,The American Society of Tropical Medicine and Hygiene,Visceral leishmaniasis: consequences of a neglected disease in a Bangladeshi community,https://www.ajtmh.org/content/journals/10.4269/ajtmh.2003.69.624,69,2003,/scholar?cites=11853022149335187249,ggyoQ3UAAAAJ:_V0JUKP8578C
