id,abstract,author,cites,cites_id,journal,number,pages,publisher,title,url,volume,year,citation_link,id_citations
9080,"An outdoor experimental study was carried out to investigate and compare the performance of three commercially available photovoltaic modules (monocrystalline, polycrystalline and single junction amorphous silicon) under the weather of Pakistan for the month of January. Power output efficiency, module efficiency, and performance ratio are calculated for each module and comparison is presented. Results have shown that mono-crystalline and polycrystalline modules perform better at high irradiance and show poor performance in low irradiance conditions. Amorphous solar module has shown better light absorption characteristic and performs better in low irradiance ie in cloudy and diffuse sunshine conditions. Monocrystalline photovoltaic module is found to be more efficient, having module efficiency of 13.5% which is higher than the other two modules. Furthermore the power output of mono-crystalline and poly-crystalline modules has shown a higher decrement at higher module temperatures compared to the amorphous solar module. Because of better performance in low solar irradiance, amorphous solar module has shown monthly average performance ratio of 1.07 which is higher than other photovoltaic modules under study.",Muhammad Anser Bashir and Hafiz Muhammad Ali and Muzaffar Ali and Aysha Maryam Siddiqui,47,4395397604625886830,Thermal Science,Suppl 2,S525-S534,,An experimental investigation of performance of photovoltaic modules in Pakistan,http://www.doiserbia.nb.rs/img/doi/0354-9836/2013%20OnLine-First/0354-98361300134B.pdf,19,2015,/scholar?cites=4395397604625886830,ggyoQ3UAAAAJ:wUn16MOA3RoC
9081,"In recent years, the commercial potential of oil extraction and biodiesel production derived from vegetable seed is being realized. The process energy input requirements are important factors in oil extraction and biodiesel production. This research work investigated oil extraction from flax seeds and compared extraction yield with the energy load. The effect of moisture content on the oil yield was compared between a mechanical oil expeller, organic solvent extraction, organic solvent and microwave assisted, organic solvent and ultrasonic assisted, and combined microwave and ultrasonic with organic solvent. The maximum oil yields % wt/wt from these techniques was 22.6%, 36.3%, 10.0%, 42.0% and 27.8%, respectively. The moisture content had a significant effect on oil yield with the mechanical oil expeller, organic solvent method and ultrasonic assisted extraction, whereas no or little effect was found on …",Mehmood Ali and Ian A Watson,47,11926320916801113911,International journal of energy research,5,614-625,,"Comparison of oil extraction methods, energy analysis and biodiesel production from flax seeds",https://onlinelibrary.wiley.com/doi/abs/10.1002/er.3066,38,2014,/scholar?cites=11926320916801113911,ggyoQ3UAAAAJ:txeM2kYbVNMC
9082,"Light Emitting Diodes (LEDs) with their current performances have been proved to be the most suitable solution for street lighting applications. Nowadays, a topic of interest in this context is the design for electronic driver in order to take the advantage of LEDs performances. However, requirements such as high power factor, long life time, accurate current control and high efficiency pose challenges to the design of LED driver circuits. Single-stage power factor correction (PFC) topologies are preferred here for their advantages of lower cost and near unity power factor, while adding a separated PFC stage will surely increase the cost. This paper presents a high efficiency single-stage LED lamp driver for street lighting applications based on SEPIC PFC converter topology operating in continuous conduction mode (CCM). This converter has achieved high efficiency and high power factor all over the operating range …",Mokhtar Ali and Mohamed Orabi and Mahrous E Ahmed and Abdelali El-Aroudi,47,16779930439334424619,,,501-506,IEEE,A single stage SEPIC PFC converter for LED street lighting applications,https://ieeexplore.ieee.org/abstract/document/5697634/,,2010,/scholar?cites=16779930439334424619,ggyoQ3UAAAAJ:AkQCnCHIR28C
9083,Splitting of ammonium nitrate to nitric acid and ammonia was achieved by a coupled process including bipolar membrane electrodialysis and in situ ammonia stripping. The effect of homopolar ion-exchange membranes on current efficiency led to the selection of AW (Solvay) and CMB (Tokuyama Soda) membranes. The main parameters influencing the current efficiency were acid and ammonia concentrations. Proton leakage through the anion-exchange membrane is proportional to acid concentration. Ammonia diffuses through the membranes independently of the current. Higher current efficiency was obtained at higher current density. Batch and continuous processing were compared.,MA Ben Ali and M Rakib and Sébastien Laborie and Ph Viers and G Durand,47,779517136884596962,Journal of membrane science,1-2,89-96,Elsevier,Coupling of bipolar membrane electrodialysis and ammonia stripping for direct treatment of wastewaters containing ammonium nitrate,https://www.sciencedirect.com/science/article/pii/S0376738804005046,244,2004,/scholar?cites=779517136884596962,ggyoQ3UAAAAJ:qbqt7gslDFUC
9084,"View materialization is an important technique for high performance query processing, data integration and replication. Solutions to the problem of incrementally maintaining materialized views are very relevant. So far, most work on this problem has been confined to relational settings and solutions have not been comprehensively evaluated. This paper describes MOVIE, a complete, implemented and evaluated solution to the problem of incrementally maintaining materialized OQL views in ODMG-compliant object databases. The evaluation throws light into how the effectiveness of incremental maintenance is affected by issues such as database size, and the complexity and selectivity of views.",M Akhtar Ali and Alvaro AA Fernandes and Norman W Paton,47,10355569479576708638,Data & Knowledge Engineering,2,131-166,North-Holland,MOVIE: An incremental maintenance system for materialized object views,https://www.sciencedirect.com/science/article/pii/S0169023X0300048X,47,2003,/scholar?cites=10355569479576708638,ggyoQ3UAAAAJ:k8Z6L05lTy4C
9085,"Zeolitic imidazole frameworks (ZIFs), a subclass of metal organic frameworks (MOFs), are composed of metal ions linked by organic ligands which offer an exceptionally high surface area and appealing separation potential. In this study, mixed matrix membranes (MMMs) were prepared using polydimethylsiloxane (PDMS) as a hydrophobic polymer and ZIF-67 as inorganic filler particle. ZIF-67 particles and MMMs were characterized by XRD, SEM, FTIR, BET and contact angle measurements. The prepared membranes were tested for the separation of ethanol/water mixtures via pervaporation. Compared to unfilled PDMS membranes, MMMs loaded with 20 wt% ZIF-67 showed an increase in flux and a doubled separation factor. The easy synthesis of ZIF-67 and its enhanced separation performance make ZIF-67 an attractive candidate to prepare MMMs for a variety of membrane applications.",Amin Khan and Mohsin Ali and Ayesha Ilyas and Parimal Naik and Ivo FJ Vankelecom and Mazhar Amjad Gilani and Muhammad Roil Bilad and Zabia Sajjad and Asim Laeeq Khan,46,4980166640027906250,Separation and Purification Technology,,50-58,Elsevier,ZIF-67 filled PDMS mixed matrix membranes for recovery of ethanol via pervaporation,https://www.sciencedirect.com/science/article/pii/S1383586618313947,206,2018,/scholar?cites=4980166640027906250,ggyoQ3UAAAAJ:T_ojBgVMvoEC
9086,"Crimes remained always a major problem for society. Crimes violate sacred customs, laws and values. Criminal acts of young people are called juvenile delinquency. Sometimes the term Delinquency is also used to refer to conduct that is antisocial but not against the law. However, it usually describes activities that would be considered crimes if committed by an adult. This excludes “status offenses,” or actions that become legal matters only if conducted by children, before the establishment of juvenile courts, children under the age of seven were never held responsible for criminal acts. The law considered them incapable of forming the necessary criminal intent. Children between the ages of 7 and 14 were generally thought to be incapable of committing a criminal act, but this belief could be disproved by showing that the youth knew the act was a crime or would cause harm to another and committed it anyway …",Muhammad Nisar and Shakir Ullah and Madad Ali and Sadiq Alam,46,2855535868025642713,Applied Science Reports,1,37-48,,"Juvenile delinquency: The Influence of family, peer and economic factors on juvenile delinquents",http://scholar.google.com/scholar?cluster=2855535868025642713&hl=en&oi=scholarr,9,2015,/scholar?cites=2855535868025642713,ggyoQ3UAAAAJ:BFeJNCPbDVwC
9087,"Annual leishmanin skin test (LST) surveys were conducted in a visceral leishmaniasis-endemic Bangladeshi community from 2002 through 2004, using Leishmania infantum antigen from the same manufacturer and batch. In 2002, 530 (35%) of 1,532 had positive LST results; the prevalence increased with increasing age. The LST result was positive in 24 (51%) of 47, 18 (72%) of 25, and 11 (85%) of 13 kala-azar patients treated in the previous 1–11, 12–23, and 24–35 months. A positive LST result in 2002 was associated with protection against subsequent kala-azar (P < 0.0001). In 2003–2004, decreased antigen sensitivity was observed. Among 686 participants, 34% were LST-positive in 2002, 29% in 2003, and 19% in 2004. Of 63 cured kala-azar patients, 70% were positive in 2002, 53% in 2003, and only 30% in 2004. Among 171 participants tested with both antigens, L. infantum study antigen sensitivity was …",Caryn Bern and Josef Amann and Rashidul Haque and Rajib Chowdhury and Mustakim Ali and Katie M Kurkjian and Louise Vaz and Yukiko Wagatsuma and Robert F Breiman and W Evan Secor and James H Maguire,46,9421055556508863964,The American journal of tropical medicine and hygiene,4,744-748,The American Society of Tropical Medicine and Hygiene,Loss of leishmanin skin test antigen sensitivity and potency in a longitudinal study of visceral leishmaniasis in Bangladesh,https://www.ajtmh.org/content/journals/10.4269/ajtmh.2006.75.744,75,2006,/scholar?cites=9421055556508863964,ggyoQ3UAAAAJ:tDdgxD0hSQMC
9088,"Objective:To determine within-rater and between-rater reliability of the universal goniometer (UG) for measuring active cervical range of motion (ACROM) in asymptomatic healthy subjects.Methods:Nineteen healthy subjects were tested in an identical seated position. Two raters used UG to measure active cervical movements of flexion, extension, right side flexion, left side flexion, right rotation and left rotation. Each motion was measured twice by each of the two raters and was re-measured all over again after one week. Data analysis was performed using the intraclass correlation coefficient (ICC).Results:The results demonstrated excellent within-session (ICC2, 1= 0.83 to 0.98) and between-session (ICC2, 2= 0.79 to 0.97) intra-rater reliability and excellent inter-rater reliability (ICC2, 2= 0.79 to 0.92).Conclusion:Considering above results it is concluded that UG is a reliable tool for assessing ACROM in a clinical …",Muhammad Nazim Farooq and Mohammad A Mohseni Bandpei and Mudassar Ali and Ghazanfar Ali Khan,45,6399718979420512850,Pakistan journal of medical sciences,2,457,Professional Medical Publications,Reliability of the universal goniometer for assessing active cervical range of motion in asymptomatic healthy persons,https://www.ncbi.nlm.nih.gov/pmc/articles/PMC4859044/,32,2016,/scholar?cites=6399718979420512850,ggyoQ3UAAAAJ:yGgOC45Jz5YC
9089,"Oil extraction from date palm seeds (Iraqi date palm) is done by standard solvent extraction method using a Soxhlet apparatus. This work is aiming to investigate the extraction of palm seed oil as a cheap feedstock for producing bio-oil and determine the fatty acid composition of bio-oil. Parameters such as particle size, extraction time and type of solvent are optimized in order to enhance the yield of bio oil production. The bio-oil is characterized using Fourier Transform Infrared Spectroscopy (FT-IR) and Gas Chromatography Mass Spectrometry. Some of the basic fuel properties such as iodine value, saponification value, acid value, density, refractive index and kinematic viscosity are investigated to characterize fuel quality of the bio-oil. The extraction process was carried out on a laboratory scale with particle size 2mm, 1mm and 0.425 mm for different time 1h, 2h, 4h and 6h. Particle size of 2 mm was chosen in order to study the effect of solvent type. The optimal conditions to obtain the highest oil yield of 8.5%(w/w) were 120 min, 0.425 mm and n-hexane extracted time, particle size of grounded seed and type of solvent, respectively. The physical properties viscosity, density and refractive index were 29 CP, 0.925 g/cm2 and 1.444 respectively.",Mortadha A Ali and Tahseen A Al-Hattab and Imad A Al-Hydary,45,11980736336715656888,International Journal of Advances in Engineering & Technology,3,261,IAET Publishing Company,Extraction of date palm seed oil (Phoenix dactylifera) by Soxhlet apparatus,https://www.researchgate.net/profile/Majid_Ibrahim2/post/Can_someone_help_with_protocols_that_will_help_to_determine_the_purity_of_Oil_Palm_Seedling/attachment/59d64fa079197b80779a8b80/AS%3A498768952950784%401495927193400/download/3I27-IJAET0827749-v8-iss3-261-271.pdf,8,2015,/scholar?cites=11980736336715656888,ggyoQ3UAAAAJ:8p-ueveQw4wC
9090,"In this work, an array of molecular-level solvent featuresincluding solute−solvent/solvent−solvent interactions, dipolarity, heterogeneity, dynamics, probe accessibility, and diffusionwere investigated across the entire composition of ambient mixtures containing the ionic liquid 1-butyl-3-methylimidazolium tetrafluoroborate, [bmim][BF4], and pH 7.0 phosphate buffer, based on results assembled for nine different molecular probes utilized in a range of spectroscopic modes. These studies uncovered interesting and unusual solvatochromic probe behavior within this benchmark mixture. Solvatochromic absorbance probesa water-soluble betaine dye (betaine dye 33), N,N-diethyl-4-nitroaniline, and 4-nitroanilinewere employed to determine ET (a blend of dipolarity/polarizability and hydrogen bond donor contributions) and the Kamlet−Taft indices π* (dipolarity/polarizability), α (hydrogen bond donor acidity), and β …",Abhra Sarkar and Maroof Ali and Gary A Baker and Sergey Y Tetin and Qiaoqiao Ruan and Siddharth Pandey,45,14786648429232657649,The Journal of Physical Chemistry B,10,3088-3098,American Chemical Society,Multiprobe spectroscopic investigation of molecular-level behavior within aqueous 1-butyl-3-methylimidazolium tetrafluoroborate,https://pubs.acs.org/doi/abs/10.1021/jp8098297,113,2009,/scholar?cites=14786648429232657649,ggyoQ3UAAAAJ:peNFRSk4lDYC
9091,"The effect of elevated temperature on the antioxidants in the freshwater fish Channa punctata was investigated. Fish stressed with an elevated temperature of 12° C, range ± 1° C over the ambient temperature for 3 h showed a significant (P < 0·05–0·01) reduction in the levels of antioxidants: reduced glutathione (GSH) and non‐protein thiols. Activity of glutathione reductase was also reduced in all the tissues (liver, kidney and gills) after 3 h of heat stress and 24 h recovery. Catalase (CAT) showed enhanced activity in liver in both the conditions while gills and kidney showed a decreased CAT activity. Glutathione S‐transferase (GST) activity in kidney and liver decreased significantly (P < 0·05–0·01) after 3 h of heat stress. At 24 h GST activity showed a tendency to normalize in all the tissues along with a concomitant increase in the GSH level in the kidney. Total and protein thiols in heat stressed fish …",M Kaur and F Atif and M Ali and H Rehman and S Raisuddin,45,6703484842644015526,Journal of fish biology,6,1653-1665,Blackwell Publishing Ltd/Inc.,Heat stress‐induced alterations of antioxidants in the freshwater fish Channa punctata Bloch,https://onlinelibrary.wiley.com/doi/abs/10.1111/j.1095-8649.2005.00872.x,67,2005,/scholar?cites=6703484842644015526,ggyoQ3UAAAAJ:6DzZfY3qH5gC
9092,"A novel naphthanol glycoside, arjunaphthanoloside (1), was isolated from the stem bark of Terminalia arjuna and its structure was established as 2, 3, 6, 7, 8, 9-hexahydroxynaphthalene-2-O-alpha-L (-)-rhamnoside by means of spectroscopic and chemical methods. Compound 1 showed potent antioxidant activity and inhibited nitric oxide (NO) production in lipopolysaccharide (LPS)-stimulated rat peritoneal macrophages.",A Ali and G Kaur and K Hayat and M Ali and M Ather,45,12874162974685812284,Die Pharmazie,12,932-934,,A novel naphthanol glycoside from Terminalia arjuna with antioxidant and nitric oxide inhibitory activities.,https://europepmc.org/article/med/14703977,58,2003,/scholar?cites=12874162974685812284,ggyoQ3UAAAAJ:NMlhSUseqAsC
9093,"The air borne dust deposited on the surface of photovoltaic module influence the transmittance of solar radiations from the photovoltaic modules glazing surface. This experimental work aimed to investigate the effect of dust deposited on the surface of two different types of photovoltaic modules (monocrystalline silicon and polycrystalline silicon). Two modules of each type were used and one module from each pair was left exposed to natural atmosphere for three months of winter in Taxila, Pakistan. Systematic series of measurements were conducted for the time period of three months corresponding to the different dust densities. The difference between the output parameters of clean and dirty modules provided the information of percentage loss at different dust densities. The dust density deposited on the modules surface was 0.9867 mg/cm2 at the end of the study. The results showed that dust deposition has strong impact on the performance of photovoltaic modules. The monocrystalline and polycrystalline modules showed about 20% and 16% decrease of average output power, respectively, compared to the clean modules of same type. It was found that the reduction of module efficiency (ηclean – ηdirtv) in case of monocrystalline and polycrystalline module was 3.55% and 3.01%, respectively. Moreover the loss of output power and module efficiency in monocrystalline module was more compared to the polycrystalline module.",Hafiz Muhammad Ali and Muhammad Abdullah Zafar and Muhammad Anser Bashir and Muhammad Ali Nasir and Muzaffar Ali and Aysha Maryam Siddiqui,44,8372688291378625553,Thermal Science,2,915-923,,"Effect of dust deposition on the performance of photovoltaic modules in Taxila, Pakistan",http://www.doiserbia.nb.rs/Article.aspx?ID=0354-98361500046A,21,2017,/scholar?cites=8372688291378625553,ggyoQ3UAAAAJ:PQEM9vzQD9gC
9094,"A simple relation of chemical processes for three-dimensional flow of a cross magnetofluid over bidirectional stretched surface is constructed. The impact of convective heat transport in the manifestation of non-linear thermal radiation and features of heat source–sink are also considered for heat transfer mechanism. Furthermore, in this research paper, the innovative relation between heterogeneous and homogeneous responses with equivalent diffusivities for reactant and autocatalysis is exploited. Apposite alterations are guaranteed to obtain ordinary differential equations (ODEs) with high nonlinearity. Numerically, the bvp4c technique is exploited to the interpret the structure of ODEs. Portrayals of temperature and concentration for cross liquid equivalent to abundant somatic parameters are presented graphically as well as in tabular form. Our results reveal that the temperature of the cross fluid decreases …",WA Khan and M Ali and F Sultan and M Shahzad and M Khan and M Irfan,43,5264359716624805903,Pramana,2,16,Springer India,Numerical interpretation of autocatalysis chemical reaction for nonlinear radiative 3D flow of cross magnetofluid,https://link.springer.com/content/pdf/10.1007/s12043-018-1678-y.pdf,92,2019,/scholar?cites=5264359716624805903,ggyoQ3UAAAAJ:LXmCCkuhhTsC
9095,"Today, all count words are about how to enhance the electrical grid reliability during the peak instant. The direct solution for the grid is to cut off some loads to keep its stability. One of these loads is the street lighting especially during the summer period. This paper proposes an energy-free system for street lighting as there is no power demand from the grid. A standalone solar street LED light system is proposed. The proposed system consists of a PV panel, storage system, LED lamp, power conditioning system (PCS) and the controller which can manage the power direction and system operation. Using LED in lighting applications has many advantages compared to other lamp. It is very efficient (very high efficiency lighting source) lamps and cost effective (the life time is very long compare to other lamps). In additions to, it needs low dc voltage source to be operated. The storage system will be charged during the …",Mokhtar Ali and Mohamed Orabi and Emad Abdelkarim and Jaber A Abu Qahouq and Abdelali El Aroudi,43,4745333863386555076,,,1-7,IEEE,Design and development of energy-free solar street LED light system,https://ieeexplore.ieee.org/abstract/document/6220812/,,2011,/scholar?cites=4745333863386555076,ggyoQ3UAAAAJ:UlRcoTO8nVoC
9096,"The present study is aimed at assessing the ability of Corynebacterium sp. to decolorize and degrade dyes into non-toxic form. Corynebacterium sp. could tolerate Reactive Black5 and Yellow15 up to 10 mg/ml. The maximum growth of bacterium was observed at 37ºC and at pH 7. Corynebacterium sp. showed high azoreductase activity against Reactive Black5 (68%) and Reactive Yellow15 (80%). Corynebacterium sp. could decolourize 60%(Reactive Black5) and 76%(Reactive Yellow15) from the medium containing 100 µg/ml after 2 and 4 days, respectively. The additional bands in TLC chromatograms after decolourization of the dyes showed that the dyes were degraded by the bacterium when compared with the undecolourized dyes. The presence of extra bands in TLC in decolourized samples indicates the ability of the bacterium to degrade dyes enzymatically and can be exploited for bioremediation of azo …",Usman Aftab and Muhammad Riaz Khan and Muhammad Mahfooz and Musadiq Ali and Salik Hassan Aslam and A Rehman,43,3883996189541141445,Pakistan Journal of Zoology,1,,AsiaNet Pakistan (Pvt) Ltd.,Decolourization and degradation of textile azo dyes by Corynebacterium sp. isolated from industrial effluent,http://www.zsp.com.pk/1-8%20(1)%20PJZ-370-10.pdf,43,2011,/scholar?cites=3883996189541141445,ggyoQ3UAAAAJ:uH1VZYVfkoQC
9097,"Limitations of the properties of water, the most common ‘green’ solvent, may be overcome by adding small amounts of ionic liquids (ILs). Important physical properties, such as density, viscosity and refractive index, of dilute aqueous IL 1-butyl-3-methylimidazolium hexafluorophosphate (bmimPF6) are shown to be significantly different than those of pure water at different temperatures. Up to 2.00 wt% bmimPF6 behaves like a strong electrolyte in water. Solvatochromic absorbance probe investigation indicates sensitive spectral behavior of a water-soluble betaine dye upon bmimPF6 addition to water. With considerably modified physicochemical properties, dilute aqueous IL solutions may find use in a variety of chemical applications.",Maroof Ali and Abhra Sarkar and Mohammad Tariq and Anwar Ali and Siddharth Pandey,43,6284970139408668681,Green Chemistry,11,1252-1258,Royal Society of Chemistry,Dilute aqueous 1-butyl-3-methylimidazolium hexafluorophosphate: properties and solvatochromic probe behavior,https://pubs.rsc.org/en/content/articlehtml/2007/gc/b704843b,9,2007,/scholar?cites=6284970139408668681,ggyoQ3UAAAAJ:3jqAvCjcdfEC
