id,abstract,author,cites,cites_id,journal,number,pages,publisher,title,url,volume,year,citation_link,id_citations
9208,"Zika virus is one of the emerging viruses and is of significant threat to human health globally. It is a mosquito borne flavivirus similar to dengue, yellow fever, and West Nile viruses. It was reported about 5 decades ago and then it spreads to different parts of the world. Large outbreaks were reported on Yap Islands in 2007. Now it has gained wide attention globally by health communities. Major vector for virus transmission is Aedes aegypti mosquito. ZIKV infection is mostly asymptomatic but it is also responsible to cause mild influenza like illness to serious manifestations. There is no specific anti‐viral treatment is available for ZIKV infection. The virus disseminates very fast due to which it possesses a serious threat especially in those areas where there is lack of specific immunity against virus. Little knowledge is available on its transmission and pathogenicity. Although virus was discovered years ago but its genomic …",Farakh Javed and Khanzadi N Manzoor and Mubashar Ali and Irshad U Haq and Abid A Khan and Assad Zaib and Sobia Manzoor,27,12544337504751917660,Journal of basic microbiology,1,3-16,,Zika virus: what we need to know?,https://onlinelibrary.wiley.com/doi/abs/10.1002/jobm.201700398,58,2018,/scholar?cites=12544337504751917660,ggyoQ3UAAAAJ:cBPnxVikjH8C
9209,"Fanger’s heat balance model led to the formulation of the predicted mean vote (PMV) and predicted percentage dissatisfied (PPD) for rating thermal comfort in buildings. The authenticity of PMV/PPD model has been questioned by several studies, thus opening the debate for revisiting the main parameters in PMV thermal comfort model. In this experimental study, a correlation between biomarker ‘mean blood pressure (MAP)’ and the ‘activity level’, was developed to improve the thermal prediction of PMV model. This study revealed a strong correlation between mean blood pressure and the activity level with a confidence level of 96%. Field assessments of PMV model were conducted in air conditioned as well as naturally ventilated buildings to analyze the effect of mean blood pressure on the PMV model. In air-conditioned buildings, PMV model overestimated the thermal sensation up to 54% as compared to actual …",Syed Ihtsham-ul-Haq Gilani and Muhammad Hammad Khan and Muzaffar Ali,27,5100120279815243771,Applied thermal engineering,,35-43,Pergamon,Revisiting Fanger’s thermal comfort model using mean blood pressure as a bio-marker: An experimental investigation,https://www.sciencedirect.com/science/article/pii/S1359431116313965,109,2016,/scholar?cites=5100120279815243771,ggyoQ3UAAAAJ:4Yq6kJLCcecC
9210,"This study was meant to determine environmental aspects of hospital waste management scenarios using a life cycle analysis approach. The survey for this study was conducted at the largest hospital in a major city of Pakistan. The hospital was thoroughly analyzed from November 2014 to January 2015 to quantify its wastes by category. The functional unit of the study was selected as 1 tonne of disposable solid hospital waste. System boundaries included transportation of hospital solid waste and its treatment and disposal by landfilling, incineration, composting, and material recycling methods. These methods were evaluated based on their greenhouse gas emissions. Landfilling and incineration turned out to be the worst final disposal alternatives, whereas composting and material recovery displayed savings in emissions. An integrated system (composting, incineration, and material recycling) was found as the …",Mustafa Ali and Wenping Wang and Nawaz Chaudhry,27,119065246536981012,Journal of the Air & Waste Management Association,10,1012-1018,Taylor & Francis,Application of life cycle assessment for hospital solid waste management: A case study,https://www.tandfonline.com/doi/abs/10.1080/10962247.2016.1196263,66,2016,/scholar?cites=119065246536981012,ggyoQ3UAAAAJ:8cBNEdFwSQkC
9211,"Noise filtering in presence of important image detail information is considered as challenging task in imaging applications. Use of fuzzy logic based techniques is capturing more focus since last decade to deal with these challenges. In order to tackle conflicting issues of noise smoothing and detail preservation, this paper presents a novel approach using adaptive fuzzy inference system for random valued impulse noise detection and removal. The proposed filter uses the intensity based directional statistics to construct adaptive fuzzy membership functions which plays an important role in fuzzy inference system. Fuzzy inference system constructed in this way is used by the noise detector for accurate classification of noisy and noise-free pixels by differentiating them from edges and detailed information present in an image. After classification of pixels, noise adaptive filtering is performed based on median and …",Muhammad Habib and Ayyaz Hussain and Saqib Rasheed and Mubashir Ali,27,14285054019939482940,AEU-International Journal of Electronics and Communications,5,689-697,Urban & Fischer,Adaptive fuzzy inference system based directional median filter for impulse noise removal,https://www.sciencedirect.com/science/article/pii/S1434841116300619,70,2016,/scholar?cites=14285054019939482940,ggyoQ3UAAAAJ:HiMnOR5ODjIC
9212,"In this paper performance of an indirect evaporative cooler is experimentally analyzed in terms of its thermal effectiveness. A heat and mass exchanger (HMX) using a cross-flow pattern incorporating Maisotsenko cycle (M-cycle) is designed and fabricated having an improved channel width to height ratio and more efficient moisture absorbing material (felt) on the wet channel. Experimental investigations are conducted under various operating conditions of inlet air including its humidity, temperature and velocity along with water temperature. The experimental results indicate that the dew point effectiveness and the wet bulb effectiveness vary in the range of 62–85% and 92–120%, respectively with inlet air temperature variation from 25 to 45 °C at different humidity ratio ranging from 11 g/kg to 19g/kg. Moreover, the overall performance of the improved design is found 5% more efficient in terms of wet bulb …",Omar Khalid and Muzaffar Ali and Nadeem Ahmed Sheikh and Hafiz M Ali and M Shehryar,27,7704371233669383947,Applied Thermal Engineering,,288-295,Pergamon,Experimental analysis of an improved Maisotsenko cycle design under low velocity conditions,https://www.sciencedirect.com/science/article/pii/S1359431115012661,95,2016,/scholar?cites=7704371233669383947,ggyoQ3UAAAAJ:lg2tdxc6qMwC
9213,"Subsurface stormflow is an important component of the rainfall–runoff response, especially in steep terrain. Its contribution to total runoff is, however, poorly represented in the current generation of land surface models. The lack of physical basis of these common parameterizations precludes a priori estimation of the stormflow (i.e. without calibration), which is a major drawback for prediction in ungauged basins, or for use in global land surface models. This paper is aimed at deriving regionalized parameterizations of the storage–discharge relationship relating to subsurface stormflow from a top–down empirical data analysis of streamflow recession curves extracted from 50 eastern United States catchments. Detailed regression analyses were performed between parameters of the empirical storage–discharge relationships and the controlling climate, soil and topographic characteristics. The regression analyses …",Sheng Ye and Hong-Yi Li and Maoyi Huang and Melkamu Ali and Guoyong Leng and L Ruby Leung and Shao-wen Wang and Murugesu Sivapalan,27,3234181156074726958,Journal of hydrology,,670-682,Elsevier,Regionalization of subsurface stormflow parameters of hydrologic models: Derivation from regional analysis of streamflow recession curves,https://www.sciencedirect.com/science/article/pii/S0022169414005344,519,2014,/scholar?cites=3234181156074726958,ggyoQ3UAAAAJ:abG-DnoFyZgC
9214,"Polyetheretherketones (PEEK) have been increasingly employed as biomaterials for trauma, orthopedic, and spinal implants. These implants are commonly fabricated by extrusion and injection molding, and for this fact, additional machining operations are required. Surface roughness is a vital factor for medical implants since the cells of the surrounding tissue interact with the underlying substrate on the micro and nanometer scales. For some application, such as self-mating articulation cervical disc implants smooth surface finish is critical so as to minimize the contact friction and wear. The requirement for a fine surface roughness poses a major concern in machining of polymeric base materials due to its low thermal conductivity. Machining performance such as surface roughness is directly affected by the milling parameter and should be methodically analyzed. Thus, this paper aims to study the effect of milling parameter on surface roughness of PEEK plastic under dry machining condition. Response Surface Methodology (RSM) technique was used to evaluate the influence of milling parameter namely cutting speed, feed rate and depth of cut on machined surface. From the conducted study, based on the statistical analysis result it is found that feed rate is the main factor that influence the surface roughness followed by milling speed and depth of cut. In addition, optical observation on the machined surface indicated that the mechanisms of the surface finish obtained from machining of polymeric based composites are different from those obtained from machining of the metals. It shows that there is some form of polymeric softening taking place …",R Izamshah and MA Azam and M Hadzley and MA Md Ali and MS Kasim and MS Abdul Aziz,27,6101988609932963941,Procedia Engineering,,654-660,Elsevier,Study of surface roughness on milling unfilled-polyetheretherketones engineering plastics,https://core.ac.uk/download/pdf/81141832.pdf,68,2013,/scholar?cites=6101988609932963941,ggyoQ3UAAAAJ:B_SudGh4-BUC
9215,"Lahore’s population is growing at a rate of 4% a year. It is widely perceived that because of this rapid growth, the level of services provided to the city’s 7 million inhabitants has substantially deteriorated. This study presents the finding of ambient air quality monitoring carried out in Lahore City, Pakistan. The ambient air quality was monitored for criteria pollutants carbon monoxide (CO), nitrogen dioxide (NO2), sulfur dioxide (SO2), ozone (O3), particulate matter (TSP and PM10), lead (Pb), and noise level at ten different locations of the city. The sampling locations were selected in a way to draw a representative profile of air quality, covering both newly developed as well as highly congested urban centers. The sulfur dioxide, lead, and suspended particulate concentration was found very high as compared to the ambient air quality standards of US Environmental Protection Agency and WHO guidelines. The 24 …",Mahboob Ali and Makshoof Athar,27,17828022908243672890,Environmental monitoring and assessment,1-4,353-363,Springer Netherlands,"Impact of transport and industrial emissions on the ambient air quality of Lahore City, Pakistan",https://link.springer.com/article/10.1007/s10661-009-1283-0,171,2010,/scholar?cites=17828022908243672890,ggyoQ3UAAAAJ:b15ltGHXyxQC
9216,"The experimental yield of ZnO nanocrystals decreases drastically with increasing reactor temperature in a typical chemical vapor synthesis (CVS) of ZnO nanocrystals from diethylzinc. A novel CVS set‐up – a microwave plasma combined with a hot‐wall zone – is described to minimize the loss of particles at higher reactor temperatures. The powder samples have been characterized by transmission electron microscopy (TEM) and X‐ray diffraction (XRD). It is observed that the synthesis set‐up and reaction temperature have substantial influence not only on yield but also on crystallite size and crystallinity of the pure wurtzite‐type ZnO nanocrystals. The lattice constants of ZnO nanocrystals increase with decreasing crystallite size. Defect densities (twin and stacking faults), as well as microstrain, decrease with increasing reactor temperature, whereas crystallinity increases.",Moazzam Ali and Nina Friedenberger and Marina Spasova and Markus Winterer,27,11293478106277297959,Chemical Vapor Deposition,7‐9,192-198,WILEY‐VCH Verlag,"A novel approach for chemical vapor synthesis of ZnO nanocrystals: optimization of yield, crystallinity",https://onlinelibrary.wiley.com/doi/abs/10.1002/cvde.200806722,15,2009,/scholar?cites=11293478106277297959,ggyoQ3UAAAAJ:HKviVsUxM5wC
9217,Plant-microbe-chelator synergy has been considered as an important phytoremediation strategy to enhance heavy metal extraction from contaminated soil. Plant growth promoting bacteria (PGPB) and organic acids such as citric acid (CA) are important regarding the plant growth and induction of antioxidative defense under abiotic stress conditions. The current study was conducted to investigate the possibility of phytoextraction potential and stress tolerance of Glycine max L. in multi-metal contaminated soil by the manipulation of plant growth promoting endophyte Kocuria rhizophila and citric acid. CA. It was observed that the application of K. rhizophila or CA showed significant influence on growth promotion and metal accumulation capability of G. max L. in industrial contaminated and cadmium spiked (100 and 200 mg kg−1) soils. The individual application of K. rhizophila and CA led to a significant increase in …,Amjad Hussain and Muhammad Aqeel Kamran and Muhammad Tariq Javed and Kashif Hayat and Muhammad Asad Farooq and Naeem Ali and Musrat Ali and Hakim Manghwar and Farooq Jan and Hassan Javed Chaudhary,26,16684030666851321596,Environmental and Experimental Botany,,23-33,Elsevier,Individual and combinatorial application of Kocuria rhizophila and citric acid on phytoextraction of multi-metal contaminated soils by Glycine max L,https://www.sciencedirect.com/science/article/pii/S0098847218314825,159,2019,/scholar?cites=16684030666851321596,ggyoQ3UAAAAJ:n0_S8QYMK-AC
9218,"This research study aims at giving an overview of the emerging research field of Islamic insurance in a phase that is still under debate among Muslim nations. No doubt, Takaful (Islamic insurance) is growing rapidly but it is still behind conventional insurance. Most of the researches reveal the fact that general public is unaware about Takaful and Takaful awareness level is low among general public. Researchers and practitioners are trying to explore the crucial factors which creates Takaful awareness among general public. However, only few studies are available in Pakistan which formally documented the issue and explore different Takaful awareness factors among general public of Pakistan. Therefore, the ultimate objective of this study is to find out general factors which enhance Takaful awareness level among general public of Pakistan. To achieve this objective, three hypotheses are proposed concerning the relationship of Takaful awareness level and other Takaful awareness factors such as Educational Level of general public, Religious Orientation of general public and Takaful Distribution Channels. Primary data was collected from general public of Pakistan by using 5-point Likert scale. These hypotheses predicting a positive relationship between Takaful awareness level and awareness factors (ie, educational level, religious orientation, distribution channels). However, religious orientation has higher impact as compared to Takaful distribution channels and educational level. Study found that these three factors are crucial to enhance Takaful awareness level among general public. Hence, this study is contributing in the body of …",Muhammad Azeem Waseem-Ul-Hameed and Mohsin Ali and Shahid Nadeem and Tayyab Amjad,26,1855130141242919721,Int. J Sup. Chain. Mgt Vol,4,308,,The role of distribution channels and educational level towards insurance awareness among the general public,http://ijis-scm.bsne.ch/ojs.excelingtech.co.uk/index.php/IJSCM/article/download/1850/1850-6395-1-PB.pdf,6,2017,/scholar?cites=1855130141242919721,ggyoQ3UAAAAJ:SN5MtqHu-psC
9219,"The aim of this study was to establish a database on nutrients and mineral profile, in vitro dry matter digestibility (DMD) and in situ ruminal degradability characteristics of leaves from 21 fodder tree species commonly fed to livestock in semi-arid and arid zones of Northern Pakistan. Leaves from 13 fodder tree species: Albizia lebbeck, Ailanthus altissima, Bauhinia variegata, Butea frondosa, Celtis australis, Ficus carica, Grewia oppositifolia, Leucaena leucocephala, Mallotus philippensis, Melia azedarach, Morus alba, Morus papyrifera and Ziziphus mauritiana were sampled from semi-arid zone. Leaves from 8 fodder tree species: Acacia modesta, A. lebbeck, Capparis aphylla, Olea cuspidata, Prosopis juliflora, Tecomella undulata, Ziziphus jujuba and Ziziphus mauritiana were sampled from arid zone. Within each ecological zone, leaves of each tree species were collected at four sub-locations, from three randomly …",G Habib and NA Khan and A Sultan and M Ali,26,10194472261411226980,Livestock Science,,64-70,Elsevier,Nutritive value of common tree leaves for livestock in the semi-arid and arid rangelands of Northern Pakistan,https://www.sciencedirect.com/science/article/pii/S1871141315300627,184,2016,/scholar?cites=10194472261411226980,ggyoQ3UAAAAJ:RfQ-KHj5eBsC
9220,"A fundamental problem in 802.11 wireless networks is to accurately determine the cause of packet losses. This becomes increasingly important as wireless data rates scale to Gbps, where lack of loss differentiation leads to higher loss in throughput. Recent and upcoming high-speed WLAN standards, such as 802.11n and 802.11ac, use frame aggregation and block acknowledgements for achieving efficient communication. This paper presents BLMon, a framework for loss differentiation, that uses loss patterns within aggregate frames and aggregate frame retries to achieve accurate and low overhead loss differentiation. Towards this end, we carry out a detailed measurement study on a real testbed to ascertain the differences in loss patterns due to noise, collisions, and hidden nodes. We then devise metrics to quantitatively capture these differences. Finally, we design BLMon, which collectively uses these metrics …",Ruwaifa Anwar and Kamran Nishat and Mohsin Ali and Zahaib Akhtar and Haseeb Niaz and Ihsan Ayyub Qazi,26,7239700447682926827,,,2463-2471,IEEE,Loss differentiation: Moving onto high-speed wireless LANs,https://ieeexplore.ieee.org/abstract/document/6848192/,,2014,/scholar?cites=7239700447682926827,ggyoQ3UAAAAJ:CMPXdcK5v8EC
9221,"Nowadays Knowledge management has been of great interest globally. Bahraini's Bank have been given interest to IT investment in knowledge Management. This paper concentrate on the availability of Knowledge-Based System and the benefits estimated from the use of such a system in increasing the effectiveness of decisions. The paper highlights the need for an automated tool to support the decision-making process. The affect of four factors, representing the use of KMS, had been studied to see their effect on decisions. These factors are: availability of required technologies, capabilities of individuals, coordination between departments, and acceptance and trust of decision makers.Overall, the results show that there was a significant relationship between the effectiveness of decision making and the availability of required technologies, capabilities of individuals and coordination between departments. On the other hand, there was no relationship between the effectiveness of decision making and acceptance and trust of decision makers in Bahraini banks.",Zainab Abdulshaheed Mohsen and Mai Ali and Akram Jalal,26,11106728357550645259,International Journal of Business and Management,8,130,Canadian Center of Science and Education,The significance of knowledge management systems at financial decision making process,https://www.academia.edu/download/32552031/11569-34746-1-SM.pdf,6,2011,/scholar?cites=11106728357550645259,ggyoQ3UAAAAJ:bczYY1dZPtQC
9222,"Smartphones are increasingly being used to store personal information as well as to access sensitive data from the Internet and the cloud. Establishment of the identity of a user requesting information from smartphones is a prerequisite for secure systems in such scenarios. In the past, keystroke-based user identification has been successfully deployed on production-level mobile devices to mitigate the risks associated with naïve username/password based authentication. However, these approaches have two major limitations: they are not applicable to services where authentication occurs outside the domain of the mobile device – such as web-based services; and they often overly tax the limited computational capabilities of mobile devices. In this paper, we propose a protocol for keystroke dynamics analysis which allows web-based applications to make use of remote attestation and delegated keystroke …",Mohammad Nauman and Tamleek Ali,26,14507355837627623253,,,286-297,"Springer, Berlin, Heidelberg",Token: Trustable keystroke-based authentication for web-based applications on smartphones,https://link.springer.com/chapter/10.1007/978-3-642-13365-7_28,,2010,/scholar?cites=14507355837627623253,ggyoQ3UAAAAJ:YsMSGLbcyi4C
9223,"The importance of materialized views has grown significantly with the advent of data warehousing and OLAP technology. This increases the relevance of solutions to the problem of incrementally maintaining materialized views. So far, most w orkon this problem has been confined to relational settings. Proposals that apply to object databases have either used non-standard models or fallen short of providing a comprehensive framework. This paper contributes a solution to the incremental view maintenance problem for a large class of views expressed in OQL, the query language of the ODMG standard for object databases. The solution applies to immediate update propagation, and works for any update operation on views defined over a substantial subset of ODMG types. The approach presen ted has been fully implemented and preliminary performance results are reported.",M Akhtar Ali and Alvaro AA Fernandes and Norman W Paton,26,1012685862628303045,,,41-48,,Incremental maintenance of materialized OQL views,https://dl.acm.org/doi/pdf/10.1145/355068.355314,,2000,/scholar?cites=1012685862628303045,ggyoQ3UAAAAJ:ILKRHgRFtOwC
9224,"To treat a realistic chemical system, such as a liquid phase dehydrogenation reaction, a chemical scheme, which describes the chemical kinetics in terms of the small number of reaction progress variables is needed. Based on the matrix algebra, we analyse the key components, elements and reactions in the mechanism, C-matrix. Reduction techniques exploit the time-scale separation into fast and slow modes by computing the dimension reduced model via the elimination of fast mode subjecting them to the slow one. The two-step reversible reaction mechanism is considered for model reduction and to simplify the complexity of reaction mechanisms. They give a meaningful picture, but for maximum clarity, the phase flow of the solution trajectories near the equilibrium point is exploited. The Lyapunov function is applied for the stability analysis. To describe the physical behaviour of the reaction mechanism …",M Shahzad and F Sultan and I Haq and M Ali and WA Khan,25,89690376645596549,Pramana,4,64,Springer India,C-matrix and invariants in chemical kinetics: a mathematical concept,https://link.springer.com/article/10.1007/s12043-019-1723-5,92,2019,/scholar?cites=89690376645596549,ggyoQ3UAAAAJ:65Yg0jNCQDAC
9225,"This study describes the immobilization of ginger peroxidase on amino-functionalized silica-coated titanium dioxide nanocomposite and its application in bioremediation process. A dramatic enhancement in enzyme activity was observed after immobilization on nanosupport which was evident from the effectiveness factor (η) value of 1.76. Immobilization of enzyme on nanosupport was confirmed by transmission electron microscopy, scanning electron microscopy, and Fourier transform infrared spectroscopy. Immobilized peroxidase exhibited higher activity in a broad range of pH and temperature as compared to free enzyme. Also, the thermostability of peroxidase was strikingly improved upon immobilization. After six repeated uses, the immobilized peroxidase retained around 62% of its dye decolorization activity. V max of the enzyme was changed to 35.01 μmol L−1 min−1 from 8.42 μmol L−1 …",Misha Ali and Qayyum Husain and Nida Alam and Masood Ahmad,25,17237497039150309888,"Water, Air, & Soil Pollution",1,22,Springer International Publishing,Enhanced catalytic activity and stability of ginger peroxidase immobilized on amino-functionalized silica-coated titanium dioxide nanocomposite: a cost-effective tool for …,https://link.springer.com/content/pdf/10.1007/s11270-016-3205-4.pdf,228,2017,/scholar?cites=17237497039150309888,ggyoQ3UAAAAJ:-A4928QJj7oC
