id,abstract,author,cites,cites_id,journal,number,pages,publisher,title,url,volume,year
3000,"We present an extensive molecular‐dynamics simulation for a bead spring model of a melt of linear polymers. The number of monomers N covers the range from N=5 to N=400. Since the entanglement length Ne is found to be approximately 35, our chains cover the crossover from the nonentangled to the entangled regime. The Rouse model provides an excellent description for short chains N<Ne, while the dynamics of the long chains can be described by the reptation model. By mapping the model chains onto chemical species we give estimates of the times and distances of onset of the slowing down in motion due to reptation. Comparison to neutron spin‐echo data confirm our mapping procedure, resolving a discrepancy between various experiments. By considering the primitive chain we are able to directly visualize the confinement to a tube. Analyzing the Rouse mode relaxation allows us to exclude the …",Kurt Kremer and Gary S Grest,3234,10164367454711182685,The Journal of Chemical Physics,8,5057-5086,American Institute of Physics,Dynamics of entangled linear polymer melts: A molecular‐dynamics simulation,https://aip.scitation.org/doi/abs/10.1063/1.458541,92,1990
3001,"We describe an efficient and general algorithm for simulating polymers, which can be used for single, large chains as well as many-chain systems. It allows us to distinguish solvent effects from interchain effects on the dynamics of the chains. The method is tested for linear and cyclic chains of 50 to 200 monomers. We have confirmed two theoretical results which have not been observed numerically or experimentally, namely the anomalous behavior of S (q) for rings and the t 0.54 power law for the motion of a monomer in a self-avoiding chain undergoing Rouse relaxation.",Gary S Grest and Kurt Kremer,1606,14013357973757693769,Physical Review A,5,3628,American Physical Society,Molecular dynamics simulation for polymers in the presence of a heat bath,https://journals.aps.org/pra/abstract/10.1103/PhysRevA.33.3628,33,1986
3002,"We present a new effective algorithm to simulate dynamic properties of polymeric systems confined to lattices. The algorithm displays Rouse behavior for all spatial dimensions. It combines typical advantages of lattice Monte Carlo methods with those from the continuous Brownian dynamics algorithm. In addition, it allows for the simulation of branched structures and is shown to be ergodic. Detailed numerical tests for random and self-avoiding walks are performed for d= 2. For SAWs the power law for the mean-square displacement for inner monomers, g (t)= tVd+ d/2*·))(at0*, d= 2), is clearly found. Also, an anomaly in the static structure function S (k), which is typical for d= 2 linear polymers, was found. We can also compare this ergodic algorithmwith a nonergodic one, which seems to be suitable for isolated chains.",I Carmesin and Kurt Kremer,1502,14620577461690549962,Macromolecules,9,2819-2823,American Chemical Society,The bond fluctuation method: a new effective algorithm for the dynamics of polymers in all spatial dimensions,https://pubs.acs.org/doi/pdf/10.1021/ma00187a030,21,1988
3003,"Written by leading experts from around the world, Monte Carlo and Molecular Dynamics Simulations in Polymer Science comprehensively reviews the latest simulation techniques for macromolecular materials. Focusing in particular on numerous new techniques, the book offers authoritative introductions to solutions of neutral polymers and polyelectrolytes; dynamics of polymer melts, rubbers and gels, and glassy materials; thermodynamics of polymer mixing and mesophase formation, and polymers confined at interfaces and grafted to walls. Throughout, contributors offer practical advice on how to overcome the unique challenges posed by the large size and slow relaxation of polymer coils. Students and researchers in polymer chemistry, polymer physics, chemical engineering, and materials and computational science will all benefit from the cogent, step-by-step introductions contained in this important new book.",Kurt Binder,1249,17433941633135794728,,,,Oxford University Press,Monte Carlo and molecular dynamics simulations in polymer science,http://scholar.google.com/scholar?cluster=17433941633135794728&hl=en&oi=scholarr,,1995
3004,"The influence of a hard wall on the configurations of long flexible polymer chains near the wall is studied, in the presence of a short‐range attractive force between monomers and the wall. Particular attention is paid to the region around the temperature Ta below which the polymer becomes adsorbed to the wall, i.e., where the typical polymer linear dimensions perpendicular to the wall become independent of chain length. Both ideal noninteracting chains and chains with excluded volume interactions are treated. Polymer linear dimensions parallel and perpendicular to the wall and their probability distributions are studied, as well as the behavior of the monomer fraction at the surface and a distance z in the interior. The relation of polymer statistics to the problem of correlation functions in the n‐vector model of magnetism in the limit n→0 is exploited to express both the exponents describing the various power laws …",E Eisenriegler and K Kremer and K Binder,766,6741242804264981470,The Journal of Chemical Physics,12,6296-6320,American Institute of Physics,Adsorption of polymer chains at surfaces: Scaling and Monte Carlo analyses,https://aip.scitation.org/doi/abs/10.1063/1.443835,77,1982
3005,"The phase diagram and dynamical properties of systems of particles interacting through a repulsive screened Coulomb (Yukawa) potential have been calculated using molecular and lattice dynamics techniques. The phase diagram contains both a melting transition and a transition from fcc to bcc crystalline phases. These phase transitions have been studied as a function of potential shape (screening length) and compared to phenomenological criteria for transition temperatures such as those of Lindemann and of Hansen and Verlet. The transition from fcc to bcc with increasing temperature is shown to result from a higher entropy in the bcc phase because of its softer shear modes. Even when the stable solid phase below the melting temperature is fcc, bcc‐like local order is found in the liquid phase. This may substantially slow crystallization. The calculated phase diagram and shear modulus are in good …",Mark O Robbins and Kurt Kremer and Gary S Grest,725,6588943183646612935,The Journal of chemical physics,5,3286-3312,American Institute of Physics,Phase diagram and dynamics of Yukawa systems,https://aip.scitation.org/doi/abs/10.1063/1.453924,88,1988
3006,"Membrane remodelling 1, 2, 3, 4, 5 plays an important role in cellular tasks such as endocytosis, vesiculation and protein sorting, and in the biogenesis of organelles such as the endoplasmic reticulum or the Golgi apparatus. It is well established that the remodelling process is aided by specialized proteins that can sense 4 as well as create 6 membrane curvature, and trigger tubulation 7, 8, 9 when added to synthetic liposomes. Because the energy needed for such large-scale changes in membrane geometry significantly exceeds the binding energy between individual proteins and between protein and membrane, cooperative action is essential. It has recently been suggested 10, 11 that curvature-mediated attractive interactions could aid cooperation and complement the effects of specific binding events on membrane remodelling. But it is difficult to experimentally isolate curvature-mediated interactions from direct …",Benedict J Reynwar and Gregoria Illya and Vagelis A Harmandaris and Martin M Müller and Kurt Kremer and Markus Deserno,699,11673756883595978037,Nature,7143,461-464,Nature Publishing Group,Aggregation and vesiculation of membrane proteins by curvature-mediated interactions,https://www.nature.com/articles/nature05840,447,2007
3007,"The viscoelastic properties of high molecular weight polymeric liquids are dominated by topological constraints on a molecular scale. In a manner similar to that of entangled ropes, polymer chains can slide past but not through each other. Tube models of polymer dynamics and rheology are based on the idea that entanglements confine a chain to small fluctuations around a primitive path that follows the coarse-grained chain contour. Here we provide a microscopic foundation for these highly successful phenomenological models. We analyze the topological state of polymeric liquids in terms of primitive paths and obtain parameter-free, quantitative predictions for the plateau modulus, which agree with experiment for all major classes of synthetic polymers.",Ralf Everaers and Sathish K Sukumaran and Gary S Grest and Carsten Svaneborg and Arvind Sivasubramanian and Kurt Kremer,633,15969684641401108416,Science,5659,823-826,American Association for the Advancement of Science,Rheology and microscopic topology of entangled polymeric liquids,https://science.sciencemag.org/content/303/5659/823.abstract,303,2004
3008,"We present results of molecular dynamics simulations of linear polyelectrolytes in solution. The fundamental model for polyelectrolytes in solution is studied. Specifically, simulations are performed for multichain systems of a flexible chain model of charged polymers. The full Coulomb interactions of the monomers and counterions are treated explicitly. Experimental measurements of the osmotic pressure and the structure factor are reproduced. The simulations reveal a new picture of the chain structure based on calculations of the structure factor, persistence length, end‐to‐end distance, etc. We present a detailed discussion of the chain structure and a comparison with present theories. In contrast to the predicted dilute limit of rodlike chains, we find that the chains have significant bending at very low densities. Furthermore, the chains contract significantly before they overlap. We also show that counterion …",Mark J Stevens and Kurt Kremer,515,7108113159171126129,The Journal of chemical physics,4,1669-1690,American Institute of Physics,The nature of flexible linear polyelectrolytes in salt free solution: A molecular dynamics study,https://aip.scitation.org/doi/abs/10.1063/1.470698,103,1995
3009,"Discotic liquid crystals are a promising class of materials for molecular electronics thanks to their self-organization and charge transporting properties. The best discotics so far are built around the coronene unit and possess six-fold symmetry. In the discotic phase six-fold-symmetric molecules stack with an average twist of 30∘, whereas the angle that would lead to the greatest electronic coupling is 60∘. Here, a molecule with three-fold symmetry and alternating hydrophilic/hydrophobic side chains is synthesized and X-ray scattering is used to prove the formation of the desired helical microstructure. Time-resolved microwave-conductivity measurements show that the material has indeed a very high mobility, 0.2 cm 2 V− 1 s− 1. The assemblies of molecules are simulated using molecular dynamics, confirming the model deduced from X-ray scattering. The simulated structures, together with quantum-chemical …",Xinliang Feng and Valentina Marcon and Wojciech Pisula and Michael Ryan Hansen and James Kirkpatrick and Ferdinand Grozema and Denis Andrienko and Kurt Kremer and Klaus Müllen,509,14493941227071916047,Nature materials,5,421-426,Nature Publishing Group,Towards high charge-carrier mobilities by rational design of the shape and periphery of discotics,https://www.nature.com/articles/nmat2427,8,2009
3010,"The paper introduces a systematic procedure to coarse grain atomistic polymer models into a mesoscopic model, which then allows an effective and fast simulation of melts. The method, which provides information on both static and dynamic properties, is tested for three different modifications of polycarbonate. The models successfully describe the variation in the Vogel—Fulcher temperature as well as the total chain extension. The effective speedup compared to the corresponding atomistic simulation is significantly above 103.",W Tschöp and Kurt Kremer and J Batoulis and Ta Bürger and O Hahn,501,8797743479677108770,Acta Polymerica,2‐3,61-74,WILEY‐VCH Verlag GmbH,Simulation of polymer melts. I. Coarse‐graining procedure for polycarbonates,https://onlinelibrary.wiley.com/doi/abs/10.1002/(SICI)1521-4044(199802)49:2/3%3C61::AID-APOL61%3E3.0.CO;2-V,49,1998
3011,"Several methods for preparing well equilibrated melts of long chains polymers are studied. We show that the standard method in which one starts with an ensemble of chains with the correct end-to-end distance arranged randomly in the simulation cell and introduces the excluded volume rapidly, leads to deformation on short length scales. This deformation is strongest for long chains and relaxes only after the chains have moved their own size. Two methods are shown to overcome this local deformation of the chains. One method is to first pre-pack the Gaussian chains, which reduces the density fluctuations in the system, followed by a gradual introduction of the excluded volume. The second method is a double-bridging algorithm in which new bonds are formed across a pair of chains, creating two new chains each substantially different from the original. We demonstrate the effectiveness of these methods for a …",Rolf Auhl and Ralf Everaers and Gary S Grest and Kurt Kremer and Steven J Plimpton,464,11390105268054402831,The Journal of chemical physics,24,12718-12728,American Institute of Physics,Equilibration of long chain polymer melts in computer simulations,https://aip.scitation.org/doi/abs/10.1063/1.1628670,119,2003
3012,"The relation between atomistic chemical structure, molecular architecture, molecular weight, and material properties is of basic concern in modern soft material science and includes standard properties of bulk materials and surface and interface aspects, as well as the relation between structure and function in nanoscopic objects and molecular assemblies of both synthetic and biological origin. This all implies a thorough understanding on many length and correspondingly time scales, ranging from (sub)atomistic to macroscopic. Presently, computer simulations play an increasingly important, if not central, role. Some problems do not require specific atomistic details, whereas others require them only locally. However, in many cases this strict separation is not sufficient for a comprehensive understanding of systems, and flexible simulation schemes are required that link the different levels of resolution. We here give a …",Matej Praprotnik and Luigi Delle Site and Kurt Kremer,453,8922506562331482129,,,545-571,Annual Reviews,Multiscale simulation of soft matter: From scale bridging to adaptive resolution,https://www.annualreviews.org/doi/abs/10.1146/annurev.physchem.59.032607.093707,59,2008
3013,"This article reviews various methods for the Monte Carlo simulation of models for long flexible polymer chains, namely self-avoiding random walks at various lattices. This problem belongs to the classical applications of Monte Carlo methods since more than thirty years, and numerous techniques have been devised. Neverthless, there are still many open questions, relating to the validity of the algorithms in principle, as well as to the accuracy of the results that can be obtained in practice. This review presents a brief introduction to these problems, discusses the basic ideas on which the various algorithms are based as well as their limitations, and describes a few typical physical applications. Most emphasis is on the simulation of single, isolated chains representing macromolecules in dilute solution, but the simulation of many-chain systems is also dealt with briefly. An outlook on related problems (simulation of off …",Kurt Kremer and Kurt Binder,451,1412026052543770248,Computer Physics Reports,6,259-310,North-Holland,Monte Carlo simulation of lattice models for macromolecules,https://www.sciencedirect.com/science/article/pii/0167797788900159,7,1988
3014,"Results of a molecular dynamics simulation of a single polymer chain in a good solvent are presented. The latter is modeled explicitly as a bath of particles. This system provides a first‐principles microscopic test of the hydrodynamic Kirkwood–Zimm theory of the chain’s Brownian motion. A 30 monomer chain is studied in 4066 solvent particles as well as 40/4056 and 60/7940 systems. The density was chosen rather high, in order to come close to the ideal situation of incompressible flow, and to ensure that diffusive momentum transport is much faster than particle motions. In order to cope with the numerical instability of microcanonical algorithms, we generate starting states by a Langevin simulation that includes a coupling to a heat bath, which is switched off for the analysis of the dynamics. The long range of the hydrodynamic interaction induces a large effect of finite box size on the diffusive properties, which is …",Burkhard Dünweg and Kurt Kremer,440,8755301442639836997,The Journal of chemical physics,9,6983-6997,American Institute of Physics,Molecular dynamics simulation of a polymer chain in solution,https://aip.scitation.org/doi/abs/10.1063/1.465445,99,1993
3015,"We discuss dissipative particle dynamics as a thermostat to molecular dynamics, and highlight some of its virtues:(i) universal applicability irrespective of the interatomic potential;(ii) correct and unscreened reproduction of hydrodynamic correlations;(iii) stabilization of the numerical integration of the equations of motion; and (iv) the avoidance of a profile bias in boundary-driven nonequilibrium simulations of shear flow. Numerical results on a repulsive Lennard-Jones fluid illustrate our arguments.",Thomas Soddemann and Burkhard Dünweg and Kurt Kremer,439,3087112488387917096,Physical Review E,4,046702,American Physical Society,Dissipative particle dynamics: A useful thermostat for equilibrium and nonequilibrium molecular dynamics simulations,https://journals.aps.org/pre/abstract/10.1103/PhysRevE.68.046702,68,2003
3016,"Recent developments that increase the time and distance scales accessible in the simulations of specific polymers are reviewed. Several different techniques are similar in that they replace a model expressed in fully atomistic detail with a coarse-grained model of the same polymer, atomistic→ coarse-grained (and beyond!), thereby increasing the time and distance scales accessible within the expenditure of reasonable computational resources. The bridge represented by the right-pointing arrow can be constructed via different procedures, which are reviewed here. The review also considers the status of methods which reverse this arrow, atomistic← coarse-grained. This “reverse-mapping” recovers a model expressed in fully atomistic detail from an arbitrarily chosen replica generated during the simulation of the coarse-grained system. Taken in conjunction with the efficiency of the simulation when the system is in …",Jörg Baschnagel and Kurt Binder and Pemra Doruker and Andrei A Gusev and Oliver Hahn and Kurt Kremer and Wayne L Mattice and Florian Müller-Plathe and Michael Murat and Wolfgang Paul and Serge Santos and Ulrich W Suter and Volker Tries,417,1494733730918665938,,,41-156,"Springer, Berlin, Heidelberg",Bridging the gap between atomistic and coarse-grained models of polymers: Status and perspectives,https://link.springer.com/chapter/10.1007/3-540-46778-5_2,,2000
3017,"Coarse-graining is a systematic way of reducing the number of degrees of freedom representing a system of interest. Several coarse-graining techniques have so far been developed, such as iterative Boltzmann inversion, force-matching, and inverse Monte Carlo. However, there is no unified framework that implements these methods and that allows their direct comparison. We present a versatile object-oriented toolkit for coarse-graining applications (VOTCA) that implements these techniques and that provides a flexible modular platform for the further development of coarse-graining techniques. All methods are illustrated and compared by coarse-graining the SPC/E water model, liquid methanol, liquid propane, and a single molecule of hexane.",Victor Ruhle and Christoph Junghans and Alexander Lukyanov and Kurt Kremer and Denis Andrienko,399,3554138775692437701,Journal of Chemical Theory and Computation,12,3211-3223,American Chemical Society,Versatile object-oriented toolkit for coarse-graining applications,https://pubs.acs.org/doi/abs/10.1021/ct900369w,5,2009
3018,"We present a new adaptive resolution technique for efficient particle-based multiscale molecular-dynamics simulations. The presented approach is tailor-made for molecular systems where atomistic resolution is required only in spatially localized domains whereas a lower mesoscopic level of detail is sufficient for the rest of the system. Our method allows an on-the-fly interchange between a given molecule’s atomic and coarse-grained levels of description, enabling us to reach large length and time scales while spatially retaining atomistic details of the system. The new approach is tested on a model system of a liquid of tetrahedral molecules. The simulation box is divided into two regions: one containing only atomistically resolved tetrahedral molecules, and the other containing only one-particle coarse-grained spherical molecules. The molecules can freely move between the two regions while changing their level …",Matej Praprotnik and Luigi Delle Site and Kurt Kremer,398,4282197079170191097,The Journal of chemical physics,22,224106,American Institute of Physics,Adaptive resolution molecular-dynamics simulation: Changing the degrees of freedom on the fly,https://aip.scitation.org/doi/abs/10.1063/1.2132286,123,2005
3019,"The bond fluctuation model on the simple cubic lattice is studied by Monte Carlo simulations on a multitransputer array, for polymer volume fractions φ in the range 0.025≤φ≤0.500 and chain lengths N in the range 20≤N≤200. Extensive data are presented on the dynamics of monomer displacements, center‐of‐gravity displacements, and relaxation times. This study is complementary to previous work, in which the crossover scaling properties of the chain linear dimensions, structure factor, and self‐diffusion constant were tested for the same athermal model. The simulation technique takes both excluded volume interactions and entanglement constraints into account, but ignores hydrodynamic forces. Our results describe the crossover from Rouse behavior of swollen chains (τ∼N1+2ν, ν being the exponent describing the radius R of the chains, R∼Nν ) to reptation, τ∼N3. Since the excluded volume screening …",Wolfgang Paul and Kurt Binder and Dieter W Heermann and Kurt Kremer,377,8721530216583801549,The Journal of chemical physics,10,7726-7740,American Institute of Physics,Dynamics of polymer solutions and melts. Reptation predictions and scaling of relaxation times,https://aip.scitation.org/doi/abs/10.1063/1.461346,95,1991
3020,"We present a model for the efficient simulation of generic bilayer membranes. Individual lipids are represented by one head bead and two tail beads. By means of simple pair potentials these robustly self-assemble to a fluid bilayer state over a wide range of parameters, without the need for an explicit solvent. The model shows the expected elastic behavior on large length scales, and its physical properties (eg, fluidity or bending stiffness) can be widely tuned via a single parameter. In particular, bending rigidities in the experimentally relevant range are obtained, at least within 3–30 k B T. The model is naturally suited to study many physical topics, including self-assembly, fusion, bilayer melting, lipid mixtures, rafts, and protein-bilayer interactions.",Ira R Cooke and Kurt Kremer and Markus Deserno,373,11471428023444248333,Physical Review E,1,011506,American Physical Society,Tunable generic model for fluid bilayer membranes,https://journals.aps.org/pre/abstract/10.1103/PhysRevE.72.011506,72,2005
3021,"Many physical phenomena and properties of soft matter systems such as synthetic or biological materials are governed by interactions and processes on a wide range of length- and time-scales. Computer simulation approaches that are targeted at questions in these systems require models which cover these scales and the respective levels of resolution. Multiscale simulation methods combine and systematically link several simulation hierarchies so that they can address phenomena at multiple levels of resolution. In order to reach the mesoscopic time- and length-scales important for many material properties, methods that bridge from the atomistic (microscopic) to a coarser (mesocopic) level are developed. Here, we review coarse-grained simulation models that are linked to a higher resolution atomistic description. In particular, we focus on structure-based coarse-graining methods which are used for a variety of …",Christine Peter and Kurt Kremer,359,10350883895285517342,Soft Matter,22,4357-4366,Royal Society of Chemistry,Multiscale simulation of soft matter systems–from the atomistic to the coarse-grained level and back,https://pubs.rsc.org/ko/content/articlehtml/2009/sm/b912027k,5,2009
