id,abstract,author,cites,cites_id,journal,number,pages,publisher,title,url,volume,year
3022,"Extensive Monte Carlo simulations are presented for the bond-fluctuation model on three-dimensional simple cubic lattices. High statistics data are obtained for polymer volume fractions  in the range  and chain lengths N in the range , making use of a parallel computer containing 80 transputers. The simulation technique takes into account both excluded volume interactions and entanglement restrictions, while otherwise the chains are non-interacting and athermal. The simulation data are analysed in terms of the de Gennes scaling concepts, describing the crossover from swollen coils in the dilute limit to gaussian coils in semidilute and concentrated solution. The crossover scaling functions for the chain linear dimensions and for the decay of the structure factor are estimated and compared to corresponding theoretical and experimental results in the literature. Also the dynamics of the …",Wolfgang Paul and Kurt Binder and Dieter W Heermann and Kurt Kremer,338,1006544373105125590,Journal De Physique Ii,1,37-60,EDP Sciences,Crossover scaling in semidilute polymer solutions: a Monte Carlo test,https://jp2.journaldephysique.org/articles/jp2/abs/1991/01/jp2v1p37/jp2v1p37.html,1,1991
3023,"We present a hierarchical approach that combines atomistic and mesoscopic simulations that can generally be applied to vinyl polymers. As a test case, the approach is applied to atactic polystyrene (PS). First, a specific model for atactic PS is chosen. The bonded parameters in the coarse-grained force field, based on data obtained from atomistic simulations of isolated PS dimers, are chosen in a way which allows to differentiate between meso and racemic dyads. This approach in principle allows to study isotactic and syndiotactic melts as well. Nonbonded interactions between coarse-grained beads were chosen as purely repulsive. The proposed mesoscopic model reproduces both the local structure and the chain dimensions properly. An explicit time mapping is performed, based on the atomistic and CG mean-square displacements of short chains, demonstrating an effective speed up of about 3 orders of …",VA Harmandaris and NP Adhikari and Nico FA van der Vegt and Kurt Kremer,327,8031452621646026426,Macromolecules,19,6708-6719,American Chemical Society,Hierarchical modeling of polystyrene: From atomistic to coarse-grained simulations,https://pubs.acs.org/doi/abs/10.1021/ma0606399,39,2006
3024,We present the results of an extensive molecular-dynamics simulation of a dense polymer system. We show for the first time that simulations are able to cover the whole regime from pure Rouse dynamics to reptation dynamics and give strong evidence of the latter. The mean square displacements clearly exhibit a t 1 4 power law. A mode analysis shows that the high-frequency modes follow the Rouse relaxation while those at lower frequency display reptation relaxation. Both quantities give the same entanglement length.,Kurt Kremer and Gary S Grest and I Carmesin,314,7849152923498407967,Physical review letters,5,566,American Physical Society,Crossover from rouse to reptation dynamics: A molecular-dynamics simulation,https://journals.aps.org/prl/abstract/10.1103/PhysRevLett.61.566,61,1988
3025,"We present a detailed simulation study of star polymers with many (6< f< 50) arms/. Each arm consists of N.= 50,100, or 200 monomers. In most respects these show good agreement with the asymptotic scaling predictions of the Daoud-Cotton blobmodel. We report values for the universal ratios characterizing the scattering from such stars. We especially concentrate on many-arm properties and on deviations from recent scaling arguments and describe in detail anomalies in the structure factor. Because typical experimental systems have arm lengths that are on the border line to the asymptotic behavior, we expect that our results are relevant for the interpretation of experiments for both star polymers and micellar solutions.",Gary S Grest and Kurt Kremer and TA Witten,303,8959592998438586179,Macromolecules,6,1376-1383,American Chemical Society,Structure of many arm star polymers: a molecular dynamics simulation,https://pubs.acs.org/doi/pdf/10.1021/ma00172a035,20,1987
3026,"A highly efficient procedure for calculating forces in a molecular dynamics simulation on a vector computer is described. The algorithm is feasible for several thousand particles on currently available machines. The efficiency comes about by a combination of a Verlet table with a link cell algorithm. By a double list data structure, that treats the pairs of interacting particles in a symmetrical manner, the vectorization can be improved significantly. Moreover, the “layering algorithm” recently described by Rapaport can be incorporated. A standard Fortran formulation of the basic procedure is given. We test the algorithm on a Cray XMP/416 for two different Lennard—Jones fluids with interactions truncated at 21~ 6aand 2.5 o. The CPU time is shown to increase linearly with system size. Our link cell method proves to be more efficient than a straightforward search over all pairs as soon as the particle number exceeds about 500.I. Introduction describe a number of modifications which when incorporated into standard molecular dynamics With the availability of modern supercom-(MD) codes greatly increase their performance, puters, molecular dynamics simulations [1—3] have particularly when the number of particles N exbecome very important in understanding the prop- ceeds a few thousand. erties of many complex systems, including pro- In most simulations, each particle i in the teins, biological membranes, and polymers. These simulation cell can potentially interact with any of systems differ from simple atomic fluids, in that it the remaining (N—1) particles and it is necessary",Gary S Grest and Burkhard Dünweg and Kurt Kremer,274,3513059304671669929,Computer Physics Communications,3,269-285,North-Holland,Vectorized link cell Fortran code for molecular dynamics simulations for a large number of particles,http://pds4.egloos.com/pds/200703/02/34/grest(1989)_vectorized%20link%20cell.pdf,55,1989
3027,"We present a set of molecular dynamics (MD) simulations of strongly charged, flexible polyelectrolyte chains under poor solvent conditions in a salt-free solution. Structural properties of the chains and of the solutions are reported. By varying the polymer density and the electrostatic interaction strength, we study the crossover from a dominating electrostatic interaction to the regime of strong screening, where the hydrophobic interactions dominate. During the crossover a multitude of structures is observed. In the limit of low polymer density strongly stretched, necklace like conformations are found. In the opposite limit of high polymer density, which is equivalent to strongly screened electrostatic interactions, we find that the chains are extremely collapsed; however, we observe no agglomeration or phase separation. The investigations show that the density of free charges is one of the relevant parameters that rules the …",Uwe Micka and Christian Holm and Kurt Kremer,254,12691947995751273754,Langmuir,12,4033-4044,American Chemical Society,"Strongly charged, flexible polyelectrolytes in poor solvents: molecular dynamics simulations",https://pubs.acs.org/doi/abs/10.1021/la981191a,15,1999
3028,"Starting out from a computer simulation of a rather simple bead spring model, where the parameters are determined from an atomistic model by a numerical renormalization procedure (preceeding paper), after long simulation runs the chemical details are reintroduced into the coarse‐grained chains. The resulting microscopic structure is compared to neutron scattering results. The procedure is tested for two different polycarbonate modifications.",W Tschöp and Kurt Kremer and O Hahn and Ja Batoulis and T Bürger,244,12941941728792405298,Acta Polymerica,2‐3,75-79,WILEY‐VCH Verlag GmbH,Simulation of polymer melts. II. From coarse‐grained models back to atomistic description,https://onlinelibrary.wiley.com/doi/abs/10.1002/(SICI)1521-4044(199802)49:2/3%3C75::AID-APOL75%3E3.0.CO;2-5,49,1998
3029,"We present the results of molecular dynamics simulations of very long model polymer chains analyzed by various experimentally relevant techniques. The segment motion of the chains is found to be in very good agreement with the reptation model. For comparison with experimental results we also calculated the plateau modulus G N 0 via stress-strain simulations. The predictions of the entanglement length N e from G N 0 and from the mean-square dispacement of the chain segments disagree by a factor of about 2.3 (2), indicating an error in the prefactor in the standard formula for G N 0 which is important for the analysis of many simulation results as well as the interpretation of experimental neutron spin echo (NSE) and NMR measurements. We explicitly show how recent NSE measurements are affected by this and some finite-size effects in the interpretation of the dynamic structure factor.",Mathias Pütz and Kurt Kremer and Gary S Grest,241,16635453264306561767,EPL (Europhysics Letters),6,735,IOP Publishing,What is the entanglement length in a polymer melt?,https://iopscience.iop.org/article/10.1209/epl/i2000-00212-8/meta,49,2000
3030,"We employ the inverse Boltzmann method to coarse-grain three commonly used three-site water models (TIP3P, SPC and SPC/E) where one molecule is replaced with one coarse-grained particle with isotropic two-body interactions only. The shape of the coarse-grained potentials is dominated by the ratio of two lengths, which can be rationalized by the geometric constraints of the water clusters. It is shown that for simple two-body potentials either the radial distribution function or the geometrical packing can be optimized. In a similar way, as needed for multiscale methods, either the pressure or the compressibility can be fitted to the all atom liquid. In total, a speed-up by a factor of about 50 in computational time can be reached by this coarse-graining procedure.",Han Wang and Christoph Junghans and Kurt Kremer,239,4756962528478091404,The European Physical Journal E,2,221-229,Springer-Verlag,Comparative atomistic and coarse-grained study of water: What do we lose by coarse-graining?,https://link.springer.com/content/pdf/10.1140/epje/i2008-10413-5.pdf,28,2009
3031,"Molecular dynamics simulations were conducted to investigate the structural properties of melts of nonconcatenated ring polymers and compared to melts of linear polymers. The longest rings were composed of N = 1600 monomers per chain which corresponds to roughly 57 entanglement lengths for comparable linear polymers. For the rings, the radius of gyration squared, ⟨Rg2⟩, was found to scale as N4/5 for an intermediate regime and N2/3 for the larger rings indicating an overall conformation of a crumpled globule. However, almost all beads of the rings are “surface beads” interacting with beads of other rings, a result also in agreement with a primitive path analysis performed in the next paper [J. D. Halverson, W. Lee, G. S. Grest, A. Y. Grosberg, and K. Kremer, J. Chem. Phys. 134, 204905 (2011)]10.1063/1.3587138. Details of the internal conformational properties of the ring and linear polymers as well as …",Jonathan D Halverson and Won Bo Lee and Gary S Grest and Alexander Y Grosberg and Kurt Kremer,226,11985428810543981689,The Journal of chemical physics,20,204904,American Institute of Physics,Molecular dynamics simulation study of nonconcatenated ring polymers in a melt. I. Statics,https://aip.scitation.org/doi/abs/10.1063/1.3587137,134,2011
3032,"The phase diagram of particles interacting through a repulsive screened Coulomb (Yukawa) potential has been calculated. Such interactions describe charge-stabilized colloidal suspensions and provide a potential of variable shape which can be used to test general ideas about phase transitions, including the phenomenological Hansen-Verlet and Lindemann rules. Competition between bcc and fcc solid phases was explored through calculations of the free-energy difference. For a range of screening lengths we found a transition from a low-temperature fcc phase to a high-temperature bcc phase.",Kurt Kremer and Mark O Robbins and Gary S Grest,218,7978254279965520778,Physical review letters,21,2694,American Physical Society,Phase diagram of Yukawa systems: model for charge-stabilized colloids,https://journals.aps.org/prl/abstract/10.1103/PhysRevLett.57.2694,57,1986
3033,"Similar to entangled ropes, polymer chains cannot slide through each other. These topological constraints, the so‐called entanglements, dominate the viscoelastic behavior of high‐molecular‐weight polymeric liquids. Tube models of polymer dynamics and rheology are based on the idea that entanglements confine a chain to small fluctuations around a primitive path which follows the coarse‐grained chain contour. To establish the microscopic foundation for these highly successful phenomenological models, we have recently introduced a method for identifying the primitive path mesh that characterizes the microscopic topological state of computer‐generated conformations of long‐chain polymer melts and solutions. Here we give a more detailed account of the algorithm and discuss several key aspects of the analysis that are pertinent for its successful use in analyzing the topology of the polymer configurations …",Sathish K Sukumaran and Gary S Grest and Kurt Kremer and Ralf Everaers,216,16220618784164947952,Journal of Polymer Science Part B: Polymer Physics,8,917-933,"Wiley Subscription Services, Inc., A Wiley Company",Identifying the primitive path mesh in entangled polymer liquids,https://onlinelibrary.wiley.com/doi/abs/10.1002/polb.20384,43,2005
3034,"A Monte Carlo study of self-avoiding walks on the diamond lattice is presented. This model incorporates some of the steric effects and short-range stiffness of real alkanes, and for a nearest-neighbour attractive interaction-epsilon is found to have a collapse transition at k B theta/epsilon= 2.25+ or-0.05. The behaviour of the chains in the vicinity of this theta-temperature is analysed with the help of recent'crossover scaling'theories. It is shown that for finite chain length N there is a rather broad theta-region where the chains' behaviour is quasi-ideal. The width of this region w theta behaves as omega 0 varies as N-1 2/, consistent with the blob picture. The peak of the specific heat occurs at the boundary between the theta-region and the region of collapsed chains. The authors also give rough estimates for the scaling functions describing the crossovers of the end-to-end distance and structure factor of the chains.",K Kremer and A Baumgartner and K Binder,210,16389656503673111005,Journal of Physics A: Mathematical and General,9,2879,IOP Publishing,Collapse transition and crossover scaling for self-avoiding walks on the diamond lattice,https://iopscience.iop.org/article/10.1088/0305-4470/15/9/036/meta,15,1982
3035,"A correlation is established between the molecular structure and charge mobility of discotic mesophases of hexabenzocoronene derivatives by combining electronic structure calculations, molecular dynamics, and kinetic Monte Carlo simulations. It is demonstrated that this multiscale approach can provide an accurate ab initio description of charge transport in organic materials.",James Kirkpatrick and Valentina Marcon and Jenny Nelson and Kurt Kremer and Denis Andrienko,207,10561133068844324754,Physical review letters,22,227402,American Physical Society,Charge mobility of discotic mesophases: A multiscale quantum and classical study,https://journals.aps.org/prl/abstract/10.1103/PhysRevLett.98.227402,98,2007
3036,"We present a detailed analysis of the properties of dense linear two-dimensional polymer chains. The systems are simulated by the recently developed bond fluctuation method. We investigate systems of up to 80% density. The chain length and densities considered cover the crossover from the expanded single chain limit to a dense polymer melt. The chains completely segregate and follow a power law of the chain extension< R2> N 2ν, N being the number of bonds of the chains and ν= 1/2. While for single two dimensional chains the Rouse modes are not eigenmodes they are eignemodes for the chains in a 2-d melt. Relaxation functions and mean square displacements display typical Rouse-like behavior, with the distinction, that the prefactors for the various relaxation processes differ.",I Carmesin and Kurt Kremer,199,12314824263882512454,Journal de Physique,10,915-932,Société Française de Physique,Static and dynamic properties of two-dimensional polymer melts,https://jphys.journaldephysique.org/articles/jphys/abs/1990/10/jphys_1990__51_10_915_0/jphys_1990__51_10_915_0.html,51,1990
3037,In this chapter we review recent advances which have been achieved in the theoretical description and understanding of polyelectrolyte solutions. We will discuss an improved density functional approach to go beyond mean-field theory for the cell model and an integral equation approach to describe stiff and flexible polyelectrolytes in good solvents and compare some of the results to computer simulations. Then we review some recent theoretical and numerical advances in the theory of poor solvent polyelectrolytes. At the end we show how to describe annealed polyelectrolytes in the bulk and discuss their adsorption properties.,Christian Holm and JF Joanny and Kurt Kremer and RR Netz and P Reineker and C Seidel and Thomas A Vilgis and RG Winkler,193,2948127490204367648,,,67-111,"Springer, Berlin, Heidelberg",Polyelectrolyte theory,https://link.springer.com/chapter/10.1007/b11349,,2004
3038,"A quantitative understanding and prediction of the dynamics of entangled polymer melts is a long-standing problem. In this work we present results about the dynamical and rheological properties of atactic polystyrene melts, obtained from a hierarchical approach that combines atomistic and coarse-grained dynamic simulations of unentangled and entangled systems. By comparing short chain atomistic and coarse-grained simulations, the time mapping constant is determined. Self-diffusion coefficients, after correcting for the chain end free volume effect, show a transition from Rouse to reptation-like behavior. In addition, the entanglement molecular weight is calculated through a primitive path analysis. All properties are compared to experimental data.",Vagelis A Harmandaris and Kurt Kremer,188,6678444261497764421,Macromolecules,3,791-802,American Chemical Society,Dynamics of polystyrene melts through hierarchical multiscale simulations,https://pubs.acs.org/doi/abs/10.1021/ma8018624,42,2009
3039,"The kinetics of end crosslinking a linear polymer melt and the dynamics of the resulting network is studied using molecular dynamics (MD) simulations. Starting from equilibrated melts of linear chains of length ranging from 1/3Ne to 3Ne, where Ne is the entanglement length, tetrafunctional crosslinkers are attached to a fraction x of the chain ends. When a free end comes within a short capture distance rx from an unsaturated crosslinker, the chain ends are attached. With a stoichmetric number x of crosslinkers, the long time kinetics for the number of free ends and the number of unsaturated crosslinkers decays as a power law in time t−a, with a≊0.5 for the present range of chain lengths. The resulting networks are then used to study the effect of entanglements on the motion of the crosslinks and the modulus of the network. Using a cluster search algorithm, the microscopic characteristics of the networks are determined …",Edgardo R Duering and Kurt Kremer and Gary S Grest,187,11143854979078819969,The Journal of chemical physics,9,8169-8192,American Institute of Physics,Structure and relaxation of end‐linked polymer networks,https://aip.scitation.org/doi/abs/10.1063/1.468202,101,1994
3040,"We review pro and contra of the hypothesis that generic polymer properties of topological constraints are behind many aspects of chromatin folding in eukaryotic cells. For that purpose, we review, first, recent theoretical and computational findings in polymer physics related to concentrated, topologically simple (unknotted and unlinked) chains or a system of chains. Second, we review recent experimental discoveries related to genome folding. Understanding in these fields is far from complete, but we show how looking at them in parallel sheds new light on both.",Jonathan D Halverson and Jan Smrek and Kurt Kremer and Alexander Y Grosberg,183,6689940518967946433,Reports on Progress in Physics,2,022601,IOP Publishing,From a melt of rings to chromosome territories: the role of topological constraints in genome folding,https://iopscience.iop.org/article/10.1088/0034-4885/77/2/022601/meta,77,2014
3041,"Molecular dynamics simulations were conducted to investigate the dynamic properties of melts of nonconcatenated ring polymers and compared to melts of linear polymers. The longest rings were composed of N = 1600 monomers per chain which corresponds to roughly 57 entanglement lengths for comparable linear polymers. The ring melts were found to diffuse faster than their linear counterparts, with both architectures approximately obeying a D ∼ N−2.4 scaling law for large N. The mean-square displacement of the center-of-mass of the rings follows a sub-diffusive behavior for times and distances beyond the ring extension ⟨Rg2⟩, neither compatible with the Rouse nor the reptation model. The rings relax stress much faster than linear polymers, and the zero-shear viscosity was found to vary as η0 ∼ N1.4 ± 0.2 which is much weaker than the N3.4 behavior of linear chains, not matching any commonly known …",Jonathan D Halverson and Won Bo Lee and Gary S Grest and Alexander Y Grosberg and Kurt Kremer,177,3746397321227182961,The Journal of chemical physics,20,204905,American Institute of Physics,Molecular dynamics simulation study of nonconcatenated ring polymers in a melt. II. Dynamics,https://aip.scitation.org/doi/abs/10.1063/1.3587138,134,2011
3042,"Topologically constrained molecular systems are relevant to many areas of physics and biology, from the collapse of a polymer gel to the existence of chromosome territories. As a model system for the study of such unusual interactions, we simulated melts of unconcatenated polymer rings, where topology directly influences not only dynamic properties, as is the case for linear chains, but also the statics. In order to access the relatively large chain lengths required to observe significant effects, we implemented an efficient, on-lattice Monte Carlo model allowing for fast relaxation thanks to non-local moves which randomly displace kinks along the polymer contour. The sufficiently long rings are shown to behave as compact objects, their size scaling as N 1/3 for large chain length N; this observation is supported by measurements of several other static properties. The entanglement length of the rings' linear counterparts …",Thomas Vettorel and Alexander Y Grosberg and Kurt Kremer,177,4686675504812623883,Physical biology,2,025013,IOP Publishing,Statistics of polymer rings in the melt: a numerical simulation study,https://iopscience.iop.org/article/10.1088/1478-3975/6/2/025013/meta,6,2009
3043,"Polymers are characterized by a broad range of length and time scales.[1, 2] For this reason the development of coarsegrained (CG) particle based models is an active research field. By using such methods the length and time scales accessible by simulations can be increased by several orders of magnitude.[3–5] A common approach to obtain CG molecular models is to merge groups of chemically connected atoms into ‘‘superatoms’’and deriving the effective, CG interaction potentials by averaging over the microscopic details of the atomistic models. Several different models and approaches have been proposed in the literature, varying in the degree of coarse-graining.[6–22] For this work, we follow an ansatz, where intramolecular and intermolecular interactions are treated separately.[6, 7, 12] In the past, this ansatz has proven to be rather robust and transferable. Moreover, a straightforward back-mapping …",Vagelis A Harmandaris and Dirk Reith and Nico FA Van der Vegt and Kurt Kremer,170,12238184262376714041,Macromolecular chemistry and physics,19‐20,2109-2120,WILEY‐VCH Verlag,Comparison Between Coarse‐Graining Models for Polymer Systems: Two Mapping Schemes for Polystyrene,https://onlinelibrary.wiley.com/doi/abs/10.1002/macp.200700245,208,2007
3044,"Water and alcohol, such as methanol or ethanol, are miscible and, individually, good solvents for poly (N-isopropylacrylamide)(PNIPAm), but this polymer precipitates in water–alcohol mixtures. The intriguing behaviour of solvent mixtures that cannot dissolve a given polymer or a given protein, while the same macromolecule dissolves well in each of the cosolvents, is called cononsolvency. It is a widespread phenomenon, relevant for many formulation steps in the physicochemical and pharmaceutical industry, that is usually explained by invoking specific chemical details of the mixtures: as such, it has so far eluded any generic explanation. Here, by using a combination of simulations and theory, we present a simple and universal treatment that requires only the preferential interaction of one of the cosolvents with the polymer. The results show striking quantitative agreement with experiments and chemically specific …",Debashish Mukherji and Carlos M Marques and Kurt Kremer,164,7579120185599915137,Nature communications,1,1-6,Nature Publishing Group,Polymer collapse in miscible good solvents is a generic phenomenon driven by preferential adsorption,https://www.nature.com/articles/ncomms5882,5,2014
