id,abstract,author,cites,cites_id,journal,number,pages,publisher,title,url,volume,year
3093,"where thenormalization is S (0)= Nb, and we calculate the spherically averaged quantity, S (q). In the range 2ir/R< q< 2x/6, whereR is the average end-to-end distance and b is the bond length, S (q) scales as q-1/"" for neutral polymers with/?~ Nb"". 1 The ideal chainand good solvent chain values of v are V2 and 0.588 («= 3/g), respectively. Scaling predictions for S (q) have been based on the picture that the polyelectrolyte’s structure is composed of rodlike segments which together form an ideal chain. 3-710 For wavevectors greaterthan the inverse segment length, or persistence length, Lp, 8-9 the form factor should scale as 1/q. For q< 2x/Lp, the ideal chain would yield v= V2. However, we have good solvent chains and should see v «3/5 at dilute densities and v= V2 for semidilute anddense solutions.We show our calculated S (q) spanning dilute and semidilute ranges for the 64 bead chains in Figure 1. For this …",Mark J Stevens and Kurt Kremer,84,10027543010030720339,Macromolecules,17,4717-4719,American Chemical Society,Form factor of salt-free linear polyelectrolytes,https://pubs.acs.org/doi/pdf/10.1021/ma00069a048,26,1993
3094,"We numerically analyze mesh entanglements in model polymer networks. We find G-G ph≊ 0.85 ρ ent k BT, where ρ ent is the entanglement density, G the shear modulus which was measured in extensive molecular dynamics simulations of stretched samples, and G ph the phantom model prediction for the equivalent system without topological constraints. A simple model calculation of the prefactor is in close agreement with the observed value.© 1996 The American Physical Society.",Ralf Everaers and Kurt Kremer,81,15717344818997783797,Physical Review E,1,R37,American Physical Society,Topological interactions in model polymer networks,https://journals.aps.org/pre/abstract/10.1103/PhysRevE.53.R37,53,1996
3095,"Revised Manuscript Received June 13, 1995 Introduction. The classical theories of rubber elasticity1-9 provide a simple and at least qualitatively successful explanation of the entropic elasticity of these materials. Their fundamental assumption is that (I) the elastic response of the network is composed of contribu-tions of the individual network strands, which may be treated as independent entropic springs. For moderate extensions these springs can be regarded as harmonic due to the Gaussian distribution of the end-to-end vector R of flexible polymers in a melt: p (xy¿)=() p (y) p (z)",Ralf Everaers and Kurt Kremer,81,4620926622410617576,Macromolecules,21,7291-7294,American Chemical Society,Test of the foundations of classical rubber elasticity,https://pubs.acs.org/doi/pdf/10.1021/ma00125a039,28,1995
3096,"We have conducted a triple-scale simulation of liquid water by concurrently coupling atomistic, mesoscopic, and continuum models of the liquid. The presented triple-scale hydrodynamic solver for molecular liquids enables the insertion of large molecules into the atomistic domain through a mesoscopic region. We show that the triple-scale scheme is robust against the details of the mesoscopic model owing to the conservation of linear momentum by the adaptive resolution forces. Our multiscale approach is designed for molecular simulations of open domains with relatively large molecules, either in the grand canonical ensemble or under nonequilibrium conditions.",Rafael Delgado-Buscalioni and Kurt Kremer and Matej Praprotnik,80,8502298681395542906,The Journal of chemical physics,24,244107,American Institute of Physics,Coupling atomistic and continuum hydrodynamics through a mesoscopic model: application to liquid water,https://aip.scitation.org/doi/abs/10.1063/1.3272265,131,2009
3097,"Using atomistic molecular dynamics simulations we study solid and liquid crystalline columnar discotic phases formed by alkyl-substituted hexabenzocoronene mesogens. Correlations between the molecular structure, packing, and dynamical properties of these materials are established.",Denis Andrienko and Valentina Marcon and Kurt Kremer,80,5853000648553953476,The Journal of chemical physics,12,124902,American Institute of Physics,Atomistic simulation of structure and dynamics of columnar phases of hexabenzocoronene derivatives,https://aip.scitation.org/doi/abs/10.1063/1.2354156,125,2006
3098,"We present a dual-resolution coarse-graining scheme for efficient molecular dynamics simulations of bisphenol-A-polycarbonate (BP− A− PC) liquids in contact with a (111) nickel surface. The essential feature of this model is the strong adsorption of phenoxy chain ends, and the absence of adsorption by other parts of the chains. Details of how phenoxy chain ends interact with the nickel surface were extracted from Car-Parrinello molecular dynamics calculations of adsorption of phenol on nickel. These calculations show that phenol adsorption on nickel is short ranged (< 3 Å) and strongly dependent on the C 1− C 4 orientation of the ring. The structure of BP− A− PC prevents internal phenylene groups from interacting with the surface, due to steric hindrances from the noninteracting isopropylidenes. These dependencies are incorporated in the coarse-grained model of the BP− A− PC chain by resolving chain …",Cameron F Abrams and Luigi Delle Site and Kurt Kremer,80,15530270085429336816,Physical Review E,2,021807,American Physical Society,Dual-resolution coarse-grained simulation of the bisphenol--polycarbonate/nickel interface,https://journals.aps.org/pre/abstract/10.1103/PhysRevE.67.021807,67,2003
3099,"We discuss the hydrodynamic radius RH of polymer chains in good solvent, and show that the leading order correction to the asymptotic law RH∝Nν (N degree of polymerization, ν≈0.59) is an “analytic” term of order N−(1−ν), which is directly related to the discretization of the chain into a finite number of beads. This result is further corroborated by exact calculations for Gaussian chains, and extensive numerical simulations of different models of good-solvent chains, where we find a value of 1.591±0.007 for the asymptotic universal ratio RG/RH, RG being the chain’s gyration radius. For Θ chains the data apparently extrapolate to RG/RH≈1.44, which is different from the Gaussian value 1.5045, but in accordance with previous simulations. We also show that the experimentally observed deviations of the initial decay rate in dynamic light scattering from the asymptotic Benmouna–Akcasu value can partly be …",Burkhard Dünweg and Dirk Reith and Martin Steinhauser and Kurt Kremer,80,7541719246820656087,The Journal of chemical physics,2,914-924,American Institute of Physics,Corrections to scaling in the hydrodynamic properties of dilute polymer solutions,https://aip.scitation.org/doi/abs/10.1063/1.1483296,117,2002
3100,We investigate spherical macroions in the strong Coulomb coupling regime within the primitive model in salt-free environment. We first show that the ground state of an isolated colloid is naturally overcharged by simple electrostatic arguments illustrated by the Gillespie rule. We furthermore demonstrate that in the strong Coulomb coupling this mechanism leads to ionized states and thus to long range attractions between like-charged spheres. We use molecular dynamics simulations to study in detail the counterion distribution for one and two highly charged colloids for the ground state as well as for finite temperatures. We compare our results in terms of a simple version of a Wigner crystal theory and find excellent qualitative and quantitative agreement.,René Messina and Christian Holm and Kurt Kremer,80,6546966244444432842,Physical Review E,2,021405,American Physical Society,Strong electrostatic interactions in spherical colloidal systems,https://journals.aps.org/pre/abstract/10.1103/PhysRevE.64.021405,64,2001
3101,"In the context of a few characteristic examples, the perspectives of computational materials science for polymeric systems are being discussed. The examples chosen cover the range from atomistic/quantum models to coarse grained bead spring polymer models.         Cartoon of the average chain conformations near the surface. Since the chains are relatively short and only the chain ends adsorb, there is no entanglement network, which would otherwise enhance the bulk adhesion to the surface. Black lines represent chains with both chain ends stuck to the surface, red lines represent chains with only one chain end stuck to the surface and the other in the bulk, and light blue lines represent chains in the bulk.29   ",Kurt Kremer,79,15285889922213407463,Macromolecular Chemistry and Physics,2,257-264,WILEY‐VCH Verlag,Computer simulations for macromolecular science,https://onlinelibrary.wiley.com/doi/abs/10.1002/macp.200290079,204,2003
3102,"Starting from equilibrated melts of linear polymerschains, we investigate the static properties of randomly cross-linked polymer networks. Distributions of strand length, dangling ends, and self-cross-links are investigated. We find that the distributions are well described by simple exponentials. We also study systems where the chain ends are cross-linked. Here also the distributions are very well described by a simple exponential, however, with a strongly enhanced probability for short and long strands between cross-links.",Gary S Grest and Kurt Kremer,78,16247964503865920524,Macromolecules,23,4994-5000,American Chemical Society,Statistical properties of random cross-linked rubbers,https://pubs.acs.org/doi/pdf/10.1021/ma00225a020,23,1990
3103,"Atomistic molecular dynamics simulations are performed to analyze the diffusion of phenol molecules in a bisphenol-A-polycarbonate melt in the zero concentration limit for the temperature range from 500 K to 640 K. The transition from a hopping diffusion to a continuous diffusion is observed. Visualization of the diffusion process reveals a strong coupling between the polymer dynamics, i.e., size and shape fluctuations of the pore space and the hopping of the penetrant. Proper equilibration of the melt has been ensured by application of a novel multiscale simulation approach.",Oliver Hahn and Damian A Mooney and Florian Müller-Plathe and Kurt Kremer,77,3362833600223478786,The Journal of chemical physics,13,6061-6068,American Institute of Physics,A new mechanism for penetrant diffusion in amorphous polymers: Molecular dynamics simulations of phenol diffusion in bisphenol-A-polycarbonate,https://aip.scitation.org/doi/abs/10.1063/1.479904,111,1999
3104,"The systematic exploration of chemical compound space holds many promises toward structure–function relationships and material design. In the context of computer simulations, progress is hampered by both the sheer number of compounds and the efforts associated with parametrizing a force field for every new molecule. A coarse-grained (CG) representation provides not only a reduced phase space but also a smaller number of compounds, due to the redundancy of CG representations mapping to the same structure. Though many CG models require the explicit force-field parametrization of a molecule with all others, others assume transferability by means of mixing rules, such as the Martini force field. To alleviate the burden associated with tedious parametrizations for each new compound, the present work aims at automating the mapping and parametrization of common small organic molecules for Martini …",Tristan Bereau and Kurt Kremer,76,14977165505804584263,Journal of chemical theory and computation,6,2783-2791,American Chemical Society,Automated parametrization of the coarse-grained Martini force field for small organic molecules,https://pubs.acs.org/doi/abs/10.1021/acs.jctc.5b00056,11,2015
3105,"Soft condensed matter, involving such diverse systems as synthetic or biological macromolecules to colloids, is a fast growing research area due to its scientific and technological relevance. Beyond scaling theories of simple model systems the dynamics and rheology of complex fluids have been extensively studied through various experimental techniques and computer simulations. While these techniques typically address a single dynamic quantity it is a challenge to develop simulation methodologies that can directly access different dynamic quantities as well as a broad range of length and time scales of specific systems. Here we present a hierarchical simulation approach to overcome these problems. We predict polymer dynamics over a broad spectrum of length and time scales ranging from segmental relaxation on the monomer level to long time chain diffusion. As an example we study various dynamical …",Vagelis A Harmandaris and Kurt Kremer,76,3380654597806123058,Soft Matter,20,3920-3926,Royal Society of Chemistry,Predicting polymer dynamics at multiple length and time scales,https://pubs.rsc.org/en/content/articlehtml/2009/sm/b905361a,5,2009
3106,"Combining atomistic molecular dynamic simulations, Marcus–Hush theory description of charge transport rates, and master equation description of charge dynamics, we correlate the temperature-driven change of the mesophase structure with the change of charge carrier mobilities in columnar phases of hexabenzocoronene derivatives. The time dependence of fluctuations in transfer integrals shows that static disorder is predominant in determining charge transport characteristics. Both site energies and transfer integrals are distributed because of disorder in the molecular arrangement. It is shown that the contributions to the site energies from polarization and electrostatic effects are of opposite sign for positive charges. We look at three mesophases of hexabenzocoronene: herringbone, discotic, and columnar disordered. All results are compared to time resolved microwave conductivity data and show excellent …",James Kirkpatrick and Valentina Marcon and Kurt Kremer and Jenny Nelson and Denis Andrienko,76,835195947752187172,The Journal of chemical physics,9,094506,American Institute of Physics,Columnar mesophases of hexabenzocoronene derivatives. II. Charge carrier mobility,https://aip.scitation.org/doi/abs/10.1063/1.2969764,129,2008
3107,"An all-atom force field for phenol is parameterized to replicate its pure liquid properties over a wide range of temperatures (333.15 to 523.15 K). Using molecular dynamics techniques, thermodynamic properties, such as liquid density and heat of vaporization, are shown to be in good agreement with available experimental data. Diffusion coefficients, evaluated from simple hydrodynamic theory (using experimental viscosities), show reasonable agreement with diffusion results from simulation. The liquid structure exhibits a preferential `T'-shape conformer about the O–H alcohol group. Where a `robust' force field is sought (e.g. one having a wide temperature range), a need for its careful parameterization is demonstrated.",DA Mooney and Florian Müller-Plathe and Kurt Kremer,75,16756224731564300021,Chemical physics letters,1-3,135-142,North-Holland,Simulation studies for liquid phenol: properties evaluated and tested over a range of temperatures,https://www.sciencedirect.com/science/article/pii/S0009261498008604,294,1998
3108,"Using scaling arguments, the equilibrium swelling behaviour of a cross-linked polyelectrolyte gel has been investigated by means of molecular-dynamics simulations of a coarse-grained model; a bead-spring defect-free network with diamond-like topology was considered at the θ-point and under good solvent conditions, where the counterions were treated explicitly. A multitude of systems covering the range between strongly and very weakly charged gels with network chains bearing N m= 39,..., 259 monomers each were examined for both solvent qualities. We compare the resulting structures with mechanical theories describing the swelling behaviour of such systems which, after taking charge renormalization into account, can then be successfully applied to our measured data.",Bernward A Mann and Ralf Everaers and Christian Holm and Kurt Kremer,74,12904325641919155896,EPL (Europhysics Letters),5,786,IOP Publishing,Scaling in polyelectrolyte networks,https://iopscience.iop.org/article/10.1209/epl/i2004-10121-x/meta,67,2004
3109,"We present the results of a combined experimental (neutron scattering) and theoretical (computer simulation) effort to investigate structural properties of polycarbonate melts and glasses in the wave vector regime of Q⩽2.2 Å−1. The experimental part consists of advanced spin polarized scattering experiments, allowing us to extract the coherent scattering for protonated and deuterated samples. The simulations employ recently developed novel mapping procedures, which allow us to efficiently equilibrate complex polymer melts, thereby reproducing the experiment in much closer detail than earlier attempts.",J Eilhard and A Zirkel and W Tschöp and O Hahn and Kurt Kremer and O Schärpf and D Richter and U Buchenau,74,383378917514884841,The Journal of chemical physics,3,1819-1830,American Institute of Physics,Spatial correlations in polycarbonates: Neutron scattering and simulation,https://aip.scitation.org/doi/abs/10.1063/1.477889,110,1999
3110,"We study the statistical mechanics of double-stranded semiflexible polymers using both analytical techniques and simulation. We find a transition at some finite temperature, from a type of short range order to a fundamentally different sort of short range order. In the high temperature regime, the two-point correlation functions of the object are identical to wormlike chains, while at low temperatures they are different due to a twist structure. In the low temperature phase, the polymers develop a kink-rod structure which could clarify some recent puzzling experiments on actin.",Tanniemola B Liverpool and Ramin Golestanian and Kurt Kremer,73,11945534037980162208,Physical review letters,2,405,American Physical Society,Statistical mechanics of double-stranded semiflexible polymers,https://journals.aps.org/prl/abstract/10.1103/PhysRevLett.80.405,80,1998
3111,"In the last few decades, computer simulations have become a fundamental tool in the field of soft matter science, allowing researchers to investigate the properties of a large variety of systems. Nonetheless, even the most powerful computational resources presently available are, in general, sufficient to simulate complex biomolecules only for a few nanoseconds. This limitation is often circumvented by using coarse-grained models, in which only a subset of the system’s degrees of freedom is retained; for an effective and insightful use of these simplified models; however, an appropriate parametrization of the interactions is of fundamental importance. Additionally, in many cases the removal of fine-grained details in a specific, small region of the system would destroy relevant features; such cases can be treated using dual-resolution simulation methods, where a subregion of the system is described with high resolution, and a coarse-grained representation is employed in the rest of the simulation domain. In this review we discuss the basic notions of coarse-graining theory, presenting the most common methodologies employed to build low-resolution descriptions of a system and putting particular emphasis on their similarities and differences. The AdResS and H-AdResS adaptive resolution simulation schemes are reported as examples of dual-resolution approaches, especially focusing in particular on their theoretical background. View Full-Text",Raffaello Potestio and Christine Peter and Kurt Kremer,72,5925821225183639914,,8,4199-4245,Multidisciplinary Digital Publishing Institute,Computer simulations of soft matter: Linking the scales,https://www.mdpi.com/1099-4300/16/8/4199,16,2014
3112,"The non-linear stress–strain relation for cross-linked polymer networks is studied using molecular dynamics simulations. Previously we demonstrated the importance of trapped entanglements in determining the elastic and relaxational properties of networks. Here, we present new results for the stress versus strain for both dry and swollen networks. Models which limit the fluctuations of the network strands like the tube model are shown to describe the stress for both elongation and compression. For swollen networks, the total modulus is found to decrease like (V0/V)2/3 and goes to the phantom model result only for short strand networks.",Gary S Grest and Mathias Pütz and Ralf Everaers and Kurt Kremer,72,15382032015392488936,Journal of non-crystalline solids,1-3,139-146,North-Holland,Stress–strain relation of entangled polymer networks,https://www.sciencedirect.com/science/article/pii/S0022309300002246,274,2000
3113,"The authors present a detailed statistical analysis of the Rosenbluth method (1955) of generating self-avoiding walks. This method became one of the standard methods for simulating long polymers. They show that this method, although very successful in yielding large samples, becomes exponentially poor with increasing chain length. This has to be taken into account for simulations and was not done yet. They describe a way to quantify the number of chains needed. However, when compared to direct simple sampling, the method still, carefully used, yields better results, especially in the vicinity of the theta point of polymers. Special care has to be taken for d= 2. Some extensions to improve the situation are also discussed.",Jannis Batoulis and Kurt Kremer,72,14521223395284565324,Journal of Physics A: Mathematical and General,1,127,IOP Publishing,Statistical properties of biased sampling methods for long polymer chains,https://iopscience.iop.org/article/10.1088/0305-4470/21/1/020/meta,21,1988
3114,"Complex soft matter systems can be efficiently studied with the help of adaptive resolution simulation methods, concurrently employing two levels of resolution in different regions of the simulation domain. The nonmatching properties of high-and low-resolution models, however, lead to thermodynamic imbalances between the system’s subdomains. Such inhomogeneities can be healed by appropriate compensation forces, whose calculation requires nontrivial iterative procedures. In this work we employ the recently developed Hamiltonian adaptive resolution simulation method to perform Monte Carlo simulations of a binary mixture, and propose an efficient scheme, based on Kirkwood thermodynamic integration, to regulate the thermodynamic balance of multicomponent systems.",Raffaello Potestio and Pep Espanol and Rafael Delgado-Buscalioni and Ralf Everaers and Kurt Kremer and Davide Donadio,71,15897407619403226874,Physical review letters,6,060601,American Physical Society,Monte Carlo adaptive resolution simulation of multicomponent molecular liquids,https://journals.aps.org/prl/abstract/10.1103/PhysRevLett.111.060601,111,2013
3115,"For the study of complex synthetic and biological molecular systems by computer simulations one is still restricted to simple model systems or by far too small time scales. To overcome this problem multiscale techniques are being developed. However, in almost all cases, the regions and molecules of different resolution are kept fixed and are not in equilibrium with each other. We here give a basic theoretical framework for an efficient and flexible coupling of the different regimes. The approach leads to a concept, which can be seen as a geometry-induced phase transition, and to a counterpart of the equipartition theorem for fractional degrees of freedom. This represents the initial step in developing a general theoretical framework for computer simulation methods applying simultaneously different levels of resolution.",Matej Praprotnik and Kurt Kremer and Luigi Delle Site,71,7579197170670076273,Physical Review E,1,017701,American Physical Society,Adaptive molecular resolution via a continuous change of the phase space dimensionality,https://journals.aps.org/pre/abstract/10.1103/PhysRevE.75.017701,75,2007
3116,"The kinetics of the end crosslinking process in linear-polymer melts is studied using molecular-dynamics simulations. Starting from an equilibrated melt, tetrafunctional crosslinkers are attached randomly to a fraction x of the chain ends. The system is then allowed to evolve. When a free end comes within a short reaction radius r x from an unsaturated crosslinker, the chain ends are attached. Two cases can be distinguished. In the first, with a stoichiometric number (x s= 1/4) of crosslinkers present, the time dependence of such quantities as the number of free ends and the number of unsaturated crosslinkers decays as a power law in time t-a with α≈ 0.5. However, for x≠ x s, the decay is significantly faster.",GS Grest and K Kremer and ER Duering,70,8236216566850131437,EPL (Europhysics Letters),3,195,IOP Publishing,Kinetics of end crosslinking in dense polymer melts,https://iopscience.iop.org/article/10.1209/0295-5075/19/3/008/meta,19,1992
