,Unnamed: 0,title,pub_year,author,volume,journal,number,pages,publisher,abstract,filled,author_pub_id,num_citations,pub_url,cites_id,citedby_url,author_id,eprint_url,got_citations,got_author_ids,author_ids
449,7215,Neurophysiological and epigenetic effects of physical exercise on the aging process,2011.0,Perla Kaliman and Marcelina Párrizas and Jaume F Lalanza and Antoni Camins and Rosa Maria Escorihuela and Mercè Pallàs,10.0,Ageing research reviews,4,475-486,Elsevier,Aging is a gradual process during which molecular and cellular processes deteriorate progressively. often leading to such pathological conditions as vascular and metabolic disorders and cognitive decline. Although the mechanisms of aging are not yet fully understood. inflammation. oxidative damage. mitochondrial dysfunction. functional alterations in specific neuronal circuits and a restricted degree of apoptosis are involved. Physical exercise improves the efficiency of the capillary system and increases the oxygen supply to the brain. thus enhancing metabolic activity and oxygen intake in neurons. and increases neurotrophin levels and resistance to stress. Regular exercise and an active lifestyle during adulthood have been associated with reduced risk and protective effects for mild cognitive impairment and Alzheimer's disease. Similarly. studies in animal models show that physical activity has positive …,True,rN2tDIgAAAAJ:5nxA0vEk-isC,120,https://www.sciencedirect.com/science/article/pii/S1568163711000468,7587335924806139132,/scholar?cites=7587335924806139132,,,0,1,None | jxFZ1-kAAAAJ | None | 0oZps-0AAAAJ | rN2tDIgAAAAJ | lcwElTEAAAAJ
450,7216,Environmental enrichment reverses the detrimental action of early inconsistent stimulation and increases the beneficial effects of postnatal handling on shuttlebox learning in …,1994.0,Rosa M Escorihuela and Adolf Tobeña and Albert Fernández-Teruel,61.0,Behavioural brain research,2,169-173,Elsevier,Certain types of environmental stimulation administered during critical periods of neural development can enduringly modify adult behavior. The present experiments show that postnatal handling of Sprague-Dawley rats (administered from postnatal days 1 to 22) and/or living in an enriched environment (EE; from weaning until the age of 100 days) clearly improved the ability to learn a two-way active avoidance task in adulthood. In addition the results demonstrated that postnatal inconsistent stimulation (from postnatal days 1 to 22) impaired avoidance acquisition in the same task. This detrimental effect of inconsistent stimulation was reversed by EE. Our findings provide evidence that different types of early experience can influence learning abilities in distinct directions and with different strenghts.,True,rN2tDIgAAAAJ:YsMSGLbcyi4C,118,https://www.sciencedirect.com/science/article/pii/0166432894901570,17131702099093598720,/scholar?cites=17131702099093598720,,,0,1,rN2tDIgAAAAJ | y9ickJoAAAAJ | 4Qa9JG4AAAAJ
451,7217,Behavior of the Roman/Verh high-and low-avoidance rat lines in anxiety tests: relationship with defecation and self-grooming,1995.0,P Ferré and A Fernández-Teruel and RM Escorihuela and P Driscoll and MG Corda and O Giorgi and A Tobena,58.0,Physiology & behavior,6,1209-1213,Elsevier,The Swiss sublines of Roman high- and low-avoidance (RHA/Verh and RLA/Verh) rats have been selected and bred for rapid (RHA/Verh) vs. extremely poor (RLA/Verh) acquisition of two-way active avoidance. Behavioral and physiological measures of emotionality. or reactivity to stress. appear to be among the most prominent characteristics differentiating both rat lines. The present study shows that RLA/Verh rats are more sensitive. as compared to their RHA/Verh counterparts. to the conflict involved in the shock-induced suppression of drinking paradigm. as well as in a hyponeophagia test. RLA/Verh rats also showed higher defecation values which were significantly correlated with the main hyponeophagia test variables. Likewise. self-grooming was more frequent in RLA/Verh rats than in their RHA/Verh counterparts and showed significant correlations with conflict-related behaviors (i.e.. latency to start eating …,True,rN2tDIgAAAAJ:_FxGoFyzp5QC,113,https://www.sciencedirect.com/science/article/pii/0031938495020683,13378419651899457294,/scholar?cites=13378419651899457294,,https://www.academia.edu/download/49660150/0031-9384_2895_2902068-320161017-23479-j3ckyq.pdf,0,1,Zpa72ZUAAAAJ | 4Qa9JG4AAAAJ | rN2tDIgAAAAJ | NvBJvGQAAAAJ | None | km328qkAAAAJ | y9ickJoAAAAJ
452,7218,Enduring effects of environmental enrichment from weaning to adulthood on pituitary-adrenal function. pre-pulse inhibition and learning in male and female rats,2009.0,Yolanda Peña and Margarita Prunell and David Rotllant and Antonio Armario and Rosa M Escorihuela,34.0,Psychoneuroendocrinology,9,1390-1404,Pergamon,Environmental enrichment (EE) increases stimulation and provides richer sensory. cognitive and motor opportunities through the interaction with the social and physical environment. EE produces a wide range of neuroanatomical. neurochemical and behavioural effects in several animal species. However. the effects of EE have mainly been studied shortly after the treatment. so its long-lasting effects remain to be elucidated. Thus. we studied in male and female Sprague–Dawley rats the enduring effects of EE on tasks that measured emotional reactivity. social exploration and memory. sensorimotor gating and learning. After weaning. rats reared in EE were housed in single-sex groups of 12–14 in enriched cages during 12 weeks. whereas control rats were housed in single-sex groups of 2–3 animals in standard cages. Then. all rats were housed in pairs and successively exposed to different tests between 4 and 60 …,True,rN2tDIgAAAAJ:0EnyYjriUFMC,103,https://www.sciencedirect.com/science/article/pii/S0306453009001450,14675643618706188679,/scholar?cites=14675643618706188679,,http://www.academia.edu/download/45741873/Enduring_effects_of_environmental_enrich20160518-25400-1lezmxy.pdf,0,1,OKN0g5gAAAAJ | None | P_aXCRwAAAAJ | 3FWCFIYAAAAJ | rN2tDIgAAAAJ
453,7219,Postnatal handling reduces emotionality ratings and accelerates two-way active avoidance in female rats,1995.0,Juan F Núñez and Pilar Ferré and Ernesto García and Rosa M Escorihuela and Alberto Fernández-Teruel and Adolf Tobeña,57.0,Physiology & behavior,5,831-835,Elsevier,The present study evaluated whether postnatal handling (PH; administered daily during the first 21 days of life) could reduce anxiety or emotional reactivity in tasks of either spontaneous or conditioned fear-related behavior. To this purpose control nonhandled and postnatally handled female rats were submitted to three different behavioral tests: an emotionality rating (ER) followed by an elevated plus-maze test of anxiety in one experiment. and an acquisition of two-way active (shuttlebox) avoidance under two different training conditions in a separate experiment. Significant effects of PH treatment appeared in the three testing situations. clearly indicating an important and enduring reduction of emotionality/anxiety in PH-treated rats. Of especial interest were the results of shuttlebox training: by shortening the conditioned stimulus (CS) and the intertrial interval (ITI) duration. avoidance acquisition was impaired as …,True,rN2tDIgAAAAJ:LkGwnXOMwfcC,99,https://www.sciencedirect.com/science/article/pii/003193849400308R,15258101533411958835,/scholar?cites=15258101533411958835,,https://www.academia.edu/download/49660153/0031-9384_2894_2900308-r20161017-6515-m9gzrq.pdf,0,1,ERdHWmYAAAAJ | qivqs9AAAAAJ | 3A8PfqoAAAAJ | rN2tDIgAAAAJ | 4Qa9JG4AAAAJ | y9ickJoAAAAJ
454,7220,Learned fear. emotional reactivity and fear of heights: a factor analytic map from a large F 2 intercross of Roman rat strains,2002.0,Raúl Aguilar and Luis Gil and Jonathan Flint and Jeffrey A Gray and Gerard R Dawson and Peter Driscoll and Lydia Giménez-Llort and Rosa M Escorihuela and Alberto Fernández-Teruel and Adolf Tobeña,57.0,Brain research bulletin,1,17-26,Elsevier,Anxiety-related behaviours were evaluated across various tests in a 800 F2-intercross of the Roman high- and low-avoidance inbred rats. These tests either evoke unlearned (open field [OF]; plus-maze [PM]; hole-board [HB]; spontaneous activity [A]; and acoustic startle reflex [ASR]) or learned (classical fear conditioning [CFC]; and shuttlebox avoidance conditioning [SAC]). anxious/fearful responses. Using factor analysis (oblique rotation). we obtained a six-fold solution with 14 variables derived from all tests. These six factors represented SAC. CFC. PM anxiety. PM and OF activity. ASR anxiety. plus a mixed whole of anxious and activity variables (from OF and A). respectively. In searching for a smaller number of meaningful factors. we applied a three-factor solution that coherently corresponded with differentiated facets of fearfulness. rather than with the tests. Results showed that (1) measures of SAC and CFC …,True,rN2tDIgAAAAJ:roLk4NBRz8UC,97,https://www.sciencedirect.com/science/article/pii/S0361923001006323,96314159099353005,/scholar?cites=96314159099353005,,http://www.academia.edu/download/48441603/Learned_fear_emotional_reactivity_and_fe20160830-5901-1n23dip.pdf,0,1,wW2xmi8AAAAJ | co3E0CAAAAAJ | wecM1PoAAAAJ | oWcp_oUAAAAJ | GPnC1cUAAAAJ | C3wwnGAAAAAJ | rmqrQecAAAAJ | rN2tDIgAAAAJ | 4Qa9JG4AAAAJ | y9ickJoAAAAJ
455,7221,Long-term treadmill exercise induces neuroprotective molecular changes in rat brain,2011.0,Sergi Bayod and Jaume Del Valle and Anna M Canudas and Jaume F Lalanza and Sandra Sanchez-Roigé and Antoni Camins and Rosa M Escorihuela and Merce Pallas,111.0,Journal of Applied Physiology,5,1380-1390,American Physiological Society,Exercise enhances general health. However. its effects on neurodegeneration are controversial. and the molecular pathways in the brain involved in this enhancement are poorly understood. Here. we examined the effect of long-term moderate treadmill training on adult male rat cortex and hippocampus to identify the cellular mechanisms behind the effects of exercise. We compared three animal groups: exercised (30 min/day. 12 m/min. 5 days/wk. 36 wk). handled but nonexercised (treadmill handling procedure. 0 m/min). and sedentary (nonhandled and nonexercised). Moderate long-term exercise induced an increase in IGF-1 levels and also in energy parameters. such as PGC-1α and the OXPHOS system. Moreover. the sirtuin 1 pathway was activated in both the exercised and nonexercised groups but not in sedentary rats. This induction could be a consequence of exercise as well as the handling procedure. To …,True,rN2tDIgAAAAJ:YOwf2qJgpHMC,95,https://journals.physiology.org/doi/abs/10.1152/japplphysiol.00425.2011,5733494307857413861,/scholar?cites=5733494307857413861,,https://journals.physiology.org/doi/full/10.1152/japplphysiol.00425.2011,0,1,MJaCId8AAAAJ | K5DuBJsAAAAJ | Sap_KCoAAAAJ | None | None | 0oZps-0AAAAJ | rN2tDIgAAAAJ | lcwElTEAAAAJ
456,7222,7. 8‐dihydroxyflavone. a TrkB receptor agonist. blocks long‐term spatial memory impairment caused by immobilization stress in rats,2012.0,Raül Andero and Núria Daviu and Rosa Maria Escorihuela and Roser Nadal and Antonio Armario,22.0,Hippocampus,3,399-408,Wiley Subscription Services. Inc.. A Wiley Company,Post‐traumatic stress disorder (PTSD) patients show cognitive deficits. but it is unclear whether these are a consequence of the pathology or a pre‐existing factor of vulnerability to PTSD. Animal models may help to demonstrate whether or not exposure to certain stressors can actually induce long‐lasting (LL; days) impairment of hippocampus‐dependent memory tasks and to characterize neurobiological mechanisms. Adult male rats were exposed to 2‐h immobilization on boards (IMO). a severe stressor. and spatial learning in the Morris water maze (MWM) was studied days later. Exposure to IMO did not modify learning or short‐term memory in the MWM when learning started 3 or 9 days after IMO. but stressed rats did show impaired long‐term memory at both times. in accordance with the severity of the stressor. New treatments to prevent PTSD symptoms are needed. Thus. considering the potential protective …,True,rN2tDIgAAAAJ:MXK_kJrjxJIC,94,https://onlinelibrary.wiley.com/doi/abs/10.1002/hipo.20906,17979149247332464234,/scholar?cites=17979149247332464234,,https://www.academia.edu/download/41460661/-dihydroxyflavone_a_TrkB_receptor_agonis20160122-21987-md76cz.pdf,0,1,ORHEFhUAAAAJ | None | rN2tDIgAAAAJ | rwh0NOUAAAAJ | 3FWCFIYAAAAJ
457,7223,Fearfulness and sex in F2 Roman rats: males display more fear though both sexes share the same fearfulness traits,2003.0,Raúl Aguilar and Luis Gil and Jeffrey A Gray and Peter Driscoll and Jonathan Flint and Gerard R Dawson and Lydia Giménez-Llort and Rosa M Escorihuela and Alberto Fernández-Teruel and Adolf Tobeña,78.0,Physiology & behavior,4,723-732,Elsevier,The pattern of sex differences in a large sample (about 400 for each sex) of F2-generation rats. derived from inbred Roman high- and low-avoidance strains differing in fearfulness and brain functioning. was investigated. We obtained measures from responses to a battery of novel/threatening tests [open field (OF). plus maze (PM). hole board (HB). activity (A). and acoustic startle reflex (ASR)] as well as learned fear paradigms [classical fear conditioning (CFC) and shuttlebox avoidance conditioning (SAC)]. The results showed that almost all behaviors assessed fit with a pattern of unidirectional sex effects characterized by male rats as being more fearful than females: males defecated more than females in the OF. PM. HB. ASR. and CFC; ambulated less in the OF. PM. A. and SAC; showed more self-grooming in PM and HB; explored the open arms of the PM and the holes of the HB less; displayed enhanced ASR; and …,True,rN2tDIgAAAAJ:hqOjcs7Dif8C,94,https://www.sciencedirect.com/science/article/pii/S003193840300043X,8048656432150717522,/scholar?cites=8048656432150717522,,http://www.academia.edu/download/48441598/Fearfulness_and_sex_in_F2_Roman_rats_Mal20160830-6229-cwl9y2.pdf,0,1,wW2xmi8AAAAJ | co3E0CAAAAAJ | oWcp_oUAAAAJ | C3wwnGAAAAAJ | wecM1PoAAAAJ | GPnC1cUAAAAJ | rmqrQecAAAAJ | rN2tDIgAAAAJ | 4Qa9JG4AAAAJ | y9ickJoAAAAJ
458,7224,Effects of training. early handling. and perinatal flumazenil on shuttle box acquisition in Roman low-avoidance rats: toward overcoming a genetic deficit,1995.0,RM Escorihuela and A Tobena and P Driscoll and A Fernández-Teruel,19.0,Neuroscience & Biobehavioral Reviews,3,353-367,Pergamon,The present series of studies investigated the effects of intensive training. postnatal handling-stimulation and/or perinatal flumazenil (Ro 15-1788. benzodiazepine receptor antagonist) on the acquisition of two-way active avoidance by Roman low-avoidance (RLA/Verh) rats. This rat line has been selectively bred for poor avoidance in the shuttle box. while their Roman high-avoidance counterparts (RHA/Verh) have been selectively bred for their extremely good performance in that task. In the first experiment. RLA/Verh rats submitted to a long and intensive training procedure (unlike those submitted to short training) were able to achieve a performance of 56% of avoidances per session. In the second experiment both postnatal handling and perinatal flumazenil treaments increased avoidance responding in another group of RLA/Verh rats tested at the age of 18 months. Finally. in the last experiment. the performance …,True,rN2tDIgAAAAJ:UebtZRa9Y70C,87,https://www.sciencedirect.com/science/article/pii/0149763494000512,18105915391362823056,/scholar?cites=18105915391362823056,,,0,1,rN2tDIgAAAAJ | y9ickJoAAAAJ | NvBJvGQAAAAJ | 4Qa9JG4AAAAJ
459,7225,Infantile (handling) stimulation and behavior in young Roman high-and low-avoidance rats,1991.0,A Fernandez-Teruel and RM Escorihuela and P Driscoll and A Tobena and K Bättig,50.0,Physiology & behavior,3,563-565,Elsevier,The effect of infantile handling stimulation on exploratory and emotional behavior of Roman high- and low-avoidance (RHA/Verh and RLA/ Verh) weanling rats was investigated. Postnatally handled and nonhandled. 4-week-old males and females from both psychogenetically selected lines were exposed to a hexagonal tunnel maze. including an illuminated central arena. Postnatal handling increased exploratory behavior and decreased emotional reactivity as expressed by increased entries into the central arena and a reduction in defecations in both lines of rats. These effects were more pronounced in the RLA/Verh rats. In agreement with earlier studies using nonselected adult rats. the females of both lines (especially those from the RHA/Verh line) were more sensitive than males to the positive influences of early stimulation.,True,rN2tDIgAAAAJ:Se3iqnhoufwC,85,https://www.sciencedirect.com/science/article/pii/003193849190546Z,13724243076699316193,/scholar?cites=13724243076699316193,,,0,1,4Qa9JG4AAAAJ | rN2tDIgAAAAJ | NvBJvGQAAAAJ | y9ickJoAAAAJ | Nxyr0WYAAAAJ
460,7226,Environmental enrichment effects in social investigation in rats are gender dependent,2006.0,Yolanda Pena and Margarita Prunell and Vagelis Dimitsantos and Roser Nadal and Rosa M Escorihuela,174.0,Behavioural brain research,1,181-187,Elsevier,Environmental enrichment (E) can change neuronal structure. improves learning in various tasks and increases cerebral plasticity. However. no E effects were found in a test measuring social olfactory discrimination memory and. although they have been mainly measured in males. gender differences have been reported in other tests. The aims of the present study were to evaluate gender differential effects of E in the social discrimination paradigm which also involves social olfactory discrimination and in the elevated plus-maze test (EPM) for measuring anxiety. E procedure consisted of a combination of social and physical factors; groups of 11–12 Sprague–Dawley rats were separated by sex in large cages with physical stimulus for a period of 8 weeks starting immediately after weaning. Differential gender E effects appeared in the social exploratory patterns: enriched males showed increased exploratory …,True,rN2tDIgAAAAJ:KlAtU1dfN6UC,83,https://www.sciencedirect.com/science/article/pii/S0166432806003858,15952436647185930862,/scholar?cites=15952436647185930862,,,0,1,OKN0g5gAAAAJ | None | None | rwh0NOUAAAAJ | rN2tDIgAAAAJ
461,7227,Effects of a post-weaning cafeteria diet in young rats: Metabolic syndrome. reduced activity and low anxiety-like behaviour,2014.0,Jaume F Lalanza and Antoni Caimari and Josep M del Bas and Daniel Torregrosa and Igor Cigarroa and Mercè Pallàs and Lluís Capdevila and Lluís Arola and Rosa M Escorihuela,9.0,,1,e85049,,Among adolescents. overweight. obesity and metabolic syndrome are rapidly increasing in recent years as a consequence of unhealthy palatable diets. Animal models of diet-induced obesity have been developed. but little is known about the behavioural patterns produced by the consumption of such diets. The aim of the present study was to determine the behavioural and biochemical effects of a cafeteria diet fed to juvenile male and female rats. as well as to evaluate the possible recovery from these effects by administering standard feeding during the last week of the study. Two groups of male and female rats were fed with either a standard chow diet (ST) or a cafeteria (CAF) diet from weaning and for 8 weeks. A third group of males (CAF withdrawal) was fed with the CAF diet for 7 weeks and the ST in the 8th week. Both males and females developed metabolic syndrome as a consequence of the CAF feeding. showing overweight. higher adiposity and liver weight. increased plasma levels of glucose. insulin and triglycerides. as well as insulin resistance. in comparison with their respective controls. The CAF diet reduced motor activity in all behavioural tests. enhanced exploration. reduced anxiety-like behaviour and increased social interaction; this last effect was more pronounced in females than in males. When compared to animals only fed with a CAF diet. CAF withdrawal increased anxiety in the open field. slightly decreased body weight. and completely recovered the liver weight. insulin sensitivity and the standard levels of glucose. insulin and triglycerides in plasma. In conclusion. a CAF diet fed to young animals for 8 weeks induced …,True,rN2tDIgAAAAJ:_Qo2XoVZTnwC,70,https://journals.plos.org/plosone/article?id=10.1371/journal.pone.0085049,2947880192667383183,/scholar?cites=2947880192667383183,,https://journals.plos.org/plosone/article?id=10.1371/journal.pone.0085049,0,1,None | None | 6P7NNOoAAAAJ | ZHU6W5oAAAAJ | 92jAdf4AAAAJ | lcwElTEAAAAJ | 9KtKK0QAAAAJ | FrYVBnQAAAAJ | rN2tDIgAAAAJ
462,7228,Litter size affects emotionality in adult male rats,2007.0,E Dimitsantos and RM Escorihuela and S Fuentes and A Armario and R Nadal,92.0,Physiology & behavior,4,708-716,Elsevier,The role of natural variations in pre-weaning litter size in rodent adult emotionality and the importance of maternal care as a possible mediating factor have been frequently neglected. To address these issues. maternal behaviour of Sprague–Dawley dams differing in natural number of pups was studied for the first seven postnatal days. Later. adult behaviour of representative male offspring was studied in the elevated plus-maze. the circular corridor. the dark–light box and the forced swimming test. Three groups of offspring were selected in function of the number of littermates: L < 10 group (less than 10 pups per dam). L10–15 (between 10 and 15 pups per dam) and L > 15 group (more than 15 pups per dam). L < 10 litters showed a reduced habituation of activity across time in a circular corridor and as compared to L > 15 litters. L < 10 litters showed a lower activity during the first 5 min of exposure to the circular …,True,rN2tDIgAAAAJ:_kc_bZDykSQC,70,https://www.sciencedirect.com/science/article/pii/S0031938407002405,8257580699140464774,/scholar?cites=8257580699140464774,,https://www.researchgate.net/profile/Rosa_Escorihuela/publication/234072321_Dimitsantos_Escorihuela_et_al_2007/links/09e4150ed3db67e4f3000000/Dimitsantos-Escorihuela-et-al-2007.pdf,0,1,None | rN2tDIgAAAAJ | s-_UnaYAAAAJ | 3FWCFIYAAAAJ | Ee1X3AYAAAAJ
463,7229,Long-term behavioural and neuroendocrine changes in Roman high-(RHA/Verh) and low-(RLA-Verh) avoidance rats following neonatal handling,1998.0,Thierry Steimer and RM Escorihuela and A Fernandez-Teruel and P Driscoll,16.0,International Journal of Developmental Neuroscience,3,165-174,Pergamon,Roman high-(RHA/Verh) and low-(RLA/Verh) avoidance rats. originally selected and bred for rapid vs poor acquisition of a two-way active avoidance response. differ in emotional reactivity and coping style. These differences are associated with particular neuroendocrine and neurochemical characteristics. New data are presented here to show that the behavioural changes specifically induced by neonatal handling. i.e. decreased emotional reactivity. are associated with marked changes in the neuroendocrine responses of (hyperemotional) RLA/Verh rats to a novel environment. Eight months after neonatal handling. self-grooming behaviour. a reliable marker of emotional reactivity in this line of rats. was significantly decreased in RLA/Verh rats. Defecation scores were also significantly reduced in both lines. Moreover. there was a significant reduction in prolactin and corticosterone release following exposure to a …,True,rN2tDIgAAAAJ:3fE2CSJIrl8C,68,https://www.sciencedirect.com/science/article/pii/S073657489800032X,6031410735838835106,/scholar?cites=6031410735838835106,,,0,1,None | rN2tDIgAAAAJ | 4Qa9JG4AAAAJ | NvBJvGQAAAAJ
464,7230,Early environmental stimulation produces long-lasting changes on β-adrenoceptor transduction system,1995.0,Rosa M Escorihuela and Alberto Fernandezteruel and Adolf Tobena and Nuria M Vivas and Frederic Marmol and Albert Badia and Mara Dierssen,64.0,Neurobiology of learning and memory,1,49-57,Elsevier Inc.,Long-term behavioral and biochemical effects of exposure to differential early stimulation (postnatal handling and/or enriched environment) were studied in 18- to 20-month-old Sprague-Dawley rats. Postnatal handling treatment was given between 1 and 22 postnatal days. In the enriched environment procedure. the pups were maintained under enriched conditions from weaning until postnatal Day 100. At 18 months of age animals were tested for working memory in an object recognition test. based on the differential exploration of familiar and new objects. Animals reared in the enriched environment performed better in the working memory test than did control or postnatally handled rats. No interaction was observed between postnatal handling and environmental enrichment on cognitive parameters. At 20 months of age. the animals were sacrificed and cyclic AMP formation was determined under basal conditions …,True,rN2tDIgAAAAJ:kNdYIx-mwKoC,67,https://www.sciencedirect.com/science/article/pii/S107474278571043X,9282556776799699379,/scholar?cites=9282556776799699379,,https://www.academia.edu/download/48267736/nlme.1995.104320160823-15166-1bi089g.pdf,0,1,rN2tDIgAAAAJ | 4Qa9JG4AAAAJ | y9ickJoAAAAJ | None | None | None | dICEP-MAAAAJ
