,affiliation,email_domain,citedby,scholar_id,filled,interests,name,url_picture,citedby5y,hindex,hindex5y,i10index,i10index5y,got_publications,got_coauthors
188480,"Professor of Astrophysics, University of Ferrara",,42750,_9bItzkAAAAJ,{'indices'},,Piero Rosati,,14687,108,59,348,235,0,0
188481,Gemini Observatory,,29274,7w57_eQAAAAJ,{'indices'},,John P. Blakeslee,,8592,81,47,202,143,0,0
188482,"Professor of Physics and Astronomy, Michigan State University",,20502,FKIFfHYAAAAJ,{'indices'},,Megan Donahue,,8794,72,47,197,143,0,0
188483,"Ikerbasque Prof. of Astrophysics, University of the Basque Country",,27969,unjiYgQAAAAJ,{'indices'},,Tom Broadhurst,,8547,93,50,254,171,0,0
188484,Space Telescope Science Institute,,80262,mq6cQ3QAAAAJ,{'indices'},,Anton M. Koekemoer,,39310,149,99,592,514,0,0
188485,"PhD, Astronomy and Astrophysics, Ben-Gurion University",,9941,qAqDwFwAAAAJ,{'indices'},,Adi Zitrin,,7025,55,47,131,122,0,0
188486,"Institute of Astronomy and Astrophysics, Academia Sinica (ASIAA)",,10907,JHAdrV0AAAAJ,{'indices'},,Keiichi Umetsu (梅津敬一),,6417,56,43,148,125,0,0
188487,Princeton University,,6778,i2wUs3oAAAAJ,{'indices'},,Elinor Medezinski,,4657,47,37,64,61,0,0
188488,"Professor of Physics and Astronomy, Michigan State University",,11382,tbQptOgAAAAJ,{'indices'},,G. Mark Voit,,3780,58,34,110,75,0,0
188489,"Associate Research Professor of Astronomy, Research Scientist, NCSA, University of Illinois at",,19492,VA6vB64AAAAJ,{'indices'},,Felipe Menanteau,,12492,66,54,209,181,0,0
188490,"Winthrop Professor, International Centre for Radio Astronomy Research",,14244,F1cdALkAAAAJ,{'indices'},,Gerhardt Meurer,,3165,57,27,118,72,0,0
188491,Pennsylvania State University,,21156,m0BTROEAAAAJ,{'indices'},,Caryl Gronwall,,8092,62,37,163,101,0,0
188492,"Astronomical Survey Scientist, Edinburgh University",,22071,j9_1YSoAAAAJ,{'indices'},,Nicholas Cross,,9415,56,35,83,59,0,0
188493,Purdue University,,11177,OK6RNdcAAAAJ,{'indices'},,Wei Zheng,,4689,58,35,132,102,0,0
188494,,,7137,WtNfSiwAAAAJ,{'indices'},,Italo Balestra,,4817,48,41,98,89,0,0
188495,"Professor of Astronomy, University of Wisconsin-Madison",,23916,Ndhu3OEAAAAJ,{'indices'},,Alex Lazarian,,10342,83,53,309,227,0,0
188496,"Professor of Statistics, University of Wisconsin-Madison",,50520,2lPABNoAAAAJ,{'indices'},,Grace Wahba,,12246,73,32,156,81,0,0
188497,"Research Professor,  Theoretical Physics , Rome University, Sapienza",,2977,A4G84ZoAAAAJ,{'indices'},,Daniele Fargion,,505,25,12,66,13,0,0
188498,"Full Professor, Physics Department, ""Sapienza"" University of Roma, Italy",,16102,KS1VFqgAAAAJ,{'indices'},,Antonio Capone,,7133,68,38,179,101,0,0
188499,Pennsylvannia State University,,624,pvpaACQAAAAJ,{'indices'},,Craig C. Price,,367,6,6,6,6,0,0
188500,"University of Arizona, Columbia University, University Of Sydney",,6615,d67_2YcAAAAJ,{'indices'},,Sanjib Sharma,,5029,41,35,73,70,0,0
188501,Gemini Observatory,,1350,2EFYfNsAAAAJ,{'indices'},,Blair Conn,,903,25,18,31,24,0,0
188502,"Director General of the Research Centre for Astronomy and Earth Sciences, Hungarian Academy of",,9382,Ck4Nr_4AAAAJ,{'indices'},,Laszlo Kiss,,3702,49,29,179,108,0,0
188503,"Department of Statistics, The University of Auckland, New Zealand",,3018,4WVfFAoAAAAJ,{'indices'},,Brendon J. Brewer,,1944,32,23,53,44,0,0
188504,"A/Professor, Universidad Autonoma de Madrid",,8702,L-akd6cAAAAJ,{'indices'},,Alexander Knebe,,4613,50,34,129,95,0,0
188505,"Dr, Cambridge University",,32619,tK50i4oAAAAJ,{'indices'},,Vasily Belokurov,,17557,78,62,197,183,0,0
188506,University of Sydney,,24994,O81FAcMAAAAJ,{'indices'},,Tim Bedding,,11481,86,61,281,200,0,0
188507,"Director, E.A. Milne Centre for Astrophysics, University of Hull",,33444,VAL5UkEAAAAJ,{'indices'},,Brad K. Gibson,,10944,88,52,303,193,0,0
188508,ESO Director for Science,,71915,ASAI6foAAAAJ,{'indices'},,Rob Ivison,,28017,143,86,609,456,0,0
188509,Sternberg Astronomical Institute,,542,Gh_yrJoAAAAJ,{'indices'},,Artem Tuntsov,,384,13,9,13,9,0,0
188510,Associate Professor / SAIL Labs / Institute of Photonics and Optical Science / University of Sydney,,7175,NOM2YOMAAAAJ,{'indices'},,Sergio G. Leon-Saval,,3874,42,31,90,71,0,0
188511,The University of Toronto,,30408,m3bGDBYAAAAJ,{'indices'},,Bryan Gaensler,,15253,88,56,396,286,0,0
188512,"Instituto de Astrofísica de Canarias, Universidad de La Laguna",,8953,jcv3yCAAAAAJ,{'indices'},,Chris Brook,,4624,47,37,78,68,0,0
188513,"Professor of Astronomy, Yale University",,24182,9PdkBaoAAAAJ,{'indices'},,Frank van den Bosch,,9795,86,56,171,150,0,0
188514,Associate Professor. Curtin University,,12429,QY_p13gAAAAJ,{'indices'},,Randall Wayth,,9626,51,45,141,123,0,0
188515,Western Sydney University,,833,8K-JTZIAAAAJ,{'indices'},,X. Rosalind Wang,,506,14,11,18,13,0,0
188516,"Laboratoire d'Astrophysique, EPFL",,68621,EDaYupAAAAAJ,{'indices'},,Jean-Paul KNEIB,,30021,126,76,476,342,0,0
188517,"Principal Professional Staff, Applied Physics Laboratory",,22575,8C6TTR8AAAAJ,{'indices'},,Scott Murchie,,8929,83,48,240,159,0,0
188518,"Distinguished Professor of Geosciences, SUNY Stony Brook",,56512,AYFwijsAAAAJ,{'indices'},,Scott M. McLennan,,21896,92,58,204,159,0,0
188519,"Goddard Space Flight Center, emerita",,11678,Sn2eRiMAAAAJ,{'indices'},,Lucy McFadden,,4080,61,32,128,79,0,0
188520,"Professor of Biology, Harvard University",,54945,F6mLNzoAAAAJ,{'indices'},,Andrew H Knoll,,18119,127,74,342,261,0,0
188521,Space Science Institute,,15473,I8NUXKQAAAAJ,{'indices'},,Mark T. Lemmon,,7324,66,46,132,104,0,0
188522,"Senior Scientist, Dept. of Space Studies, Southwest Research Inst.",,20632,0iooKdwAAAAJ,{'indices'},,Clark R. Chapman,,4106,80,33,237,111,0,0
188523,Western Washington University,,4339,rixGXz8AAAAJ,{'indices'},,Melissa Rice,,3303,31,28,48,44,0,0
188524,Google Brain,,7927,-3zYIjQAAAAJ,{'indices'},,Jascha Sohl-Dickstein,,6459,37,34,59,55,0,0
188525,"Associate Professor of Astronomy, Cornell University",,11464,Ld5qY6IAAAAJ,{'indices'},,Alexander Hayes,,6880,53,42,124,113,0,0
188526,Malin Space Science Systems,,14399,n0lthGEAAAAJ,{'indices'},,Kenneth S. Edgett,,6891,55,42,123,85,0,0
188527,"Earth, Atmospheric, and Planetary Sciences, Purdue University",,1103,FzghC1EAAAAJ,{'indices'},,Briony Horgan,,888,16,15,22,21,0,0
188528,"Principal Research Scientist, Toyota Motor North America",,10497,Kg7xqnQAAAAJ,{'indices'},,Miles J. Johnson,,2680,54,26,154,75,0,0
188529,"Professor of Planetary Science, Caltech",,13999,lW18W_UAAAAJ,{'indices'},,Bethany L. Ehlmann,,8673,60,49,136,119,0,0
188530,"Latchmoor Services, LLC; Williamsburg, VA",,3584,jTYw2qkAAAAJ,{'indices'},,Brian T. Carcich,,1403,27,19,39,29,0,0
188531,University of Tennessee,,10645,bBvh6K4AAAAJ,{'indices'},,Jeffrey Moersch,,5016,45,32,89,61,0,0
188532,"Professor of Planetary Sciences, Washington University in St. louis",,9130,dEH4ZtIAAAAJ,{'indices'},,Alian Wang,,3410,50,32,126,83,0,0
188533,"Department of MIneral Sciences, National Museum of Natural History, Smithsonian Institution",,13997,19lQ_EoAAAAJ,{'indices'},,Timothy J McCoy,,5496,67,40,173,124,0,0
188534,Arizona State University,,14503,xUri77YAAAAJ,{'indices'},,Jack D. Farmer,,6864,63,45,122,89,0,0
188535,SETI Institute,,12341,T-QqQNQAAAAJ,{'indices'},,Janice L Bishop,,4783,53,32,143,95,0,0
188536,U.S. Geological Survey - Astrogeology Branch,,528,0ATuQv8AAAAJ,{'indices'},,Ryan B. Anderson,,292,8,7,8,7,0,0
188537,"Professor of Physics and Astronomy, University of Delaware",,27727,rGLuKDYAAAAJ,{'indices'},,John Gizis,,8822,62,35,122,79,0,0
188538,"Hunter College, CUNY; Center for Computational Astrophysics, Flatiron Institute",,10065,IH4YZaoAAAAJ,{'indices'},,Kelle Cruz,,5287,49,33,73,61,0,0
188539,American Museum of Natural History,,4415,TEw8EvwAAAAJ,{'indices'},,Jacqueline K Faherty,,3149,38,33,74,71,0,0
188540,Rider University,,27657,FajiwyIAAAAJ,{'indices'},,John Bochanski,,11402,52,37,82,70,0,0
188541,"Caltech, Institute for Astronomy, NYU",,3727,7ZME9csAAAAJ,{'indices'},,Dagny Looper,,1593,24,18,27,26,0,0
188542,American Museum of Natural History,,1256,cb3rppYAAAAJ,{'indices'},,Daniella Bardalez Gagliuffi,,1019,14,12,15,15,0,0
188543,NASA Ames Research Center,,25177,pVkgjqIAAAAJ,{'indices'},,Mark Marley,,11806,79,60,233,196,0,0
188544,"Professor of Physics and Astronomy, University of Toledo",,11323,2nR3tpUAAAAJ,{'indices'},,Michael Cushing,,4647,51,34,94,81,0,0
188545,The University of Arizona,,8975,2SCIYjIAAAAJ,{'indices'},,Daniel Apai,,5289,57,41,130,103,0,0
188546,"University of Liege, Belgium",,21672,wYhWmfsAAAAJ,{'indices'},,michael Gillon,,12687,81,56,269,241,0,0
188547,"Associate Professor of Astronomy, Boston University",,26462,aXABD4wAAAAJ,{'indices'},,Andrew A. West,,9422,64,38,123,101,0,0
188548,"Associate Professor, Western University, Canada",,4482,zIKqllEAAAAJ,{'indices'},,Stanimir Metchev,,3032,39,32,80,70,0,0
188549,University of Cambridge,,4311,-Xjd9pgAAAAJ,{'indices'},,L. Delrez,,4112,33,31,63,63,0,0
188550,Massachusetts Institute of Technology,,3500,0hZ7bFMAAAAJ,{'indices'},,Julien de Wit,,3293,21,21,26,26,0,0
188551,University of Bern,,9423,-klav54AAAAJ,{'indices'},,Brice-Olivier Demory,,6208,48,40,72,69,0,0
188552,UNSW Sydney,,17486,xscoItwAAAAJ,{'indices'},,Chris Tinney,,5019,72,34,197,134,0,0
188553,University of Liege,,5852,HOxieOkAAAAJ,{'indices'},,Valerie Van Grootel,,4545,38,31,59,51,0,0
188554,"Banting Postdoctoral Researcher, Institute for Research on Exoplanets, Université de Montréal",,2893,hmVdLH8AAAAJ,{'indices'},,Jonathan Gagné,,2429,28,27,52,52,0,0
188555,"Professor of Planetary Astronomy, California Institute of Technology",,34620,6Z9Fo7sAAAAJ,{'indices'},,Michael E. Brown,,12047,85,49,569,308,0,0
188556,,,5640,3mZOmO4AAAAJ,{'indices'},,Étienne Artigau,,3511,36,28,76,63,0,0
188557,"Associate professor of Astrophysics, Milan University",,7737,yQQ5hi4AAAAJ,{'indices'},,Marco Lombardi,,3579,48,34,104,78,0,0
188558,Smithsonian Astrophysical Observatory,,5585,3FJpMmMAAAAJ,{'indices'},,August Muench,,1147,35,19,45,37,0,0
188559,CENTRA/SIM & FEUP,,812,GBSKaIUAAAAJ,{'indices'},,Joana Ascenso,,384,13,12,14,13,0,0
188560,"Investigador Titular, Instituto de Astronomía, Universidad Nacional Autónoma de México",,3843,A49XqFYAAAAJ,{'indices'},,Carlos G. Román-Zúñiga,,2969,27,20,52,43,0,0
188561,University of Bordeaux,,12453,7dUdu90AAAAJ,{'indices'},,Herve Bouy,,9731,48,34,124,90,0,0
188562,Harvard-Smithsonian Center for Astrophysics,,12984,0LoCGasAAAAJ,{'indices'},,Alyssa Goodman,,4831,64,40,137,106,0,0
188563,Max Planck Institute for Astronomy,,20315,wPxAfh8AAAAJ,{'indices'},,Wolfgang Brandner,,8275,77,42,300,182,0,0
188564,CAB,,4993,gw2cQf8AAAAJ,{'indices'},,Nuria Huelamo,,2310,37,22,78,47,0,0
188565,Chalmers University of Technology,,2733,lxmSu2EAAAAJ,{'indices'},,Jouni Kainulainen,,1826,28,24,53,44,0,0
188566,University of Lisbon,,12738,kok7YX8AAAAJ,{'indices'},,Andre Moitinho,,10751,34,28,61,39,0,0
188567,"Research Fellow, School of Physics and Astronomy, University of St Andrews",,1975,yn2hPmEAAAAJ,{'indices'},,Paula Stella Teixeira,,1238,22,17,31,24,0,0
188568,ESO/INAF,,34772,Pzni2ZwAAAAJ,{'indices'},,Leonardo Testi,,17309,100,72,383,301,0,0
188569,Harvard-Smithsonian Center fot Astrophysics,,7506,QwcUxx0AAAAJ,{'indices'},,Scott J. Wolk,,2675,47,27,131,79,0,0
188570,"Institut de Ciències de l'Espai, CSIC - IEEC",,4994,3SmUurEAAAAJ,{'indices'},,Josep Miquel Girart,,2612,39,30,106,72,0,0
188571,Leiden University,,2322,5qwYyFUAAAAJ,{'indices'},,Yanett Contreras,,1787,25,24,33,32,0,0
188572,Max-Planck-Institut für extraterrestrische Physik,,6378,gxrN7gsAAAAJ,{'indices'},,Jaime E Pineda,,4083,40,36,91,89,0,0
188573,Professor Catedrático de Física na Faculdade de Ciências da Universidade de Lisboa,,160523,OyztpoYAAAAJ,{'indices'},,Antonio Amorim,,100870,161,134,724,618,0,0
188574,"Faculdade de Ciências, Universidade Lisboa",,5018,JkBL7PUAAAAJ,{'indices'},,José Manuel Rebordão,,4232,15,12,29,13,0,0
188575,"Professor of Astronomy, University of Cambridge",,78761,mib23ysAAAAJ,{'indices'},,Robert Kennicutt,,23154,125,66,409,262,0,0
188576,Córdoba Astronomical Observatory - National Scientific and Technical Research Council (CONICET),,6602,wo5nbTgAAAAJ,{'indices'},,Damián Mast,,5297,42,39,64,59,0,0
188577,,,26510,Dn5GkcYAAAAJ,{'indices'},,Dennis Stello,,17795,86,71,217,194,0,0
188578,"Director General of the Research Centre for Astronomy and Earth Sciences, Hungarian Academy of",,9382,Ck4Nr_4AAAAJ,{'indices'},,Laszlo Kiss,,3702,49,29,179,108,0,0
188579,"Scientist at Service d'Astrophysique, CEA-Saclay, France",,25844,0UkfvvQAAAAJ,{'indices'},,Rafael A. Garcia,,14903,90,66,260,201,0,0
188580,University of Sydney,,6101,FxIBEicAAAAJ,{'indices'},,Tim White,,3810,39,34,63,58,0,0
188581,Professor of Astrophysics,,27765,quuaJowAAAAJ,{'indices'},,Conny Aerts,,16152,75,46,301,170,0,0
188582,"Professor of Astronomy, Yale University",,30252,1whFMuUAAAAJ,{'indices'},,Sarbani Basu,,13599,91,63,245,175,0,0
188583,"Whitaker Eminent Scholar, Florida Gulf Coast University",,7967,F6C-UZUAAAAJ,{'indices'},,Derek Buzasi,,3763,37,23,63,38,0,0
188584,University of Birmingham,,6606,D2-3_38AAAAJ,{'indices'},,Guy R. Davies,,5505,43,39,89,88,0,0
188585,Australian Astronomical Observatory,,5978,wOoGI-EAAAAJ,{'indices'},,Simon O'Toole,,2563,46,29,97,55,0,0
188586,Australian National University,,12304,M-v_xskAAAAJ,{'indices'},,Michael Ireland,,7220,60,43,200,176,0,0
188587,UNSW Sydney,,17486,xscoItwAAAAJ,{'indices'},,Chris Tinney,,5019,72,34,197,134,0,0
188588,University of sydney,,744,bEFvsrgAAAAJ,{'indices'},,Andrew Jacob,,164,17,8,19,6,0,0
188589,University of Sydney,,9478,BKPKyqsAAAAJ,{'indices'},,Peter Tuthill,,3618,57,29,158,108,0,0
188590,"School of Physics and Astronomy, University of Birmingham",,6301,5irviAcAAAAJ,{'indices'},,Mikkel N. Lund,,4799,40,37,82,79,0,0
188591,ELTE Gothard Astrophysical Observatory,,2860,2CRAW_oAAAAJ,{'indices'},,Aliz Derekas,,1336,28,19,44,30,0,0
188592,Institute of Space Sciences (CSIC-IEEC),,15727,p7nVxaMAAAAJ,{'indices'},,Aldo Serenelli,,10499,65,52,130,113,0,0
188593,"School of Physics and Astronomy, University of Birmingham",,17932,byUN9YMAAAAJ,{'indices'},,andrea miglio,,11282,68,55,156,142,0,0
188594,Aarhus University,,8812,VB_SPPUAAAAJ,{'indices'},,Christoffer Karoff,,4717,51,38,86,69,0,0
188595,"Stellar Astrophysics Centre, Aarhus University",,7908,gwbCmhEAAAAJ,{'indices'},,Victor Silva Aguirre,,5352,47,39,58,56,0,0
188596,Universidade do Porto,,6114,qCm1FPoAAAAJ,{'indices'},,Margarida Cunha,,3152,38,24,78,54,0,0
188597,Los Alamos National Laboratory,,29387,ZZZorWwAAAAJ,{'indices'},,Chris Fryer,,16611,80,55,223,179,0,0
188598,University of Basel / University of Hertfordshire,,18165,26IdzZoAAAAJ,{'indices'},,Thomas Rauscher,,6337,64,37,237,156,0,0
188599,Monash University,,5992,KE8wgMgAAAAJ,{'indices'},,Bernhard Mueller,,3977,39,36,53,49,0,0
188600,Academia Sinica Institute of Astronomy and Astrophysics (ASIAA),,671,5vMfMbAAAAAJ,{'indices'},,Ke-Jung (Ken) Chen 陳科榮,,455,18,14,20,18,0,0
188601,University of Victoria,,12420,2xSNJXMAAAAJ,{'indices'},,Falk Herwig,,6113,55,40,118,92,0,0
188602,"Institut für Kernphysik (Theoriezentrum), Technische Universität Darmstadt",,18212,Y-WXXBYAAAAJ,{'indices'},,Gabriel Martínez Pinedo,,7449,69,45,182,132,0,0
188603,"Southern Utah University, Los Alamos National Laboratory",,1891,BVH-rEQAAAAJ,{'indices'},,Wesley Even,,1487,23,18,31,27,0,0
188604,Lawrence Berkeley National Laboratory,,6743,lW_gQD4AAAAJ,{'indices'},,Ann Almgren,,2696,40,29,83,57,0,0
188605,Professor of Stellar Hydrodynamics and Nuclear Astrophysics,,7433,XA_1Ll4AAAAJ,{'indices'},,Raphael Hirschi,,4427,42,35,81,69,0,0
188606,Lawrence Berkeley National Laboratory,,2499,3agMnKAAAAAJ,{'indices'},,Weiqun Zhang,,1107,22,20,28,23,0,0
188607,Michigan State University,,11221,Pqbd-pgAAAAJ,{'indices'},,Hendrik Schatz,,3908,53,33,143,94,0,0
188608,"Monash Centre for Astrophysics & School of Physics & Astronomy, Monash University",,5486,mtalbEYAAAAJ,{'indices'},,Duncan K. Galloway,,2392,40,22,89,55,0,0
188609,Clemson University,,20742,dJmVhRoAAAAJ,{'indices'},,Dieter Hartmann,,7749,63,37,213,110,0,0
188610,University of Minnesota,,8893,PzOAIxUAAAAJ,{'indices'},,Yongzhong Qian,,2863,45,24,81,47,0,0
188611,"Department of Physics, McGill University",,7809,pm8nD9EAAAAJ,{'indices'},,Andrew Cumming,,3125,47,31,91,76,0,0
188612,"Enrico Fermi Institute, Department of Physics, Department of Astronomy & Astrophysics, and Kavli",,55157,Yx4yXaUAAAAJ,{'indices'},,daniel holz,,49653,88,79,213,194,0,0
188613,New York University,,10454,sAKeesgAAAAJ,{'indices'},,Andrew MacFadyen,,4416,51,40,79,68,0,0
188614,"Professor, Arizona State University",,18654,7uliQmkAAAAJ,{'indices'},,Frank Timmes,,9973,53,39,115,90,0,0
188615,Bucknell University,,1897,DnledcwAAAAJ,{'indices'},,A. M. Amthor,,934,19,15,21,18,0,0
188616,"Prof. of theor. physics em., Univ. of Basel and guest scientist GSI Darmstadt",,31886,X0VuhZ0AAAAJ,{'indices'},,Friedrich-Karl Thielemann,,8905,96,50,220,147,0,0
188617,,,14439,J1wM5HsAAAAJ,{'indices'},,Michael Feast,,2232,64,24,212,59,0,0
188618,"professor of astronomy, university of arizona",,68010,zNS3o9QAAAAJ,{'indices'},,George Rieke,,15645,124,54,538,265,0,0
188619,Arizona State University,,7563,ZkfO3w8AAAAJ,{'indices'},,Paul Scowen,,1156,45,18,84,39,0,0
188620,University of Arizona,,13253,MeSeGd0AAAAJ,{'indices'},,Kate Y. L. Su,,3935,59,34,135,96,0,0
188621,"Directeur de Recherche, IPAG, Grenoble",,18314,YrvfjakAAAAJ,{'indices'},,Francois Menard,,9249,74,50,268,210,0,0
188622,"Astrophysicist, JPL/Caltech",,65942,QVbokjsAAAAJ,{'indices'},,Daniel Stern,,32019,116,78,567,475,0,0
188623,"School of Physics and Astronomy, Monash University",,17435,npUHvbwAAAAJ,{'indices'},,Michael J. I. Brown,,8557,71,52,181,142,0,0
188624,"Associate Professor, Department of Physics and Astronomy, UMKC",,21001,FnAGOfcAAAAJ,{'indices'},,Mark Brodwin,,10019,75,53,187,159,0,0
188625,California Institute of Technology,,45250,DXixPqAAAAAJ,{'indices'},,Lee Armus,,15048,104,61,327,234,0,0
188626,Smithsonian Astrophysical Observatory,,13768,i8CWFsEAAAAJ,{'indices'},,Paul J. Green,,7082,58,34,110,71,0,0
188627,"University of California, Berkeley",,22675,41aogyQAAAAJ,{'indices'},,James R. Graham,,7063,80,46,292,146,0,0
188628,"Senior Scientist, Lawrence Berkeley National Lab",,138257,-BynFYEAAAAJ,{'indices'},,David Schlegel,,51127,144,97,297,249,0,0
188629,Georgia Southern University,,9131,0fK27LcAAAAJ,{'indices'},,Sarah Unger Higdon,,1521,41,17,66,23,0,0
188630,"Associate professor, Astronomy, University of Massachusetts Amherst",,15298,n2wPj7AAAAAJ,{'indices'},,Alexandra Pope,,7093,53,34,94,83,0,0
188631,,,2308,qG8t5zcAAAAJ,{'indices'},,Greg Zeimann,,1543,28,25,42,39,0,0
188632,Smithsonian Astrophysical Observatory,,28951,E4cgK1cAAAAJ,{'indices'},,Alexey Vikhlinin,,9684,84,51,223,152,0,0
188633,"Professor of Extragalactic Astronomy, University of Edinburgh",,51390,Wf2ymHkAAAAJ,{'indices'},,James S. Dunlop,,23354,121,77,394,291,0,0
188634,"Professor of Physics and Astronomy, Dartmouth College",,9969,5vLfifMAAAAJ,{'indices'},,Ryan C. Hickox,,6165,56,46,115,107,0,0
188635,Physics & Astronomy University of Waterloo,,18686,n-qG5dMAAAAJ,{'indices'},,brian mcnamara,,6857,68,45,174,125,0,0
188636,"Giacconi Fellow, Space Telescope Science Institute",,6554,G4EGbXAAAAAJ,{'indices'},,Gregory F. Snyder,,5529,30,26,33,32,0,0
188637,"Professor of Astronomy, University of California, Berkeley",,164678,dTpeWooAAAAJ,{'indices'},,Alexei V. FILIPPENKO,,53510,168,91,820,600,0,0
188638,University of Arizona,,89757,QgINalAAAAAJ,{'indices'},,Xiaohui Fan,,33003,126,80,352,289,0,0
188639,"Professor of Physics and Astronomy, UCLA",,117943,0rlyyTwAAAAJ,{'indices'},,Edward L. Wright,,30392,105,57,302,183,0,0
188640,"Professor of Astrophysics, University of Ferrara",,42750,_9bItzkAAAAJ,{'indices'},,Piero Rosati,,14687,108,59,348,235,0,0
188641,"Australian National University, University of arizona",,3495,VE3bTBEAAAAJ,{'indices'},,Fuyan Bian,,2796,30,28,59,51,0,0
188642,"French Ministry for higher education, research and innovation (MESRI)",,6614,2r4gPcMAAAAJ,{'indices'},,Volker Beckmann,,2335,41,19,91,40,0,0
188643,Paul Scherrer Institut,,3367,l-kM4lwAAAAJ,{'indices'},,Hajdas,,1032,31,16,68,30,0,0
188644,University of Geneva,,9214,lvCGR7cAAAAJ,{'indices'},,Andrii Neronov,,4809,49,33,135,91,0,0
188645,"Professor für Astrophysik, Universität Tübingen",,15085,5xzLW2YAAAAJ,{'indices'},,Rüdiger Staubert,,3370,54,25,200,80,0,0
188646,Università Milano Bicocca,,10861,cA2FCtwAAAAJ,{'indices'},,Maurizio Acciarri,,1529,58,19,196,51,0,0
188647,"Department of Astronomy, University of Geneva",,18768,zKX4glYAAAAJ,{'indices'},,Stéphane Paltani,,9123,74,52,196,155,0,0
188648,European Space Agency,,7546,anjmlbwAAAAJ,{'indices'},,Peter Kretschmar,,3026,44,29,129,70,0,0
188649,University of Geneva,,4450,GGpxc4MAAAAJ,{'indices'},,Dominique Eckert,,3595,41,39,83,70,0,0
188650,Senior Scientist,,434,BYfyiaAAAAAJ,{'indices'},,Estela Suarez,,236,8,8,8,6,0,0
188651,"Researcher, National Institute of Astrophysics (INAF), Brera Astronomical Observatory",,10098,JEC4FlUAAAAJ,{'indices'},,Luigi Foschini,,3586,53,30,128,77,0,0
188652,University of Geneva,,6161,dYcBmSMAAAAJ,{'indices'},,Volodymyr Savchenko,,5854,21,20,31,27,0,0
188653,"electronics engineer, Paul Scherrer Institut",,398,Sk0i-FoAAAAJ,{'indices'},,Dominik Konrad Rybka,,172,13,7,13,6,0,0
188654,Senior Vice-President for Science USRA,,25935,xTRbIgIAAAAJ,{'indices'},,nicholas white,,4200,77,19,237,51,0,0
188655,University of Southampton,,17098,-_oIIwkAAAAJ,{'indices'},,Adam Hill,,8832,53,41,100,70,0,0
188656,"Professor of Astronomy, University of Erlangen-Nuremberg",,27487,04iI2fwAAAAJ,{'indices'},,Joern Wilms,,15703,81,57,368,293,0,0
188657,"Associate Professor in astrophysics, DTU Space",,9037,lBrPLoMAAAAJ,{'indices'},,Jérôme Chenevez,,6546,24,19,68,34,0,0
188658,"Professor of Astrophysics, University of Leicester",,38756,URDOw6oAAAAJ,{'indices'},,Paul T O'Brien,,16058,98,59,333,211,0,0
188659,Max-Planck-Institut für extraterrestrische Physik,,6757,eZy9F9UAAAAJ,{'indices'},,J. Michael Burgess,,4858,30,24,45,42,0,0
188660,"Professor of Physics, Trento University",,36226,KCOzcmMAAAAJ,{'indices'},,Roberto Battiston,,10070,83,41,285,100,0,0
188661,"ISDC, science data center for astrophysics, University of Geneva",,767,WdLwFfcAAAAJ,{'indices'},,lucia pavan,,468,13,9,13,8,0,0
188662,"Professor of Astrophysics, University of Massachusetts",,29252,jD_Kk-EAAAAJ,{'indices'},,Houjun Mo,,8962,78,46,178,130,0,0
188663,Max Planck Institute for Astrophysics,,201706,Gv-FkZ4AAAAJ,{'indices'},,Simon D M White,,78080,184,107,513,391,0,0
188664,"Professore Associato - Dipartimento di Fisica e Astronomia, Università di Padova",,15883,CaffyygAAAAJ,{'indices'},,Giuseppe (Bepi) Tormen,,4560,47,30,65,47,0,0
188665,"Professor, University of Sydney",,13642,i_ICwO0AAAAJ,{'indices'},,Tara Murphy,,6257,43,33,86,70,0,0
188666,"Curtin Research Fellow, Curtin University",,5857,cALpPZoAAAAJ,{'indices'},,Paul Hancock,,4942,29,28,63,61,0,0
188667,Dalhousie University,,41384,hvOg2xoAAAAJ,{'indices'},,Scott Chapman,,17893,112,72,375,292,0,0
188668,ESO APEX project scientist,,14719,P8SZawEAAAAJ,{'indices'},,Carlos De Breuck,,7435,68,47,191,151,0,0
188669,"Professor of Astrophysics, Universidad Diego Portales",,7072,cn9uqN4AAAAJ,{'indices'},,Manuel Aravena,,5389,49,43,107,100,0,0
188670,Stanford University,,3124,4tQoRHoAAAAJ,{'indices'},,Yashar Hezaveh,,2509,26,25,37,36,0,0
188671,"Reader in Astronomy, University College London",,13914,6wZebsUAAAAJ,{'indices'},,Thomas R. Greve,,6505,62,47,112,87,0,0
188672,Harvard-Smithsonian Center for Astrophysics,,1454,tXEl6DUAAAAJ,{'indices'},,Jingzhe Ma,,1352,19,18,24,24,0,0
188673,"Graduate Student, Astronomy Department, University of Illinois at Urbana-Champaign",,448,cYqPFzkAAAAJ,{'indices'},,Kedar Anil Phadke,,447,8,8,7,7,0,0
188674,University of British Columbia,,185831,WSR8vAgAAAAJ,{'indices'},,Douglas Scott,,78350,137,95,567,446,0,0
188675,"Research Professor, University of Chicago",,15509,JNJTwKgAAAAJ,{'indices'},,Tom Crawford,,8976,65,53,129,118,0,0
188676,NRAO,,20566,Erbg8TsAAAAJ,{'indices'},,Eric Murphy,,9987,75,52,183,163,0,0
188677,"Center for Computational Astrophysics, Flatiron Institute",,6607,Lp6RI3EAAAAJ,{'indices'},,Christopher C. Hayward,,5135,48,43,93,88,0,0
188678,"University of California, Davis",,14196,iUlPKN4AAAAJ,{'indices'},,Chris Fassnacht,,7007,62,43,162,117,0,0
188679,"Postdoctoral Researcher, University of Illinois at Urbana-Champaign",,4244,jUF1_AsAAAAJ,{'indices'},,Cassie Reuter,,4104,21,21,25,25,0,0
188680,"Associate Professor, Department of Physics and Astronomy, UMKC",,21001,FnAGOfcAAAAJ,{'indices'},,Mark Brodwin,,10019,75,53,187,159,0,0
188681,University of Chicago,,17731,9vfavVMAAAAJ,{'indices'},,Bradford Benson,,11295,68,57,162,148,0,0
188682,Argonne National Laboratory,,14660,bvpWO4AAAAAJ,{'indices'},,Lindsey Bleem,,8068,63,52,136,126,0,0
188683,University of Illinois at Urbana-Champaign,,17930,qg2R34AAAAAJ,{'indices'},,Gilbert Holder,,8564,71,52,148,118,0,0
188684,Virginia Tech,,24005,AIaDhRMAAAAJ,{'indices'},,Duncan Farrah,,11969,85,59,260,220,0,0
188685,"Physics and Astronomy, University of Pennsylvania",,9651,bnWdaogAAAAJ,{'indices'},,James Aguirre,,6003,49,40,105,91,0,0
188686,"Kavli Fellow, KIPAC, Stanford University",,8469,ivq_rJQAAAAJ,{'indices'},,marco viero,,4515,49,40,94,72,0,0
188687,"Dr, Cambridge University",,32619,tK50i4oAAAAJ,{'indices'},,Vasily Belokurov,,17557,78,62,197,183,0,0
188688,"Professor of Astrophysics, Cambridge University",,51883,HDBoqvYAAAAJ,{'indices'},,N.Wyn Evans,,22398,98,61,420,257,0,0
188689,Carnegie Mellon University,,10209,IcEsJfAAAAAJ,{'indices'},,Matthew G. Walker,,5881,55,44,83,80,0,0
188690,"Professor of Astronomy, University of Cambridge, UK",,75777,8OG1X14AAAAJ,{'indices'},,Richard McMahon,,28817,113,59,332,183,0,0
188691,Radboud University,,9428,2knqLpsAAAAJ,{'indices'},,Nadia Blagoródnova,,9277,35,35,55,55,0,0
