,title,pub_year,author,volume,journal,number,pages,publisher,abstract,filled,author_pub_id,num_citations,pub_url,cites_id,citedby_url,author_id,eprint_url,got_citations,got_author_ids,author_ids
1115333,Role of mineral aerosol as a reactive surface in the global troposphere,1996,Frank J Dentener and Gregory R Carmichael and Yang Zhang and Jos Lelieveld and Paul J Crutzen,101,Journal of Geophysical Research,D17,"22869-22,889",American Geophysical Union,A global three‐dimensional model of the troposphere is used to simulate the sources. abundances. and sinks of mineral aerosol and the species involved in the photochemical oxidant. nitrogen. and sulfur cycles. Although the calculated heterogeneous removal rates on mineral aerosol are highly uncertain. mainly due to poorly known heterogeneous reaction rates. the reaction of SO2 on calcium‐rich mineral aerosol is likely to play an important role downwind of arid source regions. This is especially important for regions in Asia. which are important and increasing emitters of sulfur compounds. Our results indicate that the assumption that sulfate aerosol follows an accumulation mode size distribution. is particularly in Asia likely to overestimate the sulfate aerosol climate‐cooling effect. An even larger fraction of gas phase nitric acid may be associated with and neutralized by mineral aerosol. Interactions of N2O5. O3 …,True,MHbvpzAAAAAJ:u-x6o8ySG0sC,1192,https://agupubs.onlinelibrary.wiley.com/doi/abs/10.1029/96JD01818,4784141303625438035,/scholar?cites=4784141303625438035,,https://www.academia.edu/download/47664122/Role_of_Mineral_Aerosol_as_a_Reactive_Su20160731-31419-260l4p.pdf,0,0,0
1115334,An overview of ACE-Asia: Strategies for quantifying the relationships between Asian aerosols and their climatic impacts: Characterization of Asian aerosols and their radiative …,2003,Barry J HUEBERT and Timothy Bates and Philip B Russell and SHI GUANGYU and Kimitaka KAWAMURA and Greg CARMICHAEL and Teruyuki NAKAJIMA,108,Journal of geophysical research,D23,ACE1. 1-ACE1. 20,American Geophysical Union,Sauf mention contraire ci-dessus. le contenu de cette notice bibliographique peut être utilisé dans le cadre d’une licence CC BY 4.0 Inist-CNRS/Unless otherwise stated above. the content of this bibliographic record may be used under a CC BY 4.0 licence by Inist-CNRS/A menos que se haya señalado antes. el contenido de este registro bibliográfico puede ser utilizado al amparo de una licencia CC BY 4.0 Inist-CNRS,True,MHbvpzAAAAAJ:geHnlv5EZngC,965,https://pascal-francis.inist.fr/vibad/index.php?action=getRecordDetail&idt=15437233,13239990042540561805,/scholar?cites=13239990042540561805,,,0,0,0
1115335,An overview of ACE-Asia: Strategies for quantifying the relationships between Asian aerosols and their climatic impacts,2003,Barry J Huebert and Timothy Bates and Philip B Russell and Guangyu Shi and Young Joon Kim and Kimitaka Kawamura and Greg Carmichael and Teruyuki Nakajima,108,Journal of Geophysical Research,D23,8633,American Geophysical Union,The International Global Atmospheric Chemistry Program (IGAC) has conducted a series of Aerosol Characterization Experiments (ACE) that integrate in situ measurements. satellite observations. and models to reduce the uncertainty in calculations of the climate forcing due to aerosol particles. ACE‐Asia. the fourth in this series of experiments. consisted of two focused components: (1) An intensive field study that sought to quantify the spatial and vertical distribution of aerosol concentrations and properties. the processes controlling their formation. evolution. and fate. and the column‐integrated radiative effect of the aerosol (late March through May 2001). (2) A longer‐term network of ground stations that used in situ and column‐integrated measurements to quantify the chemical. physical. and optical properties of aerosols in the ACE‐Asia study area and to assess their spatial and temporal (seasonal and …,True,MHbvpzAAAAAJ:d1gkVwhDpl0C,952,https://agupubs.onlinelibrary.wiley.com/doi/abs/10.1029/2003JD003550,13239990042540561805,/scholar?cites=13239990042540561805,,https://agupubs.onlinelibrary.wiley.com/doi/pdfdirect/10.1029/2003JD003550,0,0,0
1115336,Biomass burning in Asia: Annual and seasonal estimates and atmospheric emissions,2003,DG Streets and KF Yarber and J-H Woo and GR Carmichael,17,Global Biogeochemical Cycles,4,1099,American Geophysical Union,Estimates of biomass burning in Asia are developed to facilitate the modeling of Asian and global air quality. A survey of national. regional. and international publications on biomass burning is conducted to yield consensus estimates of “typical” (i.e.. non‐year‐specific) estimates of open burning (excluding biofuels). We conclude that 730 Tg of biomass are burned in a typical year from both anthropogenic and natural causes. Forest burning comprises 45% of the total. the burning of crop residues in the field comprises 34%. and 20% comes from the burning of grassland and savanna. China contributes 25% of the total. India 18%. Indonesia 13%. and Myanmar 8%. Regionally. forest burning in Southeast Asia dominates. National. annual totals are converted to daily and monthly estimates at 1° × 1° spatial resolution using distributions based on AVHRR fire counts for 1999–2000. Several adjustment schemes are …,True,MHbvpzAAAAAJ:Tyk-4Ss8FVUC,735,https://agupubs.onlinelibrary.wiley.com/doi/abs/10.1029/2003gb002040,1977707314696886546,/scholar?cites=1977707314696886546,,https://agupubs.onlinelibrary.wiley.com/doi/pdfdirect/10.1029/2003GB002040,0,0,0
1115337,Transport of Asian air pollution to North America,1999,Dan Jaffe and Theodore Anderson and Dave Covert and Robert Kotchenruther and Barbara Trost and Jen Danielson and William Simpson and Terje Berntsen and Sigrun Karlsdottir and Donald Blake and Joyce Harris and Greg Carmichael and Itsushi Uno,26,Geophysical Research Letters,6,711-714,,Using observations from the Cheeka Peak Observatory in northwestern Washington State during March‐April. 1997. we show that Asian anthropogenic emissions significantly impact the concentrations of a large number of atmospheric species in the air arriving to North America during spring. Isentropic back‐trajectories can be used to identify possible times when this impact will be felt. however trajectories alone are not sufficient to indicate the presence of Asian pollutants. Detailed chemical and meteorological data from one of these periods (March 29th. 1997) indicates that the surface emissions were lifted into the free troposphere over Asia and then transported to North America in ∼6 days.,True,MHbvpzAAAAAJ:2osOgNQ5qMEC,679,https://agupubs.onlinelibrary.wiley.com/doi/abs/10.1029/1999GL900100,12942966090273615705,/scholar?cites=12942966090273615705,,https://agupubs.onlinelibrary.wiley.com/doi/pdfdirect/10.1029/1999GL900100,0,0,0
1115338,Sulfur dioxide emissions in China and sulfur trends in East Asia since 2000,2010,Z Lu and DG Streets and Q Zhang and S Wang and GR Carmichael and YF Cheng and C Wei and M Chin and T Diehl and Q Tan,10,Atmospheric chemistry and physics,13,6311-6331,European Geophysical Society. Max-Planck-Str. 13 Katlenburg-Lindau Germany, With the rapid development of the economy. the sulfur dioxide (SO2) emission from China since 2000 is of increasing concern. In this study. we estimate the annual SO2 emission in China after 2000 using a technology-based methodology specifically for China. From 2000 to 2006. total SO2 emission in China increased by 53%. from 21.7 Tg to 33.2 Tg. at an annual growth rate of 7.3%. Emissions from power plants are the main sources of SO2 in China and they increased from 10.6 Tg to 18.6 Tg in the same period. Geographically. emission from north China increased by 85%. whereas that from the south increased by only 28%. The emission growth rate slowed around 2005. and emissions began to decrease after 2006 mainly due to the wide application of flue-gas desulfurization (FGD) devices in power plants in response to a new policy of China's government. This paper shows that the trend of estimated SO2 emission in China is consistent with the trends of SO2 concentration and acid rain pH and frequency in China. as well as with the increasing trends of background SO2 and sulfate concentration in East Asia. A longitudinal gradient in the percentage change of urban SO2 concentration in Japan is found during 2000–2007. indicating that the decrease of urban SO2 is lower in areas close to the Asian continent. This implies that the transport of increasing SO2 from the Asian continent partially counteracts the local reduction of SO2 emission downwind. The aerosol optical depth (AOD) products of Moderate Resolution Imaging Spectroradiometer (MODIS) are found to be highly correlated with the surface solar radiation (SSR) measurements in …,True,MHbvpzAAAAAJ:r0BpntZqJG4C,566,https://acp.copernicus.org/articles/10/6311/2010/,866125191248882542,/scholar?cites=866125191248882542,,https://acp.copernicus.org/articles/10/6311/2010/acp-10-6311-2010.pdf,0,0,0
1115339,Introduction to special section: Outstanding problems in quantifying the radiative impacts of mineral dust,2001,IN Sokolik and DM Winker and G Bergametti and DA Gillette and G Carmichael and YJ Kaufman and L Gomes and L Schuetz and JE Penner,106,Journal of Geophysical Research,D16,"18015-18,027",American Geophysical Union,This paper provides an introduction to the special section of the Journal of Geophysical Research on mineral dust. We briefly review the current experimental and theoretical approaches used to quantify the dust radiative impacts. highlight the outstanding issues. and discuss possible strategies to overcome the emerging problems. We also introduce the contributing papers of this special section. Despite the recent notable advances in dust studies. we demonstrate that the radiative effects of dust remain poorly quantified due to both limited data and incomplete understanding of relative physical and chemical processes. The foremost needs are (1) to quantify the spatial and temporal variations of dust burden in the atmosphere and develop a predictive capability for the size‐and composition‐resolved dust particle distribution;(2) to develop a quantitative description of the processes that control the spatial and temporal …,True,MHbvpzAAAAAJ:qjMakFHDy7sC,502,https://agupubs.onlinelibrary.wiley.com/doi/abs/10.1029/2000JD900498@10.1002/(ISSN)2169-8996.DUST1,17526767407303981938,/scholar?cites=17526767407303981938,,https://agupubs.onlinelibrary.wiley.com/doi/pdf/10.1029/2000JD900498%4010.1002/%28ISSN%292169-8996.DUST1,0,0,0
1115340,Size distributions and mixtures of dust and black carbon aerosol in Asian outflow: Physiochemistry and optical properties,2004,AD Clarke and Y Shinozuka and VN Kapustin and S Howell and B Huebert and S Doherty and T Anderson and D Covert and J Anderson and Xm Hua and KG Moore and C McNaughton and G Carmichael and R Weber,109,J. Geophys. Res,D15,1-20,,[1] During Transport and Chemical Evolution over the Pacific (TRACE‐P) and Asian Aerosol Characterization Experiment (ACE‐Asia) we measured the dry size distribution of Asian aerosols. their state of mixing. and the optical properties of dust. black carbon (BC) and other aerosol constituents in combustion and/or dust plumes. Optical particle sizing in association with thermal heating extracted volatile components and resolved sizes for dust and refractory soot that usually dominated light absorption. BC was internally mixed with volatile aerosol in∼ 85% of accumulation mode particles and constituted∼ 5–15% of their mass. These optically effective sizes constrained the soot and dust size distributions and the imaginary part of the dust refractive index. k. to 0.0006±0.0001. This implies a single‐scatter albedo. ϖ (550 nm). for dust ranging from 0.99+ for D p< 1 μm to∼ 0.90 at D p= 10 μm and a size‐integrated …,True,MHbvpzAAAAAJ:Y0pCki6q_DkC,422,https://agupubs.onlinelibrary.wiley.com/doi/abs/10.1029/2003JD004378@10.1002/(ISSN)2169-8996.TRACEP1,15259548915256264348,/scholar?cites=15259548915256264348,,https://agupubs.onlinelibrary.wiley.com/doi/full/10.1029/2003JD004378%4010.1002/%28ISSN%292169-8996.TRACEP1,0,0,0
1115341,Atmospheric brown clouds: Hemispherical and regional variations in long-range transport. absorption. and radiative forcing,2007,V Ramanathan and F Li and MV Ramana and PS Praveen and D Kim and CE Corrigan and H Nguyen and Elizabeth A Stone and James J Schauer and GR Carmichael and Bhupesh Adhikary and SC Yoon,112,Journal of Geophysical Research,D22,D22S21,American Geophysical Union,The study uses satellite observations. global assimilated aerosol data sets. Atmospheric Brown Clouds (ABC) observatories. a Monte Carlo aerosol‐cloud‐radiation model and a regional chemical transport model (STEM‐2K) to characterize the spatial extent of brown clouds. regional and megacity ABC hot spots. chemical composition and the direct radiative forcing. It presents the first annual cycle of aerosol observations and forcing from the ABC observatories in the Indo‐Asia‐Pacific regions. East Asia. Indo‐Gangetic Plains. Indonesian region. southern Africa and the Amazon basin are the regional hot spots defined by the criteria that anthropogenic aerosol optical depths (AODs) should exceed 0.3 and absorbing AOD > 0.03. Over these hot spots. as well as in other polluted oceanic regions. the EC mass exceeds 0.5 μg m−3. the OC mass exceeds 2 μg m−3 and sulfate mass exceeds 10 μg m−3 from the surface to …,True,MHbvpzAAAAAJ:ULOm3_A8WrAC,414,https://agupubs.onlinelibrary.wiley.com/doi/abs/10.1029/2006JD008124,14415809372303495835,/scholar?cites=14415809372303495835,,https://agupubs.onlinelibrary.wiley.com/doi/full/10.1029/2006JD008124,0,0,0
1115342,Multimodel estimates of intercontinental source-receptor relationships for ozone pollution,2009,AM Fiore and FJ Dentener and Oliver Wild and C Cuvelier and MG Schultz and P Hess and C Textor and M Schulz and RM Doherty and LW Horowitz and IA MacKenzie and MG Sanderson and DT Shindell and DS Stevenson and S Szopa and R Van Dingenen and G Zeng and C Atherton and D Bergmann and I Bey and G Carmichael and WJ Collins and BN Duncan and G Faluvegi and G Folberth and M Gauss and S Gong and D Hauglustaine and T Holloway and ISA Isaksen and DJ Jacob and JE Jonson and JW Kaminski and TJ Keating and A Lupu and E Marmer and V Montanaro and Rokjin J Park and G Pitari and KJ Pringle and JA Pyle and S Schroeder and MG Vivanco and P Wind and G Wojcik and S Wu and A Zuber,114,Journal of Geophysical Research,D4,D04301,American Geophysical Union,Understanding the surface O3 response over a “receptor” region to emission changes over a foreign “source” region is key to evaluating the potential gains from an international approach to abate ozone (O3) pollution. We apply an ensemble of 21 global and hemispheric chemical transport models to estimate the spatial average surface O3 response over east Asia (EA). Europe (EU). North America (NA). and south Asia (SA) to 20% decreases in anthropogenic emissions of the O3 precursors. NOx. NMVOC. and CO (individually and combined). from each of these regions. We find that the ensemble mean surface O3 concentrations in the base case (year 2001) simulation matches available observations throughout the year over EU but overestimates them by >10 ppb during summer and early fall over the eastern United States and Japan. The sum of the O3 responses to NOx. CO. and NMVOC decreases separately …,True,MHbvpzAAAAAJ:4DMP91E08xMC,395,https://agupubs.onlinelibrary.wiley.com/doi/abs/10.1029/2008JD010816,10436600953977327678,/scholar?cites=10436600953977327678,,https://agupubs.onlinelibrary.wiley.com/doi/full/10.1029/2008JD010816,0,0,0
1115343,The kinetic preprocessor KPP-a software environment for solving chemical kinetics,2002,Valeriu Damian and Adrian Sandu and Mirela Damian and Florian Potra and Gregory R Carmichael,26,Computers & Chemical Engineering,11,1567-1579,Pergamon,The kinetic preprocessor (KPP) is a software tool that assists the computer simulation of chemical kinetic systems. The concentrations of a chemical system evolve in time according to the differential law of mass action kinetics. A computer simulation requires the implementation of the differential system and its numerical integration in time. KPP translates a specification of the chemical mechanism into fortran or c simulation code that implement the concentration time derivative function and its Jacobian. together with a suitable numerical integration scheme. Sparsity in Jacobian is carefully exploited in order to obtain computational efficiency. KPP incorporates a library with several widely used atmospheric chemistry mechanisms and users can add their own chemical mechanisms to the library. KPP also includes a comprehensive suite of stiff numerical integrators. The KPP development environment is designed in a …,True,MHbvpzAAAAAJ:hqOjcs7Dif8C,387,https://www.sciencedirect.com/science/article/pii/S009813540200128X,9032609755201782631,/scholar?cites=9032609755201782631,,https://www.academia.edu/download/63920972/s0098-1354_2802_2900128-x20200714-22974-1indii2.pdf,0,0,0
1115344,ACE-ASIA: regional climatic and atmospheric chemical effects of Asian dust and pollution,2004,John H Seinfeld and Gregory R Carmichael and Richard Arimoto and William C Conant and Frederick J Brechtel and Timothy S Bates and Thomas A Cahill and Antony D Clarke and Sarah J Doherty and Piotr J Flatau and Barry J Huebert and Jiyoung Kim and Krzysztof M Markowicz and Patricia K Quinn and Lynn M Russell and Philip B Russell and Atsushi Shimizu and Yohei Shinozuka and Chul H Song and Youhua Tang and Itsushi Uno and Andrew M Vogelmann and Rodney J Weber and Jung-Hun Woo and Xiao Y Zhang,85,Bulletin of the American Meteorological Society,3,367-380,American Meteorological Society,Although continental-scale plumes of Asian dust and pollution reduce the amount of solar radiation reaching the earth's surface and perturb the chemistry of the atmosphere. our ability to quantify these effects has been limited by a lack of critical observations. particularly of layers above the surface. Comprehensive surface. airborne. shipboard. and satellite measurements of Asian aerosol chemical composition. size. optical properties. and radiative impacts were performed during the Asian Pacific Regional Aerosol Characterization Experiment (ACE-Asia) study. Measurements within a massive Chinese dust storm at numerous widely spaced sampling locations revealed the highly complex structure of the atmosphere. in which layers of dust. urban pollution. and biomass- burning smoke may be transported long distances as distinct entities or mixed together. The data allow a first-time assessment of the regional …,True,MHbvpzAAAAAJ:_FxGoFyzp5QC,362,https://journals.ametsoc.org/view/journals/bams/85/3/bams-85-3-367.xml,1504309435631739199,/scholar?cites=1504309435631739199,,https://journals.ametsoc.org/downloadpdf/journals/bams/85/3/bams-85-3-367.xml,0,0,0
1115345,Acid rain and acidification in China: the importance of base cation deposition,2000,Thojorn Larssen and GR Carmichael,110,Environmental Pollution,1,89-102,Elsevier,Acid deposition has been recognized as a serious environmental problem in China. Most acid deposition studies have focused on sulfur deposition and the pH of precipitation. However. as high concentration of alkaline dust is an important feature of the atmosphere in large parts of China. base cation deposition must be taken into account when discussing possible effects on soils and vegetation from acid deposition. We estimate the deposition of sulfur as well as calcium. i.e. the dominating anion and cation. on a regional scale in China using data both from measurements and modeling. The ratio of sulfur/calcium in deposition is then used as an indicator for identifying areas where deposition acidity exceeds alkalinity. and where soils may be at risk to acidification. The dynamic soil acidification model MAGIC is applied with data from two sites receiving high deposition loads in southwest China. The model …,True,MHbvpzAAAAAJ:ufrVoPGSRksC,335,https://www.sciencedirect.com/science/article/pii/S0269749199002791,9904754010477004543,/scholar?cites=9904754010477004543,,,0,0,0
1115346,A second generation model for regional-scale transport/chemistry/deposition,1986,Gregory R Carmichael and Leonard K Peters,20,Atmospheric Environment (1967),1,173-188,Elsevier,The regional-scale transport. chemistry and deposition of acidifying compounds. photochemical oxidants. and their precursors are analyzed using a second-generation Eulerian model. The important atmospheric processes are incorporated using chemical. dynamical and thermodynamical parameterizations having sufficient detail to accommodate boundary layer-free troposphere exchange in cloudy and cloud-free environments. and in-cloud and below-cloud wet removal and chemistry. Forty-one species are considered. many of which are also present in the liquid-drop phases. In the regional scale transport. the advected species are NO. NO2. SO2. SO−24. O3. HNO3. NH3. PAN. H2O2. HCHO. alkanes. C2H4. other olefins. aromatics. RCHO. ROOH. HNO2. RONO2 and RO2NO2. The model capabilities are illustrated by showing simulations in which non-precipitating clouds are present to absorb gas-phase …,True,MHbvpzAAAAAJ:zYLM7Y9cAGgC,333,https://www.sciencedirect.com/science/article/pii/0004698186902180,3896192282805058707,/scholar?cites=3896192282805058707,,,0,0,0
1115347,H. Streets D. and Hordijk L (1999) Anthropogenic NOx emissions in Asia in the period 1990-2020,,JA Van Aardenne and GR Carmichael and II Levy,33,Atmospheric Environment,4,633-646,,,True,MHbvpzAAAAAJ:D_sINldO8mEC,298,http://scholar.google.com/scholar?cluster=15543600144997116383&hl=en&oi=scholarr,10731458043650079231,/scholar?cites=10731458043650079231,,,0,0,0
1115348,Anthropogenic NO x emissions in Asia in the period 1990-2020,1999,John A van Aardenne and Gregory R Carmichael and Hiram Levy II and David Streets and Leen Hordijk,33,Atmospheric Environment,4,633-646,Elsevier Science,Nitrogen oxides emissions in Asia during the period 1990–2020 due to anthropogenic activity are presented. These estimates are based on the RAINS-ASIA methodology (Foell et al.. 1995. Acid Rain and Emission Reduction in Asia. World Bank). which includes a dynamic model for energy forecasts. and information on 6 energy sectors and 9 fuel types. The energy forecasts are combined with process emission factors to yield NOx emission estimates at the country level. the regional level. and on a 1 degree by 1 degree grid. In 1990 the total NOx emissions are estimated to be ∼19 Tg NO2. with China (43%). India (18%) and Japan (13%) accounting for 75% of the total. Emissions by fuel are dominated by burning of hard coal and emissions by economic activity are dominated by the power. transport. and industrial sectors. These new estimates of NOx emissions are compared with those published by Hameed and …,True,MHbvpzAAAAAJ:W7OEmFMy1HYC,296,https://www.sciencedirect.com/science/article/pii/S1352231098001101,10731458043650079231,/scholar?cites=10731458043650079231,,https://www.academia.edu/download/53021463/Aardenne_AtmosEnv_1999.pdf,0,0,0
1115349,Benchmarking stiff ODE solvers for atmospheric chemistry problems II: Rosenbrock solvers,1997,A Sandu and JG Verwer and JG Blom and EJ Spee and GR Carmichael and FA Potra,31,Atmospheric Environment,20,3459-3472,Pergamon,In the numerical simulation of atmospheric transport-chemistry processes. a major task is the integration of the stiff systems of ordinary differential equations describing the chemical transformations. It is therefore of interest to systematically search for stiff solvers which can be identified as close to optimal for atmospheric applications. In this paper we continue our investigation from Sandu et al. (1996. CWI Report NM-R9603 and Report in Comput. Math.. No. 85) and compare eight solvers on a set of seven box-models used in present day models. The focus is on Rosenbrock solvers. These turn out to be very well suited for our application when they are provided with highly efficient sparse matrix techniques to economize on the linear algebra. Two of the Rosenbrock solvers tested are from the literature. viz. rodas and Ros4. and two are new and specially developed for air quality applications. viz. rodas3 and ros3.,True,MHbvpzAAAAAJ:UebtZRa9Y70C,294,https://www.sciencedirect.com/science/article/pii/S1352231097832128,15324553183396513783,/scholar?cites=15324553183396513783,,http://citeseerx.ist.psu.edu/viewdoc/download?doi=10.1.1.38.2020&rep=rep1&type=pdf,0,0,0
1115350,Impacts of biomass burning on tropospheric CO. NOx. and O3,2000,Hiram Levy II and Gregory R Carmichael,105,Journal of Geophysical Research,D5,6633-6653,,,True,MHbvpzAAAAAJ:roLk4NBRz8UC,293,,70561313779531729,/scholar?cites=70561313779531729,,,0,0,0
