,title,pub_year,author,volume,journal,number,pages,publisher,abstract,filled,author_pub_id,num_citations,pub_url,cites_id,citedby_url,author_id,eprint_url,got_citations
39319,Proteolytic and non-proteolytic migration of tumour cells and leucocytes,2003,Jeremy Saklatvala and Hideaki Nagase and Guy Salvesen and Peter Friedl and Katarina Wolf,70,Biochemical Society Symposia,,277-285,Portland Press,The migration of different cell types. such as leucocytes and tumour cells. involves cellular strategies to overcome the physical resistance of three-dimensional tissue networks. including proteolytic degradation of extracellular matrix (ECM) components. High-resolution live-cell imaging techniques have recently provided structural and biochemical insight into the differential use of matrix-degrading enzymes in the migration processes of different cell types within the three-dimensional ECM. Proteolytic migration is achieved by slow-moving cells. such as fibroblasts and mesenchymally moving tumour cells. by engaging matrix metalloproteinases. cathepsins and serine proteases at the cell surface in a focalized manner ('pericellular proteolysis'). while adhesion and migratory traction are provided by integrins. Pericellular breakdown of ECM components generates localized matrix defects and remodelling along …,True,xke6pR0AAAAJ:uoRD4RTSUPoC,166,https://portlandpress.com/biochemsocsymp/article-abstract/doi/10.1042/bss0700277/101812,220635723075770412,/scholar?cites=220635723075770412,,http://www.academia.edu/download/41795861/Proteolytic_and_non-proteolytic_migratio20160130-22471-1mzmovs.pdf,0
39320,Dominant-interfering forms of MEF2 generated by caspase cleavage contribute to NMDA-induced neuronal apoptosis,2002,Shu-ichi Okamoto and Zhen Li and Chung Ju and Marion N Schölzke and Emily Mathews and Jiankun Cui and Guy S Salvesen and Ella Bossy-Wetzel and Stuart A Lipton,99,Proceedings of the National Academy of Sciences,6,3974-3979,National Academy of Sciences,Myocyte enhancer factor-2 (MEF2) transcription factors are activated by p38 mitogen-activated protein kinase during neuronal and myogenic differentiation. Recent work has shown that stimulation of this pathway is antiapoptotic during development but proapoptotic in mature neurons exposed to excitotoxic or other stress. We now report that excitotoxic (N-methyl-D-aspartate) insults to mature cerebrocortical neurons activate caspase-3. -7. in turn cleaving MEF2A. C. and D isoforms. MEF2 cleavage fragments containing a truncated transactivation domain but preserved DNA-binding domain block MEF2 transcriptional activity via dominant interference. Transfection of constitutively active MEF2 (MEF2C-CA) rescues MEF2 transcriptional activity after N-methyl-D-aspartate insult and prevents neuronal apoptosis. Conversely. dominant-interfering MEF2 abrogates neuroprotection by MEF2C-CA. These results define a …,True,xke6pR0AAAAJ:dfsIfKJdRG4C,163,https://www.pnas.org/content/99/6/3974.short,8311828089549651833,/scholar?cites=8311828089549651833,,https://www.pnas.org/content/pnas/99/6/3974.full.pdf,0
39321,Chondroitin 4-sulfate covalently cross-links the chains of the human blood protein pre-alpha-inhibitor.,1991,Jan J Enghild and Guy Salvesen and SA Hefta and IB Thøgersen and S Rutherfurd and SV Pizzo,266,Journal of Biological Chemistry,2,747-751,Elsevier,The human blood protein pre-alpha-inhibitor is composed of one heavy and one light protein chain. The chains are covalently linked to each other by a structure that has not previously been described. which we designate a protein-glycosaminoglycan-protein (PGP) cross-link. A combination of protein and carbohydrate analytical techniques indicates that the interchain linkage is mediated by a chondroitin 4-sulfate glycosaminoglycan that originates from a typical O-glycosidic link to Ser-10 of the light chain. The heavy chain is esterified. via the alpha-carbon of its C-terminal Asp. to C-6 of an internal N-acetylgalactosamine of the glycosaminoglycan chain. This PGP cross-link may be present in other proteins. but could have been overlooked due to the heterogeneous behavior of proteins containing glycosaminoglycan.,True,xke6pR0AAAAJ:35N4QoGY0k4C,159,https://www.sciencedirect.com/science/article/pii/S0021925817352353,6718276797225645820,/scholar?cites=6718276797225645820,,https://www.sciencedirect.com/science/article/pii/S0021925817352353,0
39322,Control of the expression of inflammatory response genes,2003,Jeremy Saklatvala and Hideaki Nagase and Guy Salvesen and Jonathan Dean and Andrew Clark,70,Biochemical Society Symposia,,95-106,Portland Press,The expression of genes involved in the inflammatory response is controlled both transcriptionally and post-transcriptionally. Primary inflammatory stimuli. such as microbial products and the cytokines interleukin-1 (IL-1) and tumour necrosis factor α (TNFα). act through receptors of either the Toll and IL-1 receptor (TIR) family or the TNF receptor family. These cause changes in gene expression by activating four major intracellular signalling pathways that are cascades of protein kinases: namely the three mitogen-activated protein kinase (MAPK) pathways. and the pathway leading to activation of the transcription factor nuclear factor ϰB (NFϰB). The pathways directly activate and induce the expression of a limited set of transcription factors which promote the transcription of inflammatory response genes. Many of the mRNAs are unstable. and are stabilized by the p38 MAPK pathway. Instability is mediated by clusters …,True,xke6pR0AAAAJ:GtqhT-R7ZnwC,158,https://portlandpress.com/biochemsocsymp/article-abstract/doi/10.1042/bss0700095/101803,17045761779283475850,/scholar?cites=17045761779283475850,,https://www.researchgate.net/profile/Jonathan_Dean2/publication/9033640_Control_of_the_expression_of_inflammatory_response_genes/links/568d0a8d08aefb48d4bf26fa/Control-of-the-expression-of-inflammatory-response-genes.pdf,0
39323,Covalent binding of proteinases in their reaction with α2-macroglobulin,1980,Guy S Salvesen and Alan J Barrett,187,Biochemical Journal,3,695-701,Portland Press Ltd.,Although it is known that most of the plasma proteinase inhibitors form complexes with proteinases that are not dissociated by SDS (sodium dodecyl sulphate). there has been disagreement as to whether this is true for alpha 2M (alpha 2-macroglobulin). We have examined the stability to SDS with reduction of complexes between alpha 2M and several 125I-labelled proteinases (trypsin. plasmin. leucocyte elastase. pancreatic elastase and papain) by gel electrophoresis. For each enzyme. some molecules were separated from the denatured alpha 2M chains. but amounts ranging from 8.3% (papain) to 61.2% (trypsin) were bound with a stability indicative of a covalent link. Proteolytic activity was essential for the covalent binding to occur. and the proteinase molecules became attached to the larger of the two proteolytic derivatives (apparent mol.wt. 111 000) of the alpha 2M subunit. We take this to mean that cleavage …,True,xke6pR0AAAAJ:HoB7MX3m0LUC,158,https://portlandpress.com/biochemj/article-abstract/187/3/695/5499,10435844502885311857,/scholar?cites=10435844502885311857,,https://www.ncbi.nlm.nih.gov/pmc/articles/PMC1162453/pdf/biochemj00424-0155.pdf,0
39324,Transnitrosylation of XIAP regulates caspase-dependent neuronal cell death,2010,Tomohiro Nakamura and Lei Wang and Catherine CL Wong and Fiona L Scott and Brendan P Eckelman and Xuemei Han and Christos Tzitzilonis and Fanjun Meng and Zezong Gu and Emily A Holland and Arjay T Clemente and Shu-ichi Okamoto and Guy S Salvesen and Roland Riek and John R Yates III and Stuart A Lipton,39,Molecular cell,2,184-195,Cell Press,X-linked inhibitor of apoptosis (XIAP) is a potent antagonist of caspase apoptotic activity. XIAP also functions as an E3 ubiquitin ligase. targeting caspases for degradation. However. molecular pathways controlling XIAP activities remain unclear. Here. we report that nitric oxide (NO) reacts with XIAP by S-nitrosylating its RING domain (forming SNO-XIAP). thereby inhibiting E3 ligase and antiapoptotic activity. NO-mediated neurotoxicity and caspase activation have been linked to several neurodegenerative disorders. including Alzheimer's. Parkinson's. and Huntington's diseases. We find significant SNO-XIAP formation in brains of patients with these diseases. implicating this reaction in the etiology of neuronal damage. Conversely. S-nitrosylation of caspases is known to inhibit apoptotic activity. Unexpectedly. we find that SNO-caspase transnitrosylates (transfers its NO group) to XIAP. forming SNO-XIAP. and thus …,True,xke6pR0AAAAJ:Og1tA8FjbJAC,155,https://www.sciencedirect.com/science/article/pii/S1097276510005241,5995629724893729456,/scholar?cites=5995629724893729456,,https://www.sciencedirect.com/science/article/pii/S1097276510005241,0
39325,Activation of pro-caspase-7 by serine proteases includes a non-canonical specificity,1997,Qiao ZHOU and Guy S SALVESEN,324,Biochemical Journal,2,361-364,Portland Press Ltd.,As a model to investigate the mechanism of caspase activation we have analysed the processing of pro-caspase-7 by serine proteases with varied specificities. The caspase-7 zymogen was rapidly activated by granzyme B and more slowly by subtilisin and cathepsin G. generating active enzymes with similar kinetic properties. Significantly. cathepsin G activated the zymogen by cleaving at a Gln–Ala bond. indicating that the canonical cleavage specificity at aspartic acid is not required for activation.,True,xke6pR0AAAAJ:SeFeTyx0c_EC,155,https://portlandpress.com/biochemj/article-abstract/324/2/361/37757,15740044894838000288,/scholar?cites=15740044894838000288,,https://www.ncbi.nlm.nih.gov/pmc/articles/PMC1218439/pdf/9182691.pdf,0
39326,Profiling constitutive proteolytic events in vivo,2007,John C Timmer and Mari Enoksson and Eric Wildfang and Wenhong Zhu and Yoshinobu Igarashi and Jean-Benard Denault and Yuliang Ma and Benjamin Dummitt and Yie-Hwa Chang and Alan E Mast and Alexey Eroshkin and Jeffrey W Smith and W Andy Tao and Guy S Salvesen,407,Biochemical Journal,1,41-48,Portland Press Ltd.,Most known organisms encode proteases that are crucial for constitutive proteolytic events. In the present paper. we describe a method to define these events in proteomes from Escherichia coli to humans. The method takes advantage of specific N-terminal biotinylation of protein samples. followed by affinity enrichment and conventional LC (liquid chromatography)–MS/MS (tandem mass spectrometry) analysis. The method is simple. uses conventional and easily obtainable reagents. and is applicable to most proteomics facilities. As proof of principle. we demonstrate profiles of proteolytic events that reveal exquisite in vivo specificity of methionine aminopeptidase in E. coli and unexpected processing of mitochondrial transit peptides in yeast. mouse and human samples. Taken together. our results demonstrate how to rapidly distinguish real proteolysis that occurs in vivo from the predictions based on in vitro …,True,xke6pR0AAAAJ:UxriW0iASnsC,152,https://portlandpress.com/biochemj/article-abstract/407/1/41/41949,16020629810532767705,/scholar?cites=16020629810532767705,,https://www.ncbi.nlm.nih.gov/pmc/articles/PMC2267409/,0
39327,Evolutionary conservation of apoptosis mechanisms: lepidopteran and baculoviral inhibitor of apoptosis proteins are inhibitors of mammalian caspase-9,2000,Qihong Huang and Quinn L Deveraux and Susumu Maeda and Guy S Salvesen and Henning R Stennicke and Bruce D Hammock and John C Reed,97,Proceedings of the National Academy of Sciences,4,1427-1432,National Academy of Sciences,We cloned a new inhibitor of apoptosis protein (IAP) homolog. SfIAP. from Spodoptera frugiperda Sf-21 cells. a host of insect baculoviruses. SfIAP contains two baculovirus IAP repeat domains followed by a RING domain. SfIAP has striking amino acid sequence similarity with baculoviral IAPs. CpIAP and OpIAP. suggesting that baculoviral IAPs may be host-derived genes. SfIAP and baculoviral CpIAP inhibit Bax but not Fas-induced apoptosis in human cells. Their apoptosis-suppressing activity in mammalian cells requires both baculovirus IAP repeat and RING domains. Further biochemical data suggest that SfIAP and CpIAP are specific inhibitors of mammalian caspase-9. the pinnacle caspase in the mitochondria/cytochrome c pathway for apoptosis. but are not inhibitors of downstream caspase-3 and caspase-7. Thus the mechanisms by which insect and baculoviral IAPs suppress apoptosis may involve inhibition …,True,xke6pR0AAAAJ:u_35RYKgDlwC,151,https://www.pnas.org/content/97/4/1427.short,179212580129325227,/scholar?cites=179212580129325227,,https://www.pnas.org/content/97/4/1427.long,0
39328,Granzyme release and caspase activation in activated human T-lymphocytes,1998,Juan M Zapata and Ryosuke Takahashi and Guy S Salvesen and John C Reed,273,Journal of Biological Chemistry,12,6916-6920,American Society for Biochemistry and Molecular Biology,Recently it has been reported that caspase-3 activation occurs in stimulated T-lymphocytes without associated apoptosis (Miossec. C.. Dutilleul. V.. Fassy. F.. and Diu-Hercend. A. (1997) J. Biol. Chem. 272. 13459–13462). To explore this phenomenon. human peripheral blood lymphocytes (PBLs) were stimulated with mitogenic lectins or anti-CD3 antibody. and the proteolytic processing of different caspases and caspase substrates was analyzed by immunoblotting. Proteolytic processing of caspases-3 and -7 and the caspase substrates poly(ADP-ribose) polymerase. GDP dissociation inhibitor. and PKCδ was observed when PBLs were activated in vitro. and lysates were prepared using RIPA buffer which contains 1% Nonidet P-40. 0.5% deoxycholate. and 0.1% SDS. In contrast. when a lysis buffer containing 2% SDS was used. the caspases remained in their zymogen pro-forms. and no proteolytic processing of …,True,xke6pR0AAAAJ:g5m5HwL7SMYC,151,https://www.jbc.org/content/273/12/6916.short,14152110573891228772,/scholar?cites=14152110573891228772,,https://www.jbc.org/content/273/12/6916.full.pdf,0
39329,Caspase substrates and inhibitors,2013,Marcin Poręba and Aleksandra Stróżyk and Guy S Salvesen and Marcin Drąg,5,Cold Spring Harbor perspectives in biology,8,a008680,Cold Spring Harbor Lab,Caspases are proteases at the heart of networks that govern apoptosis and inflammation. The past decade has seen huge leaps in understanding the biology and chemistry of the caspases. largely through the development of synthetic substrates and inhibitors. Such agents are used to define the role of caspases in transmitting life and death signals. in imaging caspases in situ and in vivo. and in deconvoluting the networks that govern cell behavior. Additionally. focused proteomics methods have begun to reveal the natural substrates of caspases in the thousands. Together. these chemical and proteomics technologies are setting the scene for designing and implementing control of caspase activity as appropriate targets for disease therapy.,True,xke6pR0AAAAJ:xGWFX6Gbr9MC,147,https://cshperspectives.cshlp.org/content/5/8/a008680.short,16531058049964525222,/scholar?cites=16531058049964525222,,https://cshperspectives.cshlp.org/content/5/8/a008680.full.pdf,0
39330,Neutralization of Smac/Diablo by inhibitors of apoptosis (IAPs) A caspase-independent mechanism for apoptotic inhibition,2004,John C Wilkinson and Amanda S Wilkinson and Fiona L Scott and Rebecca A Csomos and Guy S Salvesen and Colin S Duckett,279,Journal of biological chemistry,49,51082-51090,American Society for Biochemistry and Molecular Biology,Numerous members of the IAP family can suppress apoptotic cell death in physiological settings. Whereas certain IAPs directly inhibit caspases. the chief proteolytic effectors of apoptosis. the protective effects of other IAPs do not correlate well with their caspase inhibitory activities. suggesting the involvement of alternative cytoprotective abilities. To examine this issue. we have characterized the protective effects of an ancestral. baculoviral IAP (Op-IAP) in mammalian cells. We show that although Op-IAP potently inhibited Bax-mediated apoptosis in human cells. Op-IAP failed to directly inhibit mammalian caspases. However. Op-IAP efficiently bound the IAP antagonist Smac/Diablo. thereby preventing Smac/Diablo-mediated inhibition of cellular IAPs. Whereas reduction of Smac/Diablo protein levels in the absence of Op-IAP prevented Bax-mediated apoptosis. overexpression of Smac/Diablo neutralized Op-IAP …,True,xke6pR0AAAAJ:4OULZ7Gr8RgC,147,https://www.jbc.org/content/279/49/51082.short,17745253904265295742,/scholar?cites=17745253904265295742,,https://www.jbc.org/content/279/49/51082.full.pdf,0
39331,Caspases on the brain,2002,Carol M Troy and Guy S Salvesen,69,Journal of neuroscience research,2,145-150,Wiley Subscription Services. Inc.. A Wiley Company,The basic mechanisms that underlie neurodegenerative diseases are unknown. Loss of function of specific regions of the brain is due to incapacitation of cells that constitute those regions. Cells can simply stop functioning normally (neurons may cease to transmit signals). or they may die. There is now evidence that the pathology of several neurodegenerative diseases is due to inappropriate apoptosis. This being the case. an understanding of the mediators of apoptosis. their identities. and their role in orchestrating death would be a vital step toward remedying the diseases. The central components of apoptotic pathways. proteases of the caspase family. are present in latent forms in all nucleated cells. Their activity is balanced by specific activation and inactivation events. and the molecular and biochemical controls have been well established in vitro and in model transformed cell lines. In this Mini‐Review. we …,True,xke6pR0AAAAJ:fPk4N6BV_jEC,142,https://onlinelibrary.wiley.com/doi/abs/10.1002/jnr.10294,5659925430412340918,/scholar?cites=5659925430412340918,,https://onlinelibrary.wiley.com/doi/pdf/10.1002/jnr.10294,0
39332,Small Ubiquitin-related Modifier (SUMO)-specific Proteases PROFILING THE SPECIFICITIES AND ACTIVITIES OF HUMAN SENPs,2007,Jowita Mikolajczyk and Marcin Drag and Miklós Békés and John T Cao and Ze'ev Ronai and Guy S Salvesen,282,Journal of Biological Chemistry,36,26217-26224,American Society for Biochemistry and Molecular Biology,SENPs are proteases that participate in the regulation of SUMOylation by generating mature small ubiquitin-related modifiers (SUMO) for protein conjugation (endopeptidase activity) and removing conjugated SUMO from targets (isopeptidase activity). Using purified recombinant catalytic domains of 6 of the 7 human SENPs. we demonstrate the specificity of their respective activities on SUMO-1. -2. and -3. The primary mode of recognition of substrates is via the SUMO domain. and the C-terminal tails direct endopeptidase specificity. Broadly speaking. SENP1 is the most efficient endopeptidase. whereas SENP2 and -5–7 have substantially higher isopeptidase than endopeptidase activities. We developed fluorogenic tetrapeptide substrates that are cleaved by SENPs. enabling us to characterize the environmental profiles of each enzyme. Using these synthetic substrates we reveal that the SUMO domain enhances …,True,xke6pR0AAAAJ:8AbLer7MMksC,140,https://www.jbc.org/content/282/36/26217.short,14890500375699061846,/scholar?cites=14890500375699061846,,https://www.jbc.org/content/282/36/26217.full.pdf,0
39333,Proteolysis of the collagen fibril in osteoarthritis,2003,Jeremy Saklatvala and Hideaki Nagase and Guy Salvesen and A Robin Poole and Fred Nelson and Leif Dahlberg and Elena Tchetina and Masahiko Kobayashi and Tadashi Yasuda and Sheila Laverty and Ginette Squires and Toshihisa Kojima and William Wu and R Clark Billinghurst,70,Biochemical Society Symposia,,115-123,Portland Press,The development of cartilage pathology in osteoarthritis involves excessive damage to the collagen fibrillar network. which appears to be mediated primarily by the chondrocyte-generated cytokines interleukin-1 and tumour necrosis factor α and the collagenases matrix metalloproteinase-1 (MMP-1) and MMP-13. The damage to matrix caused by these and other MMPs can result in the production of sufficient degradation products that can themselves elicit further degradation. leading to chondrocyte differentiation and eventually matrix mineralization and cell death. Knowledge of these MMPs. cellular receptors and cytokine pathways. and the ability to selectively antagonize them by selective blockade of function. may provide valuable therapeutic opportunities in the treatment of osteoarthritis and other joint diseases involving cartilage resorption. such as rheumatoid arthritis. The ability to detect the products of these …,True,xke6pR0AAAAJ:5rMqqAh47xYC,138,https://portlandpress.com/biochemsocsymp/article-abstract/doi/10.1042/bss0700115/101801,9338907076102709016,/scholar?cites=9338907076102709016,,https://www.researchgate.net/profile/Robin_Poole/publication/9033642_Proteolysis_of_the_collagen_fibril_in_osteoarthritis/links/5640c5ae08aec448fa60084e/Proteolysis-of-the-collagen-fibril-in-osteoarthritis.pdf,0
39334,Apoptosome: the seven-spoked death machine,2002,Guy S Salvesen and Martin Renatus,2,,3,256-257,Cell Press,A paper in the February issue of Molecular Cell describes the structure of the apoptosome. a multicomponent death machine. deciphered by cryoelectron microscopy. This structure explains the assembly of the machine. the tentative location of the subcomponents. and proposes a mechanism for initiating the death signal.,True,xke6pR0AAAAJ:KxtntwgDAa4C,138,https://www.sciencedirect.com/science/article/pii/S1534580702001375,12896019535417094303,/scholar?cites=12896019535417094303,,https://www.sciencedirect.com/science/article/pii/S1534580702001375,0
39335,Kinetics and physiologic relevance of the inactivation of alpha 1-proteinase inhibitor. alpha 1-antichymotrypsin. and antithrombin III by matrix metalloproteinases-1 (tissue …,1991,Alan E Mast and JJ Enghild and H Nagase and K Suzuki and SV Pizzo and G Salvesen,266,Journal of Biological Chemistry,24,15810-15816,American Society for Biochemistry and Molecular Biology,Serpins encompass a superfamily of proteinase inhibitors that regulate many of the serine proteinases involved in inflammation and hemostasis. In vitro. many serpins are catalytically inactivated by proteinases that they do not inhibit. leading to the concept of proteolytic down-regulation of serpin inhibitory capacity. The extent to which down-regulation of serpin activity occurs in vivo is debated. since little is known of the rates at which the process occurs. To address this debate. we have measured the rates of inactivation of three serpins. alpha 1-proteinase inhibitor (alpha 1PI). alpha 1-antichymotrypsin (alpha 1ACT). and antithrombin III (ATIII). by three human matrix metalloproteinases (MMPs-1. -2. and -3) thought to be involved in tissue destruction and repair. Our object was to establish a working kinetic model which can be used to predict whether serpin inactivation by these proteinases is likely to occur in vivo. We …,True,xke6pR0AAAAJ:3s1wT3WcHBgC,136,https://www.jbc.org/content/266/24/15810.short,2321232638949891387,/scholar?cites=2321232638949891387,,https://www.jbc.org/content/266/24/15810.full.pdf,0
39336,Role of proteolysis in caspase-8 activation and stabilization,2007,Cristina Pop and Patrick Fitzgerald and Douglas R Green and Guy S Salvesen,46,Biochemistry,14,4398-4407,American Chemical Society,Caspase-8 is an apoptotic protease that is activated at the cytosolic face of the cell membrane. Activation relies on adaptor-induced dimerization of monomeric caspase-8 and is followed by specific limited autoproteolysis of the linker which separates the two subunits of the catalytic domain. However. the role of this autoproteolysis. which directly activates executioner caspases-3 and -7. is unknown for the apical caspase-8. We have generated linker mutants of caspase-8 that can be proteolyzed in a controlled manner by thrombin or tobacco etch mosaic virus protease. and we use these to define the role of proteolysis in the activation and stability of the enzyme. We show that proteolysis is insufficient for generating enzymatic activity in recombinant caspase-8. Kinetic activation studies using Hoffmeister salts demonstrate that activation is the result of caspase dimerization. However. linker proteolysis significantly …,True,xke6pR0AAAAJ:tS2w5q8j5-wC,131,https://pubs.acs.org/doi/abs/10.1021/bi602623b,4875829521272809427,/scholar?cites=4875829521272809427,,,0
