,title,pub_year,author,volume,journal,number,pages,publisher,abstract,filled,author_pub_id,num_citations,pub_url,cites_id,citedby_url,author_id,eprint_url,got_citations
39392,Design. synthesis. and evaluation of aza-peptide epoxides as selective and potent inhibitors of caspases-1.-3.-6. and-8,2004,Karen Ellis James and Juliana L Asgian and Zhao Zhao Li and Özlem Doǧan Ekici and John R Rubin and Jowita Mikolajczyk and Guy S Salvesen and James C Powers,47,Journal of medicinal chemistry,6,1553-1574,American Chemical Society,Aza-peptide epoxides. a novel class of irreversible protease inhibitors. are specific for the clan CD cysteine proteases. Aza-peptide epoxides with an aza-Asp residue at P1 are excellent irreversible inhibitors of caspases-1. -3. -6. and -8 with second-order inhibition rates up to 1 910 000 M-1 s-1. In general. the order of reactivity of aza-peptide epoxides is S.S > R.R > trans > cis. Interestingly. some of the R.R epoxides while being less potent are actually more selective than the S.S epoxides. Our aza-peptide epoxides designed for caspases are stable. potent. and specific inhibitors. as they show little to no inhibition of other proteases such as the aspartyl proteases porcine pepsin. human cathepsin D. plasmepsin 2 from P. falciparum. HIV-1 protease. and the secreted aspartic proteinase 2 (SAP-2) from Candida albicans; the serine proteases granzyme B and α-chymotrypsin; and the cysteine proteases cathepsin B …,True,xke6pR0AAAAJ:sSrBHYA8nusC,72,https://pubs.acs.org/doi/abs/10.1021/jm0305016,3575891877401368101,/scholar?cites=3575891877401368101,,,0
39393,Investigation of glucocorticoid-induced apoptotic pathway: processing of caspase-6 but not caspase-3,1998,Toshiyuki Miyashita and Kazuaki Nagao and Stanislaw Krajewski and Guy S Salvesen and John C Reed and Tadashi Inoue and Masao Yamada,5,Cell Death & Differentiation,12,1034-1041,Nature Publishing Group,Glucocorticoids (GCs) are essential therapeutic reagents for the treatment of lymphomas and leukemias. GCs cause cell death in certain types of lymphoid cells mediated by the process known as apoptosis. This cell death is completely inhibited by Bcl-2. Here we report that Bcl-2 and benzyloxycarbonyl-Val-Ala-Asp (OMe)-fluoromethylketone (zVAD-fmk). a broad spectrum caspase inhibitor. prevent loss of mitochondrial membrane potential (ΔΨCm) and the production of reactive oxygen species (ROS) caused by GC. while acetyl-Asp-Glu-Val-Asp-aldehyde (Ac-DEVD-CHO). an inhibitor of the caspase-3 family proteases. does not. This suggests that the inhibition by Bcl-2 and activation of some initiator caspases are upstream events of mitochondrial damage. whereas the activation of caspase-3 family proteases occurs downstream of mitochondrial changes. We also demonstrate that caspase-6 but not caspase-3 is …,True,xke6pR0AAAAJ:u9iWguZQMMsC,72,https://www.nature.com/articles/4400442,9954574400952896616,/scholar?cites=9954574400952896616,,https://www.nature.com/articles/4400442.pdf?origin=ppub,0
39394,Identification of ubiquitination sites on the X-linked inhibitor of apoptosis protein,2003,Hwain Shin and Kazuya Okada and John C Wilkinson and Katherine M Solomon and Colin S Duckett and John C Reed and Guy S Salvesen,373,Biochemical Journal,3,965-971,Portland Press Ltd.,The execution phase of apoptosis is under the control of members of the inhibitor of apoptosis (IAP) family of zinc finger proteins. Several of these proteins contain a C-terminal RING (really interesting new gene) domain that has been postulated to regulate ubiquitination of themselves or their target proteins. thereby modulating thresholds for apoptosis. We demonstrate that the auto-ubiquitination sites of the X-linked IAP (XIAP) are Lys322 and Lys328. located in the third baculovirus IAP repeat domain of the protein. Modification of these sites to arginine dramatically reduces ubiquitination of XIAP. but has no measurable effect on the ability of ectopically expressed IAP to rescue cells from two independent apoptotic inducers. Our data firmly locate the auto-ubiquitination sites. and raise doubts regarding the importance of this event as a mechanism for regulating the levels of XIAP.,True,xke6pR0AAAAJ:Tiz5es2fbqcC,69,https://portlandpress.com/biochemj/article-abstract/373/3/965/41110,17031483709937399877,/scholar?cites=17031483709937399877,,https://www.ncbi.nlm.nih.gov/pmc/articles/PMC1223557/pdf/12747801.pdf,0
39395,Sequential autolytic processing activates the zymogen of Arg-gingipain,2003,Jowita Mikolajczyk and Kelly M Boatright and Henning R Stennicke and Tamim Nazif and Jan Potempa and Matthew Bogyo and Guy S Salvesen,278,Journal of Biological Chemistry,12,10458-10464,American Society for Biochemistry and Molecular Biology,Most proteases are synthesized as inactive precursors to protect the synthetic machinery of the cell and allow timing of activation. The mechanisms used to render latency are varied but tend to be conserved within protease families. Proteases belonging to the caspase family have a unique mechanism mediated by transitions of two surface loops. and on the basis of conservation of mechanism one would expect this to be preserved by caspase relatives. We have been able to express the full-length precursor of the Arg-specific caspase relative from the bacterium Porphyromonas gingivalis. Arg-gingipain-B. and we show that it contains N- and C-terminal extensions that render a low amount of latency. meaning that the zymogen is substantially active. Three sequential autolytic processing steps at the N and C terminus are required for full activity. and the N-propeptide may serve as an intramolecular chaperone rather …,True,xke6pR0AAAAJ:4fKUyHm3Qg0C,69,https://www.jbc.org/content/278/12/10458.short,10848983642475765162,/scholar?cites=10848983642475765162,,https://www.jbc.org/content/278/12/10458.full.pdf,0
39396,Proteolytic enzymes: a practical approach,1989,G Salvesen and H Nagase,,,,83-194,Oxford University Press,,True,xke6pR0AAAAJ:HqhvjgTjE9cC,69,http://scholar.google.com/scholar?cluster=7244606333156624255&hl=en&oi=scholarr,7244606333156624255,/scholar?cites=7244606333156624255,,,0
39397,The BIR domain of IAP-like protein 2 is conformationally unstable: implications for caspase inhibition,2005,Hwain Shin and Martin Renatus and Brendan P Eckelman and Viviane A Nunes and Claudio AM Sampaio and Guy S Salvesen,385,Biochemical Journal,1,1-10,Portland Press Ltd.,Several IAP (inhibitor of apoptosis) proteins regulate cell fate decisions. and the X-linked IAP (XIAP) does so in part by inhibiting caspases. proteases that execute the apoptotic pathway. A tissue-specific homologue of XIAP. known as ILP2 (IAP-like protein 2). has previously been implicated in the control of apoptosis in the testis by direct inhibition of caspase 9. In examining this protein we found that the putative caspase 9 interaction domain is a surprisingly weak inhibitor and is also conformationally unstable. Comparison with the equivalent domain in XIAP demonstrated that the instability is due to the lack of a linker segment N-terminal to the inhibitory BIR (baculovirus IAP repeat) domain. Fusion of a 9-residue linker from XIAP to the N-terminus of ILP2 restored tight caspase 9 inhibition. dramatically increased conformational stability and allowed crystallization of the ILP2 BIR domain in a form strikingly similar to the …,True,xke6pR0AAAAJ:kRWSkSYxWN8C,68,https://portlandpress.com/biochemj/article-abstract/385/1/1/44175,18317992745313479954,/scholar?cites=18317992745313479954,,https://www.ncbi.nlm.nih.gov/pmc/articles/PMC1134667/,0
39398,Membrane-type 1 matrix metalloproteinase and cell migration,2003,Jeremy Saklatvala and Hideaki Nagase and Guy Salvesen and Motoharu Seiki and Hidetoshi Mori and Masahiro Kajita and Takamasa Uekita and Yoshifumi Itoh,70,Biochemical Society Symposia,,253-262,Portland Press,Membrane-type 1 matrix metalloproteinase (MT1-MMP) is an integral membrane proteinase that performs processing of cell surface proteins and degradation of extracellular matrix (ECM) components. Through these proteolytic events. MT1-MMP regulates various cellular functions. including ECM turnover. promotion of cell migration and invasion. and morphogenic responses to extracellular stimuli. MT1-MMP has to be regulated strictly to accomplish its function appropriately at various steps. including at the transcriptional and post-translational levels. MT1-MMP was originally identified as an invasion-promoting enzyme expressed in malignant tumour cells. and also as a specific activator of proMMP-2. which is believed to play a role in invasion of the basement membrane. Since then. it has attracted attention as a membrane-associated MMP that promotes cancer cell invasion and angiogenesis by endothelial cells …,True,xke6pR0AAAAJ:vjZqxyZ7hS4C,68,https://portlandpress.com/biochemsocsymp/article/doi/10.1042/bss0700253/101813,4474418900211917922,/scholar?cites=4474418900211917922,,https://www.researchgate.net/profile/Hidetoshi_Mori/publication/9033653_Membrane-type_I_matrix_metalloproteinase_and_cell_migration/links/541344220cf2fa878ad3d7af.pdf,0
39399,Regulation of histone acetylation by autophagy in Parkinson disease,2016,Goonho Park and Jieqiong Tan and Guillermina Garcia and Yunyi Kang and Guy Salvesen and Zhuohua Zhang,291,Journal of Biological Chemistry,7,3531-3540,American Society for Biochemistry and Molecular Biology,Parkinson disease (PD) is the most common age-dependent neurodegenerative movement disorder. Accumulated evidence indicates both environmental and genetic factors play important roles in PD pathogenesis. but the potential interaction between environment and genetics in PD etiology remains largely elusive. Here. we report that PD-related neurotoxins induce both expression and acetylation of multiple sites of histones in cultured human cells and mouse midbrain dopaminergic (DA) neurons. Consistently. levels of histone acetylation are markedly higher in midbrain DA neurons of PD patients compared to those of their matched control individuals. Further analysis reveals that multiple histone deacetylases (HDACs) are concurrently decreased in 1-methyl-4-phenylpyridinium (MPP+)-treated cells and 1-methyl-4-phenyl-1.2.3.6-tetrahydropyridine-treated mouse brains. as well as midbrain tissues of human …,True,xke6pR0AAAAJ:SrKkpNFED5gC,67,https://www.jbc.org/content/291/7/3531.short,932769858474731066,/scholar?cites=932769858474731066,,https://www.jbc.org/content/291/7/3531.full.pdf,0
39400,The dynamics and mechanism of SUMO chain deconjugation by SUMO-specific proteases,2011,Miklós Békés and John Prudden and Tharan Srikumar and Brian Raught and Michael N Boddy and Guy S Salvesen,286,Journal of Biological Chemistry,12,10238-10247,American Society for Biochemistry and Molecular Biology,SUMOylation of proteins is a cyclic process that requires both conjugation and deconjugation of SUMO moieties. Besides modification by a single SUMO. SUMO chains have also been observed. yet the dynamics of SUMO conjugation/deconjugation remain poorly understood. Using a non-deconjugatable form of SUMO we demonstrate the underappreciated existence of SUMO chains in vivo. we highlight the importance of SUMO deconjugation. and we demonstrate the highly dynamic nature of the SUMO system. We show that SUMO-specific proteases (SENPs) play a crucial role in the dynamics of SUMO chains in vivo by constant deconjugation. Preventing deSUMOylation in Schizosaccharomyces pombe results in slow growth and a sensitivity to replication stress. highlighting the biological requirement for deSUMOylation dynamics. Furthermore. we present the mechanism of SUMO chain deconjugation by …,True,xke6pR0AAAAJ:tuHXwOkdijsC,67,https://www.jbc.org/content/286/12/10238.short,13115723853843721264,/scholar?cites=13115723853843721264,,https://www.jbc.org/content/286/12/10238.full.pdf,0
39401,Methods of detecting Alzheimer's disease,2000,,,,,,,Methods of diagnosing or prognosing Alzheimer's disease in a subject are disclosed. The methods involve directly or indirectly detecting the presence or absence of an apolipoprotein E type 4 (ApoE4) isoform or DNA encoding ApoE4 in the subject. The presence of ApoE4 indicates the subject is afflicted with Alzheimer's disease or at risk of developing Alzheimer's disease. A novel immunochemical assay for detecting the presence or absence of the Apoliprotein E (ApoE) E4 allele in a subject is also disclosed.,True,xke6pR0AAAAJ:VL0QpB8kHFEC,65,https://patents.google.com/patent/US6027896A/en,17880592028800198301,/scholar?cites=17880592028800198301,,https://patentimages.storage.googleapis.com/f9/a1/de/50a4d35e04f279/US6027896.pdf,0
39402,Fingerprinting the substrate specificity of M1 and M17 aminopeptidases of human malaria. Plasmodium falciparum,2012,Marcin Poreba and Sheena McGowan and Tina S Skinner-Adams and Katharine R Trenholme and Donald L Gardiner and James C Whisstock and Joyce To and Guy S Salvesen and John P Dalton and Marcin Drag,7,PLoS One,2,e31938,Public Library of Science,Background Plasmodium falciparum. the causative agent of human malaria. expresses two aminopeptidases. PfM1AAP and PfM17LAP. critical to generating a free amino acid pool used by the intraerythrocytic stage of the parasite for proteins synthesis. growth and development. These exopeptidases are potential targets for the development of a new class of anti-malaria drugs.   Methodology/Principal Findings To define the substrate specificity of recombinant forms of these two malaria aminopeptidases we used a new library consisting of 61 fluorogenic substrates derived both from natural and unnatural amino acids. We obtained a detailed substrate fingerprint for recombinant forms of the enzymes revealing that PfM1AAP exhibits a very broad substrate tolerance. capable of efficiently hydrolyzing neutral and basic amino acids. while PfM17LAP has narrower substrate specificity and preferentially cleaves bulky. hydrophobic amino acids. The substrate library was also exploited to profile the activity of the native aminopeptidases in soluble cell lysates of P. falciparum malaria.   Conclusions/Significance This data showed that PfM1AAP and PfM17LAP are responsible for majority of the aminopeptidase activity in these extracts. These studies provide specific substrate and mechanistic information important for understanding the function of these aminopeptidases and could be exploited in the design of new inhibitors to specifically target these for anti-malaria treatment.,True,xke6pR0AAAAJ:9c2xU6iGI7YC,64,https://journals.plos.org/plosone/article?id=10.1371/journal.pone.0031938,4712076932830810801,/scholar?cites=4712076932830810801,,https://journals.plos.org/plosone/article?id=10.1371/journal.pone.0031938,0
39403,Early processing of Bid and caspase-6.-8.-10.-14 in the canine brain during cardiac arrest and resuscitation,2004,Maryla Krajewska and Robert E Rosenthal and Jowita Mikolajczyk and Henning R Stennicke and Thomas Wiesenthal and Juergen Mai and Mikihiko Naito and Guy S Salvesen and John C Reed and Gary Fiskum and Stan Krajewski,189,Experimental neurology,2,261-279,Academic Press,A clinically relevant model of transient global brain ischemia involving cardiac arrest followed by resuscitation in dogs was utilized to study the expression and proteolytic processing of apoptosis-regulatory proteins. In the hippocampus. an increase in pro-apoptotic Bcl-2 family proteins Bcl-XS and Bak was detected. concomitant with proteolysis of Bcl-XL and Bcl-2. following ischemia–reperfusion injury. Also. biphasic cleavage of Bid was found in this region of the brain. with early generation of tBid-p11 within 10 min of cardiac arrest. followed by generation of tBid-p15 within 30-min reperfusion. consistent with activation of this pro-apoptotic protein. In addition. cardiac arrest and resuscitation induced early. reperfusion-dependent proteolytic processing of pro-caspase-6. -8. -10. and -14. which preceded caspase-3 activation. Immunohistochemical analysis using antibodies. which preferentially recognize processed …,True,xke6pR0AAAAJ:LPZeul_q3PIC,64,https://www.sciencedirect.com/science/article/pii/S0014488604001839,4183714727207714184,/scholar?cites=4183714727207714184,,,0
39404,Phospholipase C-γ1 is required for cell survival in oxidative stress by protein kinase C,2002,Xiao-Chun Bai and Fan Deng and An-Ling Liu and Zhi-Peng Zou and Yu Wang and Zhi-Yong Ke and Qun-Sheng Ji and Shen-Qiu Luo,363,Biochemical Journal,2,395-401,Portland Press Ltd.,Phospholipase C-γ1 (PLC-γ1) activation has been reported to enhance cell survival during the cellular response to oxidative stress. We studied the role of protein kinase C (PKC) pathways in mediating PLC-γ1 survival signalling in oxidative stress by using mouse embryonic fibroblasts genetically deficient in PLC-γ1 (Plcg1−/−) and its wild type (Plcg1+/+). PLC-γ1 was activated by H2O2 treatment in a dose- and time-dependent manner. Activation of PKC was also markedly increased in both cell lines treated with H2O2 (1–5mM). but with low doses (50–200μM). PKC activation was considerably decreased in Plcg1−/− cells. After treatment with H2O2. PKC-dependent phosphorylation of Bcl-2 and cell viability of Plcg1−/− cells decreased dramatically and caspase-3-like activity increased significantly compared with that of the wild-type cells. Furthermore. pretreatment of Plcg1+/+ cells with PKC-specific inhibitor …,True,xke6pR0AAAAJ:ALROH1vI_8AC,63,https://portlandpress.com/biochemj/article-abstract/363/2/395/39527,16781348500765167406,/scholar?cites=16781348500765167406,,https://www.ncbi.nlm.nih.gov/pmc/articles/PMC1222491/pdf/11931670.pdf,0
39405,Purification and characterization of an α-macroglobulin proteinase inhibitor from the mollusc Octopus vulgaris,1992,IB Thøgersen and Guy Salvesen and Frederic H Brucato and Salvatore V Pizzo and Jan J Enghild,285,Biochemical Journal,2,521-527,Portland Press Ltd.,The cell-free haemolymph of the mollusc Octopus vulgaris inhibited the proteolytic activity of the thermolysin against the high-molecular-mass substrate hide powder azure. The purified inhibitor was a glycoprotein composed of two identical 180 kDa disulphide-linked subunits. In addition to the inhibition of the metalloproteinase thermolysin. the protein inhibited the serine proteinases human neutrophil elastase. pig pancreatic elastase. bovine chymotrypsin. bovine trypsin and the cysteine proteinase papain. A fraction of the proteinase-inhibitor complex resisted dissociation after denaturation indicating that some of the proteinase molecules became covalently bound. The nucleophile beta-aminopropionitrile decreased the covalent binding of proteinases to the Octopus vulgaris protein. suggesting that this interaction is mediated by an internal thiol ester; the reactivity and the amino acid sequence flanking the reactive …,True,xke6pR0AAAAJ:geHnlv5EZngC,63,https://portlandpress.com/biochemj/article-abstract/285/2/521/27895,7603595976371904510,/scholar?cites=7603595976371904510,,https://www.ncbi.nlm.nih.gov/pmc/articles/PMC1132819/pdf/biochemj00131-0176.pdf,0
39406,Identification and evaluation of small molecule pan-caspase inhibitors in Huntington's disease models,2010,Melissa J Leyva and Francesco DeGiacomo and Linda S Kaltenbach and Jennifer Holcomb and Ningzhe Zhang and Juliette Gafni and Hyunsun Park and Donald C Lo and Guy S Salvesen and Lisa M Ellerby and Jonathan A Ellman,17,Chemistry & biology,11,1189-1200,Cell Press,Huntington's Disease (HD) is characterized by a mutation in the huntingtin (Htt) gene encoding an expansion of glutamine repeats on the N terminus of the Htt protein. Numerous studies have identified Htt proteolysis as a critical pathological event in HD postmortem human tissue and mouse HD models. and proteases known as caspases have emerged as attractive HD therapeutic targets. We report the use of the substrate activity screening method against caspase-3 and -6 to identify three novel. pan-caspase inhibitors that block proteolysis of Htt at caspase-3 and -6 cleavage sites. In HD models these irreversible inhibitors suppressed Hdh111Q/111Q-mediated toxicity and rescued rat striatal and cortical neurons from cell death. In this study. the identified nonpeptidic caspase inhibitors were used to confirm the role of caspase-mediated Htt proteolysis in HD. These results further implicate caspases as promising …,True,xke6pR0AAAAJ:yB1At4FlUx8C,61,https://www.sciencedirect.com/science/article/pii/S1074552110003996,10763551992325245048,/scholar?cites=10763551992325245048,,https://www.sciencedirect.com/science/article/pii/S1074552110003996,0
39407,Activation and specificity of human caspase-10,2010,Katherine Wachmann and Cristina Pop and Bram J van Raam and Marcin Drag and Peter D Mace and Scott J Snipas and Christian Zmasek and Robert Schwarzenbacher and Guy S Salvesen and Stefan J Riedl,49,Biochemistry,38,8307-8315,American Chemical Society,Two apical caspases. caspase-8 and -10. are involved in the extrinsic death receptor pathway in humans. but it is mainly caspase-8 in its apoptotic and nonapoptotic functions that has been an intense research focus. In this study we concentrate on caspase-10. its mechanism of activation. and the role of the intersubunit cleavage. Our data obtained through in vitro dimerization assays strongly suggest that caspase-10 follows the proximity-induced dimerization model for apical caspases. Furthermore. we compare the specificity and activity of the wild-type protease with a mutant incapable of autoprocessing by using positional scanning substrate analysis and cleavage of natural protein substrates. These experiments reveal a striking difference between the wild type and the mutant. leading us to hypothesize that the single chain enzyme has restricted activity on most proteins but high activity on the proapoptotic …,True,xke6pR0AAAAJ:BwyfMAYsbu0C,61,https://pubs.acs.org/doi/abs/10.1021/bi100968m,4353465174997907099,/scholar?cites=4353465174997907099,,https://www.ncbi.nlm.nih.gov/pmc/articles/PMC2943529/,0
39408,Combined X-ray. NMR. and kinetic analyses reveal uncommon binding characteristics of the hepatitis C virus NS3-NS4A protease inhibitor BI 201335,2011,Christopher T Lemke and Nathalie Goudreau and Songping Zhao and Oliver Hucke and Diane Thibeault and Montse Llinàs-Brunet and Peter W White,286,Journal of Biological Chemistry,13,11434-11443,American Society for Biochemistry and Molecular Biology,Hepatitis C virus infection. a major cause of liver disease worldwide. is curable. but currently approved therapies have suboptimal efficacy. Supplementing these therapies with direct-acting antiviral agents has the potential to considerably improve treatment prospects for hepatitis C virus-infected patients. The critical role played by the viral NS3 protease makes it an attractive target. and despite its shallow. solvent-exposed active site. several potent NS3 protease inhibitors are currently in the clinic. BI 201335. which is progressing through Phase IIb trials. contains a unique C-terminal carboxylic acid that binds noncovalently to the active site and a bromo-quinoline substitution on its proline residue that provides significant potency. In this work we have used stopped flow kinetics. x-ray crystallography. and NMR to characterize these distinctive features. Key findings include: slow association and dissociation rates within …,True,xke6pR0AAAAJ:OzeSX8-yOCQC,60,https://www.jbc.org/content/286/13/11434.short,14376204401005786267,/scholar?cites=14376204401005786267,,https://www.jbc.org/content/286/13/11434.full.pdf,0
39409,Activation and substrate specificity of caspase-14,2004,Jowita Mikolajczyk and Fiona L Scott and Stan Krajewski and Daniel P Sutherlin and Guy S Salvesen,43,Biochemistry,32,10560-10569,American Chemical Society,Caspase-14 is a developmentally regulated and tissue restricted member of the caspase family present in mammals. It is mainly found in epidermal keratinocytes and has been hypothesized to be involved in a tissue-specific form of cell senescence. leading to the differentiation of keratinocytes that form the cornified cell layer. However. the substrate specificity. activation mechanism. and function of this caspase have yet to be revealed. We report that caspase-14. in contrast to other caspases. is not produced in active form following expression in Escherichia coli but can be activated by high concentrations of kosmotropic salts. Moreover. proteolytic cleavage is also required since the kosmotropic salts were only effective on the cleaved enzyme. We propose that caspase-14 requires proteolytic cleavage within the catalytic domain. followed by dimerization and ordering of mobile active site loops. to generate a …,True,xke6pR0AAAAJ:V3AGJWp-ZtQC,60,https://pubs.acs.org/doi/abs/10.1021/bi0498048,5670992203796274039,/scholar?cites=5670992203796274039,,,0
