,title,pub_year,author,volume,journal,number,pages,publisher,abstract,filled,author_pub_id,num_citations,pub_url,cites_id,citedby_url,gsrank,author_id,eprint_url,got_citations,got_author_ids,author_ids
1265597,How to decarbonise international shipping: Options for fuels. technologies and policies,2019,Paul Balcombe and James Brierley and Chester Lewis and Line Skatvedt and Jamie Speirs and Adam Hawkes and Iain Staffell,182,,,72-88,Pergamon,International shipping provides 80–90% of global trade. but strict environmental regulations around NOX. SOX and greenhouse gas (GHG) emissions are set to cause major technological shifts. The pathway to achieving the international target of 50% GHG reduction by 2050 is unclear. but numerous promising options exist. This study provides a holistic assessment of these options and their combined potential to decarbonise international shipping. from a technology. environmental and policy perspective. Liquefied natural gas (LNG) is reaching mainstream and provides 20–30% CO2 reductions whilst minimising SOX and other emissions. Costs are favourable. but GHG benefits are reduced by methane slip. which varies across engine types. Biofuels. hydrogen. nuclear and carbon capture and storage (CCS) could all decarbonise much further. but each faces significant barriers around their economics. resource …,True,jnAduAcAAAAJ:_FxGoFyzp5QC,91,https://www.sciencedirect.com/science/article/pii/S0196890418314250,13049948296003328318,/scholar?cites=13049948296003328318,,,https://qmro.qmul.ac.uk/xmlui/bitstream/handle/123456789/64783/Balcombe%20How%20to%20decarbonise%202019%20Accepted.pdf?sequence=2,0,0,0
1265598,Levelized cost of CO 2 mitigation from hydrogen production routes,2019,B Parkinson and P Balcombe and JF Speirs and AD Hawkes and K Hellgardt,12,Energy & environmental science,1,19-40,Royal Society of Chemistry,Different technologies produce hydrogen with varying cost and carbon footprints over the entire resource supply chain and manufacturing steps. This paper examines the relative costs of carbon mitigation from a life cycle perspective for 12 different hydrogen production techniques using fossil fuels. nuclear energy and renewable sources by technology substitution. Production costs and life cycle emissions are parameterized and re-estimated from currently available assessments to produce robust ranges to describe uncertainties for each technology. Hydrogen production routes are then compared using a combination of metrics. levelized cost of carbon mitigation and the proportional decarbonization benchmarked against steam methane reforming. to provide a clearer picture of the relative merits of various hydrogen production pathways. the limitations of technologies and the research challenges that need to be …,True,jnAduAcAAAAJ:WF5omc3nYNoC,73,https://pubs.rsc.org/en/content/articlehtml/2019/ee/c8ee02079e,4502404436725732426,/scholar?cites=4502404436725732426,,,https://www.johnmonash.com/static/uploads/files/c8ee02079e-wfkarunfsslu.pdf,0,0,0
1265599,The natural gas supply chain: the importance of methane and carbon dioxide emissions,2017,Paul Balcombe and Kris Anderson and Jamie Speirs and Nigel Brandon and Adam Hawkes,5,,1,3-20,American Chemical Society,Natural gas is typically considered to be the cleaner-burning fossil fuel that could play an important role within a restricted carbon budget. While natural gas emits less CO2 when burned than other fossil fuels. its main constituent is methane. which has a much stronger climate forcing impact than CO2 in the short term. Estimates of methane emissions in the natural gas supply chain have been the subject of much controversy. due to uncertainties associated with estimation methods. data quality. and assumptions used. This Perspective presents a comprehensive compilation of estimated CO2 and methane emissions across the global natural gas supply chain. with the aim of providing a balanced insight for academia. industry. and policy makers by summarizing the reported data. locating the areas of major uncertainty. and identifying where further work is needed to reduce or remove this uncertainty. Overall. the range …,True,jnAduAcAAAAJ:UeHWp8X0CEIC,66,https://pubs.acs.org/doi/abs/10.1021/acssuschemeng.6b00144,2971801009643347200,/scholar?cites=2971801009643347200,,,https://qmro.qmul.ac.uk/xmlui/bitstream/handle/123456789/64791/Balcombe%20The%20Natural%20Gas%202016%20Accepted.pdf?sequence=2,0,0,0
1265600,Methane emissions: choosing the right climate metric and time horizon,2018,Paul Balcombe and Jamie F Speirs and Nigel P Brandon and Adam D Hawkes,20,,10,1323-1339,Royal Society of Chemistry,Methane is a more potent greenhouse gas (GHG) than CO2. but it has a shorter atmospheric lifespan. thus its relative climate impact reduces significantly over time. Different GHGs are often conflated into a single metric to compare technologies and supply chains. such as the global warming potential (GWP). However. the use of GWP is criticised. regarding: (1) the need to select a timeframe; (2) its physical basis on radiative forcing; and (3) the fact that it measures the average forcing of a pulse over time rather than a sustained emission at a specific end-point in time. Many alternative metrics have been proposed which tackle different aspects of these limitations and this paper assesses them by their key attributes and limitations. with respect to methane emissions. A case study application of various metrics is produced and recommendations are made for the use of climate metrics for different categories of …,True,jnAduAcAAAAJ:eQOLeE2rZwMC,52,https://pubs.rsc.org/en/content/articlehtml/2018/em/c8em00414e,17671794121039757549,/scholar?cites=17671794121039757549,,,https://pubs.rsc.org/en/content/articlehtml/2018/em/c8em00414e,0,0,0
1265601,A greener gas grid: What are the options,2018,Jamie Speirs and Paul Balcombe and Erin Johnson and Jeanne Martin and Nigel Brandon and Adam Hawkes,118,Energy Policy,,291-297,Elsevier,There is an ongoing debate over future decarbonisation of gas networks using biomethane. and increasingly hydrogen. in gas network infrastructure. Some emerging research presents gas network decarbonisation options as a tractable alternative to ‘all-electric’ scenarios that use electric appliances to deliver the traditional gas services such as heating and cooking. However. there is some uncertainty as to the technical feasibility. cost and carbon emissions of gas network decarbonisation options. In response to this debate the Sustainable Gas Institute at Imperial College London has conducted a rigorous systematic review of the evidence surrounding gas network decarbonisation options. The study focuses on the technologies used to generate biomethane and hydrogen. and examines the technical potentials. economic costs and emissions associated with the full supply chains involved. The following …,True,jnAduAcAAAAJ:W7OEmFMy1HYC,51,https://www.sciencedirect.com/science/article/pii/S0301421518302027,3926999443806808076,/scholar?cites=3926999443806808076,,,,0,0,0
1265602,Characterising the distribution of methane and carbon dioxide emissions from the natural gas supply chain,2018,Paul Balcombe and NP Brandon and AD Hawkes,172,Journal of Cleaner Production,,2019-2032,Elsevier,Methane and CO2 emissions from the natural gas supply chain have been shown to vary widely but there is little understanding about the distribution of emissions across supply chain routes. processes. regions and operational practises. This study defines the distribution of total methane and CO2 emissions from the natural gas supply chain. identifying the contribution from each stage and quantifying the effect of key parameters on emissions. The study uses recent high-resolution emissions measurements with estimates of parameter distributions to build a probabilistic emissions model for a variety of technological supply chain scenarios. The distribution of emissions resembles a log-log-logistic distribution for most supply chain scenarios. indicating an extremely heavy tailed skew: median estimates which represent typical facilities are modest at 18–24 g CO2 eq./MJ HHV. but mean estimates which account for the …,True,jnAduAcAAAAJ:zYLM7Y9cAGgC,43,https://www.sciencedirect.com/science/article/pii/S0959652617328962,17466168577418993047,/scholar?cites=17466168577418993047,,,https://qmro.qmul.ac.uk/xmlui/bitstream/handle/123456789/64790/Balcombe%20Characterising%20the%20distribution%202017%20Accepted.pdf?sequence=2&isAllowed=y,0,0,0
1265603,Methane and CO 2 emissions from the natural gas supply chain,2015,Paul Balcombe and K Anderson and J Speirs and N Brandon and A Hawkes,,Sustain. Gas. Inst,,,,"Page 1. WHITE PAPER 1: Methane and CO 2 emissions from the natural gas supply chain IGU
Workshop 20th October 2016 Paul Balcombe Sustainable Gas Institute p.balcombe@imperial.
ac.uk Page 2. KEY MESSAGES 1. Supply chain methane and CO 2 emissions are highly variable -
The are some 'incorrect' estimates using inappropriate data but many high estimates are valid
2. The majority of supply chain facilities/routes exhibit low emissions - But there are always a
few facilities/equipment with disproportionately high emissions 3. Using BAT will help reduce
emissions but this is not everything - Progress in the detection of methane emissions is vital
Page 3. 86x 34x Time after emission pulse (years) Small release of methane = large impact
(at least in the short term) BACKGROUND Page 4. • Prompted greater investigation • Different
conclusions and estimation methods Motivation … 
",True,jnAduAcAAAAJ:u5HHmVD_uO8C,38,https://www.igu.org/app/uploads-wp/2016/11/3-IGU-Amsterdam-Oct-2016-rev2-Recovered-min.pdf,9340197839715171285,/scholar?cites=9340197839715171285,,,,0,0,0
1265604,Assessing the impact of future greenhouse gas emissions from natural gas production,2019,Daniel Crow and Paul Balcombe and Nigel Brandon and Adam Hawkes,,Science of the Total Environment,,,,Greenhouse gases (GHGs) produced by the extraction of natural gas are an important contributor to lifecycle emissions and account for a significant fraction of anthropogenic methane emissions in the USA. The timing as well as the magnitude of these emissions matters. as the short term climate warming impact of methane is up to 120 times that of CO2. This study uses estimates of CO2 and methane emissions associated with different upstream operations to build a deterministic model of GHG emissions from conventional and unconventional gas fields as a function of time. By combining these emissions with a dynamic. techno-economic model of gas supply we assess their potential impact on the value of different types of project and identify stranded resources in various carbon price scenarios. We focus in particular on the effects of different emission metrics for methane. using the global warming potential (GWP …,True,jnAduAcAAAAJ:LkGwnXOMwfcC,23,https://www.sciencedirect.com/science/article/pii/S0048969719310265,7807902427925114819,/scholar?cites=7807902427925114819,,,https://qmro.qmul.ac.uk/xmlui/bitstream/handle/123456789/64781/Balcombe%20Assessing%20the%20impact%202020%20Accepted.pdf?sequence=2,0,0,0
1265605,The carbon credentials of hydrogen gas networks and supply chains,2018,Paul Balcombe and Jamie F Speirs and Erin Johnson and Jeanne Martin and Nigel P Brandon and Adam D Hawkes,91,Renewable and Sustainable Energy Reviews,,1077–1088,,Projections of decarbonisation pathways have typically involved reducing dependence on natural gas grids via greater electrification of heat using heat pumps or even electric heaters. However. many technical. economic and consumer barriers to electrification of heat persist. The gas network holds value in relation to flexibility of operation. requiring simpler control and enabling less expensive storage. There may be value in retaining and repurposing gas infrastructure where there are feasible routes to decarbonisation. This study quantifies and analyses the decarbonisation potential associated with the conversion of gas grids to deliver hydrogen. focusing on supply chains. Routes to produce hydrogen for gas grids are categorised as: reforming natural gas with (or without) carbon capture and storage (CCS); gasification of coal with (or without) CCS; gasification of biomass with (or without) CCS; electrolysis using …,True,jnAduAcAAAAJ:YsMSGLbcyi4C,20,https://www.sciencedirect.com/science/article/pii/S1364032118302983,16335848277724413190,/scholar?cites=16335848277724413190,,,https://spiral.imperial.ac.uk/bitstream/10044/1/59861/2/The%20carbon%20credentials%20of%20hydrogen%20gas%20networks%20rev5.docx,0,0,0
1265606,Can natural gas reduce emissions from transport: Heavy goods vehicles and shipping,2019,J Speirs and P Balcombe and P Blomerus and M Stettler and N Brandon and A Hawkes,,,,,,,True,jnAduAcAAAAJ:roLk4NBRz8UC,10,http://scholar.google.com/scholar?cluster=8874200243153692240&hl=en&oi=scholarr,14108405981322021220,/scholar?cites=14108405981322021220,,,,0,0,0
1265607,Life cycle environmental impacts of natural gas drivetrains used in UK road freighting and impacts to UK emission targets,2019,Jasmin Cooper and Adam Hawkes and Paul Balcombe,674,Science of The Total Environment,,482-493,Elsevier,Using natural gas as a fuel in the road freight sector instead of diesel could cut greenhouse gas and air quality emissions but the switch alone is not enough to meet UK climate targets. A life cycle assessment (LCA) has been conducted comparing natural gas trucks to diesel. biodiesel. dimethyl ether and electric trucks on impacts to climate change. land use change. air quality. human health and resource depletion. This is the first LCA to consider a full suite of environmental impacts and is the first study to estimate what impact natural gas could have on reducing emissions form the UK freight sector. If LNG is used. climate change impacts could be up to 33% lower per km and up to 12% lower per kWh engine output. However. methane emissions will eliminate any benefits if they exceed 1.5–3.5% of throughput for typical fuel consumption. For non-climate impacts. natural gas exhibits lower emissions (11–66%) than …,True,jnAduAcAAAAJ:Se3iqnhoufwC,9,https://www.sciencedirect.com/science/article/pii/S0048969719316110,6801778917503790226,/scholar?cites=6801778917503790226,,,https://qmro.qmul.ac.uk/xmlui/bitstream/handle/123456789/64782/Balcombe%20Life%20cycle%20environmental%202019%20Accepted.pdf?sequence=2&isAllowed=y,0,0,0
1265608,Natural gas fuel and greenhouse gas emissions in trucks and ships,2020,Jamie Speirs and Paul Balcombe and Paul Blomerus and Marc Stettler and Pablo Achurra-Gonzalez and Mino Woo and Daniel Ainalis and Jasmin Cooper and Amir Sharafian and Walter Merida and Daniel Crow and Sara Giarola and Nimil Shah and Nigel Brandon and Adam Hawkes,2,,1,012002,IOP Publishing,Natural gas is a transport fuel which may help reduce greenhouse gas emissions in shipping and trucks. However. there is some disagreement regarding the potential for natural gas to provide significant improvements relative to current ships and trucks. In 2015. road freight represented~ 7% of global energy related CO 2 emissions. with international shipping representing~ 2.6% of global emissions. These emissions are also expected to grow. with some estimates suggesting road freight emission growing by a third. and shipping emissions growing by between 50% and 250% from 2012 to 2050. making absolute emissions reductions challenging. In addition. reducing emissions in ships and trucks has proved technically difficult given the relatively long distances that ships and trucks travel.,True,jnAduAcAAAAJ:3fE2CSJIrl8C,6,https://iopscience.iop.org/article/10.1088/2516-1083/ab56af/meta,7589849005206924867,/scholar?cites=7589849005206924867,,,,0,0,0
1265609,A greener gas grid: What are the options?: White Paper 3,2017,Jamie Speirs and Paul Balcombe and Paul Blomerus and Marc Stettler and Nigel Brandon and Adam D Hawkes,,,,,Hydrogen Knowledge Centre,There is an ongoing debate over future decarbonisation of gas networks using biomethane. and increasingly hydrogen. in gas network infrastructure. Some emerging research presents gas network decarbonisation options as a tractable alternative to ‘all-electric’ scenarios that use electric appliances to deliver the traditional gas services such as heating and cooking. However. there is some uncertainty as to the technical feasibility. cost and carbon emissions of gas network decarbonisation options. In response to this debate the Sustainable Gas Institute at Imperial College London has conducted a rigorous systematic review of the evidence surrounding gas network decarbonisation options. The study focuses on the technologies used to generate biomethane and hydrogen. and examines the technical potentials. economic costs and emissions associated with the full supply chains involved. The following …,True,jnAduAcAAAAJ:kNdYIx-mwKoC,3,https://www.h2knowledgecentre.com/content/researchpaper1532,2044758643548596255,/scholar?cites=2044758643548596255,,,,0,0,0
1265610,Life cycle environmental impacts of natural gas drivetrains used in road freighting,2019,Jasmin Cooper and Paul Balcombe,80,Procedia CIRP,,334-339,Elsevier,The displacement of diesel in the road freight sector by natural gas could cut the sector’s environmental impacts but methane emissions risk eliminating this benefit. A life cycle assessment has been performed to compare natural gas fuelled trucks to diesel. biodiesel. dimethyl ether and electric (UK grid mix). on impacts to climate change. air quality and resource depletion. LNG drivetrains exhibit climate change impacts lower than diesel (17-21%) and similar to electric drivetrains. but CH4 emissions will negate any benefits if they exceed 3.5% of throughput for typical fuel consumption. However. this is much higher than measured slip from current natural gas trucks. Biodiesel exhibits the lowest GHG emissions but for compressed natural gas. only at lowest fuel consumption and negligible methane emissions does this option reach climate parity with diesel. For the other indicators. natural gas exhibits lower impacts …,True,jnAduAcAAAAJ:UebtZRa9Y70C,2,https://www.sciencedirect.com/science/article/pii/S2212827119300721,9566185526557561118,/scholar?cites=9566185526557561118,,,https://www.sciencedirect.com/science/article/pii/S2212827119300721/pdf?md5=5f45211211b0d91608519509815e2c16&pid=1-s2.0-S2212827119300721-main.pdf,0,0,0
1265611,Energy from Microgeneration: Sustainability and Perceptions in the UK.,2014,Paul Balcombe,,,,,,In the UK. microgeneration is defined as the generation of electricity of up to 50 kW and/or heat of up to 45 kW from a low-carbon source and includes the following technologies (HM Government. 2004):• electricity: solar photovoltaic (PV). micro-wind. micro-hydro. micro-CHP and fuel cells;• heat: solar thermal. air source heat pumps (ASHP). ground source heat pumps (GSHP). water source heat pumps (WSHP). biomass stoves and boilers. This scale of generation is suitable for installation in domestic and non-domestic buildings. including offices. schools. shops. hotels and factories.,True,jnAduAcAAAAJ:qjMakFHDy7sC,2,https://www.research.manchester.ac.uk/portal/files/54560482/FULL_TEXT.PDF,810753903045082045,/scholar?cites=810753903045082045,,,https://www.research.manchester.ac.uk/portal/files/54560482/FULL_TEXT.PDF,0,0,0
1265612,White Paper 4 Gas in Transport: Heavy Goods and Shipping,2018,Scoping Note and Jamie Speirs and Paul Balcombe and Adam Hawkes and Nigel Brandon,,,,,,The Sustainable Gas Institute (SGI) at Imperial College London was created with the mission to understand the role of gas in a low carbon future. The SGI White Paper Series contributes to this mission. providing globally impactful. policy facing analysis and bringing clarity to contentious topics in the energy sector. This is delivered through the use of Systematic Review of the contemporary evidence base. expert elicitation and primary analysis to fill gaps in current knowledge.Each project in the SGI White Paper Series begins with a published scoping note setting out the proposed direction of the project. The white papers also establish an international Expert Panel to provide guidance and advice throughout the project research phase. Each white paper then conducts a Systematic Review of the evidence base to expose the full range of existing evidence. analysing this evidence to uncover pertinent data and …,True,jnAduAcAAAAJ:8k81kl-MbHgC,0,http://scholar.google.com/scholar?cluster=9048742556634662566&hl=en&oi=scholarr,,,,,,0,0,0
1265613,A GREENER GAS GRID: WHAT ARE THE OPTIONS? WHITE,2017,Jamie Speirs and Paul Balcombe and Erin Johnson and Jeanne Martin and Nigel Brandon and Adam Hawkes,,,,,,The Sustainable Gas Institute (SGI) is a unique academic-industry partnership. and a ground-breaking collaboration between the United Kingdom and Brazil. The Institute is multidisciplinary and operates on a global open innovation model. based at Imperial College London. and collaborating with leading universities in Brazil. The Sustainable Gas Institute manages. leads and delivers world class research with global partners across the spectrum of science. engineering. economics and business.,True,jnAduAcAAAAJ:MXK_kJrjxJIC,0,https://www.imperial.ac.uk/media/imperial-college/research-centres-and-groups/sustainable-gas-institute/SGI-A-greener-gas-grid-what-are-the-options-WP3.pdf,,,,,https://www.imperial.ac.uk/media/imperial-college/research-centres-and-groups/sustainable-gas-institute/SGI-A-greener-gas-grid-what-are-the-options-WP3.pdf,0,0,0
1265614,Observer backstepping control of DFIG-Generators for wind turbines variable-speed: FPGA-based implementation,2015,Badre Bossoufi and Mohammed Karim and Ahmed Lagrioui and Mohammed Taoussi and Aziz Derouich,81,Renewable Energy,,903-917,Pergamon,In this paper. we present a new contribution for the control of Wind-turbine energy systems. a nonlinear robust control of active and reactive power by the use of the Adaptative Backstepping approach based in double-fed asynchronous generator (DFIG-Generator).Initially. a control strategy of the MPPT for extraction of maximum power of the turbine generator is presented. Thereafter. a new control technique for wind systems is presented. This control system is based on an adaptive pole placement control approach integrated to a Backstepping control system. The stability of the system is shown using Lyapunov technique. Using the FPGA to implement the order gives us a better rapidity. A Benchmark was realized by a prototyping platform based on DFIG-generator. FPGA and wind-turbine; the experimental results obtained show the effectiveness and the benefit of our contribution.,True,BloEQfIAAAAJ:tOudhMTPpwUC,104,https://www.sciencedirect.com/science/article/pii/S0960148115002931,15780750881675457297,/scholar?cites=15780750881675457297,,,https://tarjomefa.com/wp-content/uploads/2018/04/134-English-TarjomeFa.pdf,0,0,0
1265615,Backstepping control of DFIG-Generators for Wind Turbines Variable-Speed,2014,Badre Bossoufi and Mohammed Larbi El Hafyani and Hala Alami Aroussi and Mohammed Karim and Ahmed Lagrioui and Mohammed Taoussi and Aziz Derouich,4,IJAAC International Journal of Automation and Control,4,122-140,,,True,BloEQfIAAAAJ:KxtntwgDAa4C,33,,3651230882647947945,/scholar?cites=3651230882647947945,,,,0,0,0
1265616,Improved DTC strategy of doubly fed induction motor using fuzzy logic controller,2019,Najib El Ouanjli and Saad Motahhir and Aziz Derouich and Abdelaziz El Ghzizal and Ali Chebabhi and Mohammed Taoussi,5,Energy Reports,,271-279,Elsevier,This paper presents an improved Direct Torque Control (DTC) strategy for a Doubly Fed Induction Machine (DFIM) powered by two voltage source inverters (VSI) at two levels. This strategy is based on the fuzzy logic controller. The main objective is to improve the performance of the system by reducing electromagnetic torque ripples and improving the currents shape by optimization of the total harmonic distortion (THD). The hysteresis regulators and voltage vectors selection table of the conventional DTC are replaced by fuzzy logic blocks to realize fuzzy DTC control. The two control strategies are simulated in the MATLAB/SIMULINK environment followed by a comparative analysis to validate the effectiveness of the proposed strategy. Many improvements in term of rise time. torque ripples. flux ripples and current harmonics have been done. namely stator and rotor flux ripple and torque ripple have been reduced …,True,BloEQfIAAAAJ:nrtMV_XWKgEC,32,https://www.sciencedirect.com/science/article/pii/S2352484718302324,9819761295608478563,/scholar?cites=9819761295608478563,,,https://www.sciencedirect.com/science/article/pii/S2352484718302324,0,0,0
