,title,pub_year,author,volume,journal,number,pages,publisher,abstract,filled,author_pub_id,num_citations,pub_url,cites_id,citedby_url,author_id,eprint_url,got_citations,got_author_ids,author_ids
86120,A protein phosphorylation switch at the conserved allosteric site in GP,1996,Kai Lin and Virginia L Rath and Shirleko C Dai and Robert J Fletterick and Peter K Hwang,273,Science,5281,1539-1541,American Association for the Advancement of Science,A phosphorylation-initiated mechanism of local protein refolding activates yeast glycogen phosphorylase (GP). Refolding of the phosphorylated amino-terminus was shown to create a hydrophobic cluster that wedges into the subunit interface of the enzyme to trigger activation. The phosphorylated threonine is buried in the allosteric site. The mechanism implicates glucose 6-phosphate. the allosteric inhibitor. in facilitating dephosphorylation by dislodging the buried covalent phosphate through binding competition. Thus. protein phosphorylation-dephosphorylation may also be controlled through regulation of the accessibility of the phosphorylation site to kinases and phosphatases. In mammalian glycogen phosphorylase. phosphorylation occurs at a distinct locus. The corresponding allosteric site binds a ligand activator. adenosine monophosphate. which triggers activation by a mechanism analogous to that of …,True,MAlNgd0AAAAJ:Wp0gIr-vW9MC,100,https://science.sciencemag.org/content/273/5281/1539.abstract,1729429983469079388,/scholar?cites=1729429983469079388,,,0,0,0
86121,Molecular heterogeneity of myophosphorylase deficiency (McArdle's disease): a genotype‐phenotype correlation study,2001,Miguel A Martín and Juan C Rubio and Jenny Buchbinder and Roberto Fernández‐Hojas and Pilar Del Hoyo and Susana Teijeira and Josep Gámez and Carmen Navarro and José M Fernández and Ana Cabello and Yolanda Campos and Carlos Cervera and José M Culebras and Antoni L Andreu and Robert Fletterick and Joaquín Arenas,50,Annals of Neurology: Official Journal of the American Neurological Association and the Child Neurology Society,5,574-581,John Wiley & Sons. Inc.,We report on 54 Spanish patients with McArdle's disease from 40 unrelated families. Molecular analysis revealed that the most common R49X mutation was present in 70% of patients and 55% of alleles. The G204S mutation was less frequent and found in 14.8% of patients and 9% of mutant alleles. The W797R mutation was observed in 16.5% of patients. accounting for 13.7% of mutant alleles. Moreover. 78% of mutant alleles among Spanish patients can be identified by using polymerase chain reaction‐restriction fragment length polymorphism analysis for the R49X. G204S. and W797R mutations. which makes noninvasive diagnosis possible through molecular genetic analysis of blood DNA. Six novel mutations were found. Three were missense mutations. E348K. R601W. and A703V; two nonsense mutations. E124X and Q754X; and one single base pair deletion. 533 delA. No clear genotype‐phenotype …,True,MAlNgd0AAAAJ:AHdEip9mkN0C,97,https://onlinelibrary.wiley.com/doi/abs/10.1002/ana.1225,15083951043906373079,/scholar?cites=15083951043906373079,,https://www.researchgate.net/profile/Carmen_Navarro3/publication/227938459_Molecular_heterogeneity_of_myophosphorylase_deficiency_McArdle%27s_disease_A_Genotype-Phenotype_Correlation_Study/links/5b433158aca2728a0d659e38/Molecular-heterogeneity-of-myophosphorylase-deficiency-McArdles-disease-A-Genotype-Phenotype-Correlation-Study.pdf,0,0,0
86122,Crystal Structure of Neurotrophin-3 Homodimer Shows Distinct Regions Are Used To Bind Its Receptors.,1998,Manish J Butte and Peter K Hwang and William C Mobley and Robert J Fletterick,37,Biochemistry,48,16846-16852,American Chemical Society,Neurotrophin-3 (NT-3) is a cystine knot growth factor that promotes the survival. proliferation. and differentiation of developing neurons and is a potential therapeutic for neurodegenerative diseases. To clarify the structural basis of receptor specificity and the role of neurotrophin dimerization in receptor activation. the structure of the NT-3 homodimer was determined using X-ray crystallography. The orthorhombic crystals diffract to 2.4 Å. with dimer symmetry occurring about a crystallographic 2-fold axis. The overall structure of NT-3 resembles that of the other neurotrophins. NGF and BDNF; each protomer forms a twisted four-stranded β sheet. with three intertwined disulfide bonds. There are notable differences. however. between NT-3 and NGF in the surface loops and in three functionally important regions. shown in previous mutagenesis studies to be critical for binding. One such difference implies that NT-3's …,True,MAlNgd0AAAAJ:8k81kl-MbHgC,97,https://pubs.acs.org/doi/abs/10.1021/bi981254o,1277226635371814551,/scholar?cites=1277226635371814551,,,0,0,0
86123,Convergent and divergent evolution of regulatory sites in eukaryotic phosphorylases,1986,Peter K Hwang and Robert J Fletterick,324,Nature,6092,80-84,Nature Publishing Group,The activity of many proteins in eukaryotic cells is regulated by reversible covalent phosphorylation 1. This regulatory modification is often linked to other allosteric controls within the same protein 2. and such overlapping regulatory mechanisms are best characterized for glycogen phosphorylase (EC 2.4. 1.1). Phosphorylases from different organisms or cell types exhibit markedly contrasting regulatory features 3; this makes the enzyme attractive for studying the evolution of interacting molecular regulatory mechanisms 4. 5. Extensive biochemical and crystallographic studies of rabbit muscle phosphorylase have led to a characterization of five regulatory regions (phosphorylation. glycogen storage. AMP. glucose and purine sites) 6–8. Here we report the complete primary structure of the yeast Saccharomyces cerevisiae glycogen phosphorylase. deduced from the sequence of the cloned gene. Regions that are highly …,True,MAlNgd0AAAAJ:MhiOAD_qIWkC,97,https://www.nature.com/articles/324080a0,16562641965199896733,/scholar?cites=16562641965199896733,,,0,0,0
86124,Catalytic site of glycogen phosphorylase: structure of the T state and specificity for. alpha.-D-glucose,1982,Stephen R Sprang and Elizabeth J Goldsmith and Robert J Fletterick and Stephen G Withers and Neil B Madsen,21,Biochemistry,21,5364-5371,American Chemical Society,Stephen R. Sprang. Elizabeth J. Goldsmith. Robert J. Fletterick.* Stephen G. Withers. and Neil B. Madsen abstract: aD-Glucose inhibits glycogen phosphorylase a by binding at the catalytic site of the inactive conformer (T state) at the same position as does the substrate aD-glucose 1-phosphate to the active (R state) enzyme. It is established that recognition of glucose 1-phosphate is highly specific. Here. we show by crystallographic analysis of the aD-glucose-phosphorylase a complex and by analysis of inhibition by a variety of glucose analogues the nature and specificity of the recognition of the glucosyl group by the T-state enzyme. The catalytic site at which glucose is bound is located at the confluence of the N-and C-terminal domains. Each is an a//3 structure consisting of a/3-sheet core surrounded by a double tier of a helices. The active-site residues are located on flexible loops of polypeptide chain …,True,MAlNgd0AAAAJ:iH-uZ7U-co4C,96,https://pubs.acs.org/doi/pdf/10.1021/bi00264a038,2773191466145714043,/scholar?cites=2773191466145714043,,,0,0,0
86125,A novel TRβ mutation (R383H) in resistance to thyroid hormone syndrome predominantly impairs corepressor release and negative transcriptional regulation,1998,RJ Clifton-Bligh and Francis de Zegher and RL Wagner and TN Collingwood and I Francois and M Van Helvoirt and RJ Fletterick and VKK Chatterjee,12,Molecular Endocrinology,5,609-621,Oxford University Press,Resistance to thyroid hormone (RTH) is characterized by elevated serum thyroid hormones. failure to suppress pituitary TSH secretion. and variable T3 responsiveness in peripheral tissues. The disorder is associated with diverse mutations that cluster within three areas of the thyroid hormone β (TRβ) receptor. Here. we report a novel RTH mutation (R383H). which is located in a region not known to harbor naturally occurring mutations. Although the R383H mutant receptor activated positively regulated genes to an extent comparable to wild-type (WT). negative transcriptional regulation of human TSHα and TRH promoters was impaired in either TRβ1 or TRβ2 contexts. and WT receptor function was dominantly inhibited. T3-dependent changes in basal transcription with R383H were also impaired: on the TRH promoter. basal activation by unliganded R383H was not reversed by T3 to the same extent as WT …,True,MAlNgd0AAAAJ:KbBQZpvPDL4C,95,https://academic.oup.com/mend/article-abstract/12/5/609/2754333,13763796961778073171,/scholar?cites=13763796961778073171,,https://academic.oup.com/mend/article/12/5/609/2754333,0,0,0
86126,X-ray crystallographic and functional studies of thyroid hormone receptor,1998,Ralff CJ Ribeiro and James W Apriletti and Richard L Wagner and Weijun Feng and Peter J Kushner and Stefan Nilsson and Thomas S Scanlan and Brian L West and Robert J Fletterick and John D Baxter,65,,1-6,133-141,Pergamon,We have solved several X-ray crystallographic structures of TR ligand-binding domains (LBDs). including the rat (r) TRα and the human (h) TRβ bound to diverse ligands. The TR-LBD folding. comprised mostly of α-helices. is likely to be general for the superfamily. The ligand. buried in the receptor. forms part of its hydrophobic core. Tight fitting of ligand into the receptor explains its high affinity for the TR. although the structure suggests that ligands with even higher affinities might be generated. The kinetics of 3.5.3′-triiodo-l-thyronine (T3) and 3.5.3′.5′-tetraiodo-l-thyronine (T4) binding suggest that folding around the ligand. rather than receptor opening. is rate-limiting for high affinity binding. TRβ mutations in patients with resistance to T3 cluster around the ligand; these different locations could differentially affect on other receptor functions and explain the syndrome's clinical diversity. Guided by the structure …,True,MAlNgd0AAAAJ:uc_IGeMz5qoC,95,https://www.sciencedirect.com/science/article/pii/S0960076098000296,9097593287521469971,/scholar?cites=9097593287521469971,,,0,0,0
86127,Perturbing the polar environment of Asp102 in trypsin: consequences of replacing conserved Ser214,1992,Mary E McGrath and John R Vasquez and Charles S Craik and AS Yang and Barry Honig and Robert J Fletterick,31,Biochemistry,12,3059-3064,American Chemical Society,Much of the catalytic power of trypsin is derived from the unusual buried. charged side chain of Aspl02. A polar cave provides the stabilization for maintaining the buried charge. and it features the conserved amino acid Ser214 adjacent to Aspl02. Ser214 has been replaced with Ala. Glu. and Lys in rat anionic trypsin. and the consequences of these changes have been determined. Three-dimensional structures of the Glu and Lys variant trypsins reveal that the new 214 side chains are buried. The 2.2-A crystal structure (R= 0.150) of trypsin S214K shows that Lys214occupies the position held by Ser214 and a buried water molecule in the buried polar cave. Lys214-Nf is solvent inaccessible and is less than 5 A from the catalytic Aspl02. The side chain of Glu214 (2.8 k. R=0.168) in trypsin S214E shows two conformations. In the major one. the Glu carboxylate in S214E forms a hydrogen bond with Asp 102. Analytical …,True,MAlNgd0AAAAJ:1Ye0OR6EYb4C,94,https://pubs.acs.org/doi/pdf/10.1021/bi00127a005,17958214280944853330,/scholar?cites=17958214280944853330,,https://citeseerx.ist.psu.edu/viewdoc/download?doi=10.1.1.586.3265&rep=rep1&type=pdf,0,0,0
86128,The structure of corepressor Dax-1 bound to its target nuclear receptor LRH-1,2008,Elena P Sablin and April Woods and Irina N Krylova and Peter Hwang and Holly A Ingraham and Robert J Fletterick,105,Proceedings of the National Academy of Sciences,47,18390-18395,National Academy of Sciences,The Dax-1 protein is an enigmatic nuclear receptor that lacks an expected DNA binding domain. yet functions as a potent corepressor of nuclear receptors. Here we report the structure of Dax-1 bound to one of its targets. liver receptor homolog 1 (LRH-1). Unexpectedly. Dax-1 binds to LRH-1 using a new module. a repressor helix built from a family conserved sequence motif. PCFXXLP. Mutations in this repressor helix that are linked with human endocrine disorders dissociate the complex and attenuate Dax-1 function. The structure of the Dax-1:LRH-1 complex provides the molecular mechanism for the function of Dax-1 as a potent transcriptional repressor.,True,MAlNgd0AAAAJ:SjuI4pbJlxcC,93,https://www.pnas.org/content/105/47/18390.short,17712085450539236974,/scholar?cites=17712085450539236974,,https://www.pnas.org/content/pnas/105/47/18390.full.pdf,0,0,0
86129,Phosphorylase: a biological transducer,1992,Michelle F Browner and Robert J Fletterick,17,,2,66-71,Elsevier Current Trends,A transducer is a device that receives energy from one system and transmits it. often in a different form. to another. Glycogen phosphorylase receives information from the cell or organism in the form of metabolic signals. The energy associated with the binding of these ligand signals is integrated and transmitted at an atomic level. allowing precise adjustment of the enzymatic activity. Understanding this elegant allosteric control has required several different approaches. but the structural requirements of allostery are being defined.,True,MAlNgd0AAAAJ:v1_lew4L6wgC,93,https://www.sciencedirect.com/science/article/pii/0968000492905043,16090434880801483194,/scholar?cites=16090434880801483194,,,0,0,0
86130,The N-terminal domain of the reticulocyte-type 15-lipoxygenase is not essential for enzymatic activity but contains determinants for membrane binding,2002,Matthias Walther and Monika Anton and Martin Wiedmann and Robert Fletterick and Hartmut Kuhn,277,Journal of biological chemistry,30,27360-27366,Elsevier,The rabbit reticulocyte-type 15-lipoxygenase is capable of oxygenating biomembranes and lipoproteins without the preceding action of ester lipid cleaving enzymes. This reaction requires an efficient membrane binding. and the N-terminal β-barrel domain of the enzyme has been implicated in this process. To obtain detailed information on the structural requirements for membrane oxygenation. we expressed the rabbit wild-type 15-lipoxygenase. its β-barrel deletion mutant (catalytic domain). and several lipoxygenase point mutations as His-tagged fusion proteins in Escherichia coli and tested their membrane binding characteristics. We found that: (i) the β-barrel deletion mutant was catalytically active and its enzymatic properties (KM.Vmax. pH optimum. substrate specificity) were similar to those of the wild-type enzyme; (ii) when compared with the wild-type lipoxygenase. the membrane binding properties of the N …,True,MAlNgd0AAAAJ:yB1At4FlUx8C,92,https://www.sciencedirect.com/science/article/pii/S0021925818600870,9077902783421377883,/scholar?cites=9077902783421377883,,https://www.sciencedirect.com/science/article/pii/S0021925818600870,0,0,0
86131,Structural and catalytic models of trypsin-like viral proteases,1990,JF Bazan and RJ Fletterick,1,Semin. Virol,31,1-322,,,True,MAlNgd0AAAAJ:O3NaXMp0MMsC,90,http://scholar.google.com/scholar?cluster=3279613323903930433&hl=en&oi=scholarr,3279613323903930433,/scholar?cites=3279613323903930433,,,0,0,0
86132,Complete cDNA sequence for rabbit muscle glycogen phosphorylase,1986,Kenichi Nakano and Peter K Hwang and Robert J Fletterick,204,FEBS letters,2,283-287,,The cDNA for the nearly full‐length rabbit muscle glycogen phosphorylase mRNA has been isolated and sequenced. The cDNA is rich in G and C nucleotides. This feature is especially striking at the 3rd position of codons. where 86% of the 843 amino acid codons terminate with G or C. Methionine. presumably the initiation residue. is found at position—1. suggesting that the removal of only a single methionine residue precedes the amino‐terminal acetylation at serine. Eight differences between the deduced amino acid sequence and the previously determined protein sequence are discussed.,True,MAlNgd0AAAAJ:3htObqc8RwsC,90,https://febs.onlinelibrary.wiley.com/doi/abs/10.1016/0014-5793(86)80829-8,13641419975376095763,/scholar?cites=13641419975376095763,,https://febs.onlinelibrary.wiley.com/doi/pdf/10.1016/0014-5793%2886%2980829-8,0,0,0
86133,Intron/exon structure of the human gene for the muscle isozyme of glycogen phosphorylase,1987,J Burke and P Hwang and L Anderson and R Lebo and F Gorin and R Fletterick,2,"Proteins: Structure, Function, and Bioinformatics",3,177-187,Wiley Subscription Services. Inc.. A Wiley Company,The intron/exon organization of the human gene for glycogen phosphorylase has been determined. The segments of the polypeptide chain that corresponds to the 19 exons of the gene are examined for relationships between the three‐dimensional structure to the protein and gene structure. Only weak correlations are observed between domains of phosphorylase and exons. The nucleotide binding domains that are found in phosphorylase and other glycolytic enzymes are examined for relationships between exons of the genes and structures of the domains. When mapped to the three‐dimensional structures. the intron/exon boundaries are shown to be widely distributed in this family of protein domains.,True,MAlNgd0AAAAJ:PVgj2kMGcgYC,87,https://onlinelibrary.wiley.com/doi/abs/10.1002/prot.340020303,15420714408461315747,/scholar?cites=15420714408461315747,,,0,0,0
86134,Actin binding by Hip1 (huntingtin-interacting protein 1) and Hip1R (Hip1-related protein) is regulated by clathrin light chain,2008,Jeremy D Wilbur and Chih-Ying Chen and Venus Manalo and Peter K Hwang and Robert J Fletterick and Frances M Brodsky,283,Journal of Biological Chemistry,47,32870-32879,Elsevier,The huntingtin-interacting protein family members (Hip1 and Hip1R in mammals and Sla2p in yeast) link clathrin-mediated membrane traffic to actin cytoskeleton dynamics. Genetic data in yeast have implicated the light chain subunit of clathrin in regulating this link. To test this hypothesis. the biophysical properties of mammalian Hip1 and Hip1R and their interaction with clathrin light chain and actin were analyzed. The coiled-coil domains (clathrin light chain-binding) of Hip1 and Hip1R were found to be stable homodimers with no propensity to heterodimerize in vitro. Homodimers were also predominant in vivo. accounting for cellular segregation of Hip1 and Hip1R functions. Coiled-coil domains of Hip1 and Hip1R differed in their stability and flexibility. correlating with slightly different affinities for clathrin light chain and more markedly with effects of clathrin light chain binding on Hip protein-actin interactions …,True,MAlNgd0AAAAJ:D03iK_w7-QYC,84,https://www.sciencedirect.com/science/article/pii/S0021925820604707,4598536660306265785,/scholar?cites=4598536660306265785,,https://www.sciencedirect.com/science/article/pii/S0021925820604707,0,0,0
86135,The structure of chagasin in complex with a cysteine protease clarifies the binding mode and evolution of an inhibitor family,2007,Stephanie X Wang and Kailash C Pandey and Julio Scharfstein and James Whisstock and Rick K Huang and Jordan Jacobelli and Robert J Fletterick and Philip J Rosenthal and Magnus Abrahamson and Linda S Brinen and Andrea Rossi and Andrej Sali and James H McKerrow,15,Structure,5,535-543,Cell Press,Protein inhibitors of proteolytic enzymes regulate proteolysis and prevent the pathological effects of excess endogenous or exogenous proteases. Cysteine proteases are a large family of enzymes found throughout the plant and animal kingdoms. Disturbance of the equilibrium between cysteine proteases and natural inhibitors is a key event in the pathogenesis of cancer. rheumatoid arthritis. osteoporosis. and emphysema. A family (I42) of cysteine protease inhibitors (http://merops.sanger.ac.uk) was discovered in protozoan parasites and recently found widely distributed in prokaryotes and eukaryotes. We report the 2.2 Å crystal structure of the signature member of the I42 family. chagasin. in complex with a cysteine protease. Chagasin has a unique variant of the immunoglobulin fold with homology to human CD8α. Interactions of chagasin with a target protease are reminiscent of the cystatin family inhibitors. Protein …,True,MAlNgd0AAAAJ:HIFyuExEbWQC,84,https://www.sciencedirect.com/science/article/pii/S0969212607001207,13227974271822701816,/scholar?cites=13227974271822701816,,https://www.sciencedirect.com/science/article/pii/S0969212607001207,0,0,0
86136,Crystal structure of rat anionic trypsin complexed with the protein inhibitors APPI and BPTI,1993,John J Perona and Christopher A Tsu and Charles S Craik and Robert J Fletterick,230,Journal of molecular biology,3,919-933,Academic Press,The crystal structure of rat anionic trypsin D189G/G226D has been determined in complexes with each of the protein inhibitors APPI (amyloid β-protein precursor inhibitor domain) and BPTI (bovine pancreatic trypsin inhibitor) at resolutions of 2·5 Å and 2·1 Å. respectively. Comparisons with the structure of the bovine trypsin-BPTI complex show that the enzyme-inhibitor interactions in rat trypsin are dominated to a much greater degree by attractive and repulsive electrostatic forces. Decreased structural complementarity in the flanking regions of the interface formed with BPTI is reflected in significantly weaker inhibition relative to bovine trypsin. The primary active site loop of BPTI adopts slightly different conformations when bound to rat and cow trypsins. reflecting a broader entrance to the binding pocket in the former. Tight complementarity of each loop conformer to the respective active sites then gives rise to …,True,MAlNgd0AAAAJ:LPZeul_q3PIC,84,https://www.sciencedirect.com/science/article/pii/S0022283683712106,6439330331362749255,/scholar?cites=6439330331362749255,,,0,0,0
86137,Biochemical Characterization and Crystallographic Structure of an Escherichia coli Protein from the Phosphotriesterase Gene Family,1998,Jenny L Buchbinder and Robert C Stephenson and Mark J Dresser and Jed W Pitera and Thomas S Scanlan and Robert J Fletterick,37,Biochemistry,15,5096-5106,American Chemical Society,Phosphotriesterase homology protein (PHP) is a member of a recently discovered family of proteins related to phosphotriesterase. a hydrolytic. bacterial enzyme with an unusual substrate specificity for synthetic organophosphate triesters and phosphorofluoridates. which are common constituents of chemical warfare agents and agricultural pesticides. No natural substrate has been identified for phosphotriesterase. and it has been suggested that the enzyme may have evolved the ability to hydrolyze synthetic compounds in bacteria under selective pressure to meet nutritional needs. PHP. which has 28% sequence identity with phosphotriesterase. may belong to the family of proteins from which phosphotriesterase evolved. Here we report the cloning. expression. initial characterization. and high-resolution X-ray crystallographic structure of PHP. Biochemical analysis shows that PHP is monomeric and binds two zinc …,True,MAlNgd0AAAAJ:WC23djZS0W4C,83,https://pubs.acs.org/doi/full/10.1021/bi971707+,16649333480787163084,/scholar?cites=16649333480787163084,,,0,0,0
86138,Macromolecular chelation as an improved mechanism of protease inhibition: structure of the ecotin‐trypsin complex.,1994,Mary E McGrath and T Erpel and C Bystroff and RJ Fletterick,13,The EMBO journal,7,1502-1507,,The 2.4 A crystal structure (R = 0.180) of the serine protease inhibitor ecotin was determined in a complex with trypsin. Ecotin's dimer structure provides a second discrete and distal binding site for trypsin and. as shown by modelling experiments. other serine proteases. The second site is approximately 45 A from the reactive/active site of the complex and features 13 hydrogen bonds. including six that involve carbonyl oxygen atoms and four bridged by water molecules. Contacts ecotin makes with trypsin's active site are similar to. though more extensive than. those found between trypsin and basic pancreatic trypsin inhibitor. The side chain of ecotin Met84 is found in the substrate binding pocket of trypsin where it makes few contacts. but also does not disrupt the solvent structure or cause misalignment of the scissile bond. This first case of protein dimerization being used to augment binding energy and allow …,True,MAlNgd0AAAAJ:vDZJ-YLwNdEC,83,https://www.embopress.org/doi/abs/10.1002/j.1460-2075.1994.tb06411.x,14957213096679587805,/scholar?cites=14957213096679587805,,https://www.embopress.org/doi/pdf/10.1002/j.1460-2075.1994.tb06411.x,0,0,0
