,title,pub_year,author,volume,journal,number,pages,publisher,abstract,filled,author_pub_id,num_citations,pub_url,cites_id,citedby_url,author_id,eprint_url,got_citations,got_author_ids,author_ids
88552,Phylogeography of Cape Verde Island skinks (Mabuya),2001,RP Brown and NM Suarez and A Smith and J Pestano,10,Molecular Ecology,6,1593-1597,Blackwell Science Ltd,The Cape Verde Islands are of volcanic origin with most having appeared between the early Miocene and mid‐Pleistocene. They contain six known species of Mabuya skinks. Phylogeographical relationships within and among the relatively widespread taxa M. stangeri. M. spinalis and M. delalandii were inferred. based on ≈ 1 kbp of the cytochrome b gene (mitochondrial DNA). Reciprocal monophyly of M. spinalis and M. stangeri was established. which may have arisen from an early Pliocene/late Miocene cladogenetic event. Considerable between‐island sequence divergence was detected among M. spinalis. which appears to have colonized the older islands (Sal and Boavista) first. Much lower sequence divergence was found in M. delalandii. indicating a more recent range expansion. Here. evidence points to colonization of the younger islands of Brava and Fogo soon after appearance. There are similarities …,True,8pK0oMgAAAAJ:TQgYirikUcIC,15,https://onlinelibrary.wiley.com/doi/abs/10.1046/j.1365-294X.2001.01297.x,11219368305714058098,/scholar?cites=11219368305714058098,,https://www.researchgate.net/profile/Richard_Brown88/publication/11928416_Phylogeography_of_Cape_Verde_Island_skinks_Mabuya/links/59e859d60f7e9bc89b50cf3a/Phylogeography-of-Cape-Verde-Island-skinks-Mabuya.pdf,0,0,0
88553,Landmark-defense and scramble competition mating systems in two Australian tachinid flies (Diptera),1995,John Alcock and Andrew P Smith,,Journal of the Kansas Entomological Society,,85-94,Kansas Entomological Society,"Two species of Australian tachinid flies exhibit distinctly different mate-locating tactics. Males of Microtopesa sinuata Donovan engage in landmark-territoriality with individuals defending small perching areas at local ""hilltops"" along a ridgeline. Territory ownership is established through ritualized aerial contests. Different populations of males rank perch sites similarly. Some males exhibit strong fidelity to a given site over a period of as much as 2 wk. Differences among males in site fidelity are not related to differences in body size.Males of Rutilia micans Malloch exhibit scramble competition. with individuals flying quickly from one tree to the next. inspecting trunks for perched females. Male aggression and territoriality are absent. The difference between the mate-locating tactics of the two species is possibly related to the greater size and density of the male population in R. micans. which should raise the cost of …",True,8pK0oMgAAAAJ:SnGPuo6Feq8C,15,https://www.jstor.org/stable/25085564,11040289670713887083,/scholar?cites=11040289670713887083,,,0,0,0
88554,Parental perceptions of information about medication prescribed for their children.,1993,AM Counsell and DC Geddis and AR Smith,106,The New Zealand Medical Journal,956,205-206,,AIMS: The study aimed to examine parents' perceptions of the information provided to them on prescribed medication; how it might be improved and; parental level of knowledge of medication administration. METHODS: 245 parents completed a questionnaire at a preschool health day. The questionnaire covered parental opinion on whether the doctor provided enough information about illness and medication. recall of pharmacist's instructions on medication. parental general knowledge of medication and what parents wanted to know about medication for their children. RESULTS: The findings indicated there was an overall lack of information from the doctor on side effects and what to do if problems occurred with medication. Furthermore. half (49%) of the parents did not recall receiving any information from the pharmacist. Parents appeared to understand the basics of medication administration. CONCLUSIONS: It is suggested that improvements should be made regarding the information given to parents on prescribed medication. This may improve satisfaction with the service received from health professionals. such as doctors and pharmacists. and increase patient compliance with treatment regimes.,True,8pK0oMgAAAAJ:pk6FPx6l9xIC,15,https://europepmc.org/article/med/8341440,15358906961458688391,/scholar?cites=15358906961458688391,,,0,0,0
88555,The abolition of collagen gene expression in SV40-transformed fibroblasts is associated with trans-acting factor switching,1992,M lqbal Parker and Arlene A Smith and Kim Mundell and Malcolm Collins and Sharon Boast and Francesco Ramirez,20,Nucleic acids research,21,5825-5830,Oxford University Press,The goal of this study was to determine whether α2(1) procollagen gene expression is modulated by positive or negative trans-acting DNA-binding proteins. Previous studies have shown that a clone of SV40-transformed WI-38 fibroblasts (SVWI-38) does not produce any α2(1) procollagen mRNA (Parker et al (1989). J. Biol Chem. 264. 7147–7152). In order to elucidate the mechanism(s) responsible for such inactivation. we have examined the activity of a transfected wild type COL1A2 promoter in SVWI-38 cells. A set of 5′promoter deletions was linked to the chloramphenicol acetyltransferase (CAT) gene and transfected into SVWI-38 and other cell lines expressing type I collagen. The resulting CAT assays confirmed the importance of several upstream regions for promoter activity and documented the decreased transcriptional activity from an exogenous COL1A2 promoter in the SVWI-38 cell line …,True,8pK0oMgAAAAJ:YnriW4MgZhwC,15,https://academic.oup.com/nar/article-abstract/20/21/5825/2376795,16512751440780993599,/scholar?cites=16512751440780993599,,https://www.ncbi.nlm.nih.gov/pmc/articles/PMC334422/pdf/nar00232-0302.pdf,0,0,0
88556,A microscopic and immunodiagnostic search for giardiasis in patients with gastrointestinal disorders,1988,MC Allison and EL Green and DN Bhattacharya and A Smith and RE Pounder,23,Scandinavian journal of gastroenterology,2,209-212,Taylor & Francis,Allison MC. Green EL. Bhattacharya DN. Smith A. Pounder RE. A microscopic and immunodiagnostic search for giardiasis in patients with gastrointestinal disorders.Direct microscopy and an ELISA technique were used to determine the prevalence of Giardia lamblia and its antigen in stool samples from patients with Crohn' disease. ulcerative colitis. acute-onset diarrhoea. or dyspepsia. Cysts of Giardia lamblia were observed by microscopy of faeces from two of the patients with acute-onset diarrhoea and one with dyspepsia. Giardia antigen was detected in the faeces of five patients. including all three in whom cysts had been identified by microscopy. No evidence of giardiasis was found in any patient with Crohn' disease or ulcerative colitis. It is concluded that the ELISA can reliably distinguish giardiasis from a range of other gastrointestinal disorders.,True,8pK0oMgAAAAJ:-ZoC36zw86wC,15,https://www.tandfonline.com/doi/abs/10.3109/00365528809103969,6199436167833922500,/scholar?cites=6199436167833922500,,,0,0,0
88557,Evaluation of sarolaner and spinosad oral treatments to eliminate fleas. reduce dermatologic lesions and minimize pruritus in naturally infested dogs in west Central Florida. USA,2017,Michael W Dryden and Michael S Canfield and Emily Niedfeldt and Amanda Kinnon and Kimberly Kalosy and Amber Smith and Kaitlin M Foley and Vicki Smith and Todd S Bress and Nicole Smith and Mike Endrizzi and Joyce Login,10,Parasites & vectors,1,1-10,BioMed Central,An in-home investigation of naturally flea infested dogs was conducted in West Central Florida. USA to evaluate and compare the effectiveness of two different oral flea adulticides to control flea infestations. minimize dermatologic lesions and reduce pruritus over an 8-week period. Twenty-nine dogs living in 19 homes and another 26 dogs residing in 16 different homes were orally administered either a sarolaner or spinosad chewable. respectively on day 0 and once between days 28–30. Products were administered by study personnel according to label directions. Flea populations on dogs were estimated using visual area counts and flea infestations in the indoor premises were assessed using intermittent-light flea traps on days 0. 7. 14. 21 and once between days 28–30. 40–45. and 56–60. Assessments of dermatologic lesions were conducted monthly during the study and severity of pruritus was evaluated …,True,8pK0oMgAAAAJ:bFuYayV9R1gC,14,https://link.springer.com/article/10.1186/s13071-017-2328-9,17732350415873199572,/scholar?cites=17732350415873199572,,https://link.springer.com/article/10.1186/s13071-017-2328-9,0,0,0
88558,Swarm motility of Salmonella enterica serovar Typhimurium is inhibited by compounds from fruit peel extracts,2015,G Mahadwar and KR Chauhan and GV Bhagavathy and C Murphy and AD Smith and AA Bhagwat,60,Letters in applied microbiology,4,334-340,,Controlling spread of human pathogens on fresh produce is a top priority for public health reasons. Isolation of compounds from agricultural waste that would control spread of human pathogens was explored using Salmonella enterica serovar Typhimurium as a model organism. In the environment. micro‐organisms migrate as a ‘community’ especially when they move on moist surfaces. This type of motility is characterized as swarming motility. We examined extracts from agricultural waste such as soya bean husk. peels of orange. pineapple. avocado and pomegranate for antiswarming activity. Avocado and pineapple peels showed moderate (~40%) inhibition of swarming motility while pomegranate peel extract had high antiswarming activity (~85% inhibition) and was examined in further detail. Although the pomegranate peel extract was acidic. swarm‐inhibitory activity was not due to low pH and the peel extract …,True,8pK0oMgAAAAJ:WZBGuue-350C,14,https://sfamjournals.onlinelibrary.wiley.com/doi/abs/10.1111/lam.12364,1098346698435539297,/scholar?cites=1098346698435539297,,https://sfamjournals.onlinelibrary.wiley.com/doi/pdfdirect/10.1111/lam.12364,0,0,0
88559,Open data. official statistics and statistics education: threats. and opportunities for collaboration,2013,Jim Ridgway and Alan Smith,,"Proceedings of the Joint IASEIAOS Satellite Conference “Statistics Education for Progress”, Macao, China",,,,Technology is shaping the ways that evidence is used to influence policy and public opinion. Developments include: the semantic web; the Big Data movement. new tools for data visualisation. and the rise of data-driven journalism. Such developments will have profound effects in terms of the nature of evidence that is gathered. the ways in which it is presented and used. and the skills that will be needed for its interpretation. As such they offer opportunities. but also pose threats to both National Statistics Offices (NSOs) and to statistics educators. A great deal is to be gained from collaborations between NSOs. statistics educators. and other groups. Here. we give examples of the ways that technology is influencing practice. and describe a UK collaboration between the Data Visualisation Centre within the Office for National Statistics and the SMART Centre at Durham University. which sets out to work with journalists and policy makers. and uses Big Data tools to explore success. The opportunities and threats presented by technological developments to NSOs and statistics educators are discussed. We discuss strategies for working effectively with journalists. and other data users.,True,8pK0oMgAAAAJ:A7-hzOuI2KQC,14,https://iase-web.org/documents/papers/sat2013/IASE_IAOS_2013_Paper_K3_Ridgway_Smith.pdf,17443539309322446764,/scholar?cites=17443539309322446764,,https://iase-web.org/documents/papers/sat2013/IASE_IAOS_2013_Paper_K3_Ridgway_Smith.pdf,0,0,0
88560,God-shaped mission: Theological and practical perspectives from the rural church,2013,Alan Smith,,,,,Canterbury Press,Explores some of the issues facing the church. especially in rural areas. and some theological strands in the New Testament that underpin the way we go about mission. This book tells the stories of a range of mission initiatives actually taking place in rural areas and identifies good practice. It identifies opportunities for growth for churches.,True,8pK0oMgAAAAJ:MhiOAD_qIWkC,14,http://books.google.com/books?hl=en&lr=&id=L2qmDwAAQBAJ&oi=fnd&pg=PR9&dq=info:NBM7X4xtojEJ:scholar.google.com&ots=hr2-YZ3X16&sig=W18E35cLuxI-GjkuY-_l6-ilNsw,3576541503746151220,/scholar?cites=3576541503746151220,,,0,0,0
88561,Usborne Internet-linked Science Encyclopedia,2009,Kirsteen Rogers,,,,,Usborne Publishing Limited,,True,8pK0oMgAAAAJ:6HoeAlFIZOwC,14,http://scholar.google.com/scholar?cluster=12804013313966266071&hl=en&oi=scholarr,12804013313966266071,/scholar?cites=12804013313966266071,,,0,0,0
88562,Comparison of the structures of natural and synthetic Pb-Cu-jarosite-type compounds,2008,Karen A Hudson-Edwards and Adrian ML Smith and William E Dubbin and Andrew J Bennett and Pamela J Murphy and Kate Wright,20,European Journal of Mineralogy,2,241-252,E. Schweizerbart'sche Verlagsbuchhandlung Science Publishers,Jarosite minerals are effective scavengers of potentially toxic elements such as Pb and Cu. and are abundant in acid rock drainage systems. acid sulfate soils and metallurgical wastes. We used XRD. SEM. and infrared. Raman and X-ray absorption (EXAFS and XANES) spectroscopy to determine the structural differences between natural and synthetic Pb-Cu-jarosites. Differences in the a0 unit cell dimensions for the natural and synthetic samples (7.2288(27) Å and 7.32088(26) Å. respectively). and c0 unit cell values (34.407(14) Å and 17.0336(7) Å. respectively) are attributed to different proportions of H3O. Fe and Pb in the jarosite structures. The synthetic Pb-Cu-jarosite has sharper Raman and IR spectra. with narrower and more intense bands. suggesting that it is more crystalline than the natural sample. EXAFS fitting of the Fe and Pb data for the natural and synthetic Pb-Cu-jarosite samples are …,True,8pK0oMgAAAAJ:QyXJ3EUuO1IC,14,https://pubs.geoscienceworld.org/eurjmin/article-abstract/20/2/241/62443,14852577881136009463,/scholar?cites=14852577881136009463,,,0,0,0
88563,COULD'FOOD MILES'BECOME A NON-TARIFF BARRIER?,2006,Julian A Heyes and Andrew Smith,,XXVII International Horticultural Congress-IHC2006: International Symposium on The Role of Postharvest Technology in the 768,,431-436,,Movements advocating ‘buy local’have used the ‘Food Miles’ concept to develop consumer awareness of the environmental ‘footprint’of food items freighted over longer distances. and have raised objections to the environmental costs of pandering to consumer demand for year-round availability of a wide variety of horticultural products. This problem requires careful analysis. particularly because the ‘Food Miles’ concept may help to create a new type of non-tariff trade barrier. The environmental benefit of the ‘Food Miles’ concept is not so clear-cut. Transport by sea has been estimated to impose a 20-fold lower energy cost per kg of produce than transport by road. making a simple comparison of kilometres travelled almost meaningless. Air freight. often criticized as the least sustainable form of transport. has a hugely variable environmental cost per kg depending on whether perishable produce is transported in …,True,8pK0oMgAAAAJ:LYDvBi7O6RsC,14,https://www.actahort.org/books/768/768_56.htm,14141985605910665104,/scholar?cites=14141985605910665104,,,0,0,0
88564,A lattice Boltzmann-based model of plankton–flow interaction around a mussel cluster,2006,A Smith and V Nikora and A Ross and G Wake,192,Ecological modelling,3-4,645-657,Elsevier,We present a new modelling approach for assessing the interplay between marine mussels and their environment. as a first step towards identifying optimal aquaculture structures. The lattice Boltzmann (LB) method can accommodate the complex geometry of mussel clusters. We have developed this hydrodynamic model to incorporate the individual and cluster geometry of mussels. the dynamics of phytoplankton concentration (the mussel food supply) and the filtration of water by the mussels. in order to quantify the relationship between the arrangement of the mussels and the spatial distribution of phytoplankton concentration. Results are given on the effect that orientation of the cluster to the flow has on drag force. and we show statistics of phytoplankton uptake for various mussel configurations. It is found that the optimal configuration is generally independent of diffusive conditions. and that the effects of local …,True,8pK0oMgAAAAJ:pYKElYtJMmwC,14,https://www.sciencedirect.com/science/article/pii/S0304380005003273,15087923024964743682,/scholar?cites=15087923024964743682,,,0,0,0
88565,High‐level expression of Dok‐1 in neurons of the primate prefrontal cortex and hippocampus,2004,A Smith and J Wang and CM Cheng and J Zhou and CS Weickert and CA Bondy,75,Journal of neuroscience research,2,218-224,Wiley Subscription Services. Inc.. A Wiley Company,The docking protein p62Dok‐1 (Dok‐1) has a central role in cell signaling mediated by a wide range of protein tyrosine kinases. including intrinsic membrane kinases. such as the insulin‐like growth factor‐1 (IGF‐1) receptor. To elucidate potential IGF signaling mechanisms. we used DNA array technology to investigate novel kinase targets expressed in the primate dorsolateral prefrontal cortex (DLPFC). Dok‐1 transcripts were among the most abundant found in this structure. Because Dok‐1 expression has not been characterized in brain. we evaluated its expression pattern using immunoblotting. in situ hybridization. and immunohistochemistry in the rhesus monkey prefrontal cortex and hippocampal formation. Dok‐1 antibodies identified a 62‐kDa band in lysates from the DLPFC. consistent with the known size for Dok‐1. In situ hybridization showed that Dok‐1 mRNA was expressed in all layers of the DLPFC …,True,8pK0oMgAAAAJ:fh7vmlWxvT0C,14,https://onlinelibrary.wiley.com/doi/abs/10.1002/jnr.10842,6631549141444707774,/scholar?cites=6631549141444707774,,,0,0,0
88566,Foam and film/foam laminates using linear low density polyethylene,2000,,,,,,,It is an object of the present invention to produce a foam that is capable of being re-used or recycled if the foam is not Suitable for use (ie. Scrap material). It is another object to produce a film/foam laminate that is capable of being re-used or recycled if the foam is not Suitable for use (ie. Scrap material). It is yet another object of the present invention to allow recovery of film/foam laminate Scrap into a useful foam product.It is further object of the invention to product a foam Structure that is dimensionally stable. In one embodiment. a polymeric composition is to be used in producing foam. The polymeric composition comprises a linear low density polyethylene and a resiliency modifier resin. The linear low density polyethylene is in the amount of from about 1 to about 90 weight percent of the polymeric composition. The linear low density polyethylene has a Z-average molecular weight. M. greater than about 700.000. The …,True,8pK0oMgAAAAJ:Nw_I7GeUguwC,14,https://patents.google.com/patent/US6114025A/en,3539818294360629489,/scholar?cites=3539818294360629489,,https://patentimages.storage.googleapis.com/f8/80/6e/de202481a0b433/US6114025.pdf,0,0,0
88567,Listeriosis and pregnancy,1983,ARB Smith and BA Lieberman and Linda Allen and AJ Barson,322,The Lancet,8363,1364,Elsevier,Simply purchase your Lancet Choice pass from the Summary or Full Text page of an article you wish to access. This will count as the first of 5 article credits. or ‘Allowances’. and you can use your 4 remaining Allowances to access other articles from any of The Lancet journals.,True,8pK0oMgAAAAJ:FKYJxdYMdFIC,14,https://www.thelancet.com/journals/lancet/article/PIIS0140-6736(83)91120-0/fulltext,9486711965293905240,/scholar?cites=9486711965293905240,,,0,0,0
88568,The elastic photoproduction of neutral pi mesons from deuterium,1966,B Mann and AM Smith and DT Stewart,88,Proceedings of the Physical Society (1958-1967),4,915,IOP Publishing,Differential cross sections have been determined for the elastic neutral pion photoproduction from deuterons at recoil deuteron angles of 25. 30 and 37 (lab.) within the photon energy range 220< Eγ< 280 MeV. The experiment was carried out by detecting the recoil deuteron with a counter telescope capable of distinguishing deuterons from protons and measuring their energy. These and previous results have been compared with an impulse approximation calculation.,True,8pK0oMgAAAAJ:2ywjKiB__4kC,14,https://iopscience.iop.org/article/10.1088/0370-1328/88/4/313/meta,11677849101220511980,/scholar?cites=11677849101220511980,,,0,0,0
88569,Control for heating apparatus,1958,,,,,,,Among the objects of this invention is to provide an improved low cost control of the above mentioned type. Another object of this invention is to provide anim proved control of the above type that may be readily de tached from a portable cooking vessel. A control made in accordance with this invention includes a thermally responsive element for sensing the temperature of a cooking vessel and for actuating a main Switch for controlling the vessel heater in response to changes in vessel temperature. In addition to the main Switch. the control includes a manually adjustable aux iliary Switch for controlling energization of an auxiliary heater disposed adjacent the thermally responsive ele ment. This auxiliary switch is actuated to enable the auxiliary heater to cycle the main switch during a boiling operation. The auxiliary heater is deemergized for cer tain other operations in which the main switch is cycled by the thermally …,True,8pK0oMgAAAAJ:E2bRg1zSkIsC,14,https://patents.google.com/patent/US2847553A/en,7652392999756089963,/scholar?cites=7652392999756089963,,https://patentimages.storage.googleapis.com/34/7e/12/df7214c0265550/US2847553.pdf,0,0,0
88570,National partnership for maternal safety recommended maternal early warning criteria are associated with maternal morbidity,2019,David E Arnolds and Aaron Smith and Jennifer M Banayan and Roxane Holt and Barbara M Scavone,129,Anesthesia & Analgesia,6,1621-1626,LWW,BACKGROUND:Many cases of maternal mortality and morbidity are preventable. A delayed response to clinical warning signs contributes to preventability. Therefore. the National Partnership for Maternal Safety devised maternal early warning criteria (MEWC). composed of abnormal vital signs that trigger bedside evaluation by a provider with the capacity to escalate care. The relationship of the MEWC to maternal morbidity has not been studied. We evaluated the correlation between the MEWC and maternal morbidity.METHODS:We retrospectively reviewed the first 400 deliveries at the University of Chicago in 2016. We analyzed the electronic medical record to determine whether vital signs triggered the MEWC during the admission to labor and delivery and whether patients experienced morbidity during their delivery hospitalization. The association between MEWC and morbidity was tested using χ 2 analysis …,True,8pK0oMgAAAAJ:ovGv7akYl-cC,13,https://journals.lww.com/anesthesia-analgesia/fulltext/2019/12000/national_partnership_for_maternal_safety.28.aspx,8536977685678700119,/scholar?cites=8536977685678700119,,,0,0,0
88571,Transoral laser microsurgery versus radiation therapy in the management of T1 and T2 laryngeal glottic carcinoma: which modality is cost‐effective within the UK?,2017,M Prettyjohns and S Winter and C Kerawala and V Paleri and NICE cancer of the upper aerodigestive tract guideline committee and Martin Robinson and Shreerang Bhide and Margred Capel and Leah Cox and Michael Fenlon and Laurence Newman and Sarah Orr and Tom Roques and Anthony Smith and Stephen Spraggett and Bella Talwar and Selvam Thavaraj and Jane Thornton and Wai Lup Wong,42,Clinical Otolaryngology,2,404-415,,To identify the most cost‐effective treatment strategy in patients with early stage (T1 and T2) cancers of the laryngeal glottis.A Markov decision model populated using data from updated systematic reviews and meta‐analyses. with attributable costs from NHS sources. Data on local control and mortality were obtained from updates of existing systematic reviews conducted for the NICE guideline on cancer of the upper aerodigestive tract. Procedure costs were sourced from NHS reference costs 2013/14 by applying tariffs associated with the appropriate health resource group codeThe UK National Health Service.Patients with early stage (T1 and T2) cancers of the laryngeal glottis.Transoral laser microsurgery (TLM) and radiation therapy (RT).Total costs. incremental costs and quality adjusted life years (QALYs) over a 10‐year time …,True,8pK0oMgAAAAJ:SxCCDk4iOpsC,13,https://onlinelibrary.wiley.com/doi/abs/10.1111/coa.12807,7601419540033144372,/scholar?cites=7601419540033144372,,,0,0,0
