,title,pub_year,author,volume,journal,number,pages,publisher,abstract,filled,author_pub_id,num_citations,pub_url,cites_id,citedby_url,author_id,eprint_url,got_citations,got_author_ids,author_ids
1092915,Upconversion nanoparticles: design. nanochemistry. and applications in theranostics,2014,Guanying Chen and Hailong Qiu and Paras N Prasad and Xiaoyuan Chen,114,,10,5161-5214,American Chemical Society,Theranostics is a concept of integrating imaging and therapy into a single platform for use in the next generation of personalized medicine to meet the challenges in modern health care. 1 The diagnostic role of theranostic agents reports the presence of a disease. its status. and its response to a specific treatment. while the therapeutic role of the agent can be implemented in several forms: 2 (i) The first is imaging-guided surgery for tumor resection and postsurgery evaluation. Intraoperative visualization of diseased areas is important for precision surgery. as the location of the tumor may change after presurgical imaging and during resection. 3− 6 Furthermore. postsurgical assessment is valuable in ensuring complete removal of the diseased sections.(ii) The second is delivery or release of therapeutic entities to the intended site. The delivered entities can be small molecule chemotherapeutics (such as cisplatin …,True,_yF5knkAAAAJ:6Qrnqxh1sGEC,1694,https://pubs.acs.org/doi/full/10.1021/cr400425h,10568514370475125895,/scholar?cites=10568514370475125895,,https://pubs.acs.org/doi/full/10.1021/cr400425h,0,0,0
1092916,In vivo biodistribution and highly efficient tumour targeting of carbon nanotubes in mice,2007,Zhuang Liu and Weibo Cai and Lina He and Nozomi Nakayama and Kai Chen and Xiaoming Sun and Xiaoyuan Chen and Hongjie Dai,2,Nature nanotechnology,1,47-52,Nature Publishing Group,Single-walled carbon nanotubes (SWNTs) exhibit unique size. shape and physical properties 1. 2. 3 that make them promising candidates for biological applications. Here. we investigate the biodistribution of radio-labelled SWNTs in mice by in vivo positron emission tomography (PET). ex vivo biodistribution and Raman spectroscopy. It is found that SWNTs that are functionalized with phospholipids bearing polyethylene-glycol (PEG) are surprisingly stable in vivo. The effect of PEG chain length on the biodistribution and circulation of the SWNTs is studied. Effectively PEGylated SWNTs exhibit relatively long blood circulation times and low uptake by the reticuloendothelial system (RES). Efficient targeting of integrin positive tumour in mice is achieved with SWNTs coated with PEG chains linked to an arginine–glycine–aspartic acid (RGD) peptide. A high tumour accumulation is attributed to the multivalent effect of the …,True,_yF5knkAAAAJ:u-x6o8ySG0sC,1471,https://www.nature.com/articles/nnano.2006.170,13066122014799177319,/scholar?cites=13066122014799177319,,http://web.stanford.edu/group/dailab/Reprint/116.%20In%20vivo%20biodistribution%20and%20highly%20efficient%20tumour%20targeting%20of%20carbon%20nanotubes%20in%20mice.pdf,0,0,0
1092917,Drug delivery with carbon nanotubes for in vivo cancer treatment,2008,Zhuang Liu and Kai Chen and Corrine Davis and Sarah Sherlock and Qizhen Cao and Xiaoyuan Chen and Hongjie Dai,68,Cancer research,16,6652-6660,American Association for Cancer Research,Chemically functionalized single-walled carbon nanotubes (SWNT) have shown promise in tumor-targeted accumulation in mice and exhibit biocompatibility. excretion. and little toxicity. Here. we show in vivo SWNT drug delivery for tumor suppression in mice. We conjugate paclitaxel (PTX). a widely used cancer chemotherapy drug. to branched polyethylene glycol chains on SWNTs via a cleavable ester bond to obtain a water-soluble SWNT-PTX conjugate. SWNT-PTX affords higher efficacy in suppressing tumor growth than clinical Taxol in a murine 4T1 breast cancer model. owing to prolonged blood circulation and 10-fold higher tumor PTX uptake by SWNT delivery likely through enhanced permeability and retention. Drug molecules carried into the reticuloendothelial system are released from SWNTs and excreted via biliary pathway without causing obvious toxic effects to normal organs. Thus. nanotube drug …,True,_yF5knkAAAAJ:qjMakFHDy7sC,1370,https://cancerres.aacrjournals.org/content/68/16/6652.short,13707063582106013495,/scholar?cites=13707063582106013495,,https://cancerres.aacrjournals.org/content/canres/68/16/6652.full.pdf,0,0,0
1092918,Nanoparticle-based theranostic agents,2010,Jin Xie and Seulki Lee and Xiaoyuan Chen,62,,11,1064-1079,Elsevier,Theranostic nanomedicine is emerging as a promising therapeutic paradigm. It takes advantage of the high capacity of nanoplatforms to ferry cargo and loads onto them both imaging and therapeutic functions. The resulting nanosystems. capable of diagnosis. drug delivery and monitoring of therapeutic response. are expected to play a significant role in the dawning era of personalized medicine. and much research effort has been devoted toward that goal. A convenience in constructing such function-integrated agents is that many nanoplatforms are already. themselves. imaging agents. Their well-developed surface chemistry makes it easy to load them with pharmaceutics and promote them to be theranostic nanosystems. Iron oxide nanoparticles. quantum dots. carbon nanotubes. gold nanoparticles and silica nanoparticles. have been previously well investigated in the imaging setting and are candidate …,True,_yF5knkAAAAJ:YFjsv_pBGBYC,1245,https://www.sciencedirect.com/science/article/pii/S0169409X1000164X,10599036346540394193,/scholar?cites=10599036346540394193,,https://www.ncbi.nlm.nih.gov/pmc/articles/pmc2988080/,0,0,0
1092919,Carbon nanotubes as photoacoustic molecular imaging agents in living mice,2008,Adam De La Zerda and Cristina Zavaleta and Shay Keren and Srikant Vaithilingam and Sunil Bodapati and Zhuang Liu and Jelena Levi and Bryan R Smith and Te-Jen Ma and Omer Oralkan and Zhen Cheng and Xiaoyuan Chen and Hongjie Dai and Butrus T Khuri-Yakub and Sanjiv S Gambhir,3,Nature nanotechnology,9,557-562,Nature Publishing Group,Photoacoustic imaging of living subjects offers higher spatial resolution and allows deeper tissues to be imaged compared with most optical imaging techniques 1. 2. 3. 4. 5. 6. 7. As many diseases do not exhibit a natural photoacoustic contrast. especially in their early stages. it is necessary to administer a photoacoustic contrast agent. A number of contrast agents for photoacoustic imaging have been suggested previously 8. 9. 10. 11. 12. 13. 14. 15. but most were not shown to target a diseased site in living subjects. Here we show that single-walled carbon nanotubes conjugated with cyclic Arg-Gly-Asp (RGD) peptides can be used as a contrast agent for photoacoustic imaging of tumours. Intravenous administration of these targeted nanotubes to mice bearing tumours showed eight times greater photoacoustic signal in the tumour than mice injected with non-targeted nanotubes. These results were verified ex vivo …,True,_yF5knkAAAAJ:zYLM7Y9cAGgC,1162,https://www.nature.com/articles/nnano.2008.231,4024385049114396898,/scholar?cites=4024385049114396898,,https://www.ncbi.nlm.nih.gov/pmc/articles/PMC2562547/,0,0,0
1092920,Peptide-labeled near-infrared quantum dots for imaging tumor vasculature in living subjects,2006,Weibo Cai and Dong-Woon Shin and Kai Chen and Olivier Gheysens and Qizhen Cao and Shan X Wang and Sanjiv S Gambhir and Xiaoyuan Chen,6,Nano letters,4,669-676,American Chemical Society,We report the in vivo targeting and imaging of tumor vasculature using arginine-glycine-aspartic acid (RGD) peptide-labeled quantum dots (QDs). Athymic nude mice bearing subcutaneous U87MG human glioblastoma tumors were administered QD705-RGD intravenously. The tumor fluorescence intensity reached maximum at 6 h postinjection with good contrast. The results reported here open up new perspectives for integrin-targeted near-infrared optical imaging and may aid in cancer detection and management including imaging-guided surgery. ,True,_yF5knkAAAAJ:u5HHmVD_uO8C,1109,https://pubs.acs.org/doi/abs/10.1021/nl052405t,16459943084387601496,/scholar?cites=16459943084387601496,,https://www.academia.edu/download/27368079/3.pdf,0,0,0
1092921,Circulation and long-term fate of functionalized. biocompatible single-walled carbon nanotubes in mice probed by Raman spectroscopy,2008,Zhuang Liu and Corrine Davis and Weibo Cai and Lina He and Xiaoyuan Chen and Hongjie Dai,105,Proceedings of the National Academy of Sciences,5,1410-1415,National Academy of Sciences,Carbon nanotubes are promising new materials for molecular delivery in biological systems. The long-term fate of nanotubes intravenously injected into animals in vivo is currently unknown. an issue critical to potential clinical applications of these materials. Here. using the intrinsic Raman spectroscopic signatures of single-walled carbon nanotubes (SWNTs). we measured the blood circulation of intravenously injected SWNTs and detect SWNTs in various organs and tissues of mice ex vivo over a period of three months. Functionalization of SWNTs by branched polyethylene-glycol (PEG) chains was developed. enabling thus far the longest SWNT blood circulation up to 1 day. relatively low uptake in the reticuloendothelial system (RES). and near-complete clearance from the main organs in ≈2 months. Raman spectroscopy detected SWNT in the intestine. feces. kidney. and bladder of mice. suggesting excretion …,True,_yF5knkAAAAJ:9yKSN-GCB0IC,1049,https://www.pnas.org/content/105/5/1410.short,2244916354662121292,/scholar?cites=2244916354662121292,,https://www.pnas.org/content/pnas/105/5/1410.full.pdf,0,0,0
1092922,Reactive oxygen species generating systems meeting challenges of photodynamic cancer therapy,2016,Zijian Zhou and Jibin Song and Liming Nie and Xiaoyuan Chen,45,,23,6597-6626,Royal Society of Chemistry,The reactive oxygen species (ROS)-mediated mechanism is the major cause underlying the efficacy of photodynamic therapy (PDT). The PDT procedure is based on the cascade of synergistic effects between light. a photosensitizer (PS) and oxygen. which greatly favors the spatiotemporal control of the treatment. This procedure has also evoked several unresolved challenges at different levels including (i) the limited penetration depth of light. which restricts traditional PDT to superficial tumours; (ii) oxygen reliance does not allow PDT treatment of hypoxic tumours; (iii) light can complicate the phototherapeutic outcomes because of the concurrent heat generation; (iv) specific delivery of PSs to sub-cellular organelles for exerting effective toxicity remains an issue; and (v) side effects from undesirable white-light activation and self-catalysation of traditional PSs. Recent advances in nanotechnology and nanomedicine …,True,_yF5knkAAAAJ:wThRXJ0beWAC,731,https://pubs.rsc.org/--/content/articlehtml/2016/cs/c6cs00271d,1654185511846315822,/scholar?cites=1654185511846315822,,https://www.ncbi.nlm.nih.gov/pmc/articles/pmc5118097/,0,0,0
1092923,Nanotechnology for multimodal synergistic cancer therapy,2017,Wenpei Fan and Bryant Yung and Peng Huang and Xiaoyuan Chen,117,,22,13566-13638,American Chemical Society,The complexity. diversity. and heterogeneity of tumors seriously undermine the therapeutic potential of treatment. Therefore. the current trend in clinical research has gradually shifted from a focus on monotherapy to combination therapy for enhanced treatment efficacy. More importantly. the cooperative enhancement interactions between several types of monotherapy contribute to the naissance of multimodal synergistic therapy. which results in remarkable superadditive (namely “1 + 1 > 2”) effects. stronger than any single therapy or their theoretical combination. In this review. state-of-the-art studies concerning recent advances in nanotechnology-mediated multimodal synergistic therapy will be systematically discussed. with an emphasis on the construction of multifunctional nanomaterials for realizing bimodal and trimodal synergistic therapy as well as the intensive exploration of the underlying synergistic …,True,_yF5knkAAAAJ:DA5rzP6i-j0C,664,https://pubs.acs.org/doi/abs/10.1021/acs.chemrev.7b00258,2180525426862384679,/scholar?cites=2180525426862384679,,,0,0,0
1092924,Photothermal therapy and photoacoustic imaging via nanotheranostics in fighting cancer,2019,Yijing Liu and Pravin Bhattarai and Zhifei Dai and Xiaoyuan Chen,48,,7,2053-2108,Royal Society of Chemistry,The nonradiative conversion of light energy into heat (photothermal therapy. PTT) or sound energy (photoacoustic imaging. PAI) has been intensively investigated for the treatment and diagnosis of cancer. respectively. By taking advantage of nanocarriers. both imaging and therapeutic functions together with enhanced tumour accumulation have been thoroughly studied to improve the pre-clinical efficiency of PAI and PTT. In this review. we first summarize the development of inorganic and organic nano photothermal transduction agents (PTAs) and strategies for improving the PTT outcomes. including applying appropriate laser dosage. guiding the treatment via imaging techniques. developing PTAs with absorption in the second NIR window. increasing photothermal conversion efficiency (PCE). and also increasing the accumulation of PTAs in tumours. Second. we introduce the advantages of combining PTT with …,True,_yF5knkAAAAJ:lDear0YwZa0C,619,https://pubs.rsc.org/en/content/articlehtml/2018/cs/c8cs00618k,15034069579802750685,/scholar?cites=15034069579802750685,,https://www.ncbi.nlm.nih.gov/pmc/articles/pmc6437026/,0,0,0
1092925,In vivo visualization of embryonic stem cell survival. proliferation. and migration after cardiac delivery,2006,Feng Cao and Shuan Lin and Xiaoyan Xie and Pritha Ray and Manishkumar Patel and Xianzhong Zhang and Micha Drukker and Scott J Dylla and Andrew J Connolly and Xiaoyuan Chen and Irving L Weissman and Sanjiv S Gambhir and Joseph C Wu,113,Circulation,7,1005,NIH Public Access,BackgroundRecent studies have shown that stem cell therapy can promote tissue regeneration; however. monitoring stem cells in vivo remains problematic owing to limitations of conventional histological assays and imaging modalities.Methods and ResultsMurine embryonic stem (ES) cells were stably transduced with a lentiviral vector carrying a novel triple-fusion (TF) reporter gene that consists of firefly luciferase. monomeric red fluorescence protein. and truncated thymidine kinase (fluc-mrfp-ttk). ES cell viability. proliferation. and differentiation ability were not adversely affected by either reporter genes or reporter probes compared with nontransduced control cells (P= NS). Afterward. 1× 10 7 of ES cells carrying the TF reporter gene (ES-TF) were injected into the myocardium of adult nude rats (n= 20). Control animals received nontransduced ES cells (n= 6). At day 4. the bioluminescence and positron emission …,True,_yF5knkAAAAJ:d1gkVwhDpl0C,601,https://www.ncbi.nlm.nih.gov/pmc/articles/pmc4701384/,11653696140659957022,/scholar?cites=11653696140659957022,,https://www.ncbi.nlm.nih.gov/pmc/articles/pmc4701384/,0,0,0
1092926,Overcoming the Achilles' heel of photodynamic therapy,2016,Wenpei Fan and Peng Huang and Xiaoyuan Chen,45,,23,6488-6519,Royal Society of Chemistry,Photodynamic therapy (PDT) has been applied to treat a wide range of medical conditions. including wet age-related macular degeneration psoriasis. atherosclerosis. viral infection and malignant cancers. However. the tissue penetration limitation of excitation light hinders the widespread clinical use of PDT. To overcome this “Achilles' heel”. deep PDT. a novel type of phototherapy. has been developed for the efficient treatment of deep-seated diseases. Based on the different excitation sources. including near-infrared (NIR) light. X-ray radiation. and internal self-luminescence. a series of deep PDT techniques have been explored to demonstrate the advantages of deep cancer therapy over conventional PDT excited by ultraviolet-visible (UV-Vis) light. In particular. the featured applications of deep PDT. such as organelle-targeted deep PDT. hypoxic deep PDT and deep PDT-involved multimodal synergistic therapy …,True,_yF5knkAAAAJ:4Rmygd0nS6gC,588,https://pubs.rsc.org/en/content/articlehtml/2016/cs/c6cs00616g,939295428806532672,/scholar?cites=939295428806532672,,,0,0,0
1092927,Nanoplatforms for targeted molecular imaging in living subjects,2007,Weibo Cai and Xiaoyuan Chen,3,,11,1840-1854,WILEY‐VCH Verlag,Molecular or personalized medicine is the future of patient management and molecular imaging plays a key role towards this goal. Recently. nanoplatform‐based molecular imaging has emerged as an interdisciplinary field. which involves chemistry. engineering. biology. and medicine. Possessing unprecedented potential for early detection. accurate diagnosis. and personalized treatment of diseases. nanoplatforms have been employed in every single biomedical imaging modality. namely. optical imaging. computed tomography. ultrasound. magnetic resonance imaging. single‐photon‐emission computed tomography. and positron emission tomography. Multifunctionality is the key advantage of nanoplatforms over traditional approaches. Targeting ligands. imaging labels. therapeutic drugs. and many other agents can all be integrated into the nanoplatform to allow for targeted molecular imaging and molecular …,True,_yF5knkAAAAJ:YsMSGLbcyi4C,588,https://onlinelibrary.wiley.com/doi/abs/10.1002/smll.200700351,1764526307601380954,/scholar?cites=1764526307601380954,,https://web.ics.purdue.edu/~jfleary/nanomedicine_course_2013/Lecture%203/References/Cai%20and%20Chen%202007.pdf,0,0,0
1092928,Diverse applications of nanomedicine,2017,Beatriz Pelaz and Christoph Alexiou and Ramon A Alvarez-Puebla and Frauke Alves and Anne M Andrews and Sumaira Ashraf and Lajos P Balogh and Laura Ballerini and Alessandra Bestetti and Cornelia Brendel and Susanna Bosi and Monica Carril and Warren CW Chan and Chunying Chen and Xiaodong Chen and Xiaoyuan Chen and Zhen Cheng and Daxiang Cui and Jianzhong Du and Christian Dullin and Alberto Escudero and Neus Feliu and Mingyuan Gao and Michael George and Yury Gogotsi and Arnold Grunweller and Zhongwei Gu and Naomi J Halas and Norbert Hampp and Roland K Hartmann and Mark C Hersam and Patrick Hunziker and Ji Jian and Xingyu Jiang and Philipp Jungebluth and Pranav Kadhiresan and Kazunori Kataoka and Ali Khademhosseini and Jindřich Kopeček and Nicholas A Kotov and Harald F Krug and Dong Soo Lee and Claus-Michael Lehr and Kam W Leong and Xing-Jie Liang and Mei Ling Lim and Luis M Liz-Marzán and Xiaowei Ma and Paolo Macchiarini and Huan Meng and Helmuth Mohwald and Paul Mulvaney and Andre E Nel and Shuming Nie and Peter Nordlander and Teruo Okano and Jose Oliveira and Tai Hyun Park and Reginald M Penner and Maurizio Prato and Victor Puntes and Vincent M Rotello and Amila Samarakoon and Raymond E Schaak and Youqing Shen and Sebastian Sjoqvist and Andre G Skirtach and Mahmoud G Soliman and Molly M Stevens and Hsing-Wen Sung and Ben Zhong Tang and Rainer Tietze and Buddhisha N Udugama and J Scott VanEpps and Tanja Weil and Paul S Weiss and Itamar Willner and Yuzhou Wu and Lily Yang and Zhao Yue and Qian Zhang and Qiang Zhang and Xian-En Zhang and Yuliang Zhao and Xin Zhou and Wolfgang J Parak,11,,3,2313-2381,American Chemical Society,The design and use of materials in the nanoscale size range for addressing medical and health-related issues continues to receive increasing interest. Research in nanomedicine spans a multitude of areas. including drug delivery. vaccine development. antibacterial. diagnosis and imaging tools. wearable devices. implants. high-throughput screening platforms. etc. using biological. nonbiological. biomimetic. or hybrid materials. Many of these developments are starting to be translated into viable clinical products. Here. we provide an overview of recent developments in nanomedicine and highlight the current challenges and upcoming opportunities for the field and translation to the clinic.,True,_yF5knkAAAAJ:3tFfz0KySVIC,574,https://pubs.acs.org/doi/abs/10.1021/acsnano.6b06040,10511703946039355712,/scholar?cites=10511703946039355712,,https://pubs.acs.org/doi/pdf/10.1021/acsnano.6b06040,0,0,0
1092929,Multimodality molecular imaging of tumor angiogenesis,2008,Weibo Cai and Xiaoyuan Chen,49,,Suppl 2,113S-128S,Society of Nuclear Medicine,Molecular imaging is a key component of 21st-century cancer management. The vascular endothelial growth factor (VEGF)/VEGF receptor signaling pathway and integrin α v β 3. a cell adhesion molecule. play pivotal roles in regulating tumor angiogenesis. the growth of new blood vessels. This review summarizes the current status of tumor angiogenesis imaging with SPECT. PET. molecular MRI. targeted ultrasound. and optical techniques. For integrin α v β 3 imaging. only nanoparticle-based probes. which truly target the tumor vasculature rather than tumor cells because of poor extravasation. are discussed. Once improvements in the in vivo stability. tumor-targeting efficacy. and pharmacokinetics of tumor angiogenesis imaging probes are made. translation to clinical applications will be critical for the maximum benefit of these novel agents. The future of tumor angiogenesis imaging lies in multimodality and …,True,_yF5knkAAAAJ:eQOLeE2rZwMC,568,https://jnm.snmjournals.org/content/49/Suppl_2/113S.short,8842685879400265114,/scholar?cites=8842685879400265114,,https://jnm.snmjournals.org/content/jnumed/49/Suppl_2/113S.full.pdf,0,0,0
1092930,Light‐triggered theranostics based on photosensitizer‐conjugated carbon dots for simultaneous enhanced‐fluorescence imaging and photodynamic therapy,2012,Peng Huang and Jing Lin and Xiansong Wang and Zhe Wang and Chunlei Zhang and Meng He and Kan Wang and Feng Chen and Zhiming Li and Guangxia Shen and Daxiang Cui and Xiaoyuan Chen,24,Advanced Materials,37,5104-5110,WILEY‐VCH Verlag,Novel theranostics based on photosensitizer‐conjugated carbon dots is reported. The prepared C‐dots–Ce6 has good stability and high water dispersibility and solubility. non‐cytotoxicity. good biocompatibility. enhanced photosensitizer fluorescence detection and remarkable photodynamic efficacy upon irradiation. The C‐dots–Ce6 conjugate is a good candidate with excellent imaging and tumor‐homing ability for NIR fluorescence imaging monitored PDT treatment.,True,_yF5knkAAAAJ:1HYIo8DVeu0C,561,https://onlinelibrary.wiley.com/doi/abs/10.1002/adma.201200650,13129973582523057548,/scholar?cites=13129973582523057548,,https://www.ncbi.nlm.nih.gov/pmc/articles/pmc3657566/,0,0,0
1092931,PET/MRI dual-modality tumor imaging using arginine-glycine-aspartic (RGD)–conjugated radiolabeled iron oxide nanoparticles,2008,Ha-Young Lee and Zibo Li and Kai Chen and Andrew R Hsu and Chenjie Xu and Jin Xie and Shouheng Sun and Xiaoyuan Chen,49,Journal of Nuclear Medicine,8,1371-1379,Society of Nuclear Medicine,,True,_yF5knkAAAAJ:3fE2CSJIrl8C,559,https://jnm.snmjournals.org/content/49/8/1371.short,16562239076820787109,/scholar?cites=16562239076820787109,,https://jnm.snmjournals.org/content/jnumed/49/8/1371.full.pdf,0,0,0
1092932,Rethinking cancer nanotheranostics,2017,Hongmin Chen and Weizhong Zhang and Guizhi Zhu and Jin Xie and Xiaoyuan Chen,2,,7,1-18,Nature Publishing Group,Advances in nanoparticle synthesis and engineering have produced nanoscale agents affording both therapeutic and diagnostic functions that are often referred to by the portmanteau ‘nanotheranostics’. The field is associated with many applications in the clinic. especially in cancer management. These include patient stratification. drug-release monitoring. imaging-guided focal therapy and post-treatment response monitoring. Recent advances in nanotheranostics have expanded this notion and enabled the characterization of individual tumours. the prediction of nanoparticle–tumour interactions. and the creation of tailor-designed nanomedicines for individualized treatment. Some of these applications require breaking the dogma that a nanotheranostic must combine both therapeutic and diagnostic agents within a single. physical entity; instead. it can be a general approach in which diagnosis and therapy are …,True,_yF5knkAAAAJ:IUimcr2u0DQC,539,https://www.nature.com/articles/natrevmats201724,13792828482701907380,/scholar?cites=13792828482701907380,,https://www.ncbi.nlm.nih.gov/pmc/articles/pmc5654564/,0,0,0
