,title,pub_year,author,volume,journal,number,pages,publisher,abstract,filled,author_pub_id,num_citations,pub_url,cites_id,citedby_url,gsrank,author_id,eprint_url,got_citations,got_author_ids,author_ids
1233546,CMS Physics: Technical Design Report Volume 1: Detector Performance and Software,2006,GL Bayatian and A Korablev and A Soha and O Sharif and M Chertok and W Mitaroff and F Pauss and V Genchev and M Wensveen and V Lemaitre and V Mishra and M Savina and N Colino and P Petagna and G Landsberg and T Keskinpala and F Nessi-Tedaldi and I Vodopiyanov and S Rahatlou and D Green and A Araujo Trindade and S Singh and P Rosinsky and D Smolin and Y Onel and R Fruehwirth and S Asghar and D Engh and D Winn and F Rondeaux and Marina Giunta and L Foa and B Panev and Y Sirois and T Solaija and M Vergili and E Isiksal and I Churin and A Krokhotin and E Widl and L Feld and HG Wang and T Rodrigo and James Nugent Bellinger and V Elsha and B Lisowski and R Adolphi and C Rott and H Kim and A Colaleo and B De Callatay and A Marinov and I Ahmed and A Singovsky and B Baldin and M Konecki and V Andreev and A Shah and M Albrow and C Almeida and P Busson and N Almeida and D Vintache and M Poettgens and V Zhukov and E Marinova and P Sharp and S Vaurynovich and J Olzem and A Bujak and CH Jiang and A Flossdorf and B Raue and A Dominguez and A Bornheim and P Sphicas and G Roland and MW Lee and A Kayis Topaksu and V Perelygin and N Stanton and A Litomin and F Hartmann and P Raics and E James and S Ganjour and D Futyan and P Zalewski and F Ligabue and G Polese and S Stoykova and M Haguenauer and A Ninane and Wilhelm H Bertl and E Tuominen and YS Chung and F Sikler and M Ignatenko and R Loveless and S Petrushanko and JM Lopez and A Bocci and S Greder and J Blaha and A Marchioro and M Jha and S Akhtar and Y Fu and C Tully and C Ciocca and EA De Wolf and I Lokhtin and M Pieri and MS Kalelkar and A Filine and S Marcellini and S Heising and V Korenkov and P Ingenito and I Diaz Merino and Elizabeth Jane Dusinberre Sudano and P Kreuzer and JC Yun and H Mathez and K Gabathuler and DM Newbold and T Ortega Gomez and M Wlochal and Y Zheng and DJ Karmgard and W Sakumoto and N Demaria and A Petrilli and K Doroba and D Konstantinov and E Torassa and M Friedl and M Planinic and B Perea Solano and N De Filippis and P Gartung and M Schmitt and A Racz and A Lath and F Borcherding and J Amundson and C Civinini and M Zeyrek and A Heister and H Castilla Valdez,,,CERN-LHCC-2006-001,,CMS-TDR-008-1,Although the Standard Model (SM) of particle physics has so far been tested to exquisite precision. it is considered to be an effective theory up to some scale Λ≈ TeV. The prime motivation of the Large Hadron Collider (LHC) is to elucidate the nature of electroweak symmetry breaking for which the Higgs mechanism is presumed to be responsible. The experimental study of the Higgs mechanism also can shed light on the mathematical consistency of the SM at energy scales above about 1 TeV. However. there are alternatives that invoke more symmetry such as supersymmetry or invoke new forces or constituents such as strongly-broken electroweak symmetry. technicolour. etc. An as yet unknown mechanism is also possible. Furthermore there are high hopes for discoveries that could pave the way towards a unified theory. These discoveries could take the form of supersymmetry or extra dimensions. the latter requiring modification of gravity at the TeV scale. Hence there are many compelling reasons to investigate the TeV energy scale. Hadron colliders are well suited to the task of exploring new energy domains. and the region of 1 TeV constituent centre-of-mass energy can be explored if the proton energy and the luminosity are high enough. The beam energy (7 TeV) and the design luminosity (L= 1034 cm− 2 s− 1) of the LHC have been chosen in order to study physics at the TeV energy scale. Hence a wide range of physics is potentially possible with the seven-fold increase in energy and a hundred-fold increase in integrated luminosity over the current hadron collider experiments. These conditions also require a very careful design of the …,True,NHVxCnwAAAAJ:KUekCDWCRvQC,212,https://cds.cern.ch/record/922757,3838137315281829060,/scholar?cites=3838137315281829060,,,https://cds.cern.ch/record/922757,0,0,0
1233547,Solitons in systems of coupled scalar fields,1995,D Bazeia and MJ Dos Santos and RF Ribeiro,208,Physics Letters A,1-2,84-88,North-Holland,We present a method to obtain soliton solutions to relativistic systems of coupled scalar fields. This is done by examining the energy associated to static field configurations. In this case we derive a set of first-order differential equations that solve the equations of motion when the energy saturates its lower bound. To illustrate the general results. we investigate some systems described by polynomial interactions in the coupled fields.,True,NHVxCnwAAAAJ:oLQGhPHTrpcC,208,https://www.sciencedirect.com/science/article/pii/037596019500756S,16953694715478343114,/scholar?cites=16953694715478343114,,,https://arxiv.org/pdf/hep-th/0311265,0,0,0
1233548,A aceleracao contemporánea: tempo mundo e espaco mundo.,1993,Milton Santos,,Boletín Geográfico,19,1-10,,Aceleracoes sao momentos culminantes na Historia. como se abrigassem forcas concentradas. explodindo para criarem o novo. A marcha do tempo. de que faiava Michelst no prefacio á sua Historia do Sécuío 19. é marcada por essas grandes perturbacoes aparentemente sem sentido. Daí. a cada época. rnalgrado a certeza de que se atingiu um paramar definitivo. as reacoes de admiracao ou de medo diante do inusitado ea dificuldade para entender os novos esquemas e para encontrar um novo sistema de conceitos que expressem a nova ordem em gestaca~ o.,True,NHVxCnwAAAAJ:2hszv8GT5-sC,200,http://170.210.83.53/htdoc/revele/index.php/geografia/article/view/926,3973258967102816129,/scholar?cites=3973258967102816129,,,http://170.210.83.53/htdoc/revele/index.php/geografia/article/download/926/963,0,0,0
1233549,Ciências Físicas e Naturais. Orientações curriculares para o 3º ciclo do ensino básico,2001,Cecília Galvão and Adelaide Neves and Ana Maria Freire and AM Lopes and Maria da Conceição Santos and Maria da Conceição Vilela and Maria Teresa Oliveira and Mariana Pereira,,"Lisboa: Ministério da Educação, Departamento da Educação Básica",,,,,True,NHVxCnwAAAAJ:9v9c93RoLYUC,192,http://scholar.google.com/scholar?cluster=2621046491488402390&hl=en&oi=scholarr,2621046491488402390,/scholar?cites=2621046491488402390,,,,0,0,0
1233550,Sistema de gestão da qualidade para empresas construtoras,1995,Roberto de Souza and Geraldo Mekbekian and Maria A C Silva and ACMT LEITÃO and Marcia M dos Santos,,São Paulo: Pini,,247,,,True,NHVxCnwAAAAJ:sgVRHlApM4oC,182,http://scholar.google.com/scholar?cluster=5204861495282323079&hl=en&oi=scholarr,5204861495282323079,/scholar?cites=5204861495282323079,,,,0,0,0
1233551,A horta escolar na educação ambiental e alimentar: experiência do Projeto Horta Viva nas escolas municipais de Florianópolis,2006,Fernanda da Silva Morgado,,,,,Florianópolis,O presente estágio foi realizado na Coordenadoria de Alimentação Escolar (CAE) da Secretaria Municipal de Educação (SME) de Florianópolis. no período de 24 de abril a 11 de agosto do ano de 2006. totalizando 360 horas. As atividades desenvolvidas durante o estágio foram supervisionadas pela nutricionista e pedagoga Sanlina Barreto Hülse–CAE/SME. da Prefeitura Municipal de Florianópolis. ficando a responsabilidade de orientação a cargo da professora Mônica Aparecida Aguiar dos Santos do Centro de Ciências Agrárias–CCA. da Universidade Federal de Santa Catarina–UFSC. A Coordenadoria de Alimentação Escolar desenvolve inúmeras ações junto às unidades educativas da rede municipal de ensino. como: seleção e compra de alimentos. fiscalização da qualidade dos alimentos adquiridos; elaboração e acompanhamentos dos cardápios das unidades educativas; capacitações permanentes e orientações às merendeiras quanto aos cuidados higiênicosanitários e qualidade nutricional e sensorial das refeições servidas; implantação e acompanhamento nas escolas de projetos educativos na área de educação alimentar.Dentre os projetos desenvolvidos por esta Coordenadoria destaca-se o projeto intitulado “Horta Viva”. que surgiu em 2001 com o objetivo de auxiliar a formação dos alunos e da comunidade escolar em relação à educação ambiental e alimentar através do incentivo à implantação e manutenção de hortas escolares. O Projeto envolve escolas da primeira e segunda etapa da educação básica. sendo respectivamente a educação infantil e educação fundamental. Atualmente o projeto conta com 46 …,True,NHVxCnwAAAAJ:Kb2XK_T5ZYAC,155,https://repositorio.ufsc.br/bitstream/handle/123456789/118768/230911.pdf?sequence,16038270705187184588,/scholar?cites=16038270705187184588,,,https://repositorio.ufsc.br/bitstream/handle/123456789/118768/230911.pdf?sequence,0,0,0
1233552,Prognostic factors and treatment of penetrating gunshot wounds to the head,2003,Roberto S Martins and MG Siqueira and MTS Santos and N Zanon-Collange and OJS Moraes,60,,2,98-104,Elsevier,In an attempt to evaluate the predictive factors of morbidity and mortality in patients who suffered from civilian gunshot wounds to the head. we reviewed a series of 319 patients admitted to the Hospital Santa Marcelina. São Paulo. Brazil. between 1994 and 2000.Clinical and cranial computed tomography (CT) results are described. The initial Glasgow Coma Scale (GCS). the presence of an unilateral dilated pupil or medium fixed pupils. and five different findings in the CT scan were considered as variables. The Qui-Square Fisher test was utilized to verify the correlation between the presence of the variables and the occurrence of an increased mortality rate and of an unfavorable outcome (Glasgow Outcome Scale = 2 and 3).In 265 cases the missile penetrated the dura (83%). In our study there was a significant correlation between the low GCS scores on admission and a higher mortality …,True,NHVxCnwAAAAJ:S_0nULq340kC,141,https://www.sciencedirect.com/science/article/pii/S0090301903003021,7620714201748425242,/scholar?cites=7620714201748425242,,,https://www.academia.edu/download/53923587/s0090-3019_2803_2900302-120170720-2861-1bilan2.pdf,0,0,0
1233553,Changes in salivary composition in patients with renal failure,2008,I Tomás and JS Marinho and J Limeres and MJ Santos and L Araújo and P Diz,53,Archives of oral biology,6,528-532,Pergamon,To our knowledge. none of the articles has been published in the literature which analyse the alterations of saliva in different stages of chronic renal failure (CRF). The objective of this study has been to analyse the flow. pH and biochemical composition of saliva in patients with moderate–severe CRF (M–S CRF) and with terminal renal failure (TRF).The study group was formed of 50 CRF patients: 22 with M–S CRF and 28 with TRF included in a haemodialysis programme. A control group with similar characteristics was established (n = 64). Saliva samples were taken from both patients and controls to determine the salivary pH and biochemical composition.Whole salivary flow was similar in patients and controls. Salivary concentrations of creatinine. urea. sodium. potassium. chloride and alpha-amylase were significantly higher in patients than in controls. Calcium concentration was …,True,NHVxCnwAAAAJ:OShvA0zO5LQC,139,https://www.sciencedirect.com/science/article/pii/S0003996908000137,5573648668649862240,/scholar?cites=5573648668649862240,,,https://www.academia.edu/download/48078051/Changes_in_salivary_composition_in_patie20160815-358-1l6wqra.pdf,0,0,0
1233554,Population-based multicase-control study in common tumors in Spain (MCC-Spain): rationale and study design,2015,Gemma Castano-Vinyals and Nuria Aragonés and Beatriz Pérez-Gómez and Vicente Martín and Javier Llorca and Victor Moreno and Jone M Altzibar and Eva Ardanaz and Sílvia de Sanjosé and José Juan Jiménez-Moleón and Adonina Tardón and Juan Alguacil and Rosana Peiró and Rafael Marcos-Gragera and Carmen Navarro and Marina Pollán and Manolis Kogevinas,29,Gaceta sanitaria,,308-315,Ediciones Doyma. SL,,True,NHVxCnwAAAAJ:iPtaxXGL5a8C,136,https://www.scielosp.org/article/gs/2015.v29n4/308-315/en/,17012566054990733500,/scholar?cites=17012566054990733500,,,https://www.scielosp.org/article/gs/2015.v29n4/308-315/en/,0,0,0
1233555,Dengue haemorrhagic fever in Cuba. II. Clinical investigations,1984,Maria G Guzman and GP Kouri and Jr Bravo and Maritza Soler and Susana Vazquez and Marianila Santos and R Villaescusa and P Basanta and Gloria Indan and JM Ballester,78,Transactions of the Royal Society of Tropical Medicine and Hygiene,2,239-241,Royal Society of Tropical Medicine and Hygiene,Clinical and serological studies were carried out on 114 patients admitted to hospital in Havana. Cuba with Dengue Haemorrhagic Fever and Dengue Shock Syndrome (DHF/DSS). Serological confirmation of dengue was obtained in 90% of cases. with 5% of cases primary and 95% secondary. Fever. haemorrhagic manifestations. vomiting and headache were the most frequent signs and symptoms. Among haemorrhagic manifestations. petechiae and vaginal bleeding were reported in a larger number of patients. 21 patients presented shock and. of these. 20 were secondary infections. The disease appeared more frequently in white persons and in women. The aetiopathogenicity of the syndromes is discussed. 95% of the cases could be explained on the basis of the secondary infection hypothesis.,True,NHVxCnwAAAAJ:vfT5ieZw1WcC,134,https://academic.oup.com/trstmh/article-abstract/78/2/239/1883137,4327457433701041122,/scholar?cites=4327457433701041122,,,https://www.academia.edu/download/48501213/0035-9203_2884_2990286-420160901-17649-kkhkmw.pdf,0,0,0
1233556,Robotic excavation in construction automation,2002,Quang Ha and Miguel Santos and Quang Nguyen and David Rye and Hugh Durrant-Whyte,9,IEEE Robotics & Automation Magazine,1,20-28,IEEE,This article presents some results of the autonomous excavation project conducted at the Australian Centre for Field Robotics (ACFR) with a focus on construction automation. The application of robotic technology and computer control is one key to construction industry automation. Excavation automation is a multidisciplinary task. encompassing a broad area of research and development. The ultimate goal of the ACFR excavation project is to demonstrate fully autonomous execution of excavation tasks in common construction. such as loading a truck or digging a trench. A number of difficult theoretical and practical problems must be solved to achieve this objective. The problems fall into three main groups: excavation planning. sensing and estimation. and control.,True,NHVxCnwAAAAJ:t3SSBJTuMXcC,127,https://ieeexplore.ieee.org/abstract/document/993151/,15370908961082593877,/scholar?cites=15370908961082593877,,,https://www.academia.edu/download/35354980/Robotic_excavation_in_construction_automation.pdf,0,0,0
1233557,Condutas negativas à saúde em estudantes universitários brasileiros,2013,Thiago Ferreira de Sousa and Helma Pio Mororó José and Aline Rodrigues Barbosa,18,Ciência & Saúde Coletiva,12,3563-3575,ABRASCO-Associação Brasileira de Saúde Coletiva,O objetivo foi estimar as prevalências e os fatores associados aos menores níveis de atividades físicas no lazer. consumo insuficiente de frutas e de hortaliças. consumo de bebidas alcoólicas e hábito de fumar em estudantes de uma universidade pública da região Nordeste do Brasil. A amostra foi estratificada segundo o curso. o período de estudo e o ano de ingresso na universidade. As condutas negativas foram analisadas em relação aos indicadores sociodemográficos e de vínculo com a universidade. por meio das Razões de Prevalências. As condutas negativas de saúde mais prevalentes foram: consumo insuficiente de frutas. hortaliças. menores níveis de atividades físicas no lazer e consumo de bebidas alcoólicas. O consumo insuficiente de frutas. hábito de fumar e consumo excessivo de bebidas alcoólicas foram maiores em homens. Além disso. o consumo insuficiente de hortaliças foi maior em homens. mais jovens. sem companheira. do pai com o ensino fundamental incompleto e com três anos de vivência na universidade. Os menores níveis de atividades físicas no lazer foram maiores em mulheres. mais velhas. com pai com ensino fundamental incompleto e que avaliaram negativamente os relacionamentos com os colegas.,True,NHVxCnwAAAAJ:wW8w_uPXRNAC,118,https://www.scielo.br/scielo.php?pid=S1413-81232013001200013&script=sci_arttext,6820161973362998074,/scholar?cites=6820161973362998074,,,https://www.scielo.br/scielo.php?pid=S1413-81232013001200013&script=sci_arttext,0,0,0
1233558,Aids em idosos: vivências dos doentes,2010,Helana Augusta dos Santos Andrade and Susan Kelly da Silva and Maria Izabel Penha de Oliveira Santos,14,Escola Anna Nery,4,712-719,UFRJ,O objetivo do estudo foi compreender a vivência dos idosos com síndrome da imunodeficiência humana adquirida inscritos em uma unidade de referência do Sistema Único de Saúde da região metropolitana de Belém/PA. A abordagem foi qualitativa. utilizando-se a técnica de análise de conteúdo. e os sujeitos eram 13 idosos. As idades foram entre 60 e 92 anos; seis eram viúvos. dois. casados. e cinco. solteiros; o tempo de descoberta da doença foi de dois meses a 15 anos. As categorias de análise são as relações afetivas. isolamento social. redes de apoio e aposentadoria e trabalho. O estudo desvelou a complexidade de uma doença sem cura para o idoso. sentimentos foram revelados além de transtornos da autoimagem e solidão. que implicaram a revelação à família. Essa vulnerabilidade também traz implicações importantes para a saúde coletiva e para enfermagem. na busca de estratégias de informação e proteção aos idosos.,True,NHVxCnwAAAAJ:TCy96lt6RIkC,99,https://www.scielo.br/scielo.php?pid=S1414-81452010000400009&script=sci_arttext&tlng=pt,8341094468578650993,/scholar?cites=8341094468578650993,,,https://www.scielo.br/scielo.php?pid=S1414-81452010000400009&script=sci_arttext&tlng=pt,0,0,0
1233559,Low-carbohydrate diet for the treatment of gestational diabetes mellitus: a randomized controlled trial,2013,Cristina Moreno-Castilla and Marta Hernandez and Merce Bergua and Maria C Alvarez and Maria A Arce and Karen Rodriguez and Montserrat Martinez-Alonso and Montserrat Iglesias and Magdalena Mateu and Maria D Santos and Linda R Pacheco and Yolanda Blasco and Eva Martin and Nuria Balsells and Nuria Aranda and Didac Mauricio,36,Diabetes Care,8,2233-2238,American Diabetes Association,Medical nutrition therapy based on the control of the amount and distribution of carbohydrates (CHO) is the initial treatment for gestational diabetes mellitus (GDM). but there is a need for randomized controlled trials comparing different dietary strategies. The purpose of this study was to test the hypothesis that a low-CHO diet for the treatment of GDM would lead to a lower rate of insulin treatment with similar pregnancy outcomes compared with a control diet.A total of 152 women with GDM were included in this open. randomized controlled trial and assigned to follow either a diet with low-CHO content (40% of the total diet energy content as CHO) or a control diet (55% of the total diet energy content as CHO). CHO intake was assessed by 3-day food records. The main pregnancy outcomes were also assessed.The rate of women requiring insulin was not …,True,NHVxCnwAAAAJ:viTTOddtVMkC,93,https://care.diabetesjournals.org/content/36/8/2233.short,11715188817223780019,/scholar?cites=11715188817223780019,,,https://care.diabetesjournals.org/content/diacare/36/8/2233.full.pdf,0,0,0
1233560,La división del trabajo entre empresas: las condiciones de trabajo en las pequeñas y medianas empresas de la electrónica y del mueble en Madrid,1989,Juan José Castillo and María Jiménez Zozaya and Andrés Alas-Pumariño and Maximiano Santos,,,,,Ministerio de Trabajo y Seguridad Social. Centro de Publicaciones,,True,NHVxCnwAAAAJ:F2VeH06lQh8C,92,http://scholar.google.com/scholar?cluster=2639761820268544089&hl=en&oi=scholarr,2639761820268544089,/scholar?cites=2639761820268544089,,,,0,0,0
1233561,A logística reversa e a sustentabilidade empresarial,2010,Fábio Ytoshi Shibao and Roberto Giro Moori and MR dos Santos,13,Seminários em administração,,,,2 reasons for the use of Reverse Logistics. Reverse Logistics costs and environmental concern. It was found among the authors researched who gave focus to the use of Reverse Logistics and presented as a result of financial gains and competitive advantage to the companies involved.,True,NHVxCnwAAAAJ:-VEz7GmFoMgC,84,http://sistema.semead.com.br/13semead/resultado/trabalhosPDF/521.pdf,4435421046766047808,/scholar?cites=4435421046766047808,,,http://sistema.semead.com.br/13semead/resultado/trabalhosPDF/521.pdf,0,0,0
1233562,Scientific errors in the Fearnside comments on greenhouse gas emissions (GHG) from hydroelectric dams and response to his political claiming,2006,Luiz Pinguelli Rosa and Marco Aurélio Dos Santos and Bohdan Matvienko and Elizabeth Sikar and Ednaldo Oliveira Dos Santos,75,Climatic Change,1-2,91,Springer Science & Business Media,In the September 2004 edition of Climatic Change (N◦ 66). an editorial comment was published by Philip Fearnside. jointly with an article written by ourselves (Rosa et al.. 2004) reporting on a broad-ranging project through which we measured CO2 and CH4 emissions at eleven Brazilian hydroelectric dams. from Itaipu. with the largest installed capacity in Southern Brazil. northwards to Tucuruı in Amazonia. This comment reflects a long-standing controversy over the estimates presented by Fearnside and the experimental results that we have obtained so far on greenhouse gases emissions by hydroelectric dams in Brazil (Rosa et al.. 1996; Fearnside. 1996). The key issue in this latest comment by Fearnside is based on the fact that the water intake for the Tucuruı hydroelectric dam turbines is located at an average depth of 35m. with a high methane concentration at a pressure of around three atmospheres1 and an estimated temperature of 15◦ C. This water pressure is suddenly eased after running through the turbines to the tailrace. flowing downstream from the hydroelectric dam. while it is drawn into the spillway at a depth of no more than twenty meters. far shallower than the water intake point for the turbines. The author of these comments uses the data published by us (Rosa et al.. 1997) on the methane concentration measured by Tundisi2. who worked in cooperation with our research group. Fearnside commits a series of errors: he is confused about the transformation of units to express the Henry’s constant. obtaining a value that is completely wrong; he errs when calculating the methane concentration in the water,True,NHVxCnwAAAAJ:aqlVkmm33-oC,77,https://www.academia.edu/download/36153070/climatechangefulltextrosaetal2006.pdf,13731111619413190404,/scholar?cites=13731111619413190404,,,https://www.academia.edu/download/36153070/climatechangefulltextrosaetal2006.pdf,0,0,0
1233563,Biogenic gas production from major Amazon reservoirs. Brazil,2003,Luiz Pinguelli Rosa and Marco Aurelio Dos Santos and Bohdan Matvienko and Elisabeth Sikar and Ronaldo Sérgio M Lourenço and Carlos Frederico Menezes,17,Hydrological Processes,7,1443-1450,John Wiley & Sons. Ltd.,Methane (CH4) and carbon dioxide (CO2) emissions from Brazilian reservoirs were assessed. Point measurements were made during 1998 and 1999 (using inverted funnels for bubbles and air and water concentration gradients for diffusion) in the 559 km2 Samuel reservoir. which was initially flooded in 1988. and the 2430 km2 Tucuruí reservoir. which was flooded in 1984. and the data were evaluated with respect to historical measurements in other Brazilian reservoirs. Bubble emissions of CH4 were higher in Samuel (ranging from 2 to 70 mgCH4 m−2 day−1) than in Tucuruí (ranging from 0·5 to 30 mgCH4 m−2 day−1). with the highest values occurring the shallowest regions in each reservoir. CH4 from diffusion for the Tucuruí reservoir ranged from 5 to 30 mgCH4 m−2 day−1. which is lower than that for the Samuel reservoir. which ranged from 10 to 80 mgCH4 m−2 day−1. The smaller emissions in Tucuruí …,True,NHVxCnwAAAAJ:9yKSN-GCB0IC,73,https://onlinelibrary.wiley.com/doi/abs/10.1002/hyp.1295,1885762569715674,/scholar?cites=1885762569715674,,,https://www.researchgate.net/profile/Marco_Dos_Santos/publication/272477195_coppe_hydrological_process/links/54e4ade00cf276cec171ee4d.pdf,0,0,0
