,title,pub_year,author,volume,journal,number,pages,publisher,abstract,filled,author_pub_id,num_citations,pub_url,cites_id,citedby_url,author_id,eprint_url,got_citations
45526,A greedy algorithm for aligning DNA sequences,2000,Zheng Zhang and Scott Schwartz and Lukas Wagner and Webb Miller,7,Journal of Computational biology,1-2,203-214,Mary Ann Liebert. Inc.,For aligning DNA sequences that differ only by sequencing errors. or by equivalent errors from other sources. a greedy algorithm can be much faster than traditional dynamic programming approaches and yet          produce an alignment that is guaranteed to be theoretically optimal. We introduce a new greedy alignment algorithm with particularly good performance and show that it computes the same alignment as does          a certain dynamic programming algorithm. while executing over 10 times faster on appropriate data. An implementation of this algorithm is currently used in a program that assembles the UniGene database          at the National Center for Biotechnology Information.      ,True,7lp2ziEAAAAJ:o4Qvs5Y5TLQC,4525,https://www.liebertpub.com/doi/abs/10.1089/10665270050081478,1831082504589366451,/scholar?cites=1831082504589366451,,http://www.alliot.org/BIO/PDF/10665270050081478.pdf,0
45527,Molecular biological access to the chemistry of unknown soil microbes: a new frontier for natural products,1998,Jo Handelsman and Michelle R Rondon and Sean F Brady and Jon Clardy and Robert M Goodman,5,Chemistry & biology,10,R245-R249,Cell Press,Cultured soil microorganisms have provided a rich source of natural-product chemistry. Because only a tiny fraction of soil microbes from soil are readily cultured. soil might be the greatest untapped resource for novel chemistry. The concept of cloning the metagenome to access the collective genomes and the biosynthetic machinery of soil microflora is explored here.,True,7lp2ziEAAAAJ:d1gkVwhDpl0C,2156,https://www.sciencedirect.com/science/article/pii/S1074552198901089,7430759291749824054,/scholar?cites=7430759291749824054,,https://www.sciencedirect.com/science/article/pii/S1074552198901089/pdf?md5=684bca0048a8cb8ac72c819bca97c1b6&pid=1-s2.0-S1074552198901089-main.pdf&_valck=1,0
45528,Cloning the soil metagenome: a strategy for accessing the genetic and functional diversity of uncultured microorganisms,2000,Michelle R Rondon and Paul R August and Alan D Bettermann and Sean F Brady and Trudy H Grossman and Mark R Liles and Kara A Loiacono and Berkley A Lynch and Ian A MacNeil and Charles Minor and Choi Lai Tiong and Michael Gilman and Marcia S Osburne and JON Clardy and JO Handelsman and Robert M Goodman,66,Applied and environmental microbiology,6,2541-2547,American Society for Microbiology,Recent progress in molecular microbial ecology has revealed that traditional culturing methods fail to represent the scope of microbial diversity in nature. since only a small proportion of viable microorganisms in a sample are recovered by culturing techniques. To develop methods to investigate the full extent of microbial diversity. we used a bacterial artificial chromosome (BAC) vector to construct libraries of genomic DNA isolated directly from soil (termed metagenomic libraries). To date. we have constructed two such libraries. which contain more than 1 Gbp of DNA. Phylogenetic analysis of 16S rRNA gene sequences recovered from one of the libraries indicates that the BAC libraries contain DNA from a wide diversity of microbial phyla. including sequences from diverse taxa such as the low-G+C. gram-positive Acidobacterium.Cytophagales. and Proteobacteria. Initial screening of the libraries in Escherichia coli …,True,7lp2ziEAAAAJ:u-x6o8ySG0sC,1566,https://aem.asm.org/content/66/6/2541.short,4456293916464513531,/scholar?cites=4456293916464513531,,https://aem.asm.org/content/aem/66/6/2541.full.pdf,0
45529,Atomic structures of the human immunophilin FKBP-12 complexes with FK506 and rapamycin,1993,Gregory D Van Duyne and Robert F Standaert and P Andrew Karplus and Stuart L Schreiber and Jon Clardy,229,Journal of molecular biology,1,105-124,Academic Press,High resolution structures for the complexes formed by the immunosuppressive agents FK506 and rapamycin with the human immunophilin FKBP-12 have been determined by X-ray diffraction. FKBP-12 has a novel fold comprised of a five-stranded β-sheet wrapping around a short α-helix with an overall conical shape. Both FK506 and rapamycin bind in the cavity defined by the β-sheet. α-helix and three loops. Both FK506 and rapamycin bind in similar fashions with a set of hydrogen bonds and an unusual carbonyl binding pocket. Bound FK506 has different conformation than free (crystalline) FK506 while rapamycin's bound conformation is virtually identical to that of unbound rapamycin. FKBP-12 is a peptidyl-prolyl isomerase (PPIase). and the structures of the complexes suggest ways in which this catalytic activity could operate. The different complexes are active in suppressing different steps of T cell activation …,True,7lp2ziEAAAAJ:u5HHmVD_uO8C,1333,https://www.sciencedirect.com/science/article/pii/S0022283683710120,15151287448020369973,/scholar?cites=15151287448020369973,,,0
45530,Lessons from natural molecules,2004,Jon Clardy and Christopher Walsh,432,,7019,829-837,Nature Publishing Group,Natural products have inspired chemists and physicians for millennia. Their rich structural diversity and complexity has prompted synthetic chemists to produce them in the laboratory. often with therapeutic applications in mind. and many drugs used today are natural products or natural-product derivatives. Recent years have seen considerable advances in our understanding of natural-product biosynthesis. Coupled with improvements in approaches for natural-product isolation. characterization and synthesis. these could be opening the door to a new era in the investigation of natural products in academia and industry.,True,7lp2ziEAAAAJ:UeHWp8X0CEIC,1306,https://www.nature.com/articles/nature03194,16794561055652476256,/scholar?cites=16794561055652476256,,http://oww-files-public.s3.amazonaws.com/e/ea/Walsh.pdf,0
45531,Ribosomally synthesized and post-translationally modified peptide natural products: overview and recommendations for a universal nomenclature,2013,Paul G Arnison and Mervyn J Bibb and Gabriele Bierbaum and Albert A Bowers and Tim S Bugni and Grzegorz Bulaj and Julio A Camarero and Dominic J Campopiano and Gregory L Challis and Jon Clardy and Paul D Cotter and David J Craik and Michael Dawson and Elke Dittmann and Stefano Donadio and Pieter C Dorrestein and Karl-Dieter Entian and Michael A Fischbach and John S Garavelli and Ulf Göransson and Christian W Gruber and Daniel H Haft and Thomas K Hemscheidt and Christian Hertweck and Colin Hill and Alexander R Horswill and Marcel Jaspars and Wendy L Kelly and Judith P Klinman and Oscar P Kuipers and A James Link and Wen Liu and Mohamed A Marahiel and Douglas A Mitchell and Gert N Moll and Bradley S Moore and Rolf Müller and Satish K Nair and Ingolf F Nes and Gillian E Norris and Baldomero M Olivera and Hiroyasu Onaka and Mark L Patchett and Joern Piel and Martin JT Reaney and Sylvie Rebuffat and R Paul Ross and Hans-Georg Sahl and Eric W Schmidt and Michael E Selsted and Konstantin Severinov and Ben Shen and Kaarina Sivonen and Leif Smith and Torsten Stein and Roderich D Süssmuth and John R Tagg and Gong-Li Tang and Andrew W Truman and John C Vederas and Christopher T Walsh and Jonathan D Walton and Silke C Wenzel and Joanne M Willey and Wilfred A Van Der Donk,30,,1,108-160,Royal Society of Chemistry,Covering: 1988 to 2012       This review presents recommended nomenclature for the biosynthesis of ribosomally synthesized and post-translationally modified peptides (RiPPs). a rapidly growing class of natural products. The current knowledge regarding the biosynthesis of the >20 distinct compound classes is also reviewed. and commonalities are discussed.,True,7lp2ziEAAAAJ:U0iAMwwPxtsC,1281,https://pubs.rsc.org/en/content/articlehtml/2013/np/c2np20085f,2442214366985028515,/scholar?cites=2442214366985028515,,https://www.ncbi.nlm.nih.gov/pmc/articles/pmc3954855/,0
45532,Okadaic acid. a cytotoxic polyether from two marine sponges of the genus Halichondria,1981,Kazuo Tachibana and Paul J Scheuer and Yasumasa Tsukitani and Hiroyuki Kikuchi and Donna Van Engen and Jon Clardy and Yalamanchili Gopichand and Francis J Schmitz,103,Journal of the American Chemical Society,9,2469-2471,American Chemical Society,A new polyether derivative of a C38 fatty acid. okadaic acid (1). has been isolatedindependently from two sponges. Hali-chondria (syn Remera) okadai Kadota. a black sponge. commonly found along the Pacific coast of Japan.* 1 and H. melanodocia. a Caribbean sponge collected in the Florida Keys. Mammalian toxicity of a crude extract of H. okadai guided the isolation of a colorless crystalline solid (~ 10~ 4% from wet animal). The methanolic homogenate was further extracted at room temperature thrice with methanol and once with acetone. After partial solvent evaporation. the 70% aqueous residue was washed with «-hexane. The aqueous residue after complete organic solvent removal was finally extracted with ethyl acetate. Repeated chromatography of the organic residue [polystyrene gel (Hitachi 3019). MeOH; Sephadex LH-20. MeOH; silicic acid.«-hex-f Suntory Institute for Bioorganic Research. Osaka …,True,7lp2ziEAAAAJ:9yKSN-GCB0IC,959,https://pubs.acs.org/doi/abs/10.1021/ja00399a082,9026696590392402964,/scholar?cites=9026696590392402964,,https://pubs.acs.org/doi/pdfplus/10.1021/ja00399a082,0
45533,Structure of the FKBP12-rapamycin complex interacting with binding domain of human FRAP,1996,Jungwon Choi and Jie Chen and Stuart L Schreiber and Jon Clardy,273,Science,5272,239-242,American Association for the Advancement of Science,Rapamycin. a potent immunosuppressive agent. binds two proteins: the FK506-binding protein (FKBP12) and the FKBP-rapamycin-associated protein (FRAP). A crystal structure of the ternary complex of human FKBP12. rapamycin. and the FKBP12-rapamycin-binding (FRB) domain of human FRAP at a resolution of 2.7 angstroms revealed the two proteins bound together as a result of the ability of rapamycin to occupy two different hydrophobic binding pockets simultaneously. The structure shows extensive interactions between rapamycin and both proteins. but fewer interactions between the proteins. The structure of the FRB domain of FRAP clarifies both rapamycin-independent and -dependent effects observed for mutants of FRAP and its homologs in the family of proteins related to the ataxia-telangiectasia mutant gene product. and it illustrates how a small cell-permeable molecule can mediate protein …,True,7lp2ziEAAAAJ:IjCSPb-OGe4C,897,https://science.sciencemag.org/content/273/5272/239.abstract,7225128455541593506,/scholar?cites=7225128455541593506,,,0
45534,Isolation and structure of bryostatin 1,1982,George R Pettit and Cherry L Herald and Dennis L Doubek and Delbert L Herald and Edward Arnold and Jon Clardy,104,Journal of the American Chemical Society,24,6846-6848,American Chemical Society,Marine animals of the phylum Ectoprocta (usually termed Bryozoa or Polyzoa) are colonial filter-feeders and each member (polypide) is enclosed in a separate unit (zooecium). Because of their superficial appearance Bryozoa are commonly known as sea-mats and false corals.* 2 The genus Bugula3 containsvery prominent mosslike colonies. and Bugula neritina (Linnaeus) is well-known for its ability to attach to ship hulls. 4 Our initial report5 that certainBryozoa such as B. neritina L. contain an-ticancer constituents. preliminary study of an adrenochrome-like pigment in the same species. 6 and isolation of indoles such as flustramines A andB from Flustra foliácea7 appear to represent the only prior chemical investigations of Bryozoan metabolites. We now report the structure of a remarkable8 anticancer constituent of Bugula neritina designated bryostatin 1. The study began in 1968 with a Gulf of Mexico collection …,True,7lp2ziEAAAAJ:qjMakFHDy7sC,891,https://pubs.acs.org/doi/abs/10.1021/ja00388a092,14599638878391338566,/scholar?cites=14599638878391338566,,https://pubs.acs.org/doi/pdfplus/10.1021/ja00388a092,0
45535,Diarrhetic shellfish toxins,1985,T Yasumoto and M Murata and Y Oshima and M Sano and GK Matsumoto and J Clardy,41,Tetrahedron,6,1019-1025,Pergamon,As the causative agents of a new type of shellfish poisoning. named diarrhetic shellfish poisoning. okadaic acid. 35(S)-methylokadaic acid. 7-O-acyl derivatives of 35(S)-methylokadaic acid. two novel polyether lactones named pectenotoxin-1 and -2 have been isolated and had their structures determined. Three pectenotoxin analogues were also present. In addition to the previously identified Dinophysis fortii. D. acuminata was newly suggested as a source of toxins.,True,7lp2ziEAAAAJ:zYLM7Y9cAGgC,778,https://www.sciencedirect.com/science/article/pii/S0040402001964695,11536935984299362862,/scholar?cites=11536935984299362862,,,0
45536,D-amino acids trigger biofilm disassembly,2010,Ilana Kolodkin-Gal and Diego Romero and Shugeng Cao and Jon Clardy and Roberto Kolter and Richard Losick,328,Science,5978,627-629,American Association for the Advancement of Science,Bacteria form communities known as biofilms. which disassemble over time. In our studies outlined here. we found that. before biofilm disassembly. Bacillus subtilis produced a factor that prevented biofilm formation and could break down existing biofilms. The factor was shown to be a mixture of d-leucine. d-methionine. d-tyrosine. and d-tryptophan that could act at nanomolar concentrations. d-Amino acid treatment caused the release of amyloid fibers that linked cells in the biofilm together. Mutants able to form biofilms in the presence of d-Amino acids contained alterations in a protein (YqxM) required for the formation and anchoring of the fibers to the cell. d-Amino acids also prevented biofilm formation by Staphylococcus aureus and Pseudomonas aeruginosa. d-amino acids are produced by many bacteria and. thus. may be a widespread signal for biofilm disassembly.,True,7lp2ziEAAAAJ:7PzlFSSx8tAC,764,https://science.sciencemag.org/content/328/5978/627.abstract,7992755544697513778,/scholar?cites=7992755544697513778,,https://www.ncbi.nlm.nih.gov/pmc/articles/pmc2921573/,0
45537,Atomic structure of FKBP-FK506. an immunophilin-immunosuppressant complex,1991,Gregory D Van Duyne and Robert F Standaert and P Andrew Karplus and Stuart L Schreiber and Jon Clardy,252,Science,5007,839-842,American Association for the Advancement of Science,The structure of the human FK506 binding protein (FKBP). complexed with the immunosuppressant FK506. has been determined to 1.7 angstroms resolution by x-ray crystallography. The conformation of the protein changes little upon complexation. but the conformation of FK506 is markedly different in the bound and unbound forms. The drug9s association with the protein involves five hydrogen bonds. a hydrophobic binding pocket lined with conserved aromatic residues. and an unusual carbonyl binding pocket. The nature of this complex has implications for the mechanism of rotamase catalysis and for the biological actions of FK506 and rapamycin.,True,7lp2ziEAAAAJ:2osOgNQ5qMEC,715,https://science.sciencemag.org/content/252/5007/839.abstract,6702185406822460215,/scholar?cites=6702185406822460215,,https://www.researchgate.net/profile/Paul_Karplus/publication/21447083_Atomic_Structure_of_FKBP-FK506_an_Immunophilin-Immunosuppressant_Complex/links/0fcfd50e522ac71b04000000/Atomic-Structure-of-FKBP-FK506-an-Immunophilin-Immunosuppressant-Complex.pdf,0
45538,"Isolation and structure of brevetoxin B from the"" red tide"" dinoflagellate Ptychodiscus brevis (Gymnodinium breve)",1981,Yong-Yeng Lin and Martin Risk and Sammy M Ray and Donna Van Engen and Jon Clardy and Jerzy Golik and John C James and Koji Nakanishi,103,Journal of the American Chemical Society,22,6773-6775,American Chemical Society,BTX-Bi g fragment. and an electron density synthesis revealed all 64 non-hydrogen atoms. Block diagonal least-squares refinement followed by a difference electron density synthesis showed the majorityof the hydrogen atoms. Block diagonal least-squares refinementwith anisotropic nonhydrogen atoms and isotropic hydrogens have converged to a current residual of 0.062 for the observed reflections. Additional crystallographicdetails can be found in the supplementary materials.,True,7lp2ziEAAAAJ:Tyk-4Ss8FVUC,652,https://pubs.acs.org/doi/abs/10.1021/ja00412a053,4475844750070050291,/scholar?cites=4475844750070050291,,https://pubs.acs.org/doi/pdfplus/10.1021/ja00412a053,0
45539,New antibiotics from bacterial natural products,2006,Jon Clardy and Michael A Fischbach and Christopher T Walsh,24,,12,1541-1550,Nature Publishing Group,For the past five decades. the need for new antibiotics has been met largely by semisynthetic tailoring of natural product scaffolds discovered in the middle of the 20 th century. More recently. however. advances in technology have sparked a resurgence in the discovery of natural product antibiotics from bacterial sources. In particular. efforts have refocused on finding new antibiotics from old sources (for example. streptomycetes) and new sources (for example. other actinomycetes. cyanobacteria and uncultured bacteria). This has resulted in several newly discovered antibiotics with unique scaffolds and/or novel mechanisms of action. with the potential to form a basis for new antibiotic classes addressing bacterial targets that are currently underexploited.,True,7lp2ziEAAAAJ:3fE2CSJIrl8C,640,https://www.nature.com/articles/nbt1266,16459620320965113412,/scholar?cites=16459620320965113412,,http://kitto.cm.utexas.edu/courses/ch395g/fall2009/MOL190/Clardy.pdf,0
45540,Isolation of antibiotics turbomycin A and B from a metagenomic library of soil microbial DNA,2002,Doreen E Gillespie and Sean F Brady and Alan D Bettermann and Nicholas P Cianciotto and Mark R Liles and Michelle R Rondon and Jon Clardy and Robert M Goodman and Jo Handelsman,68,Applied and environmental microbiology,9,4301-4306,American Society for Microbiology,To access the genetic and biochemical potential of soil microorganisms by culture-independent methods. a 24.546-member library in Escherichia coli with DNA extracted directly from soil had previously been constructed (M. R. Rondon. P. R. August. A. D. Bettermann. S. F. Brady. T. H. Grossman. M. R. Liles. K. A. Loiacono. B. A. Lynch. I. A. MacNeil. M. S. Osburne. J. Clardy. J. Handelsman. and R. M. Goodman. Appl. Environ. Microbiol. 66:2541-2547. 2000). Three clones. P57G4. P89C8. and P214D2. produced colonies with a dark brown melanin-like color. We fractionated the culture supernatant of P57G4 to identify the pigmented compound or compounds. Methanol extracts of the acid precipitate from the culture supernatant contained a red and an orange pigment. Structural analysis revealed that these were triaryl cations. designated turbomycin A and turbomycin B. respectively; both exhibited broad-spectrum …,True,7lp2ziEAAAAJ:W7OEmFMy1HYC,587,https://aem.asm.org/content/68/9/4301.short,1063118891118189305,/scholar?cites=1063118891118189305,,https://aem.asm.org/content/aem/68/9/4301.full.pdf,0
45541,Insights into secondary metabolism from a global analysis of prokaryotic biosynthetic gene clusters,2014,Peter Cimermancic and Marnix H Medema and Jan Claesen and Kenji Kurita and Laura C Wieland Brown and Konstantinos Mavrommatis and Amrita Pati and Paul A Godfrey and Michael Koehrsen and Jon Clardy and Bruce W Birren and Eriko Takano and Andrej Sali and Roger G Linington and Michael A Fischbach,158,Cell,2,412-421,Cell Press,Although biosynthetic gene clusters (BGCs) have been discovered for hundreds of bacterial metabolites. our knowledge of their diversity remains limited. Here. we used a novel algorithm to systematically identify BGCs in the extensive extant microbial sequencing data. Network analysis of the predicted BGCs revealed large gene cluster families. the vast majority uncharacterized. We experimentally characterized the most prominent family. consisting of two subfamilies of hundreds of BGCs distributed throughout the Proteobacteria; their products are aryl polyenes. lipids with an aryl head group conjugated to a polyene tail. We identified a distant relationship to a third subfamily of aryl polyene BGCs. and together the three subfamilies represent the largest known family of biosynthetic gene clusters. with more than 1.000 members. Although these clusters are widely divergent in sequence. their small molecule products …,True,7lp2ziEAAAAJ:C5mqfHIFIucC,562,https://www.sciencedirect.com/science/article/pii/S0092867414008265,5146828272087098180,/scholar?cites=5146828272087098180,,https://www.sciencedirect.com/science/article/pii/S0092867414008265,0
45542,Tyrosol is a quorum-sensing molecule in Candida albicans,2004,Hao Chen and Masaki Fujita and Qinghua Feng and Jon Clardy and Gerald R Fink,101,Proceedings of the National Academy of Sciences,14,5048-5052,National Academy of Sciences,The human fungal pathogen Candida albicans shows a significant lag in growth when diluted into fresh minimal medium. This lag is abolished by the addition of conditioned medium from a high-density culture. The active component of conditioned medium is tyrosol. which is released into the medium continuously during growth. Under conditions permissive for germ-tube formation. tyrosol stimulates the formation of these filamentous protrusions. Because germ-tube formation is inhibited by farnesol. another quorum-sensing molecule. this process must be under complex positive and negative control by environmental conditions. The identification of tyrosol as an autoregulatory molecule has important implications on the dynamics of growth and morphogenesis in Candida.,True,7lp2ziEAAAAJ:0EnyYjriUFMC,530,https://www.pnas.org/content/101/14/5048.short,1548867607382355656,/scholar?cites=1548867607382355656,,https://www.pnas.org/content/101/14/5048.full,0
45543,Gene expression signature-based chemical genomic prediction identifies a novel class of HSP90 pathway modulators,2006,Haley Hieronymus and Justin Lamb and Kenneth N Ross and Xiao P Peng and Cristina Clement and Anna Rodina and Maria Nieto and Jinyan Du and Kimberly Stegmaier and Srilakshmi M Raj and Katherine N Maloney and Jon Clardy and William C Hahn and Gabriela Chiosis and Todd R Golub,10,Cancer cell,4,321-330,Cell Press,Although androgen receptor (AR)-mediated signaling is central to prostate cancer. the ability to modulate AR signaling states is limited. Here we establish a chemical genomic approach for discovery and target prediction of modulators of cancer phenotypes. as exemplified by AR signaling. We first identify AR activation inhibitors. including a group of structurally related compounds comprising celastrol. gedunin. and derivatives. To develop an in silico approach for target pathway identification. we apply a gene expression-based analysis that classifies HSP90 inhibitors as having similar activity to celastrol and gedunin. Validating this prediction. we demonstrate that celastrol and gedunin inhibit HSP90 activity and HSP90 clients. including AR. Broadly. this work identifies new modes of HSP90 modulation through a gene expression-based strategy.,True,7lp2ziEAAAAJ:LkGwnXOMwfcC,524,https://www.sciencedirect.com/science/article/pii/S1535610806002820,4282426031522424916,/scholar?cites=4282426031522424916,,https://www.sciencedirect.com/science/article/pii/S1535610806002820,0
45544,Crystal and molecular structure of dynemicin A: a novel 1. 5-diyn-3-ene antitumor antibiotic,1990,Masataka Konishi and Hiroaki Ohkuma and Takashi Tsuno and Toshikazu Oki and Gregory D VanDuyne and Jon Clardy,112,Journal of the American Chemical Society,9,3715-3716,American Chemical Society,"Dynemicin A was isolated5 from the ethylacetate extract of M. chersina as a lipophilic violetsolid: HRMS mfz 538.1132 (M+ H)+; C30Hi9NO9+ H requires 538.1138; mp 208-210 C dec;[a] D+ 270 (c 0.01. DMF); IR (KBr) 3420. 3350. 2930. 1660. 1630. 1587. 1480. 1385. 1300. 1280. 1180. and 785 cm"" 1; UV (MeOH) Xmax 239 (< 24900). 282 (sh). 569 (10 800). and 599 nm (10100). The UV spectrum and the absorption shifts observed in weakly acid and alkaline solution6 suggested a 1.4. 5.8-tetrahydroxyanthraquinone chromophore. Poor solubility hampered spectral characterizationof l. 7 but conversion to its triacetate 2 (acetic anhydride-pyridine. 25 C) provided a more tractable material. The l3C NMR spectrum of 2 revealed a1.2. 4.5. 8-pentasubstituted anthraquinone (5C 146.9. s. Cl8; 130.6. d. C17; 131.0. d. C16; 146.4. s. C15; 125.9. s. C14; 180.6. s. C13;(4)(a) Zein. N.; Sinha. AM; McGahren. W. J.; Ellestad. GA …",True,7lp2ziEAAAAJ:WF5omc3nYNoC,524,https://pubs.acs.org/doi/abs/10.1021/ja00165a097,8301860676023075978,/scholar?cites=8301860676023075978,,https://pubs.acs.org/doi/pdf/10.1021/ja00165a097,0
