,title,pub_year,author,volume,journal,number,pages,publisher,abstract,filled,author_pub_id,num_citations,pub_url,cites_id,citedby_url,author_id,eprint_url,got_citations,got_author_ids,author_ids
88318,The genotype-tissue expression (GTEx) project,2013,John Lonsdale and Jeffrey Thomas and Mike Salvatore and Rebecca Phillips and Edmund Lo and Saboor Shad and Richard Hasz and Gary Walters and Fernando Garcia and Nancy Young and Barbara Foster and Mike Moser and Ellen Karasik and Bryan Gillard and Kimberley Ramsey and Susan Sullivan and Jason Bridge and Harold Magazine and John Syron and Johnelle Fleming and Laura Siminoff and Heather Traino and Maghboeba Mosavel and Laura Barker and Scott Jewell and Dan Rohrer and Dan Maxim and Dana Filkins and Philip Harbach and Eddie Cortadillo and Bree Berghuis and Lisa Turner and Eric Hudson and Kristin Feenstra and Leslie Sobin and James Robb and Phillip Branton and Greg Korzeniewski and Charles Shive and David Tabor and Liqun Qi and Kevin Groch and Sreenath Nampally and Steve Buia and Angela Zimmerman and Anna Smith and Robin Burges and Karna Robinson and Kim Valentino and Deborah Bradbury and Mark Cosentino and Norma Diaz-Mayoral and Mary Kennedy and Theresa Engel and Penelope Williams and Kenyon Erickson and Kristin Ardlie and Wendy Winckler and Gad Getz and David DeLuca and Daniel MacArthur and Manolis Kellis and Alexander Thomson and Taylor Young and Ellen Gelfand and Molly Donovan and Yan Meng and George Grant and Deborah Mash and Yvonne Marcus and Margaret Basile and Jun Liu and Jun Zhu and Zhidong Tu and Nancy J Cox and Dan L Nicolae and Eric R Gamazon and Hae Kyung Im and Anuar Konkashbaev and Jonathan Pritchard and Matthew Stevens and Timothèe Flutre and Xiaoquan Wen and Emmanouil T Dermitzakis and Tuuli Lappalainen and Roderic Guigo and Jean Monlong and Michael Sammeth and Daphne Koller and Alexis Battle and Sara Mostafavi and Mark McCarthy and Manual Rivas and Julian Maller and Ivan Rusyn and Andrew Nobel and Fred Wright and Andrey Shabalin and Mike Feolo and Nataliya Sharopova and Anne Sturcke and Justin Paschal and James M Anderson and Elizabeth L Wilder and Leslie K Derr and Eric D Green and Jeffery P Struewing and Gary Temple and Simona Volpi and Joy T Boyer and Elizabeth J Thomson and Mark S Guyer and Cathy Ng and Assya Abdallah and Deborah Colantuoni and Thomas R Insel and Susan E Koester and A Roger Little and Patrick K Bender and Thomas Lehner and Yin Yao and Carolyn C Compton and Jimmie B Vaught and Sherilyn Sawyer and Nicole C Lockhart and Joanne Demchok and Helen F Moore,45,Nature genetics,6,580-585,Nature Publishing Group,,True,8pK0oMgAAAAJ:uWQEDVKXjbEC,3831,,63038959008730260,/scholar?cites=63038959008730260,,,0,0,0
88319,The LHCb detector at the LHC,2008,A Augusto Alves Jr and LM Andrade Filho and AF Barbosa and I Bediaga and G Cernicchiaro and G Guerrer and HP Lima Jr and AA Machado and J Magnin and F Marujo and JM De Miranda and A Reis and A Santos and A Toledo and K Akiba and S Amato and B De Paula and L De Paula and T Da Silva and M Gandelman and JH Lopes and B Maréchal and D Moraes and E Polycarpo and F Rodrigues and J Ballansat and Y Bastian and D Boget and I De Bonis and V Coco and PY David and D Decamp and P Delebecque and C Drancourt and N Dumont-Dayot and C Girard and B Lieunard and MN Minard and B Pietrzyk and T Rambure and G Rospabe and S t'Jampens and Ziad Ajaltouni and G Bohner and R Bonnefoy and D Borras and C Carloganu and Hervé Chanal and E Conte and R Cornat and M Crouau and E Delage and O Deschamps and Pierre Henrard and P Jacquet and C Lacan and J Laubser and J Lecoq and R Lefèvre and M Magne and M Martemiyanov and ML Mercier and S Monteil and V Niess and Pascal Perret and G Reinmuth and A Robert and S Suchorski and K Arnaud and E Aslanides and J Babel and C Benchouk and JP Cachemiche and J Cogan and F Derue and B Dinkespiler and PY Duval and V Garonne and S Favard and R Le Gac and F Leon and O Leroy and PL Liotard and F Marin and M Menouni and P Ollive and S Poss and A Roche and M Sapunov and L Tocco and B Viaud and A Tsaregorodtsev and Y Amhis and G Barrand and S Barsuk and C Beigbeder and R Beneyton and D Breton and O Callot and D Charlet and B d'Almagne and O Duarte and F Fulda-Quenzer and A Jacholkowska and B Jean-Marie and J Lefrancois and F Machefert and P Robbe and MH Schune and V Tocut and I Videau and M Benayoun and P David and L Del Buono and G Gilles and M Domke and H Futterschneider and Ch Ilgner and P Kapusta and M Kolander and R Krause and M Lieng and M Nedos and K Rudloff and S Schleich and R Schwierz and B Spaan and K Wacker and K Warda and M Agari and C Bauer and D Baumeister and N Bulian and HP Fuchs and W Fallot-Burghardt and T Glebe and W Hofmann and KT Knöpfle and S Löchner and A Ludwig and F Maciuc and F Sanchez Nieto and M Schmelling and B Schwingenheuer and E Sexauer and NJ Smale and U Trunk and H Voss and J Albrecht and S Bachmann,3,,08,S08005,IOP Publishing,,True,8pK0oMgAAAAJ:IT1MJ6E3JesC,3298,,11718754967116277557,/scholar?cites=11718754967116277557,,,0,0,0
88320,Global. regional. and national incidence. prevalence. and years lived with disability for 310 diseases and injuries. 1990–2015: a systematic analysis for the Global Burden of …,2016,Theo Vos and Christine Allen and Megha Arora and Ryan M Barber and Zulfiqar A Bhutta and Alexandria Brown and Austin Carter and Daniel C Casey and Fiona J Charlson and Alan Z Chen and Megan Coggeshall and Leslie Cornaby and Lalit Dandona and Daniel J Dicker and Tina Dilegge and Holly E Erskine and Alize J Ferrari and Christina Fitzmaurice and Tom Fleming and Mohammad H Forouzanfar and Nancy Fullman and Peter W Gething and Ellen M Goldberg and Nicholas Graetz and Juanita A Haagsma and Simon I Hay and Catherine O Johnson and Nicholas J Kassebaum and Toana Kawashima and Laura Kemmer and Ibrahim A Khalil and Yohannes Kinfu and Hmwe H Kyu and Janni Leung and Xiaofeng Liang and Stephen S Lim and Alan D Lopez and Rafael Lozano and Laurie Marczak and George A Mensah and Ali H Mokdad and Mohsen Naghavi and Grant Nguyen and Elaine Nsoesie and Helen Olsen and David M Pigott and Christine Pinho and Zane Rankin and Nikolas Reinig and Joshua A Salomon and Logan Sandar and Alison Smith and Jeffrey Stanaway and Caitlyn Steiner and Stephanie Teeple and Bernadette A Thomas and Christopher Troeger and Joseph A Wagner and Haidong Wang and Valentine Wanga and Harvey A Whiteford and Leo Zoeckler and Amanuel Alemu Abajobir and Kalkidan Hassen Abate and Cristiana Abbafati and Kaja M Abbas and Foad Abd-Allah and Biju Abraham and Ibrahim Abubakar and Laith J Abu-Raddad and Niveen ME Abu-Rmeileh and Ilana N Ackerman and Akindele Olupelumi Adebiyi and Zanfina Ademi and Arsène Kouablan Adou and Kossivi Agbelenko Afanvi and Emilie Elisabet Agardh and Arnav Agarwal and Aliasghar Ahmad Kiadaliri and Hamid Ahmadieh and Oluremi N Ajala and Rufus Olusola Akinyemi and Nadia Akseer and Ziyad Al-Aly and Khurshid Alam and Noore KM Alam and Saleh Fahed Aldhahri and Miguel Angel Alegretti and Zewdie Aderaw Alemu and Lily T Alexander and Samia Alhabib and Raghib Ali and Ala'a Alkerwi and François Alla and Peter Allebeck and Rajaa Al-Raddadi and Ubai Alsharif and Khalid A Altirkawi and Nelson Alvis-Guzman and Azmeraw T Amare and Alemayehu Amberbir and Heresh Amini and Walid Ammar and Stephen Marc Amrock and Hjalte H Andersen and Gregory M Anderson and Benjamin O Anderson and Carl Abelardo T Antonio and Atsede Fantahun Aregay and Johan Ärnlöv and Al Artaman and Hamid Asayesh and Reza Assadi and Suleman Atique and Euripide Frinel G Arthur Avokpaho and Ashish Awasthi and Beatriz Paulina Ayala Quintanilla and Peter Azzopardi and Umar Bacha and Alaa Badawi and Kalpana Balakrishnan and Amitava Banerjee and Aleksandra Barac and Suzanne L Barker-Collo and Till Bärnighausen and Lars Barregard and Lope H Barrero and Arindam Basu and Shahrzad Bazargan-Hejazi and Ettore Beghi and Brent Bell and Michelle L Bell and Derrick A Bennett and Isabela M Bensenor and Habib Benzian and Adugnaw Berhane and Eduardo Bernabé and Balem Demtsu Betsu and Addisu Shunu Beyene and Neeraj Bhala and Samir Bhatt and Sibhatu Biadgilign and Kelly Bienhoff and Boris Bikbov and Stan Biryukov and Donal Bisanzio and Espen Bjertness and Jed Blore and Rohan Borschmann and Soufiane Boufous,388,The lancet,10053,1545-1602,Elsevier,,True,8pK0oMgAAAAJ:kGbpvR7Ecy8C,2493,,16526736009745336210,/scholar?cites=16526736009745336210,,,0,0,0
88321,Location-based services,2010,,,,,,,,True,8pK0oMgAAAAJ:BJtnxTr0fRcC,918,,2500580294458729851,/scholar?cites=2500580294458729851,,,0,0,0
88322,Global. regional. and national prevalence. incidence. and disability-adjusted life years for oral conditions for 195 countries. 1990–2015: a systematic analysis for the global …,2017,Nicholas J Kassebaum and Amanda GC Smith and Eduardo Bernabé and Thomas D Fleming and Alex E Reynolds and Theo Vos and CJL Murray and W Marcenes and GBD 2015 Oral Health Collaborators,96,,4,380-387,Sage Publications,,True,8pK0oMgAAAAJ:0klj8wIChNAC,646,,10252036947890566719,/scholar?cites=10252036947890566719,,,0,0,0
88323,Evidence for an extraterrestrial impact 12.900 years ago that contributed to the megafaunal extinctions and the Younger Dryas cooling,2007,Richard B Firestone and Allen West and James P Kennett and L Becker and Ted E Bunch and Zsolt S Revay and Peter H Schultz and T Belgya and DJ Kennett and JM Erlandson and OJ Dickenson and AC Goodyear and RS Harris and GA Howard and JB Kloosterman and P Lechler and PA Mayewski and J Montgomery and R Poreda and T Darrah and SS Que Hee and AR Smith and A Stich and W Topping and JH Wittke and WS Wolbach,104,Proceedings of the National Academy of Sciences,41,16016-16021,National Academy of Sciences,,True,8pK0oMgAAAAJ:SAZ1SQo2q1kC,582,,4023451515756407371,/scholar?cites=4023451515756407371,,,0,0,0
88324,CfA3: 185 type Ia supernova light curves from the CfA,2009,Malcolm Hicken and Peter Challis and Saurabh Jha and Robert P Kirshner and Tom Matheson and Maryam Modjaz and Armin Rest and W Michael Wood-Vasey and Gaspar Bakos and Elizabeth J Barton and Perry Berlind and Ann Bragg and Cesar Briceño and Warren R Brown and Nelson Caldwell and Mike Calkins and Richard Cho and Larry Ciupik and Maria Contreras and Kristi-Concannon Dendy and Anil Dosaj and Nick Durham and Kris Eriksen and Gil Esquerdo and Mark Everett and Emilio Falco and Jose Fernandez and Alejandro Gaba and Peter Garnavich and Genevieve Graves and Paul Green and Ted Groner and Carl Hergenrother and Matthew J Holman and Vit Hradecky and John Huchra and Bob Hutchison and Diab Jerius and Andres Jordan and Roy Kilgard and Miriam Krauss and Kevin Luhman and Lucas Macri and Daniel Marrone and Jonathan McDowell and Daniel McIntosh and Brian McNamara and Tom Megeath and Barbara Mochejska and Diego Munoz and James Muzerolle and Orlando Naranjo and Gautham Narayan and Michael Pahre and Wayne Peters and Dawn Peterson and Ken Rines and Ben Ripman and Anna Roussanova and Rudolph Schild and Aurora Sicilia-Aguilar and Jennifer Sokoloski and Kyle Smalley and Andy Smith and Tim Spahr and KZ Stanek and Pauline Barmby and Stéphane Blondin and Christopher W Stubbs and Andrew Szentgyorgyi and Manuel AP Torres and Amili Vaz and Alexey Vikhlinin and Zhong Wang and Mike Westover and Deborah Woods and Ping Zhao,700,The Astrophysical Journal,1,331,IOP Publishing,,True,8pK0oMgAAAAJ:htyGaKyDgHMC,462,,9281536023845585437,/scholar?cites=9281536023845585437,,,0,0,0
88325,Ladybug: a parametric environmental plugin for grasshopper to help designers create an environmentally-conscious design,2013,Mostapha Sadeghipour Roudsari and Michelle Pak and Adrian Smith,,"Proceedings of the 13th international IBPSA conference held in Lyon, France Aug",,3128-3135,,,True,8pK0oMgAAAAJ:kuq-04jA658C,431,,4735896066563279747,/scholar?cites=4735896066563279747,,,0,0,0
88326,A novel approach to high-quality postmortem tissue procurement: the GTEx project,2015,Latarsha J Carithers and Kristin Ardlie and Mary Barcus and Philip A Branton and Angela Britton and Stephen A Buia and Carolyn C Compton and David S DeLuca and Joanne Peter-Demchok and Ellen T Gelfand and Ping Guan and Greg E Korzeniewski and Nicole C Lockhart and Chana A Rabiner and Abhi K Rao and Karna L Robinson and Nancy V Roche and Sherilyn J Sawyer and Ayellet V Segrè and Charles E Shive and Anna M Smith and Leslie H Sobin and Anita H Undale and Kimberly M Valentino and Jim Vaught and Taylor R Young and Helen M Moore and GTEx Consortium,13,Biopreservation and biobanking,5,311-319,Mary Ann Liebert. Inc.,,True,8pK0oMgAAAAJ:l7t_Zn2s7bgC,428,,15608007856941331437,/scholar?cites=15608007856941331437,,,0,0,0
88327,Orthotopic reimplantation of cryopreserved ovarian cortical strips after high-dose chemotherapy for Hodgkin's lymphoma,2001,John A Radford and BA Lieberman and Daniel R Brison and ARB Smith and JD Critchlow and SA Russell and Amanda J Watson and JA Clayton and Martin Harris and RG Gosden and Stephen M Shalet,357,The Lancet,9263,1172-1175,Elsevier,,True,8pK0oMgAAAAJ:qwOXE0mbtu4C,417,,7569348034022048775,/scholar?cites=7569348034022048775,,,0,0,0
88328,Parallel synthesis and screening of a solid phase carbohydrate library,1996,Rui Liang and Lin Yan and Jennifer Loebach and Min Ge and Yasuhiro Uozumi and Klara Sekanina and Nina Horan and Jeff Gildersleeve and Chris Thompson and Andri Smith and Kaustav Biswas and W Clark Still and Daniel Kahne,274,Science,5292,1520-1522,American Association for the Advancement of Science,,True,8pK0oMgAAAAJ:xm0LlTxljI0C,390,,8731129563649886197,/scholar?cites=8731129563649886197,,,0,0,0
88329,An Inquiry Into the Nature and Causes of the Wealth of Nations: General Editors: RH Campbell and AS Skinner. Textual Editor: WB Todd,1976,Adam Smith and Roy Hutcheson Campbell and Andrew S Skinner,,,,,Clarendon Press,,True,8pK0oMgAAAAJ:Y0agIcFmOsQC,385,,11614068640194625331,/scholar?cites=11614068640194625331,,,0,0,0
88330,The FAST alcohol screening test,2002,Ray Hodgson and Tina Alwyn and Bev John and Betsy Thom and Alyson Smith,37,Alcohol and alcoholism,1,61-66,Oxford University Press,,True,8pK0oMgAAAAJ:BJbdYPG6LGMC,356,,8638429557151148346,/scholar?cites=8638429557151148346,,,0,0,0
88331,Potent and selective inhibition of human cytomegalovirus replication by 1263W94. a benzimidazole L-riboside with a unique mode of action,2002,Karen K Biron and Robert J Harvey and Stanley C Chamberlain and Steven S Good and Albert A Smith and Michelle G Davis and Christine L Talarico and Wayne H Miller and Robert Ferris and Ronna E Dornsife and Sylvia C Stanat and John C Drach and Leroy B Townsend and George W Koszalka,46,Antimicrobial agents and chemotherapy,8,2365-2372,American Society for Microbiology Journals,,True,8pK0oMgAAAAJ:roLk4NBRz8UC,346,,1194202832229720572,/scholar?cites=1194202832229720572,,,0,0,0
88332,Campylobacter pyloridis in peptic ulcer disease: microbiology. pathology. and scanning electron microscopy.,1985,AB Price and J Levi and Jean M Dolby and PL Dunscombe and A Smith and J Clark and Mary L Stephenson,26,Gut,11,1183-1188,BMJ Publishing Group,,True,8pK0oMgAAAAJ:FAceZFleit8C,290,,18075331824158327772,/scholar?cites=18075331824158327772,,,0,0,0
88333,fMRI correlates of the episodic retrieval of emotional contexts,2004,APR Smith and RNA Henson and Raymond J Dolan and MD Rugg,22,Neuroimage,2,868-878,Academic Press,,True,8pK0oMgAAAAJ:nRpfm8aw39MC,281,,15308770927126364067,/scholar?cites=15308770927126364067,,,0,0,0
88334,Task and content modulate amygdala-hippocampal connectivity in emotional retrieval,2006,Adam PR Smith and Klaas E Stephan and Michael D Rugg and Raymond J Dolan,49,Neuron,4,631-638,Cell Press,,True,8pK0oMgAAAAJ:IaI1MmNe2tcC,266,,16584864105631775387,/scholar?cites=16584864105631775387,,,0,0,0
88335,Remembrance of odors past: human olfactory cortex in cross-modal recognition memory,2004,Jay A Gottfried and Adam PR Smith and Michael D Rugg and Raymond J Dolan,42,Neuron,4,687-695,Cell Press,,True,8pK0oMgAAAAJ:v1_lew4L6wgC,258,,582973738200279154,/scholar?cites=582973738200279154,,,0,0,0
88336,Measuring performance on the Healthcare Access and Quality Index for 195 countries and territories and selected subnational locations: a systematic analysis from the Global …,2018,Nancy Fullman and Jamal Yearwood and Solomon M Abay and Cristiana Abbafati and Foad Abd-Allah and Jemal Abdela and Ahmed Abdelalim and Zegeye Abebe and Teshome Abuka Abebo and Victor Aboyans and Haftom Niguse Abraha and Daisy MX Abreu and Laith J Abu-Raddad and Akilew Awoke Adane and Rufus Adesoji Adedoyin and Olatunji Adetokunboh and Tara Ballav Adhikari and Mohsen Afarideh and Ashkan Afshin and Gina Agarwal and Dominic Agius and Anurag Agrawal and Sutapa Agrawal and Aliasghar Ahmad Kiadaliri and Miloud Taki Eddine Aichour and Mohammed Akibu and Rufus Olusola Akinyemi and Tomi F Akinyemiju and Nadia Akseer and Faris Hasan Al Lami and Fares Alahdab and Ziyad Al-Aly and Khurshid Alam and Tahiya Alam and Deena Alasfoor and Mohammed I Albittar and Kefyalew Addis Alene and Ayman Al-Eyadhy and Syed Danish Ali and Mehran Alijanzadeh and Syed M Aljunid and Ala'a Alkerwi and François Alla and Peter Allebeck and Christine Allen and Mahmoud A Alomari and Rajaa Al-Raddadi and Ubai Alsharif and Khalid A Altirkawi and Nelson Alvis-Guzman and Azmeraw T Amare and Kebede Amenu and Walid Ammar and Yaw Ampem Amoako and Nahla Anber and Catalina Liliana Andrei and Sofia Androudi and Carl Abelardo T Antonio and Valdelaine EM Araújo and Olatunde Aremu and Johan Ärnlöv and Al Artaman and Krishna Kumar Aryal and Hamid Asayesh and Ephrem Tsegay Asfaw and Solomon Weldegebreal Asgedom and Rana Jawad Asghar and Mengistu Mitiku Ashebir and Netsanet Abera Asseffa and Tesfay Mehari Atey and Sachin R Atre and Madhu S Atteraya and Leticia Avila-Burgos and Euripide Frinel G Arthur Avokpaho and Ashish Awasthi and Beatriz Paulina Ayala Quintanilla and Animut Alebel Ayalew and Henok Tadesse Ayele and Rakesh Ayer and Tambe Betrand Ayuk and Peter Azzopardi and Natasha Azzopardi-Muscat and Tesleem Kayode Babalola and Hamid Badali and Alaa Badawi and Maciej Banach and Amitava Banerjee and Amrit Banstola and Ryan M Barber and Miguel A Barboza and Suzanne L Barker-Collo and Till Bärnighausen and Simon Barquera and Lope H Barrero and Quique Bassat and Sanjay Basu and Bernhard T Baune and Shahrzad Bazargan-Hejazi and Neeraj Bedi and Ettore Beghi and Masoud Behzadifar and Meysam Behzadifar and Bayu Begashaw Bekele and Abate Bekele Belachew and Saba Abraham Belay and Yihalem Abebe Belay and Michelle L Bell and Aminu K Bello and Derrick A Bennett and James R Bennett and Isabela M Bensenor and Derbew Fikadu Berhe and Eduardo Bernabé and Robert Steven Bernstein and Mircea Beuran and Ashish Bhalla and Paurvi Bhatt and Soumyadeep Bhaumik and Zulfiqar A Bhutta and Belete Biadgo and Ali Bijani and Boris Bikbov and Charles Birungi and Stan Biryukov and Hailemichael Bizuneh and Ian W Bolliger and Kaylin Bolt and Ibrahim R Bou-Orm and Kayvan Bozorgmehr and Oliver Jerome Brady and Alexandra Brazinova and Nicholas JK Breitborde and Hermann Brenner and Gabrielle Britton and Traolach S Brugha and Zahid A Butt and Lucero Cahuana-Hurtado and Ismael Ricardo Campos-Nonato and Julio Cesar Campuzano and Josip Car and Mate Car and Rosario Cárdenas and Juan Jesus Carrero and Felix Carvalho and Carlos A Castañeda-Orjuela and Jacqueline Castillo Rivas and Ferrán Catalá-López and Kelly Cercy and Julian Chalek and Hsing-Yi Chang,391,The Lancet,10136,2236-2271,Elsevier,,True,8pK0oMgAAAAJ:cocyvO7vrcwC,239,,17073739373942962964,/scholar?cites=17073739373942962964,,,0,0,0
88337,Ulcerative colitis and autoimmunity induced by loss of myeloid αv integrins,2007,Adam Lacy-Hulbert and Aileen M Smith and Hamid Tissire and Marc Barry and Denise Crowley and Roderick T Bronson and Jürgen T Roes and John S Savill and Richard O Hynes,104,Proceedings of the National Academy of Sciences,40,15823-15828,National Academy of Sciences,,True,8pK0oMgAAAAJ:-95Q15plzcUC,236,,10079594228396983620,/scholar?cites=10079594228396983620,,,0,0,0
88338,Effects of breakfast and caffeine on cognitive performance. mood and cardiovascular functioning,1994,ANDREW Smith and Anna Kendrick and Andrea Maben and Jenny Salmon,22,Appetite,1,39-55,Academic Press,,True,8pK0oMgAAAAJ:Dip1O2bNi0gC,236,,9419542110771626065,/scholar?cites=9419542110771626065,,,0,0,0
88339,Approaches to studying racism and sexism in Black women's lives,1983,Althea Smith and Abigail J Stewart,39,Journal of Social Issues,3,1-15,Blackwell Publishing Ltd,,True,8pK0oMgAAAAJ:U_h31ocWZrQC,232,,12811820881085792554,/scholar?cites=12811820881085792554,,,0,0,0
88340,Scavenging deep demersal fishes of the Porcupine Seabight. north-east Atlantic: observations by baited camera. trap and trawl,1994,Imants George Priede and Philip Michael Bagley and A Smith and S Creasey and NR Merrett,74,Journal of the Marine Biological Association of the United Kingdom,3,481-498,Cambridge University Press,,True,8pK0oMgAAAAJ:t7izwRedFcYC,213,,8069522967338172949,/scholar?cites=8069522967338172949,,,0,0,0
88341,The antiosteoporotic efficacy of intravenous pamidronate in men with prostate carcinoma receiving combined androgen blockade: a double blind. randomized. placebo‐controlled …,2001,Terrence H Diamond and Julie Winters and Angie Smith and Paul De Souza and John H Kersley and William J Lynch and Carl Bryant,92,Cancer,6,1444-1450,John Wiley & Sons. Inc.,,True,8pK0oMgAAAAJ:6sy8ByAbWgIC,208,,3971105586630194357,/scholar?cites=3971105586630194357,,,0,0,0
88342,Ion beam therapy system and its couch positioning method,2007,,,,,,,,True,8pK0oMgAAAAJ:Np1obAXpBq8C,186,,2589876482003081117,/scholar?cites=2589876482003081117,,,0,0,0
88343,A pilot study of functional magnetic resonance imaging brain correlates of deception in healthy young men,2004,F Andrew Kozel and Letty J Revell and Jeffrey P Lorberbaum and Ananda Shastri and Jon D Elhai and Michael David Horner and Adam Smith and Ziad Nahas and Daryl E Bohning and Mark S George,16,The Journal of Neuropsychiatry and Clinical Neurosciences,3,295-305,American Psychiatric Publishing,,True,8pK0oMgAAAAJ:kVjdVfd2voEC,184,,1344304008641722250,/scholar?cites=1344304008641722250,,,0,0,0
88344,Principles of analytic validation of immunohistochemical assays: guideline from the College of American Pathologists Pathology and Laboratory Quality Center,2014,Patrick L Fitzgibbons and Linda A Bradley and Lisa A Fatheree and Randa Alsabeh and Regan S Fulton and Jeffrey D Goldsmith and Thomas S Haas and Rouzan G Karabakhtsian and Patti A Loykasek and Monna J Marolt and Steven S Shen and Anthony T Smith and Paul E Swanson,138,Archives of Pathology and Laboratory Medicine,11,1432-1443,the College of American Pathologists,,True,8pK0oMgAAAAJ:ehoypfNsBj8C,177,,1672570872918437762,/scholar?cites=1672570872918437762,,,0,0,0
88345,Surface thermometry by laser‐induced fluorescence,1989,LP Goss and AA Smith and ME Post,60,Review of scientific instruments,12,3702-3706,American Institute of Physics,,True,8pK0oMgAAAAJ:5bfplxN71z4C,152,,13383085545605699187,/scholar?cites=13383085545605699187,,,0,0,0
88346,High incidence of positive peritoneal cytology in low-risk endometrial cancer treated by laparoscopically assisted vaginal hysterectomy,2001,Yukio Sonoda and Marc Zerbe and Alex Smith and Oscar Lin and Richard R Barakat and William J Hoskins,80,Gynecologic oncology,3,378-382,Academic Press,,True,8pK0oMgAAAAJ:6xXPb0EiZccC,148,,3554672166408599901,/scholar?cites=3554672166408599901,,,0,0,0
88347,Measurement of the  Cross Section between  and 11.20 GeV,2009,B Aubert and M Bona and Y Karyotakis and JP Lees and V Poireau and E Prencipe and X Prudent and V Tisserand and J Garra Tico and E Grauges and L Lopez and A Palano and M Pappagallo and G Eigen and B Stugu and Luyan Sun and GS Abrams and M Battaglia and DN Brown and RN Cahn and RG Jacobsen and LT Kerth and Yu G Kolomensky and G Lynch and IL Osipenkov and MT Ronan and K Tackmann and T Tanabe and CM Hawkes and N Soni and AT Watson and H Koch and T Schroeder and D Walker and DJ Asgeirsson and BG Fulsom and C Hearty and TS Mattison and JA McKenna and M Barrett and A Khan and VE Blinov and AD Bukin and AR Buzykaev and VP Druzhinin and VB Golubev and AP Onuchin and SI Serednyakov and Yu I Skovpen and EP Solodov and K Yu Todyshev and M Bondioli and S Curry and I Eschrich and D Kirkby and AJ Lankford and P Lund and M Mandelkern and EC Martin and DP Stoker and S Abachi and C Buchanan and JW Gary and F Liu and O Long and BC Shen and GM Vitug and Z Yasin and L Zhang and V Sharma and C Campagnari and TM Hong and D Kovalskyi and MA Mazur and JD Richman and TW Beck and AM Eisner and CJ Flacco and CA Heusch and J Kroseberg and WS Lockman and AJ Martinez and T Schalk and BA Schumm and A Seiden and MG Wilson and LO Winstrom and CH Cheng and DA Doll and B Echenard and F Fang and DG Hitlin and I Narsky and T Piatenko and FC Porter and R Andreassen and G Mancinelli and BT Meadows and K Mishra and MD Sokoloff and PC Bloom and WT Ford and A Gaz and JF Hirschauer and M Nagel and U Nauenberg and JG Smith and KA Ulmer and SR Wagner and R Ayad and A Soffer and WH Toki and RJ Wilson and DD Altenburg and E Feltresi and A Hauke and H Jasper and M Karbach and J Merkel and A Petzold and B Spaan and K Wacker and MJ Kobel and WF Mader and R Nogowski and KR Schubert and R Schwierz and A Volk and D Bernard and GR Bonneaud and E Latour and M Verderi and PJ Clark and S Playfer and JE Watson and M Andreotti and D Bettoni and C Bozzi and R Calabrese and A Cecchi and G Cibinetto and P Franchini and E Luppi and M Negrini and A Petrella and L Piemontese and V Santoro and R Baldini-Ferroli and A Calcaterra and R De Sangro,102,Physical review letters,1,012001,American Physical Society,,True,8pK0oMgAAAAJ:NhqRSupF_l8C,146,,5557614338290556663,/scholar?cites=5557614338290556663,,,0,0,0
