,title,pub_year,author,volume,journal,number,pages,publisher,abstract,filled,author_pub_id,num_citations,pub_url,cites_id,citedby_url,author_id,eprint_url,got_citations,got_author_ids,author_ids
1115317,Simulating and explaining passive air sampling rates for semivolatile compounds on polyurethane foam passive samplers,2013,Nicholas T Petrich and Scott N Spak and Gregory R Carmichael and Dingfei Hu and Andres Martinez and Keri C Hornbuckle,47,Environmental science & technology,15,8591-8598,American Chemical Society,Passive air samplers (PAS) including polyurethane foam (PUF) are widely deployed as an inexpensive and practical way to sample semivolatile pollutants. However. concentration estimates from PAS rely on constant empirical mass transfer rates. which add unquantified uncertainties to concentrations. Here we present a method for modeling hourly sampling rates for semivolatile compounds from hourly meteorology using first-principle chemistry. physics. and fluid dynamics. calibrated from depuration experiments. This approach quantifies and explains observed effects of meteorology on variability in compound-specific sampling rates and analyte concentrations. simulates nonlinear PUF uptake. and recovers synthetic hourly concentrations at a reference temperature. Sampling rates are evaluated for polychlorinated biphenyl congeners at a network of Harner model samplers in Chicago. IL. during 2008. finding …,True,yFS538MAAAAJ:JV2RwH3_ST0C,41,https://pubs.acs.org/doi/abs/10.1021/es401532q,5448842694635766900,/scholar?cites=5448842694635766900,,https://www.ncbi.nlm.nih.gov/pmc/articles/PMC3764502/,0,0,0
1115318,Overview of the LADCO winter nitrate study: hourly ammonia. nitric acid and PM2.5 composition at an urban and rural site pair during PM2.5 episodes in the US …,2012,C Stanier and A Singh and W Adamski and J Baek and M Caughey and G Carmichael and E Edgerton and D Kenski and M Koerber and J Oleson and T Rohlf and SR Lee and N Riemer and S Shaw and S Sousan and SN Spak,12,Atmospheric Chemistry and Physics,22,11037-11056,Copernicus GmbH, An overview of the LADCO (Lake Michigan Air Directors Consortium) Winter Nitrate Study (WNS) is presented. Sampling was conducted at ground level at an urban-rural pair of sites during January–March 2009 in eastern Wisconsin. toward the western edge of the US Great Lakes region. Areas surrounding these sites experience multiday episodes of wintertime PM2.5 pollution characterized by high fractions of ammonium nitrate in PM. low wind speeds. and air mass stagnation. Hourly surface monitoring of inorganic gases and aerosols supplemented long-term 24-h aerosol chemistry monitoring at these locations. The urban site (Milwaukee. WI) experienced 13 PM2.5 episodes. defined as periods where the seven-hour moving average PM2.5 concentration exceeded 27 μg m−3 for at least four consecutive hours. The rural site experienced seven episodes by the same metric. and all rural episodes coincided with urban episodes. Episodes were characterized by low pressure systems. shallow/stable boundary layer. light winds. and increased temperature and relative humidity relative to climatological mean conditions. They often occurred in the presence of regional snow cover at temperatures near freezing. when snow melt and sublimation could generate fog and strengthen the boundary layer inversion. Substantial contribution to nitrate production from nighttime chemistry of ozone and NO2 to N2O5 and nitric acid is likely and requires further investigation. Pollutant-specific urban excess during episode and non-episode conditions is presented. The largest remaining uncertainties in the conceptual model of the wintertime episodes are the …,True,yFS538MAAAAJ:qxL8FJ1GzNcC,41,https://acp.copernicus.org/articles/12/11037/2012/,9401606697089191796,/scholar?cites=9401606697089191796,,https://acp.copernicus.org/articles/12/11037/2012/acp-12-11037-2012.pdf,0,0,0
1115319,Seasonality of speciated aerosol transport over the Great Lakes region,2009,Scott N Spak and Tracey Holloway,114,Journal of Geophysical Research: Atmospheres,D8,,,The Community Multiscale Air Quality model (CMAQ) is used to simulate aerosol mass and composition in the Great Lakes region of North America in an annual study for 2002. Model predictions are evaluated against daily and weekly average speciated fine particle (PM2.5) and bulk (PM2.5 and PM10) mass concentration measurements taken throughout the region by the Interagency Monitoring of Protected Visual Environments (IMPROVE). Speciation Trends Network (STN). and Clean Air Status and Trends Network (CASTNet) monitoring networks. and number concentration is evaluated using hourly observations at a rural site. Through detailed evaluation of model‐measurement agreement over urban and remote areas. major features of aerosol seasonality are examined. Whereas nitrate (winter maximum) and sulfate (summer maximum) seasonal patterns are driven by climatic influence on aerosol …,True,yFS538MAAAAJ:UeHWp8X0CEIC,39,https://agupubs.onlinelibrary.wiley.com/doi/abs/10.1029/2008JD010598,13465346025683383371,/scholar?cites=13465346025683383371,,https://agupubs.onlinelibrary.wiley.com/doi/pdf/10.1029/2008JD010598,0,0,0
1115320,MICS-Asia II: Impact of global emissions on regional air quality in Asia,2008,Tracey Holloway and Tatsuya Sakurai and Zhiwei Han and Susanna Ehlers and Scott N Spak and Larry W Horowitz and Gregory R Carmichael and David G Streets and Y Hozumi and Hiromasa Ueda and SU Park and Christopher Fung and M Kajino and Narisara Thongboonchoo and Magnuz Engardt and Cecilia Bennet and Hiroshi Hayami and Karine Sartelet and Zifa Wang and K Matsuda and Markus Amann,42,Atmospheric Environment,15,3543-3561,Pergamon,This study quantifies the seasonality and geographic variability of global pollutant inflow to Asia. Asia is often looked to as a major source of intercontinental air pollution transport with rising emissions and efficient pollutant export processes. However. the degree to which foreign emissions have been imported to Asia has not been thoroughly examined. The Model Inter-Comparison Study for Asia (MICS-Asia) is an international collaboration to study air pollution transport and chemistry in Asia. Using the global atmospheric chemistry Model of Ozone and Related Tracers (MOZART v. 2.4). and comparing results with a suite of regional models participating in MICS-Asia. we find that imported O3 contributes significantly throughout Asia. The choice of upper boundary condition is found to be particularly important for O3. even for surface concentrations. Both North America and Europe contribute to ground-level O3 …,True,yFS538MAAAAJ:2osOgNQ5qMEC,39,https://www.sciencedirect.com/science/article/pii/S1352231007008928,4406718867838219682,/scholar?cites=4406718867838219682,,http://citeseerx.ist.psu.edu/viewdoc/download?doi=10.1.1.558.1584&rep=rep1&type=pdf,0,0,0
1115321,Calibration and evaluation of PUF-PAS sampling rates across the Global Atmospheric Passive Sampling (GAPS) network,2018,Nicholas J Herkert and Scott N Spak and Austen Smith and Jasmin K Schuster and Tom Harner and Andres Martinez and Keri C Hornbuckle,20,Environmental Science: Processes & Impacts,1,210-219,Royal Society of Chemistry,Passive air samplers equipped with polyurethane foam (PUF-PAS) are frequently used to measure persistent organic pollutants (POPs) in ambient air. Here we present and evaluate a method to determine sampling rates (RS). and the effective sampling volume (Veff). for gas-phase chemical compounds captured by a PUF-PAS sampler deployed anywhere in the world. The method uses a mathematical model that requires only publicly available hourly meteorological data. physical–chemical properties of the target compound. and the deployment dates. The predicted RS is calibrated from sampling rates determined from 5 depuration compounds (13C PCB-9. 13C PCB-15. 13C PCB-32. PCB-30. and d6-γ-HCH) injected in 82 samples from 24 sites deployed by the Global Atmospheric Passive Sampling (GAPS) network around the world. The dimensionless fitting parameter. gamma. was found to be constant at 0.267 …,True,yFS538MAAAAJ:K3LRdlH-MEoC,37,https://pubs.rsc.org/az/content/articlehtml/2018/em/c7em00360a,2828589980438583595,/scholar?cites=2828589980438583595,,https://www.ncbi.nlm.nih.gov/pmc/articles/PMC5783774/,0,0,0
1115322,Variations of flame retardant. polycyclic aromatic hydrocarbon. and pesticide concentrations in Chicago’s atmosphere measured using passive sampling,2015,Angela A Peverly and Yuning Ma and Marta Venier and Zachary Rodenburg and Scott N Spak and Keri C Hornbuckle and Ronald A Hites,49,Environmental science & technology,9,5371-5379,American Chemical Society,Atmospheric concentrations of flame retardants. polycyclic aromatic hydrocarbons. and pesticides were measured using passive air samplers equipped with polyurethane foam disks to find spatial information in and around Chicago. Illinois. Samplers were deployed around the greater Chicago area for intervals of 6 weeks from 2012 to 2013 (inclusive). Volumes were calculated using passive sampling theory and were based on meteorology and the compounds’ octanol–air partition coefficients. Geometric mean concentrations of total polybrominated diphenyl ethers ranged from 11 to 150 pg/m3. and tributyl phosphate. tris(2-chloroethyl)phosphate. tris(1-chloro-2-propyl)phosphate. and triphenyl phosphate concentrations were in the ranges of 54–290. 32–340. 130–580. and 170–580 pg/m3. respectively. The summed concentrations of 16 PAHs ranged from 8700 to 52 000 pg/m3 over the sampling area. and DDT …,True,yFS538MAAAAJ:u_35RYKgDlwC,35,https://pubs.acs.org/doi/abs/10.1021/acs.est.5b00216,12857334106727361409,/scholar?cites=12857334106727361409,,https://www.ncbi.nlm.nih.gov/pmc/articles/PMC6314031/,0,0,0
1115323,Modeled aerosol nitrate formation pathways during wintertime in the Great Lakes region of North America,2014,Yoo Jung Kim and Scott N Spak and Gregory R Carmichael and Nicole Riemer and Charles O Stanier,119,Journal of Geophysical Research: Atmospheres,21,"12,420-12,445",,Episodic wintertime particle pollution by ammonium nitrate is an important air quality concern across the Midwest U.S. Understanding and accurately forecasting PM2.5 episodes are complicated by multiple pathways for aerosol nitrate formation. each with uncertain rate parameters. Here. the Community Multiscale Air Quality model (CMAQ) simulated regional atmospheric nitrate budgets during the 2009 LADCO Winter Nitrate Study. using integrated process rate (IPR) and integrated reaction rate (IRR) tools to quantify relevant processes. Total nitrate production contributing to PM2.5 episodes is a regional phenomenon. with peak production over the Ohio River Valley and southern Great Lakes. Total nitrate production in the lower troposphere is attributed to three pathways. with 57% from heterogeneous conversion of N2O5. 28% from the reaction of OH and NO2. and 15% from homogeneous conversion of N2O5 …,True,yFS538MAAAAJ:35N4QoGY0k4C,35,https://agupubs.onlinelibrary.wiley.com/doi/abs/10.1002/2014JD022320,4658785067676215410,/scholar?cites=4658785067676215410,,https://agupubs.onlinelibrary.wiley.com/doi/pdf/10.1002/2014JD022320,0,0,0
1115324,Impacts of aerosol particles on the microphysical and radiative properties of stratocumulus clouds over the southeast Pacific Ocean,2013,CH Twohy and Jeffrey R Anderson and DW Toohey and M Andrejczuk and A Adams and M Lytle and RC George and R Wood and P Saide and S Spak and P Zuidema and D Leon,13,Atmospheric Chemistry and Physics,5,2541-2562,Copernicus GmbH,The southeast Pacific Ocean is covered by the world's largest stratocumulus cloud layer. which has a strong impact on ocean temperatures and climate in the region. The effect of anthropogenic sources of aerosol particles on the stratocumulus deck was investigated during the VOCALS field experiment. Aerosol measurements below and above cloud were made with a ultra-high sensitivity aerosol spectrometer and analytical electron microscopy. In addition to more standard in-cloud measurements. droplets were collected and evaporated using a counterflow virtual impactor (CVI). and the non-volatile residual particles were analyzed. Many flights focused on the gradient in cloud properties on an EW track along 20° S from near the Chilean coast to remote areas offshore. Mean statistics. including their significance. from eight flights and many individual legs were compiled. Consistent with a continental source of cloud condensation nuclei. below-cloud accumulation-mode aerosol and droplet number concentration generally decreased from near shore to offshore. Single particle analysis was used to reveal types and sources of the enhanced particle number that influence droplet concentration. While a variety of particle types were found throughout the region. the dominant particles near shore were partially neutralized sulfates. Modeling and chemical analysis indicated that the predominant source of these particles in the marine boundary layer along 20° S was anthropogenic pollution from central Chilean sources. with copper smelters a relatively small contribution. Cloud droplets were smaller in regions of enhanced particles near shore. However …,True,yFS538MAAAAJ:maZDTaKrznsC,34,https://acp.copernicus.org/articles/13/2541/2013/,18196227870904867214,/scholar?cites=18196227870904867214,,https://acp.copernicus.org/articles/13/2541/2013/,0,0,0
1115325,Inventory of PCBs in Chicago and opportunities for reduction in airborne emissions and human exposure,2015,Caitlin E Shanahan and Scott N Spak and Andres Martinez and Keri C Hornbuckle,49,Environmental science & technology,23,13878-13888,American Chemical Society,Urban areas are important regional sources of airborne polychlorinated biphenyls (PCBs) and population-scale airborne exposure. yet a comprehensive bottom-up source inventory of PCB emissions has never been quantified at urban scales in the United States. Here we report a comprehensive parcel level inventory of PCB stocks and emissions for Chicago. Illinois. developed with a transferable method from publicly available data. Chicago’s legacy stocks hold 276 ± 147 tonnes ∑PCBs. with 0.2 tonnes added annually. Transformers and building sealants represent the largest legacy categories at 250 and 20 tonnes. respectively. From these stocks. annual emissions rates of 203 kg for ∑PCBs and 3 kg for PCB 11 explain observed concentrations in Chicago air. Sewage sludge drying contributes 25% to emissions. soils 31%. and transformers 21%. Known contaminated sites account for <1% of stocks and 17% of …,True,yFS538MAAAAJ:a0OBvERweLwC,33,https://pubs.acs.org/doi/abs/10.1021/acs.est.5b00906,722390259490653536,/scholar?cites=722390259490653536,,https://www.ncbi.nlm.nih.gov/pmc/articles/PMC6201697/,0,0,0
1115326,Global and regional modeling of clouds and aerosols in the marine boundary layer during VOCALS: the VOCA intercomparison,2015,MC Wyant and Christopher S Bretherton and Robert Wood and GR Carmichael and A Clarke and J Fast and R George and WI Gustafson Jr and Cecile Hannay and Axel Lauer and Yanluan Lin and J-J Morcrette and J Mulcahy and PE Saide and SN Spak and Qing Yang,15,Atmospheric Chemistry and Physics,1,153-172,Copernicus GmbH, A diverse collection of models are used to simulate the marine boundary layer in the southeast Pacific region during the period of the October–November 2008 VOCALS REx (VAMOS Ocean Cloud Atmosphere Land Study Regional Experiment) field campaign. Regional models simulate the period continuously in boundary-forced free-running mode. while global forecast models and GCMs (general circulation models) are run in forecast mode. The models are compared to extensive observations along a line at 20° S extending westward from the South American coast. Most of the models simulate cloud and aerosol characteristics and gradients across the region that are recognizably similar to observations. despite the complex interaction of processes involved in the problem. many of which are parameterized or poorly resolved. Some models simulate the regional low cloud cover well. though many models underestimate MBL (marine boundary layer) depth near the coast. Most models qualitatively simulate the observed offshore gradients of SO2. sulfate aerosol. CCN (cloud condensation nuclei) concentration in the MBL as well as differences in concentration between the MBL and the free troposphere. Most models also qualitatively capture the decrease in cloud droplet number away from the coast. However. there are large quantitative intermodel differences in both means and gradients of these quantities. Many models are able to represent episodic offshore increases in cloud droplet number and aerosol concentrations associated with periods of offshore flow. Most models underestimate CCN (at 0.1% supersaturation) in the MBL and free …,True,yFS538MAAAAJ:M05iB0D1s5AC,33,https://acp.copernicus.org/articles/15/153/2015/,12781252675811237081,/scholar?cites=12781252675811237081,,https://acp.copernicus.org/articles/15/153/2015/acp-15-153-2015.pdf,0,0,0
1115327,Source sector and region contributions to BC and PM2.5 in Central Asia,2015,S Kulkarni and N Sobhani and JP Miller-Schulze and MM Shafer and JJ Schauer and PA Solomon and PE Saide and SN Spak and YF Cheng and HAC Denier Van Der Gon and Z Lu and DG Streets and Greet Janssens-Maenhout and C Wiedinmyer and J Lantz and M Artamonova and B Chen and S Imashev and L Sverdlik and JT Deminter and B Adhikary and A D'Allura and C Wei and GR Carmichael,15,Atmospheric Chemistry and Physics,4,1683-1705,Copernicus GmbH,Particulate matter (PM) mass concentrations. seasonal cycles. source sector. and source region contributions in Central Asia (CA) are analyzed for the period April 2008–July 2009 using the Sulfur Transport and dEposition Model (STEM) chemical transport model and modeled meteorology from the Weather Research and Forecasting (WRF) model. Predicted aerosol optical depth (AOD) values (annual mean value~ 0.2) in CA vary seasonally. with lowest values in the winter. Surface PM 2.5 concentrations (annual mean value~ 10 μg m− 3) also exhibit a seasonal cycle. with peak values and largest variability in the spring/summer. and lowest values and variability in the winter (hourly values from 2 to 90 μg m− 3). Surface concentrations of black carbon (BC)(mean value~ 0.1 μg m− 3) show peak values in the winter. The simulated values are compared to surface measurements of AOD as well as PM 2.5. PM 10. BC. and organic carbon (OC) mass concentrations at two regional sites in Kyrgyzstan (Lidar Station Teplokluchenka (LST) and Bishkek). The predicted values of AOD and PM mass concentrations and their seasonal cycles are fairly well captured. The carbonaceous aerosols are underpredicted in winter. and analysis suggests that the winter heating emissions are underestimated in the current inventory. Dust. from sources within and outside CA. is a significant component of the PM mass and drives the seasonal cycles of PM and AOD. On an annual basis. the power and industrial sectors are found to be the most important contributors to the anthropogenic portion of PM 2.5. Residential combustion and transportation are shown to be the …,True,yFS538MAAAAJ:J_g5lzvAfSwC,32,https://acp.copernicus.org/articles/15/1683/2015/,7846750590511362661,/scholar?cites=7846750590511362661,,https://acp.copernicus.org/articles/15/1683/2015/,0,0,0
1115328,Aerosols. climate. and the hydrological cycle,2001,VCPJ Ramanathan and PJ Crutzen and JT Kiehl and Daniel Rosenfeld,294,,5549,2119-2124,American Association for the Advancement of Science,Human activities are releasing tiny particles (aerosols) into the atmosphere. These human-made aerosols enhance scattering and absorption of solar radiation. They also produce brighter clouds that are less efficient at releasing precipitation. These in turn lead to large reductions in the amount of solar irradiance reaching Earth9s surface. a corresponding increase in solar heating of the atmosphere. changes in the atmospheric temperature structure. suppression of rainfall. and less efficient removal of pollutants. These aerosol effects can lead to a weaker hydrological cycle. which connects directly to availability and quality of fresh water. a major environmental issue of the 21st century.,True,MHbvpzAAAAAJ:BrOSOlqYqPUC,3696,https://science.sciencemag.org/content/294/5549/2119.abstract,4720261791416854710,/scholar?cites=4720261791416854710,,http://citeseerx.ist.psu.edu/viewdoc/download?doi=10.1.1.586.2998&rep=rep1&type=pdf,0,0,0
1115329,Global and regional climate changes due to black carbon,2008,Veerabhadran Ramanathan and Gregory Carmichael,1,Nature Geoscience,4,221-227,Nature Publishing Group,Black carbon in soot is the dominant absorber of visible solar radiation in the atmosphere. Anthropogenic sources of black carbon. although distributed globally. are most concentrated in the tropics where solar irradiance is highest. Black carbon is often transported over long distances. mixing with other aerosols along the way. The aerosol mix can form transcontinental plumes of atmospheric brown clouds. with vertical extents of 3 to 5 km. Because of the combination of high absorption. a regional distribution roughly aligned with solar irradiance. and the capacity to form widespread atmospheric brown clouds in a mixture with other aerosols. emissions of black carbon are the second strongest contribution to current global warming. after carbon dioxide emissions. In the Himalayan region. solar heating from black carbon at high elevations may be just as important as carbon dioxide in the melting of snowpacks and …,True,MHbvpzAAAAAJ:9yKSN-GCB0IC,3045,https://www.nature.com/articles/ngeo156,7553409238748668370,/scholar?cites=7553409238748668370,,https://citeseerx.ist.psu.edu/viewdoc/download?doi=10.1.1.1061.2931&rep=rep1&type=pdf,0,0,0
1115330,An inventory of gaseous and primary aerosol emissions in Asia in the year 2000,2003,DG Streets and TC Bond and GR Carmichael and SD Fernandes and Q Fu and D He and Z Klimont and SM Nelson and NY Tsai and M Qm Wang and J-H Woo and KF Yarber,108,Journal of Geophysical Research,D21,8809,American Geophysical Union,An inventory of air pollutant emissions in Asia in the year 2000 is developed to support atmospheric modeling and analysis of observations taken during the TRACE‐P experiment funded by the National Aeronautics and Space Administration (NASA) and the ACE‐Asia experiment funded by the National Science Foundation (NSF) and the National Oceanic and Atmospheric Administration (NOAA). Emissions are estimated for all major anthropogenic sources. including biomass burning. in 64 regions of Asia. We estimate total Asian emissions as follows: 34.3 Tg SO2. 26.8 Tg NOx. 9870 Tg CO2. 279 Tg CO. 107 Tg CH4. 52.2 Tg NMVOC. 2.54 Tg black carbon (BC). 10.4 Tg organic carbon (OC). and 27.5 Tg NH3. In addition. NMVOC are speciated into 19 subcategories according to functional groups and reactivity. Thus we are able to identify the major source regions and types for many of the significant gaseous and …,True,MHbvpzAAAAAJ:u5HHmVD_uO8C,2181,https://agupubs.onlinelibrary.wiley.com/doi/abs/10.1029/2002JD003093,8684766309828449633,/scholar?cites=8684766309828449633,,https://agupubs.onlinelibrary.wiley.com/doi/full/10.1029/2002JD003093,0,0,0
1115331,co-authors. 2003. An inventory of gaseous and primary aerosol emissions in Asia in the year 2000,,DG Streets and TC Bond and GR Carmichael and SD Fernandes and Q Fu and D He,108,J. Geophys. Res,21,8809-8832,,,True,MHbvpzAAAAAJ:abG-DnoFyZgC,2169,,8684766309828449633,/scholar?cites=8684766309828449633,,,0,0,0
1115332,Asian emissions in 2006 for the NASA INTEX-B mission,2009,Qiang Zhang and David G Streets and Gregory R Carmichael and KB He and H Huo and A Kannari and Z Klimont and IS Park and S Reddy and JS Fu and D Chen and L Duan and Y Lei and LT Wang and ZL Yao,9,Atmos. Chem. Phys,14,5131-5153,, A new inventory of air pollutant emissions in Asia in the year 2006 is developed to support the Intercontinental Chemical Transport Experiment-Phase B (INTEX-B) funded by the National Aeronautics and Space Administration (NASA). Emissions are estimated for all major anthropogenic sources. excluding biomass burning. We estimate total Asian anthropogenic emissions in the year 2006 as follows: 47.1 Tg SO2. 36.7 Tg NOx. 298.2 Tg CO. 54.6 Tg NMVOC. 29.2 Tg PM10. 22.2 Tg PM2.5. 2.97 Tg BC. and 6.57 Tg OC. We emphasize emissions from China because they dominate the Asia pollutant outflow to the Pacific and the increase of emissions from China since 2000 is of great concern. We have implemented a series of improved methodologies to gain a better understanding of emissions from China. including a detailed technology-based approach. a dynamic methodology representing rapid technology renewal. critical examination of energy statistics. and a new scheme of NMVOC speciation for model-ready emissions. We estimate China's anthropogenic emissions in the year 2006 to be as follows: 31.0 Tg SO2. 20.8 Tg NOx. 166.9 Tg CO. 23.2 Tg NMVOC. 18.2 Tg PM10. 13.3 Tg PM2.5. 1.8 Tg BC. and 3.2 Tg OC. We have also estimated 2001 emissions for China using the same methodology and found that all species show an increasing trend during 2001–2006: 36% increase for SO2. 55% for NOx. 18% for CO. 29% for VOC. 13% for PM10. and 14% for PM2.5. BC. and OC. Emissions are gridded at a resolution of 30 min×30 min and can be accessed at our web site (http://mic.greenresource.cn/intex-b2006).,True,MHbvpzAAAAAJ:UeHWp8X0CEIC,1952,https://acp.copernicus.org/articles/9/5131/2009/,15591270587296132738,/scholar?cites=15591270587296132738,,https://acp.copernicus.org/articles/9/5131/2009/acp-9-5131-2009.pdf,0,0,0
