,title,pub_year,author,volume,journal,number,pages,publisher,abstract,filled,author_pub_id,num_citations,pub_url,cites_id,citedby_url,author_id,eprint_url,got_citations
45644,CR377. a new pentaketide antifungal agent isolated from an endophytic fungus,2000,Sean F Brady and Jon Clardy,63,Journal of natural products,10,1447-1448,American Chemical Society,Cultures of endophytic fungi collected in the Guanacaste Conservation Area of Costa Rica were screened for antifungal activity. CR377. a new pentaketide antifungal agent. was isolated from the culture broth of a fungus. CR377 (Fusarium sp.). that showed potent activity against Candida albicans in this assay. The structure of CR377 was established using 1- and 2-D NMR and HRFABMS. ,True,7lp2ziEAAAAJ:kRWSkSYxWN8C,142,https://pubs.acs.org/doi/abs/10.1021/np990568p,4880560599625552454,/scholar?cites=4880560599625552454,,,0
45645,New insight into the catalytic mechanism of chorismate mutases from structural studies,1995,AY Lee and John D Stewart and Jon Clardy and Bruce Ganem,2,,4,195-203,Cell Press,Chorismate mutase catalyzes the rearrangement of chorismic acid to prephenic acid. which is the first committed step in the biosynthesis of aromatic amino acids. Its catalytic mechanism has been much studied. but is poorly understood. Recent structural information on enzymes from two species. and on an antibody that catalyzes the same reaction. has shed new light on this topic.,True,7lp2ziEAAAAJ:NaGl4SEjCO4C,142,https://www.sciencedirect.com/science/article/pii/1074552195902694,4421143625275536074,/scholar?cites=4421143625275536074,,https://www.sciencedirect.com/science/article/pii/1074552195902694/pdf?md5=799ce05d08165a271ff1f2676726be70&pid=1-s2.0-1074552195902694-main.pdf&_valck=1,0
45646,Hormothamnione. a novel cytotoxic styrylchromone from the marine cyanophyte Hormothamnion enteromorphoides grunow,1986,William H Gerwick and Albert Lopez and Gregory D Van Duyne and Jon Clardy and Wanda Ortiz and Adriana Baez,27,Tetrahedron letters,18,1979-1982,Pergamon,The first naturally occurring styrylchromone. hormothamnione. was isolated from the marine cyanophyte Hormothamnion enteromorphoides and its structure determined by an x-ray experiment on its triacetate derivative. Hormothamnione is an exceptionally potent cytotoxin to cancer cells in vitro and appears to be a selective inhibitor of RNA synthesis.,True,7lp2ziEAAAAJ:RGFaLdJalmkC,142,https://www.sciencedirect.com/science/article/pii/S0040403900844263,17585423318175540643,/scholar?cites=17585423318175540643,,,0
45647,Biological activity of guanacastepene. a novel diterpenoid antibiotic produced by an unidentified fungus CR115,2000,MP Singh and Jeffrey E Janso and SW Luckman and Sean F Brady and Jon Clardy and M Greenstein and WM Maiese,53,The Journal of antibiotics,3,256-261,Japan Antibiotics Research Association,Culture CR115 was maintained on Bennetts' agar plate (incubated at 22 C for 14 days). The culture was streaked on various agar media (see Table 1) and incubated at three different temperatures (22. 28. and 37 C) for up to 21 days.,True,7lp2ziEAAAAJ:M05iB0D1s5AC,140,https://www.jstage.jst.go.jp/article/antibiotics1968/53/3/53_3_256/_article/-char/ja/,3742174151982963753,/scholar?cites=3742174151982963753,,https://www.jstage.jst.go.jp/article/antibiotics1968/53/3/53_3_256/_pdf,0
45648,Bisandrographolide from Andrographis paniculata activates TRPV4 channels,2006,Paula L Smith and Katherine N Maloney and Randy G Pothen and Jon Clardy and David E Clapham,281,Journal of Biological Chemistry,40,29897-29904,Elsevier,Many transient receptor potential (TRP) channels are activated or blocked by various compounds found in plants; two prominent examples include the activation of TRPV1 channels by capsaicin and the activation of TRPM8 channels by menthol. We sought to identify additional plant compounds that are active on other types of TRP channels. We screened a library of extracts from 50 Chinese herbal plants using a calcium-imaging assay to find compounds active on TRPV3 and TRPV4 channels. An extract from the plant Andrographis paniculata potently activated TRPV4 channels. The extract was fractionated further. and the active compound was identified as bisandrographolide A (BAA). We used purified compound to characterize the activity of BAA on certain TRPV channel subtypes. Although BAA activated TRPV4 channels with an EC50 of 790-950 nm. it did not activate or block activation of TRPV1. TRPV2. or …,True,7lp2ziEAAAAJ:TeJ9juy8vcMC,139,https://www.sciencedirect.com/science/article/pii/S0021925819338967,5856019529684307649,/scholar?cites=5856019529684307649,,https://www.sciencedirect.com/science/article/pii/S0021925819338967,0
45649,The structures of syringolides 1 and 2. novel C-glycosidic elicitors from Pseudomonas syringae pv. tomato,1993,Sharon L Midland and Noel T Keen and James J Sims and M Mark Midland and Mark M Stayton and Vicki Burton and Mitchell J Smith and Eugene P Mazzola and Kate J Graham and Jon Clardy,58,The Journal of Organic Chemistry,11,2940-2945,American Chemical Society,The isolation and structure determination of two bacterial signal molecules which elicit active plant defense responses are reported. The production of these molecules by Gram-negative bacteria requires the action of avirulence gene D (avrD). cloned from Pseudomonas syringae pv. tomato. The structures of syringolide 1 (la) and syringolide 2 (lb) are determined by a combination ofNMR experiments. biosynthetic arguments. molecular modeling. and X-ray crystallography. A proposed biosynthetic scheme based on the condensation of D-xylulose with a d-ketoalkanoic acid is presented. Further cyclization of the biosynthetic intermediates leads to C-glycosides with a novel tricyclic ring system. These are the first nonproteinaceous specific elicitors of a plant hypersensitive response.In the plant kingdom one widespread type of resistance to microbial pathogens is the hypersensitive response (HR). This active defense …,True,7lp2ziEAAAAJ:TQgYirikUcIC,137,https://pubs.acs.org/doi/abs/10.1021/jo00063a007,8041392606542430279,/scholar?cites=8041392606542430279,,,0
45650,Pestalotiopsins A and B:  New Caryophyllenes from an Endophytic Fungus of Taxus brevifolia,1996,Maurizio Pulici and Fumio Sugawara and Hiroyuki Koshino and Jun Uzawa and Shigeo Yoshida and Emil Lobkovsky and Jon Clardy,61,The Journal of organic chemistry,6,2122-2124,American Chemical Society,Two new caryophyllene sesquiterpenes have been isolated from Pestalotiopsis sp.. an endophytic fungus associated with the bark and leaves of Taxus brevifolia. Pestalotiopsin A (1) has a novel oxatricyclic ring system while pestalotiopsin B (3) exists as two slowly equilibrating atropisomers (6:5 ratio of ββ:βα) in chloroform solution at room temperature. Structures of 1 and 3 were determined by spectroscopic analyses and single-crystal X-ray diffraction. ,True,7lp2ziEAAAAJ:abG-DnoFyZgC,136,https://pubs.acs.org/doi/abs/10.1021/jo951736v,10647730331997296871,/scholar?cites=10647730331997296871,,,0
45651,Zwittermicin A. an antifungal and plant protection agent from Bacillus cereus,1994,Haiyin He and Laura A Silo-Suh and Jo Handelsman and Jon Clardy,35,Tetrahedron letters,16,2499-2502,Pergamon,Zwittermicin A (1). a new linear aminopolyol. was isolated from Bacillus cereus UW85 and its structure was determined by spectroscopic methods.,True,7lp2ziEAAAAJ:D03iK_w7-QYC,136,https://www.sciencedirect.com/science/article/pii/S0040403900771541,9721727569854023176,/scholar?cites=9721727569854023176,,https://handelsmanlab.discovery.wisc.edu/wp-content/uploads/2018/01/ZwittermicinAanantifungal1994.pdf,0
45652,Heavy metal and pesticide content in commonly prescribed individual raw Chinese Herbal Medicines,2011,Eric SJ Harris and Shugeng Cao and Bruce A Littlefield and Jane A Craycroft and Robert Scholten and Ted Kaptchuk and Yanling Fu and Wenquan Wang and Yong Liu and Hubiao Chen and Zhongzhen Zhao and Jon Clardy and Alan D Woolf and David M Eisenberg,409,Science of the Total Environment,20,4297-4305,Elsevier,Heavy metal and pesticide contamination has previously been reported in Chinese Herbal Medicines (CHMs). in some cases at potentially toxic levels. This study was conducted to determine general patterns and toxicological significance of heavy metal and pesticide contamination in a broad sample of raw CHMs. Three-hundred-thirty-four samples representing 126 species of CHMs were collected throughout China and examined for arsenic. cadmium. chromium. lead. and mercury. Of the total. 294 samples representing 112 species were also tested for 162 pesticides. At least 1 metal was detected in all 334 samples (100%) and 115 samples (34%) had detectable levels of all metals. Forty-two different pesticides were detected in 108 samples (36.7%). with 1 to 9 pesticides per sample. Contaminant levels were compared to toxicological reference values in the context of different exposure scenarios. According to a …,True,7lp2ziEAAAAJ:ZqE1mSdD_DYC,135,https://www.sciencedirect.com/science/article/pii/S0048969711007509,10081260218419461213,/scholar?cites=10081260218419461213,,https://www.ncbi.nlm.nih.gov/pmc/articles/pmc3163780/,0
45653,Interspecies modulation of bacterial development through iron competition and siderophore piracy,2012,Matthew F Traxler and Mohammad R Seyedsayamdost and Jon Clardy and Roberto Kolter,86,Molecular microbiology,3,628-644,,While soil‐dwelling actinomycetes are renowned for secreting natural products. little is known about the roles of these molecules in mediating actinomycete interactions. In a previous co‐culture screen. we found that one actinomycete. Amycolatopsis sp. AA4. inhibited aerial hyphae formation in adjacent colonies of Streptomyces coelicolor. A siderophore. amychelin. mediated this developmental arrest. Here we present genetic evidence that confirms the role of the amc locus in the production of amychelin and in the inhibition of S. coelicolor development. We further characterize the Amycolatopsis sp. AA4 – S. coelicolor interaction by examining expression of developmental and iron acquisition genes over time in co‐culture. Manipulation of iron availability and/or growth near Amycolatopsis sp. AA4 led to alterations in expression of the critical developmental gene bldN. and other key downstream genes in the S …,True,7lp2ziEAAAAJ:vnF2_uLGgtgC,134,https://onlinelibrary.wiley.com/doi/abs/10.1111/mmi.12008,8991892614125828853,/scholar?cites=8991892614125828853,,https://onlinelibrary.wiley.com/doi/pdf/10.1111/mmi.12008,0
45654,Kallolide A. a new antiinflammatory diterpenoid. and related lactones from the Caribbean octocoral Pseudopterogorgia kallos (Bielschowsky),1985,Sally A Look and Mark T Burch and William Fenical and Qitai Zheng and Jon Clardy,50,The Journal of Organic Chemistry,26,5741-5746,American Chemical Society,Four new representatives of the rare pseudopterane skeleton are reported from the Caribbean gorgonian Pseudopterogorgia kallos (Bielschowsky). The structure of the sole crystalline metabolite. kallolide A acetate (3). was provided by single-crystal X-ray diffraction analysis. Structures for kallolides AC (2. 4. 5) were subsequently established on the basis of spectral analyses and chemical interconversions. KallolideA (2). the major metabolite. shows potent antiinflammatory activity.The genus Pseudopterogorgia is widely distributed throughout the tropical Atlantic Ocean andthe Caribbean Sea. and these organisms are known to produce a diversity of novel secondary metabolites. 2-8 As part of a research program emphasizing the characterization of biologically active and structurally unique natural products from marine octocorals. we have focused our attention on this,True,7lp2ziEAAAAJ:pqnbT2bcN3wC,134,https://pubs.acs.org/doi/abs/10.1021/jo00350a061,804533340367942802,/scholar?cites=804533340367942802,,,0
45655,Bacterial printing press that regenerates its ink: contact-printing bacteria using hydrogel stamps,2005,Douglas B Weibel and Andrew Lee and Michael Mayer and Sean F Brady and Derek Bruzewicz and Jerry Yang and Willow R DiLuzio and Jon Clardy and George M Whitesides,21,Langmuir,14,6436-6442,American Chemical Society,This paper describes the use of micropatterned agarose stamps prepared by molding against PDMS masters to print patterns of bacteria on agar plates. Topographically patterned agarose stamps were inked with suspensions of bacteria; these stamps generated patterns of bacteria with features as small as 200 μm over areas as large as 50 cm2. Stamps with many small features (>200 μm) were used to study patterns of bacteria growing on media containing gradients of small molecules; stamps with larger features (>750 μm) were used to print different strains of bacteria simultaneously. The stamp transfers only a small percentage of cells that are on its surface to the agar at a time; it is thus possible to replica-pattern hundreds of times with a single inking. The use of soft stamps provides other useful functions. Stamps are easily customized to provide a range of patterns. When culture media is included in the agarose …,True,7lp2ziEAAAAJ:ZHo1McVdvXMC,132,https://pubs.acs.org/doi/abs/10.1021/la047173c,12969478145425953071,/scholar?cites=12969478145425953071,,https://biochem.wisc.edu/sites/default/files/labs/weibel/publications/2005_pubs/18_Weibel_Langmuir_2005.pdf,0
45656,Isolation and Structural Proof of the Large Diamond Molecule. Cyclohexamantane (C26H30),2003,Jeremy EP Dahl and J Michael Moldowan and Torren M Peakman and Jon C Clardy and Emil Lobkovsky and Marilyn M Olmstead and Paul W May and Tim J Davis and John W Steeds and Ken E Peters and Andy Pepper and Andy Ekuan and Robert MK Carlson,115,Angewandte Chemie,18,2086-2090,WILEY‐VCH Verlag,In this report. we describe the first isolation and structural verification of the diamondoid cyclohexamantane. C26H30. a material that has probably never previously existed anywhere in crystalline form. Since the diamond surface can terminate in hydrogen.[1] cyclohexamantane may be thought of as a nanometer-sized diamond of approximately 10À21 carats. In fact. the cyclohexamantane structure has been used to represent a small diamond in theoretical investigations.[2–4] Here we present the experimentally determined properties of cyclohexamantane isolated from petroleum. which includes its single-crystal X-ray structure. and analysis by NMR and laser Raman spectroscopy. as well as mass spectrometry. Diamondoids of the adamantane series are hydrocarbons composed of fused cyclohexane rings. all in stable chair conformations. which form interlocking cage structures that can be superimposed on the …,True,7lp2ziEAAAAJ:CHSYGLWDkRkC,131,https://onlinelibrary.wiley.com/doi/abs/10.1002/ange.200250794,592069392964677622,/scholar?cites=592069392964677622,,https://onlinelibrary.wiley.com/doi/pdf/10.1002/anie.200250794,0
45657,Citral sensing by transient receptor potential channels in dorsal root ganglion neurons,2008,Stephanie C Stotz and Joris Vriens and Derek Martyn and Jon Clardy and David E Clapham,3,PLoS One,5,e2082,Public Library of Science,Transient receptor potential (TRP) ion channels mediate key aspects of taste. smell. pain. temperature sensation. and pheromone detection. To deepen our understanding of TRP channel physiology. we require more diverse pharmacological tools. Citral. a bioactive component of lemongrass. is commonly used as a taste enhancer. as an odorant in perfumes. and as an insect repellent. Here we report that citral activates TRP channels found in sensory neurons (TRPV1 and TRPV3. TRPM8. and TRPA1). and produces long-lasting inhibition of TRPV1–3 and TRPM8. while transiently blocking TRPV4 and TRPA1. Sustained citral inhibition is independent of internal calcium concentration. but is state-dependent. developing only after TRP channel opening. Citral's actions as a partial agonist are not due to cysteine modification of the channels nor are they a consequence of citral's stereoisoforms. The isolated aldehyde and alcohol cis and trans enantiomers (neral. nerol. geranial. and geraniol) each reproduce citral's actions. In juvenile rat dorsal root ganglion neurons. prolonged citral inhibition of native TRPV1 channels enabled the separation of TRPV2 and TRPV3 currents. We find that TRPV2 and TRPV3 channels are present in a high proportion of these neurons (94% respond to 2-aminoethyldiphenyl borate). consistent with our immunolabeling experiments and previous in situ hybridization studies. The TRPV1 activation requires residues in transmembrane segments two through four of the voltage-sensor domain. a region previously implicated in capsaicin activation of TRPV1 and analogous menthol activation of TRPM8. Citral's broad spectrum …,True,7lp2ziEAAAAJ:TIZ-Mc8IlK0C,129,https://journals.plos.org/plosone/article?id=10.1371/journal.pone.0002082,17393035226687599863,/scholar?cites=17393035226687599863,,https://journals.plos.org/plosone/article?id=10.1371/journal.pone.0002082,0
45658,Salinamides A and B: anti-inflammatory depsipeptides from a marine streptomycete,1994,Jacqueline A Trischman and Dianne M Tapiolas and Paul R Jensen and Ryan Dwight and William Fenical and Tawnya C McKee and Chris M Ireland and Thomas J Stout and Jon Clardy,116,Journal of the American Chemical Society,2,757-758,American Chemical Society,Terrestrial actinomycetes or Filamentous bacteria produce a large number of antibiotic and associated compounds. For the past years. we have explored thebiosynthetic potential of diverse classes of marine bacteria to determine whether they produce secondary metabolites that extend the molecular diversity of their terrestrial counterparts. Uniquely adapted actinomycetes exist in marine habitats. 1 and these habitats include the surfaces of animals and plants2 as well as shallow water sediments. 3 Previous reports have documented the production of new antibiotics4 and antitumor agents5 from this source. In this Communication. we augment these earlier observations by reporting the structures of the salinamides 1 and 2. anti-inflammatory cyclicdepsipeptides with unusualstructures.,True,7lp2ziEAAAAJ:uWQEDVKXjbEC,129,https://pubs.acs.org/doi/abs/10.1021/ja00081a042,6027930415039239392,/scholar?cites=6027930415039239392,,https://pubs.acs.org/doi/pdf/10.1021/ja00081a042,0
45659,Pyridoacridine alkaloids from deep-water marine sponges of the family Pachastrellidae: structure revision of dercitin and related compounds and correlation with the kuanoniamines,1992,Geewananda P Gunawardana and Frank E Koehn and Angela Y Lee and Jon Clardy and Hai Yin He and D John Faulkner,57,The Journal of Organic Chemistry,5,1523-1526,American Chemical Society,The single-crystal X-ray diffraction of a novel alkaloid. stellettamine (15). together with long-range-13 coupling constants obtained by inverse detection methods. and metal chelation studies have shown that the previously reported regiochemistry of the thiazole moiety of dercitin (1) and four other related alkaloids 2-5 has to be revised. The corrected structures 10-14 are related to. and in one case identical to. those of the kuanoniamines 6-9.The structure of dercitin (1). a DNA interacting alkaloid from a deep-water marine sponge Dercitus sp. was deduced by a combination of long-range-130 (coloc) and 13C-13C (2D inadequate) correlation information on the parent compound and its tetrahydro derivative. 2 Although the carbon skeleton of dercitin was established unambiguously from these data. the regiochemistry of the thiazole moiety was incorrectly assigned by comparison of the 13C NMR chemical shifts of C-9a …,True,7lp2ziEAAAAJ:1sJd4Hv_s6UC,129,https://pubs.acs.org/doi/abs/10.1021/jo00031a035,3544150494099720032,/scholar?cites=3544150494099720032,,,0
45660,Refined structure of the FKBP12–rapamycin–FRB ternary complex at 2.2 Å resolution,1999,Jun Liang and Jungwon Choi and Jon Clardy,55,Acta Crystallographica Section D: Biological Crystallography,4,736-744,International Union of Crystallography,The structure of the FKBP12–rapamycin–FRB ternary complex has now been refined at 2.2 Å resolution. The cell-cycle arrest agent rapamycin binds FK506-binding protein (FKBP12) and the FKBP12–rapamycin binding (FRB) domain of FKBP12–rapamycin associated protein (FRAP) simultaneously. and the inhibition of FRAP is responsible for rapamycin's biological activity. The conformation of rapamycin in the ternary complex is very similar to that observed in the FKBP12–rapamycin binary complex. with an r.m.s. difference of only 0.30 Å. However. a slight (9°) rotation repositions the FRB-binding face of rapamycin in the ternary complex. There are extensive rapamycin–protein interactions and relatively few interactions between the two protein partners FKBP12 and FRB. these interactions mainly involving residues in the 40s and 80s loops of FKBP12 and α1 and α4 of FRB. The high-resolution refinement has …,True,7lp2ziEAAAAJ:WbkHhVStYXYC,127,https://scripts.iucr.org/cgi-bin/paper?gr0889,4693659419816459802,/scholar?cites=4693659419816459802,,,0
45661,Using the heat-shock response to discover anticancer compounds that target protein homeostasis,2012,Sandro Santagata and Ya-ming Xu and EM Kithsiri Wijeratne and Renee Kontnik and Christine Rooney and Casey C Perley and Hyoungtae Kwon and Jon Clardy and Santosh Kesari and Luke Whitesell and Susan Lindquist and AA Leslie Gunatilaka,7,ACS chemical biology,2,340-349,American Chemical Society,Unlike normal tissues. cancers experience profound alterations in protein homeostasis. Powerful innate adaptive mechanisms. especially the transcriptional response regulated by Heat Shock Factor 1 (HSF1). are activated in cancers to enable survival under these stressful conditions. Natural products that further tax these stress responses can overwhelm the ability to cope and could provide leads for the development of new. broadly effective anticancer drugs. To identify compounds that drive the HSF1-dependent stress response. we evaluated over 80.000 natural and synthetic compounds as well as partially purified natural product extracts using a reporter cell line optimized for high-throughput screening. Surprisingly. many of the strongly active compounds identified were natural products representing five diverse chemical classes (limonoids. curvularins. withanolides. celastraloids. and colletofragarones). All of …,True,7lp2ziEAAAAJ:SAZ1SQo2q1kC,126,https://pubs.acs.org/doi/abs/10.1021/cb200353m,17836455440709536810,/scholar?cites=17836455440709536810,,https://www.ncbi.nlm.nih.gov/pmc/articles/PMC3291478/,0
45662,Lysophosphatidylcholine regulates sexual stage differentiation in the human malaria parasite Plasmodium falciparum,2017,Nicolas MB Brancucci and Joseph P Gerdt and ChengQi Wang and Mariana De Niz and Nisha Philip and Swamy R Adapa and Min Zhang and Eva Hitz and Igor Niederwieser and Sylwia D Boltryk and Marie-Claude Laffitte and Martha A Clark and Christof Grüring and Deepali Ravel and Alexandra Blancke Soares and Allison Demas and Selina Bopp and Belén Rubio-Ruiz and Ana Conejo-Garcia and Dyann F Wirth and Edyta Gendaszewska-Darmach and Manoj T Duraisingh and John H Adams and Till S Voss and Andrew P Waters and Rays HY Jiang and Jon Clardy and Matthias Marti,171,Cell,7,1532-1544. e15,Cell Press,Transmission represents a population bottleneck in the Plasmodium life cycle and a key intervention target of ongoing efforts to eradicate malaria. Sexual differentiation is essential for this process. as only sexual parasites. called gametocytes. are infective to the mosquito vector. Gametocyte production rates vary depending on environmental conditions. but external stimuli remain obscure. Here. we show that the host-derived lipid lysophosphatidylcholine (LysoPC) controls P. falciparum cell fate by repressing parasite sexual differentiation. We demonstrate that exogenous LysoPC drives biosynthesis of the essential membrane component phosphatidylcholine. LysoPC restriction induces a compensatory response. linking parasite metabolism to the activation of sexual-stage-specific transcription and gametocyte formation. Our results reveal that malaria parasites can sense and process host-derived physiological …,True,7lp2ziEAAAAJ:Q17yWvk9gpwC,125,https://www.sciencedirect.com/science/article/pii/S0092867417312424,2641951187222716372,/scholar?cites=2641951187222716372,,https://www.sciencedirect.com/science/article/pii/S0092867417312424,0
45663,Prianosin A. a novel antileukemic alkaloid from the okinawan marine sponge Prianos melanos,1987,Jun'ichi Kobayashi and Jie-Fei Cheng and Masami Ishibashi and Hideshi Nakamura and Yasushi Ohizumi and Yoshimasa Hirata and Takuma Sasaki and Helen Lu and Jon Clardy,28,Tetrahedron letters,42,4939-4942,Pergamon,A novel alkaloid. prianosin A (1). with potent antineoplastic activity has been isolated from the Okinawan marine sponge Prianos melanos. Its absolute stereostructure was determined by single crystal x-ray diffraction analysis.,True,7lp2ziEAAAAJ:2P1L_qKh6hAC,125,https://www.sciencedirect.com/science/article/pii/S0040403900966644,871349526931160818,/scholar?cites=871349526931160818,,,0
