,title,pub_year,author,volume,journal,number,pages,publisher,abstract,filled,author_pub_id,num_citations,pub_url,cites_id,citedby_url,author_id,eprint_url,got_citations,got_author_ids,author_ids
1025286,CDK phosphorylation of Drc1 regulates DNA replication in fission yeast,2002,Eishi Noguchi and Paul Shanahan and Chiaki Noguchi and Paul Russell,12,Current biology,7,599-605,Cell Press,Cyclin-dependent kinases (CDKs) are absolutely required for DNA replication in eukaryotic cells 1. 2. CDKs are thought to activate one or more replication factors. but the identities of these proteins are unknown. Here we describe fission yeast Drc1. a protein required for DNA replication that is phosphorylated by Cdc2. Drc1 depletion leads to catastrophic mitotic divisions with incompletely replicated DNA. indicating that Drc1 is required for DNA synthesis and S-M replication checkpoint control. Drc1 associates with Cdc2 and is phosphorylated at the onset of S phase when Cdc2 is activated. Mutant Drc1 that lacks CDK phosphorylation sites is nonfunctional and fails to interact with Cut5 replication factor. These data suggest that Cdc2 promotes DNA replication by phosphorylating Drc1 and regulating its association with Cut5.,True,velgwCkAAAAJ:UeHWp8X0CEIC,74,https://www.sciencedirect.com/science/article/pii/S096098220200739X,4190497619178042684,/scholar?cites=4190497619178042684,,https://www.sciencedirect.com/science/article/pii/S096098220200739X,0,0,0
1025287,Dynamic O-glycosylation of nuclear and cytosolic proteins: cloning and characterization of a neutral. cytosolic β-N-acetylglucosaminidase from human brain,2001,Yuan Gao and Lance Wells and Frank I Comer and Glendon J Parker and Gerald W Hart,276,Journal of Biological Chemistry,13,9838-9845,Elsevier,Dynamic modification of cytoplasmic and nuclear proteins by O-linked N-acetylglucosamine (O-GlcNAc) on Ser/Thr residues is ubiquitous in higher eukaryotes and is analogous to protein phosphorylation. The enzyme for the addition of this modification. O-GlcNAc transferase. has been cloned from several species. Here. we have cloned a human brain O-GlcNAcase that cleaves O-GlcNAc off proteins. The cloned cDNA encodes a polypeptide of 916 amino acids with a predicted molecular mass of 103 kDa and a pI value of 4.63. but the protein migrates as a 130-kDa band on SDS-polyacrylamide gel electrophoresis. The cloned O-GlcNAcase has a pH optimum of 5.5–7.0 and is inhibited by GlcNAc but not by GalNAc.p-Nitrophenyl (pNP)-β-GlcNAc. but notpNP-β-GalNAc or pNP-α-GlcNAc. is a substrate. The cloned enzyme cleaves GlcNAc. but not GalNAc. from glycopeptides. Cell fractionation suggests that the …,True,SOYkbDsAAAAJ:qxL8FJ1GzNcC,636,https://www.sciencedirect.com/science/article/pii/S0021925819342450,12376505330513609390,/scholar?cites=12376505330513609390,,https://www.sciencedirect.com/science/article/pii/S0021925819342450,0,0,0
1025288,Altered glycan-dependent signaling induces insulin resistance and hyperleptinemia,2002,Donald A McClain and William A Lubas and Robert C Cooksey and Mark Hazel and Glendon J Parker and Dona C Love and John A Hanover,99,Proceedings of the National Academy of Sciences,16,10695-10699,National Academy of Sciences,Insulin resistance and β cell toxicity are key features of type 2 diabetes. One leading hypothesis suggests that these abnormalities result from excessive flux of nutrients through the UDP–hexosamine biosynthetic pathway leading to “glucose toxicity.” How the products of the hexosamine pathway mediate these effects is not known. Here. we show that transgenic overexpression of an enzyme using UDP-GlcNAc to modify proteins with O-GlcNAc produces the type 2 diabetic phenotype. Even modest overexpression of an isoform of O-GlcNAc transferase. in muscle and fat. leads to insulin resistance and hyperleptinemia. These data support the proposal that O-linked GlcNAc transferase participates in a hexosamine-dependent signaling pathway that is linked to insulin resistance and leptin production.,True,SOYkbDsAAAAJ:ufrVoPGSRksC,371,https://www.pnas.org/content/99/16/10695.short,5354846965205022212,/scholar?cites=5354846965205022212,,https://www.pnas.org/content/pnas/99/16/10695.full.pdf,0,0,0
1025289,A role for the transcriptional coactivator PGC-1α in muscle refueling,2007,Adam R Wende and Paul J Schaeffer and Glendon J Parker and Christoph Zechner and Dong-Ho Han and May M Chen and Chad R Hancock and John J Lehman and Janice M Huss and Donald A McClain and John O Holloszy and Daniel P Kelly,282,Journal of Biological Chemistry,50,36642-36651,Elsevier,The transcriptional coactivator peroxisome proliferator-activated receptor γ coactivator-1α (PGC-1α) has been identified as an inducible regulator of mitochondrial function. Skeletal muscle PGC-1α expression is induced post-exercise. Therefore. we sought to determine its role in the regulation of muscle fuel metabolism. Studies were performed using conditional. muscle-specific. PGC-1α gain-of-function and constitutive. generalized. loss-of-function mice. Forced expression of PGC-1α increased muscle glucose uptake concomitant with augmentation of glycogen stores. a metabolic response similar to post-exercise recovery. Induction of muscle PGC-1α expression prevented muscle glycogen depletion during exercise. Conversely. PGC-1α-deficient animals exhibited reduced rates of muscle glycogen repletion post-exercise. PGC-1α was shown to increase muscle glycogen stores via several mechanisms including …,True,SOYkbDsAAAAJ:Se3iqnhoufwC,286,https://www.sciencedirect.com/science/article/pii/S0021925818461182,7620934544131450485,/scholar?cites=7620934544131450485,,https://www.sciencedirect.com/science/article/pii/S0021925818461182,0,0,0
1025290,Insulin resistance of glycogen synthase mediated byo-linked N-acetylglucosamine,2003,Glendon J Parker and Kelli C Lund and Rodrick P Taylor and Donald A McClain,278,Journal of Biological Chemistry,12,10022-10027,Elsevier,We have investigated the mechanism by which high concentrations of glucose inhibit insulin stimulation of glycogen synthase. In NIH-3T3-L1 adipocytes cultured in low glucose (LG; 2.5 mm). the half-maximal activation concentration (A 0.5) of glucose 6-phosphate was 162 ± 15 μm. Exposure to either high glucose (HG; 20 mm) or glucosamine (GlcN; 10 mm) increased the A0.5 to 558 ± 61 or 612 ± 34 μm. Insulin treatment with LG reduced the A0.5 to 96 ± 10 μm. but cells cultured with HG or GlcN were insulin-resistant (A 0.5 = 287 ± 27 or 561 ± 77 μm). Insulin resistance was not explained by increased phosphorylation of synthase. In fact. culture with GlcN decreased phosphorylation to 61% of the levels seen in cells cultured in LG. Hexosamine flux and subsequent enzymatic proteinO-glycosylation have been postulated to mediate nutrient sensing and insulin resistance. Glycogen synthase is modified byO-linked N …,True,SOYkbDsAAAAJ:WF5omc3nYNoC,174,https://www.sciencedirect.com/science/article/pii/S0021925819324718,5334480540522511550,/scholar?cites=5334480540522511550,,https://www.sciencedirect.com/science/article/pii/S0021925819324718,0,0,0
1025291,Hyperglycemia and inhibition of glycogen synthase in streptozotocin-treated mice: role of O-linked N-acetylglucosamine,2004,Glendon Parker and Rodrick Taylor and Deborah Jones and Donald McClain,279,Journal of Biological Chemistry,20,20636-20642,Elsevier,Glycogen synthase is post-translationally modified by both phosphate and O-linked N-acetylglucosamine (O-GlcNAc). In 3T3-L1 adipocytes exposed to high concentrations of glucose. O-GlcNAc contributes to insulin resistance of glycogen synthase. We sought to determine whether O-GlcNAc also regulates glycogen synthase in vivo. Glycogen synthase activity in fat pad extracts was inhibited in streptozotocin (STZ)-treated diabetic mice. The half-maximal activation concentration for glucose 6-phosphate (A0.5) was increased to 830 ± 120 μm compared with 240 ± 20 μm in control mice (C. p < 0.01). while the basal glycogen synthase activity (%I-form) was decreased to 2.4 ± 1.4% compared with 10.1 ± 1.8% in controls (p < 0.01). Glycogen synthase activity remained inhibited after compensatory insulin treatment. After insulin treatment kinetic parameters of glycogen synthase were more closely correlated with blood …,True,SOYkbDsAAAAJ:5nxA0vEk-isC,130,https://www.sciencedirect.com/science/article/pii/S0021925820669149,8427538638960483337,/scholar?cites=8427538638960483337,,https://www.sciencedirect.com/science/article/pii/S0021925820669149,0,0,0
1025292,Glucose deprivation stimulates O-GlcNAc modification of proteins through up-regulation of O-linked N-acetylglucosaminyltransferase,2008,Rodrick P Taylor and Glendon J Parker and Mark W Hazel and Yudi Soesanto and William Fuller and Marla J Yazzie and Donald A McClain,283,Journal of Biological Chemistry,10,6050-6057,American Society for Biochemistry and Molecular Biology,O-Linked N-acetylglucosamine (O-GlcNAc) is a post-translational modification of proteins that functions as a nutrient sensing mechanism. Here we report on regulation of O-GlcNAcylation over a broad range of glucose concentrations. We have discovered a significant induction of O-GlcNAc modification of a limited number of proteins under conditions of glucose deprivation. Beginning 12 h after treatment. glucose-deprived human hepatocellular carcinoma (HepG2) cells demonstrate a 7.8-fold increase in total O-GlcNAc modification compared with cells cultured in normal glucose (5 mm; p = 0.008). Some of the targets of glucose deprivation-induced O-GlcNAcylation are distinct from those modified in response to high glucose (20 mm) or glucosamine (10 mm) treatment. suggesting differential targeting with glucose deprivation and glucose excess. O-GlcNAcylation of glycogen synthase is significantly increased with …,True,SOYkbDsAAAAJ:aqlVkmm33-oC,126,https://www.sciencedirect.com/science/article/pii/S0021925820571810,12554520027839951107,/scholar?cites=12554520027839951107,,https://www.sciencedirect.com/science/article/pii/S0021925820571810,0,0,0
1025293,Streptozotocin-induced β-cell death is independent of its inhibition of O-GlcNAcase in pancreatic Min6 cells,2000,Yuan Gao and Glendon J Parker and Gerald W Hart,383,Archives of biochemistry and biophysics,2,296-302,Academic Press,Streptozotocin (STZ) injection into experimental animals selectively causes massive β-cell death. The mechanism of this specific toxicity is not fully understood. Recently. it has been discovered that O-linked N-acetylglucosamine (O-GlcNAc) is enriched in the β-cells. It has been proposed that STZ toxicity may be due to its inhibition of neutral O-GlcNAcase activity. the enzyme that removes O-GlcNAc from cytosolic proteins (K. Liu et al.. 2000. Proc. Natl. Acad. Sci. USA 97. 2820–2825). To further ascertain the role of O-GlcNAcase in β-cell death. we have used PUGNAc. a potent and specific O-GlcNAcase inhibitor. together with STZ in pancreatic Min6 cells. Both STZ and PUGNAc increased O-GlcNAc to similar levels on intracellular proteins. STZ. but not PUGNAc. decreased cellular protein synthesis by 66.0% within 8 h. killed 80.9% of the cells within 18 h. and decreased insulin secretion. STZ. but not PUGNAc. also …,True,SOYkbDsAAAAJ:UebtZRa9Y70C,86,https://www.sciencedirect.com/science/article/pii/S0003986100920940,7671530825123653702,/scholar?cites=7671530825123653702,,https://www.academia.edu/download/57854755/abbi.2000.209420181126-22927-w5p9zr.pdf,0,0,0
1025294,Activation of the hexosamine signaling pathway in adipose tissue results in decreased serum adiponectin and skeletal muscle insulin resistance,2004,Mark Hazel and Robert C Cooksey and Deborah Jones and Glendon Parker and John L Neidigh and Bryan Witherbee and Eric A Gulve and Donald A McClain,145,Endocrinology,5,2118-2128,Oxford University Press,Overexpression of the rate-limiting enzyme for hexosamine synthesis (glutamine:fructose-6-phosphate amidotransferase) in muscle and adipose tissue of transgenic mice was previously shown to result in insulin resistance and hyperleptinemia. Explanted muscle from transgenic mice was not insulin resistant in vitro. suggesting that muscle insulin resistance could be mediated by soluble factors from fat tissue. To dissect the relative contributions of muscle and fat to hexosamine-induced insulin resistance. we overexpressed glutamine:fructose-6-phosphate amidotransferase 2.5-fold. specifically in fat under control of the aP2 promoter. Fasting glucose. insulin. and triglycerides were unchanged in the transgenic mice; leptin and β-hydroxybutyrate levels were 91% and 29% higher. respectively. Fasted transgenic mice have mild glucose intolerance and skeletal muscle insulin resistance in vivo. In fasting …,True,SOYkbDsAAAAJ:W7OEmFMy1HYC,84,https://academic.oup.com/endo/article-abstract/145/5/2118/2877969,4432948981908563942,/scholar?cites=4432948981908563942,,https://academic.oup.com/endo/article/145/5/2118/2877969,0,0,0
1025295,Comparative structural analyses of purified glycogen particles from rat liver. human skeletal muscle and commercial preparations,2009,Je-Hoon Ryu and Jace Drain and Jung Hwan Kim and Sean McGee and Angus Gray-Weale and Lynne Waddington and Glendon J Parker and Mark Hargreaves and Sang-Ho Yoo and David Stapleton,45,International journal of biological macromolecules,5,478-482,Elsevier,Glycogen is a cellular energy store that is crucial for whole body energy metabolism. metabolic regulation and exercise performance. To understand glycogen structure we have purified glycogen particles from rat liver and human skeletal muscle tissues and compared their biophysical properties with those found in commercial glycogen preparations. Ultrastructural analysis of commercial liver glycogens fails to reveal the classical α-rosette structure but small irregularly shaped particles. In contrast. commercial slipper limpet glycogen consists of β-particles with similar branching and chain lengths to purified rat liver glycogen together with a tendency to form small α-particles. and suggest it should be used as a source of glycogen for all future studies requiring a substitute for mammalian liver glycogen.,True,SOYkbDsAAAAJ:2osOgNQ5qMEC,80,https://www.sciencedirect.com/science/article/pii/S0141813009001846,1937181351727438162,/scholar?cites=1937181351727438162,,https://www.academia.edu/download/45293461/Comparative_structural_analyses_of_purif20160502-1610-1d7azwx.pdf,0,0,0
1025296,Analysis of hepatic glycogen‐associated proteins,2010,David Stapleton and Chad Nelson and Krishna Parsawar and Donald McClain and Ryan Gilbert‐Wilson and Elizabeth Barker and Brant Rudd and Kevin Brown and Wayne Hendrix and Paul O'Donnell and Glendon Parker,10,Proteomics,12,2320-2329,WILEY‐VCH Verlag,Glycogen particles are associated with a population of proteins that mediate its biological functions. including: management of glucose flux into and out of the glycogen particle. maintenance of glycogen structure and regulation of particle size. number. and cellular location. A survey of the glycogen‐associated proteome would be predicted to identify the relative representation of known members of this population. and associations with unexpected proteins that have the potential to mediate other functions of the glycogen particle. We therefore purified glycogen particles from both mouse and rat liver. using different techniques. and analyzed the resulting tryptic peptides by MS. We also specifically eluted glycogen‐binding proteins from the pellet using malto‐oligosaccharides. Comparison of the rat and mouse populations. and analysis of specifically eluted proteins allow some conclusions to be made about the …,True,SOYkbDsAAAAJ:roLk4NBRz8UC,78,https://onlinelibrary.wiley.com/doi/abs/10.1002/pmic.200900628,6821503293900153830,/scholar?cites=6821503293900153830,,https://www.ncbi.nlm.nih.gov/pmc/articles/PMC2892038/,0,0,0
1025297,Demonstration of protein-based human identification using the hair shaft proteome,2016,Glendon J Parker and Tami Leppert and Deon S Anex and Jonathan K Hilmer and Nori Matsunami and Lisa Baird and Jeffery Stevens and Krishna Parsawar and Blythe P Durbin-Johnson and David M Rocke and Chad Nelson and Daniel J Fairbanks and Andrew S Wilson and Robert H Rice and Scott R Woodward and Brian Bothner and Bradley R Hart and Mark Leppert,11,PloS one,9,e0160653,Public Library of Science,Human identification from biological material is largely dependent on the ability to characterize genetic polymorphisms in DNA. Unfortunately. DNA can degrade in the environment. sometimes below the level at which it can be amplified by PCR. Protein however is chemically more robust than DNA and can persist for longer periods. Protein also contains genetic variation in the form of single amino acid polymorphisms. These can be used to infer the status of non-synonymous single nucleotide polymorphism alleles. To demonstrate this. we used mass spectrometry-based shotgun proteomics to characterize hair shaft proteins in 66 European-American subjects. A total of 596 single nucleotide polymorphism alleles were correctly imputed in 32 loci from 22 genes of subjects’ DNA and directly validated using Sanger sequencing. Estimates of the probability of resulting individual non-synonymous single nucleotide polymorphism allelic profiles in the European population. using the product rule. resulted in a maximum power of discrimination of 1 in 12.500. Imputed non-synonymous single nucleotide polymorphism profiles from European–American subjects were considerably less frequent in the African population (maximum likelihood ratio = 11.000). The converse was true for hair shafts collected from an additional 10 subjects with African ancestry. where some profiles were more frequent in the African population. Genetically variant peptides were also identified in hair shaft datasets from six archaeological skeletal remains (up to 260 years old). This study demonstrates that quantifiable measures of identity discrimination and biogeographic …,True,SOYkbDsAAAAJ:ULOm3_A8WrAC,74,https://journals.plos.org/plosone/article?id=10.1371/journal.pone.0160653,11600980333705347069,/scholar?cites=11600980333705347069,,https://journals.plos.org/plosone/article?id=10.1371/journal.pone.0160653,0,0,0
1025298,Sharing and community curation of mass spectrometry data with Global Natural Products Social Molecular Networking,2016,Mingxun Wang and Jeremy J Carver and Vanessa V Phelan and Laura M Sanchez and Neha Garg and Yao Peng and Don Duy Nguyen and Jeramie Watrous and Clifford A Kapono and Tal Luzzatto-Knaan and Carla Porto and Amina Bouslimani and Alexey V Melnik and Michael J Meehan and Wei-Ting Liu and Max Crüsemann and Paul D Boudreau and Eduardo Esquenazi and Mario Sandoval-Calderón and Roland D Kersten and Laura A Pace and Robert A Quinn and Katherine R Duncan and Cheng-Chih Hsu and Dimitrios J Floros and Ronnie G Gavilan and Karin Kleigrewe and Trent Northen and Rachel J Dutton and Delphine Parrot and Erin E Carlson and Bertrand Aigle and Charlotte F Michelsen and Lars Jelsbak and Christian Sohlenkamp and Pavel Pevzner and Anna Edlund and Jeffrey McLean and Jörn Piel and Brian T Murphy and Lena Gerwick and Chih-Chuang Liaw and Yu-Liang Yang and Hans-Ulrich Humpf and Maria Maansson and Robert A Keyzers and Amy C Sims and Andrew R Johnson and Ashley M Sidebottom and Brian E Sedio and Andreas Klitgaard and Charles B Larson and Daniel Torres-Mendoza and David J Gonzalez and Denise B Silva and Lucas M Marques and Daniel P Demarque and Egle Pociute and Ellis C O'Neill and Enora Briand and Eric JN Helfrich and Eve A Granatosky and Evgenia Glukhov and Florian Ryffel and Hailey Houson and Hosein Mohimani and Jenan J Kharbush and Yi Zeng and Julia A Vorholt and Kenji L Kurita and Pep Charusanti and Kerry L Mcphail and Kristian Fog Nielsen and Lisa Vuong and Maryam Elfeki and Matthew F Traxler and Niclas Engene and Nobuhiro Koyama and Oliver B Vining and Ralph Baric and Ricardo R Silva and Samantha J Mascuch and Sophie Tomasi and Stefan Jenkins and Venkat Macherla and Thomas Hoffman and Vinayak Agarwal and Philip G Williams and Jingqui Dai and Ram Neupane and Joshua Gurr and Andrés MC Rodriguez and Anne Lamsa and Chen Zhang and Kathleen Dorrestein and Brendan M Duggan and Jehad Almaliti and Pierre-Marie Allard and Prasad Phapale and Louis-Felix Nothias and Theodore Alexandrov and Marc Litaudon and Jean-Luc Wolfender and Jennifer E Kyle and Thomas O Metz and Tyler Peryea and Dac-Trung Nguyen and Danielle Vanleer and Paul Shinn and Ajit Jadhav and Rolf Müller and Katrina M Waters and Wenyuan Shi and Xueting Liu and Lixin Zhang and Rob Knight and Paul R Jensen and Bernhard Ø Palsson and Kit Pogliano and Roger G Linington and Marcelino Gutierrez and Norberto P Lopes and William H Gerwick and Bradley S Moore and Pieter C Dorrestein and Nuno Bandeira,34,Nature biotechnology,8,828-837,Nature Publishing Group,The potential of the diverse chemistries present in natural products (NP) for biotechnology and medicine remains untapped because NP databases are not searchable with raw data and the NP community has no way to share data other than in published papers. Although mass spectrometry (MS) techniques are well-suited to high-throughput characterization of NP. there is a pressing need for an infrastructure to enable sharing and curation of data. We present Global Natural Products Social Molecular Networking (GNPS; http://gnps. ucsd. edu). an open-access knowledge base for community-wide organization and sharing of raw. processed or identified tandem mass (MS/MS) spectrometry data. In GNPS. crowdsourced curation of freely available community-wide reference MS libraries will underpin improved annotations. Data-driven social-networking should facilitate identification of spectra and foster …,True,dtKLJuwAAAAJ:2osOgNQ5qMEC,1168,https://www.nature.com/articles/nbt.3597,14070672842987271681,/scholar?cites=14070672842987271681,,https://www.ncbi.nlm.nih.gov/pmc/articles/pmc5321674/,0,0,0
1025299,Antimicrobials from human skin commensal bacteria protect against Staphylococcus aureus and are deficient in atopic dermatitis,2017,Teruaki Nakatsuji and Tiffany H Chen and Saisindhu Narala and Kimberly A Chun and Aimee M Two and Tong Yun and Faiza Shafiq and Paul F Kotol and Amina Bouslimani and Alexey V Melnik and Haythem Latif and Ji-Nu Kim and Alexandre Lockhart and Keli Artis and Gloria David and Patricia Taylor and Joanne Streib and Pieter C Dorrestein and Alex Grier and Steven R Gill and Karsten Zengler and Tissa R Hata and Donald YM Leung and Richard L Gallo,9,Science translational medicine,378,,American Association for the Advancement of Science,The microbiome can promote or disrupt human health by influencing both adaptive and innate immune functions. We tested whether bacteria that normally reside on human skin participate in host defense by killing Staphylococcus aureus. a pathogen commonly found in patients with atopic dermatitis (AD) and an important factor that exacerbates this disease. High-throughput screening for antimicrobial activity against S. aureus was performed on isolates of coagulase-negative Staphylococcus (CoNS) collected from the skin of healthy and AD subjects. CoNS strains with antimicrobial activity were common on the normal population but rare on AD subjects. A low frequency of strains with antimicrobial activity correlated with colonization by S. aureus. The antimicrobial activity was identified as previously unknown antimicrobial peptides (AMPs) produced by CoNS species including Staphylococcus epidermidis and …,True,dtKLJuwAAAAJ:eQOLeE2rZwMC,422,https://stm.sciencemag.org/content/9/378/eaah4680?utm_campaign=toc_stm_2017-02-22&et_rid=33946681&et_cid=1179857,12529757815799043004,/scholar?cites=12529757815799043004,,https://www.ncbi.nlm.nih.gov/pmc/articles/PMC5600545/,0,0,0
1025300,Molecular cartography of the human skin surface in 3D,2015,Amina Bouslimani and Carla Porto and Christopher M Rath and Mingxun Wang and Yurong Guo and Antonio Gonzalez and Donna Berg-Lyon and Gail Ackermann and Gitte Julie Moeller Christensen and Teruaki Nakatsuji and Lingjuan Zhang and Andrew W Borkowski and Michael J Meehan and Kathleen Dorrestein and Richard L Gallo and Nuno Bandeira and Rob Knight and Theodore Alexandrov and Pieter C Dorrestein,112,Proceedings of the National Academy of Sciences,17,E2120-E2129,National Academy of Sciences,The human skin is an organ with a surface area of 1.5–2 m2 that provides our interface with the environment. The molecular composition of this organ is derived from host cells. microbiota. and external molecules. The chemical makeup of the skin surface is largely undefined. Here we advance the technologies needed to explore the topographical distribution of skin molecules. using 3D mapping of mass spectrometry data and microbial 16S rRNA amplicon sequences. Our 3D maps reveal that the molecular composition of skin has diverse distributions and that the composition is defined not only by skin cells and microbes but also by our daily routines. including the application of hygiene products. The technological development of these maps lays a foundation for studying the spatial relationships of human skin with hygiene. the microbiota. and environment. with potential for developing predictive models of skin …,True,dtKLJuwAAAAJ:u5HHmVD_uO8C,265,https://www.pnas.org/content/112/17/E2120.short,7050696939983785583,/scholar?cites=7050696939983785583,,https://www.pnas.org/content/112/17/E2120.short,0,0,0
