,title,pub_year,author,volume,journal,number,pages,publisher,abstract,filled,author_pub_id,num_citations,pub_url,cites_id,citedby_url,author_id,eprint_url,got_citations
29817,“Mini-mental state”: a practical method for grading the cognitive state of patients for the clinician,1975,Marshal F Folstein and Susan E Folstein and Paul R McHugh,12,Journal of psychiatric research,3,189-198,Pergamon,EXAMINATION of the mental state is essential in evaluating psychiatric patients. 1 Many investigators have added quantitative assessment of cognitive performance to the standard examination. and have documented reliability and validity of the several “clinical tests of the sensorium”. 2* 3 The available batteries are lengthy. For example. WITHERS and HINTON’S test includes 33 questions and requires about 30 min to administer and score. The standard WAIS requires even more time. However. elderly patients. particularly those with delirium or dementia syndromes. cooperate well only for short periods. 4 Therefore. we devised a simplified. scored form of the cognitive mental status examination. the “Mini-Mental State”(MMS) which includes eleven questions. requires only 5-10 min to administer. and is therefore practical to use serially and routinely. It is “mini” because it concentrates only on the cognitive aspects of mental functions. and excludes questions concerning mood. abnormal mental experiences and the form of thinking. But within the cognitive realm it is thorough.,True,3JsfnzsAAAAJ:QYdC8u9Cj1oC,91061,https://www.academia.edu/download/48794085/0022-3956_2875_2990026-620160913-28497-y2c5d5.pdf,889307938343557605,/scholar?cites=889307938343557605,,https://www.academia.edu/download/48794085/0022-3956_2875_2990026-620160913-28497-y2c5d5.pdf,0
29818,“Mini-mental state”: a practical method for grading the cognitive state of patients for the clinician,1975,Marshal F Folstein and Susan E Folstein and Paul R McHugh,12,Journal of psychiatric research,3,189-198,Pergamon,EXAMINATION of the mental state is essential in evaluating psychiatric patients. 1 Many investigators have added quantitative assessment of cognitive performance to the standard examination. and have documented reliability and validity of the several “clinical tests of the sensorium”. 2* 3 The available batteries are lengthy. For example. WITHERS and HINTON’S test includes 33 questions and requires about 30 min to administer and score. The standard WAIS requires even more time. However. elderly patients. particularly those with delirium or dementia syndromes. cooperate well only for short periods. 4 Therefore. we devised a simplified. scored form of the cognitive mental status examination. the “Mini-Mental State”(MMS) which includes eleven questions. requires only 5-10 min to administer. and is therefore practical to use serially and routinely. It is “mini” because it concentrates only on the cognitive aspects of mental functions. and excludes questions concerning mood. abnormal mental experiences and the form of thinking. But within the cognitive realm it is thorough.,True,3JsfnzsAAAAJ:4vMrXwiscB8C,91041,https://www.academia.edu/download/48794085/0022-3956_2875_2990026-620160913-28497-y2c5d5.pdf,889307938343557605,/scholar?cites=889307938343557605,,https://www.academia.edu/download/48794085/0022-3956_2875_2990026-620160913-28497-y2c5d5.pdf,0
29819,Clinical diagnosis of Alzheimer's disease: Report of the NINCDS‐ADRDA Work Group* under the auspices of Department of Health and Human Services Task Force on Alzheimer's Disease,1984,Guy McKhann and David Drachman and Marshall Folstein and Robert Katzman and Donald Price and Emanuel M Stadlan,34,Neurology,7,939-939,Wolters Kluwer Health. Inc. on behalf of the American Academy of Neurology,Clinical criteria for the diagnosis of Alzheimer9s disease include insidious onset and progressive impairment of memory and other cognitive functions. There are no motor. sensory. or coordination deficits early in the disease. The diagnosis cannot be determined by laboratory tests. These tests are important primarily in identifying other possible causes of dementia that must be excluded before the diagnosis of Alzheimer9s disease may be made with confidence. Neuropsychological tests provide confirmatory evidence of the diagnosis of dementia and help to assess the course and response to therapy. The criteria proposed are intended to serve as a guide for the diagnosis of probable. possible. and definite Alzheimer9s disease; these criteria will be revised as more definitive information becomes available.,True,3JsfnzsAAAAJ:wBLCggQE-ToC,30902,https://n.neurology.org/content/34/7/939.short,5501567859114976444,/scholar?cites=5501567859114976444,,,0
29820,Population-based norms for the Mini-Mental State Examination by age and educational level,1993,Rosa M Crum and James C Anthony and Susan S Bassett and Marshal F Folstein,269,Jama,18,2386-2391,American Medical Association,—To report the distribution of Mini-Mental State Examination (MMSE) scores by age and educational level.—National Institute of Mental Health Epidemiologic Catchment Area Program surveys conducted between 1980 and 1984.—Community populations in New Haven. Conn; Baltimore. Md; St Louis. Mo; Durham. NC; and Los Angeles. Calif.—A total of 18 056 adult participants selected by probability sampling within census tracts and households.—Summary scores for the MMSE are given in the form of mean. median. and percentile distributions specific for age and educational level.—The MMSE scores were related to both age and educational level. There was an inverse relationship between MMSE scores and age. ranging from a median of 29 for those 18 to 24 years of age. to 25 for individuals 80 years of age and older. The median …,True,3JsfnzsAAAAJ:dBIO0h50nwkC,3222,https://jamanetwork.com/journals/jama/article-abstract/405973,12209431701157466340,/scholar?cites=12209431701157466340,,https://pogoe.org/sites/default/files/Crum_Handout.pdf,0
29821,Limits of the ‘Mini-Mental State’as a screening test for dementia and delirium among hospital patients,1982,James C Anthony and Linda LeResche and Unaiza Niaz and Michael R Von Korff and Marshal F Folstein,12,Psychological medicine,2,397-408,Cambridge University Press,With a psychiatrist's standardized clinical diagnosis as the criterion. the'Mini-Mental State'Examination (MMSE) was 87% sensitive and 82% specific in detecting dementia and delirium among hospital patients on a general medical ward. The false positive ratio was 39% and the false negative ratio was 5%. All false positives had less than 9 years of education; many were 60 years of age or older. Performance on specific MMSE items was related to education or age. These findings confirm the MMSE's value as a screen instrument for dementia and delirium when later. more intensive diagnostic enquiry is possible; they reinforce earlier suggestions that the MMSE alone cannot yield a diagnosis for these conditions.,True,3JsfnzsAAAAJ:HIFyuExEbWQC,1561,https://www.cambridge.org/core/services/aop-cambridge-core/content/view/S0033291700046730,5026573300603841239,/scholar?cites=5026573300603841239,,,0
29822,The telephone interview for cognitive status,1988,Jason Brandt and Miriam Spencer and Marshal Folstein,1,Neuropsychiatry Neuropsychol Behav Neurol,2,111-117,,"Instructions to Proctor In a couple of minutes. l am going to be asking [examinee's name] a number of different questions to test [his/her] thinking and memory. Before we start. I need to ask you whether the address l have for your current location is correct. Please don't repeat it out loud if [examinee's name] is in the room with you. since I will be asking [him/her] the same question in a few minutes. Is your current address [examinee's address]? If the answer is"" no"" please ask the proctor either to step into another room before giving you the correct address or to have the examinee leave the room briefly before giving you the address. Then go on to say. Please be sure that all papers. pencils. books. calendars. newspapers. and everything else that might provide distraction or visual cues are removed from [examinee's name] sight. Also. please be sure that the room is quiet; there should be no television. radio. or music …",True,3JsfnzsAAAAJ:cWzG1nlazyYC,1393,https://www.researchprotocols.org/api/download?filename=301bc45c9c7e62133bb131ea8535b190.pdf&alt_name=6660-99053-3-SP.pdf,3904022196429160135,/scholar?cites=3904022196429160135,,https://www.researchprotocols.org/api/download?filename=301bc45c9c7e62133bb131ea8535b190.pdf&alt_name=6660-99053-3-SP.pdf,0
29823,Mini-mental state examination,2002,Joseph R Cockrell and Marshal F Folstein,,Principles and practice of geriatric psychiatry,,140-141,Wiley & Sons. West Sussex,The Mini-Mental State Examination (MMSE) is a 10-minute bedside measure of impaired thinking in undeveloped. uneducated. diseased. or very old populations. The summed score of the individual items indicates the current severity of cognitive impairment. Deterioration in cognition is indicated by decreasing scores of repeated tests. Scores are reliable between tests and between raters1 and correlate with other mental tests. electroencephalography2. computerized tomography3. magnetic resonance imaging4. single photon emission computed tomography (SPECT) scan5. CSF proteins and enzymes6. 7 and brain biopsy synapse numbers8. To administer the MMSE. gain the patient’s cooperation by asking him if there is a memory problem and then asking permission to test his memory. During testing. praise successes and ignore failures so as to avoid emotional reactions that will compromise cooperation and performance.The items of the MMSE include tests of orientation. registration. recall. calculation and attention. naming. repetition. comprehension. reading. writing and drawing. Level of consciousness is rated on a scale from coma to fully alert. but the consciousness rating is not summed with the other items. If all items are answered correctly. the score is 30. The mean score for a community-dwelling population over 65 years of age is 27. with a standard deviation of 1.71. The score is lower in those who completed comparatively fewer years of education and who have diagnosable diseases9–11. Patients with dementia. delirium. mental retardation. Parkinson’s disease. stroke and some cases of depression score lower than normal …,True,3JsfnzsAAAAJ:mNrWkgRL2YcC,908,http://citeseerx.ist.psu.edu/viewdoc/download?doi=10.1.1.453.4452&rep=rep1&type=pdf#page=150,14393228287397544649,/scholar?cites=14393228287397544649,,http://citeseerx.ist.psu.edu/viewdoc/download?doi=10.1.1.453.4452&rep=rep1&type=pdf#page=150,0
29824,Psychiatric symptoms and nursing home placement of patients with Alzheimer's disease.,1990,Cynthia Steele and Barry Rovner and Gary A Chase and Marshal Folstein,,The American journal of psychiatry,,,American Psychiatric Assn,Examined 210 community-dwelling patients with Alzheimer's disease as part of a longitudinal study. 25 of these Ss who were institutionalized over 3 yrs were matched to 25 Ss who were not institutionalized. and the groups were compared. Institutionalized Ss had higher scores on standardized psychiatric rating scales but not on formal neuropsychological tests of cognition. Potentially treatable (noncognitive) behavioral and psychiatric symptoms may be risk factors for institutionalization. and treating these symptoms might delay or prevent institutionalization of some patients.(PsycINFO Database Record (c) 2016 APA. all rights reserved),True,3JsfnzsAAAAJ:DJbcl8HfkQkC,892,https://psycnet.apa.org/record/1991-05682-001,9385519250079349210,/scholar?cites=9385519250079349210,,,0
29825,Effects of age on dopamine and serotonin receptors measured by positron tomography in the living human brain,1984,Dean F Wong and Henry N Wagner and Robert F Dannals and Jonathan M Links and J James Frost and Hayden T Ravert and Alan A Wilson and Arthur E Rosenbaum and Albert Gjedde and Kenneth H Douglass,226,Science,4681,1393-1396,American Association for the Advancement of Science,D2 dopamine and S2 serotonin receptors were imaged and measured in healthy human subjects by positron emission tomography after intravenous injection of 11C-labeled 3-N-methylspiperone. Levels of receptor in the caudate nucleus. putamen. and frontal cerebral cortex declined over the age span studied (19 to 73 years). The decline in D2 receptor in males was different from that in females.,True,3JsfnzsAAAAJ:0ngZmJvimKcC,837,https://science.sciencemag.org/content/226/4681/1393.abstract,15845615070681467162,/scholar?cites=15845615070681467162,,,0
29826,The meaning of cognitive impairment in the elderly,1985,Marshal Folstein and James C Anthony and Irma Parhad and Bonnie Duffy and Ernest M Gruenberg,33,Journal of the American Geriatrics Society,4,228-235,Blackwell Publishing Ltd,In order to determine the meaning of cognitive impairment in community dwelling elderly. 3.481 adults were interviewed in their homes using the Mini‐Mental State Examination. Ninety‐six per cent of the population aged 18–64 scored 23 or higher. whereas 80 per cent of the population 65 and over scored 23 or higher. Individuals with low scores were suffering from a variety of psychiatric disorders including dementia. Thirty‐three per cent of the elderly population scoring in the range of 0–23 had no diagnosable DSM‐III condition. Prevalence of dementia from all causes was 6.1 per cent of the population over age 65. Two per cent of the population over age 65 were diagnosed as having Alzheimer's disease,True,3JsfnzsAAAAJ:bKqednn6t2AC,725,https://onlinelibrary.wiley.com/doi/abs/10.1111/j.1532-5415.1985.tb07109.x,17280093218968364753,/scholar?cites=17280093218968364753,,https://www.polyu.edu.hk/cbs/rclcn/images/cdl_articles/F/Folstein_et_al._1985.pdf,0
29827,Comparison of the lay Diagnostic Interview Schedule and a standardized psychiatric diagnosis: experience in eastern Baltimore,1985,James C Anthony and Marshal Folstein and Alan J Romanoski and Michael R Von Korff and Gerald R Nestadt and Raman Chahal and Altaf Merchant and C Hendricks Brown and Sam Shapiro and Morton Kramer and Ernest M Gruenberg,42,Archives of general psychiatry,7,667-675,American Medical Association,• We studiedDSM-IIIdiagnoses made by the lay Diagnostic Interview Schedule (DIS) method in relation to a standardizedDSM-IIIdiagnosis by psychiatrists in the two-stage Baltimore Epidemiologic Catchment Area mental morbidity survey. Generally. prevalence estimates based on the DIS one-month diagnoses were significantly different from those based on the psychiatric diagnoses. Subjects identified as cases by each method were often different subjects. Measured in terms of K. the chance-corrected degree of agreement between the DIS and psychiatrists' one-month diagnoses was moderate forDSM-IIIalcohol-use disorder (abuse and dependence combined). and lower for other mental disorder categories. The unreliability of either the DIS or psychiatric diagnoses is one potential explanation for the observed disagreements. Others include the following: (1) insufficient or inadequate information (on which to …,True,3JsfnzsAAAAJ:HtS1dXgVpQUC,679,https://jamanetwork.com/journals/jamapsychiatry/article-abstract/493606,16066337591658727085,/scholar?cites=16066337591658727085,,,0
29828,Depression and mortality,1991,Barry W Rovner and Pearl S German and Larry J Brant and Rebecca Clark and Lynda Burton and Marshal F Folstein,265,Jama,8,993-996,American Medical Association,To determine the prevalence rates of major depressive disorder and of depressive symptoms and their relationship to mortality in nursing homes. research psychiatrists examined 454 consecutive new admissions and followed them up longitudinally for 1 year. Major depressive disorder occurred in 12.6% and 18.1% had depressive symptoms; the majority of cases were unrecognized by nursing home physicians and were untreated. Major depressive disorder. but not depressive symptoms. was a risk factor for mortality over 1 year independent of selected physical health measures and increased the likelihood of death by 59%. Because depression is a prevalent and treatable condition associated with increased mortality. recognition and treatment in nursing homes is imperative.(JAMA. 1991;265:993-996),True,3JsfnzsAAAAJ:yFnVuubrUp4C,616,https://jamanetwork.com/journals/jama/article-abstract/385137,6416808028360085915,/scholar?cites=6416808028360085915,,,0
29829,Reliability. validity. and clinical application of the visual analogue mood scale1,1973,Marshal F Folstein and Richard Luria,3,Psychological medicine,4,479-486,Cambridge University Press,The reliability and validity of the Visual Analogue Mood Scale (VAMS) has been demonstrated in both a military and a private psychiatric hospital. inpatient population. The repeated and concurrent administration of the VAMS and the Digit-Symbol test identifies a mood-performance correlation which distinguishes patients with affective disorders. of manic or depressed type. from other psychiatric patients.,True,3JsfnzsAAAAJ:OcBU2YAGkTUC,600,https://www.cambridge.org/core/journals/psychological-medicine/article/reliability-validity-and-clinical-application-of-the-visual-analogue-mood-scale1/88B36294AFB19142129D468D4EFD8335,8008024266601633331,/scholar?cites=8008024266601633331,,,0
29830,Mood disorder as a specific complication of stroke.,1977,Marshal F Folstein and Richard Maiberger and Paul R McHugh,40,"Journal of Neurology, Neurosurgery & Psychiatry",10,1018-1020,BMJ Publishing Group Ltd,In an effort to discern whether cerebral vascular injuries provoke specific emotional disturbances. 20 consecutively admitted stroke patients were compared with 10 orthopaedic patients. Both groups were examined for functional disabilities (Activities of Daily Living) and for psychiatric symptoms. Reliable and valid instruments. the Hamilton Rating Scale. the Visual Analogue Mood Scale. the Present State Exam. and the Mini-Mental State Exam were employed to display the psychopathology. More of stroke patients than orthopaedic patients were depressed (45% versus 10%) even though the level of functional disability in both groups were the same. Patients with right hemisphere stroke seemed particularly vulnerable and and displayed a syndrome of irritability. loss of interest. and difficulty in concentration. in addition to depression of mood (70% of right hemisphere stroke patients versus 0% left hemisphere stroke …,True,3JsfnzsAAAAJ:OR75R8vi5nAC,577,https://jnnp.bmj.com/content/40/10/1018.short,16574109898091239308,/scholar?cites=16574109898091239308,,https://jnnp.bmj.com/content/jnnp/40/10/1018.full.pdf,0
29831,Nonsteroidal anti-inflammatory drugs in Alzheimer's disease,1995,Jill B Rich and DX Rasmusson and Marshal F Folstein and Kathryn Anne Carson and C Kawas and Jason Brandt,45,Neurology,1,51-55,Wolters Kluwer Health. Inc. on behalf of the American Academy of Neurology,Article abstract-We reviewed the records of 210 patients in the Johns Hopkins Alzheimer9s Disease Research Center to evaluate the role of nonsteroidal anti-inflammatory drugs (NSAIDs) on clinical features and progression of the disease. We compared patients taking NSAIDs or aspirin on a daily basis (N = 32) to non-NSAID patients (N = 177) on clinical. cognitive. and psychiatric measures. The NSAID group had a significantly shorter duration of illness at study entry. Even after controlling for this difference. the NSAID group performed better on the Mini-Mental State Examination. Boston Naming Test. and the delayed condition of the Benton Visual Retention Test. Furthermore. analysis of longitudinal changes over 1 year revealed less decline among NSAID patients than among non-NSAID patients on measures of verbal fluency. spatial recognition. and orientation. These findings support other recent studies …,True,3JsfnzsAAAAJ:ODE9OILHJdcC,555,https://n.neurology.org/content/45/1/51.short,12811405753717454117,/scholar?cites=12811405753717454117,,,0
29832,Insulin. insulin-degrading enzyme and amyloid-β peptide in Alzheimer's disease: review and hypothesis,2006,Wei Qiao Qiu and Marshal F Folstein,27,,2,190-198,Elsevier,Clinical and epidemiological studies have found that type 2 diabetes. and hyperinsulinaemia. increased the risk of developing Alzheimer's disease (AD) in the elderly. The link between hyperinsulinaemia and AD may be insulin-degrading enzyme (IDE). This enzyme degrades both insulin and amylin. peptides related to the pathology of type 2 diabetes. along with amyloid-β peptide (Aβ). a short peptide found in excess in the AD brain. We review the current evidence. which suggests that hyperinsulinaemia may elevate Aβ through insulin's competition with Aβ for IDE. Genetic studies have also shown that IDE gene variations are associated with the clinical symptoms of AD as well as the risk of type 2 diabetes. The deficiency of IDE can be caused by genetic variation or by the diversion of IDE from the metabolism of Aβ to the metabolism of insulin. It is intriguing to notice that both hyperinsulinaemia and IDE gene …,True,3JsfnzsAAAAJ:yMeIxYmEMEAC,547,https://www.sciencedirect.com/science/article/pii/S0197458005000199,11399879180958203599,/scholar?cites=11399879180958203599,,"http://pages.ucsd.edu/~mboyle/COGS163/pdf-files/insulin,%20insulin-degrading%20enzyme%20and%20amyloid-%CE%B2%20peptide%20in%20Alzheimer's%20disease%20review%20and%20hypothesis-2006.pdf",0
29833,The neuropathology of aminergic nuclei in Alzheimer's disease,1988,Richard M Zweig and Christopher A Ross and John C Hedreen and Cynthia Steele and Joseptemberh E Cardillo and Peter J Whitehouse and Marchshal F Folstein and Donald L Price,24,Annals of Neurology: Official Journal of the American Neurological Association and the Child Neurology Society,2,233-242,Wiley Subscription Services. Inc.. A Wiley Company,Neuronal loss and the presence of neurofibrillary tangles (NFTs) within aminergic nuclei were examined in a series of patients with Alzheimer's disease (AD). Neuromelanin‐containing neurons within the locus ceruleus and large nucleolus‐containing neurons within the dorsal raphe nucleus and the central superior (raphe) nucleus were counted in 25 patients with AD and in 12 age‐matched control subjects. Numbers of NFTs were quantified in the same regions. Counts were compared with clinical data. including psychiatric evaluations. available for 21 of the patients with AD. Within the locus ceruleus in the patients with AD. abnormalities were more severe at mid level than at caudal or rostral levels (p < 0.01). Within the dorsal raphe nucleus. neuronal loss was most severe caudally (p < 0.05). NFTs. but not neuronal loss. were demonstrated within the central superior nucleus. Neuronal and NFT counts did not …,True,3JsfnzsAAAAJ:7H_jS4BsgvYC,485,https://onlinelibrary.wiley.com/doi/abs/10.1002/ana.410240210,3706226636681626271,/scholar?cites=3706226636681626271,,http://www.academia.edu/download/50485539/Zweig_RM_Ross_CA_Hedreen_JC_et_al._The_n20161122-28889-fj8mop.pdf,0
29834,Prevalence of mental illness in a community nursing home.,1986,Barry W Rovner and Stephanie Kafonek and Laura Filipp and Mary Jane Lucas and Marshal F Folstein,,The American journal of psychiatry,,,American Psychiatric Assn,Reports on the prevalence of Diagnostic and Statistical Manual of Mental Disorders (DSM-III) mental disorders and of behavioral disorders in a random sample of 50 residents (mean age 83 yrs) of a nursing home. who did not differ significantly from the rest of the nursing home population with regard to demographic characteristics. 94% of the sample were found to have mental disorders according to DSM-III criteria. with primary degenerative dementia and multi-infarct dementia being the most common diagnoses. 76% of the sample had at least 1 behavioral problem. Results are discussed in terms of the funding and delivery of psychiatric care for nursing home residents.(13 ref)(PsycINFO Database Record (c) 2016 APA. all rights reserved),True,3JsfnzsAAAAJ:3htObqc8RwsC,462,https://psycnet.apa.org/record/1987-11463-001,1948166932580937178,/scholar?cites=1948166932580937178,,,0
29835,Mini-mental state examination: clinical guide,2002,Marshal F Folstein and Susan E Folstein and Gary Fanjiang,,,,,Psychological Assessment Resources,,True,3JsfnzsAAAAJ:WC9gN4BGCRcC,425,http://scholar.google.com/scholar?cluster=12886950259805859827&hl=en&oi=scholarr,12886950259805859827,/scholar?cites=12886950259805859827,,,0
