,title,pub_year,author,volume,journal,number,pages,publisher,abstract,filled,author_pub_id,num_citations,pub_url,cites_id,citedby_url,author_id,eprint_url,got_citations,got_author_ids,author_ids
1025384,Palladium (II) and platinum (II) organometallic complexes with the model nucleobase anions of thymine. uracil. and cytosine: antitumor activity and interactions with DNA of the …,2006,José Ruiz and Julia Lorenzo and Laura Sanglas and Natalia Cutillas and Consuelo Vicente and María Dolores Villa and Francesc X Avilés and Gregorio López and Virtudes Moreno and José Pérez and Delia Bautista,45,Inorganic chemistry,16,6347-6360,American Chemical Society,Pd(II) and Pt(II) complexes with the anions of the model nucleobases 1-methylthymine (1-MethyH). 1-methyluracil (1-MeuraH). and 1-methylcytosine (1-MecytH) of the types [Pd(dmba)(μ-L)]2 [dmba = N.C-chelating 2-((dimethylamino)methyl)phenyl; L = 1-Methy. 1-Meura or 1-Mecyt] and [M(dmba)(L)(L‘)] [L = 1-Methy or 1-Meura; L‘ = PPh3 (M = Pd or Pt). DMSO (M = Pt)] have been obtained. Palladium complexes of the types [Pd(C6F5)(N−N)(L)] [L = 1-Methy or 1-Meura; N−N = N.N.N‘.N‘-tetramethylethylenediamine (tmeda). 2.2‘-bipyridine (bpy). or 4.4‘-dimethyl-2.2‘-bipyridine (Me2bpy)] and [NBu4][Pd(C6F5)(1-Methy)2(H2O)] have also been prepared. The crystal structures of [Pd(dmba)(μ-1-Methy)]2. [Pd(dmba)(μ-1-Mecyt)]2·2CHCl3. [Pd(dmba)(1-Methy)(PPh3)]·3CHCl3. [Pt(dmba)(1-Methy)(PPh3)]. [Pd(tmeda)(C6F5)(1-Methy)]. and [NBu4][Pd(C6F5)(1-Methy)2(H2O)]·H2O have been established by X-ray diffraction …,True,nGqhUpUAAAAJ:d1gkVwhDpl0C,86,https://pubs.acs.org/doi/abs/10.1021/ic060374e,13040078830913424316,/scholar?cites=13040078830913424316,,,0,0,0
1025385,Screening organometallic binuclear thiosemicarbazone ruthenium complexes as potential anti-tumour agents: cytotoxic activity and human serum albumin binding mechanism,2013,Bruno Demoro and Rodrigo FM De Almeida and Fernanda Marques and Cristina P Matos and Lucía Otero and João Costa Pessoa and Isabel Santos and Alejandra Rodríguez and Virtudes Moreno and Julia Lorenzo and Dinorah Gambino and Ana Isabel Tomaz,42,Dalton Transactions,19,7131-7146,Royal Society of Chemistry,Four complexes combining the {Ru(p-cym)} moiety (p-cym = para-cymene) with thiosemicarbazone (TSC) ligands containing the 5-nitrofuryl pharmacophore were investigated in vitro for their properties as prospective anti-tumour agents. The compounds are dimeric structures of general formula [Ru2(p-cym)2(L)2]X2 where X = Cl−. PF6− and L = deprotonated 5-nitrofuraldehyde TSC (L1). and the N-methyl (L2). N-ethyl (L3) and N-phenyl (L4) derivatives. The precursor [RuCl2(p-cym)]2. all TSC ligands L1–L4 and their corresponding complexes 1–4 were screened in vitro for their cytotoxicity against a range of human cancer cell lines (HL-60 acute promyelocytic leukemia. A2780 ovarian adenocarcinoma. MCF7 breast adenocarcinoma and PC3 grade IV prostate carcinoma). While the precursor complex was found to be inactive and L4 exhibited moderate activity only in the MCF7 cell line. the coordination of L4 to the …,True,nGqhUpUAAAAJ:YOwf2qJgpHMC,76,https://pubs.rsc.org/ko/content/articlehtml/2013/dt/c3dt00028a,5692625193251314426,/scholar?cites=5692625193251314426,,https://pdfs.semanticscholar.org/a2ee/32dc22a3c6b5cfde4738ac28a66eac0ae798.pdf,0,0,0
1025386,Inactivation of efflux pumps abolishes bacterial biofilm formation,2008,Malin Kvist and Viktoria Hancock and Per Klemm,74,Applied and environmental microbiology,23,7376-7382,American Society for Microbiology,Bacterial biofilms cause numerous problems in health care and industry; notably. biofilms are associated with a large number of infections. Biofilm-dwelling bacteria are particularly resistant to antibiotics. making it hard to eradicate biofilm-associated infections. Bacteria rely on efflux pumps to get rid of toxic substances. We discovered that efflux pumps are highly active in bacterial biofilms. thus making efflux pumps attractive targets for antibiofilm measures. A number of efflux pump inhibitors (EPIs) are known. EPIs were shown to reduce biofilm formation. and in combination they could abolish biofilm formation completely. Also. EPIs were able to block the antibiotic tolerance of biofilms. The results of this feasibility study might pave the way for new treatments for biofilm-related infections and may be exploited for prevention of biofilms in general.,True,X34CD1AAAAAJ:u5HHmVD_uO8C,258,https://aem.asm.org/content/74/23/7376.short,1609363763731716490,/scholar?cites=1609363763731716490,,https://aem.asm.org/content/aem/74/23/7376.full.pdf,0,0,0
1025387,The asymptomatic bacteriuria Escherichia coli strain 83972 outcompetes uropathogenic E. coli strains in human urine,2006,Viktoria Roos and Glen C Ulett and Mark A Schembri and Per Klemm,74,Infection and immunity,1,615-624,American Society for Microbiology Journals,Escherichia coli is the most common organism associated with asymptomatic bacteriuria (ABU). In contrast to uropathogenic E. coli (UPEC). which causes symptomatic urinary tract infections (UTI). very little is known about the mechanisms by which these strains colonize the human urinary tract. The prototype ABU E. coli strain 83972 was originally isolated from a girl who had carried it asymptomatically for 3 years. Deliberate colonization of UTI-susceptible individuals with E. coli 83972 has been used successfully as an alternative approach for the treatment of patients who are refractory to conventional therapy. Colonization with strain 83972 appears to prevent infection with UPEC strains in such patients despite the fact that this strain is unable to express the primary adhesins involved in UTI. viz. P and type 1 fimbriae. Here we investigated the growth characteristics of E. coli 83972 in human urine and show that it …,True,X34CD1AAAAAJ:dhFuZR0502QC,176,https://iai.asm.org/content/74/1/615.short,13847948371753322993,/scholar?cites=13847948371753322993,,https://iai.asm.org/content/iai/74/1/615.full.pdf,0,0,0
1025388,The asymptomatic bacteriuria Escherichia coli strain 83972 outcompetes uropathogenic E. coli strains in human urine,2006,Viktoria Roos and Glen C Ulett and Mark A Schembri and Per Klemm,74,Infection and immunity,1,615-624,American Society for Microbiology Journals,Escherichia coli is the most common organism associated with asymptomatic bacteriuria (ABU). In contrast to uropathogenic E. coli (UPEC). which causes symptomatic urinary tract infections (UTI). very little is known about the mechanisms by which these strains colonize the human urinary tract. The prototype ABU E. coli strain 83972 was originally isolated from a girl who had carried it asymptomatically for 3 years. Deliberate colonization of UTI-susceptible individuals with E. coli 83972 has been used successfully as an alternative approach for the treatment of patients who are refractory to conventional therapy. Colonization with strain 83972 appears to prevent infection with UPEC strains in such patients despite the fact that this strain is unable to express the primary adhesins involved in UTI. viz. P and type 1 fimbriae. Here we investigated the growth characteristics of E. coli 83972 in human urine and show that it …,True,X34CD1AAAAAJ:8k81kl-MbHgC,176,https://iai.asm.org/content/74/1/615.short,13847948371753322993,/scholar?cites=13847948371753322993,,https://iai.asm.org/content/iai/74/1/615.full.pdf,0,0,0
1025389,Molecular characterization of the Escherichia coli asymptomatic bacteriuria strain 83972: the taming of a pathogen,2006,Per Klemm and Viktoria Roos and Glen C Ulett and Catharina Svanborg and Mark A Schembri,74,Infection and immunity,1,781-785,American Society for Microbiology Journals,Escherichia coli 83972 is a clinical asymptomatia bacteriuric isolate that is able to colonize the human urinary bladder without inducing an immune response. Here we demonstrate that one of the mechanisms by which this strain has become attenuated is through the mutation of its genes encoding type 1 and P fimbriae.,True,X34CD1AAAAAJ:MXK_kJrjxJIC,153,https://iai.asm.org/content/74/1/781.short,7795370188061567975,/scholar?cites=7795370188061567975,,https://iai.asm.org/content/iai/74/1/781.full.pdf,0,0,0
1025390,Prevention of bacterial adhesion,2010,Per Klemm and Rebecca Munk Vejborg and Viktoria Hancock,88,,2,451-459,Springer-Verlag,Management of bacterial infections is becoming increasingly difficult due to the emergence and increasing prevalence of bacterial pathogens that are resistant to available antibiotics. Conventional antibiotics generally kill bacteria by interfering with vital cellular functions. an approach that imposes selection pressure for resistant bacteria. New approaches are urgently needed. Targeting bacterial virulence functions directly is an attractive alternative. An obvious target is bacterial adhesion. Bacterial adhesion to surfaces is the first step in colonization. invasion. and biofilm formation. As such. adhesion represents the Achilles heel of crucial pathogenic functions. It follows that interference with adhesion can reduce bacterial virulence. Here. we illustrate this important topic with examples of techniques being developed that can inhibit bacterial adhesion. Some of these will become valuable weapons for …,True,X34CD1AAAAAJ:UeHWp8X0CEIC,133,https://link.springer.com/article/10.1007/s00253-010-2805-y,13009490608088627003,/scholar?cites=13009490608088627003,,https://www.academia.edu/download/47848827/Prevention_of_bacterial_adhesion20160806-32694-um0doj.pdf,0,0,0
1025391,The ferric yersiniabactin uptake receptor FyuA is required for efficient biofilm formation by urinary tract infectious Escherichia coli in human urine,2008,Viktoria Hancock and Lionel Ferrieres and Per Klemm,154,Microbiology,1,167-175,Microbiology Society,Urinary tract infection (UTI) is the most common infection in patients with indwelling urinary catheters. and bacterial biofilm formation is a major problem in this type of infection. Escherichia coli is responsible for the large majority of UTIs. Free iron is strictly limited in the human urinary tract and there is fierce competition between the host and infectious bacteria for this essential metal. Urinary tract infectious E. coli have highly efficient mechanisms of iron acquisition. one of which is the yersiniabactin system. The fyuA gene. encoding the yersiniabactin receptor. is one of the most upregulated genes in biofilm; it was upregulated 63-fold in the E. coli UTI strain VR50. FyuA was found to be highly important for biofilm formation in iron-poor environments such as human urine. Mutants in fyuA show aberrant biofilm formation and the cells become filamentous; a VR50fyuA mutant showed a 92 % reduction in biofilm formation …,True,X34CD1AAAAAJ:2osOgNQ5qMEC,132,https://www.microbiologyresearch.org/content/journal/micro/10.1099/mic.0.2007/011981-0?crawler=true,10054902376302471912,/scholar?cites=10054902376302471912,,https://citeseerx.ist.psu.edu/viewdoc/download?doi=10.1.1.550.8462&rep=rep1&type=pdf,0,0,0
1025392,Global gene expression profiling of the asymptomatic bacteriuria Escherichia coli strain 83972 in the human urinary tract,2006,Viktoria Roos and Per Klemm,74,Infection and immunity,6,3565-3575,American Society for Microbiology Journals,Urinary tract infections (UTIs) are an important health problem worldwide. with many million cases each year. Escherichia coli is the most common organism causing UTIs in humans. The asymptomatic bacteriuria E. coli strain 83972 is an excellent colonizer of the human urinary tract. where it causes long-term bladder colonization. The strain has been used for prophylactic purposes in patients prone to more severe and recurrent UTIs. For this study. we used DNA microarrays to monitor the expression profile of strain 83972 in the human urinary tract. Significant differences in expression levels were seen between the in vivo expression profiles of strain 83972 in three patients and the corresponding in vitro expression profiles in lab medium and human urine. The data revealed an in vivo lifestyle of microaerobic growth with respiration of nitrate coupled to degradation of sugar acids and amino acids. with no signs of …,True,X34CD1AAAAAJ:3fE2CSJIrl8C,117,https://iai.asm.org/content/74/6/3565.short,14701762236615395825,/scholar?cites=14701762236615395825,,https://iai.asm.org/content/iai/74/6/3565.full.pdf,0,0,0
1025393,Biofilm formation by asymptomatic and virulent urinary tract infectious Escherichia coli strains,2007,Viktoria Hancock and Lionel Ferrieres and Per Klemm,267,FEMS microbiology letters,1,30-37,Blackwell Publishing Ltd, Escherichia coli is the most common organism associated with asymptomatic bacteriuria (ABU) in humans. In contrast to uropathogenic E. coli (UPEC) that cause symptomatic urinary tract infection. very little is known about the mechanisms by which these strains colonize the urinary tract. Here. we have investigated the biofilm-forming capacity on abiotic surfaces of groups of ABU strains and UPEC strains in human urine. We found that there is a strong bias; ABU strains were significantly better biofilm formers than UPEC strains. Our data suggest that biofilm formation in urinary tract infectious E. coli seems to be associated with ABU strains and appears to be an important strategy used by these strains for persistence in this high-flow environment.,True,X34CD1AAAAAJ:9yKSN-GCB0IC,116,https://academic.oup.com/femsle/article-abstract/267/1/30/644800,8355467638400616126,/scholar?cites=8355467638400616126,,https://academic.oup.com/femsle/article/267/1/30/644800,0,0,0
1025394,Probiotic Escherichia coli strain Nissle 1917 outcompetes intestinalpathogens during biofilm formation,2010,Viktoria Hancock and Malin Dahl and Per Klemm,59,Journal of medical microbiology,4,392-399,Microbiology Society,Many bacterial infections are associated with biofilm formation. Bacterialbiofilms can develop on essentially all kinds of surfaces. producing chronicand often intractable infections. Escherichia coli is an importantpathogen causing a wide range of gastrointestinal infections. E. coli strain Nissle 1917 has been used for many decades as a probiotic againsta variety of intestinal disorders and is probably the best field-tested E. coli strain in the world. Here we have investigated the biofilm-formingcapacity of Nissle 1917. We found that the strain was a good biofilm former.Not only was it significantly better at biofilm formation than enteropathogenic.enterotoxigenic and enterohaemorrhagic E. coli strains. it was alsoable to outcompete such strains during biofilm formation. The results supportthe notion of bacterial prophylaxis employing Nissle 1917 and may partiallyexplain why the strain has a beneficial effect on many …,True,X34CD1AAAAAJ:zYLM7Y9cAGgC,102,https://www.microbiologyresearch.org/content/journal/jmm/10.1099/jmm.0.008672-0?crawler=true,14830394878525829885,/scholar?cites=14830394878525829885,,https://www.academia.edu/download/50636224/392.full.pdf,0,0,0
1025395,Global gene expression profiling of asymptomatic bacteriuria Escherichia coli during biofilm growth in human urine,2007,Viktoria Hancock and Per Klemm,75,Infection and immunity,2,966-976,American Society for Microbiology Journals,Urinary tract infection (UTI) is an important health problem worldwide. with many millions of cases each year. and Escherichia coli is the most common organism causing UTI in humans. Also. E. coli is responsible for most infections in patients with chronic indwelling bladder catheter. The two asymptomatic bacteriuria (ABU) E. coli strains 83972 and VR50 are significantly better biofilm formers in their natural growth medium. human urine. than the two uropathogenic E. coli isolates CFT073 and 536. We used DNA microarrays to monitor the expression profile during biofilm growth in urine of the two ABU strains 83972 and VR50. Significant differences in expression levels were seen between the biofilm expression profiles of the two strains with the corresponding planktonic expression profiles in morpholinepropanesulfonic acid minimal laboratory medium and human urine; 417 and 355 genes were up- and down …,True,X34CD1AAAAAJ:7PzlFSSx8tAC,98,https://iai.asm.org/content/75/2/966.short,8109477662084513220,/scholar?cites=8109477662084513220,,https://iai.asm.org/content/iai/75/2/966.full.pdf,0,0,0
1025396,Global gene expression profiling of asymptomatic bacteriuria Escherichia coli during biofilm growth in human urine,2007,Viktoria Hancock and Per Klemm,75,Infection and immunity,2,966-976,American Society for Microbiology Journals,Urinary tract infection (UTI) is an important health problem worldwide. with many millions of cases each year. and Escherichia coli is the most common organism causing UTI in humans. Also. E. coli is responsible for most infections in patients with chronic indwelling bladder catheter. The two asymptomatic bacteriuria (ABU) E. coli strains 83972 and VR50 are significantly better biofilm formers in their natural growth medium. human urine. than the two uropathogenic E. coli isolates CFT073 and 536. We used DNA microarrays to monitor the expression profile during biofilm growth in urine of the two ABU strains 83972 and VR50. Significant differences in expression levels were seen between the biofilm expression profiles of the two strains with the corresponding planktonic expression profiles in morpholinepropanesulfonic acid minimal laboratory medium and human urine; 417 and 355 genes were up- and down …,True,X34CD1AAAAAJ:u-x6o8ySG0sC,98,https://iai.asm.org/content/75/2/966.short,8109477662084513220,/scholar?cites=8109477662084513220,,https://iai.asm.org/content/iai/75/2/966.full.pdf,0,0,0
1025397,Heterocyclic anticancer compounds: recent advances and the paradigm shift towards the use of nanomedicine’s tool box,2015,Pedro Martins and João Jesus and Sofia Santos and Luis R Raposo and Catarina Roma-Rodrigues and Pedro Viana Baptista and Alexandra R Fernandes,20,,9,16852-16891,Multidisciplinary Digital Publishing Institute,The majority of heterocycle compounds and typically common heterocycle fragments present in most pharmaceuticals currently marketed. alongside with their intrinsic versatility and unique physicochemical properties. have poised them as true cornerstones of medicinal chemistry. Apart from the already marketed drugs. there are many other being investigated for their promising activity against several malignancies. In particular. anticancer research has been capitalizing on the intrinsic versatility and dynamic core scaffold of these compounds. Nevertheless. as for any other promising anticancer drugs. heterocyclic compounds do not come without shortcomings. In this review. we provide for a concise overview of heterocyclic active compounds and families and their main applications in medicine. We shall focus on those suitable for cancer therapy while simultaneously addressing main biochemical modes of action. biological targets. structure-activity relationships as well as intrinsic limitation issues in the use of these compounds. Finally. considering the advent of nanotechnology for effective selective targeting of drugs. we shall discuss fundamental aspects and considerations on nanovectorization of such compounds that may improve pharmacokinetic/pharmacodynamic properties of heterocycles. View Full-Text,True,2MZnSxAAAAAJ:8k81kl-MbHgC,281,https://www.mdpi.com/1420-3049/20/9/16852,15359652799593474650,/scholar?cites=15359652799593474650,,https://www.mdpi.com/1420-3049/20/9/16852/pdf,0,0,0
1025398,Yeast diversity in hypersaline habitats,2005,L Butinar and S Santos and I Spencer-Martins and A Oren and N Gunde-Cimerman,244,FEMS microbiology letters,2,229-234,Blackwell Publishing Ltd,Thus far it has been considered that hypersaline natural brines which are subjected to extreme solar heating. do not contain non-melanized yeast populations. Nevertheless we have isolated yeasts in eight different salterns worldwide. as well as from the Dead Sea. Enriquillo Lake (Dominican Republic) and the Great Salt Lake (Utah). Among the isolates obtained from hypersaline waters. Pichia guilliermondii. Debaryomyces hansenii. Yarrowia lipolytica and Candida parapsilosis are known contaminants of low water activity food. whereas Rhodosporidium sphaerocarpum. R. babjevae. Rhodotorula laryngis. Trichosporon mucoides. and a new species resembling C. glabrata were not known for their halotolerance and were identified for the first time in hypersaline habitats. Moreover. the ascomycetous yeast Metschnikowia bicuspidata. known to be a parasite of the brine shrimp. was isolated as a free-living form …,True,2MZnSxAAAAAJ:PELIpwtuRlgC,241,https://academic.oup.com/femsle/article-abstract/244/2/229/470145,10575741466843118372,/scholar?cites=10575741466843118372,,https://academic.oup.com/femsle/article/244/2/229/470145,0,0,0
1025399,Polyphasic taxonomy of the basidiomycetous yeast genus Rhodosporidium: Rhodosporidium kratochvilovae and related anamorphic species.,2001,José Paulo Sampaio and Mario Gadanho and Sofia Santos and Filomena L Duarte and Célia Pais and Alvaro Fonseca and Jack W Fell,51,International Journal of Systematic and Evolutionary Microbiology,2,687-697,Microbiology Society,The phenotypic and genetic heterogeneity of the basidiomycetous yeast species Rhodosporidium kratochvilovae was investigated in a group of recent isolates and collection strains. A polyphasic taxonomic approach was followed which included micromorphological studies. nuclear staining. determination of sexual compatibility. physiological characterization. comparison of electrophoretic isoenzyme patterns. PCR fingerprinting. determination of mol% G+C. DNA-DNA reassociation experiments and 26S and ITS rDNA sequence analysis. The results allowed a more natural circumscription of the species. both from the genetic and phenotypic perspectives. The relationships with anamorphic species of the genus Rhodotorula were studied and isolates previously identified as Rhodotorula glutinis were found to belong to Rhodosporidium kratochvilovae. Other isolates included in the study were found to represent …,True,2MZnSxAAAAAJ:iH-uZ7U-co4C,160,https://www.microbiologyresearch.org/content/journal/ijsem/10.1099/00207713-51-2-687?crawler=true,8729932873226569215,/scholar?cites=8729932873226569215,,https://www.academia.edu/download/33396307/687.pdf,0,0,0
1025400,Recovery of protein. chitin. carotenoids and glycosaminoglycans from Pacific white shrimp (Litopenaeus vannamei) processing waste,2012,Thiago B Cahú and Suzan D Santos and Aline Mendes and Carolina R Córdula and Suely F Chavante and Luiz B Carvalho Jr and Helena B Nader and Ranilson S Bezerra,47,Process Biochemistry,4,570-577,Elsevier,Shrimp head waste is a major byproduct of crustacean processing in North-eastern Brazil and represents an interesting source of bioactive molecules. Additionally. its use increases the sustainability of processing fishery products. The present study reports a process developed for recovering bioactive molecules from shrimp heads through autolysis. A protein hydrolysate (120 ± 0.4 g) formed by a 9% (w/v) solution was recovered and lyophilized from 1 kg of shrimp heads. Approximately 195 ± 0.5 mg of carotenoids was recovered as an ethanolic extract. The recovery of chitin and chitosan were 25 ± 2 g kg−1 and 17 ± 4 g kg−1 wet processing waste. respectively. Chitosans were characterized by 13C NMR. and FT-IR analysis and exhibited a variable degree of deacetylation (60–80%). Sulfated glycosaminoglycans that exhibited electrophoretic migration similar to mammalian standards were also recovered (79 ± 2 …,True,2MZnSxAAAAAJ:ldfaerwXgEUC,122,https://www.sciencedirect.com/science/article/pii/S135951131100448X,4954204450797344722,/scholar?cites=4954204450797344722,,https://www.sciencedirect.com/science/article/pii/S135951131100448X,0,0,0
1025401,Úlcera de perna: um estudo de casos em Juiz de Fora-MG (Brasil) e região,2005,Marco Andrey Cipriani Frade and Igor Brum Cursi and Felipe Fortes Andrade and Samara Casemiro Soares and Wendel S Ribeiro and Sandro V Santos and Norma Tiraboschi Foss,80,Anais Brasileiros de Dermatologia,1,41-46,Sociedade Brasileira de Dermatologia,FUNDAMENTOS: Úlcera de perna (UP) caracteriza-se por perda do tegumento nas extremidades dos membros inferiores causada geralmente por disfunção vascular. OBJETIVOS: Caracterizar clínica e epidemiologicamente a amostra populacional com UP atendida nos centros de saúde de Juiz de Fora. PACIENTES E MÉTODOS: Submetidos ao protocolo clínico 124 pacientes com UP. de Juiz de Fora e região de janeiro/1999 a agosto/2001. RESULTADOS: A média de idade foi 64 anos. 65.3% do sexo feminino. média de 3.7 indivíduos/família e renda inferior a R$540.00 (86.8%). Associavam-se às úlceras insuficiência venosa (90.3%). hipertensão arterial sistêmica (54%). obesidade (20.2%) e diabetes mellitus (16.1%). A associação insuficiência venosa e hipertensão arterial foi freqüente (43.7%) e significante (p<0.01) para predisposição às úlceras. Foram classificadas como venosas (79%). hipertensivas (15.4%). mistas e outras(5.6%). Acometiam terço distal das pernas (90%). de tamanho grande (5cm) em cerca de 90% da amostra. com médias de 8.7cm e 9.6cm para os eixos vertical e horizontal. respectivamente. Estavam acompanhadas de hipercromia (92.7%). lipodermatoesclerose (68.5%) e varicosidades (66.9%). com duração média de 94.2 meses. e 50% das úlceras eram recidivantes. CONCLUSÕES: Os dados sugerem que a úlcera de perna seja doença crônica significativa na população idosa e de baixa renda de Juiz de Fora e região.,True,2MZnSxAAAAAJ:4OULZ7Gr8RgC,103,https://www.scielo.br/scielo.php?pid=S0365-05962005000100006&script=sci_arttext,16395639159170624689,/scholar?cites=16395639159170624689,,https://www.scielo.br/scielo.php?pid=S0365-05962005000100006&script=sci_arttext,0,0,0
