,title,pub_year,author,volume,journal,number,pages,publisher,abstract,filled,author_pub_id,num_citations,pub_url,cites_id,citedby_url,author_id,eprint_url,got_citations,got_author_ids,author_ids
86211,Silencing LRH-1 in colon cancer cell lines impairs proliferation and alters gene expression programs,2015,James R Bayrer and Sridevi Mukkamala and Elena P Sablin and Paul Webb and Robert J Fletterick,112,Proceedings of the National Academy of Sciences,8,2467-2472,National Academy of Sciences,Colorectal cancers (CRCs) account for nearly 10% of all cancer deaths in industrialized countries. Recent evidence points to a central role for the nuclear receptor liver receptor homolog-1 (LRH-1) in intestinal tumorigenesis. Interaction of LRH-1 with the Wnt/β-catenin pathway. highly active in a critical subpopulation of CRC cells. underscores the importance of elucidating LRH-1’s role in this disease. Reduction of LRH-1 diminishes tumor burden in murine models of CRC; however. it is not known whether LRH-1 is required for tumorigenesis. for proliferation. or for both. In this work. we address this question through shRNA-mediated silencing of LRH-1 in established CRC cell lines. LRH-1 mRNA knockdown results in significantly impaired proliferation in a cell line highly expressing the receptor and more modest impairment in a cell line with moderate LRH-1 expression. Cell-cycle analysis shows prolongation of G0 …,True,MAlNgd0AAAAJ:eQOLeE2rZwMC,42,https://www.pnas.org/content/112/8/2467.short,547420095083006790,/scholar?cites=547420095083006790,,https://www.pnas.org/content/pnas/112/8/2467.full.pdf,0,0,0
86212,Calcium-dependent changes in the flexibility of the regulatory domain of troponin C in the troponin complex,2005,Tharin MA Blumenschein and Deborah B Stone and Robert J Fletterick and Robert A Mendelson and Brian D Sykes,280,Journal of Biological Chemistry,23,21924-21932,Elsevier,With the recent advances in structure determination of the troponin complex. it becomes even more important to understand the dynamics of its components and how they are affected by the presence or absence of Ca2+. We used NMR techniques to study the backbone dynamics of skeletal troponin C (TnC) in the complex. Transverse relaxation-optimized spectroscopy pulse sequences and deuteration of TnC were essential to assign most of the TnC residues in the complex. Backbone amide 15N relaxation times were measured in the presence of Ca2+ or EGTA/Mg2+. T1 relaxation times could not be interpreted precisely. because for a molecule of this size. the longitudinal backbone amide 15N relaxation rate due to chemical shift anisotropy and dipole-dipole interactions becomes too small. and other relaxation mechanisms become relevant. T2 relaxation times were of the expected magnitude for a complex of …,True,MAlNgd0AAAAJ:NJ774b8OgUMC,42,https://www.sciencedirect.com/science/article/pii/S0021925820691359,8265696908650422482,/scholar?cites=8265696908650422482,,https://www.sciencedirect.com/science/article/pii/S0021925820691359,0,0,0
86213,Proteases,1992,Margaret A Phillips and Robert J Fletterick,2,,5,713-720,Elsevier Current Trends,Proteases control many physiological responses. thus the identification and characterization of specific proteases offers the prospect of new medical adbances. Study of the structure-function relationships in protease-catalyzed hydrolysis of the peptide bond has adbanced our understanding of enzyme catalysis and specificity. Three-dimensional structures have been solved for each mechanistic class of protease. and these studies have been extended using site-directed mutagenesis to characterize the amino acid residues required for enzyme function.,True,MAlNgd0AAAAJ:4X0JR2_MtJMC,42,https://www.sciencedirect.com/science/article/pii/0959440X9290206M,15298224325134502966,/scholar?cites=15298224325134502966,,,0,0,0
86214,Coordination between motor domains in processive kinesins,2004,Elena P Sablin and Robert J Fletterick,279,,16,15707-15710,American Society for Biochemistry and Molecular Biology,Among cellular functions that kinesins perform. their ability to walk along the microtubules transporting specific cargoes is the most fascinating (1. 2). The complexity of this phenomenon and tremendous scientific efforts put toward dissecting the mechanisms underlying it have led to conflicting models explaining how kinesins might travel long distances without dissociating from their biological track (eg move “processively”(3)).Although these models differ. for conventional kinesin dimer the favored one predicts that the two kinesin heads bind alternatively to the track. taking 80-Å steps along the microtubule while hydrolyzing one ATP molecule per step (4–6). This “hand-over-hand” model (7. 8) also predicts that the two kinesin heads remain enzymatically “out of phase”(eg at different stages of the ATP hydrolysis cycle). ensuring that. at any given tug. at least one of the two motor domains remains strongly attached to …,True,MAlNgd0AAAAJ:5nxA0vEk-isC,40,https://www.jbc.org/content/279/16/15707.short,1256701370180890016,/scholar?cites=1256701370180890016,,https://www.jbc.org/article/S0021-9258(20)88280-5/fulltext,0,0,0
86215,Identification of the molecular trigger for allosteric activation in glycogen phosphorylase,1994,Michelle F Browner and David Hackos and Robert Fletterick,1,Nature structural biology,5,327-333,Nature Publishing Group,Activation of protein function through phosphorylation can be mimicked by the engineering of specific metal binding sites. The addition of two histidine residues to glycogen phosphorylase allows enzymatic activation by transition metals in a cooperative and allosteric manner. Crystal structures of the metallo-enzyme have been determined and show that the structural transition induced upon metal binding (Ni 2+) is. in part. analogous to the mode of activation of the native enzyme. The designed metal activation site allows assignment of the structural changes which trigger activation in this allosteric enzyme and. further. provide insight into the evolutionary development of multiple activation sites.,True,MAlNgd0AAAAJ:a9-T7VOCCH8C,40,https://www.nature.com/articles/nsb0594-327,12730658683562544952,/scholar?cites=12730658683562544952,,,0,0,0
86216,An alternate geometry for the catalytic triad of serine proteases,1992,David R Corey and Mary E McGrath and John R Vasquez and Robert J Fletterick and Charles S Craik,114,Journal of the American Chemical Society,12,4905-4907,American Chemical Society,We have previously reportedthat. of the three members of the triad. only the serine in trypsin is necessary for a minimal level of catalysis toward peptide bonds. 3 In this communication we report the mutation of Asp 102 andthe partial replacement of its function in catalysis through the introduction of aspartic or glutamic acid in place of a neighboring amino acid. Ser 214. The (1)(a) Lerner. R. A.; Benkovic. SJ; Schultz. PG Science 1991. 252. 659-667.(b) Lewis. C. T.; Hilvert. D. Curr. Opin. Struct. Biol. 1991./. 624-629.(2)(a) DeGrado. W. F.; Wasserman. ZR; Lear. J. D. Science 1989. 243. 622-628.(b) Hahn. KW; Klis. W. A.; Stewart. J. M. Science 1990. 248. 1544-1547.(c) Sander. C. Curr. Opin. Struct. Biol. 1991./. 630-637.(d) DeGrado. W. F.; Raleigh. D. P.; Handel. T. Curr. Opin. Struct. Biol. 1991. 1. 984-993.,True,MAlNgd0AAAAJ:cFHS6HbyZ2cC,40,https://pubs.acs.org/doi/pdf/10.1021/ja00038a067,4510953166422720109,/scholar?cites=4510953166422720109,,,0,0,0
86217,The combination of independent phase information obtained from separate protein structure determinations of yeast hexokinase,1976,ROBERT J Fletterick and THOMAS A Steitz,32,"Acta Crystallographica Section A: Crystal Physics, Diffraction, Theoretical and General Crystallography",1,125-132,International Union of Crystallography,A procedure is presented for combining in reciprocal space the information contained in protein structures which have been independently determined by multiple isomorphous replacement (MIR). Application of this method to the two crystal forms of yeast hexokinase B which have been solved at 3.5 Å resolution results in an electron density map that is a striking improvement over either of the two MIR maps or the map obtained by simply averaging the MIR maps in direct space. The background is lower. the apparent resolution is higher and most importantly. side chains are visible in this new hybrid map where none exist in either of the MIR maps. The method consists of determining a linear transformation matrix and vector relating the subunits of the two crystals. orienting the electron density map of one crystal form in the unit cell of the other and transforming this map to produce a set of calculated phases and …,True,MAlNgd0AAAAJ:tuHXwOkdijsC,40,https://scripts.iucr.org/cgi-bin/paper?S0567739476000235,10247501314299256521,/scholar?cites=10247501314299256521,,,0,0,0
86218,Compromise and accommodation in ecotin. a dimeric macromolecular inhibitor of serine proteases,2000,Sarah A Gillmor and Toshihiko Takeuchi and Steven Q Yang and Charles S Craik and Robert J Fletterick,299,Journal of molecular biology,4,993-1003,Academic Press,Ecotin is a dimeric serine protease inhibitor from Escherichia coli which binds proteases to form a hetero-tetramer with three distinct interfaces: an ecotin-ecotin dimer interface. a larger primary ecotin-protease interface. and a smaller secondary ecotin-protease interface. The contributions of these interfaces to binding and inhibition are unequal. To investigate the contribution and adaptability of each interface. we have solved the structure of two mutant ecotin-trypsin complexes and compared them to the structure of the previously determined wild-type ecotin-trypsin complex. Wild-type ecotin has an affinity of 1 nM for trypsin. while the optimized mutant. ecotin Y69F. D70P. which was found using phage display technologies. inhibits rat trypsin with a Ki value of 0.08 nM. Ecotin 67-70A. M84R which has four alanine substitutions in the ecotin-trypsin secondary binding site. along with the M84R mutation at the primary …,True,MAlNgd0AAAAJ:FiytvqdAVhgC,39,https://www.sciencedirect.com/science/article/pii/S0022283600938129,16521450756813288661,/scholar?cites=16521450756813288661,,https://www.academia.edu/download/64967051/jmbi.2000.381220201117-9790-iq4lq3.pdf,0,0,0
86219,Comparative analysis of viral cysteine protease structural models,1989,J Fernando Bazan and Robert J Fletterick,249,FEBS letters,1,5-7,,A recent Discussion Letter in this journal by the Moscow group of Gorbalenya et al.[l] presents similar conclusions to an earlier study by Bazan and Fletterick [2]. Both papers propose an evolutionary relationship between viral Cys proteases (encoded by related positive-stranded RNA viruses of animals and plants; for review see [3]) and the family of cellular. trypsin-like Ser proteases. This association is suggested by alignment of viral protease sequences and secondary structural patterns that reveal common features with the bilobal. LY-barrel fold of trypsin-like enzymes. The spatial identity of the active site Ser of trypsin-like proteases (the nucleophilic residue of the catalytic triad His-57/Asp-102/Ser-195. chymotrypsin numbering scheme [4]) and a conserved Cys residue found in the C-termini of viral Cys protease domains [5] is a striking measure of the divergence of the viral and cellular protease classes. Both …,True,MAlNgd0AAAAJ:pqnbT2bcN3wC,37,https://febs.onlinelibrary.wiley.com/doi/abs/10.1016/0014-5793(89)80003-1,4083523720084794344,/scholar?cites=4083523720084794344,,https://febs.onlinelibrary.wiley.com/doi/pdf/10.1016/0014-5793%2889%2980003-1,0,0,0
86220,Two resistance to thyroid hormone mutants with impaired hormone binding,2003,B Russell Huber and Ben Sandler and Brian L West and Suzana T Cunha Lima and Hoa T Nguyen and James W Apriletti and John D Baxter and Robert J Fletterick,17,Molecular Endocrinology,4,643-652,Oxford University Press,Resistance to hormones is commonly due to mutations in genes encoding receptors. Resistance to thyroid hormone is due mostly to mutations of the β-form of the human (h) thyroid hormone receptor (hTRβ). We determined x-ray crystal structures of two hTRβ ligand-binding domains (LBDs). Ala 317 Thr and Arg 316 His. Amino acids 316 and 317 form part of the hormone-binding pocket. The methyl of Ala 317. contacting iodine. sculpts the T3 hormone-binding pocket. Arg 316 is not in direct contact with T3 and has an unknown role in function. Remarkably. the Arg forms part of an unusual buried polar cluster in hTRβ. Although the identity of the amino acids changes. the polar cluster appears in all nuclear receptors. In spite of the differing roles of 316 and 317. both resistance to thyroid hormone mutants display decreased T3 affinity and weakened transcriptional activation. The two mutants differ in that the Arg …,True,MAlNgd0AAAAJ:nRpfm8aw39MC,36,https://academic.oup.com/mend/article-abstract/17/4/643/2756349,16373174138034004435,/scholar?cites=16373174138034004435,,https://academic.oup.com/mend/article/17/4/643/2756349,0,0,0
86221,Purification and crystallization of 15-lipoxygenase from rabbit reticulocytes,1990,David L Sloane and Michelle F Browner and Zbigniew Dauter and Keith Wilson and Robert J Fletterick and Elliott Sigal,173,Biochemical and biophysical research communications,2,507-513,Academic Press,We report a new purification of rabbit reticulocyte 15-lipoxygenase that has resulted in the first crystallization of a mammalian lipoxygenase. The enzyme was purified to homogeneity (greater than 98% pure by SDS-PAGE) using high pressure liquid chromatography on hydrophobic-interaction. hydroxyapatite and cation-exchange columns. Crystals were grown by the vapor diffusion method from concentrated solutions of the protein in sodium phosphate buffer. pH 7.0. The hexagonal. rod-shaped crystals were on average 0.09 mm × 0.09 mm × 0.4 mm. with approximate unit cell dimensions of a=b=260 Å. c=145 Å. The crystals diffract to 5 Å resolution.,True,MAlNgd0AAAAJ:TIZ-Mc8IlK0C,35,https://www.sciencedirect.com/science/article/pii/S0006291X05800634,10107012557113334142,/scholar?cites=10107012557113334142,,,0,0,0
86222,Subunit interactions and the allosteric response in phosphorylase,1980,S Sprang and RJ Fletterick,32,Biophysical journal,1,175-192,Cell Press,The contribution of intersubunit interactions to allosterically induced conformational changes in phosphorylase are considered. Phosphorylase a. Pa (phosphorylated at Ser-14). is significantly in the active (R) conformation. while phosphorylase b. Pb (nonphosphorylated). is predominantly in the inactive (T) conformation. The structure of glucose-inhibited (T) Pa has been determined at 2.5-A resolution and atomic coordinates have been measured. These data have been used to calculate the solvent accessible surface area at the subunit interface and map noncovalent interactions between protomers. The subunit contact involves only 6% of the Pa monomer surface. but withdraws an area of 4.600 A2 from solvent. The contact region is confined to the N-terminal (regulatory) domain of the subunit. Half of the residues involved are among the 70 N-terminal peptides. A total of approximately 100 atoms take part in polar …,True,MAlNgd0AAAAJ:aqlVkmm33-oC,35,https://www.sciencedirect.com/science/article/pii/S0006349580849320,1709028641208118457,/scholar?cites=1709028641208118457,,https://www.sciencedirect.com/science/article/pii/S0006349580849320/pdf?md5=c2084685a261bb03faaaf3b700a78119&pid=1-s2.0-S0006349580849320-main.pdf&_valck=1,0,0,0
86223,Structure-based discovery of NANOG variant with enhanced properties to promote self-renewal and reprogramming of pluripotent stem cells,2015,Yohei Hayashi and Laura Caboni and Debanu Das and Fumiaki Yumoto and Thomas Clayton and Marc C Deller and Phuong Nguyen and Carol L Farr and Hsiu-Ju Chiu and Mitchell D Miller and Marc-André Elsliger and Ashley M Deacon and Adam Godzik and Scott A Lesley and Kiichiro Tomoda and Bruce R Conklin and Ian A Wilson and Shinya Yamanaka and Robert J Fletterick,112,Proceedings of the National Academy of Sciences,15,4666-4671,National Academy of Sciences,NANOG (from Irish mythology Tír na nÓg) transcription factor plays a central role in maintaining pluripotency. cooperating with OCT4 (also known as POU5F1 or OCT3/4). SOX2. and other pluripotency factors. Although the physiological roles of the NANOG protein have been extensively explored. biochemical and biophysical properties in relation to its structural analysis are poorly understood. Here we determined the crystal structure of the human NANOG homeodomain (hNANOG HD) bound to an OCT4 promoter DNA. which revealed amino acid residues involved in DNA recognition that are likely to be functionally important. We generated a series of hNANOG HD alanine substitution mutants based on the protein–DNA interaction and evolutionary conservation and determined their biological activities. Some mutant proteins were less stable. resulting in loss or decreased affinity for DNA binding. Overexpression of …,True,MAlNgd0AAAAJ:-7ulzOJl1JYC,34,https://www.pnas.org/content/112/15/4666.short,18151520242957951601,/scholar?cites=18151520242957951601,,https://www.pnas.org/content/pnas/112/15/4666.full.pdf,0,0,0
86224,A high-throughput screening method to identify small molecule inhibitors of thyroid hormone receptor coactivator binding,2006,Leggy A Arnold and Eva Estébanez-Perpiñá and Marie Togashi and Anang Shelat and Cory A Ocasio and Andrea C McReynolds and Phuong Nguyen and John D Baxter and Robert J Fletterick and Paul Webb and R Kiplin Guy,2006,Science's STKE,341,pl3-pl3,American Association for the Advancement of Science,To provide alternative methods for regulation of gene transcription initiated by the binding of thyroid hormone (T3) to the thyroid receptor (TR). we have developed a high-throughput method for discovering inhibitors of the interaction of TR with its transcriptional coactivators. The screening method is based on fluorescence polarization (FP). one of the most sensitive and robust high-throughput methods for the study of protein-protein interactions. A fluorescently labeled coactivator is excited by polarized light. The emitted polarized light is a function of the molecular properties of the labeled coactivator. especially Brownian molecular rotation. which is very sensitive to changes in the molecular mass of the labeled complex. Dissociation of hormone receptor from fluorescently labeled coactivator peptide in the presence of small molecules can be detected by this competition method. and the assay can be performed in a …,True,MAlNgd0AAAAJ:nVrZBo8bIpAC,34,https://stke.sciencemag.org/content/2006/341/pl3.short,14797133512372079001,/scholar?cites=14797133512372079001,,https://www.researchgate.net/profile/Kip_Guy/publication/6980864_A_High-Throughput_Screening_Method_to_Identify_Small_Molecule_Inhibitors_of_Thyroid_Hormone_Receptor_Coactivator_Binding/links/0912f50648f6108e4c000000/A-High-Throughput-Screening-Method-to-Identify-Small-Molecule-Inhibitors-of-Thyroid-Hormone-Receptor-Coactivator-Binding.pdf,0,0,0
86225,An engineered liver glycogen phosphorylase with AMP allosteric activation,1991,WS Coats and MF Browner and RJ Fletterick and CB Newgard,266,Journal of Biological Chemistry,24,16113-16119,Elsevier,Liver and muscle glycogen phosphorylases. which are products of distinct genes. are both activated by covalent phosphorylation. but in the unphosphorylated (b) state. only the muscle isozyme is efficiently activated by the allosteric activator AMP. The different responsiveness of the phosphorylase isozymes to allosteric ligands is important for the maintenance of tissue and whole body glucose homeostasis. In an attempt to understand the structural determinants of differential sensitivity of the muscle and liver isozymes to AMP. we have developed a bacterial expression system for the liver enzyme. allowing native and engineered proteins to be expressed and characterized. Engineering of the single amino acid substitutions Thr48Pro. Met197Thr and the double mutant Thr48Pro. Met197Thr in liver phosphorylase. and Pro48Thr in muscle phosphorylase. did not qualitatively change the response of the two isozymes to …,True,MAlNgd0AAAAJ:LgRImbQfgY4C,34,https://www.sciencedirect.com/science/article/pii/S0021925818985236,15074914624004455976,/scholar?cites=15074914624004455976,,https://www.sciencedirect.com/science/article/pii/S0021925818985236/pdf?md5=b978b93e2e6ba92d9aa7692fad7f9cc8&pid=1-s2.0-S0021925818985236-main.pdf,0,0,0
86226,Structure of Liver Receptor Homolog-1 (NR5A2) with PIP3 hormone bound in the ligand binding pocket,2015,Elena P Sablin and Raymond D Blind and Rubatharshini Uthayaruban and Hsiu-Ju Chiu and Ashley M Deacon and Debanu Das and Holly A Ingraham and Robert J Fletterick,192,Journal of structural biology,3,342-348,Academic Press,The nuclear receptor LRH-1 (Liver Receptor Homolog-1. NR5A2) is a transcription factor that regulates gene expression programs critical for many aspects of metabolism and reproduction. Although LRH-1 is able to bind phospholipids. it is still considered an orphan nuclear receptor (NR) with an unknown regulatory hormone. Our prior cellular and structural studies demonstrated that the signaling phosphatidylinositols PI(4.5)P2 (PIP2) and PI(3.4.5)P3 (PIP3) bind and regulate SF-1 (Steroidogenic Factor-1. NR5A1). a close homolog of LRH-1. Here. we describe the crystal structure of human LRH-1 ligand binding domain (LBD) bound by PIP3 – the first phospholipid with a head group endogenous to mammals. We show that the phospholipid hormone binds LRH-1 with high affinity. stabilizing the receptor LBD. While the hydrophobic PIP3 tails (C16/C16) are buried inside the LRH-1 ligand binding pocket. the …,True,MAlNgd0AAAAJ:SdhP9T11ey4C,33,https://www.sciencedirect.com/science/article/pii/S1047847715300678,7510948464648477169,/scholar?cites=7510948464648477169,,https://www.ncbi.nlm.nih.gov/pmc/articles/pmc4651778/,0,0,0
86227,Structural and functional insight into TAF1–TAF7. a subcomplex of transcription factor II D,2014,Suparna Bhattacharya and Xiaohua Lou and Peter Hwang and Kanagalaghatta R Rajashankar and Xiaoping Wang and Jan-Åke Gustafsson and Robert J Fletterick and Raymond H Jacobson and Paul Webb,111,Proceedings of the National Academy of Sciences,25,9103-9108,National Academy of Sciences,Transcription factor II D (TFIID) is a multiprotein complex that nucleates formation of the basal transcription machinery. TATA binding protein-associated factors 1 and 7 (TAF1 and TAF7). two subunits of TFIID. are integral to the regulation of eukaryotic transcription initiation and play key roles in preinitiation complex (PIC) assembly. Current models suggest that TAF7 acts as a dissociable inhibitor of TAF1 histone acetyltransferase activity and that this event ensures appropriate assembly of the RNA polymerase II-mediated PIC before transcriptional initiation. Here. we report the 3D structure of a complex of yeast TAF1 with TAF7 at 2.9 Å resolution. The structure displays novel architecture and is characterized by a large predominantly hydrophobic heterodimer interface and extensive cofolding of TAF subunits. There are no obvious similarities between TAF1 and known histone acetyltransferases. Instead. the surface of …,True,MAlNgd0AAAAJ:D_sINldO8mEC,33,https://www.pnas.org/content/111/25/9103.short,6474711454822452368,/scholar?cites=6474711454822452368,,https://www.pnas.org/content/pnas/111/25/9103.full.pdf,0,0,0
86228,Characterization of structural determinants of granzyme B reveals potent mediators of extended substrate specificity,2004,Sandra Waugh Ruggles and Robert J Fletterick and Charles S Craik,279,Journal of Biological Chemistry,29,30751-30759,Elsevier,Granzymes are trypsin-like serine proteases mediating apoptotic cell death that are composed of two genetically distinct subfamilies: granzyme A-like proteases resemble trypsin in their active site architecture. while granzyme B-like proteases are quite distinct. Granzyme B prefers substrates containing P4 to P1 amino acids Ile/Val. Glu/Met/Gln. Pro/Xaa. and aspartic acid N-terminal to the proteolytic cleavage. By investigating the narrow extended specificity of the granzyme B-like proteases the mediators of their unique specificity are being defined. The foci of this study were the structural determinants Ile99. Tyr174. Arg192. and Asn218. Even modest mutations of these residues resulted in unique extended specificity profiles as determined using combinatorial substrate libraries and individual fluorogenic substrates. As with other serine proteases. Ile99 completely defines and predicts P2 specificity. primarily through …,True,MAlNgd0AAAAJ:WJVC3Jt7v1AC,33,https://www.sciencedirect.com/science/article/pii/S0021925819710977,12991141324105700004,/scholar?cites=12991141324105700004,,https://www.sciencedirect.com/science/article/pii/S0021925819710977,0,0,0
