,title,pub_year,author,volume,journal,number,pages,publisher,abstract,filled,author_pub_id,num_citations,pub_url,cites_id,citedby_url,author_id,eprint_url,got_citations,got_author_ids,author_ids
1115367,Influence of extreme weather disasters on global crop production,2016,Corey Lesk and Pedram Rowhani and Navin Ramankutty,529,Nature,7584,84-87,Nature Publishing Group,In recent years. several extreme weather disasters have partially or completely damaged regional crop production 1. 2. 3. 4. 5. While detailed regional accounts of the effects of extreme weather disasters exist. the global scale effects of droughts. floods and extreme temperature on crop production are yet to be quantified. Here we estimate for the first time. to our knowledge. national cereal production losses across the globe resulting from reported extreme weather disasters during 1964–2007. We show that droughts and extreme heat significantly reduced national cereal production by 9–10%. whereas our analysis could not identify an effect from floods and extreme cold in the national data. Analysing the underlying processes. we find that production losses due to droughts were associated with a reduction in both harvested area and yields. whereas extreme heat mainly decreased cereal yields. Furthermore. the …,True,POHYXREAAAAJ:EkHepimYqZsC,1147,https://www.nature.com/articles/nature16467,2912996877938738733,/scholar?cites=2912996877938738733,,https://open.library.ubc.ca/collections/52383/52383/items/1.0376077,0,0,0
1115368,Anthropogenic transformation of the biomes. 1700 to 2000,2010,Erle C Ellis and Kees Klein Goldewijk and Stefan Siebert and Deborah Lightman and Navin Ramankutty,19,Global ecology and biogeography,5,589-606,Blackwell Publishing Ltd,Aim  To map and characterize anthropogenic transformation of the terrestrial biosphere before and during the Industrial Revolution. from 1700 to 2000.Location  Global.Methods  Anthropogenic biomes (anthromes) were mapped for 1700. 1800. 1900 and 2000 using a rule‐based anthrome classification model applied to gridded global data for human population density and land use. Anthropogenic transformation of terrestrial biomes was then characterized by map comparisons at century intervals.Results  In 1700. nearly half of the terrestrial biosphere was wild. without human settlements or substantial land use. Most of the remainder was in a seminatural state (45%) having only minor use for agriculture and settlements. By 2000. the opposite was true. with the majority of the biosphere in agricultural and settled anthromes. less than 20% seminatural and only a quarter left wild. Anthropogenic transformation …,True,POHYXREAAAAJ:KlAtU1dfN6UC,1133,https://onlinelibrary.wiley.com/doi/abs/10.1111/j.1466-8238.2010.00540.x,14728115859563035985,/scholar?cites=14728115859563035985,,http://users.clas.ufl.edu/mbinford/GEOXXXX_Biogeography/Literature_reports_by_students/Report_5/Comte_paper5.pdf,0,0,0
1115369,Recent patterns of crop yield growth and stagnation,2012,Deepak K Ray and Navin Ramankutty and Nathaniel D Mueller and Paul C West and Jonathan A Foley,3,Nature communications,,1293,Nature Publishing Group,In the coming decades. continued population growth. rising meat and dairy consumption and expanding biofuel use will dramatically increase the pressure on global agriculture. Even as we face these future burdens. there have been scattered reports of yield stagnation in the world’s major cereal crops. including maize. rice and wheat. Here we study data from∼ 2.5 million census observations across the globe extending over the period 1961–2008. We examined the trends in crop yields for four key global crops: maize. rice. wheat and soybeans. Although yields continue to increase in many areas. we find that across 24–39% of maize-. rice-. wheat-and soybean-growing areas. yields either never improve. stagnate or collapse. This result underscores the challenge of meeting increasing global agricultural demands. New investments in underperforming regions. as well as strategies to continue increasing yields in …,True,POHYXREAAAAJ:LPZeul_q3PIC,963,https://www.nature.com/articles/ncomms2296,14131520828391291465,/scholar?cites=14131520828391291465,,https://www.nature.com/articles/ncomms2296,0,0,0
1115370,Carbon balance of the terrestrial biosphere in the twentieth century: Analyses of CO2. climate and land use effects with four process‐based ecosystem models,2001,AD McGuire and S Sitch and JS Clein and R Dargaville and G Esser and J Foley and M Heimann and F Joos and J Kaplan and DW Kicklighter and RA Meier and JM Melillo and BIII Moore and IC Prentice and N Ramankutty and T Reichenau and A Schloss and H Tian and LJ Williams and U Wittenberg,15,Global Biogeochemical Cycles,1,183-206,,The concurrent effects of increasing atmospheric CO2 concentration. climate variability. and cropland establishment and abandonment on terrestrial carbon storage between 1920 and 1992 were assessed using a standard simulation protocol with four process‐based terrestrial biosphere models. Over the long‐term(1920–1992). the simulations yielded a time history of terrestrial uptake that is consistent (within the uncertainty) with a long‐term analysis based on ice core and atmospheric CO2 data. Up to 1958. three of four analyses indicated a net release of carbon from terrestrial ecosystems to the atmosphere caused by cropland establishment. After 1958. all analyses indicate a net uptake of carbon by terrestrial ecosystems. primarily because of the physiological effects of rapidly rising atmospheric CO2. During the 1980s the simulations indicate that terrestrial ecosystems stored between 0.3 and 1.5 Pg C yr−1 …,True,POHYXREAAAAJ:qjMakFHDy7sC,847,https://agupubs.onlinelibrary.wiley.com/doi/abs/10.1029/2000GB001298,16816407117266660645,/scholar?cites=16816407117266660645,,https://agupubs.onlinelibrary.wiley.com/doi/pdfdirect/10.1029/2000GB001298,0,0,0
1115371,Carbon emissions from land use and land-cover change,2012,Richard A Houghton and JI House and J Pongratz and GR Van der Werf and RS DeFries and MC Hansen and C Le Quéré and N Ramankutty,9,Biogeosciences,12,5125-5142,Copernicus GmbH, The net flux of carbon from land use and land-cover change (LULCC) accounted for 12.5% of anthropogenic carbon emissions from 1990 to 2010. This net flux is the most uncertain term in the global carbon budget. not only because of uncertainties in rates of deforestation and forestation. but also because of uncertainties in the carbon density of the lands actually undergoing change. Furthermore. there are differences in approaches used to determine the flux that introduce variability into estimates in ways that are difficult to evaluate. and not all analyses consider the same types of management activities. Thirteen recent estimates of net carbon emissions from LULCC are summarized here. In addition to deforestation. all analyses considered changes in the area of agricultural lands (croplands and pastures). Some considered. also. forest management (wood harvest. shifting cultivation). None included emissions from the degradation of tropical peatlands. Means and standard deviations across the thirteen model estimates of annual emissions for the 1980s and 1990s. respectively. are 1.14 ± 0.23 and 1.12 ± 0.25 Pg C yr−1 (1 Pg = 1015 g carbon). Four studies also considered the period 2000–2009. and the mean and standard deviations across these four for the three decades are 1.14 ± 0.39. 1.17 ± 0.32. and 1.10 ± 0.11 Pg C yr−1. For the period 1990–2009 the mean global emissions from LULCC are 1.14 ± 0.18 Pg C yr−1. The standard deviations across model means shown here are smaller than previous estimates of uncertainty as they do not account for the errors that result from data uncertainty and from an incomplete understanding of all …,True,POHYXREAAAAJ:VOx2b1Wkg3QC,810,https://bg.copernicus.org/articles/9/5125/2012/,1908973038392796845,/scholar?cites=1908973038392796845,,https://bg.copernicus.org/articles/9/5125/2012/bg-9-5125-2012.pdf,0,0,0
1115372,Testing the performance of a dynamic global ecosystem model: water balance. carbon balance. and vegetation structure,2000,Christopher J Kucharik and Jonathan A Foley and Christine Delire and Veronica A Fisher and Michael T Coe and John D Lenters and Christine Young‐Molling and Navin Ramankutty and John M Norman and Stith T Gower,14,Global Biogeochemical Cycles,3,795-825,,While a new class of Dynamic Global Ecosystem Models (DGEMs) has emerged in the past few years as an important tool for describing global biogeochemical cycles and atmosphere‐biosphere interactions. these models are still largely untested. Here we analyze the behavior of a new DGEM and compare the results to global‐scale observations of water balance. carbon balance. and vegetation structure. In this study. we use version 2 of the Integrated Biosphere Simulator (IBIS). which includes several major improvements and additions to the prototype model developed by Foley et al. [1996]. IBIS is designed to be a comprehensive model of the terrestrial biosphere; the model represents a wide range of processes. including land surface physics. canopy physiology. plant phenology. vegetation dynamics and competition. and carbon and nutrient cycling. The model generates global simulations of the surface …,True,POHYXREAAAAJ:UeHWp8X0CEIC,735,https://agupubs.onlinelibrary.wiley.com/doi/abs/10.1029/1999GB001138,1026190371161634703,/scholar?cites=1026190371161634703,,https://agupubs.onlinelibrary.wiley.com/doi/pdf/10.1029/1999GB001138,0,0,0
1115373,Geographic distribution of major crops across the world,2004,Billie Leff and Navin Ramankutty and Jonathan A Foley,18,Global Biogeochemical Cycles,1,,,Humans have transformed the surface of the planet through agricultural activities. and today. ∼12% of the land surface is used for cultivation and another 22% is used for pastures and rangelands. In this paper. we have synthesized satellite‐derived land cover data and agricultural census data to produce global data sets of the distribution of 18 major crops across the world. The resulting data are representative of the early 1990s. have a spatial resolution of 5 min. (∼10 km). and describe the fraction of a grid cell occupied by each of the 18 crops. The global crop data are consistent with our knowledge of agricultural geography. and compares favorably to another existing data set that partially overlaps with our product. We have also analyzed how different crops are grown in combination to form major crop belts throughout the world. Further. we analyzed the patterns of crop diversification across the world. While …,True,POHYXREAAAAJ:eQOLeE2rZwMC,685,https://agupubs.onlinelibrary.wiley.com/doi/abs/10.1029/2003GB002108,4189091884703996200,/scholar?cites=4189091884703996200,,https://agupubs.onlinelibrary.wiley.com/doi/pdf/10.1029/2003GB002108,0,0,0
1115374,The global distribution of cultivable lands: current patterns and sensitivity to possible climate change,2002,Navin Ramankutty and Jonathan A Foley and John Norman and Kevin McSweeney,11,Global Ecology and Biogeography,5,377-392,Blackwell Science Ltd,Aim This study makes quantitative global estimates of land suitability for cultivation based on climate and soil constraints. It evaluates further the sensitivity of croplands to any possible changes in climate and atmospheric CO2 concentrations.Location The location is global. geographically explicit.Methods The methods used are spatial data synthesis and analysis and numerical modelling.Results There is a cropland ‘reserve’ of 120%. mainly in tropical South America and Africa. Our climate sensitivity analysis indicates that the southern provinces of Canada. north‐western and north‐central states of the United States. northern Europe. southern Former Soviet Union and the Manchurian plains of China are most sensitive to changes in temperature. The Great Plains region of the United States and north‐eastern China are most sensitive to changes in precipitation. The regions that are sensitive to precipitation …,True,POHYXREAAAAJ:_FxGoFyzp5QC,657,https://onlinelibrary.wiley.com/doi/abs/10.1046/j.1466-822x.2002.00294.x,1326211367400998206,/scholar?cites=1326211367400998206,,https://pdfs.semanticscholar.org/bbbb/3553c6a520e38ebe3646a8be87bbdca1a46b.pdf,0,0,0
1115375,Amazonia revealed: forest degradation and loss of ecosystem goods and services in the Amazon Basin,2007,Jonathan A Foley and Gregory P Asner and Marcos Heil Costa and Michael T Coe and Ruth DeFries and Holly K Gibbs and Erica A Howard and Sarah Olson and Jonathan Patz and Navin Ramankutty and Peter Snyder,5,Frontiers in Ecology and the Environment,1,25-32,,The Amazon Basin is one of the world's most important bioregions. harboring a rich array of plant and animal species and offering a wealth of goods and services to society. For years. ecological science has shown how large‐scale forest clearings cause declines in biodiversity and the availability of forest products. Yet some important changes in the rainforests. and in the ecosystem services they provide. have been underappreciated until recently. Emerging research indicates that land use in the Amazon goes far beyond clearing large areas of forest; selective logging and other canopy damage is much more pervasive than once believed. Deforestation causes collateral damage to the surrounding forests – through enhanced drying of the forest floor. increased frequency of fires. and lowered productivity. The loss of healthy forests can degrade key ecosystem services. such as carbon storage in biomass and soils …,True,POHYXREAAAAJ:Se3iqnhoufwC,648,https://esajournals.onlinelibrary.wiley.com/doi/abs/10.1890/1540-9295(2007)5[25:ARFDAL]2.0.CO;2,12895524617104930712,/scholar?cites=12895524617104930712,,http://www.woodwellclimate.org/wp-content/uploads/2015/09/FoleyetalFrontEcolEnv.07.pdf,0,0,0
1115376,Crop planting dates: an analysis of global patterns,2010,William J Sacks and Delphine Deryng and Jonathan A Foley and Navin Ramankutty,19,Global Ecology and Biogeography,5,607-620,Blackwell Publishing Ltd,Aim  To assemble a data set of global crop planting and harvesting dates for 19 major crops. explore spatial relationships between planting date and climate for two of them. and compare our analysis with a review of the literature on factors that drive decisions on planting dates.Location  Global.Methods  We digitized and georeferenced existing data on crop planting and harvesting dates from six sources. We then examined relationships between planting dates and temperature. precipitation and potential evapotranspiration using 30‐year average climatologies from the Climatic Research Unit. University of East Anglia (CRU CL 2.0).Results  We present global planting date patterns for maize. spring wheat and winter wheat (our full. publicly available data set contains planting and harvesting dates for 19 major crops). Maize planting in the northern mid‐latitudes generally occurs in April and May. Daily average …,True,POHYXREAAAAJ:mVmsd5A6BfQC,628,https://onlinelibrary.wiley.com/doi/abs/10.1111/j.1466-8238.2010.00551.x,3065629718900451213,/scholar?cites=3065629718900451213,,https://environment.wisc.edu/sage/data-and-models/crop-calendar-dataset/sacksetalGEB2010.pdf,0,0,0
1115377,A synthesis of information on rapid land-cover change for the period 1981–2000,2005,Erika Lepers and Eric F Lambin and Anthony C Janetos and Ruth DeFries and Frederic Achard and Navin Ramankutty and Robert J Scholes,55,BioScience,2,115-124,Oxford University Press,This article presents a synthesis of what is known about areas of rapid land-cover change around the world over the past two decades. based on data compiled from remote sensing and censuses. as well as expert opinion. Asia currently has the greatest concentration of areas of rapid land-cover changes. and dryland degradation in particular. The Amazon basin remains a major hotspot of tropical deforestation. Rapid cropland increase. often associated with large-scale deforestation. is prominent in Southeast Asia. Forest degradation in Siberia. mostly related to logging activities. is increasing rapidly. The southeastern United States and eastern China are experiencing rapid cropland decrease. Existing data do not support the claim that the African Sahel is a desertification hotspot. Many of the most populated and rapidly changing cities are found in the tropics.,True,POHYXREAAAAJ:Tyk-4Ss8FVUC,594,https://academic.oup.com/bioscience/article-abstract/55/2/115/221477,6821505830541231713,/scholar?cites=6821505830541231713,,https://academic.oup.com/bioscience/article-pdf/55/2/115/26896553/55-2-115.pdf,0,0,0
1115378,Agronomic phosphorus imbalances across the world's croplands,2011,Graham K MacDonald and Elena M Bennett and Philip A Potter and Navin Ramankutty,108,Proceedings of the National Academy of Sciences,7,3086-3091,National Acad Sciences,Increased phosphorus (P) fertilizer use and livestock production has fundamentally altered the global P cycle. We calculated spatially explicit P balances for cropland soils at 0.5° resolution based on the principal agronomic P inputs and outputs associated with production of 123 crops globally for the year 2000. Although agronomic inputs of P fertilizer (14.2 Tg of P·y−1) and manure (9.6 Tg of P·y−1) collectively exceeded P removal by harvested crops (12.3 Tg of P·y−1) at the global scale. P deficits covered almost 30% of the global cropland area. There was massive variation in the magnitudes of these P imbalances across most regions. particularly Europe and South America. High P fertilizer application relative to crop P use resulted in a greater proportion of the intense P surpluses (>13 kg of P·ha−1·y−1) globally than manure P application. High P fertilizer application was also typically associated with areas of …,True,POHYXREAAAAJ:L8Ckcad2t8MC,565,https://www.pnas.org/content/108/7/3086.short,12783199174212043881,/scholar?cites=12783199174212043881,,https://www.pnas.org/content/pnas/108/7/3086.full.pdf,0,0,0
1115379,The role of pasture and soybean in deforestation of the Brazilian Amazon,2010,Elizabeth Barona and Navin Ramankutty and Glenn Hyman and Oliver T Coomes,5,Environmental Research Letters,2,024002,IOP Publishing,The dynamics of deforestation in the Brazilian Amazon are complex. A growing debate considers the extent to which deforestation is a result of the expansion of the Brazilian soy industry. Most recent analyses suggest that deforestation is driven by the expansion of cattle ranching. rather than soy. Soy seems to be replacing previously deforested land and/or land previously under pasture. In this study. we use municipality-level statistics on agricultural and deforested areas across the Legal Amazon from 2000 to 2006 to examine the spatial patterns and statistical relationships between deforestation and changes in pasture and soybean areas. Our results support previous studies that showed that deforestation is predominantly a result of pasture expansion. However. we also find support for the hypothesis that an increase of soy in Mato Grosso has displaced pasture further north. leading to deforestation elsewhere …,True,POHYXREAAAAJ:4TOpqqG69KYC,562,https://iopscience.iop.org/article/10.1088/1748-9326/5/2/024002/meta,16469910976957754441,/scholar?cites=16469910976957754441,,https://iopscience.iop.org/article/10.1088/1748-9326/5/2/024002/pdf,0,0,0
1115380,A safe operating space for humanity,2009,Johan Rockström and Will Steffen and Kevin Noone and Åsa Persson and F Stuart Chapin and Eric F Lambin and Timothy M Lenton and Marten Scheffer and Carl Folke and Hans Joachim Schellnhuber and Björn Nykvist and Cynthia A De Wit and Terry Hughes and Sander Van der Leeuw and Henning Rodhe and Sverker Sörlin and Peter K Snyder and Robert Costanza and Uno Svedin and Malin Falkenmark and Louise Karlberg and Robert W Corell and Victoria J Fabry and James Hansen and Brian Walker and Diana Liverman and Katherine Richardson and Paul Crutzen and Jonathan A Foley,461,nature,7263,472-475,Nature Publishing Group,Although Earth has undergone many periods of significant environmental change. the planet's environment has been unusually stable for the past 10.000 years 1. 2. 3. This period of stability—known to geologists as the Holocene—has seen human civilizations arise. develop and thrive. Such stability may now be under threat. Since the Industrial Revolution. a new era has arisen. the Anthropocene 4. in which human actions have become the main driver of global environmental change 5. This could see human activities push the Earth system outside the stable environmental state of the Holocene. with consequences that are detrimental or even catastrophic for large parts of the world.During the Holocene. environmental change occurred naturally and Earth's regulatory capacity maintained the conditions that enabled human development. Regular temperatures. freshwater availability and biogeochemical flows all …,True,inOO43MAAAAJ:u-x6o8ySG0sC,14541,https://www.nature.com/articles/461472a?foxtrotcallb,6167498193089293126,/scholar?cites=6167498193089293126,,https://www.nature.com/articles/461472a?foxtrotcallb,0,0,0
1115381,Global consequences of land use,2005,Jonathan A Foley and Ruth DeFries and Gregory P Asner and Carol Barford and Gordon Bonan and Stephen R Carpenter and F Stuart Chapin and Michael T Coe and Gretchen C Daily and Holly K Gibbs and Joseph H Helkowski and Tracey Holloway and Erica A Howard and Christopher J Kucharik and Chad Monfreda and Jonathan A Patz and I Colin Prentice and Navin Ramankutty and Peter K Snyder,309,,5734,570-574,American Association for the Advancement of Science,Land use has generally been considered a local environmental issue. but it is becoming a force of global importance. Worldwide changes to forests. farmlands. waterways. and air are being driven by the need to provide food. fiber. water. and shelter to more than six billion people. Global croplands. pastures. plantations. and urban areas have expanded in recent decades. accompanied by large increases in energy. water. and fertilizer consumption. along with considerable losses of biodiversity. Such changes in land use have enabled humans to appropriate an increasing share of the planet9s resources. but they also potentially undermine the capacity of ecosystems to sustain food production. maintain freshwater and forest resources. regulate climate and air quality. and ameliorate infectious diseases. We face the challenge of managing trade-offs between immediate human needs and maintaining the capacity of …,True,inOO43MAAAAJ:u5HHmVD_uO8C,10701,https://science.sciencemag.org/content/309/5734/570.abstract,9991565653417427840,/scholar?cites=9991565653417427840,,http://citeseerx.ist.psu.edu/viewdoc/download?doi=10.1.1.461.2896&rep=rep1&type=pdf,0,0,0
1115382,Planetary boundaries: exploring the safe operating space for humanity,2009,Johan Rockström and Will Steffen and Kevin Noone and Åsa Persson and F Stuart Chapin III and Eric Lambin and Timothy M Lenton and Marten Scheffer and Carl Folke and Hans Joachim Schellnhuber and Björn Nykvist and Cynthia A De Wit and Terry Hughes and Sander Van der Leeuw and Henning Rodhe and Sverker Sörlin and Peter K Snyder and Robert Costanza and Uno Svedin and Malin Falkenmark and Louise Karlberg and Robert W Corell and Victoria J Fabry and James Hansen and Brian Walker and Diana Liverman and Katherine Richardson and Paul Crutzen and Jonathan Foley,14,Ecology and society,2,,Resilience Alliance,Anthropogenic pressures on the Earth System have reached a scale where abrupt global environmental change can no longer be excluded. We propose a new approach to global sustainability in which we define planetary boundaries within which we expect that humanity can operate safely. Transgressing one or more planetary boundaries may be deleterious or even catastrophic due to the risk of crossing thresholds that will trigger non-linear. abrupt environmental change within continental- to planetary-scale systems. We have identified nine planetary boundaries and. drawing upon current scientific understanding. we propose quantifications for seven of them. These seven are climate change (CO₂ concentration in the atmosphere <350 ppm and/or a maximum change of +1 W m−2 in radiative forcing); ocean acidification (mean surface seawater saturation state with respect to aragonite ≥ 80% of pre-industrial …,True,inOO43MAAAAJ:UeHWp8X0CEIC,4814,https://www.jstor.org/stable/26268316,4244512993490607760,/scholar?cites=4244512993490607760,,https://www.jstor.org/stable/pdf/26268316.pdf,0,0,0
