,title,pub_year,author,volume,journal,number,pages,publisher,abstract,filled,author_pub_id,num_citations,pub_url,cites_id,citedby_url,author_id,eprint_url,got_citations
45904,Synthesis of disodium prephenate and disodium epiprephenate. Stereochemistry of prephenic acid and an observation on the base-catalyzed rearrangement of prephenic acid to p …,1979,Samuel Danishefsky and Masahiro Hirama and Nancy Fritsch and Jon Clardy,101,Journal of the American Chemical Society,23,7013-7018,American Chemical Society,The total synthesis of disodium prephenate and epiprephenic acid as its disodium and barium salts was accomplished. The stereochemistry of prephenate and epiprephenate was rigorously established by crystallographic and chemical correlation. The mechanism for the base-induced conversion of prephenate to p-hydroxyphenyllactate is shown to involve an unusual 1. 6-hydride migration.,True,7lp2ziEAAAAJ:XUvXOeBm_78C,51,https://pubs.acs.org/doi/abs/10.1021/ja00517a039,3549819910642382107,/scholar?cites=3549819910642382107,,https://pubs.acs.org/doi/pdfplus/10.1021/ja00517a039,0
45905,Synthesis and structure of dicarbonyldi-η-cyclopentadienylbis (μ-thiocarbonyl) diiron. a thiocarbonyl analog of the dicarbonyl-η-cycglopentadienyliron dimer,1976,Jan W Dunker and Janet S Finer and Jon Clardy and Robert J Angelici,114,Journal of Organometallic Chemistry,3,C49-C52,Elsevier,Sodium hydride reduction of (η-C5H5)Fe(CO)2(CS)+ gives cis- and trans[(η-C5H5)Fe(CS) (CO)]2. The trans isomer slowly converts to a cis—trans mixture in xylene solution. An X-ray structural study of the cis isomer shows the CS groups to be in the bridging positions. but otherwise. its structure is nearly identical to that of cia-[(η-C5H5)Fe(CO)2]2. The cis isomer reacts with CH3OSO2F to give the compound. (η-C5H5)2Fe2(CSCH3)(CS)(CO)2+. with a methylated bridging thiocarbonyl group.,True,7lp2ziEAAAAJ:7H_MAutzIkAC,51,https://www.sciencedirect.com/science/article/pii/S0022328X00872940,16460412573640795177,/scholar?cites=16460412573640795177,,,0
45906,Organic oxalates. VI. Pyrolysis of di (. alpha.-substituted) benzyl oxalates,1971,Walter S Trahanovsky and Ching Ching Ong and James G Pataky and Frederick L Weitl and Patrick W Muellen and Jon C Clardy and Roberta S Hansen,36,The Journal of Organic Chemistry,23,3575-3579,American Chemical Society,Products from the low-pressure gas phase pyrolysis of di («-substituted benzyl) oxalates are reported. Di-(«-substituted benzyl) oxalates which contain ß hydrogen atoms undergo an elimination reaction in addition to homolytic decomposition to «-substituted benzyl radicals. Coupling of «-substituted benzyl radicals occurs only when the a substituent is a methyl or trifluoromethyl group. When the «substituent is a trichloromethyl. an ethyl. a pentafluoroethyl. or an isopropyl group. ß scission is the chief reaction of the radicals. No evidence for disproportionation of the radicals is presented. The meso/dl ratios for the coupling products from the «-methylbenzyl and «-trifluoromethylbenzyl radicals are 52: 48 and 42: 58. respectively. Mechanistic implications of these results are discussed.Recently we reported that pyrolysis of ring-sub-stituted dibenzyl oxalates under vacuum gave exclusively bibenzyls resulting from …,True,7lp2ziEAAAAJ:QYdC8u9Cj1oC,51,https://pubs.acs.org/doi/pdf/10.1021/jo00822a023,16944370315071837913,/scholar?cites=16944370315071837913,,,0
45907,A chimeric siderophore halts swarming Vibrio,2014,Thomas Böttcher and Jon Clardy,53,Angewandte Chemie International Edition,13,3510-3513,WILEY‐VCH Verlag,Some bacteria swarm under some circumstances; they move rapidly and collectively over a surface. In an effort to understand the molecular signals controlling swarming. we isolated two bacterial strains from the same red seaweed. Vibrio alginolyticus B522. a vigorous swarmer. and Shewanella algae B516. which inhibits V. alginolyticus swarming in its vicinity. Plate assays combined with NMR. MS. and X‐ray diffraction analyses identified a small molecule. which was named avaroferrin. as a potent swarming inhibitor. Avaroferrin. a previously unreported cyclic dihydroxamate siderophore. is a chimera of two well‐known siderophores: putrebactin and bisucaberin. The sequenced genome of S. algae revealed avaroferrin’s biosynthetic gene cluster to be a mashup of putrebactin and bisucaberin biosynthetic genes. Avaroferrin blocks swarming through its ability to bind iron in a form that cannot be pirated by V …,True,7lp2ziEAAAAJ:iWL_APfBKHwC,50,https://onlinelibrary.wiley.com/doi/abs/10.1002/anie.201310729,6737406007093225961,/scholar?cites=6737406007093225961,,https://www.ncbi.nlm.nih.gov/pmc/articles/PMC4040223/,0
45908,Antibacterial activity of the winged oyster Pteria chinensis (Pterioida: Pteridae),2004,CMEG Chellaram and K Gnanambal and JK Edward,,,,,CSIR,The whole body extracts of the winged oyster. Pteria chinensis obtained with different solvents were assayed for antibacterial activity using agar well diffusion technique against human and fish pathogens. The acetone and chloroform crude extracts exhibited broad antibacterial activity. Highest activity was exhibited against Klebsiella pneumoniae (5 mm) and Staphylococcus epidermidis (5 mm) by the crude extract of acetone and against Salmonella paratyphi B (5 mm) by the chloroform extract. Similarly. the crude extract of chloroform was found to inhibit 8 out of 10 fish pathogens tested. The column-purified acetone fractions showed higher activity against Klebsiella pneumoniae (5 mm). Sreptococcus pneumoniae (4 mm). Serratia marcescens (4 mm) and Proteus mirabilis (4 mm). The MIC of the 100% acetone fraction was found to be lower for the pathogens. S. marcescens (100 μg) and P. mirabilis (150 μg) and hence 100% acetonated fraction of the extract of P. chinensis can be considered as potent antimicrobial compound against these pathogens.,True,7lp2ziEAAAAJ:hXZnTIgIr50C,50,http://nopr.niscair.res.in/handle/123456789/1694,17636444651064882365,/scholar?cites=17636444651064882365,,http://nopr.niscair.res.in/bitstream/123456789/1694/1/IJMS%2033(4)%20369-372.pdf?utm_source=The_Journal_Database&trk=right_banner&id=1424908861&ref=2db43607a9d65628dedb9e4848ba76ea,0
45909,The biosynthetic gene cluster of pantocin A provides insights into biosynthesis and a tool for screening,2003,Mi Jin and Sandra AI Wright and Steven V Beer and Jon Clardy,115,Angewandte Chemie,25,3008-3011,WILEY‐VCH Verlag,The preceding communication described the isolation and structural characterization of pantocin A (PA. 1). a member of the diverse family of antibiotics produced by Pantoea agglomerans. and its ability to block histidine biosynthesis by inhibiting l-histidinol phosphate aminotransferase. The unusual structure of pantocin A. especially its labile bicyclic core. suggested a previously uncharacterized biosynthetic pathway. Pantocin A (1) was discovered through the heterologous expression of a cosmid library. derived from the genomic DNA of P. agglomerans strain Eh318. in Escherichia coli XL2Blue.[1] This DNA-based approach to the discovery of biologically active small molecules. which facilitated the characterization of the Eh318 antibiotics pantocin A (1) and B (2).[2] also expedites the identification of the DNA involved in their production. Subcloning of the original cosmid clone pCPP702 resulted in a 3.5 kb DNA …,True,7lp2ziEAAAAJ:P7Ujq4OLJYoC,50,https://onlinelibrary.wiley.com/doi/abs/10.1002/ange.200351054,4922298211421496091,/scholar?cites=4922298211421496091,,,0
45910,Acetoxydehydroaustin. a new bioactive compound. and related compound neoaustin from Penicillium sp. MG-11,1994,Hideo Hayashi and Manabu Mukaihara and Sawao Murao and Motoo Arai and Jon Clardy,58,"Bioscience, biotechnology, and biochemistry",2,334-338,Japan Society for Bioscience. Biotechnology. and Agrochemistry,Compounds from a soil isolate of Penicillium sp. MG-11 showed remarkable convulsive activity against silkworms. Activity-based fractionation of an acetone extract of the fermentation products resulted in the isolation of four compounds. One was identified as verruculogen. which was an active principle. Another compound. acetoxydehydroaustin. was new and was structurally characterized by spectral data and a single-crystal X-ray analysis. The two other compounds were identified as dehydroaustin and austin on the basis of the spectral data. Although the latter three compounds were not active themselves. they enhanced the convulsive activity of verruculogen in a silkworm bioassay. Three additional compounds with no identifiable activity were also isolated. Two of them were identified as austinol and dehydroaustinol. and the third was determined to be a new related compound named neoaustin by an X-ray analysis of crystals.,True,7lp2ziEAAAAJ:DrR-2ekChdkC,50,https://www.jstage.jst.go.jp/article/bbb1992/58/2/58_2_334/_article/-char/ja/,17862641756016121668,/scholar?cites=17862641756016121668,,https://www.jstage.jst.go.jp/article/bbb1992/58/2/58_2_334/_pdf,0
45911,HIV inhibitory natural products. 11. Structure. absolute stereochemistry. and synthesis of conocurvone. a potent. novel HIV-inhibitory naphthoquinone trimer from a Conospermum sp,1993,Laurent A Decosterd and Ian C Parsons and Kirk R Gustafson and John H Cardellina and James B McMahon and Gordon M Cragg and Yoshiko Murata and Lewis K Pannell and Jorge Rios Steiner,115,Journal of the American Chemical Society,15,6673-6679,American Chemical Society,Bioassay-guided fractionation provided conocurvone(1). a novel trimeric naphthoquinone derivative. as the active anti-HIV constituent of an extract from a Conospermum sp. The related naphthoquinone monomer teretifolione B (2) also was isolated from a Conospermum sp. extract. The absolute stereochemistry of 2 was established by X-ray crystallographic analysis of the p-bromobenzoate derivative 6. Base-catalyzed coupling of 2 equiv of teretifolione B (2) with the deoxy derivative 8 provided compound 1. which was identical in all respects with the natural product. While compound 2 was inactive against HIV. the natural and synthetic conocurvone(1) and the synthetic trimeric analog 4 were all active and equipotent. preventing the cytopathic effects and replication of HIV in human T-lymphoblastic cells (CEM-SS) over a concentration range of 0.02-50 µ.,True,7lp2ziEAAAAJ:a9-T7VOCCH8C,50,https://pubs.acs.org/doi/abs/10.1021/ja00068a026,13436219947986400119,/scholar?cites=13436219947986400119,,https://pubs.acs.org/doi/pdfplus/10.1021/ja00068a026,0
45912,Phidolopine. a new purine derivative from the bryozoan Phidolopora pacifica,1984,Stephen W Ayer and Raymond J Andersen and Cunheng He and Jon Clardy,49,The Journal of Organic Chemistry,20,3869-3870,American Chemical Society,The structure of phidolopin (1). a purine de-rivative isolated from the bryozoan Phidolopora pacifica. was solved by X-ray diffraction analysis.Sir: A number of interesting nitrogenous metabolites containing the physostigmine. 1indole. 2 quinoline. 3 and bipyrrole4 ring systems have recently been reported from bryozoans. As part of an ongoing search for biologically active metabolites from British Columbia marine organisms. we have examined extracts of thebryozoan Phidolopora pacifica. commonly referred to as the “lacey bryozoan” because of its highly intricate calciumcarbonate skeleton. Our attention was drawn to P. pacifica by the total absence of fouling organisms on its skeleton and by the strong in vitro antifungal and antialgal activity of its extracts. Herein. we report the structure of phidolopin (1). an unusual purine derivative. which is largely responsible for the biological activity of the crude extracts. 5,True,7lp2ziEAAAAJ:XvxMoLDsR5gC,50,https://pubs.acs.org/doi/abs/10.1021/jo00194a053,6233993475357052403,/scholar?cites=6233993475357052403,,,0
45913,Tetracyclo [8.2. 2.22. 5.26. 9] octadeca-1. 5. 9-triene,1984,John E McMurry and Gregory J Haley and James R Matz and Jon C Clardy and Gregory Van Duyne and Rolf Gleiter and Wolfgang Schaefer and David H White,106,Journal of the American Chemical Society,17,5018-5019,American Chemical Society,"TetracycIo[8.2.2.225.26.9]octadeca-l.5.9-triene John E. McMurry.* Gregory J. Haley. Janies 
R. Matz. Jon C. Clardy.* and Gregory Van Duyne … Department of Chemistry. Baker Laboratory 
Cornell University Ithaca. New York 14853 Rolf Gleiter* and Wolfgang Schafer Institut fur Organische 
Chemie der Universitdt Heidelberg D 6900 Heidelberg. West Germany … Department of 
Chemistry. University of Santa Clara Santa Clara. California 95053 Received April 16. 1984   … Imagine a class of compounds made up of n six-membered rings joined together by double 
bonds to form a large overall ring as in 3. The parent member of the class. tricyclo[4.2.2.22.5]dode … 1 2 3 ca-1.5-diene (1). was reported recently by Wiberg.1 but other members have not been 
prepared. The second member of the class. tetracyclo[8.2.2.22'5.26.9]oc- tadeca-l.5.9-triene. 
(2). might be expected to possess unusual properties because of the proximity of its three … ",True,7lp2ziEAAAAJ:rmuvC79q63oC,50,https://pubs.acs.org/doi/abs/10.1021/ja00329a071,16125439965213664124,/scholar?cites=16125439965213664124,,https://pubs.acs.org/doi/pdfplus/10.1021/ja00329a071,0
45914,A further study of the cytotoxic constituents of a milnamide-producing sponge,2004,Rachel N Sonnenschein and Jarrett J Farias and Karen Tenney and Susan L Mooberry and Emil Lobkovsky and Jon Clardy and Phillip Crews,6,Organic letters,5,779-782,American Chemical Society,A reinvestigation of Auletta sp. yielded the novel compound milnamide C (3) plus the known compounds milnamide A (1). milnamide B (hemiasterlin) (2). jasplakinolide (5). and geodiamolides A (6). D (7). E (8). and G (9). The isolation work was guided by cytoskeletal bioactivity data. Compounds 2 and 3 were shown to cause microtubule depolymerization. and 6−9 were shown to cause microfilament disruption. This biological activity and the structural elucidation of 3. including X-ray analysis. are reported here. ,True,7lp2ziEAAAAJ:j7_hQOaDUrUC,49,https://pubs.acs.org/doi/abs/10.1021/ol036446c,304441591728712903,/scholar?cites=304441591728712903,,,0
45915,The structure and biogenetic origin of (-) halicyclamine B from a Xestospongia sponge,1996,Blaine Harrison and Sunil Talapatra and Emil Lobkovsky and Jon Clardy and Phillip Crews,37,Tetrahedron letters,51,9151-9154,Pergamon,A new tetracyclic diamine. (-) halicyclamine B (1). has been isolated from the sponge Xestospongia sp. and its structure was elucidated from NMR and X-ray crystallography data. Some biogenetic relationships are proposed between 1 and other polycyclic diamines recently reported from sponges.,True,7lp2ziEAAAAJ:umqufdRvDiIC,49,https://www.sciencedirect.com/science/article/pii/S004040399602165X,7480150986513507635,/scholar?cites=7480150986513507635,,,0
45916,Chlorophyllonic acid and methyl ester. a new chlorophyll a related compound isolated as an antioxidant from short-necked clam. Ruditapes philippinarum,1992,Ken'ichi Yamamoto and Kanzo Sakata and Naoharu Watanabe and Akihito Yagi and Linda S Brinen and Jon Clardy,33,Tetrahedron letters,18,2587-2588,Pergamon,The structure of chlorophyllonic acid a methyl ester (3). a new chlorophyll a related compound was determined as shown in Fig. 2 by NMR spectral and X-ray cyrstallographic analysis.,True,7lp2ziEAAAAJ:r_AWSJRzSzQC,49,https://www.sciencedirect.com/science/article/pii/S0040403900922500,10521214956822111682,/scholar?cites=10521214956822111682,,,0
45917,Terpenoids from the sponge Aplysilla glacialis and specimens of the nudibranch Cadlina luteomarginta found on the sponge,1991,Mark Tischler and Raymond J Andersen and M Iqbal Choudhary and Jon Clardy,56,The Journal of Organic Chemistry,1,42-47,American Chemical Society,Four new rearranged and/or degraded “spongian” terpenoids and one new “marginatane” diterpenoid have been isolated from the marine sponge Aplysilla glacialis. Thestructure of cadlinolide A (3) was solved by X-ray diffraction analysis. and the structures of cadlinolide B (4). aplysillolide A (5). aplysillolide B (6). andmarginatone (7) were determined by extensive spectroscopic analysis and chemical interconversions. Glaciolide (2). cadlinolide,True,7lp2ziEAAAAJ:_5tno0g5mFcC,49,https://pubs.acs.org/doi/abs/10.1021/jo00001a010,17105853784082223349,/scholar?cites=17105853784082223349,,,0
45918,Chiral 1. 4-dihydropyridines. Synthesis and absolute configuration.,1981,AI Meyers and Nicholas R Natale and David G Wettlaufer and Shahin Rafii and Jon Clardy,22,Tetrahedron Letters,51,5123-5126,Pergamon,Addition of organometallics to chiral 3-pyridyl oxazolines gave high diastereoselectivity at the 4-position of the pyridine nucleus. Absolute configuration was determined by x-ray analysis.,True,7lp2ziEAAAAJ:a3BOlSfXSfwC,49,https://www.sciencedirect.com/science/article/pii/S0040403901924360,1235512371105615723,/scholar?cites=1235512371105615723,,,0
45919,The structure of a new type of plant growth inhibitor extracted from immature tobacco leaves,1975,James P Springer and Jon Clardy and Richard H Cox and Horace G Cutler and Richard J Cole,16,Tetrahedron Letters,32,2737-2740,Pergamon,The development of axillary shoots. following the removal of upper leaves and inflorescence. represents a substantial problem in the cultivation of fluecured tobacco. 2 Recently we indicated that the young upper-most leaves might control the growth of lateral shoots by producing natural growth inhibitors. We now wish to report that the structure of the most active of these inhibitors found so far is 4. 8. 13-duvatriene-1. 3-diol (l.).Isolation procedures for the active substances from Hicks variety tobacco have beengiven previously. 3 On silica gel chromatography (ethyl acetate/benzene. 55/45) there were two fractions with activity; the more polar was coded C2 and the less active. less polar compound. Cl. The crystalline material C2 (mp l23OC) lost water easily in the mass spectrometer and gave a highest observable m/e of 288.2453 (calcd for C20H320. 288.2453). The infrared spectrum clearly showed a broad hydroxyl …,True,7lp2ziEAAAAJ:0izLItjtcgwC,49,https://www.sciencedirect.com/science/article/pii/S0040403900752270,9976241140614972400,/scholar?cites=9976241140614972400,,,0
45920,. alpha.-Halo sulfones. XVII. Directive effects in the chlorination of thiapropellanes,1971,Leo A Paquette and Robert E Wingard Jr and J Christopher Philips and Gerald L Thompson and Leonard K Read and Jon Clardy,93,Journal of the American Chemical Society,18,4508-4516,American Chemical Society,To probe the role of steric effects operative in the-chlorination of sulfides. six thiapropellanes were exposed to the action of V-chlorosuccinimide and subsequently oxidized. Where applicable. the isomeric a-chloro sulfones were separated and their ratio inthe product mixtures was determined. The configurations of the chlo-rine substituents. assigned initially on the basis of nmr correlations. were confirmed by X-ray structure analysis of two representative examples. The observed product distributions appear not to be due exclusively to steric factors. although such considerations are of considerable importance. Rather. the data suggest that electronic effects gain significance in those examples which have sites of unsaturation in close proximity to the developing sulfonium ion.,True,7lp2ziEAAAAJ:5MTHONV0fEkC,49,https://pubs.acs.org/doi/pdf/10.1021/ja00747a028,14345013349937616470,/scholar?cites=14345013349937616470,,https://pubs.acs.org/doi/pdf/10.1021/ja00747a028,0
45921,Topoisomerase II-mediated DNA cleavage by adocia-and xestoquinones from the Philippine sponge Xestospongia sp.,1995,Gisela P Concepcion and Tommaso A Foderaro and Glenn S Eldredge and Emil Lobkovsky and Jon Clardy and Louis R Barrows and Chris M Ireland,38,Journal of medicinal chemistry,22,4503-4507,American Chemical Society,Investigation of an orange Xestospongia sp. sponge collected at Cape Bolinao in northern Luzon. Philippines. yielded the known compounds adociaquinones A and B (1. 2) and six new metabolites. secoadociaquinones A and B (3. 4). 14-methoxyxestoquinone (5). 15-methoxyxestoquinone (6). 15-chloro-14-hydroxyxestoquinone (7). and 14-chloro-15-hydroxyxestoquinone (8). All compounds showed inhibition of topoisomerase II in catalytic DNA unwinding and/or decatenation assays. Furthermore. adociaquinone B showed activity in a KSDS assay. suggesting it inhibits the enzyme by freezing the enzyme-DNA cleavable complex. Interestingly. adociaquinone B did not displace ethidium bromide from DNA or unwind supercoiled DNA. implying it does not intercalate DNA.,True,7lp2ziEAAAAJ:LO7wyVUgiFcC,48,https://pubs.acs.org/doi/abs/10.1021/jm00022a016,7830802112191060126,/scholar?cites=7830802112191060126,,http://scinet.dost.gov.ph/union/Downloads/Concepcion%20GP%20et%20al.%201995%20%20Topoisomerase%20II%20Mediated%20DNA%20Cleavage%20by%20Adocia%20and%20Xestoquinones%20from%20the%20Philippine%20Sponge%20Xestospongia%20sp_4197.pdf,0
45922,The structure of a new nucleoside antibiotic. capuramycin,1988,Haruo Seto and Noboru Otake and Shingo Sato and Hiroshi Yamaguchi and Kinji Takada and Masayoshi Itoh and Helen SM Lu and Jon Clardy,29,Tetrahedron letters,19,2343-2346,Pergamon,The structure of capuramycin has been determined to be an uracil nucleoside with a caprolactam substituent as shown in Fig. 5 by NMR spectral analysis. chemical degradation and X-ray analysis.,True,7lp2ziEAAAAJ:NXb4pA-qfm4C,48,https://www.sciencedirect.com/science/article/pii/S0040403900860554,14195441090651588085,/scholar?cites=14195441090651588085,,,0
45923,Isolation and structure determination of two novel lathyranes from Jatropha curcas.,1986,W Naengchomnong and Y Thebtaranonth and P Wiriyachitra and KT Okamoto and J Clardy,27,Tetrahedron letters,47,5675-5678,,These root diterpenes. named curculathyranes A and B. were characterized by NMR spectroscopy and X-ray diffraction.,True,7lp2ziEAAAAJ:djft3U1LymYC,48,https://www.cabdirect.org/cabdirect/abstract/19870341536,2180851937052165067,/scholar?cites=2180851937052165067,,,0
45924,Peri-bridged naphthalenes. 2. Unsymmetrical diatomic chalcogen bridges,1977,Jerrold Meinwald and David Dauplaise and Jon Clardy,99,Journal of the American Chemical Society,23,7743-7744,American Chemical Society,232 2(2) 280 7(7) 324 1(1) 233 0(0) 281 2(3) 325 1(1) 234 19(18) 282 14(13) 326 5(5) 235 18(17) 283 22(21) 327 6(5) 236 49(49) 284 56(55) 328 20(19) 237 7(8) 285 8(7) 329 16(15) 238 100 (100) 286 93(91) 330 40(40) 239 12(12) 287 11(11) 331 27(27) 240 22(23) 288 100 (100) 332 83(81) 241 3(3) 289 12(12) 333 23(21) 242 1(1) 290 5(5) 334 100 (100),True,7lp2ziEAAAAJ:HtEfBTGE9r8C,48,https://pubs.acs.org/doi/abs/10.1021/ja00465a074,17384096393579064413,/scholar?cites=17384096393579064413,,https://pubs.acs.org/doi/pdfplus/10.1021/ja00465a074,0
45925,Synthesis. trapping. and dimerization of 9. 10-benzotricyclo [3.3. 2.03. 7] deca-3 (7). 9 (10)-diene. X-ray crystal structure of the dimer,1977,Robert Greenhouse and Weston Thatcher Borden and Ken Hirotsu and Jon Clardy,99,Journal of the American Chemical Society,5,1664-1666,American Chemical Society,(2) H. Bock. B. Solouki. G. Bert. T. Hirabayashi. S. Mohmand.. E. Rohwer. U. Stein. and H. Zacharias. unpublished results.(3) Cf. the Master Thesis of G. Bert. University of Frankfurt. 1977. The liquid educts evaporate at room temperature (p~ 10 Pa) and pass a quarz tube 30 cm long and of~ 1 cm diameter. heated by an oven of the specified temperature. The distance between oven and spectrometer target chamber amounts to~ 25 cm. suggesting for thioketene a half-life time of more than1 s.(4) The parent moleculethioketene—considerably less stable than its alkyl derivatives—has been reported to be generated by heating terf-butyl ethynyl sulfide R3CSC= CH6 or hexamethyltrithiane (R2CS) 37 or photolyzing 1. 2. 3-thiadiazole. 8 and to be identified in matrix8 or in the gas phase7 by infrared6· 8 or microwave spectra. 7,True,7lp2ziEAAAAJ:DBa1UEJaJKAC,48,https://pubs.acs.org/doi/abs/10.1021/ja00447a074,743959224262321312,/scholar?cites=743959224262321312,,https://pubs.acs.org/doi/pdf/10.1021/ja00447a074,0
45926,Hybrid biosynthesis of roseobacticides from algal and bacterial precursor molecules,2014,Mohammad R Seyedsayamdost and Rurun Wang and Roberto Kolter and Jon Clardy,136,Journal of the American Chemical Society,43,15150-15153,American Chemical Society,Roseobacticides regulate the symbiotic relationship between a marine bacterium (Phaeobacter inhibens) and a marine microalga (Emiliania huxleyi). This relationship can be mutualistic. when the algal host provides food for the bacteria and the bacteria produce growth hormones and antibiotics for the algae. or parasitic. when the algae senesce and release p-coumaric acid. The released p-coumaric acid causes the bacteria to synthesize roseobacticides. which are nM−μM toxins for the algae. We examined the biosynthesis of roseobacticides and report that all roseobacticide precursors play critical roles during the mutualist phase of the symbiosis. Roseobacticides are biosynthesized from the algal growth promoter. the major food molecule provided by the algal cells. and the algal senescence signal that initiates the mutualist-to-parasite switch. Thus. molecules that are beneficial during mutualism are diverted to …,True,7lp2ziEAAAAJ:J-ba04ztB30C,47,https://pubs.acs.org/doi/abs/10.1021/ja508782y,7335104335244502355,/scholar?cites=7335104335244502355,,https://pubs.acs.org/doi/full/10.1021/ja508782y,0
