,title,pub_year,author,volume,journal,number,pages,publisher,abstract,filled,author_pub_id,num_citations,pub_url,cites_id,citedby_url,author_id,eprint_url,got_citations,got_author_ids,author_ids
1035992,Pharmacogenomics of statins: understanding susceptibility to adverse effects,2016,Jasmine A Luzum3 Joseph P Kitzmiller and Eduard B Mikulik and Anees M Dauki and Chandrama Murkherjee,9,Pharmacogenomics and Personalized Medicine,https://dx.doi.org/10.2147/PGPM.S86013,97—106,Dovepress,Statins are a cornerstone of the pharmacologic treatment and prevention of atherosclerotic cardiovascular disease. Atherosclerotic disease is a predominant cause of mortality and morbidity worldwide. Statins are among the most commonly prescribed classes of medications. and their prescribing indications and target patient populations have been significantly expanded in the official guidelines recently published by the American and European expert panels. Adverse effects of statin pharmacotherapy. however. result in significant cost and morbidity and can lead to nonadherence and discontinuation of therapy. Statin-associated muscle symptoms occur in~ 10% of patients on statins and constitute the most commonly reported adverse effect associated with statin pharmacotherapy. Substantial clinical and nonclinical research effort has been dedicated to determining whether genetics can provide meaningful insight …,True,ZLRDQocAAAAJ:roLk4NBRz8UC,54,https://www.ncbi.nlm.nih.gov/pmc/articles/PMC5055044/,1217978124997527255,/scholar?cites=1217978124997527255,,https://www.ncbi.nlm.nih.gov/pmc/articles/PMC5055044/,0,0,0
1035993,Entamoeba shows reversible variation in ploidy under different growth conditions and between life cycle phases,2008,Chandrama Mukherjee and C Graham Clark and Anuradha Lohia,2,PLoS Negl Trop Dis,8,e281,Public Library of Science,Under axenic growth conditions. trophozoites of Entamoeba histolytica contain heterogenous amounts of DNA due to the presence of both multiple nuclei and different amounts of DNA in individual nuclei. In order to establish if the DNA content and the observed heterogeneity is maintained during different growth conditions. we have compared E. histolytica cells growing in xenic and axenic cultures. Our results show that the nuclear DNA content of E. histolytica trophozoites growing in axenic cultures is at least 10 fold higher than in xenic cultures. Re-association of axenic cultures with their bacterial flora led to a reduction of DNA content to the original xenic values. Thus switching between xenic and axenic growth conditions was accompanied by significant changes in the nuclear DNA content of this parasite. Changes in DNA content during encystation-excystation were studied in the related reptilian parasite E. invadens. During excystation of E. invadens cysts. it was observed that the nuclear DNA content increased approximately 40 fold following emergence of trophozoites in axenic cultures. Based on the observed large changes in nuclear size and DNA content. and the minor differences in relative abundance of representative protein coding sequences. rDNA and tRNA sequences. it appears that gain or loss of whole genome copies may be occurring during changes in the growth conditions. Our studies demonstrate the inherent plasticity and dynamic nature of the Entamoeba genome in at least two species.,True,ZLRDQocAAAAJ:d1gkVwhDpl0C,39,https://journals.plos.org/plosntds/article?id=10.1371/journal.pntd.0000281,5203261715027487986,/scholar?cites=5203261715027487986,,https://journals.plos.org/plosntds/article?id=10.1371/journal.pntd.0000281,0,0,0
1035994,The cytoplasmic capping complex assembles on adapter protein nck1 bound to the proline-rich C-terminus of Mammalian capping enzyme,2014,Chandrama Mukherjee and Baskar Bakthavachalu and Daniel R Schoenberg,12,PLoS Biol,8,e1001933,Public Library of Science,mRNA capping and decapping requires a cytoplasmic complex to maintain and/or restore the 5′ cap on a subset of the mammalian transcriptome; Nck1. an SH2/SH3 adapter. creates a scaffold upon which the cytoplasmic capping complex forms.,True,ZLRDQocAAAAJ:Y0pCki6q_DkC,29,https://journals.plos.org/plosbiology/article?id=10.1371/journal.pbio.1001933,10965073833794889920,/scholar?cites=10965073833794889920,,https://journals.plos.org/plosbiology/article?id=10.1371/journal.pbio.1001933,0,0,0
1035995,Inter-cellular variation in DNA content of Entamoeba histolytica originates from temporal and spatial uncoupling of cytokinesis from the nuclear cycle,2009,Chandrama Mukherjee and Shubhra Majumder and Anuradha Lohia,3,PLoS Negl Trop Dis,4,e409,Public Library of Science,Accumulation of multiple copies of the genome in a single nucleus and several nuclei in a single cell has previously been noted in Entamoeba histolytica. contributing to the genetic heterogeneity of this unicellular eukaryote. In this study. we demonstrate that this genetic heterogeneity is an inherent feature of the cell cycle of this organism. Chromosome segregation occurs on a variety of novel microtubular assemblies including multi-polar spindles. Cytokinesis in E. histolytica is completed by the mechanical severing of a thin cytoplasmic bridge. either independently or with the help of neighboring cells. Importantly. cytokinesis is uncoupled from the nuclear division cycle. both temporally and spatially. leading to the formation of unequal daughter cells. Sorting of euploid and polyploid cells showed that each of these sub-populations acquired heterogeneous DNA content upon further growth. Our study conclusively demonstrates that genetic heterogeneity originates from the unique mode of cell division events in this protist.,True,ZLRDQocAAAAJ:9yKSN-GCB0IC,29,https://journals.plos.org/plosntds/article?id=10.1371/journal.pntd.0000409,2286786786373316189,/scholar?cites=2286786786373316189,,https://journals.plos.org/plosntds/article?id=10.1371/journal.pntd.0000409,0,0,0
1035996,RNA guanine-7 methyltransferase catalyzes the methylation of cytoplasmically recapped RNAs,2017,Jackson B Trotman and Andrew J Giltmier and Chandrama Mukherjee and Daniel R Schoenberg,45,Nucleic acids research,18,10726-10739,Oxford University Press,Cap homeostasis is a cyclical process of decapping and recapping that impacts a portion of the mRNA transcriptome. The metastable uncapped forms of recapping targets redistribute from polysomes to non-translating mRNPs. and recapping is all that is needed for their return to the translating pool. Previous work identified a cytoplasmic capping metabolon consisting of capping enzyme (CE) and a 5′-monophosphate kinase bound to adjacent domains of Nck1. The current study identifies the canonical cap methyltransferase (RNMT) as the enzyme responsible for guanine-N7 methylation of recapped mRNAs. RNMT binds directly to CE. and its presence in the cytoplasmic capping complex was demonstrated by pulldown assays. gel filtration and proximity-dependent biotinylation. The latter also identified the RNMT cofactor RAM. whose presence is required for cytoplasmic cap methyltransferase activity …,True,ZLRDQocAAAAJ:UebtZRa9Y70C,23,https://academic.oup.com/nar/article-abstract/45/18/10726/4157403,17134043009907025103,/scholar?cites=17134043009907025103,,https://academic.oup.com/nar/article/45/18/10726/4157403,0,0,0
1035997,Genome Re-duplication and Irregular Segregation Occur During the Cell Cycle of Entamoeba histolytica,2007,Anuradha Lohia and Chandrama Mukherjee and Shubhra Majumder and Promita Ghosh Dastidar,27,,6,373-384,Portland Press Ltd.,Heterogeneity of genome content is commonly observed in axenic cultures of Entamoeba histolytica. Cells with multiple nuclei and nuclei with heterogenous genome contents suggest that regulatory mechanisms that ensure alternation of DNA synthesis and mitosis are absent in this organism. Therefore. several endo-reduplicative cycles may occur without mitosis. The data also shows that unlike other endo-reduplicating organisms. E. histolytica does not undergo a precise number of endo-reduplicative cycles. We propose that irregular endo-reduplication and genome partitioning lead to heterogeneity in the genome content of E. histolytica trophozoites in their proliferative phase. The goal of future studies should be aimed at understanding the mechanisms that are involved in (a) accumulation of multiple genome contents in a single nucleus; (b) genome segregation in nuclei that contain multiple genome contents …,True,ZLRDQocAAAAJ:2osOgNQ5qMEC,20,https://portlandpress.com/bioscirep/article-abstract/27/6/373/55587,14434216122562304818,/scholar?cites=14434216122562304818,,http://repository.ias.ac.in/19509/1/337.pdf,0,0,0
1035998,Cap homeostasis is independent of poly (A) tail length,2016,Daniel L Kiss and Kenji M Oman and Julie A Dougherty and Chandrama Mukherjee and Ralf Bundschuh and Daniel R Schoenberg,44,Nucleic acids research,1,304-314,Oxford University Press,Cap homeostasis is a cyclical process of decapping and recapping that maintains the cap on a subset of the cytoplasmic transcriptome. Interfering with cytoplasmic capping results in the redistribution of target transcripts from polysomes to non-translating mRNPs. where they accumulate in an uncapped but nonetheless stable form. It is generally thought that decapping is preceded by shortening of the poly(A) tail to a length that can no longer support translation. Therefore recapped target transcripts would either have to undergo cytoplasmic polyadenylation or retain a reasonably long poly(A) tail if they are to return to the translating pool. In cells that are inhibited for cytoplasmic capping there is no change in the overall distribution of poly(A) lengths or in the elution profile of oligo(dT)-bound targets. Poly(A) tail lengths were similar for target mRNAs on polysomes or in non-translating mRNPs. and the presence of …,True,ZLRDQocAAAAJ:W7OEmFMy1HYC,17,https://academic.oup.com/nar/article-abstract/44/1/304/2499673,11737926084651488173,/scholar?cites=11737926084651488173,,https://academic.oup.com/nar/article/44/1/304/2499673,0,0,0
1035999,Clinical pharmacogenomics: patient perspectives of pharmacogenomic testing and the incidence of actionable test results in a chronic disease cohort,2017,Chandrama Mukherjee and Jasmine A Sweet and Kevin M and Luzum and Mahmoud Abdel-Rasoul and Joseph P Christman and Michael F & Kitzmiller,14,Personalized Medicine,5,,Future Medicine,,True,ZLRDQocAAAAJ:hqOjcs7Dif8C,10,https://www.futuremedicine.com/doi/abs/10.2217/pme-2017-0022,5739506579881057163,/scholar?cites=5739506579881057163,,https://www.ncbi.nlm.nih.gov/pmc/articles/PMC5696621/,0,0,0
1036000,Something from almost nothing: carbon dioxide fixation in chemoautotrophs,1998,Jessup M Shively and Geertje Van Keulen and Wim G Meijer,52,,1,191-230,Annual Reviews,The last decade has seen significant advances in our understanding of the physiology. ecology. and molecular biology of chemoautotrophic bacteria. Many ecosystems are dependent on CO2 fixation by either free-living or symbiotic chemoautotrophs. CO2 fixation in the chemoautotroph occurs via the Calvin-Benson-Bassham cycle. The cycle is characterized by three unique enzymatic activities: ribulose bisphosphate carboxylase/oxygenase. phosphoribulokinase. and sedoheptulose bisphosphatase. Ribulose bisphosphate carboxylase/oxygenase is commonly found in the cytoplasm. but a number of bacteria package much of the enzyme into polyhedral organelles. the carboxysomes. The carboxysome genes are located adjacent to cbb genes. which are often. but not always. clustered in large operons. The availability of carbon and reduced substrates control the expression of cbb genes in concert …,True,ztQqAwcAAAAJ:u5HHmVD_uO8C,296,https://www.annualreviews.org/doi/abs/10.1146/annurev.micro.52.1.191,14608683060204947105,/scholar?cites=14608683060204947105,,https://www.researchgate.net/profile/Jessup_Shively/publication/13396913_Shively_JM_van_Keulen_G_Meijer_WG_Something_from_almost_nothing_carbon_dioxide_fixation_in_chemoautotrophs_Annu_Rev_Microbiol_52_191-230/links/0deec5288e6e1ed422000000/Shively-JM-van-Keulen-G-Meijer-WG-Something-from-almost-nothing-carbon-dioxide-fixation-in-chemoautotrophs-Annu-Rev-Microbiol-52-191-230.pdf,0,0,0
1036001,The family Streptomycetaceae. part I: taxonomy,2006,PETER Kämpfer,3,The prokaryotes,,538-604,Springer New York,Description of the family Streptomycetaceae Waksman and Henrici 1943 emend. Kim et al.(2003)(Strep. to. my. ce. ta’ce. ae. ending to denote a family; ML masc. n. Streptomyces. type genus of the family) is based on data taken from Williams et al.(1989). Zhang et al.(1997) and Kim et al.(2003). These aerobic. Gram-positive. nonacid-alcohol fast actinomycetes form an extensively branched substrate mycelium that rarely fragments. The aerial mycelium forms chains of three to many spores. Members of a few species bear short chains of spores on the substrate mycelium. The organisms produce a wide range of pigments responsible for the color of the substrate and aerial mycelium. The organisms grow within different pH ranges. namely 5.5–9 (Kitasatospora). 5–11.5 (Streptomyces). and 3.5–6.0 (Streptacidiphilus). They are chemoorganotrophic with an oxidative type of metabolism. The substrate mycelium contains either LL-,True,ztQqAwcAAAAJ:2osOgNQ5qMEC,212,https://www.academia.edu/download/63153016/Dworkin_The_Prokaryotes-A_Handbook_on_the_Biology_of_Bacteria_3rd_ed_Vol_320200430-42071-1b9nr0r.pdf#page=581,7290873329783119766,/scholar?cites=7290873329783119766,,https://www.academia.edu/download/63153016/Dworkin_The_Prokaryotes-A_Handbook_on_the_Biology_of_Bacteria_3rd_ed_Vol_320200430-42071-1b9nr0r.pdf#page=581,0,0,0
1036002,Antibiotic overproduction in Streptomyces coelicolor A3 (2) mediated by phosphofructokinase deletion,2008,Irina Borodina and Jeroen Siebring and Jie Zhang and Colin P Smith and Geertje van Keulen and Lubbert Dijkhuizen and Jens Nielsen,283,Journal of Biological Chemistry,37,25186-25199,Elsevier,Streptomycetes are exploited for production of a wide range of secondary metabolites. and there is much interest in enhancing the level of production of these metabolites. Secondary metabolites are synthesized in dedicated biosynthetic routes. but precursors and co-factors are derived from the primary metabolism. High level production of antibiotics in streptomycetes therefore requires engineering of the primary metabolism. Here we demonstrate this by targeting a key enzyme in glycolysis. phosphofructokinase. leading to improved antibiotic production in Streptomyces coelicolor A3(2). Deletion of pfkA2 (SCO5426). one of three annotated pfkA homologues in S. coelicolor A3(2). resulted in a higher production of the pigmented antibiotics actinorhodin and undecylprodigiosin. The pfkA2 deletion strain had an increased carbon flux through the pentose phosphate pathway. as measured by 13C metabolic flux …,True,ztQqAwcAAAAJ:u-x6o8ySG0sC,147,https://www.sciencedirect.com/science/article/pii/S002192582052557X,13475615499407477817,/scholar?cites=13475615499407477817,,https://www.sciencedirect.com/science/article/pii/S002192582052557X,0,0,0
1036003,Back to the future of soil metagenomics,2016,Joseph Nesme and Wafa Achouak and Spiros N Agathos and Mark Bailey and Petr Baldrian and Dominique Brunel and Åsa Frostegård and Thierry Heulin and Janet K Jansson and Edouard Jurkevitch and Kristiina L Kruus and George A Kowalchuk and Antonio Lagares and Hilary M Lappin-Scott and Philippe Lemanceau and Denis Le Paslier and Ines Mandic-Mulec and J Colin Murrell and David D Myrold and Renaud Nalin and Paolo Nannipieri and Josh D Neufeld and Fergal O'Gara and John J Parnell and Alfred Pühler and Victor Pylro and Juan L Ramos and Luiz FW Roesch and Michael Schloter and Christa Schleper and Alexander Sczyrba and Angela Sessitsch and Sara Sjöling and Jan Sørensen and Søren J Sørensen and Christoph C Tebbe and Edward Topp and George Tsiamis and Jan Dirk Van Elsas and Geertje Van Keulen and Franco Widmer and Michael Wagner and Tong Zhang and Xiaojun Zhang and Liping Zhao and Yong-Guan Zhu and Timothy M Vogel and Pascal Simonet,7,Frontiers in microbiology,,73,Frontiers,Direct extraction and characterization of microbial community DNA through PCR amplicon surveys and metagenomics has revolutionized the study of environmental microbiology and microbial ecology. In particular. metagenomic analysis of nucleic acids provides direct access to the genomes of the “uncultivated majority.” Accelerated by advances in sequencing technology. microbiologists have discovered more novel phyla. classes. genera. and genes from microorganisms in the first decade and a half of the twenty-first century than since these “many very little living animalcules” were first discovered by van Leeuwenhoek (Table 1). The unsurpassed diversity of soils promises continued exploration of a range of industrial. agricultural. and environmental functions. The ability to explore soil microbial communities with increasing capacity offers the highest promise for answering many outstanding who. what. where. when. why. and with whom questions such as: Which microorganisms are linked to which soil habitats? How do microbial abundances change with changing edaphic conditions? How do microbial assemblages interact and influence one another synergistically or antagonistically? What is the full extent of soil microbial diversity. both functionally and phylogenetically? What are the dynamics of microbial communities in space and time? How sensitive are microbial communities to a changing climate? What is the role of horizontal gene transfer in the stability of microbial communities? Do highly diverse microbial communities confer resistance and resilience in soils? Although molecular techniques. including metagenomics. have …,True,ztQqAwcAAAAJ:M3ejUd6NZC8C,97,https://www.frontiersin.org/articles/10.3389/fmicb.2016.00073/full,13092499238333568790,/scholar?cites=13092499238333568790,,https://www.frontiersin.org/articles/10.3389/fmicb.2016.00073/full,0,0,0
1036004,Two novel homologous proteins of Streptomyces coelicolor and Streptomyces lividans are involved in the formation of the rodlet layer and mediate attachment to a …,2002,Dennis Claessen and Han AB Wösten and Geertje van Keulen and Onno G Faber and Alexandra MCR Alves and Wim G Meijer and Lubbert Dijkhuizen,44,Molecular microbiology,6,1483-1492,Blackwell Science Ltd,The filamentous bacteria Streptomyces coelicolor and Streptomyces lividans exhibit a complex life cycle. After a branched submerged mycelium has been established. aerial hyphae are formed that may septate to form chains of spores. The aerial structures possess several surface layers of unknown nature that make them hydrophobic. one of which is the rodlet layer. We have identified two homologous proteins. RdlA and RdlB. that are involved in the formation of the rodlet layer in both streptomycetes. The rdl genes are expressed in growing aerial hyphae but not in spores. Immunolocalization showed that RdlA and RdlB are present at surfaces of aerial structures. where they form a highly insoluble layer. Disruption of both rdlA and rdlB in S. coelicolor and S. lividans (ΔrdlAB strains) did not affect the formation and differentiation of aerial hyphae. However. the characteristic rodlet layer was absent. Genes rdlA and …,True,ztQqAwcAAAAJ:Zph67rFs4hoC,93,https://onlinelibrary.wiley.com/doi/abs/10.1046/j.1365-2958.2002.02980.x,3785269775456311060,/scholar?cites=3785269775456311060,,https://onlinelibrary.wiley.com/doi/pdf/10.1046/j.1365-2958.2002.02980.x,0,0,0
1036005,The LysR-type transcriptional regulator CbbR controlling autotrophic CO2 fixation by Xanthobacter flavus is an NADPH sensor,1998,G Van Keulen and L Girbal and ERE Van Den Bergh and L Dijkhuizen and WG Meijer,180,Journal of Bacteriology,6,1411-1417,American Society for Microbiology Journals,Autotrophic growth of Xanthobacter flavus is dependent on the fixation of carbon dioxide via the Calvin cycle and on the oxidation of simple organic and inorganic compounds to provide the cell with energy. Maximal induction of the cbb andgap-pgk operons encoding enzymes of the Calvin cycle occurs in the absence of multicarbon substrates and the presence of methanol. formate. hydrogen. or thiosulfate. The LysR-type transcriptional regulator CbbR regulates the expression of the cbb andgap-pgk operons. but it is unknown to what cellular signal CbbR responds. In order to study the effects of low-molecular-weight compounds on the DNA-binding characteristics of CbbR. the protein was expressed in Escherichia coli and subsequently purified to homogeneity. CbbR of X. flavus is a dimer of 36-kDa subunits. DNA-binding assays suggested that two CbbR molecules bind to a 51-bp DNA fragment on which two …,True,ztQqAwcAAAAJ:d1gkVwhDpl0C,74,https://jb.asm.org/content/180/6/1411.short,8266178638675356307,/scholar?cites=8266178638675356307,,https://jb.asm.org/content/jb/180/6/1411.full.pdf,0,0,0
1036006,Analysis of DNA binding and transcriptional activation by the LysR-type transcriptional regulator CbbR of Xanthobacter flavus,2003,Geertje Van Keulen and Anja NJA Ridder and Lubbert Dijkhuizen and Wim G Meijer,185,Journal of bacteriology,4,1245-1252,American Society for Microbiology Journals,The LysR-type transcriptional regulator CbbR controls the expression of the cbb and gap-pgk operons in Xanthobacter flavus. which encode the majority of the enzymes of the Calvin cycle required for autotrophic CO2 fixation. The cbb operon promoter of this chemoautotrophic bacterium contains three potential CbbR binding sites. two of which partially overlap. Site-directed mutagenesis and subsequent analysis of DNA binding by CbbR and cbb promoter activity were used to show that the potential CbbR binding sequences are functional. Inverted repeat IR1 is a high-affinity CbbR binding site. The main function of this repeat is to recruit CbbR to the cbb operon promoter. In addition. it is required for negative autoregulation of cbbR expression. IR3 represents the main low-affinity binding site of CbbR. Binding to IR3 occurs in a cooperative manner. since mutations preventing the binding of CbbR to IR1 also prevent …,True,ztQqAwcAAAAJ:9yKSN-GCB0IC,59,https://jb.asm.org/content/185/4/1245.short,1976228656850844021,/scholar?cites=1976228656850844021,,https://jb.asm.org/content/jb/185/4/1245.full.pdf,0,0,0
1036007,Gas vesicles in actinomycetes: old buoys in novel habitats?,2005,Geertje Van Keulen and David A Hopwood and Lubbert Dijkhuizen and R Gary Sawers,13,,8,350-354,Elsevier Current Trends,Gas vesicles are gas-filled prokaryotic organelles that function as flotation devices. This enables planktonic cyanobacteria and halophilic archaea to position themselves within the water column to make optimal use of light and nutrients. Few terrestrial microbes are known to contain gas vesicles. Genome sequences that have become available recently for many bacteria from non-planktonic habitats reveal gas vesicle gene clusters in members of the actinomycete genera Streptomyces. Frankia and Rhodococcus. which typically live in soils and sediments. Remarkably. there is an additional level of complexity in cluster number and gene content. Here. we discuss whether putative gas vesicle proteins in these actinomycetes might actually be involved in flotation or whether they might fulfil other cellular functions.,True,ztQqAwcAAAAJ:qjMakFHDy7sC,56,https://www.sciencedirect.com/science/article/pii/S0966842X05001642,10080426391223435744,/scholar?cites=10080426391223435744,,https://www.academia.edu/download/30658679/13(8).pdf#page=11,0,0,0
1036008,The obligate aerobic actinomycete Streptomyces coelicolor A3(2) survives extended periods of anaerobic stress,2007,Geertje Van Keulen and Jesse Alderson and Janet White and R Gary Sawers,9,Environmental microbiology,12,3143-3149,Blackwell Publishing Ltd,The actinomycete Streptomyces coelicolor is an obligate aerobe that is found in soil and aqueous habitats. The levels of oxygen in these environments can vary considerably. which raises the question of how these bacteria survive during periods of anaerobiosis. Although S. coelicolor cannot grow in the complete absence of oxygen. we demonstrate here that it is capable of microaerobic growth and maintaining viability through several weeks of strict anaerobiosis. Both resting and germinated spores are able to survive abrupt exposure to anaerobiosis. which contrasts the situation with Mycobacterium species where gradual oxygen depletion is required to establish a latent state in which the bacterium is able to survive extended periods of anaerobiosis. Growth of S. coelicolor resumes immediately upon re‐introduction of oxygen. Taken together these findings indicate that survival is not restricted to spores and …,True,ztQqAwcAAAAJ:IjCSPb-OGe4C,50,https://sfamjournals.onlinelibrary.wiley.com/doi/abs/10.1111/j.1462-2920.2007.01433.x,11393510216335587748,/scholar?cites=11393510216335587748,,,0,0,0
