,title,pub_year,author,volume,journal,number,pages,publisher,abstract,filled,author_pub_id,num_citations,pub_url,cites_id,citedby_url,author_id,eprint_url,got_citations,got_author_ids,author_ids
88396,Synthesis of secorapamycin esters and amides,1994,Jerauld S Skotnicki and Robert M Kearney and Andri L Smith,35,Tetrahedron letters,2,197-200,Pergamon,,True,8pK0oMgAAAAJ:K-tzbvM8PMoC,71,,10739376864971160360,/scholar?cites=10739376864971160360,,,0,0,0
88397,Conduct and its consequences: Attempts at debiasing jury judgments,2005,Alison C Smith and Edith Greene,29,Law and human behavior,5,505-526,Kluwer Academic Publishers-Plenum Publishers,,True,8pK0oMgAAAAJ:kuK5TVdYjLIC,70,,10584668080830334932,/scholar?cites=10584668080830334932,,,0,0,0
88398,Falling stroke rates during COVID-19 pandemic at a comprehensive stroke center,2020,JE Siegler and ME Heslin and L Thau and A Smith and TG Jovin,29,Journal of Stroke and Cerebrovascular Diseases,8,104953,WB Saunders,,True,8pK0oMgAAAAJ:8LfMcXwVQboC,68,,14528044932731410736,/scholar?cites=14528044932731410736,,,0,0,0
88399,Antiplatelet therapy with aspirin. clopidogrel. and dipyridamole versus clopidogrel alone or aspirin and dipyridamole in patients with acute cerebral ischaemia (TARDIS): a …,2018,Philip M Bath and Lisa J Woodhouse and Jason P Appleton and Maia Beridze and Hanne Christensen and Robert A Dineen and Lelia Duley and Timothy J England and Katie Flaherty and Diane Havard and Stan Heptinstall and Marilyn James and Kailash Krishnan and Hugh S Markus and Alan A Montgomery and Stuart J Pocock and Marc Randall and Annemarei Ranta and Thompson G Robinson and Polly Scutt and Graham S Venables and Nikola Sprigg and LM Christensen and L Bentsen and C Krarup Hansen and TT Thomsen and C Kruuse and HH Jensen and SS Hansen and V Petrovic and N Beridze and N Kakabadze and T Kherkheulidze and D Kakabadze and I Toidze and N Lobjanidze and N Akiashvili and A Tevdoradze and N Khizanishvili and T Tsanava and R Taylor and I Iniesta and J Kok and J Duignan and M Funnell and P Cariga and M Rodriguez and IJ Watson and S Tennant and M Macleod and J Furnace and H Gow and J Irvine and A Joyson and S Nelson and V Taylor and M Smith and R Bellfield and B Hairsine and R Davies and A Dodd and J Corrigan and M Doherty and A Ahmed and C Denniss and S Johnson-Holland and KA Kay and R Icart Palau and G Auld and P Daboo and R Erande and G Grimwood and D Hove and L Howaniec and O Redjep and R Rangasamay and G Butt and D Sandler and J Reddan and S Stafford and J McIlmoyle and S Maguire and P Murphy and J Chambers and L Guthrie and M Osborn and A Steele and M Burn and A Benford and A Misra and D Hilton and E O'Brien and E Amis and S Finlay and J Mitchell and O Geraghty and K Harvey and B Hazel and S Mashate and P Wilding and M Sajid and M Ball and R Gascoyne and R Sivakumar and A Wright and K Chatterjee and S Booth and H Eccleson and C Kelly and S Leason and C Perkins and D Bruce and E Brown and S Clayton and M Garside and G Rogers and E Lawrence and S Mahmood and C Watchurst and D Chadha and L Glover and L Holford and K Smith and D Walstow and R Williams and L O'Shea and J Goodsell and C Athulathmudali and E Barbon and R Namushi and P Jacob and L Johnson and D Morse and C McGhee and O Speirs and S Atkinson and A Peacocke and Peter Langhorne and R Graham and F Wright and Christine McAlpine and A Ravindrane and M Bajoriene and L Matter and S Windebank and E Giallombardo and D Dellafera and C Eglinton and J Wilson and D Broughton,391,The Lancet,10123,850-859,Elsevier,,True,8pK0oMgAAAAJ:5kvG9DmRKWYC,67,,13374346709403078768,/scholar?cites=13374346709403078768,,,0,0,0
88400,Dissolution of lead-and lead–arsenic-jarosites at pH 2 and 8 and 20 C: Insights from batch experiments,2006,Adrian ML Smith and William E Dubbin and Kate Wright and Karen A Hudson-Edwards,229,Chemical Geology,4,344-361,Elsevier,,True,8pK0oMgAAAAJ:TlpoogIpr_IC,67,,12160382306156543517,/scholar?cites=12160382306156543517,,,0,0,0
88401,Role of laparoscopic ultrasonography in the management of patients with oesophagogastric cancer,1999,A Smith and TG John and OJ Garden and S Paterson Brown,86,British journal of surgery,8,1083-1087,John Wiley & Sons. Ltd.,,True,8pK0oMgAAAAJ:M0jDNLgoRFEC,66,,3184208990266476082,/scholar?cites=3184208990266476082,,,0,0,0
88402,Women with intellectual disability who have offended: characteristics and outcome,2004,William R Lindsay and Anne HW Smith and K Quinn and A Anderson and Alastair Smith and R Allan and J Law,48,Journal of Intellectual Disability Research,6,580-590,Blackwell Publishing Ltd.,,True,8pK0oMgAAAAJ:ZqLB7dQ1iF4C,65,,11226975433159166918,/scholar?cites=11226975433159166918,,,0,0,0
88403,Mathematics in early years education,2012,Ann Montague-Smith and Allison Price,,,,,Routledge,,True,8pK0oMgAAAAJ:nbnL2fqDbzcC,64,,3891848226161870375,/scholar?cites=3891848226161870375,,,0,0,0
88404,Education: an introductory survey,1966,William Owen Lester Smith,380,,,,Penguin,,True,8pK0oMgAAAAJ:wTekDMGr9GkC,64,,4494570243283587413,/scholar?cites=4494570243283587413,,,0,0,0
88405,Location-based services,2014,,,,,,,,True,8pK0oMgAAAAJ:as0KMg8qHbkC,62,,631131534956238781,/scholar?cites=631131534956238781,,,0,0,0
88406,Studies on the kinetics of glucose utilization,1956,CJ Hlad and H Elrick and TA Witten and A Smith and Y Arai and T Bow,35,The Journal of clinical investigation,10,1139-1149,American Society for Clinical Investigation,,True,8pK0oMgAAAAJ:9c2xU6iGI7YC,61,,612776024147657473,/scholar?cites=612776024147657473,,,0,0,0
88407,Radiation retinopathy: case report and review,2007,Abha Gupta and Felipe Dhawahir-Scala and Amy Smith and Lorna Young and Steve Charles,7,,1,1-5,BioMed Central,,True,8pK0oMgAAAAJ:BulkYocH2doC,60,,3710547425400137008,/scholar?cites=3710547425400137008,,,0,0,0
88408,Method and apparatus for providing subscriber services to a telephone,2000,,,,,,,,True,8pK0oMgAAAAJ:jL-93Qbq4QoC,60,,12235196444208184868,/scholar?cites=12235196444208184868,,,0,0,0
88409,The effects of defendant conduct on jury damage awards.,2001,Edith Greene and Michael Johns and Alison Smith,86,Journal of Applied Psychology,2,228,American Psychological Association,,True,8pK0oMgAAAAJ:LI9QrySNdTsC,59,,15035711899549561170,/scholar?cites=15035711899549561170,,,0,0,0
88410,Simone: Statistical inference for modular networks,2009,Julien Chiquet and Alexander Smith and Gilles Grasseau and Catherine Matias and Christophe Ambroise,25,Bioinformatics,3,417-418,Oxford University Press,,True,8pK0oMgAAAAJ:h1pkognVyKwC,58,,16778204113980899244,/scholar?cites=16778204113980899244,,,0,0,0
88411,Limits on  and  Couplings from  Events at ,1997,B Abbott and M Abolins and BS Acharya and I Adam and DL Adams and M Adams and S Ahn and H Aihara and GA Alves and E Amidi and N Amos and EW Anderson and R Astur and MM Baarmand and A Baden and V Balamurali and J Balderston and B Baldin and S Banerjee and J Bantly and JF Bartlett and K Bazizi and A Belyaev and SB Beri and I Bertram and VA Bezzubov and PC Bhat and V Bhatnagar and M Bhattacharjee and N Biswas and G Blazey and S Blessing and P Bloom and A Boehnlein and NI Bojko and F Borcherding and J Borders and C Boswell and A Brandt and R Brock and A Bross and D Buchholz and VS Burtovoi and JM Butler and W Carvalho and D Casey and Z Casilum and H Castilla-Valdez and D Chakraborty and S-M Chang and SV Chekulaev and L-P Chen and W Chen and Suyong Choi and S Chopra and BC Choudhary and JH Christenson and M Chung and D Claes and AR Clark and WG Cobau and J Cochran and WE Cooper and C Cretsinger and D Cullen-Vidal and MAC Cummings and D Cutts and OI Dahl and K Davis and K De and K Del Signore and M Demarteau and D Denisov and SP Denisov and HT Diehl and M Diesburg and G Di Loreto and P Draper and Y Ducros and LV Dudko and SR Dugad and D Edmunds and J Ellison and VD Elvira and R Engelmann and S Eno and G Eppley and P Ermolov and OV Eroshin and VN Evdokimov and T Fahland and M Fatyga and MK Fatyga and J Featherly and S Feher and D Fein and T Ferbel and G Finocchiaro and HE Fisk and Y Fisyak and E Flattum and GE Forden and M Fortner and KC Frame and S Fuess and E Gallas and AN Galyaev and P Gartung and TL Geld and II RJ Genik and K Genser and CE Gerber and B Gibbard and S Glenn and B Gobbi and M Goforth and A Goldschmidt and B Gómez and G Gómez and PI Goncharov and JL González Solís and H Gordon and LT Goss and K Gounder and A Goussiou and N Graf and PD Grannis and DR Green and J Green and H Greenlee and G Grim and S Grinstein and N Grossman and P Grudberg and S Grünendahl and G Guglielmo and JA Guida and JM Guida and A Gupta and SN Gurzhiev and P Gutierrez and YE Gutnikov and NJ Hadley and H Haggerty and S Hagopian and V Hagopian and KS Hahn and RE Hall and S Hansen and JM Hauptman,79,Physical review letters,8,1441,American Physical Society,,True,8pK0oMgAAAAJ:45AZ0Vt6gvEC,58,,3103577400918859502,/scholar?cites=3103577400918859502,,,0,0,0
88412,A Java programming tool for students with visual disabilities,2000,Ann C Smith and Joan M Francioni and Sam D Matzek,,,,142-148,,,True,8pK0oMgAAAAJ:LWqeokA2EBkC,57,,3857507060805807589,/scholar?cites=3857507060805807589,,,0,0,0
88413,Biological perspectives on language,1984,J Morton and D Caplan and AR Lecours and A Smith,,,,,,,True,8pK0oMgAAAAJ:zCpYd49hD24C,57,,12565105898337079059,/scholar?cites=12565105898337079059,,,0,0,0
88414,Nonvisual tool for navigating hierarchical structures,2003,Ann C Smith and Justin S Cook and Joan M Francioni and Asif Hossain and Mohd Anwar and M Fayezur Rahman,,ACM SIGACCESS Accessibility and Computing,77-78,133-139,ACM,,True,8pK0oMgAAAAJ:B2rIPIGFPLEC,56,,10782186592317081166,/scholar?cites=10782186592317081166,,,0,0,0
88415,The surgical safety checklist and patient outcomes after surgery: a prospective observational cohort study. systematic review and meta-analysis,2018,TEF Abbott and Tahania Ahmad and MK Phull and AJ Fowler and R Hewson and BM Biccard and MS Chew and M Gillies and RM Pearse and Rupert M Pearse and Scott Beattie and Pierre-Alain Clavien and Nicolas Demartines and Lee A Fleisher and Mike Grocott and James Haddow and Andreas Hoeft and Peter Holt and Rui Moreno and Naomi Pritchard and Andrew Rhodes and Duminda Wijeysundera and Matt Wilson and Tahania Ahmed and Kirsty Everingham and Russell Hewson and Marta Januszewska and Mandeep-Kaur Phull and Richard Halliwell and Mark Shulman and Paul Myles and Werner Schmid and Michael Hiesmayr and Patrick Wouters and Stefan de Hert and Suzana Lobo and Xiangming Fang and Lars Rasmussen and Emmanuel Futier and Matthieu Biais and Aurélien Venara and Karem Slim and Michael Sander and Despoina Koulenti and Kostoula Arvaniti and Mathew Chan and Atul Kulkarni and Susilo Chandra and Aida Tantri and Emad Geddoa and Muntadhar Abbas and Giorgio Della Rocca and Datin Sivasakthi and Marzida Mansor and Pastor Luna and Arthur Bouwman and Wolfgang Buhre and Vanessa Beavis and Douglas Campbell and Tim Short and Tunde Osinaike and Ricardo Matos and Ioana Grigoras and Mikhail Kirov and Denis Protsenko and Bruce Biccard and Cesar Aldecoa and Michelle Chew and Christoph Hofer and Martin Hubner and James Ditai and Tamas Szakmany and Lee Fleisher and Marissa Ferguson and Michael MacMahon and Ritchie Cherian and Helen Currow and Kathirgamanathan Kanathiban and David Gillespie and Edward Pathmanathan and Katherine Phillips and Jenifer Reynolds and Joanne Rowley and Jeanene Douglas and Ross Kerridge and Sameer Garg and Michael Bennett and Megha Jain and David Alcock and Nico Terblanche and Rochelle Cotter and Kate Leslie and Marcelle Stewart and Nicolette Zingerle and Antony Clyde and Oliver Hambidge and Adam Rehak and Sharon Cotterell and Wilson Binh Quan Huynh and Timothy McCulloch and Erez Ben-Menachem and Thomas Egan and Jennifer Cope and Paul Fellinger and Markus Haisjackl and Simone Haselberger and Caroline Holaubek and Paul Lichtenegger and Florian Scherz and Franz Hoffer and Veronika Cakova and Andreas Eichwalder and Norbert Fischbach and Reinhold Klug and Elisabeth Schneider and Martin Vesely and Reinhart Wickenhauser and Karl Gernot Grubmueller and Marion Leitgeb and Friedrich Lang and Nancy Toro and Marlene Bauer and Friedrich Laengle and Claudia Haberl and Thomas Mayrhofer and Christoph Trybus and Christian Buerkle and Karin Forstner and Reinhard Germann and Harald Rinoesl and Elke Schindler and Ernst Trampitsch and Gerhard Bogner and Daniel Dankl and Martin Duenser and Gerhard Fritsch and Ilse Gradwohl-Matis and Andreas Hartmann and Thomas Hoelzenbein and Tarkan Jaeger and Franz Landauer and Gregor Lindl and Michael Lux and Johannes Steindl and Ottokar Stundner and Christian Szabo and Jawad Bidgoli and Hans Verdoodt and Patrice Forget and David Kahn,120,,1,146-155,Elsevier,,True,8pK0oMgAAAAJ:polMJLZb0X8C,55,,10128164676946540274,/scholar?cites=10128164676946540274,,,0,0,0
88416,A relevance-theoretic account of conditionals,1988,Neil Smith and Amahl Smith,,"Language, Speech and Mind: Essays in Honour of Victoria A. Fromkin",,322-352,,,True,8pK0oMgAAAAJ:PazO6pb-sMwC,54,,6063780999146390940,/scholar?cites=6063780999146390940,,,0,0,0
88417,The SF6 tracer technique for measurements of methane emission from cattle – effect of tracer permeation rate,2008,CS Pinares-Patiño and A Machmüller and G Molano and A Smith and JB Vlaming and H Clark,88,Canadian journal of animal science,2,309-320,NRC Research Press,,True,8pK0oMgAAAAJ:9LrdxYebArsC,53,,12737586433018723974,/scholar?cites=12737586433018723974,,,0,0,0
88418,Features and Applications of [Rh(CO)2Cl]2-Catalyzed Alkylations of Unsymmetrical Allylic Substrates,2007,Brandon L Ashfeld and Kenneth A Miller and Anna J Smith and Kristy Tran and Stephen F Martin,72,,24,9018-9031,American Chemical Society,,True,8pK0oMgAAAAJ:Z7R3Ocg27JUC,53,,6309949191536001473,/scholar?cites=6309949191536001473,,,0,0,0
88419,Computer science accessibility for students with visual disabilities,2002,Joan M Francioni and Ann C Smith,,,,91-95,,,True,8pK0oMgAAAAJ:CCeGMaHljPEC,52,,11243222960681113086,/scholar?cites=11243222960681113086,,,0,0,0
88420,Design considerations for patient portal adoption by low-income. older adults,2015,Celine Latulipe and Amy Gatto and Ha T Nguyen and David P Miller and Sara A Quandt and Alain G Bertoni and Alden Smith and Thomas A Arcury,,,,3859-3868,,,True,8pK0oMgAAAAJ:rMiSbtrAJs8C,51,,5433774920855932297,/scholar?cites=5433774920855932297,,,0,0,0
88421,Geographical information systems and urban design,1999,Michael Batty and Martin Dodge and Bin Jiang and Andy Smith,,,,43-65,Springer. Berlin. Heidelberg,,True,8pK0oMgAAAAJ:PFhWnMnuT1QC,50,,17022150805722865949,/scholar?cites=17022150805722865949,,,0,0,0
88422,Alternative education programmes: Synthesis and psychological perspectives,2014,Amanda Smith and Margareta Maria Thomson,30,Educational Psychology in Practice,2,111-119,Routledge,,True,8pK0oMgAAAAJ:8s22W2WWFy4C,49,,15984218461417788749,/scholar?cites=15984218461417788749,,,0,0,0
88423,Field edge smoothing for multileaf collimators,1996,James M Galvin and Dennis D Leavitt and Alfred A Smith,35,International Journal of Radiation Oncology* Biology* Physics,1,89-94,Elsevier,,True,8pK0oMgAAAAJ:gKiMpY-AVTkC,49,,5154836348631486087,/scholar?cites=5154836348631486087,,,0,0,0
88424,Estradiol alters transcription factor gene expression in primate prefrontal cortex,2004,J Wang and CM Cheng and J Zhou and A Smith and C Shannon Weickert and WR Perlman and KG Becker and D Powell and CA Bondy,76,Journal of neuroscience research,3,306-314,Wiley Subscription Services. Inc.. A Wiley Company,,True,8pK0oMgAAAAJ:0t1ZDozeHsAC,48,,16039638471052366909,/scholar?cites=16039638471052366909,,,0,0,0
88425,Experimental tests of lepton universality in  decay,1997,A Anastassov and S Blinov and JE Duboscq and KD Fisher and D Fujino and R Fulton and KK Gan and T Hart and K Honscheid and H Kagan and R Kass and J Lee and MB Spencer and M Sung and A Undrus and R Wanke and A Wolf and MM Zoeller and B Nemati and SJ Richichi and WR Ross and P Skubic and M Wood and M Bishai and J Fast and E Gerndt and JW Hinson and N Menon and David Harry Miller and EI Shibata and IPJ Shipsey and M Yurko and L Gibbons and SD Johnson and Y Kwon and S Roberts and EH Thorndike and CP Jessop and K Lingel and H Marsiske and ML Perl and SF Schaffner and D Ugolini and R Wang and X Zhou and TE Coan and V Fadeyev and I Korolkov and Y Maravin and I Narsky and V Shelkov and J Staeck and R Stroynowski and I Volobouev and J Ye and Marina Artuso and A Efimov and F Frasconi and M Gao and M Goldberg and D He and S Kopp and GC Moneti and R Mountain and Y Mukhin and S Schuh and Tomasz Skwarnicki and Sheldon Stone and G Viehhauser and X Xing and J Bartelt and SE Csorna and V Jain and S Marka and A Freyberger and D Gibaut and R Godang and K Kinoshita and IC Lai and P Pomianowski and S Schrenk and G Bonvicini and D Cinabro and R Greene and LP Perera and B Barish and M Chadha and S Chan and G Eigen and JS Miller and C O’Grady and M Schmidtler and J Urheim and AJ Weinstein and F Würthwein and DM Asner and DW Bliss and WS Brower and G Masek and HP Paar and M Sivertz and V Sharma and J Gronberg and R Kutschke and DJ Lange and S Menary and RJ Morrison and HN Nelson and TK Nelson and C Qiao and JD Richman and D Roberts and A Ryd and MS Witherell and R Balest and BH Behrens and K Cho and WT Ford and H Park and P Rankin and J Roy and JG Smith and JP Alexander and C Bebek and BE Berger and K Berkelman and K Bloom and DG Cassel and HA Cho and DM Coffman and David S Crowcroft and M Dickson and Persis S Drell and Karl M Ecklund and R Ehrlich and R Elia and AD Foland and P Gaidarev and RS Galik and B Gittelman and SW Gray and DL Hartill and BK Heltsley and PI Hopman and J Kandaswamy and N Katayama and PC Kim and DL Kreinick and T Lee and Y Liu,55,Physical Review D,5,2559,American Physical Society,,True,8pK0oMgAAAAJ:Oj-SLI0tZTcC,47,,14764789861334977157,/scholar?cites=14764789861334977157,,,0,0,0
88426,Overview of the MGH-Northeast Proton Therapy Center plans and progress,1995,Jacob Flanz and Stanley Durlacher and Michael Goitein and Anne Levine and Paul Reardon and Al Smith,99,Nuclear Instruments and Methods in Physics Research Section B: Beam Interactions with Materials and Atoms,1-4,830-834,North-Holland,,True,8pK0oMgAAAAJ:qkm5LKljiV4C,46,,8790185600505159018,/scholar?cites=8790185600505159018,,,0,0,0
88427,-Selmer groups. -class groups. and Goldfeld's conjecture,2017,Alexander Smith,,arXiv preprint arXiv:1702.02325,,,,,True,8pK0oMgAAAAJ:kzcrU_BdoSEC,43,,4778908694746062673,/scholar?cites=4778908694746062673,,,0,0,0
88428,Precision determination of atmospheric extinction at optical and near-infrared wavelengths,2010,David L Burke and T Axelrod and Stéphane Blondin and Chuck Claver and Željko Ivezić and Lynne Jones and Abhijit Saha and Allyn Smith and R Chris Smith and Christopher W Stubbs,720,The Astrophysical Journal,1,811,IOP Publishing,,True,8pK0oMgAAAAJ:1lhNe0rCu4AC,43,,16999016424185218262,/scholar?cites=16999016424185218262,,,0,0,0
88429,Process for the production of porous polymeric materials,1974,,,,,,,,True,8pK0oMgAAAAJ:5qu0sgD3nvwC,43,,5910224228387987378,/scholar?cites=5910224228387987378,,,0,0,0
88430,[Rh(CO)2Cl]2-Catalyzed Domino Reactions Involving Allylic Substitution and Subsequent Carbocyclization Reactions,2005,Brandon L Ashfeld and Kenneth A Miller and Anna J Smith and Kristy Tran and Stephen F Martin,7,Organic letters,8,1661-1663,American Chemical Society,,True,8pK0oMgAAAAJ:hXZnTIgIr50C,42,,9469640781229567786,/scholar?cites=9469640781229567786,,,0,0,0
88431,Phase diffusion and quantum noise in the optical parametric oscillator: a semiclassical approach,1991,JY Courtois and A Smith and C Fabre and S Reynaud,38,Journal of modern optics,1,177-191,Taylor & Francis Group,,True,8pK0oMgAAAAJ:ExNiBuTMO9IC,42,,16216320121652191268,/scholar?cites=16216320121652191268,,,0,0,0
88432,The use of graphics calculators by students in an examination: what do they really do?,2003,T Graham and C Headlam and S Honey and J Sharp and A Smith,34,International Journal of Mathematical Education in Science and Technology,3,319-334,Taylor & Francis Group,,True,8pK0oMgAAAAJ:9i1gB6tY3MIC,41,,11657426636674367381,/scholar?cites=11657426636674367381,,,0,0,0
88433,A text-mining system for extracting metabolic reactions from full-text articles,2012,Jan Czarnecki and Irene Nobeli and Adrian M Smith and Adrian J Shepherd,13,BMC bioinformatics,1,1-14,BioMed Central,,True,8pK0oMgAAAAJ:rTD5ala9j4wC,40,,9091117336944666092,/scholar?cites=9091117336944666092,,,0,0,0
88434,Hilltopping. leks and female choice in the Carpenter bee Xylocopa (Neoxylocopa) varipuncta,1987,J Alcock and AP Smith,211,Journal of Zoology,1,1-10,Blackwell Publishing Ltd,,True,8pK0oMgAAAAJ:2l5NCbZemmgC,40,,2262801000917485786,/scholar?cites=2262801000917485786,,,0,0,0
88435,Looped traffic accessory,1973,,,,,,,,True,8pK0oMgAAAAJ:hQUaER0FWQ4C,40,,13994667361877721227,/scholar?cites=13994667361877721227,,,0,0,0
88436,Identifying cis-mediators for trans-eQTLs across many human tissues using genomic mediation analysis,2017,Fan Yang and Jiebiao Wang and Brandon L Pierce and Lin S Chen and François Aguet and Kristin G Ardlie and Beryl B Cummings and Ellen T Gelfand and Gad Getz and Kane Hadley and Robert E Handsaker and Katherine H Huang and Seva Kashin and Konrad J Karczewski and Monkol Lek and Xiao Li and Daniel G MacArthur and Jared L Nedzel and Duyen T Nguyen and Michael S Noble and Ayellet V Segrè and Casandra A Trowbridge and Taru Tukiainen and Nathan S Abell and Brunilda Balliu and Ruth Barshir and Omer Basha and Alexis Battle and Gireesh K Bogu and Andrew Brown and Christopher D Brown and Stephane E Castel and Colby Chiang and Donald F Conrad and Nancy J Cox and Farhan N Damani and Joe R Davis and Olivier Delaneau and Emmanouil T Dermitzakis and Barbara E Engelhardt and Eleazar Eskin and Pedro G Ferreira and Laure Frésard and Eric R Gamazon and Diego Garrido-Martín and Ariel DH Gewirtz and Genna Gliner and Michael J Gloudemans and Roderic Guigo and Ira M Hall and Buhm Han and Yuan He and Farhad Hormozdiari and Cedric Howald and Hae Kyung Im and Brian Jo and Eun Yong Kang and Yungil Kim and Sarah Kim-Hellmuth and Tuuli Lappalainen and Gen Li and Xin Li and Boxiang Liu and Serghei Mangul and Mark I McCarthy and Ian C McDowell and Pejman Mohammadi and Jean Monlong and Stephen B Montgomery and Manuel Muñoz-Aguirre and Anne W Ndungu and Dan L Nicolae and Andrew B Nobel and Meritxell Oliva and Halit Ongen and John J Palowitch and Nikolaos Panousis and Panagiotis Papasaikas and YoSon Park and Princy Parsana and Anthony J Payne and Christine B Peterson and Jie Quan and Ferran Reverter and Chiara Sabatti and Ashis Saha and Michael Sammeth and Alexandra J Scott and Andrey A Shabalin and Reza Sodaei and Matthew Stephens and Barbara E Stranger and Benjamin J Strober and Jae Hoon Sul and Emily K Tsang and Sarah Urbut and Martijn van de Bunt and Gao Wang and Xiaoquan Wen and Fred A Wright and Hualin S Xi and Esti Yeger-Lotem and Zachary Zappala and Judith B Zaugg and Yi-Hui Zhou and Joshua M Akey and Daniel Bates and Joanne Chan and Melina Claussnitzer and Kathryn Demanelis and Morgan Diegel and Jennifer A Doherty and Andrew P Feinberg and Marian S Fernando and Jessica Halow and Kasper D Hansen and Eric Haugen and Peter F Hickey and Lei Hou and Farzana Jasmine and Ruiqi Jian and Lihua Jiang and Audra Johnson and Rajinder Kaul and Manolis Kellis and Muhammad G Kibriya and Kristen Lee and Jin Billy Li and Qin Li and Jessica Lin and Shin Lin and Sandra Linder and Caroline Linke and Yaping Liu and Matthew T Maurano and Benoit Molinie and Jemma Nelson and Fidencio J Neri and Yongjin Park and Nicola J Rinaldi and Lindsay F Rizzardi and Richard Sandstrom and Andrew Skol and Kevin S Smith and Michael P Snyder and John Stamatoyannopoulos and Hua Tang and Li Wang and Meng Wang and Nicholas Van Wittenberghe,27,Genome research,11,1859-1871,Cold Spring Harbor Lab,,True,8pK0oMgAAAAJ:738O_yMBCRsC,39,,13857207076379855435,/scholar?cites=13857207076379855435,,,0,0,0
88437,Consensus statement on effective communication of urgent diagnoses and significant. unexpected diagnoses in surgical pathology and cytopathology from the College of American …,2012,Raouf E Nakhleh and Jeffrey L Myers and Timothy C Allen and Barry R DeYoung and Patrick L Fitzgibbons and William K Funkhouser and Dina R Mody and Amy Lynn and Lisa A Fatheree and Anthony T Smith and Avtar Lal and Jan F Silverman,136,Archives of pathology & laboratory medicine,2,148-154,College of American Pathologist,,True,8pK0oMgAAAAJ:j7XjBeKFbTsC,39,,13985304832618902116,/scholar?cites=13985304832618902116,,,0,0,0
88438,Synthesis. characterization and thermochemistry of a Pb-jarosite,2010,Ferenc Lázár Forray and Adrian ML Smith and Christophe Drouet and Alexandra Navrotsky and Kathleen Wright and Karen A Hudson-Edwards and WE Dubbin,74,Geochimica et Cosmochimica Acta,1,215-224,Pergamon,,True,8pK0oMgAAAAJ:DrR-2ekChdkC,39,,12894295756799554104,/scholar?cites=12894295756799554104,,,0,0,0
88439,[Os(bipy)(CN)4]2- and Its Relatives as Components of Polynuclear Assemblies:  Structural and Photophysical Properties,2007,Svetlana G Baca and Harry Adams and Christopher S Grange and Alec P Smith and Igor Sazanovich and Michael D Ward,46,Inorganic chemistry,23,9779-9789,American Chemical Society,,True,8pK0oMgAAAAJ:5icHVeHT4IsC,39,,4140052744009955390,/scholar?cites=4140052744009955390,,,0,0,0
88440,Tracking movements of deep demersal fishes in the Porcupine Seabight. north-east Atlantic Ocean,1994,Philip Michael Bagley and A Smith and Imants George Priede,74,Journal of the Marine Biological Association of the United Kingdom,3,473-480,Cambridge University Press,,True,8pK0oMgAAAAJ:9mnZQYLiiboC,39,,10812013616485094117,/scholar?cites=10812013616485094117,,,0,0,0
