,title,pub_year,author,volume,journal,number,pages,publisher,abstract,filled,author_pub_id,num_citations,pub_url,cites_id,citedby_url,author_id,eprint_url,got_citations,got_author_ids,author_ids
1093028,Relevance of breast cancer hormone receptors and other factors to the efficacy of adjuvant tamoxifen: patient-level meta-analysis of randomised trials,2011,Early Breast Cancer Trialists' Collaborative Group,378,The lancet,9793,771-784,Elsevier,As trials of 5 years of tamoxifen in early breast cancer mature. the relevance of hormone receptor measurements (and other patient characteristics) to long-term outcome can be assessed increasingly reliably. We report updated meta-analyses of the trials of 5 years of adjuvant tamoxifen.We undertook a collaborative meta-analysis of individual patient data from 20 trials (n=21 457) in early breast cancer of about 5 years of tamoxifen versus no adjuvant tamoxifen. with about 80% compliance. Recurrence and death rate ratios (RRs) were from log-rank analyses by allocated treatment.In oestrogen receptor (ER)-positive disease (n=10 645). allocation to about 5 years of tamoxifen substantially reduced recurrence rates throughout the first 10 years (RR 0·53 [SE 0·03] during years 0–4 and RR 0·68 [0·06] during years 5–9 [both 2p<0·00001]; but RR 0·97 [0·10] during years 10–14 …,True,_Q62CNAAAAAJ:r0BpntZqJG4C,2765,https://www.sciencedirect.com/science/article/pii/S0140673611609938,6910743006608907268,/scholar?cites=6910743006608907268,,https://www.sciencedirect.com/science/article/pii/S0140673611609938,0,0,0
1093029,Prevention of disabling and fatal strokes by successful carotid endarterectomy in patients without recent neurological symptoms: randomised controlled trial.,2004,A Halliday and A Mansfield and J Marro and C Peto and R Peto and J Potter and D Thomas and Asymptomatic Carotid Surgery Trial ACST MRC,363,Lancet,9420,1491,,Among patients with substantial carotid artery narrowing but no recent neurological symptom (stroke or transient ischaemia). the balance of surgical risks and longterm benefits from carotid endarterectomy (CEA) was unclear.During 1993–2003. 3120 asymptomatic patients with substantial carotid narrowing were randomised equally between immediate CEA (half got CEA by 1 month. 88% by 1 year) and indefinite deferral of any CEA (only 4% per year got CEA) and were followed for up to 5 years (mean 3·4 years). Kaplan-Meier analyses of 5-year risks are by allocated treatment.The risk of stroke or death within 30 days of CEA was 3·1% (95% Cl 2·3–4·1). Comparing all patients allocated immediate CEA versus all allocated deferral. but excluding such perioperative events. the 5-year stroke risks were 3·8% versus 11% (gain 7·2% [95% Cl 5·0–9·4]. p<0·0001). This gain chiefly involved …,True,_Q62CNAAAAAJ:L8Ckcad2t8MC,2701,https://www.sciencedirect.com/science/article/pii/S0140673604161461,1287500634624291587,/scholar?cites=1287500634624291587,,,0,0,0
1093030,Systemic treatment of early breast cancer by hormonal. cytotoxic. or immune therapy. 133 randomised trials involving 31000 recurrences and 24000 deaths among 75000 women. part 1,1992,Early Breast Cancer Trialists' Collaborative Group,339,The Lancet,,1-15,,In a worldwide collaboration. information was sought and centrally checked on mortality and recurrence for each woman in any randomised trial that began before 1985 of any aspect of systemic adjuvant therapy for early breast cancer. Checked data were available for 75 000 women (about 90% of those ever randomised). of whom 32% had died and another 10% had experienced recurrence. The parts now reviewed include 30 000 women in tamoxifen trials. 3000 in ovarian ablation trials. 11 000 in polychemotherapy trials. 15 000 in other chemotherapy comparisons. and 6000 in immunotherapy trials. Highly significant reductions in the annual rates both of recurrence and of death are produced by tamoxifen (25% SD 2 recurrence and 17% SD 2 mortality: 2p<0·00001). by ablation below age 50 (26% SD 6 recurrence and 25% SD 7 mortality: 2p=0·0004). and by polychemotherapy (28% SD 3 recurrence and 16 …,True,_Q62CNAAAAAJ:rO6llkc54NcC,2610,https://www.sciencedirect.com/science/article/pii/014067369290139T,13604030156370492593,/scholar?cites=13604030156370492593,,,0,0,0
1093031,Systemic treatment of early breast cancer by hormonal. cytotoxic. or immune therapy. 133 randomised trials involving 31000 recurrences and 24000 deaths among 75000 women. part 2,1992,Early Breast Cancer Trialists' Collaborative Group,339,The Lancet,,71-85,,Author O ABE. R ABE. K ASAISHI. K ENOMOTO. T HATTORI. Y INO. K KIKUCHI. H KOYAMA. K SAWA. J UCHINO. M YOSHIDA. JL HAYBITTLE. T VANDEVELDE. JB VERMORKEN. VJ HARVEY. TM HOLDAWAY. RG KAY. BH MASON. JF FORBES. G BASTERT. W SAUERBREI. H SCHEURLEN. M SCHUMACHER. U VERONESI. JB DUBOIS. G BRUFMAN. H HAYAT. AR BIANCO. ME LIPPMAN. LJ PIERCE. R SIMON. SM STEINBERG. Y NOMURA. R DELAHUERTA. MG SAINZ. A BROWN. B FISHER. C REDMOND. N WOLMARK. M BAUM. IM JACKSON. MK PALMER. JN INGLE. DJ SCHAID. NO BENGTSSON and LG LARSSON,True,_Q62CNAAAAAJ:3s1wT3WcHBgC,2610,https://biblio.ugent.be/publication/204236,13604030156370492593,/scholar?cites=13604030156370492593,,,0,0,0
1093032,Effect of radiotherapy after breast-conserving surgery on 10-year recurrence and 15-year breast cancer death: meta-analysis of individual patient data for 10 801 women in 17 …,2011,DLW Kwong and S Darby and P McGale and C Correa and C Taylor and R Arriagada and M Clarke and D Cutter and C Davies and M Ewertz and J Godwin and R Gray and L Pierce and T Whelan and Y Wang and R Peter,378,The Lancet,,1707-1716,,After breast-conserving surgery. radiotherapy reduces recurrence and breast cancer death. but it may do so more for some groups of women than for others. We describe the absolute magnitude of these reductions according to various prognostic and other patient characteristics. and relate the absolute reduction in 15-year risk of breast cancer death to the absolute reduction in 10-year recurrence risk.We undertook a meta-analysis of individual patient data for 10 801 women in 17 randomised trials of radiotherapy versus no radiotherapy after breast-conserving surgery. 8337 of whom had pathologically confirmed node-negative (pN0) or node-positive (pN+) disease.Overall. radiotherapy reduced the 10-year risk of any (ie. locoregional or distant) first recurrence from 35·0% to 19·3% (absolute reduction 15·7%. 95% CI 13·7–17·7. 2p<0·00001) and reduced the 15-year risk of breast …,True,_Q62CNAAAAAJ:TFP_iSt0sucC,2465,https://www.sciencedirect.com/science/article/pii/S0140673611616292,9303536743440664869,/scholar?cites=9303536743440664869,,https://www.sciencedirect.com/science/article/pii/S0140673611616292,0,0,0
1093033,Effects of ACE inhibitors. calcium antagonists. and other blood-pressure-lowering drugs: results of prospectively designed overviews of randomised trials,2000,Blood Pressure Lowering Treatment Trialists' Collaboration,356,The Lancet,9246,1955-1964,Elsevier,This programme of overviews of randomised trials was established to investigate the effects of angiotensin-converting-enzyme (ACE) inhibitors. calcium antagonists. and other blood-pressure-lowering drugs on mortality and major cardiovascular morbidity in several populations of patients. We did separate overviews of trials comparing active treatment regimens with placebo. trials comparing more intensive and less intensive blood-pressure-lowering strategies. and trials comparing treatment regimens based on different drug classes.The hypotheses to be investigated. the trials to be included. and the outcomes to be studied were all selected before the results of any participating trial were known. Individual participant data or group tabular data were provided by each trial and combined by standard statistical techniques.The overview of placebo-controlled trials of ACE inhibitors (four …,True,_Q62CNAAAAAJ:Ri6SYOTghG4C,2326,https://www.sciencedirect.com/science/article/pii/S0140673600033079,10131854832977645936,/scholar?cites=10131854832977645936,,http://acpjc.acponline.org/Content/135/1/issue/ACPJC-2001-135-1-006.htm,0,0,0
1093034,MRC European carotid surgery trial: interim results for symptomatic patients with severe (70-99%) or with mild (0-29%) carotid stenosis,1991,European Carotid Surgery Trialists' Collaborative Group,337,The Lancet,,1235-1243,,ObjectiveTo assess the effect of carotid endarterectomy on the duration of nondisabled survival in patients with recent. nondisabling. cerebrovascular ischemic events and ipsilateral carotid stenosis.DesignMulticenter. randomized. controlled trial with 3-year mean follow-up. Interim results for 2 of 3 entry strata are in this report: 0% to 29% carotid stenosis and 70% to 99% stenosis.Setting,True,_Q62CNAAAAAJ:zA6iFVUQeVQC,2243,https://acpjc.acponline.org/Content/115/2/issue/ACPJC-1991-115-2-033.htm,5867315404973254225,/scholar?cites=5867315404973254225,,https://acpjc.acponline.org/Content/115/2/issue/ACPJC-1991-115-2-033.htm,0,0,0
1093035,Do selective cyclo-oxygenase-2 inhibitors and traditional non-steroidal anti-inflammatory drugs increase the risk of atherothrombosis? Meta-analysis of randomised trials,2006,Patricia M Kearney and Colin Baigent and Jon Godwin and Heather Halls and Jonathan R Emberson and Carlo Patrono,332,Bmj,7553,1302-1308,British Medical Journal Publishing Group,Objective To assess the effects of selective cyclo-oxygenase-2 (COX 2) inhibitors and traditional non-steroidal anti-inflammatory drugs (NSAIDs) on the risk of vascular events.Design Meta-analysis of published and unpublished tabular data from randomised trials. with indirect estimation of the effects of traditional NSAIDs.Data sources Medline and Embase (January 1966 to April 2005); Food and Drug Administration records; and data on file from Novartis. Pfizer. and Merck.Review methods Eligible studies were randomised trials that included a comparison of a selective COX 2 inhibitor versus placebo or a selective COX 2 inhibitor versus a traditional NSAID. of at least four weeks9 duration. with information on serious vascular events (defined as myocardial infarction. stroke. or vascular death). Individual investigators and manufacturers provided information on the number of patients randomised. numbers of …,True,_Q62CNAAAAAJ:2osOgNQ5qMEC,1765,https://www.bmj.com/content/332/7553/1302?ehom,13148619842676985602,/scholar?cites=13148619842676985602,,https://www.ncbi.nlm.nih.gov/pmc/articles/PMC1473048/,0,0,0
1093036,Long-term effects of continuing adjuvant tamoxifen to 10 years versus stopping at 5 years after diagnosis of oestrogen receptor-positive breast cancer: ATLAS. a randomised trial,2013,Christina Davies and Hongchao Pan and Jon Godwin and Richard Gray and Rodrigo Arriagada and Vinod Raina and Mirta Abraham and Victor Hugo Medeiros Alencar and Atef Badran and Xavier Bonfill and Joan Bradbury and Michael Clarke and Rory Collins and Susan R Davis and Antonella Delmestri and John F Forbes and Peiman Haddad and Ming-Feng Hou and Moshe Inbar and Hussein Khaled and Joanna Kielanowska and Wing-Hong Kwan and Beela S Mathew and Indraneel Mittra and Bettina Müller and Antonio Nicolucci and Octavio Peralta and Fany Pernas and Lubos Petruzelka and Tadeusz Pienkowski and Ramachandran Radhika and Balakrishnan Rajan and Maryna T Rubach and Sera Tort and Gerard Urrútia and Miriam Valentini and Yaochen Wang and Richard Peto and Adjuvant Tamoxifen: Longer Against Shorter (ATLAS) Collaborative Group,381,The Lancet,9869,805-816,Elsevier,For women with oestrogen receptor (ER)-positive early breast cancer. treatment with tamoxifen for 5 years substantially reduces the breast cancer mortality rate throughout the first 15 years after diagnosis. We aimed to assess the further effects of continuing tamoxifen to 10 years instead of stopping at 5 years.In the worldwide Adjuvant Tamoxifen: Longer Against Shorter (ATLAS) trial. 12 894 women with early breast cancer who had completed 5 years of treatment with tamoxifen were randomly allocated to continue tamoxifen to 10 years or stop at 5 years (open control). Allocation (1:1) was by central computer. using minimisation. After entry (between 1996 and 2005). yearly follow-up forms recorded any recurrence. second cancer. hospital admission. or death. We report effects on breast cancer outcomes among the 6846 women with ER-positive disease. and side-effects among all women (with …,True,_Q62CNAAAAAJ:maZDTaKrznsC,1738,https://www.sciencedirect.com/science/article/pii/S0140673612619631,6390912963978545255,/scholar?cites=6390912963978545255,,https://www.sciencedirect.com/science/article/pii/S0140673612619631,0,0,0
1093037,The United Kingdom transient ischaemic attack (UK-TIA) aspirin trial: final results.,1991,B Farrell and J Godwin and S Richards and C Warlow,54,"Journal of Neurology, Neurosurgery & Psychiatry",12,1044-1054,BMJ Publishing Group Ltd,"From 1979-85. 2435 patients with a transient ischaemic attack or minor ischaemic stroke were randomly allocated to receive long term ""blind"" treatment with aspirin 600 mg twice daily (n = 815). aspirin 300 mg once daily (n = 806) or placebo (n = 814). No patient was lost to follow up. The ""intention to treat"" comparison included all the serious vascular events and deaths which occurred before the end of the follow up period on 30 September 1986. There was no difference in efficacy between the 300 mg and 1200 mg daily doses of aspirin. but the lower dose was undoubtedly less gastrotoxic. Also. there was no definite difference in the response of males and females to aspirin. The odds of suffering a major stroke. myocardial infarction or vascular death were 15% less in the combined aspirin groups compared with the placebo group (95% confidence interval 29% reduction to 3% increase in odds) which is compatible …",True,_Q62CNAAAAAJ:9yKSN-GCB0IC,1289,https://jnnp.bmj.com/content/54/12/1044.short,14238832270363880650,/scholar?cites=14238832270363880650,,https://jnnp.bmj.com/content/jnnp/54/12/1044.full.pdf,0,0,0
1093038,Randomised trial of endarterectomy for recently symptomatic carotid stenosis: final results of the MRC European Carotid Surgery Trial (ECST),1998,European Carotid Surgery Trialists Collaborative Group,351,Lancet,9113,1379-1387,,Our objective was to assess the risks and benefits of carotid endarterectomy. primarily in terms of stroke prevention. in patients with recently symptomatic carotid stenosis.This multicentre. randomised controlled trial enrolled 3024 patients. We enrolled men and women of any age. with some degree of carotid stenosis. who within the previous 6 months had had at least one transient or mild symptomatic ischaemic vascular event in the distribution of one or both carotid arteries. Between 1981 and 1994. we allocated 1811 (60%) patients to surgery and 1213 (40%) to control (surgery to be avoided for as long as possible). Follow-up was until the end of 1995 (mean 6·1 years). and the main analyses were by intention to treat.The overall outcome (major stroke or death) occurred in 669 (37·0%) surgery-group patients and 442 (36·5%) control-group patients. The risk of major stroke or death …,True,_Q62CNAAAAAJ:HDshCWvjkbEC,1249,https://www.sciencedirect.com/science/article/pii/S0140673697092921,14066687877852943487,/scholar?cites=14066687877852943487,,,0,0,0
1093039,Comparisons between different polychemotherapy regimens for early breast cancer: meta-analyses of long-term outcome among 100.000 women in 123 randomised trials.,2011,R Peto and C Davies and J Godwin and Richard Gray and HC Pan and M Clarke and D Cutter and S Darby and P McGale and C Taylor and YC Wang and Jonas Bergh and Angelo Di Leo and K Albain and S Swain and M Piccart and Kathleen Pritchard,379,"Lancet (London, England)",9814,432-444,,BackgroundModerate differences in efficacy between adjuvant chemotherapy regimens for breast cancer are plausible. and could affect treatment choices. We sought any such differences.MethodsWe undertook individual-patient-data meta-analyses of the randomised trials comparing: any taxane-plus-anthracycline-based regimen versus the same. or more. non-taxane chemotherapy (n= 44.000); one anthracycline-based regimen versus another (n= 7000) or versus cyclophosphamide. methotrexate. and fluorouracil (CMF; n= 18.000); and polychemotherapy versus no chemotherapy (n= 32.000). The scheduled dosages of these three drugs and of the anthracyclines doxorubicin (A) and epirubicin (E) were used to define standard CMF. standard 4AC. and CAF and CEF. Log-rank breast cancer mortality rate ratios (RRs) are reported.,True,_Q62CNAAAAAJ:An6A6Jpfc1oC,1086,https://europepmc.org/article/pmc/pmc3273723,6503999388532762942,/scholar?cites=6503999388532762942,,https://europepmc.org/articles/pmc3273723/bin/mmc1.pdf,0,0,0
1093040,Effect of radiotherapy after mastectomy and axillary surgery on 10-year recurrence and 20-year breast cancer mortality: meta-analysis of individual patient data for 8135 women …,2014,Early Breast Cancer Trialists' Collaborative Group,383,The Lancet,,2127-2135,,Postmastectomy radiotherapy was shown in previous meta-analyses to reduce the risks of both recurrence and breast cancer mortality in all women with node-positive disease considered together. However. the benefit in women with only one to three positive lymph nodes is uncertain. We aimed to assess the effect of radiotherapy in these women after mastectomy and axillary dissection.We did a meta-analysis of individual data for 8135 women randomly assigned to treatment groups during 1964-86 in 22 trials of radiotherapy to the chest wall and regional lymph nodes after mastectomy and axillary surgery versus the same surgery but no radiotherapy. Follow-up lasted 10 years for recurrence and to Jan 1. 2009. for mortality. Analyses were stratified by trial. individual follow-up year. age at entry. and pathological nodal status.3786 women had axillary dissection to at least level II and had zero. one to three. or four or more positive nodes. All were in trials in which radiotherapy included the chest wall. supraclavicular or axillary fossa (or both). and internal mammary chain. For 700 women with axillary dissection and no positive nodes. radiotherapy had no significant effect on locoregional recurrence (two-sided significance level [2p]>0·1). overall recurrence (rate ratio [RR]. irradiated vs not. 1·06. 95% CI 0·76-1·48. 2p>0·1). or breast cancer mortality (RR 1·18. 95% CI 0·89-1·55. 2p>0·1). For 1314 women with axillary dissection and one to three positive nodes. radiotherapy reduced locoregional recurrence (2p<0·00001). overall recurrence (RR 0·68. 95% CI 0·57-0·82. 2p=0·00006). and breast cancer mortality (RR 0·80. 95% CI 0·67-0·95. 2p=0·01). 1133 …,True,_Q62CNAAAAAJ:t7zJ5fGR-2UC,1079,https://ora.ox.ac.uk/objects/uuid:6d9697ef-2fa3-4b93-8725-1c2f188a3741,11643664208232530249,/scholar?cites=11643664208232530249,,https://ora.ox.ac.uk/objects/uuid:6d9697ef-2fa3-4b93-8725-1c2f188a3741/download_file?safe_filename=Effect%2Bof%2Bradiotherapy%2Bafter%2Bmastectomy%2Band%2Baxillary%2Bsurgery%2Bon%2B10-year%2Brecurrence%2Band%2B20-year%2Bbreast%2Bcancer%2Bmortality%253B%2Bme.pdf&file_format=application%2Fpdf&type_of_work=Journal+article,0,0,0
1093041,Favourable and unfavourable effects on long-term survival of radiotherapy for early breast cancer: an overview of the randomised trials,2000,Early Breast Cancer Trialists' Collaborative Group,355,,9217,1757-1770,Elsevier,The long-term effects of radiotherapy on mortality from breast cancer and other causes remain uncertain.A meta-analysis was done of 10-year and 20-year results from 40 unconfounded randomised trials of radiotherapy for early breast cancer. It involved central review of individual patients' data on recurrence and cause-specific mortality from 20 000 women. half with “node-positive” disease. Radiotherapy fields generally included not only chest wall (or breast) but also axillary. supraclavicular. and internal mammary nodes.A reduction of approximately two-thirds in local recurrence was seen in all trials. largely independent of the type of patient or type of radiotherapy (8·8% vs 27·2% local recurrence by year 10). Hence. to assess effects on breast cancer mortality of substantially better local control. results from all trials were combined. Breast cancer mortality was reduced (2p=0·0001 …,True,_Q62CNAAAAAJ:tYavs44e6CUC,1032,https://www.sciencedirect.com/science/article/pii/S0140673600022637,3259645576695998364,/scholar?cites=3259645576695998364,,https://journals.viamedica.pl/nowotwory_journal_of_oncology/article/download/53811/40449,0,0,0
1093042,Effects of radiotherapy and surgery in early breast cancer. An overview of the randomized trials,1995,Early Breast Cancer Trialists’ Collaborative Group,333,N Engl j med,22,1444-1455,,Randomized trials of radiotherapy and surgery for early breast cancer may have been too small to detect differences in long-term survival and recurrence reliably. We therefore performed a systematic overview (meta-analysis) of the results of such trials.Information was sought on each subject from investigators who conducted trials that began before 1985 and that compared local therapies for early breast cancer. Data on mortality were available from 36 trials comparing radiotherapy plus surgery with the same type of surgery alone. 10 comparing more-extensive surgery with less-extensive surgery. and 18 comparing more-extensive surgery with less-extensive surgery plus radiotherapy. Information on mortality was available for 28.405 women (97.4 percent of the 29.175 women in the trials).The addition of radiotherapy to surgery resulted in a rate of local recurrence that was three …,True,_Q62CNAAAAAJ:mVmsd5A6BfQC,986,https://www.nejm.org/doi/full/10.1056/NEJM199511303332202,15960622666752951921,/scholar?cites=15960622666752951921,,https://www.nejm.org/doi/full/10.1056/NEJM199511303332202,0,0,0
1093043,Speech and language therapy for aphasia following stroke,2016,Campbell P Brady MC and Kelly H and Godwin J and Enderby P,,Cochrane Database of Systematic Reviews,Iss.6 DOI:10.1002/14651858.CD000425.pub4,,,BackgroundAphasia is an acquired language impairment following brain damage that affects some or all language modalities: expression and understanding of speech. reading. and writing. Approximately one third of people who have a stroke experience aphasia.Objectives,True,_Q62CNAAAAAJ:5qfkUJPXOUwC,908,https://www.cochranelibrary.com/cdsr/doi/10.1002/14651858.CD000425.pub4/abstract,13146843086778854346,/scholar?cites=13146843086778854346,,https://www.cochranelibrary.com/cdsr/doi/10.1002/14651858.CD000425.pub4/full,0,0,0
1093044,Speech and language therapy for aphasia following stroke,2016,Campbell P Brady MC and Kelly H and Godwin J and Enderby P,,Cochrane Database of Systematic Reviews,Issue 6. Art. No.: CD000425. DOI: 10.100,,,BackgroundAphasia is an acquired language impairment following brain damage that affects some or all language modalities: expression and understanding of speech. reading. and writing. Approximately one third of people who have a stroke experience aphasia.Objectives,True,_Q62CNAAAAAJ:ClCfbGk0d_YC,908,https://www.cochranelibrary.com/cdsr/doi/10.1002/14651858.CD000425.pub4/abstract,13146843086778854346,/scholar?cites=13146843086778854346,,https://www.cochranelibrary.com/cdsr/doi/10.1002/14651858.CD000425.pub4/full,0,0,0
