,title,pub_year,author,volume,journal,number,pages,publisher,abstract,filled,author_pub_id,num_citations,pub_url,cites_id,citedby_url,gsrank,author_id,eprint_url,got_citations,got_author_ids,author_ids
1233432,The use of ilmenite as oxygen-carrier in a 500 Wth Chemical-Looping Coal Combustion unit,2011,Ana Cuadrat and A Abad and Francisco García-Labiano and P Gayán and LF De Diego and J Adánez,5,International Journal of Greenhouse Gas Control,6,1630-1642,Elsevier,,True,KtPORRUAAAAJ:HbR8gkJAVGIC,196,,4104291274389681820,/scholar?cites=4104291274389681820,,,,0,0,0
1233433,Carbon Dioxide Capture for Storage in Deep Geologic Formations-Results from the CO2 Capture Project: Vol 1-Capture and Separation of Carbon Dioxide from Combustion. Vol 2 …,2005,David C Thomas and Sally M Benson,,,,,Elsevier,,True,KtPORRUAAAAJ:uWQEDVKXjbEC,186,,12592552165212374276,/scholar?cites=12592552165212374276,,,,0,0,0
1233434,A tale of two market failures: Technology and environmental policy,2005,Adam B Jaffe and Richard G Newell and Robert N Stavins,54,Ecological economics,2-3,164-174,Elsevier,,True,EwWAkHYAAAAJ:9yKSN-GCB0IC,1479,,14274571719872480634,/scholar?cites=14274571719872480634,,,,0,0,0
1233435,The induced innovation hypothesis and energy-saving technological change,1999,Richard G Newell and Adam B Jaffe and Robert N Stavins,114,The Quarterly Journal of Economics,3,941-975,MIT Press,,True,EwWAkHYAAAAJ:u5HHmVD_uO8C,1201,,1011317740363210151,/scholar?cites=1011317740363210151,,,,0,0,0
1233436,Environmental policy and technological change,2002,Adam B Jaffe and Richard G Newell and Robert N Stavins,22,,1,41-70,Kluwer Academic Publishers,,True,EwWAkHYAAAAJ:d1gkVwhDpl0C,1098,,14613545642084145688,/scholar?cites=14613545642084145688,,,,0,0,0
1233437,Environmental and technology policies for climate mitigation,2008,Carolyn Fischer and Richard G Newell,55,Journal of environmental economics and management,2,142-162,Academic Press,,True,EwWAkHYAAAAJ:2osOgNQ5qMEC,1064,,11369965862775610030,/scholar?cites=11369965862775610030,,,,0,0,0
1233438,Energy efficiency economics and policy,2009,Kenneth Gillingham and Richard G Newell and Karen Palmer,1,,1,597-620,Annual Reviews,,True,EwWAkHYAAAAJ:_FxGoFyzp5QC,947,,7682812329118915597,/scholar?cites=7682812329118915597,,,,0,0,0
1233439,Technological change and the environment,2003,Adam B Jaffe and Richard G Newell and Robert N Stavins,1,,,461-516,Elsevier,,True,EwWAkHYAAAAJ:u-x6o8ySG0sC,703,,17784465969018463371,/scholar?cites=17784465969018463371,,,,0,0,0
1233440,Energy. the environment. and technological change,2010,David Popp and Richard G Newell and Adam B Jaffe,2,,,873-937,North-Holland,,True,EwWAkHYAAAAJ:roLk4NBRz8UC,629,,1338529773419460469,/scholar?cites=1338529773419460469,,,,0,0,0
1233441,Discounting the distant future: how much do uncertain rates increase valuations?,2003,Richard G Newell and William A Pizer,46,Journal of environmental economics and management,1,52-71,Academic Press,,True,EwWAkHYAAAAJ:UeHWp8X0CEIC,560,,1753503738893391095,/scholar?cites=1753503738893391095,,,,0,0,0
1233442,Regulating stock externalities under uncertainty,2003,Richard G Newell and William A Pizer,45,Journal of environmental economics and management,2,416-432,Academic Press,,True,EwWAkHYAAAAJ:qjMakFHDy7sC,558,,17609901335306099103,/scholar?cites=17609901335306099103,,,,0,0,0
1233443,Information programs for technology adoption: the case of energy-efficiency audits,2004,Soren T Anderson and Richard G Newell,26,Resource and Energy Economics,1,27-50,North-Holland,,True,EwWAkHYAAAAJ:YsMSGLbcyi4C,547,,13148619325411505577,/scholar?cites=13148619325411505577,,,,0,0,0
1233444,Policy‐induced technology adoption: Evidence from the US lead phasedown,2003,Suzi Kerr and Richard G Newell,51,The Journal of Industrial Economics,3,317-343,Blackwell Publishing,,True,EwWAkHYAAAAJ:IjCSPb-OGe4C,385,,12660163190089846407,/scholar?cites=12660163190089846407,,,,0,0,0
1233445,Fishing quota markets,2005,Richard G Newell and James N Sanchirico and Suzi Kerr,49,Journal of environmental economics and management,3,437-462,Academic Press,,True,EwWAkHYAAAAJ:zYLM7Y9cAGgC,347,,2453360042878874291,/scholar?cites=2453360042878874291,,,,0,0,0
1233446,Prospects for carbon capture and storage technologies,2004,Soren Anderson and Richard Newell,29,,,109-142,Annual Reviews,,True,EwWAkHYAAAAJ:Tyk-4Ss8FVUC,338,,18144085037183747581,/scholar?cites=18144085037183747581,,,,0,0,0
1233447,Energy efficiency policies: a retrospective examination,2006,Kenneth Gillingham and Richard Newell and Karen Palmer,31,,,161-192,Annual Reviews,,True,EwWAkHYAAAAJ:ufrVoPGSRksC,328,,12108689535744381422,/scholar?cites=12108689535744381422,,,,0,0,0
1233448,Designing climate mitigation policy,2010,Joseph E Aldy and Alan J Krupnick and Richard G Newell and Ian WH Parry and William A Pizer,48,Journal of Economic Literature,4,903-34,,,True,EwWAkHYAAAAJ:MXK_kJrjxJIC,317,,7138021753862498476,/scholar?cites=7138021753862498476,,,,0,0,0
1233449,Modeling endogenous technological change for climate policy analysis,2008,Kenneth Gillingham and Richard G Newell and William A Pizer,30,Energy Economics,6,2734-2753,North-Holland,,True,EwWAkHYAAAAJ:LkGwnXOMwfcC,312,,6997602273743856568,/scholar?cites=6997602273743856568,,,,0,0,0
1233450,Determining benefits and costs for future generations,2013,Kenneth Arrow and Maureen Cropper and Christian Gollier and Ben Groom and Geoffrey Heal and Richard Newell and William Nordhaus and Robert Pindyck and William Pizer and Paul Portney and Thomas Sterner and Richard SJ Tol and Martin Weitzman,341,Science,6144,349-350,American Association for the Advancement of Science,,True,EwWAkHYAAAAJ:WqliGbK-hY8C,292,,2062921727327982834,/scholar?cites=2062921727327982834,,,,0,0,0
1233451,Technological change and the environment,2000,Adam B Jaffe and Richard G Newell and Robert N Stavins,,,w7970,,National Bureau of Economic Research,,True,EwWAkHYAAAAJ:DJbcl8HfkQkC,289,,13615866596611588585,/scholar?cites=13615866596611588585,,,,0,0,0
1233452,Nudging energy efficiency behavior: The role of information labels,2014,Richard G Newell and Juha Siikamäki,1,Journal of the Association of Environmental and Resource Economists,4,555-598,University of Chicago Press,,True,EwWAkHYAAAAJ:eq2jaN3J8jMC,284,,1725105701374507440,/scholar?cites=1725105701374507440,,,,0,0,0
1233453,Assessing the energy-efficiency gap,2017,Todd D Gerarden and Richard G Newell and Robert N Stavins,55,Journal of Economic Literature,4,1486-1525,,,True,EwWAkHYAAAAJ:j8SEvjWlNXcC,280,,588598744179310560,/scholar?cites=588598744179310560,,,,0,0,0
1233454,International technology-oriented agreements to address climate change,2008,Heleen De Coninck and Carolyn Fischer and Richard G Newell and Takahiro Ueno,36,Energy Policy,1,335-356,Elsevier,,True,EwWAkHYAAAAJ:W7OEmFMy1HYC,269,,3727706267157387672,/scholar?cites=3727706267157387672,,,,0,0,0
1233455,Cost heterogeneity and the potential savings from market-based policies,2003,Richard G Newell and Robert N Stavins,23,Journal of Regulatory Economics,1,43-59,Kluwer Academic Publishers,,True,EwWAkHYAAAAJ:eQOLeE2rZwMC,253,,14158906806098938731,/scholar?cites=14158906806098938731,,,,0,0,0
1233456,Climate change and forest sinks: factors affecting the costs of carbon sequestration,2000,Richard G Newell and Robert N Stavins,40,Journal of environmental economics and management,3,211-235,Academic Press,,True,EwWAkHYAAAAJ:Y0pCki6q_DkC,250,,957720553507030197,/scholar?cites=957720553507030197,,,,0,0,0
1233457,Carbon markets 15 years after Kyoto: Lessons learned. new challenges,2013,Richard G Newell and William A Pizer and Daniel Raimi,27,Journal of Economic Perspectives,1,123-46,,,True,EwWAkHYAAAAJ:q3oQSFYPqjQC,236,,11223695915662135841,/scholar?cites=11223695915662135841,,,,0,0,0
1233458,Should governments use a declining discount rate in project analysis?,2014,Kenneth J Arrow and Maureen L Cropper and Christian Gollier and Ben Groom and Geoffrey M Heal and Richard G Newell and William D Nordhaus and Robert S Pindyck and William A Pizer and Paul R Portney and Thomas Sterner and Richard SJ Tol and Martin L Weitzman,8,Review of Environmental Economics and Policy,2,145-163,Oxford University Press,,True,EwWAkHYAAAAJ:kzcrU_BdoSEC,224,,10343781039753519226,/scholar?cites=10343781039753519226,,,,0,0,0
1233459,Balancing cost and emissions certainty: An allowance reserve for cap-and-trade,2009,Brian C Murray and Richard G Newell and William A Pizer,3,Review of Environmental Economics and Policy,1,84-103,Oxford University Press,,True,EwWAkHYAAAAJ:Se3iqnhoufwC,223,,6850633447724371774,/scholar?cites=6850633447724371774,,,,0,0,0
1233460,Summary for policymakers,2007,IPCC (Intergovernmental Panel on Climate Change),,,,1-18,Cambridge University Press,,True,1Fp2oo0AAAAJ:RHpTSmoSYBkC,4012,,14763105806003041026,/scholar?cites=14763105806003041026,,,,0,0,0
1233461,Health and climate change: policy responses to protect public health,2015,Nick Watts and W Neil Adger and Paolo Agnolucci and Jason Blackstock and Peter Byass and Wenjia Cai and Sarah Chaytor and Tim Colbourn and Mat Collins and Adam Cooper and Peter M Cox and Joanna Depledge and Paul Drummond and Paul Ekins and Victor Galaz and Delia Grace and Hilary Graham and Michael Grubb and Andy Haines and Ian Hamilton and Alasdair Hunter and Xujia Jiang and Moxuan Li and Ilan Kelman and Lu Liang and Melissa Lott and Robert Lowe and Yong Luo and Georgina Mace and Mark Maslin and Maria Nilsson and Tadj Oreszczyn and Steve Pye and Tara Quinn and My Svensdotter and Sergey Venevsky and Koko Warner and Bing Xu and Jun Yang and Yongyuan Yin and Chaoqing Yu and Qiang Zhang and Peng Gong and Hugh Montgomery and Anthony Costello,386,,10006,1861-1914,Elsevier,,True,1Fp2oo0AAAAJ:fFSKOagxvKUC,1254,,15648596591375677695,/scholar?cites=15648596591375677695,,,,0,0,0
1233462,Routledge Revivals: Kyoto Protocol (1999): A Guide and Assessment,2018,Michael Grubb and Christiaan Vrolijk and Duncan Brack,,,,,Routledge,,True,1Fp2oo0AAAAJ:hCrLmN-GePgC,1228,,15381031576297008946,/scholar?cites=15381031576297008946,,,,0,0,0
1233463,Technical summary,2007,Igor Bashmakov and Leonard Bernstein and JE Bogner and Peter Bosch and Rutu Dave and Ogunlade Davidson and Brian Fisher and Sujata Gupta and Kirsten Halsnaes and Bertjan Heij and Suzana Kahn Ribeiro and Shigeki Kobayashi and Mark Levine and Daniel Martino and Omar Masera Ceruti and Bert Metz and Leo Meyer and Adil Najam Nabuurs and Nebojsa Nakicenovic and Hans Holger Rogner and Joyashree Roy and Jayant Sathaye and Robert Schock and Priyaradshi Shukla and Ralph Sims and Pete Smith and Dennis Tirpak and Diana Urge-Vorsatz,,,,70,Cambridge University Press,,True,1Fp2oo0AAAAJ:q-HalDI95KYC,481,,15069716797967303289,/scholar?cites=15069716797967303289,,,,0,0,0
1233464,The'Earth Summit'Agreements: A Guide and Assessment: An Analysis of the Rio'92 UN Conference on Environment and Development,2019,Michael Grubb and Matthias Koch and Koy Thomson and Francis Sullivan and Abby Munson,9,,,,Routledge,,True,1Fp2oo0AAAAJ:mB3voiENLucC,453,,2307856524250145715,/scholar?cites=2307856524250145715,,,,0,0,0
1233465,Emission budgets and pathways consistent with limiting warming to 1.5 C,2017,Richard J Millar and Jan S Fuglestvedt and Pierre Friedlingstein and Joeri Rogelj and Michael J Grubb and H Damon Matthews and Ragnhild B Skeie and Piers M Forster and David J Frame and Myles R Allen,10,Nature Geoscience,10,741-747,Nature Publishing Group,,True,1Fp2oo0AAAAJ:UeHWp8X0CEIC,410,,551835946587752916,/scholar?cites=551835946587752916,,,,0,0,0
1233466,Allocation and competitiveness in the EU emissions trading scheme: policy overview,2006,Michael Grubb and Karsten Neuhoff,6,Climate Policy,1,7-30,Taylor & Francis Group,,True,1Fp2oo0AAAAJ:5nxA0vEk-isC,410,,1497296398915165194,/scholar?cites=1497296398915165194,,,,0,0,0
1233467,Integrated assessment of climate change: an overview and comparison of approaches and results,1995,John Weyant and Ogunlade Davidson and Hadi Dowlatabadi and Jae Edmonds and Michael Grubb and EA Parson and R Richels and Jan Rotmans and PR Shukla and Richard SJ Tol and William R Cline and Samuel Fankhauser,3,Climate change,,,,,True,1Fp2oo0AAAAJ:evX43VCCuoAC,381,,13242384446462044913,/scholar?cites=13242384446462044913,,,,0,0,0
1233468,The impact of CO2 emissions trading on firm profits and market prices,2006,Robin Smale and Murray Hartley and Cameron Hepburn and John Ward and Michael Grubb,6,Climate Policy,1,31-48,Taylor & Francis Group,The introduction of mandatory controls and a trading scheme covering approximately half of all carbon dioxide emissions across Europe has triggered a debate about the impact of emissions trading on the competitiveness of European industry. Economic theory suggests that. in many sectors. businesses will pass on costs to customers and make net profits due to the impact on product prices combined with the extensive free allocations of allowances. This study applies the Cournot representation of an oligopoly market to five energy-intensive sectors: cement. newsprint. steel. aluminium and petroleum. By populating the model with empirical data. the results are shown for three future emissions price scenarios. The results encompass the extent of cost pass-through to customers. changes in output. changes in UK market share. and changes in firm profits. The results suggest that most participating sectors would be …,True,1Fp2oo0AAAAJ:URolC5Kub84C,375,https://www.tandfonline.com/doi/abs/10.1080/14693062.2006.9685587,10977246706324820216,/scholar?cites=10977246706324820216,,,http://citeseerx.ist.psu.edu/viewdoc/download?doi=10.1.1.383.8725&rep=rep1&type=pdf,0,0,0
1233469,Influence of socioeconomic inertia and uncertainty on optimal CO 2-emission abatement,1997,Minh Ha-Duong and Michael J Grubb and J-C Hourcade,390,Nature,6657,270-273,Nature Publishing Group,Following the United Nations Framework Convention on Climate Change 1. governments will negotiate. in Kyoto this December. an agreement to mitigate anthropogenic greenhouse-gas emissions. Here we use a model approach to examine optimal CO 2-emission abatement paths for specified long-term constraints on atmospheric CO 2 concentrations. Our analysis highlights the interplay of uncertainty (in target greenhouse-gas concentrations) and the inertia in the energy systems that produce CO 2 emissions. We find that the ‘integrated assessment’models previously applied to these issues under-represent inertia. A more appropriate representation of inertia increases the costs of deferring abatement and makes it optimal to spread the effort of abatement across generations. Balancing the costs of early action against the potentially higher costs of more rapid and forced later action. we show that early attention to …,True,1Fp2oo0AAAAJ:l7t_Zn2s7bgC,354,https://www.nature.com/articles/36825,6440153476517190707,/scholar?cites=6440153476517190707,,,https://halshs.archives-ouvertes.fr/halshs-00002452/document,0,0,0
1233470,Auctioning of EU ETS phase II allowances: how and why?,2006,Cameron Hepburn and Michael Grubb and Karsten Neuhoff and Felix Matthes and Maximilien Tse,6,,1,137-160,Taylor & Francis Group,The European Directive on the EU ETS allows governments to auction up to 10% of the allowances issued in phase II 2008–2012. without constraints being specified thereafter. This article reviews and extends the long-standing debate about auctioning. in which economists have generally supported and industries opposed a greater use of auctioning. The article clarifies the key issues by reviewing six ‘traditional’ considerations. examines several credible options for auction design. and then proposes some new issues relevant to auctioning. It is concluded that greater auctioning in aggregate need not increase adverse competitiveness impacts. and could in some respects alleviate them. particularly by supporting border-tax adjustments. Auctioning within the 10% limit might also be used to dampen price volatility during 2008–2012 and. in subsequent periods. it offers the prospect of supporting a long-term price …,True,1Fp2oo0AAAAJ:hkOj_22Ku90C,350,https://www.tandfonline.com/doi/abs/10.1080/14693062.2006.9685592,8622825980015421416,/scholar?cites=8622825980015421416,,,https://www.repository.cam.ac.uk/bitstream/handle/1810/183630/eprg0621.pdf?sequence=1,0,0,0
1233471,Diversity and security in UK electricity generation: The influence of low-carbon objectives,2006,Michael Grubb and Lucy Butler and Paul Twomey,34,Energy policy,18,4050-4062,Elsevier,We explore the relationship between low-carbon objectives and the strategic security of electricity in the context of the UK electricity system. We consider diversity of fuel source mix to represent one dimension of security—robustness against interruptions of any one source—and apply two different diversity indices to the range of electricity system scenarios produced by the UK government and independent researchers. Our results show that low-carbon objectives are uniformly associated with greater long-term diversity in UK electricity generation. With reference to data on wind generation we also consider the impact of source variability on a second dimension of security—the reliability of generation availability. We conclude that this does not undermine our fundamental conclusion that low-carbon scenarios are associated with greater strategic security of supply in UK electricity. We discuss reasons for this result …,True,1Fp2oo0AAAAJ:BrmTIyaxlBUC,346,https://www.sciencedirect.com/science/article/pii/S0301421505002442,7136941317255117275,/scholar?cites=7136941317255117275,,,https://www.repository.cam.ac.uk/bitstream/handle/1810/131626/ep74.pdf;sequence=1,0,0,0
1233472,The costs of limiting fossil-fuel CO2 emissions: a survey and analysis,1993,Michael Grubb and Jae Edmonds and Patrick Ten Brink and Michael Morrison,18,,1,397-478,Annual Reviews,In the late 1 980s. interest flourished in the issue of global climate change. Many studies focussed on the options for limiting anthropogenic emissions of greenhouse-related gases and managing the consequences of global warming and climate change. Making appropriate policy choices requires information on both the costs and benefits. as they occur over time. of policy interventions. and an increasing number of studies have sought to quantify the costs especially of limiting CO2 emissions. as the dominant anthropogenic source. Such analyses now form an important part of overall policy assessments and influence international negotiations on policy re sponses. However. these studies are not well understood. In this paper we seek to analyze the literature on the costs of CO2 abatement. The majority of work in estimating the costs of reducing greenhouse gas emissions has occurred since 1 988. but interest in …,True,1Fp2oo0AAAAJ:j3f4tGmQtD8C,335,https://www.annualreviews.org/doi/pdf/10.1146/annurev.eg.18.110193.002145,2747721405828576874,/scholar?cites=2747721405828576874,,,https://www.annualreviews.org/doi/pdf/10.1146/annurev.eg.18.110193.002145,0,0,0
1233473,The greenhouse effect: negotiating targets,1989,Michael Grubb,,,,,,This paper examines the ensuing debate on international negotiations aimed at limiting emissions of greenhouse gases. particularly carbon dioxide. It maintains that a policy of target reductions in carbon dioxide emissions applied either across the board to developed countries or negotiated on a country-by-country basis is unlikely to succeed. Alternative approaches. which include carbon taxes. production quotas. and systems of tradeable or leasable emission permits are examined. with the latter option being deemed the most promising. The difficulties associated with monitoring of fossil carbon emissions and enforcement of an agreement are not thought to pose major obstacles. More serious is the problem of universality: countries which did not join a carbon abatement protocol stand to gain. Applying carbon taxes on trade with non-participants could be a legitimate and effective sanction against recalcitrant countries. However. an effective carbon abatement agreement will be extremely difficult to achieve and success is far from guaranteed. Alternatives to global agreement include regional accords. agreements between select groups of countries. and agreements on various component activities. Countries can and should also act unilaterally. 9 figs.. 6 tabs.,True,1Fp2oo0AAAAJ:t6usbXjVLHcC,332,https://www.osti.gov/etdeweb/biblio/7172331,7465084343894074306,/scholar?cites=7465084343894074306,,,,0,0,0
1233474,Induced technological change: Exploring its implications for the economics of atmospheric stabilization: Synthesis report from the innovation modeling comparison project,2006,Ottmar Edenhofer and Kai Lessmann and Claudia Kemfert and Michael Grubb and Jonathan Kohler,,The Energy Journal,Special Issue# 1,,International Association for Energy Economics,This paper summarizes results from ten global economy-energy-environment models implementing mechanisms of endogenous technological change (ETC). Climate policy goals represented as different CO2 stabilization levels are imposed. and the contribution of induced technological change (ITC) to meeting the goals is assessed. Findings indicate that climate policy induces additional technological change. in some models substantially. Its effect is a reduction of abatement costs in all participating models. The majority of models calculate abatement costs below 1 percent of present value aggregate gross world product for the period 2000-2100. The models predict different dynamics for rising carbon costs. with some showing a decline in carbon costs towards the end of the century. There are a number of reasons for differences in results between models; however four major drivers of differences are identified. First. the extent of the necessary CO2 reduction which depends mainly on predicted baseline emissions. determines how much a model is challenged to comply with climate policy. Second. when climate policy can offset market distortions. some models show that not costs but benefits accrue from climate policy. Third. assumptions about long-term investment behavior. eg foresight of actors and number of available investment options. exert a major influence. Finally. whether and how options for carbon-free energy are implemented (backstop and end-of-the-pipe technologies) strongly affects both the mitigation strategy and the abatement costs.,True,1Fp2oo0AAAAJ:tYavs44e6CUC,322,https://www.iaee.org/energyjournal/article/2134,18250279093725230431,/scholar?cites=18250279093725230431,,,https://www.iaee.org/en/publications/download-instant.aspx?id=2134,0,0,0
1233475,On the rebound? Feedback between energy intensities and energy uses in IEA countries,2000,Lee Schipper and Michael Grubb,28,Energy policy,6-7,367-388,Elsevier,The interaction or feedback between energy efficiencies or energy intensities and energy use has long been the topic of debate. Some have argued that energy efficiency improvements. by reducing energy intensities and therefore lowering the cost of energy services. would lead to 'rebound’ effects offsetting much or all of any initial savings in energy. In this paper we analyse historical data on energy use. efficiency and pricing in different sectors to try and identify 'rebounds'. For the period of our data (since about 1970) we show that key measures of activity (car use. manufacturing output and structure. house area. etc.) have changed little in response to changes in energy prices or efficiency. instead continuing their long-term evolution relative to GDP or other driving factors. While our analysis cannot disentangle more macro-level economic feedbacks in a detailed way. we show indirectly that such effects also …,True,1Fp2oo0AAAAJ:HtS1dXgVpQUC,315,https://www.sciencedirect.com/science/article/pii/S0301421500000185,15334211591075877584,/scholar?cites=15334211591075877584,,,https://www.researchgate.net/profile/Michael_Grubb/publication/222955316_On_the_Rebound_Feedback_Between_Energy_Intensities_and_Energy_Uses_in_IEA_Countries/links/58ac7aac92851c3cfda05432/On-the-Rebound-Feedback-Between-Energy-Intensities-and-Energy-Uses-in-IEA-Countries.pdf,0,0,0
1233476,Planetary economics,2014,Michael Grubb and Jean-Charles Hourcade and Karsten Neuhoff,,,,,Routledge,"Page 1. Source: Grubb. Hourcade. and Neuhoff. (2014): Planetary Economics: energy. climate
change and the three domains of sustainable development. Routledge Michael Grubb With
Jean-Charles Hourcade and Karsten Neuhoff Routledge/Taylor & Frances. Published March
2014 Energy. Climate Change and the Three Domains of Sustainable Development Planetary
Economics http://www.routledge.com/books/details/9780415518826/ Page 2. Source: Grubb.
Hourcade. and Neuhoff. (2014): Planetary Economics: energy. climate change and the three
domains of sustainable development. Routledge • Nature of the energy challenge • The Three
Domains and Three Pillars of Policy • System key components • Pillar I: Standards and
Engagement • Pillar II: Markets and Pricing • Pillar III: Strategic investment • Growth theory and
macroeconomic linkages • Policy Integration • Joint Benefits … 
",True,1Fp2oo0AAAAJ:u5HHmVD_uO8C,301,http://climatestrategies.org/wp-content/uploads/2014/11/Planetary-economics-slides-complete.pdf,14818484044167184888,/scholar?cites=14818484044167184888,,,http://climatestrategies.org/wp-content/uploads/2014/11/Planetary-economics-slides-complete.pdf,0,0,0
