,title,pub_year,author,volume,journal,number,pages,publisher,abstract,filled,author_pub_id,num_citations,pub_url,cites_id,citedby_url,author_id,eprint_url,got_citations,got_author_ids,author_ids
1093124,A map of human genome variation from population-scale sequencing,2010,1000 Genomes Project Consortium,467,Nature,7319,1061,Nature Publishing Group,The 1000 Genomes Project aims to provide a deep characterization of human genome sequence variation as a foundation for investigating the relationship between genotype and phenotype. Here we present results of the pilot phase of the project. designed to develop and compare different strategies for genome-wide sequencing with high-throughput platforms. We undertook three projects: low-coverage whole-genome sequencing of 179 individuals from four populations; high-coverage sequencing of two mother–father–child trios; and exon-targeted sequencing of 697 individuals from seven populations. We describe the location. allele frequency and local haplotype structure of approximately 15 million single nucleotide polymorphisms. 1 million short insertions and deletions. and 20.000 structural variants. most of which were previously undescribed. We show that. because we have catalogued the vast majority …,True,GhG6JNIAAAAJ:L_l9e5I586QC,7306,https://www.nature.com/articles/nature09534,2802397011957847088,/scholar?cites=2802397011957847088,,https://www.nature.com/articles/nature09534,0,0,0
1093125,A core gut microbiome in obese and lean twins,2009,Peter J Turnbaugh and Micah Hamady and Tanya Yatsunenko and Brandi L Cantarel and Alexis Duncan and Ruth E Ley and Mitchell L Sogin and William J Jones and Bruce A Roe and Jason P Affourtit and Michael Egholm and Bernard Henrissat and Andrew C Heath and Rob Knight and Jeffrey I Gordon,457,nature,7228,480-484,Nature Publishing Group,The human distal gut harbours a vast ensemble of microbes (the microbiota) that provide important metabolic capabilities. including the ability to extract energy from otherwise indigestible dietary polysaccharides 1. 2. 3. 4. 5. 6. Studies of a few unrelated. healthy adults have revealed substantial diversity in their gut communities. as measured by sequencing 16S rRNA genes 6. 7. 8. yet how this diversity relates to function and to the rest of the genes in the collective genomes of the microbiota (the gut microbiome) remains obscure. Studies of lean and obese mice suggest that the gut microbiota affects energy balance by influencing the efficiency of calorie harvest from the diet. and how this harvested energy is used and stored 3. 4. 5. Here we characterize the faecal microbial communities of adult female monozygotic and dizygotic twin pairs concordant for leanness or obesity. and their mothers. to address how host …,True,GhG6JNIAAAAJ:qjMakFHDy7sC,6668,https://www.nature.com/articles/nature07540?free=2,15042888981956720419,/scholar?cites=15042888981956720419,,https://www.ncbi.nlm.nih.gov/pmc/articles/PMC2677729/?source=post_page---------------------------,0,0,0
1093126,Sequence-selective recognition of DNA by strand displacement with a thymine-substituted polyamide,1991,Peter E Nielsen and Michael Egholm and Rolf H Berg and Ole Buchardt,254,Science,5037,1497-1500,American Association for the Advancement of Science,A polyamide nucleic acid (PNA) was designed by detaching the deoxyribose phosphate backbone of DNA in a computer model and replacing it with an achiral polyamide backbone. On the basis of this model. oligomers consisting of thymine-linked aminoethylglycyl units were prepared. These oligomers recognize their complementary target in double-stranded DNA by strand displacement. The displacement is made possible by the extraordinarily high stability of the PNA-DNA hybrids. The results show that the backbone of DNA can be replaced by a polyamide. with the resulting oligomer retaining base-specific hybridization.,True,GhG6JNIAAAAJ:u-x6o8ySG0sC,4040,https://science.sciencemag.org/content/254/5037/1497.abstract,17945453802649839071,/scholar?cites=17945453802649839071,,,0,0,0
1093127,A draft sequence of the Neandertal genome,2010,Richard E Green and Johannes Krause and Adrian W Briggs and Tomislav Maricic and Udo Stenzel and Martin Kircher and Nick Patterson and Heng Li and Weiwei Zhai and Markus Hsi-Yang Fritz and Nancy F Hansen and Eric Y Durand and Anna-Sapfo Malaspinas and Jeffrey D Jensen and Tomas Marques-Bonet and Can Alkan and Kay Prüfer and Matthias Meyer and Hernán A Burbano and Jeffrey M Good and Rigo Schultz and Ayinuer Aximu-Petri and Anne Butthof and Barbara Höber and Barbara Höffner and Madlen Siegemund and Antje Weihmann and Chad Nusbaum and Eric S Lander and Carsten Russ and Nathaniel Novod and Jason Affourtit and Michael Egholm and Christine Verna and Pavao Rudan and Dejana Brajkovic and Željko Kucan and Ivan Gušic and Vladimir B Doronichev and Liubov V Golovanova and Carles Lalueza-Fox and Marco De La Rasilla and Javier Fortea and Antonio Rosas and Ralf W Schmitz and Philip LF Johnson and Evan E Eichler and Daniel Falush and Ewan Birney and James C Mullikin and Montgomery Slatkin and Rasmus Nielsen and Janet Kelso and Michael Lachmann and David Reich and Svante Pääbo,328,science,5979,710-722,American Association for the Advancement of Science,Neandertals. the closest evolutionary relatives of present-day humans. lived in large parts of Europe and western Asia before disappearing 30.000 years ago. We present a draft sequence of the Neandertal genome composed of more than 4 billion nucleotides from three individuals. Comparisons of the Neandertal genome to the genomes of five present-day humans from different parts of the world identify a number of genomic regions that may have been affected by positive selection in ancestral modern humans. including genes involved in metabolism and in cognitive and skeletal development. We show that Neandertals shared more genetic variants with present-day humans in Eurasia than with present-day humans in sub-Saharan Africa. suggesting that gene flow from Neandertals into the ancestors of non-Africans occurred before the divergence of Eurasian groups from each other.,True,GhG6JNIAAAAJ:WF5omc3nYNoC,3603,https://science.sciencemag.org/content/328/5979/710.abstract,10966607706205543632,/scholar?cites=10966607706205543632,,https://www.ncbi.nlm.nih.gov/pmc/articles/pmc5100745/,0,0,0
1093128,PNA hybridizes to complementary oligonucleotides obeying the Watson–Crick hydrogen-bonding rules,1993,Michael Egholm and Ole Buchardt and Leif Christensen and Carsten Behrens and Susan M Freier and David A Driver and Rolf H Berg and Seog K Kim and Bengt Norden and Peter E Nielsen,365,Nature,6446,566-568,Nature Publishing Group,DNA ANALOGUES are currently being intensely investigated owing to their potential as gene-targeted drugs 1–3. Furthermore. their properties and interaction with DNA and RNA could provide a better understanding of the structural features of natural DNA that determine its unique chemical. biological and genetic properties 3. 4. We recently designed a DNA analogue. PNA. in which the backbone is structurally homomorphous with the deoxyribose backbone and consists of N-(2-aminoethyl) glycine units to which the nucleobases are attached 5–9. We showed that PNA oligomers containing solely thymine and cytosine can hybridize to complementary oligonucleotides. presumably by forming Watson–Crick–Hoogsteen (PNA) 2–DNA triplexes. which are much more stable than the corresponding DNA–DNA duplexes 5–7. and bind to double-stranded DNA by strand displacement 5. 8. We report here that PNA …,True,GhG6JNIAAAAJ:d1gkVwhDpl0C,2477,https://www.nature.com/articles/365566a0,9156740276030391193,/scholar?cites=9156740276030391193,,,0,0,0
1093129,The tomato genome sequence provides insights into fleshy fruit evolution,2012,Tomato Genome Consortium,485,Nature,7400,635,Nature Publishing Group,Tomato (Solanum lycopersicum) is a major crop plant and a model system for fruit development. Solanum is one of the largest angiosperm genera 1 and includes annual and perennial plants from diverse habitats. Here we present a high-quality genome sequence of domesticated tomato. a draft sequence of its closest wild relative. Solanum pimpinellifolium 2. and compare them to each other and to the potato genome (Solanum tuberosum). The two tomato genomes show only 0.6% nucleotide divergence and signs of recent admixture. but show more than 8% divergence from potato. with nine large and several smaller inversions. In contrast to Arabidopsis. but similar to soybean. tomato and potato small RNAs map predominantly to gene-rich chromosomal regions. including gene promoters. The Solanum lineage has experienced two consecutive genome triplications: one that is ancient and shared with rosids. and …,True,GhG6JNIAAAAJ:0N-VGjzr574C,2304,https://www.nature.com/articles/nature11119,16714121217574039026,/scholar?cites=16714121217574039026,,https://www.nature.com/articles/nature11119,0,0,0
1093130,The complete genome of an individual by massively parallel DNA sequencing,2008,David A Wheeler and Maithreyan Srinivasan and Michael Egholm and Yufeng Shen and Lei Chen and Amy McGuire and Wen He and Yi-Ju Chen and Vinod Makhijani and G Thomas Roth and Xavier Gomes and Karrie Tartaro and Faheem Niazi and Cynthia L Turcotte and Gerard P Irzyk and James R Lupski and Craig Chinault and Xing-zhi Song and Yue Liu and Ye Yuan and Lynne Nazareth and Xiang Qin and Donna M Muzny and Marcel Margulies and George M Weinstock and Richard A Gibbs and Jonathan M Rothberg,452,nature,7189,872-876,Nature Publishing Group,The association of genetic variation with disease and drug response. and improvements in nucleic acid technologies. have given great optimism for the impact of ‘genomic medicine’. However. the formidable size of the diploid human genome 1. approximately 6 gigabases. has prevented the routine application of sequencing methods to deciphering complete individual human genomes. To realize the full potential of genomics for human health. this limitation must be overcome. Here we report the DNA sequence of a diploid genome of a single individual. James D. Watson. sequenced to 7.4-fold redundancy in two months using massively parallel sequencing in picolitre-size reaction vessels. This sequence was completed in two months at approximately one-hundredth of the cost of traditional capillary electrophoresis methods. Comparison of the sequence to the reference genome led to the identification of 3.3 million …,True,GhG6JNIAAAAJ:9yKSN-GCB0IC,2147,https://www.nature.com/articles/nature06884,13898321755780626842,/scholar?cites=13898321755780626842,,https://www.nature.com/articles/nature06884,0,0,0
1093131,A metagenomic survey of microbes in honey bee colony collapse disorder,2007,Diana L Cox-Foster and Sean Conlan and Edward C Holmes and Gustavo Palacios and Jay D Evans and Nancy A Moran and Phenix-Lan Quan and Thomas Briese and Mady Hornig and David M Geiser and Vince Martinson and Abby L Kalkstein and Andrew Drysdale and Jeffrey Hui and Junhui Zhai and Liwang Cui and Stephen K Hutchison and Jan Fredrik Simons and Michael Egholm and Jeffery S Pettis and W Ian Lipkin,318,Science,5848,283-287,American Association for the Advancement of Science,In colony collapse disorder (CCD). honey bee colonies inexplicably lose their workers. CCD has resulted in a loss of 50 to 90% of colonies in beekeeping operations across the United States. The observation that irradiated combs from affected colonies can be repopulated with naive bees suggests that infection may contribute to CCD. We used an unbiased metagenomic approach to survey microflora in CCD hives. normal hives. and imported royal jelly. Candidate pathogens were screened for significance of association with CCD by the examination of samples collected from several sites over a period of 3 years. One organism. Israeli acute paralysis virus of bees. was strongly correlated with CCD.,True,GhG6JNIAAAAJ:Y0pCki6q_DkC,1873,https://science.sciencemag.org/content/318/5848/283.abstract,895205886777063161,/scholar?cites=895205886777063161,,https://pubag.nal.usda.gov/download/26475/PDF,0,0,0
1093132,The genome of the domesticated apple (Malus× domestica Borkh.),2010,Riccardo Velasco and Andrey Zharkikh and Jason Affourtit and Amit Dhingra and Alessandro Cestaro and Ananth Kalyanaraman and Paolo Fontana and Satish K Bhatnagar and Michela Troggio and Dmitry Pruss and Silvio Salvi and Massimo Pindo and Paolo Baldi and Sara Castelletti and Marina Cavaiuolo and Giuseppina Coppola and Fabrizio Costa and Valentina Cova and Antonio Dal Ri and Vadim Goremykin and Matteo Komjanc and Sara Longhi and Pierluigi Magnago and Giulia Malacarne and Mickael Malnoy and Diego Micheletti and Marco Moretto and Michele Perazzolli and Azeddine Si-Ammour and Silvia Vezzulli and Elena Zini and Glenn Eldredge and Lisa M Fitzgerald and Natalia Gutin and Jerry Lanchbury and Teresita Macalma and Jeff T Mitchell and Julia Reid and Bryan Wardell and Chinnappa Kodira and Zhoutao Chen and Brian Desany and Faheem Niazi and Melinda Palmer and Tyson Koepke and Derick Jiwan and Scott Schaeffer and Vandhana Krishnan and Changjun Wu and Vu T Chu and Stephen T King and Jessica Vick and Quanzhou Tao and Amy Mraz and Aimee Stormo and Keith Stormo and Robert Bogden and Davide Ederle and Alessandra Stella and Alberto Vecchietti and Martin M Kater and Simona Masiero and Pauline Lasserre and Yves Lespinasse and Andrew C Allan and Vincent Bus and David Chagné and Ross N Crowhurst and Andrew P Gleave and Enrico Lavezzo and Jeffrey A Fawcett and Sebastian Proost and Pierre Rouzé and Lieven Sterck and Stefano Toppo and Barbara Lazzari and Roger P Hellens and Charles-Eric Durel and Alexander Gutin and Roger E Bumgarner and Susan E Gardiner and Mark Skolnick and Michael Egholm and Yves Van de Peer and Francesco Salamini and Roberto Viola,42,Nature genetics,10,833-839,Nature Publishing Group,We report a high-quality draft genome sequence of the domesticated apple (Malus× domestica). We show that a relatively recent (> 50 million years ago) genome-wide duplication (GWD) has resulted in the transition from nine ancestral chromosomes to 17 chromosomes in the Pyreae. Traces of older GWDs partly support the monophyly of the ancestral paleohexaploidy of eudicots. Phylogenetic reconstruction of Pyreae and the genus Malus. relative to major Rosaceae taxa. identified the progenitor of the cultivated apple as M. sieversii. Expansion of gene families reported to be involved in fruit development may explain formation of the pome. a Pyreae-specific false fruit that develops by proliferation of the basal part of the sepals. the receptacle. In apple. a subclade of MADS-box genes. normally involved in flower and fruit development. is expanded to include 15 members. as are other gene families involved in …,True,GhG6JNIAAAAJ:hC7cP41nSMkC,1847,https://www.nature.com/articles/ng.654,10259389962636488805,/scholar?cites=10259389962636488805,,,0,0,0
1093133,Comprehensive human genome amplification using multiple displacement amplification,2002,Frank B Dean and Seiyu Hosono and Linhua Fang and Xiaohong Wu and A Fawad Faruqi and Patricia Bray-Ward and Zhenyu Sun and Qiuling Zong and Yuefen Du and Jing Du and Mark Driscoll and Wanmin Song and Stephen F Kingsmore and Michael Egholm and Roger S Lasken,99,Proceedings of the National Academy of Sciences,8,5261-5266,National Academy of Sciences,Fundamental to most genetic analysis is availability of genomic DNA of adequate quality and quantity. Because DNA yield from human samples is frequently limiting. much effort has been invested in developing methods for whole genome amplification (WGA) by random or degenerate oligonucleotide-primed PCR. However. existing WGA methods like degenerate oligonucleotide-primed PCR suffer from incomplete coverage and inadequate average DNA size. We describe a method. termed multiple displacement amplification (MDA). which provides a highly uniform representation across the genome. Amplification bias among eight chromosomal loci was less than 3-fold in contrast to 4–6 orders of magnitude for PCR-based WGA methods. Average product length was >10 kb. MDA is an isothermal. strand-displacing amplification yielding about 20–30 μg product from as few as 1–10 copies of human genomic DNA …,True,GhG6JNIAAAAJ:2osOgNQ5qMEC,1570,https://www.pnas.org/content/99/8/5261.short,4820127829510177974,/scholar?cites=4820127829510177974,,https://www.pnas.org/content/pnas/99/8/5261.full.pdf,0,0,0
1093134,Paired-end mapping reveals extensive structural variation in the human genome,2007,Jan O Korbel and Alexander Eckehart Urban and Jason P Affourtit and Brian Godwin and Fabian Grubert and Jan Fredrik Simons and Philip M Kim and Dean Palejev and Nicholas J Carriero and Lei Du and Bruce E Taillon and Zhoutao Chen and Andrea Tanzer and AC Eugenia Saunders and Jianxiang Chi and Fengtang Yang and Nigel P Carter and Matthew E Hurles and Sherman M Weissman and Timothy T Harkins and Mark B Gerstein and Michael Egholm and Michael Snyder,318,Science,5849,420-426,American Association for the Advancement of Science,Structural variation of the genome involves kilobase- to megabase-sized deletions. duplications. insertions. inversions. and complex combinations of rearrangements. We introduce high-throughput and massive paired-end mapping (PEM). a large-scale genome-sequencing method to identify structural variants (SVs) ∼3 kilobases (kb) or larger that combines the rescue and capture of paired ends of 3-kb fragments. massive 454 sequencing. and a computational approach to map DNA reads onto a reference genome. PEM was used to map SVs in an African and in a putatively European individual and identified shared and divergent SVs relative to the reference genome. Overall. we fine-mapped more than 1000 SVs and documented that the number of SVs among humans is much larger than initially hypothesized; many of the SVs potentially affect gene function. The breakpoint junction sequences of more than 200 …,True,GhG6JNIAAAAJ:IjCSPb-OGe4C,1321,https://science.sciencemag.org/content/318/5849/420.abstract,15637137196902417514,/scholar?cites=15637137196902417514,,https://www.ncbi.nlm.nih.gov/pmc/articles/PMC2674581/,0,0,0
1093135,Peptide nucleic acids,1996,Peter E Nielsen and Ole Buchardt and Michael Egholm and Rolf H Berg,,,,,,Priority date (The priority date is an assumption and is not a legal conclusion. Google has not performed a legal analysis and makes no representation as to the accuracy of the date listed.) 1993-04-26,True,GhG6JNIAAAAJ:YsMSGLbcyi4C,1179,https://patents.google.com/patent/US5539082A/en,15744515192117755240,/scholar?cites=15744515192117755240,,,0,0,0
1093136,Peptide nucleic acids (PNA). Oligonucleotide analogs with an achiral peptide backbone,1992,Michael Egholm and Ole Buchardt and Peter E Nielsen and Rolf H Berg,114,Journal of the American Chemical Society,5,1895-1897,American Chemical Society,ArbMB282 [l (l+ l)]/[3A: 7jl+ 73exp (A£/E7) j](Nm. monoradical amount). and by counting the exact spin amount of the signal with a reference TANOL. both A* b and AE were determined to be 3.9 X 1020 molecules/mol and ca. 0.5 kcal/mol. respectively. This thermally-accessible triplet has a smaller AE value compared with that of the triplet first described. suggesting a weaker spin-spin interaction. The observed Nb value indicates an unusually large biradical contribution of 0.07% to the ground state of 2.30 This molecule is unique as a closed-shell system. Indeed. twodifferent spin-spin interactions occur in the single microcrystallines of 2: one is the strong interactionwith AE= ca. 1.3 kcal/mol.| Z)']= 93. and|£ 1= 7.4 G. and the other one is comparatively weaker (AE= ca. 0.5 kcal/mol and\D\= ca. 5 G). It is concluded that the interactions are inter-and intramolecular. respectively. in view of the observation of onlythe\D]= ca …,True,GhG6JNIAAAAJ:UeHWp8X0CEIC,1150,https://pubs.acs.org/doi/abs/10.1021/ja00031a062,14845256083227843336,/scholar?cites=14845256083227843336,,,0,0,0
1093137,Rare variants of IFIH1. a gene implicated in antiviral responses. protect against type 1 diabetes,2009,Sergey Nejentsev and Neil Walker and David Riches and Michael Egholm and John A Todd,324,Science,5925,387-389,American Association for the Advancement of Science,Genome-wide association studies (GWASs) are regularly used to map genomic regions contributing to common human diseases. but they often do not identify the precise causative genes and sequence variants. To identify causative type 1 diabetes (T1D) variants. we resequenced exons and splice sites of 10 candidate genes in pools of DNA from 480 patients and 480 controls and tested their disease association in over 30.000 participants. We discovered four rare variants that lowered T1D risk independently of each other (odds ratio = 0.51 to 0.74; P = 1.3 × 10–3 to 2.1 × 10–16) in IFIH1 (interferon induced with helicase C domain 1). a gene located in a region previously associated with T1D by GWASs. These variants are predicted to alter the expression and structure of IFIH1 [MDA5 (melanoma differentiation-associated protein 5)]. a cytoplasmic helicase that mediates induction of interferon response to viral RNA …,True,GhG6JNIAAAAJ:roLk4NBRz8UC,996,https://science.sciencemag.org/content/324/5925/387.abstract,15543088834736130849,/scholar?cites=15543088834736130849,,https://www.ncbi.nlm.nih.gov/pmc/articles/PMC2707798/,0,0,0
1093138,Analysis of one million base pairs of Neanderthal DNA,2006,Richard E Green and Johannes Krause and Susan E Ptak and Adrian W Briggs and Michael T Ronan and Jan F Simons and Lei Du and Michael Egholm and Jonathan M Rothberg and Maja Paunovic and Svante Pääbo,444,Nature,7117,330-336,Nature Publishing Group,Neanderthals are the extinct hominid group most closely related to contemporary humans. so their genome offers a unique opportunity to identify genetic changes specific to anatomically fully modern humans. We have identified a 38.000-year-old Neanderthal fossil that is exceptionally free of contamination from modern human DNA. Direct high-throughput sequencing of a DNA extract from this fossil has thus far yielded over one million base pairs of hominoid nuclear DNA sequences. Comparison with the human and chimpanzee genomes reveals that modern human and Neanderthal DNA sequences diverged on average about 500.000 years ago. Existing technology and fossil resources are now sufficient to initiate a Neanderthal genome-sequencing effort.,True,GhG6JNIAAAAJ:Tyk-4Ss8FVUC,913,https://www.nature.com/articles/nature05336,961277705515373977,/scholar?cites=961277705515373977,,http://bioinformatica.uab.es/base/documents%5CmasterGP%5CNeandertalGenome.pdf,0,0,0
1093139,Stability of peptide nucleic acids in human serum and cellular extracts,1994,Vadim V Demidov and Vladimir N Potaman and MD Frank-Kamenetskil and Michael Egholm and Ole Buchard and Søren H Sönnichsen and Peter E Nlelsen,48,Biochemical pharmacology,6,1310-1313,Elsevier,The stability of a new type of DNA mimic. peptide nucleic acid (PNA) in human blood serum. Eschericia coli and Micrococcus luteus extracts and nuclear and cytoplasmic extracts from mouse Ehrlich ascites tumor cells was investigated using HPLC analysis. Under conditions that caused complete cleavage of a control peptide. adrenocorticotropic hormone fragment 4-10. no significant degradation of the PNAs. H-T10-LysNH2 and H-TGTACGTCACAACTA-NH2. could be detected. Similarly. PNA H-T5-LysNH2 was found to resist attack by fungal proteinase K or porcine intestinal mucosa peptidase at concentrations exceeding those necessary to completely degrade a control peptide. H-Phe-Trp-Tyr-Cys-Phe-Trp-Tyr-Lys-Phe-Trp-Tyr-Lys-OH. by at least 1000- and 30-fold. respectively. Thus PNA is expected to have sufficient biostability to be used as a drug.,True,GhG6JNIAAAAJ:zYLM7Y9cAGgC,800,https://www.sciencedirect.com/science/article/pii/0006295294901716,15568283966466886750,/scholar?cites=15568283966466886750,,,0,0,0
1093140,A new arenavirus in a cluster of fatal transplant-associated diseases,2008,Gustavo Palacios and Julian Druce and Lei Du and Thomas Tran and Chris Birch and Thomas Briese and Sean Conlan and Phenix-Lan Quan and Jeffrey Hui and John Marshall and Jan Fredrik Simons and Michael Egholm and Christopher D Paddock and Wun-Ju Shieh and Cynthia S Goldsmith and Sherif R Zaki and Mike Catton and W Ian Lipkin,358,New England journal of medicine,10,991-998,Massachusetts Medical Society,Three patients who received visceral-organ transplants from a single donor on the same day died of a febrile illness 4 to 6 weeks after transplantation. Culture. polymerase-chain-reaction (PCR) and serologic assays. and oligonucleotide microarray analysis for a wide range of infectious agents were not informative.We evaluated RNA obtained from the liver and kidney transplant recipients. Unbiased high-throughput sequencing was used to identify microbial sequences not found by means of other methods. The specificity of sequences for a new candidate pathogen was confirmed by means of culture and by means of PCR. immunohistochemical. and serologic analyses.High-throughput sequencing yielded 103.632 sequences. of which 14 represented an Old World arenavirus. Additional sequence analysis showed that this new arenavirus was related to lymphocytic …,True,GhG6JNIAAAAJ:KlAtU1dfN6UC,685,https://www.nejm.org/doi/full/10.1056/NEJMoa073785,17852019704390915313,/scholar?cites=17852019704390915313,,https://www.nejm.org/doi/full/10.1056/NEJMoa073785,0,0,0
