,title,pub_year,author,volume,journal,number,pages,publisher,abstract,filled,author_pub_id,num_citations,pub_url,cites_id,citedby_url,author_id,eprint_url,got_citations,got_author_ids,author_ids
1093236,Photocurrent generation in polymer-fullerene bulk heterojunctions,2004,VD Mihailetchi and LJA Koster and JC Hummelen and PWM Blom,93,Physical review letters,21,216601,American Physical Society,The photocurrent in conjugated polymer-fullerene blends is dominated by the dissociation efficiency of bound electron-hole pairs at the donor-acceptor interface. A model based on Onsager's theory of geminate charge recombination explains the observed field and temperature dependence of the photocurrent in P P V∶ P C B M blends. At room temperature only 60% of the generated bound electron-hole pairs are dissociated and contribute to the short-circuit current. which is a major loss mechanism in photovoltaic devices based on this material system.,True,AGM4TKkAAAAJ:eQOLeE2rZwMC,938,https://journals.aps.org/prl/abstract/10.1103/PhysRevLett.93.216601,11574192000577610673,/scholar?cites=11574192000577610673,,https://www.academia.edu/download/44330686/Photocurrent_Generation_in_Polymer-Fulle20160402-32306-116f68c.pdf,0,0,0
1093237,Organic photovoltaics: materials. device physics. and manufacturing technologies,2011,Christoph Brabec and Ullrich Scherf and Vladimir Dyakonov,,,,,John Wiley & Sons,Providing complementary viewpoints from academia as well as technology companies. this book covers the three most important aspects of successful device design: materials. device physics. and manufacturing technologies. It also offers an insight into commercialization concerns. such as packaging technologies. system integration. reel-to-reel large scale manufacturing issues and production costs. With an introduction by Nobel Laureate Alan Heeger.,True,AGM4TKkAAAAJ:DyXnQzXoVgIC,928,http://books.google.com/books?hl=en&lr=&id=DSGQi34Q36wC&oi=fnd&pg=PR5&dq=info:XIqBx-uGMQ4J:scholar.google.com&ots=N-wbgYYUvN&sig=Rw7LewgAm2Iuf0EQV1WFkXBPdUg,1022746937612405340,/scholar?cites=1022746937612405340,,https://cds.cern.ch/record/1613203/files/9783527316755_TOC.pdf,0,0,0
1093238,High‐performance polymer solar cells of an alternating polyfluorene copolymer and a fullerene derivative,2003,Mattias Svensson and Fengling Zhang and Sjoerd C Veenstra and Wiljan JH Verhees and Jan C Hummelen and Jan M Kroon and Olle Inganäs and Mats R Andersson,15,Advanced Materials,12,988-991,WILEY‐VCH Verlag,Solar cells prepared using the alternating copolymer shown in the Figure blended with a C60 derivative (PCBM) are demonstrated to have a high performance. with a power conversion efficiency of 2.2 % under simulated solar light. The molecular weight of the polymer is low due to limited solubility. and films of the polymer exhibit red‐shifted absorption.,True,AGM4TKkAAAAJ:IjCSPb-OGe4C,872,https://onlinelibrary.wiley.com/doi/abs/10.1002/adma.200304150,5546465895204319975,/scholar?cites=5546465895204319975,,https://www.academia.edu/download/45618745/High-Performance_Polymer_Solar_Cells_of_20160514-3673-b4n59f.pdf,0,0,0
1093239,Influence of nanomorphology on the photovoltaic action of polymer–fullerene composites,2004,Dana Chirvase and Jürgen Parisi and Jan C Hummelen and Vladimir Dyakonov,15,Nanotechnology,9,1317,IOP Publishing,Composites of conjugated poly (3-hexylthiophene)(P3HT) and the fullerene derivative [6. 6]-phenyl-C 61 butyric acid methyl ester (PCBM) demonstrate an efficient photogeneration of mobile charge carriers. Thermal annealing of P3HT: PCBM based devices gives rise to a significant increase of the photovoltaic efficiency. as follows from measurements of the external quantum efficiency and the current–voltage characteristics. Upon annealing. the absorption spectrum of the P3HT: PCBM composite undergoes a strong modification. whereas in the pure components it remains unchanged. The absorption of the annealed blends becomes stronger and red shifted in the wavelength region ascribed to P3HT. while the absorption due to the PCBM contribution does not change. Atomic force microscope measurements on P3HT: PCBM disclose some variation in morphology due to the crystallization of PCBM. The …,True,AGM4TKkAAAAJ:Tyk-4Ss8FVUC,869,https://iopscience.iop.org/article/10.1088/0957-4484/15/9/035/meta,5473075498401893547,/scholar?cites=5473075498401893547,,https://core.ac.uk/download/pdf/148195864.pdf,0,0,0
1093240,Relating the Morphology of Poly(p‐phenylene vinylene)/Methanofullerene Blends to Solar‐Cell Performance,2004,Jeroen KJ van Duren and Xiaoniu Yang and Joachim Loos and Corrie WT Bulle‐Lieuwma and Alexander B Sieval and Jan C Hummelen and René AJ Janssen,14,Advanced Functional Materials,5,425-434,WILEY‐VCH Verlag,The performance of bulk‐heterojunction solar cells based on a phase‐separated mixture of donor and acceptor materials is known to be critically dependent on the morphology of the active layer. Here we use a combination of techniques to resolve the morphology of spin cast films of poly(p‐phenylene vinylene)/methanofullerene blends in three dimensions on a nanometer scale and relate the results to the performance of the corresponding solar cells. Atomic force microscopy (AFM). transmission electron microscopy (TEM). and depth profiling using dynamic time‐of‐flight secondary ion mass spectrometry (TOF‐SIMS) clearly show that for the two materials used in this study. 1‐(3‐methoxycarbonyl)propyl‐1‐phenyl‐[6.6]‐methanofullerene (PCBM) and poly[2‐methoxy‐5‐(3′.7′‐dimethyloctyloxy)‐1.4‐phenylene vinylene] (MDMO‐PPV). phase separation is not observed up to 50 wt.‐% PCBM. Nanoscale phase …,True,AGM4TKkAAAAJ:W7OEmFMy1HYC,782,https://onlinelibrary.wiley.com/doi/abs/10.1002/adfm.200305049,12344681004458760590,/scholar?cites=12344681004458760590,,https://www.ntmdt-si.ru/data/media/files/publications/db/AdvFuncMater_photovoltaics_Loos_Phase.pdf,0,0,0
1093241,Tracing photoinduced electron transfer process in conjugated polymer/fullerene bulk heterojunctions in real time,2001,Christoph J Brabec and Gerald Zerza and Giulio Cerullo and Sandro De Silvestri and Silvia Luzzati and Jan C Hummelen and Serdar Sariciftci,340,Chemical Physics Letters,3-4,232-236,North-Holland,Ultrafast spectroscopic studies using an optical excitation of a conjugated polymer by sub-10-fs pulses are reported. Phonon modes which are strongly coupled to the electronic excitation of the conjugated polymer are directly observed as coherent oscillations during the pump–probe experiment. mirroring the resonant/nonresonant Raman spectrum of the conjugated polymer. In composites of a conjugated polymer with a fullerene the primary photoexcitation is found to be an ultrafast photoinduced electron transfer. We are able to time resolve for the first time the kinetics of this charge transfer process with a forward transfer time of around τct∼45 fs.,True,AGM4TKkAAAAJ:YsMSGLbcyi4C,777,https://www.sciencedirect.com/science/article/pii/S0009261401004316,17825011463256706166,/scholar?cites=17825011463256706166,,https://core.ac.uk/download/pdf/148149776.pdf,0,0,0
1093242,Small Bandgap Polymers for Organic Solar Cells (Polymer Material Development in the Last 5 Years),2008,Renee Kroon and Martijn Lenes and Jan C Hummelen and Paul WM Blom and Bert De Boer,48,,3,531-582,Taylor & Francis Group,During the last decade the field of polymer photovoltaics has seen a tremendous improvement in both device efficiency and understanding of the underlying physical processes. One has come to a point in which the prototypical large bandgap material system P3HT:PCBM is nearing optimal device performance. In order to enhance efficiencies even further. research activities for new materials are needed with better aligned energy levels. One interesting approach is by narrowing the donor bandgap to enhance light absorption. Recent developments on small band gap (<2.0 eV) materials for photovoltaic applications are reviewed. First. an introduction is given regarding the processes governing the exciton dissociation. charge transport requirements. energy level engineering of both donor and acceptor materials. and other parameters determining the photovoltaic performance. The focus is on polymeric donor …,True,AGM4TKkAAAAJ:_FxGoFyzp5QC,767,https://www.tandfonline.com/doi/abs/10.1080/15583720802231833,12690328503936039104,/scholar?cites=12690328503936039104,,https://www.researchgate.net/profile/Renee_Kroon/publication/41883422_Small_Bandgap_Polymers_for_Organic_Solar_Cells_Polymer_Material_Development_in_the_Last_5_Years/links/0c960519f7ecf3451b000000.pdf,0,0,0
1093243,Broadband dye-sensitized upconversion of near-infrared light,2012,Wenqiang Zou and Cindy Visser and Jeremio A Maduro and Maxim S Pshenichnikov and Jan C Hummelen,6,Nature Photonics,8,560,Nature Publishing Group,Photon upconversion of near-infrared photons is a promising way to overcome the Shockley–Queisser efficiency limit of 32% of a single-junction solar cell. However. the practical applicability of the most efficient known upconversion materials at moderate light intensities is limited by their extremely weak and narrowband near-infrared absorption. Here. we introduce the concept of an upconversion material where an organic near-infrared dye is used as an antenna for the β-NaYF 4: Yb. Er nanoparticles in which the upconversion occurs. The overall upconversion by the dye-sensitized nanoparticles is dramatically enhanced (by a factor of∼ 3.300) as a result of increased absorptivity and overall broadening of the absorption spectrum of the upconverter. The proposed concept can be extended to cover any part of the solar spectrum by using a set of dye molecules with overlapping absorption spectra acting as an …,True,AGM4TKkAAAAJ:tOudhMTPpwUC,754,https://www.nature.com/articles/nphoton.2012.158.pdf?origin=ppub,16448939267373900644,/scholar?cites=16448939267373900644,,http://www.fatecsp.br/paginas/destaques/nphoton.2012.158.pdf,0,0,0
1093244,Electron transport in a methanofullerene,2003,Valentin D Mihailetchi and Jeroen KJ van Duren and Paul WM Blom and Jan C Hummelen and René AJ Janssen and Jan M Kroon and Minze T Rispens and Wil Jan H Verhees and Martijn M Wienk,13,Advanced Functional Materials,1,43-46,WILEY‐VCH Verlag,The current–voltage characteristics of methanofullerene [6.6]‐phenyl C61‐butyric acid methyl ester (PCBM)‐based devices are investigated as a function of temperature. The occurrence of space–charge limited current enables a direct determination of the electron mobility. At room temperature. an electron mobility of μe = 2 × 10–7 m2 V–1 s–1 has been obtained. This electron mobility is more than three orders of magnitude larger than the hole mobility of donor‐type conjugated polymer poly(2‐methoxy‐5‐(3′.7′‐dimethyloctyloxy)‐p‐phenylene vinylene) (OC1C10‐PPV). As a result. the dark current in PCBM/OC1C10‐PPV based devices is completely dominated by electrons. The observed field and temperature‐dependence of the electron mobility of PCBM can be described with a Gaussian disorder model. This provides information about the energetic disorder and average transport‐site separation in …,True,AGM4TKkAAAAJ:ufrVoPGSRksC,741,https://onlinelibrary.wiley.com/doi/abs/10.1002/adfm.200390004,8447181968084296969,/scholar?cites=8447181968084296969,,https://www.ecn.nl/publicaties/PdfFetch.aspx?nr=ECN-RX--03-007,0,0,0
1093245,Fullerene bisadducts for enhanced open‐circuit voltages and efficiencies in polymer solar cells,2008,Martijn Lenes and Gert‐Jan AH Wetzelaer and Floris B Kooistra and Sjoerd C Veenstra and Jan C Hummelen and Paul WM Blom,20,Advanced Materials,11,2116-2119,WILEY‐VCH Verlag,A fullerene bisadduct can enhance the efficiency of polymer: fullerene bulk heterojunction solar cells. The bisadduct has a LUMO that is 100 meV higher compared to that of [6. 6]‐phenyl C 61 butyric acid methyl ester (PCBM). This increases the open‐circuit voltage of polymer: fullerene bulk heterojunction solar cells based on poly (3‐hexylthio phene) and bisadduct PCBM to 0.73 V. while maintaining high fill factors and currents.,True,AGM4TKkAAAAJ:LkGwnXOMwfcC,682,https://onlinelibrary.wiley.com/doi/abs/10.1002/adma.200702438,9140021149739615404,/scholar?cites=9140021149739615404,,https://publications.tno.nl/publication/34633291/932JHh/w08015.pdf,0,0,0
1093246,Isolation of the heterofullerene C59N as its dimer (C59N) 2,1995,Jan C Hummelen and Brian Knight and James Pavlovich and Rosario González and Fred Wudl,269,Science,5230,1554-1556,American Association for the Advancement of Science,The heterofullerene ion C59N+ is formed efficiently in the gas phase during fast atom bombardment mass spectroscopy of a cluster-opened N-MEM (N-methoxyethoxy methyl) ketolactam. This transformation is shown to occur also in solution in the presence of strong acid. affording biazafullerenyl (C59N)2 in good yield. It is proposed that the azafullerene dimer is formed upon in situ reduction of the highly reactive azafulleronium ion. The isolation and characterization of biazafullerenyl opens a viable route for the preparation of other heterofullerenes in solution.,True,AGM4TKkAAAAJ:zYLM7Y9cAGgC,659,https://science.sciencemag.org/content/269/5230/1554.abstract,7376324368153076299,/scholar?cites=7376324368153076299,,https://www.rug.nl/research/portal/files/3620734/1995HummelenScience.pdf,0,0,0
1093247,A low‐bandgap semiconducting polymer for photovoltaic devices and infrared emitting diodes,2002,Christoph J Brabec and Christoph Winder and N Serdar Sariciftci and Jan C Hummelen and Anantharaman Dhanabalan and Paul A van Hal and René AJ Janssen,12,Advanced Functional Materials,10,709-712,WILEY‐VCH Verlag,A novel low‐bandgap conjugated polymer (PTPTB. Eg = ∼ 1.6 eV). consisting of alternating electron‐rich N‐dodecyl‐2.5‐bis(2′‐thienyl)pyrrole (TPT) and electron‐deficient 2.1.3‐benzothiadiazole (B) units. is introduced for thin‐film optoelectronic devices working in the near infrared (NIR). Bulk heterojunction photovoltaic cells from solid‐state composite films of PTPTB with the soluble fullerene derivative [6.6]‐phenyl C61 butyric acid methyl ester (PCBM) as an active layer shows promising power conversion efficiencies up to 1 % under AM1.5 illumination. Furthermore. electroluminescent devices (light‐emitting diodes) from thin films of pristine PTPTB show near infrared emission peaking at 800 nm with a turn on voltage below 4 V. The electroluminescence can be significantly enhanced by sensitization of this material with a wide bandgap material such as the poly(p‐phenylene vinylene) derivative MDMO …,True,AGM4TKkAAAAJ:WF5omc3nYNoC,656,https://onlinelibrary.wiley.com/doi/abs/10.1002/1616-3028(20021016)12:10%3C709::AID-ADFM709%3E3.0.CO;2-N,8553393537232528857,/scholar?cites=8553393537232528857,,https://core.ac.uk/download/pdf/148149762.pdf,0,0,0
1093248,Accurate measurement of the exciton diffusion length in a conjugated polymer using a heterostructure with a side-chain cross-linked fullerene layer,2005,Denis E Markov and Emiel Amsterdam and Paul WM Blom and Alexander B Sieval and Jan C Hummelen,109,The Journal of Physical Chemistry A,24,5266-5274,American Chemical Society,Exciton diffusion and photoluminescence quenching in conjugated polymer/fullerene heterostructures are studied by time-resolved photoluminescence. It is observed that heterostructures consisting of a spin-coated poly(p-phenylene vinylene) (PPV)-based derivative and evaporated C60 are ill-defined because of diffusion of C60 into the polymer. leading to an overestimation of the exciton diffusion length. This artifact is resolved by the use of a novel. thermally side-chain polymerizing and cross-linking fullerene derivative (F2D) containing two diacetylene moieties. forming a completely immobilized electron acceptor layer. With this heterostructure test system. an exciton diffusion length of 5 ± 1 nm is derived for this PPV derivative from time-integrated luminescence quenching data. ,True,AGM4TKkAAAAJ:hqOjcs7Dif8C,529,https://pubs.acs.org/doi/abs/10.1021/jp0509663,15318987663145357556,/scholar?cites=15318987663145357556,,https://core.ac.uk/download/pdf/232398382.pdf,0,0,0
1093249,Polymer photovoltaic cells with conducting polymer anodes,2002,Fengling Zhang and Mikael Johansson and Mats R Andersson and Jan C Hummelen and Olle Inganäs,14,Advanced Materials,9,662-665,WILEY‐VCH Verlag Gmbh,Conducting polymer anodes for photovoltaic cells based on polyethylendioxythiophene (PEDOT) and its derivatives (see Figure) are reported. The results presented here show that it is feasible to use processable conducting (macro)molecular materials instead of indium tin oxide (ITO) for fabricating polymer photovoltaic cells. which could lead to lower cost and more mechanically flexible devices.,True,AGM4TKkAAAAJ:roLk4NBRz8UC,519,https://onlinelibrary.wiley.com/doi/abs/10.1002/1521-4095(20020503)14:9%3C662::AID-ADMA662%3E3.0.CO;2-N,6152279613438079236,/scholar?cites=6152279613438079236,,https://www.rug.nl/research/portal/files/3621121/2002AdvMaterZhang.pdf,0,0,0
1093250,Effect of temperature and illumination on the electrical characteristics of polymer–fullerene bulk‐heterojunction solar cells,2004,Ingo Riedel and Jürgen Parisi and Vladimir Dyakonov and Laurence Lutsen and Dirk Vanderzande and Jan C Hummelen,14,Advanced Functional Materials,1,38-44,WILEY‐VCH Verlag,The current–voltage characteristics of ITO/PEDOT:PSS/OC1C10‐PPV:PCBM/Al solar cells were measured in the temperature range 125–320 K under variable illumination. between 0.03 and 100 mW cm–2 (white light). with the aim of determining the efficiency‐limiting mechanism(s) in these devices. and the temperature and/or illumination range(s) in which these devices demonstrate optimal performance. (ITO: indium tin oxide; PEDOT:PSS: poly(styrene sulfonate)‐doped poly(ethylene dioxythiophene); OC1C10‐PPV: poly[2‐methoxy‐5‐(3.7‐dimethyl octyloxy)‐1.4‐phenylene vinylene]; PCBM: phenyl‐C61 butyric acid methyl ester.) The short‐circuit current density and the fill factor grow monotonically with temperature until 320 K. This is indicative of a thermally activated transport of photogenerated charge carriers. influenced by recombination with shallow traps. A gradual increase of the open‐circuit voltage …,True,AGM4TKkAAAAJ:4DMP91E08xMC,517,https://onlinelibrary.wiley.com/doi/abs/10.1002/adfm.200304399,3973936098863117478,/scholar?cites=3973936098863117478,,https://core.ac.uk/download/pdf/148213318.pdf,0,0,0
1093251,Increasing the open circuit voltage of bulk-heterojunction solar cells by raising the LUMO level of the acceptor,2007,Floris B Kooistra and Joop Knol and Fredrik Kastenberg and Lacramioara M Popescu and Wiljan JH Verhees and Jan M Kroon and Jan C Hummelen,9,Organic Letters,4,551-554,American Chemical Society,We report the synthesis. characterization. and electrochemical properties of ten new fullerene derivatives for usage in organic solar cells. The phenyl ring of PCBM was substituted with electron-donating and electron-withdrawing substituents to study their influence on the LUMO level of the parent fullerene. We varied the LUMO level over a range of 86 mV and show a small but significant change of the open circuit voltage upon application in MDMO−PPV:methanofullerene bulk-heterojunction photovoltaic cells. ,True,AGM4TKkAAAAJ:Se3iqnhoufwC,485,https://pubs.acs.org/doi/abs/10.1021/ol062666p,4186330925785558263,/scholar?cites=4186330925785558263,,,0,0,0
1093252,Observation of quantum interference in molecular charge transport,2012,Constant M Guédon and Hennie Valkenier and Troels Markussen and Kristian S Thygesen and Jan C Hummelen and Sense Jan Van Der Molen,7,Nature nanotechnology,5,305-309,Nature Publishing Group,As the dimensions of a conductor approach the nanoscale. quantum effects begin to dominate. and it becomes possible to control the conductance through direct manipulation of the electron wavefunction. Such control has been demonstrated in various mesoscopic devices at cryogenic temperatures 1. 2. 3. 4. but it has proved to be difficult to exert control over the wavefunction at higher temperatures. Molecules have typical energy level spacings (∼ eV) that are much larger than the thermal energy at 300 K (∼ 25 meV). and are therefore natural candidates for such experiments. Previously. phenomena such as giant magnetoresistance 5. Kondo effects 6 and conductance switching 7. 8. 9. 10. 11 have been observed in single molecules. and theorists have predicted that it should also be possible to observe quantum interference in molecular conductors 12. 13. 14. 15. 16. 17. 18. but until now all the evidence for …,True,AGM4TKkAAAAJ:dshw04ExmUIC,416,https://www.nature.com/articles/nnano.2012.37,12895535558235553804,/scholar?cites=12895535558235553804,,https://arxiv.org/pdf/1108.4357,0,0,0
1093253,Selective gas adsorption and separation in metal–organic frameworks,2009,Jian-Rong Li and Ryan J Kuppler and Hong-Cai Zhou,38,,5,1477-1504,Royal Society of Chemistry,Adsorptive separation is very important in industry. Generally. the process uses porous solid materials such as zeolites. activated carbons. or silica gels as adsorbents. With an ever increasing need for a more efficient. energy-saving. and environmentally benign procedure for gas separation. adsorbents with tailored structures and tunable surface properties must be found. Metal–organic frameworks (MOFs). constructed by metal-containing nodes connected by organic bridges. are such a new type of porous materials. They are promising candidates as adsorbents for gas separations due to their large surface areas. adjustable pore sizes and controllable properties. as well as acceptable thermal stability. This critical review starts with a brief introduction to gas separation and purification based on selective adsorption. followed by a review of gas selective adsorption in rigid and flexible MOFs. Based on possible …,True,KcunmsYAAAAJ:u5HHmVD_uO8C,6685,https://pubs.rsc.org/en/content/articlehtml/2009/cs/b802426j,3053104834265190042,/scholar?cites=3053104834265190042,,,0,0,0
1093254,Metal–organic frameworks for separations,2012,Jian-Rong Li and Julian Sculley and Hong-Cai Zhou,112,,2,869-932,American Chemical Society,Over the last at least three decades. the science of porous solid materials has become one of the most intense areas of study for chemists. physicists. and materials scientists. These materials have found a large number of applications in many fields. such as adsorption. separation and purification. as well as catalysis. 1. 2 Porous solids acting as adsorbents or membrane fillers are playing key roles in separations and purifications of various chemicals that we encounter in our daily activities. directly or indirectly. Explorations of advanced porous materials for these applications are therefore an intense subject of scientific research. MetalÀorganic frameworks (MOFs). a new class of porous solid materials. emerged approximately two decades ago and have since quickly developed into a fruitful research field. 3À7 Exploring their performances for applications in separations and,True,KcunmsYAAAAJ:9yKSN-GCB0IC,5133,https://pubs.acs.org/doi/abs/10.1021/cr200190s,12802282021203969415,/scholar?cites=12802282021203969415,,,0,0,0
1093255,Carbon dioxide capture-related gas adsorption and separation in metal-organic frameworks,2011,Jian-Rong Li and Yuguang Ma and M Colin McCarthy and Julian Sculley and Jiamei Yu and Hae-Kwon Jeong and Perla B Balbuena and Hong-Cai Zhou,255,,15-16,1791-1823,Elsevier,Reducing anthropogenic CO2 emission and lowering the concentration of greenhouse gases in the atmosphere has quickly become one of the most urgent environmental issues of our age. Carbon capture and storage (CCS) is one option for reducing these harmful CO2 emissions. While a variety of technologies and methods have been developed. the separation of CO2 from gas streams is still a critical issue. Apart from establishing new techniques. the exploration of capture materials with high separation performance and low capital cost are of paramount importance. Metal-organic frameworks (MOFs). a new class of crystalline porous materials constructed by metal-containing nodes bonded to organic bridging ligands hold great potential as adsorbents or membrane materials in gas separation. In this paper. we review the research progress (from experimental results to molecular simulations) in MOFs for CO2 …,True,KcunmsYAAAAJ:qjMakFHDy7sC,1782,https://www.sciencedirect.com/science/article/pii/S0010854511000701,6354762495547255253,/scholar?cites=6354762495547255253,,https://www.academia.edu/download/42656177/Carbon_dioxide_capture-related_gas_adsor20160213-15097-1mnf96c.pdf,0,0,0
1093256,Potential applications of metal-organic frameworks,2009,Ryan J Kuppler and Daren J Timmons and Qian-Rong Fang and Jian-Rong Li and Trevor A Makal and Mark D Young and Daqiang Yuan and Dan Zhao and Wenjuan Zhuang and Hong-Cai Zhou,253,,23-24,3042-3066,Elsevier,Metal-organic frameworks have received much attention in recent years especially as newly developed porous materials. As such. they possess a wide array of potential applications including materials for gas storage. gas/vapor separation. catalysis. luminescence. and drug delivery. In the review. these potential applications of metal-organic frameworks are examined and an outlook will be proposed.,True,KcunmsYAAAAJ:d1gkVwhDpl0C,1494,https://www.sciencedirect.com/science/article/pii/S0010854509001271,2232833627083915195,/scholar?cites=2232833627083915195,,,0,0,0
