,title,pub_year,author,volume,journal,number,pages,publisher,abstract,filled,author_pub_id,num_citations,pub_url,cites_id,citedby_url,author_id,eprint_url,got_citations
29836,Results of a high-resolution genome screen of 437 Alzheimer's disease families,2003,Deborah Blacker and Lars Bertram and Aleister J Saunders and Thomas J Moscarillo and Marilyn S Albert and Howard Wiener and Rodney T Perry and Julianne S Collins and Lindy E Harrell and Rodney CP Go and Amy Mahoney and Terri Beaty and M Danielle Fallin and Dimitrios Avramopoulos and Gary A Chase and Marshal F Folstein and Melvin G McInnis and Susan S Bassett and Kimberly J Doheny and Elizabeth W Pugh and Rudolph E Tanzi,12,Human Molecular Genetics,1,23-32,Oxford University Press,Alzheimer's disease (AD) is a devastating neurodegenerative disorder of late life with complex inheritance. Mutations in three known genes lead to the rare early-onset autosomal dominant form of AD. while a common polymorphism (ε4) in the gene encoding apolipoprotein E (APOE ) is a risk factor for more typical late-onset (>60 years) AD. A recent study concluded that there are up to four additional genes with an equal or greater contribution to the disease. We performed a 9 cM genome screen of 437 families with AD. the full National Institute of Mental Health (NIMH) sample. which has been carefully ascertained. evaluated and followed by our group over the last decade. Performing standard parametric and non-parametric linkage analyses. we observed a ‘highly significant’ linkage peak by Lander and Kruglyak criteria on chromosome 19q13. which probably represents APOE. Twelve additional locations …,True,3JsfnzsAAAAJ:fFSKOagxvKUC,417,https://academic.oup.com/hmg/article-abstract/12/1/23/623762,3853711051579913175,/scholar?cites=3853711051579913175,,https://academic.oup.com/hmg/article/12/1/23/623762,0
29837,Reliability and validity of NINCDS-ADRDA criteria for Alzheimer's disease: the National Institute of Mental Health Genetics Initiative,1994,Deborah Blacker and Marilyn S Albert and Susan S Bassett and Rodney CP Go and Lindy E Harrell and Marshai F Folstein,51,Archives of neurology,12,1198-1204,American Medical Association,To assess interrater reliability and validity of NINCDS-ADRDA (National Institute of Neurological and Communicative Diseases and Stroke/Alzheimer's Disease and Related Disorders Association) criteria for Alzheimer's disease (AD).A multisite reliability and validity study in which clinicians from each site diagnosed 60 case summaries yielding a preconsensus estimate of reliability and validity. A consensus conference was conducted for each disagreement. leading to a postconsensus estimate of validity. The criterion standard was a diagnosis of AD by autopsy.Three academic medical centers.A convenience sample of 60 detailed case summaries. 40 with AD and 20 with other dementing disorders.The κ coefficient. sensitivity. and specificity.The κ coefficient for preconsensus agreement on a diagnosis of probable or possible AD vs non-AD was 0 …,True,3JsfnzsAAAAJ:XDrR66g3YHsC,333,https://jamanetwork.com/journals/jamaneurology/article-abstract/593178,10555091019112299870,/scholar?cites=10555091019112299870,,,0
29838,25-Hydroxyvitamin D. dementia. and cerebrovascular pathology in elders receiving home services,2010,JS Buell and B Dawson-Hughes and TM Scott and DE Weiner and GE Dallal and WQ Qui and P Bergethon and IH Rosenberg and Marshal F Folstein and S Patz and RA Bhadelia and KL Tucker,74,Neurology,1,18-26,Wolters Kluwer Health. Inc. on behalf of the American Academy of Neurology,Background: Vitamin D deficiency has potential adverse effects on neurocognitive health and subcortical function. However. no studies have examined the association between vitamin D status. dementia. and cranial MRI indicators of cerebrovascular disease (CVD).Methods: Cross-sectional investigation of 25-hydroxyvitamin D [25(OH)D]. dementia. and MRI measures of CVD in elders receiving home care (aged 65–99 years) from 2003 to 2007.Results: Among 318 participants. the mean age was 73.5 ± 8.1 years. 231 (72.6%) were women. and 109 (34.3%) were black. 25(OH)D concentrations were deficient (<10 ng/mL) in 14.5% and insufficient (10–20 ng/mL) in 44.3% of participants. There were 76 participants (23.9%) with dementia. 41 of which were classified as probable AD. Mean 25(OH)D concentrations were lower in subjects with dementia (16.8 vs 20.0 ng/mL. p < 0.01). There was a higher prevalence of …,True,3JsfnzsAAAAJ:nVrZBo8bIpAC,321,https://n.neurology.org/content/74/1/18.short,1117439850549145030,/scholar?cites=1117439850549145030,,https://www.ncbi.nlm.nih.gov/pmc/articles/PMC2809024/,0
29839,Familial Alzheimer dementia: a prevalent disorder with specific clinical features,1984,John CS Breitner and Marshal F Folstein,14,Psychological medicine,1,63-80,Cambridge University Press,The early literature on Alzheimer Dementia (AD) describes the clinical features aphasia. apraxia and agraphia as characteristic. We investigated the hypothesis that these features would specifically identify the familial form of AD (FAD). Since pedigree studies had suggested that FAD is an autosomal dominant genetic disorder. we hypothesized that the first-degree relatives of language-disordered or apractic AD probands would show at least 50% lifetime risks of dementia. Using standardized methods. we screened 3500 nursing home beds for stringently defined AD cases and controls. tested for agraphia. and obtained probands' clinical and family histories from multiple informants. Language disorder and apraxia were found in 78% of AD cases. They strongly predicted familial aggregation of dementia. with a 90-year lifetime incidence among relatives exceeding 50%. or 7 times the control values. The results …,True,3JsfnzsAAAAJ:HeT0ZceujKMC,318,https://www.cambridge.org/core/journals/psychological-medicine/article/familial-alzheimer-dementia-a-prevalent-disorder-with-specific-clinical-features/AEAAE4CBA9D057116BA7FB3F626B4838,5295526965905879309,/scholar?cites=5295526965905879309,,,0
29840,The prevalence and management of dementia and other psychiatric disorders in nursing homes,1990,Barry W Rovner and Pearl S German and Jeremy Broadhead and Richard K Morriss and Larry J Brant and Jane Blaustein and Marshal F Folstein,2,International Psychogeriatrics,1,13-24,Cambridge University Press,The prevalence of psychiatric disorders among new admissions to nursing homes is unknown. Such data are needed to estimate the psychiatric needs of this population. We report the prevalence of specific psychiatric disorders in 454 consecutive new nursing home admissions who were evaluated by psychiatrists and diagnosed according to the Diagnostic and Statistical Manual of Mental Disorders. third edition. revised. Eighty percent had a psychiatric disorder. The commonest were dementia syndromes (67.4%) and affective disorders (10%). Also. 40% of demented patients had additional psychiatric syndromes such as delusions or depression. and these patients constituted a distinct subgroup that predicted frequent use of restraints and neuroleptics. and the greatest consumption of nursing time. These data demonstrate that the majority of nursing home residents have psychiatric disorders on admission. and …,True,3JsfnzsAAAAJ:yqoGN6RLRZoC,307,https://www.cambridge.org/core/journals/international-psychogeriatrics/article/prevalence-and-management-of-dementia-and-other-psychiatric-disorders-in-nursing-homes/D5569D26878EE91F02B5A8A02300E45B,8860010336549472947,/scholar?cites=8860010336549472947,,,0
29841,Psychiatric syndromes of Huntington's chorea: a clinical and phenomenologic study,1975,Paul R McHugh and Marshal F Folstein,1,Psychiatric aspects of neurologic disease,,367-286,Grune and Stratton New York,We report our detailed observations on the psychologic symptoms of eight patients with Huntington's chorea. The symptoms cluster into two clearly recognizable syndromes:(1) a progressive dementia syndrome afflicting all the patients and (2) an intermittent affective disorder afflicting a majority of the patients. A few schizophrenic-like symptoms occur in Huntington's chorea. One patient of ours had an hallucinatory-delusionary state that was most like schizophrenia. It could have been instead an atypical affective change. The issues of paranoid features and personality change are discussed and exemplified in our patients. The possibility that Huntington's chorea may represent degeneration of one of the ascending. transmitter-specific pathways is suggested and briefly discussed in the light of the particular psychiatric symptoms found in this disorder.In his original description of Huntington's chorea. 10 George Huntington made''insanity with a tendency to suicide''one of three distinguishing characteristics of the illness. along with the facts that it is hereditary and that it first appears in adulthood. Subsequent students of the disease have confirmed Huntington's observation but noted that several different mental disturbances occur in these patients; a dementia syndrome. 8 psychotic symptoms variously labeled schizoid. paranoid. or depressive. 2'3'6and personality changes. 4'17'27 The clinical descriptions of these disturbances. however. are usually brief.,True,3JsfnzsAAAAJ:KbBQZpvPDL4C,307,http://scholar.google.com/scholar?cluster=15882101378133315070&hl=en&oi=scholarr,15882101378133315070,/scholar?cites=15882101378133315070,,,0
29842,Depression and Alzheimer's disease,1989,Barry W Rovner and Jeremy Broadhead and Miriam Spencer and Kathryn Carson and Marshal F Folstein,146,Am J Psychiatry,3,350-353,,METHODThe sample consisted of 144 consecutive outpatients referred to the Johns Hopkins Alzheimer’s Disease Research Center from July 1985 to October 1986 who met the criteria of the National Institute of Neurolog-ical and Communicative Disorders and Stroke (NINCDS)(2) for probable(88%) or possible(12%) Alzheimen’s disease. All 144 patients also met the DSM-III-R criteria for primary degenerative dementia. A technician(MS) used a semistructuned method to obtain from each patient a detailed history of the onset of dementia. its wonkup. current and past medical problems. current medications. and past psychiatric history. Dependency in activities of daily living was quantified by using the Psychogeniatnic Dependency Rating Scales (12). and cognitive impairment was quantified by using the Mini-Mental State examination (13).,True,3JsfnzsAAAAJ:In6cVmBjs0IC,306,http://citeseerx.ist.psu.edu/viewdoc/download?doi=10.1.1.469.869&rep=rep1&type=pdf,127707545291079470,/scholar?cites=127707545291079470,,http://citeseerx.ist.psu.edu/viewdoc/download?doi=10.1.1.469.869&rep=rep1&type=pdf,0
29843,Psychosis and physical aggression in probable Alzheimer's disease.,1991,Lynn H Deutsch and Frederick W Bylsma and Barry W Rovner and Cynthia Steele and Marshall F Folstein,,The American journal of psychiatry,,,American Psychiatric Assn,Assessed the frequency and type of psychotic symptoms in 181 clinic patients with probable Alzheimer's disease and tested whether there was a relationship between specific psychotic symptoms and episodes of physical aggression. On the basis of Ss' charts. the presence of delusions. hallucinations. misidentifications. and episodes of physical aggression was determined. Delusions had been reported for 74 Ss and were the most frequent psychotic symptom; persecutory delusions were the most common type. Physical aggression had been noted for 50 Ss. Delusions and misidentifications frequently preceded and were significantly associated with episodes of physical aggression. The presence of delusions was a significant predictor of physical aggression but accounted for only 3.5% of the variance. Delusions were a risk factor for physical aggression in Ss who have moderate to severe cognitive impairment …,True,3JsfnzsAAAAJ:LhH-TYMQEocC,302,https://psycnet.apa.org/record/1992-02181-001,17193478511812367192,/scholar?cites=17193478511812367192,,,0
29844,Delirium and dementia: diagnostic criteria and fatality rates,1982,Peter V Rabins,140,The British Journal of Psychiatry,2,149-153,Cambridge University Press,Medically ill patients diagnosed at index admission as delirious. i.e.. suffering cognitive decline and an altered state of consciousness. had higher fatality rates than demented. cognitively intact or depressed patients. At a one-year follow-up the death rate of those who had been delirious was still higher than that of demented patients. Delirious patients were more likely to have a diffusely slow EEG. tachycardia and hyperthermia and lower mean systolic and diastolic blood pressure. These results validate the distinction between delirium and dementia and the importance of alteration of consciousness as a defining characteristic of delirium.,True,3JsfnzsAAAAJ:r_AWSJRzSzQC,302,https://www.cambridge.org/core/journals/the-british-journal-of-psychiatry/article/delirium-and-dementia-diagnostic-criteria-and-fatality-rates/C92E4443DA20806562D306EB4889608B,11275543975707356967,/scholar?cites=11275543975707356967,,,0
29845,Functional status and quality of life measurement among ophthalmic patients,1994,Ingrid U Scott and Oliver D Schein and Sheila West and Karen Bandeen-Roche and Cheryl Enger and Marshal F Folstein,112,Archives of Ophthalmology,3,329-335,American Medical Association,Assessment of the relationship between visual function and functional status/quality of life in clinical research involving patients with eye disease by investigating whether the scores of four existing functional status/quality of life patient questionnaires are sensitive to differences in visual acuity and studying whether selected subscales of the questionnaires provide similar information concerning the relationship between functional status/quality of life and visual acuity as do the respective full-length questionnaires.Case patients consisted of 86 consecutive patients seen at The Wilmer Ophthalmological Institute Retinal Vascular Center. Baltimore. Md. Controls consisted of 51 individuals with normal visual acuity and no known ocular disease and were frequency-matched to the case patients by age (±5 years). sex. and race. Subjects were interviewed in person using each of the …,True,3JsfnzsAAAAJ:a3BOlSfXSfwC,301,https://jamanetwork.com/journals/jamaophthalmology/article-abstract/640589,11497071035066234309,/scholar?cites=11497071035066234309,,,0
29846,A randomized trial of dementia care in nursing homes,1996,Barry W Rovner and Cynthia D Steele and Yochi Shmuely and Marshal F Folstein,44,Journal of the American Geriatrics Society,1,7-13,Blackwell Publishing Ltd,OBJECTIVE: To evaluate the efficacy of a dementia care program to reduce behavior disorders in nursing home patients with dementia.DESIGN: Randomized controlled clinical trial with 6‐month follow‐up.SETTING: A 250‐bed community nursing home.PATIENTS: The nursing home was screened to identify patients with dementia and behavior disorders. A total of 118 patients were eligible for randomization. Of these. 89 (75.4%) were randomized. and 81 of these (91.0%) completed the trial.INTERVENTION: The A.G.E. dementia care program consisted of Activities. Guidelines for psychotropic medications. and Educational rounds. The control treatment was usual nursing home care.MEASUREMENTS: Behavior disorders. antipsychotic drug and physical restraint use. patient activity levels. and cognitive and functional status.RESULTS: After 6 months. 12 of 42 (28.6%) intervention patients exhibited behavior …,True,3JsfnzsAAAAJ:OP4eGU-M3BUC,298,https://onlinelibrary.wiley.com/doi/abs/10.1111/j.1532-5415.1996.tb05631.x,2927233186128853549,/scholar?cites=2927233186128853549,,,0
29847,The homocysteine hypothesis of depression,2007,Marshal Folstein and Timothy Liu and Inga Peter and Jennifer Buel and Lisa Arsenault and Tammy Scott and Wendy W Qiu,164,American Journal of Psychiatry,6,861-867,American Psychiatric Association,           High levels of homocysteine are associated with cerebrovascular disease. monoamine neurotransmitters. and depression of mood. A plausible hypothesis for these associations is that high homocysteine levels cause cerebral vascular disease and neurotransmitter deficiency. which cause depression of mood. The homocysteine depression hypothesis. if true. would mandate inclusions of imaging studies for cerebrovascular disease and measures of homocysteine. folate. and B           12           and B           6           vitamins in the clinical evaluation of older depressed patients. Longitudinal studies and clinical trials should be designed to challenge the hypothesis.         ,True,3JsfnzsAAAAJ:tH6gc1N1XXoC,289,https://ajp.psychiatryonline.org/doi/abs/10.1176/ajp.2007.164.6.861,5696603573526590647,/scholar?cites=5696603573526590647,,https://ajp.psychiatryonline.org/doi/full/10.1176/ajp.2007.164.6.861,0
29848,Diagnosis and evaluation of dementia.,1995,Jody Corey-Bloom and Leon J Thal and D Galasko and M Folstein and D Drachman and M Raskind and Douglas J Lanska,,Neurology,,,Lippincott Williams & Wilkins,Reviews the most useful components of the diagnostic evaluation of elderly patients with cognitive complaints. focusing on identifying and diagnosing the 2 major dementing disorders. Alzheimer's disease (AD) and vascular dementia. Evaluation should include some or all of the following: history. mental status testing. neurological examination. various questionnaires and scales. laboratory tests. neuroimaging studies. neuropsychological testing. lumbar puncture. EEG. and positron emission tomography or single photon emission computed tomography. Information is given on performing a differential diagnosis between AD and vascular dementia and on the staging and following progression of these dementias.(PsycINFO Database Record (c) 2016 APA. all rights reserved),True,3JsfnzsAAAAJ:cSdaV2aYdYsC,284,https://psycnet.apa.org/record/1995-37662-001,5052889399978666842,/scholar?cites=5052889399978666842,,,0
29849,Association of postoperative delirium with raised serum levels of anticholinergic drugs,1981,LarryE Tune and Anthony Holland and MarshalF Folstein and NamirF Damlouji and TimothyJ Gardner and JosephT Coyle,318,The Lancet,8248,651-653,Elsevier,Drugs with anticholinergic effects are often used in surgical procedures and may impair higher cognitive functions and produce delirious states. This prospective study examined the relation between serum levels of anticholinergic drugs. measured by a radioreceptor assay. and the development of delirium in patients. undergoing cardiac surgery. Most patients who had postoperative delirium had high serum levels of anticholinergic drugs. whereas those who remained cognitively intact had low levels; and impairment in cortical function correlated with serum levels of anticholinergic drugs (p<0·001). Raised serum levels of drugs with anticholinergic effects may contribute to the development of delirium. and to the increase in risk of morbidity following cardiac surgery.,True,3JsfnzsAAAAJ:F9fV5C73w3QC,283,https://www.sciencedirect.com/science/article/pii/S0140673681909946,18348601645310912034,/scholar?cites=18348601645310912034,,,0
29850,The association of affective disorder with Huntington's disease in a case series and in families,1983,Susan E Folstein and Margaret H Abbott and Gary A Chase and Barbara A Jensen and Marshal F Folstein,13,Psychological medicine,3,537-542,Cambridge University Press,Major affective disorder clinically similar to the disorder found in conditions other than Huntington's Disease (HD) was found in 41% of patients with HD in a consecutive case series ascertained through multiple sources in a defined geographical area. The association appears to be confined to certain families. and affective disorder may appear as long as 20 years before the onset of chorea and dementia. The association may represent genetic heterogeneity in HD.,True,3JsfnzsAAAAJ:Ehil0879vHcC,279,https://www.cambridge.org/core/journals/psychological-medicine/article/association-of-affective-disorder-with-huntingtons-disease-in-a-case-series-and-in-families/C00AC5E6ECBA03C0880863C481CB3D2E,15541212836911965186,/scholar?cites=15541212836911965186,,,0
29851,Structural brain correlates of emotional disorder in multiple sclerosis,1986,Peter V Rabins and Benjamin R Brooks and Pat O'donnell and Godfrey D Pearlson and Paul Moberg and Burk Jubelt and Pat Coyle and Nancy Dalos and Marshal F Folstein,109,Brain,4,585-597,Oxford University Press,SUMMARYEighty-seven patients with definite multiple sclerosis (MS) were examined neurologically and administered the Mini-mental State examination (MMS) to asses cognitive disability at the beginning and end of a one-year study. A CT scan was performed in 37. A group of 16 patients with stable spinal cord injuries (SCI) were studied in a similar manner. Of the MS patients. 47% had a mean General Health Questionnaire (GHQ) score in the abnormal range. This was a higher rate than in SCI patients (p = 0.004). Mean depression scores were similar in MS and SCI patients. but MS patients with brain involvement were more depressed than those with cord lesions only (p = 0.05). Depression score was unrelated to functional disability but was correlated with the degree of neurological impairment (p = 0.03). Euphoric patients were more likely to have brain involvement (P = 0.006). to have progressive …,True,3JsfnzsAAAAJ:P7Ujq4OLJYoC,274,https://academic.oup.com/brain/article-abstract/109/4/585/377723,12580758051797265823,/scholar?cites=12580758051797265823,,,0
29852,Unsuspected emotional and cognitive disturbance in medical patients,1977,EDWIN B KNIGHTS and Marshal F Folstein,87,Annals of Internal Medicine,6,723-724,American College of Physicians,In 1944. Christian (1) observed that internists were allowing their concern with complex technology to divert their attention from patients' emotional problems. Romano and Engel (2) have reported the neglect of cognitive deficits as well. Our study was designed to show the prevalence of unsuspected emotional and cognitive disturbances on an acute medical ward and the ease with which these problems can be detected by recently developed screening techniques.All patients admitted to three general medical wards in September 1976. were studied. There were 32 women and 25 men. with a mean age of 55 and a range in age...,True,3JsfnzsAAAAJ:nZcligLrVowC,267,https://www.acpjournals.org/doi/pdf/10.7326/0003-4819-87-6-723,4393990424953844830,/scholar?cites=4393990424953844830,,,0
29853,Decreased levels of plasma vitamin C and increased concentrations of inflammatory and oxidative stress markers after stroke,2004,Concepción Sánchez-Moreno and John F Dashe and Tammy Scott and David Thaler and Marshal F Folstein and Antonio Martin,35,Stroke,1,163-168,Lippincott Williams & Wilkins,Background and Purpose— Inflammatory response is a critical component of the complex pathophysiological response to stroke. Vitamin C has been shown to have important roles in cell performance and vascular function. In this study. we compared the nutritional status and levels of inflammatory markers between stroke cases and controls and assessed which antioxidant was associated with levels of inflammatory markers and oxidative stress among cases and controls.Methods— We evaluated the nutritional status and measured plasma levels of vitamins C and E. uric acid. serum levels of C-reactive protein (CRP). the cytokines tumor necrosis factor-α and interleukin-1β. intercellular adhesion molecule-1 (ICAM-1) and chemokine monocyte chemoattractant protein-1 (MCP-1). prostaglandins PGE2 and PGI2. and 8-isoprostanes (8-epiPGF2α) for 15 patients with ischemic stroke within 2 to 5 days after stroke …,True,3JsfnzsAAAAJ:u-coK7KVo8oC,249,https://www.ahajournals.org/doi/abs/10.1161/01.STR.0000105391.62306.2E,13236630819168314279,/scholar?cites=13236630819168314279,,https://www.ahajournals.org/doi/full/10.1161/01.str.0000105391.62306.2e,0
29854,Clinical assessment of irritability. aggression. and apathy in Huntington and Alzheimer disease.,1990,Alistair Burns and Susan Folstein and Jason Brandt and Marshal Folstein,,Journal of Nervous and Mental Disease,,,Lippincott Williams & Wilkins,"Assessed 57 patients with Alzheimer's disease (AD) or Huntington disease (HD)(aged 17–84 yrs). using new scales to measure apathy and irritability. Ss' relatives completed the new scales. a form of the Psychogeriatric Dependency Rating Scale. and a measure of aggression. A similar prevalence of apathy and irritability was found in the 2 groups. HD Ss were more aggressive than AD Ss. In a subsample of the groups. matched for degree of cognitive impairment. HD Ss were more apathetic than AD Ss. Irritability was related to the premorbid trait of"" bad temper"" in HD. but not in AD. There was no interrelationship among the 3 symptoms in either group. The scales for irritability and apathy demonstrated interrater and test–retest reliability and validity. They differentiated AD and HD from normal behavior and from each other.(PsycINFO Database Record (c) 2016 APA. all rights reserved)",True,3JsfnzsAAAAJ:_OXeSy2IsFwC,237,https://psycnet.apa.org/record/1990-15040-001,6953349529313152959,/scholar?cites=6953349529313152959,,,0
