,title,pub_year,author,volume,journal,number,pages,publisher,abstract,filled,author_pub_id,num_citations,pub_url,cites_id,citedby_url,author_id,eprint_url,got_citations
39262,Matrix metalloproteinase 2 from human rheumatoid synovial fibroblasts: purification and activation of the precursor and enzymic properties,1990,Yasunori OKADA and Tatsuhisa MORODOMI and Jan J ENGHILD and Ko SUZUKI and Atsushi YASUI and Isao NAKANISHI and Guy SALVESEN and Hideaki NAGASE,194,European Journal of Biochemistry,3,721-730,Blackwell Publishing Ltd,Human rheumatoid synovial cells in culture secrete at least three related metalloproteinases that digest extracellular matrix macromolecules. One of them. termed matrix metalloproteinase 2 (MMP‐2). has been purified as an inactive zymogen (proMMP‐2). The final product is homogeneous on SDS/PAGE with Mr= 72000 under reducing conditions. The NH2‐terminal sequence of proMMP‐2 is Ala‐Pro‐Ser‐Pro‐Ile‐Ile‐Lys‐Phe‐Pro‐Gly‐Asp‐Val‐Ala‐Pro‐Lys‐Thr. which is identical to that of the so‐called ‘72‐kDa type IV collagenase/gelatinase’. The zymogen can be rapidly activated by 4‐aminophenylmercuric acetate to an active form of MMP‐2 with Mr= 67000. and the new NH2‐terminal generated is Tyr‐Asn‐Phe‐Phe‐Pro‐Arg‐Lys‐Pro‐Lys‐Trp‐Asp‐Lys‐Asn‐Gln‐Ile. However. following 4‐aminophenylmercuric acetate activation. MMP‐2 is gradually inactivated by autolysis. Nine endopeptidases (trypsin …,True,xke6pR0AAAAJ:M3ejUd6NZC8C,458,https://febs.onlinelibrary.wiley.com/doi/abs/10.1111/j.1432-1033.1990.tb19462.x,247226196137265585,/scholar?cites=247226196137265585,,https://febs.onlinelibrary.wiley.com/doi/pdf/10.1111/j.1432-1033.1990.tb19462.x,0
39263,The human anti-apoptotic proteins cIAP1 and cIAP2 bind but do not inhibit caspases,2006,Brendan P Eckelman and Guy S Salvesen,281,Journal of Biological Chemistry,6,3254-3260,American Society for Biochemistry and Molecular Biology,cIAPs (cellular inhibitor of apoptosis proteins) 1 and 2 are able to regulate apoptosis when ectopically expressed in recipient cells and probably also in vivo. Previous work suggested that this is at least partially due to direct caspase inhibition. mediated by two of the three baculovirus IAP repeat (BIR) domains that are contained in these proteins. In support of this we show that the BIR domains 2 and 3 of the two cIAPs are able to bind caspases-7 and -9. However. we demonstrate that neither of these BIR domains is able to inhibit caspases because of critical substitutions in the regions that target caspase inhibition in the X-linked IAP. a tight binding caspase inhibitor. The cIAP BIR domains can be converted to tight binding caspase inhibitors by substituting these critical residues with XIAP residues. Thus. cIAPs maintain protein scaffolds suitable for direct caspase inhibition but have lost or never acquired specific …,True,xke6pR0AAAAJ:M3NEmzRMIkIC,435,https://www.jbc.org/content/281/6/3254.short,1874446920855841879,/scholar?cites=1874446920855841879,,https://www.jbc.org/content/281/6/3254.full.pdf,0
39264,FLICE induced apoptosis in a cell-free system cleavage of caspase zymogens,1997,Marta Muzio and Guy S Salvesen and Vishva M Dixit,272,Journal of Biological Chemistry,5,2952-2956,American Society for Biochemistry and Molecular Biology,Engagement of CD95 or tumor necrosis factor 1 receptor (TNFR-1) by ligand or agonist antibodies is capable of activating the cell death program. the effector arm of which is composed of mammalian interleukin-1β converting enzyme (ICE)-like cysteine proteases (designated caspases) that are related to the Caenorhabditis elegans death gene. CED-3. Caspases. unlike other mammalian cysteine proteases. cleave their substrates following aspartate residues. Furthermore. proteases belonging to this family exist as zymogens that in turn require cleavage at internal aspartate residues to generate the two-subunit active enzyme. As such. family members are capable of activating each other. Remarkably. both CD95 and TNFR-1 death receptors initiate apoptosis by recruiting a novel ICE/CED-3 family member. designated FLICE/MACH. to the receptor signaling complex. Therefore. FLICE/MACH represents the apical …,True,xke6pR0AAAAJ:mVmsd5A6BfQC,433,https://www.jbc.org/content/272/5/2952.short,9031903764639768839,/scholar?cites=9031903764639768839,,https://www.jbc.org/content/272/5/2952.full.pdf,0
39265,XIAP inhibits caspase‐3 and‐7 using two binding sites: evolutionarily conserved mechanism of IAPs,2005,Fiona L Scott and Jean‐Bernard Denault and Stefan J Riedl and Hwain Shin and Martin Renatus and Guy S Salvesen,24,The EMBO journal,3,645-655,John Wiley & Sons. Ltd,The X‐linked inhibitor of apoptosis protein (XIAP) uses its second baculovirus IAP repeat domain (BIR2) to inhibit the apoptotic executioner caspase‐3 and ‐7. Structural studies have demonstrated that it is not the BIR2 domain itself but a segment N‐terminal to it that directly targets the activity of these caspases. These studies failed to demonstrate a role of the BIR2 domain in inhibition. We used site‐directed mutagenesis of BIR2 and its linker to determine the mechanism of executioner caspase inhibition by XIAP. We show that the BIR2 domain contributes substantially to inhibition of executioner caspases. A surface groove on BIR2. which also binds to Smac/DIABLO. interacts with a neoepitope generated at the N‐terminus of the caspase small subunit following activation. Therefore. BIR2 uses a two‐site interaction mechanism to achieve high specificity and potency for inhibition. Moreover. for caspase‐7. the …,True,xke6pR0AAAAJ:bEWYMUwI8FkC,427,https://www.embopress.org/doi/abs/10.1038/sj.emboj.7600544,2482926264083724240,/scholar?cites=2482926264083724240,,https://www.embopress.org/doi/pdf/10.1038/sj.emboj.7600544,0
39266,Stepwise activation mechanisms of the precursor of matrix metalloproteinase 3 (stromelysin) by proteinases and (4-aminophenyl) mercuric acetate,1990,Hideaki Nagase and Jan J Enghild and Ko Suzuki and Guy Salvesen,29,Biochemistry,24,5783-5789,American Chemical Society,Department of Biochemistry and Molecular Biology. University of Kansas Medical Center. Kansas City. Kansas 66103. and Department of Pathology. Duke University Medical Center. Durham. North Carolina 27710 Received November 28. 1989; Revised Manuscript Received February 16. 1990 abstract: The mechanisms of activation of the precursor of human matrix metalloproteinase 3 (proMMP-3/prostromelysin) by proteinases and (4-aminophenyl) mercuric acetate (APMA) were investigated by kinetic and sequence analyses. Incubation of proMMP-3 with neutrophil elastase. plasma kallikrein. plasmin. or chymotrypsin at 37 C resulted in the formation of MMP-3 of Afr=45000 by cleaving of the His82-Phe83 bond. Sincethis bond is unlikely to be cleavedby these proteinases it was postulated that an initial attack of an activator proteinase on proMMP-3 creates an intermediate form. which is then processed to a more …,True,xke6pR0AAAAJ:7PzlFSSx8tAC,416,https://pubs.acs.org/doi/pdf/10.1021/bi00476a020,3856812438843055154,/scholar?cites=3856812438843055154,,,0
39267,Caspases–controlling intracellular signals by protease zymogen activation,2000,Henning R Stennicke and Guy S Salvesen,1477,,1-2,299-306,Elsevier,Animal development and homeostasis is a balance between cell proliferation and cell death. Physiologic. and sometimes pathologic. cell death – apoptosis – is driven by activation of a family of proteases known as the caspases. present in almost all nucleated animal cells. The enzymatic properties of these proteases are governed by a dominant specificity for substrates containing Asp. and by the use of a Cys side chain for catalyzing peptide bond cleavage. The primary specificity for Asp turns out to be very rare among proteases. and currently the only other known mammalian proteases with the same primary specificity is the physiological caspase activator granzyme B. Like most other proteases. the caspases are synthesized as inactive zymogens whose activation requires limited proteolysis or binding to co-factors. To transmit the apoptotic execution signal. caspase zymogens are sequentially activated through …,True,xke6pR0AAAAJ:hC7cP41nSMkC,412,https://www.sciencedirect.com/science/article/pii/S0167483899002812,15296591511796689060,/scholar?cites=15296591511796689060,,,0
39268,Inhibition of interleukin-1 beta converting enzyme by the cowpox virus serpin CrmA. An example of cross-class inhibition.,1994,Tomoko Komiyama and Caroline A Ray and David J Pickup and Andrew D Howard and Nancy A Thornberry and Erin P Peterson and Guy Salvesen,269,Journal of Biological Chemistry,30,19331-19337,American Society for Biochemistry and Molecular Biology,"We reported previously that human interleukin-1 beta converting enzyme (ICE) is regulated by the CrmA serpin encoded by cowpox virus. We now report the mechanism and kinetics of this unusual inhibition of a cysteine proteinase by a member of the serpin superfamily previously thought to inhibit serine proteinase only. CrmA possesses several characteristics typical of a number of inhibitory serpins. It is conformationally unstable. unfolding around 3 M urea. and stable to denaturation in 8 M urea upon complex formation with ICE. CrmA rapidly inhibits ICE with an association rate constant (kon) of 1.7 x 10(7) M-1 s-1. forming a tight complex with an equilibrium constant for inhibition (Ki) of less than 4 x 10(-12) M. These data indicate that CrmA is a potent inhibitor of ICE. consistent with the dramatic effects of CrmA on modifying host responses to virus infection. The inhibition of ICE by CrmA is an example of a ""cross …",True,xke6pR0AAAAJ:9ZlFYXVOiuMC,409,https://www.jbc.org/content/269/30/19331.short,17986744198770935414,/scholar?cites=17986744198770935414,,https://www.jbc.org/content/269/30/19331.full.pdf,0
39269,Regulation of the Apaf-1–caspase-9 apoptosome,2010,Shawn B Bratton and Guy S Salvesen,123,Journal of cell science,19,3209-3214,The Company of Biologists Ltd,Apoptosis is probably not the only form of cell death. but it is currently the only form for which the proteins that constitute the death pathway have been characterized at the structural. biochemical and genetic levels in great detail. Apoptosis is an ancient paradigm. going back to the earliest multicellular animals. but does not exist in plants. simple eukaryotes or microbes (Lamkanfi et al.. 2002; Zmasek et al.. 2007). Signal transduction in apoptosis is different to most well-described signal transduction pathways in that it does not require kinases or phosphatases. although these might well set a threshold for the ‘fitness’ of a cell to die. The two best-described apoptosis pathways in mammals. the intrinsic and the extrinsic pathways. converge on a common execution phase. This phase is driven by proteases known as caspases. which are typically subdivided into those that contain large prodomains and act at the apex of a …,True,xke6pR0AAAAJ:ye4kPcJQO24C,382,https://jcs.biologists.org/content/123/19/3209.short,17413919230436640424,/scholar?cites=17413919230436640424,,https://jcs.biologists.org/content/joces/123/19/3209.full.pdf,0
39270,Calpain functions in a caspase-independent manner to promote apoptosis-like events during platelet activation,1999,Beni B Wolf and Joshua C Goldstein and Henning R Stennicke and Helen Beere and Gustavo P Amarante-Mendes and Guy S Salvesen and Douglas R Green,94,"Blood, The Journal of the American Society of Hematology",5,1683-1692,American Society of Hematology,Apoptosis and platelet activation share common morphological and biochemical features. Because caspases are essential mediators of apoptosis. we examined whether platelets contain these proteinases and use them during platelet activation. Human platelets contained caspase-9. caspase-3. and the caspase activators APAF-1 and cytochrome c as shown by sodium dodecyl sulfate-polyacrylamide gel electrophoresis and Western blotting. Upon treatment with cytochrome c and dATP. platelet cytoplasmic extracts recapitulated apoptotic events. including sequential activation of procaspase-9 and procaspase-3 and subsequent proteolysis of caspase substrates. Calcium ionophore-stimulated platelets also recapitulated apoptotic events. including cell shrinkage. plasma membrane microvesiculation. phosphatidyl serine externalization. and proteolysis of procaspase-9. procaspase-3. gelsolin. and protein …,True,xke6pR0AAAAJ:-f6ydRqryjwC,357,https://ashpublications.org/blood/article-abstract/94/5/1683/104255,5979781237612687768,/scholar?cites=5979781237612687768,,https://www.academia.edu/download/40614675/Calpain_functions_in_a_caspase-independe20151203-12012-3o9jib.pdf,0
39271,Cysteine cathepsins trigger caspase-dependent cell death through cleavage of bid and antiapoptotic Bcl-2 homologues,2008,Gabriela Droga-Mazovec and Lea Bojič and Ana Petelin and Saška Ivanova and Urska Repnik and Guy S Salvesen and Veronika Stoka and Vito Turk and Boris Turk,283,Journal of Biological Chemistry,27,19140-19150,American Society for Biochemistry and Molecular Biology,As a model for defining the role of lysosomal cathepsins in apoptosis. we characterized the action of the lysosomotropic agent LeuLeuOMe using distinct cellular models. LeuLeuOMe induces lysosomal membrane permeabilization. resulting in release of lysosomal cathepsins that cleave the proapoptotic Bcl-2 family member Bid and degrade the antiapoptotic member Bcl-2. Bcl-xL. or Mcl-1. The papain-like cysteine protease inhibitor E-64d largely prevented apoptosis. Bid cleavage. and Bcl-2/Bcl-xL/Mcl-1 degradation. The pancaspase inhibitor N-benzyloxycarbonyl-Val-Ala-Asp(OMe)fluoromethyl ketone failed to prevent Bid cleavage and degradation of anti-apoptotic Bcl-2 homologues but substantially decreased cell death. suggesting that cathepsin-mediated apoptosis in these cellular models mostly follows a caspase-dependent pathway. Moreover. in vitro experiments showed that one or more of the cysteine …,True,xke6pR0AAAAJ:1sJd4Hv_s6UC,352,https://www.jbc.org/content/283/27/19140.short,3159164590879265909,/scholar?cites=3159164590879265909,,https://www.jbc.org/content/283/27/19140.full.pdf,0
39272,The Fas–FADD death domain complex structure unravels signalling by receptor clustering,2009,Fiona L Scott and Boguslaw Stec and Cristina Pop and Małgorzata K Dobaczewska and JeongEun J Lee and Edward Monosov and Howard Robinson and Guy S Salvesen and Robert Schwarzenbacher and Stefan J Riedl,457,Nature,7232,1019-1022,Nature Publishing Group,The death inducing signalling complex (DISC) formed by Fas receptor. FADD (Fas-associated death domain protein) and caspase 8 is a pivotal trigger of apoptosis 1. 2. 3. The Fas–FADD DISC represents a receptor platform. which once assembled initiates the induction of programmed cell death. A highly oligomeric network of homotypic protein interactions comprised of the death domains of Fas and FADD is at the centre of DISC formation 4. 5. Thus. characterizing the mechanistic basis for the Fas–FADD interaction is crucial for understanding DISC signalling but has remained unclear largely because of a lack of structural data. We have successfully formed and isolated the human Fas–FADD death domain complex and report the 2.7 Å crystal structure. The complex shows a tetrameric arrangement of four FADD death domains bound to four Fas death domains. We show that an opening of the Fas death domain …,True,xke6pR0AAAAJ:TGkaJS32XoUC,350,https://www.nature.com/articles/nature07606,8962986990345788525,/scholar?cites=8962986990345788525,,https://www.ncbi.nlm.nih.gov/pmc/articles/pmc2661029/,0
39273,Activity-based probes that target diverse cysteine protease families,2005,Daisuke Kato and Kelly M Boatright and Alicia B Berger and Tamim Nazif and Galia Blum and Ciara Ryan and Kareem AH Chehade and Guy S Salvesen and Matthew Bogyo,1,Nature chemical biology,1,33-38,Nature Publishing Group,Proteases are one of the largest and best-characterized families of enzymes in the human proteome. Unfortunately. the understanding of protease function in the context of complex proteolytic cascades remains in its infancy. One major reason for this gap in understanding is the lack of technologies that allow direct assessment of protease activity. We report here an optimized solid-phase synthesis protocol that allows rapid generation of activity-based probes (ABPs) targeting a range of cysteine protease families. These reagents selectively form covalent bonds with the active-site thiol of a cysteine protease. allowing direct biochemical profiling of protease activities in complex proteomes. We present a number of probes containing either a single amino acid or an extended peptide sequence that target caspases. legumains. gingipains and cathepsins. Biochemical studies using these reagents highlight their overall …,True,xke6pR0AAAAJ:RGFaLdJalmkC,332,https://www.nature.com/articles/nchembio707?referral=true,11709040533587312638,/scholar?cites=11709040533587312638,,http://folk.uio.no/haraldtj/PDF/Kato2005.pdf,0
39274,Peroxisome-proliferator-activated receptor γ suppresses Wnt/β-catenin signalling during adipogenesis,2003,Marthe Moldes and Ying Zuo and Ron F Morrison and David Silva and Bae-Hang Park and Jiajian Liu and Stephen R Farmer,376,Biochemical Journal,3,607-613,Portland Press,The Wnt/β-catenin signalling pathway appears to operate to maintain the undifferentiated state of preadipocytes by inhibiting adipogenic gene expression. To define the mechanisms regulating suppression of Wnt/β-catenin signalling. we analysed the β-catenin expression in response to activation of transcription factors that regulate adipogenesis. The results show an extensive down-regulation of nuclear β-catenin that occurs during the first few days of differentiation of 3T3-L1 preadipocytes and coincides with the induction of the adipogenic transcription factors. C/EBPβ (CCAAT-enhancer-binding protein) and PPARγ (peroxisome-proliferator-activated receptor). To assess the role of each of these factors in this process. we conditionally overexpressed C/EBPβ in Swiss mouse fibroblasts using the TET-off system. Abundant expression of C/EBPβ alone had minimal effect on β-catenin expression. whereas expression …,True,xke6pR0AAAAJ:HGTzPopzzJcC,321,https://portlandpress.com/biochemj/article-abstract/376/3/607/40939,18177337330134986477,/scholar?cites=18177337330134986477,,https://www.ncbi.nlm.nih.gov/pmc/articles/PMC1223802/pdf/12954078.pdf,0
39275,Internally quenched fluorescent peptide substrates disclose the subsite preferences of human caspases 1. 3. 6. 7 and 8,2000,Henning R Stennicke and Martin RENATUS and Morten MELDAL and Guy S SALVESEN,350,Biochemical Journal,2,563-568,Portland Press Ltd.,Subsite interactions are considered to define the stringent specificity of proteases for their natural substrates. To probe this issue in the proteolytic pathways leading to apoptosis we have examined the P4. P1 and P1´ subsite preferences of human caspases 1. 3. 6. 7 and 8. using internally quenched fluorescent peptide substrates containing o-aminobenzoyl (also known as anthranilic acid) and 3-nitro-tyrosine. Previous work has demonstrated the importance of the S4 subsite in directing specificity within the caspase family. Here we demonstrate the influence of the S1 and S1´ subsites that flank the scissile peptide bond. The S1 subsite. the major specificity-determining site of the caspases. demonstrates tremendous selectivity. with a 20000-fold preference for cleaving substrates containing aspartic acid over glutamic acid at this position. Thus caspases are among the most selective of known endopeptidases. We …,True,xke6pR0AAAAJ:YFjsv_pBGBYC,321,https://portlandpress.com/biochemj/article-abstract/350/2/563/38645,16902888233419202930,/scholar?cites=16902888233419202930,,https://www.ncbi.nlm.nih.gov/pmc/articles/PMC1221285/pdf/10947972.pdf,0
39276,Overlapping cleavage motif selectivity of caspases: implications for analysis of apoptotic pathways,2008,GP McStay and GS Salvesen and DR Green,15,Cell Death & Differentiation,2,322-331,Nature Publishing Group,Caspases orchestrate the controlled demise of a cell after an apoptotic signal through specific protease activity and cleavage of many substrates altering protein function and ensuring apoptosis proceeds efficiently. Comparing a variety of substrates of each apoptotic caspase (2. 3. 6. 7. 8. 9 and 10) showed that the cleavage sites had a general motif. sometimes specific for one caspase. but other times specific for several caspases. Using commercially available short peptide-based substrates and inhibitors the promiscuity for different cleavage motifs was indicated. with caspase-3 able to cleave most substrates more efficiently than those caspases to which the substrates are reportedly specific. In a cell-free system. immunodepletion of caspases before or after cytochrome c-dependent activation of the apoptosome indicated that the majority of activity on synthetic substrates was dependent on caspase-3. with minor …,True,xke6pR0AAAAJ:zA6iFVUQeVQC,320,https://www.nature.com/articles/4402260,6817695486137687377,/scholar?cites=6817695486137687377,,https://www.nature.com/articles/4402260,0
39277,The apoptosome activates caspase-9 by dimerization,2006,Cristina Pop and John Timmer and Sabina Sperandio and Guy S Salvesen,22,Molecular cell,2,269-275,Cell Press,The apical protease of the human intrinsic apoptotic pathway. caspase-9. is activated in a polymeric activation platform known as the apoptosome. The mechanism has been debated. and two contrasting hypotheses have been suggested. One of these postulates an allosteric activation of monomeric caspase-9; the other postulates a dimer-driven assembly at the surface of the apoptosome—the “induced proximity” model. We show that both Hofmeister salts and a reconstituted mini-apoptosome activate caspase-9 by a second-order process. compatible with a conserved dimer-driven process. Significantly. replacement of the recruitment domain of the apical caspase of the extrinsic apoptotic pathway. caspase-8. by that of caspase-9 allows activation of this hybrid caspase by the apoptosome. Consequently. apical caspases can be activated simply by directing their zymogens to the apoptosome. ruling out the …,True,xke6pR0AAAAJ:pqnbT2bcN3wC,320,https://www.sciencedirect.com/science/article/pii/S1097276506001730,1768632962789062605,/scholar?cites=1768632962789062605,,https://www.sciencedirect.com/science/article/pii/S1097276506001730,0
39278,Inhibition of proteolytic enzymes,1989,Guy Salvesen,,Proteolytic enzymes: A practical approach,,83-104,IRL Press,"CiNii 国立情報学研究所 学術情報ナビゲータ[サイニィ]. メニュー 検索 … 
",True,xke6pR0AAAAJ:HDshCWvjkbEC,319,https://ci.nii.ac.jp/naid/10005178519/,13345784487905738825,/scholar?cites=13345784487905738825,,,0
39279,Polyamine transport in bacteria and yeast,1999,Kazuei IGARASHI and Keiko KASHIWAGI,344,,3,633-642,Portland Press Ltd.,The polyamine content of cells is regulated by biosynthesis. degradation and transport. In Escherichia coli. the genes for three different polyamine transport systems have been cloned and characterized. Two uptake systems (putrescine-specific and spermidine-preferential) were ABC transporters. each consisting of a periplasmic substrate-binding protein. two transmembrane proteins and a membrane-associated ATPase. The crystal structures of the substrate-binding proteins (PotD and PotF) have been solved. They consist of two domains with an alternating β-α-β topology. similar to other periplasmic binding proteins. The polyamine-binding site is in a cleft between the two domains. as determined by crystallography and site-directed mutagenesis. Polyamines are mainly recognized by aspartic acid and glutamic acid residues. which interact with the NH2- (or NH-) groups. and by tryptophan and tyrosine residues …,True,xke6pR0AAAAJ:1DsIQWDZLl8C,310,https://portlandpress.com/biochemj/article-abstract/344/3/633/35611,4478779229433057472,/scholar?cites=4478779229433057472,,https://www.ncbi.nlm.nih.gov/pmc/articles/PMC1220684/pdf/10585849.pdf,0
39280,Proteinase inhibitors,1986,Alan J Barrett and G Salvesen,12,Research monographs in cell and tissue physiology,,,,Sauf mention contraire ci-dessus. le contenu de cette notice bibliographique peut être utilisé dans le cadre d’une licence CC BY 4.0 Inist-CNRS/Unless otherwise stated above. the content of this bibliographic record may be used under a CC BY 4.0 licence by Inist-CNRS/A menos que se haya señalado antes. el contenido de este registro bibliográfico puede ser utilizado al amparo de una licencia CC BY 4.0 Inist-CNRS,True,xke6pR0AAAAJ:TQgYirikUcIC,302,https://pascal-francis.inist.fr/vibad/index.php?action=getRecordDetail&idt=7997630,10131066155855668407,/scholar?cites=10131066155855668407,,,0
