,title,pub_year,author,volume,journal,number,pages,publisher,abstract,filled,author_pub_id,num_citations,pub_url,cites_id,citedby_url,gsrank,author_id,eprint_url,got_citations,got_author_ids,author_ids
1233495,Nanoarchitectured graphene/CNT@ porous carbon with extraordinary electrical conductivity and interconnected micro/mesopores for lithium‐sulfur batteries,2014,Hong‐Jie Peng and Jia‐Qi Huang and Meng‐Qiang Zhao and Qiang Zhang and Xin‐Bing Cheng and Xin‐Yan Liu and Wei‐Zhong Qian and Fei Wei,24,Advanced functional materials,19,2772-2781,,The sp2‐hybridized nanocarbon (e.g.. carbon nanotubes (CNTs) and graphene) exhibits extraordinary mechanical strength and electrical conductivity but limited external accessible surface area and a small amount of pores. while nanostructured porous carbon affords a huge surface area and abundant pore structures but very poor electrical conductance. Herein the rational hybridization of the sp2 nanocarbon and nanostructured porous carbon into hierarchical all‐carbon nanoarchitectures is demonstrated. with full inherited advantages of the component materials. The sp2 graphene/CNT interlinked networks give the composites good electrical conductivity and a robust framework. while the meso‐/microporous carbon and the interlamellar compartment between the opposite graphene accommodate sulfur and polysulfides. The strong confinement induced by micro‐/mesopores of all‐carbon nanoarchitectures …,True,5kidFf8AAAAJ:UeHWp8X0CEIC,439,https://onlinelibrary.wiley.com/doi/abs/10.1002/adfm.201303296,8848335273035358631,/scholar?cites=8848335273035358631,,,https://www.researchgate.net/profile/Hong-Jie_Peng/publication/260412007_Carbon_Nanoarchitectured_GrapheneCNTPorous_Carbon_with_Extraordinary_Electrical_Conductivity_and_Interconnected_MicroMesopores_for_Lithium-Sulfur_Batteries_Adv_Funct_Mater_192014/links/5caa68dd4585157bd32a6099/Carbon-Nanoarchitectured-Graphene-CNTPorous-Carbon-with-Extraordinary-Electrical-Conductivity-and-Interconnected-Micro-Mesopores-for-Lithium-Sulfur-Batteries-Adv-Funct-Mater-19-2014.pdf,0,0,0
1233496,Hierarchical free‐standing carbon‐nanotube paper electrodes with ultrahigh sulfur‐loading for lithium–sulfur batteries,2014,Zhe Yuan and Hong‐Jie Peng and Jia‐Qi Huang and Xin‐Yan Liu and Dai‐Wei Wang and Xin‐Bing Cheng and Qiang Zhang,24,Advanced Functional Materials,39,6105-6112,,The rational combination of conductive nanocarbon with sulfur leads to the formation of composite cathodes that can take full advantage of each building block; this is an effective way to construct cathode materials for lithium–sulfur (Li–S) batteries with high energy density. Generally. the areal sulfur‐loading amount is less than 2.0 mg cm−2. resulting in a low areal capacity far below the acceptable value for practical applications. In this contribution. a hierarchical free‐standing carbon nanotube (CNT)‐S paper electrode with an ultrahigh sulfur‐loading of 6.3 mg cm−2 is fabricated using a facile bottom–up strategy. In the CNT–S paper electrode. short multi‐walled CNTs are employed as the short‐range electrical conductive framework for sulfur accommodation. while the super‐long CNTs serve as both the long‐range conductive network and the intercrossed mechanical scaffold. An initial discharge capacity of 6.2 mA …,True,5kidFf8AAAAJ:zYLM7Y9cAGgC,425,https://onlinelibrary.wiley.com/doi/abs/10.1002/adfm.201401501,10255464188848207183,/scholar?cites=10255464188848207183,,,https://www.researchgate.net/profile/Hong-Jie_Peng/publication/264387974_Electrodes_Hierarchical_Free-Standing_Carbon-Nanotube_Paper_Electrodes_with_Ultrahigh_Sulfur-Loading_for_Lithium-Sulfur_Batteries_Adv_Funct_Mater_392014/links/5caa707192851c64bd57aea5/Electrodes-Hierarchical-Free-Standing-Carbon-Nanotube-Paper-Electrodes-with-Ultrahigh-Sulfur-Loading-for-Lithium-Sulfur-Batteries-Adv-Funct-Mater-39-2014.pdf,0,0,0
1233497,An anion-immobilized composite electrolyte for dendrite-free lithium metal anodes,2017,Chen-Zi Zhao and Xue-Qiang Zhang and Xin-Bing Cheng and Rui Zhang and Rui Xu and Peng-Yu Chen and Hong-Jie Peng and Jia-Qi Huang and Qiang Zhang,114,Proceedings of the National Academy of Sciences,42,11069-11074,National Academy of Sciences,Lithium metal is strongly regarded as a promising electrode material in next-generation rechargeable batteries due to its extremely high theoretical specific capacity and lowest reduction potential. However. the safety issue and short lifespan induced by uncontrolled dendrite growth have hindered the practical applications of lithium metal anodes. Hence. we propose a flexible anion-immobilized ceramic–polymer composite electrolyte to inhibit lithium dendrites and construct safe batteries. Anions in the composite electrolyte are tethered by a polymer matrix and ceramic fillers. inducing a uniform distribution of space charges and lithium ions that contributes to a dendrite-free lithium deposition. The dissociation of anions and lithium ions also helps to reduce the polymer crystallinity. rendering stable and fast transportation of lithium ions. Ceramic fillers in the electrolyte extend the electrochemically stable window to as …,True,5kidFf8AAAAJ:pqnbT2bcN3wC,386,https://www.pnas.org/content/114/42/11069.short,13888131059422568615,/scholar?cites=13888131059422568615,,,https://www.pnas.org/content/pnas/114/42/11069.full.pdf,0,0,0
1233498,A cooperative interface for highly efficient lithium–sulfur batteries,2016,Hong‐Jie Peng and Ze‐Wen Zhang and Jia‐Qi Huang and Ge Zhang and Jin Xie and Wen‐Tao Xu and Jia‐Le Shi and Xiang Chen and Xin‐Bing Cheng and Qiang Zhang,28,Advanced Materials,43,9551-9558,,A cooperative interface constructed by “lithiophilic” nitrogen‐doped graphene frameworks and “sulfiphilic” nickel–iron layered double hydroxides (LDH@ NG) is proposed to synergistically afford bifunctional Li and S binding to polysulfides. suppression of polysulfide shuttles. and electrocatalytic activity toward formation of lithium sulfides for high‐performance lithium–sulfur batteries. LDH@ NG enables high rate capability. long lifespan. and efficient stabilization of both sulfur and lithium electrodes.,True,5kidFf8AAAAJ:hFOr9nPyWt4C,370,https://onlinelibrary.wiley.com/doi/abs/10.1002/adma.201603401,9508985338056984359,/scholar?cites=9508985338056984359,,,http://www.qianggroup.com/wp/pdf/AM-2016-A%20Cooperative%20Interface%20for%20Highly%20Efficient%20Lithium%E2%80%93Sulfur%20Batteries-Finally.pdf,0,0,0
1233499,Implantable solid electrolyte interphase in lithium-metal batteries,2017,Xin-Bing Cheng and Chong Yan and Xiang Chen and Chao Guan and Jia-Qi Huang and Hong-Jie Peng and Rui Zhang and Shu-Ting Yang and Qiang Zhang,2,Chem,2,258-270,Cell Press,Lithium (Li) metal is regarded as the “Holy Grail” electrode because of its low electrochemical potential and high theoretical capacity. Unfortunately. uncontrolled dendritic Li growth induces low coulombic efficiency and poor safety during deposition. Here. we propose an ex situ electrochemical strategy for constructing an ultra-stable implantable solid electrolyte interphase (SEI) on a Li-metal anode. In our study. the SEI rendered dendrite-free Li deposits in a working battery. A Li-metal anode with a stable SEI can be transplanted into ether and ester electrolyte to cycle sulfur (S) and a LiNi0.5Co0.2Mn0.3O2 (NCM) cathode. respectively. The Li-S cell exhibited superb long-term cycling performance at 1.0 C with an initial capacity of 890 mAh g−1 and capacity retention of 76% after 600 cycles. When matching the NCM cathode. the Li-metal anode with an implantable SEI avoided activation and increased capacity by 50 …,True,5kidFf8AAAAJ:maZDTaKrznsC,338,https://www.sciencedirect.com/science/article/pii/S245192941730027X,7734179841040933211,/scholar?cites=7734179841040933211,,,https://www.sciencedirect.com/science/article/pii/S245192941730027X,0,0,0
1233500,Advanced micro/nanostructures for lithium metal anodes,2017,Rui Zhang and Nian‐Wu Li and Xin‐Bing Cheng and Ya‐Xia Yin and Qiang Zhang and Yu‐Guo Guo,4,,3,1600445,,Owning to their very high theoretical capacity. lithium metal anodes are expected to fuel the extensive practical applications in portable electronics and electric vehicles. However. unstable solid electrolyte interphase and lithium dendrite growth during lithium plating/stripping induce poor safety. low Coulombic efficiency. and short span life of lithium metal batteries. Lately. varies of micro/nanostructured lithium metal anodes are proposed to address these issues in lithium metal batteries. With the unique surface. pore. and connecting structures of different nanomaterials. lithium plating/stripping processes have been regulated. Thus the electrochemical properties and lithium morphologies have been significantly improved. These micro/nanostructured lithium metal anodes shed new light on the future applications for lithium metal batteries.,True,5kidFf8AAAAJ:M3NEmzRMIkIC,334,https://onlinelibrary.wiley.com/doi/abs/10.1002/advs.201600445,18235987119159029497,/scholar?cites=18235987119159029497,,,https://onlinelibrary.wiley.com/doi/pdf/10.1002/advs.201600445,0,0,0
1233501,Aligned carbon nanotube/sulfur composite cathodes with high sulfur content for lithium–sulfur batteries,2014,Xin-Bing Cheng and Jia-Qi Huang and Qiang Zhang and Hong-Jie Peng and Meng-Qiang Zhao and Fei Wei,4,Nano Energy,,65-72,Elsevier,The use of conductive carbon scaffolds is efficient and effective to obtain advanced composite cathodes for lithium–sulfur batteries. However. the loading amount of mostly less than 70 wt% induces a limited energy density and the typical fabrication route involving high-temperature and elaborate process also limits the manufacturability of sulfur cathode. both of which hinder the practical application of lithium–sulfur batteries. Herein. a scalable. room-temperature. and one-step method is employed for carbon nanotube (CNT)/sulfur composite cathode. in which aligned CNTs served as interconnected conductive scaffolds to accommodate sulfur. When the loading amount of sulfur increased from 50 to 90 wt%. the tap density of CNT/sulfur increased from 0.4 to 1.98 g cm−3. and the mass/areal/volumetric capacities of the whole electrodes (CNT/sulfur composites and binders) was improved from 500.3 mAh g−1/0.298 …,True,5kidFf8AAAAJ:9yKSN-GCB0IC,328,https://www.sciencedirect.com/science/article/pii/S2211285513002036,2049745858539358161,/scholar?cites=2049745858539358161,,,https://www.researchgate.net/profile/Hong-Jie_Peng/publication/259525789_Aligned_carbon_nanotubesulfur_composite_cathodes_with_high_sulfur_content_for_lithium-sulfur_batteries/links/5caa6889299bf118c4ba7b2a/Aligned-carbon-nanotube-sulfur-composite-cathodes-with-high-sulfur-content-for-lithium-sulfur-batteries.pdf,0,0,0
1233502,Strongly coupled interfaces between a heterogeneous carbon host and a sulfur‐containing guest for highly stable lithium‐sulfur batteries: mechanistic insight into capacity …,2014,Hong‐Jie Peng and Ting‐Zheng Hou and Qiang Zhang and Jia‐Qi Huang and Xin‐Bing Cheng and Meng‐Qing Guo and Zhe Yuan and Lian‐Yuan He and Fei Wei,1,Advanced Materials Interfaces,7,1400227,,The use of conductive frameworks as the host scaffold to obtain nanostructured sulfur cathodes is an efficient way to increase the sulfur utilization for redox reaction in Li‐S batteries with large discharge capacity and high energy density. However. due to dynamical interfaces driven by phase evolution between the conductive hosts and S‐containing guests during cycling. the cathode still faces poor stability. Herein. the use of O‐/N‐containing nanocarbon as the conductive host sheds a light on the role of the dynamic interface between the carbon host and S‐containing guest for a stable Li‐S cell. The outstanding reversibility and stability of N‐doped C/S cathodes are attributed to the favorable guest‐host interaction at the electron‐modified interface. manifesting as (i) a chemical gradient to adsorb polar polysulfides and (ii) ameliorative deposition and recharging of Li2S on the region of electron‐rich pyridinic N and a …,True,5kidFf8AAAAJ:Tyk-4Ss8FVUC,317,https://onlinelibrary.wiley.com/doi/abs/10.1002/admi.201400227,4621852414480645313,/scholar?cites=4621852414480645313,,,https://www.researchgate.net/profile/Hong-Jie_Peng/publication/264200058_Batteries_Strongly_Coupled_Interfaces_between_a_Heterogeneous_Carbon_Host_and_a_Sulfur-Containing_Guest_for_Highly_Stable_Lithium-Sulfur_Batteries_Mechanistic_Insight_into_Capacity_Degradation_Adv_Mat/links/5a30dc64458515a13d8571df/Batteries-Strongly-Coupled-Interfaces-between-a-Heterogeneous-Carbon-Host-and-a-Sulfur-Containing-Guest-for-Highly-Stable-Lithium-Sulfur-Batteries-Mechanistic-Insight-into-Capacity-Degradation-Adv-Mat.pdf,0,0,0
1233503,Artificial soft–rigid protective layer for dendrite‐free lithium metal anode,2018,Rui Xu and Xue‐Qiang Zhang and Xin‐Bing Cheng and Hong‐Jie Peng and Chen‐Zi Zhao and Chong Yan and Jia‐Qi Huang,28,Advanced Functional Materials,8,1705838,,Lithium (Li) metal has been pursued as “Holy Grail” among various anode materials due to its high specific capacity and the lowest reduction potential. However. uncontrolled growth of Li dendrites and extremely unstable interfaces during repeated Li plating/stripping ineluctably plague the practical applications of Li metal batteries. Herein. an artificial protective layer with synergistic soft–rigid feature is constructed on the Li metal anode to offer superior interfacial stability during long‐term cycles. By suppressing random Li deposition and the formation of isolated Li. such a protective layer enables a dendrite‐free morphology of Li metal anode and suppresses the depletion of Li metal and electrolyte. Additionally. sufficient ionic conductivity is guaranteed through the synergy between soft and rigid structural units that are uniformly dispersed in the layer. Dendrite‐free and dense Li deposition. as well as a greatly …,True,5kidFf8AAAAJ:dfsIfKJdRG4C,316,https://onlinelibrary.wiley.com/doi/abs/10.1002/adfm.201705838,16904992910437095673,/scholar?cites=16904992910437095673,,,https://www.researchgate.net/profile/Xue_Qiang_Zhang/publication/322329753_Artificial_Soft-Rigid_Protective_Layer_for_Dendrite-Free_Lithium_Metal_Anode/links/5a544210458515e7b7321ae9/Artificial-Soft-Rigid-Protective-Layer-for-Dendrite-Free-Lithium-Metal-Anode.pdf,0,0,0
1233504,Coralloid carbon fiber-based composite lithium anode for robust lithium metal batteries,2018,Rui Zhang and Xiang Chen and Xin Shen and Xue-Qiang Zhang and Xiao-Ru Chen and Xin-Bing Cheng and Chong Yan and Chen-Zi Zhao and Qiang Zhang,2,Joule,4,764-777,Cell Press,Lithium metal is among the most promising anode materials in next-generation energy-storage systems. However. Li dendrite growth and unstable solid electrolyte interphase have hindered its practical applications. Structured current collectors have been widely proposed to settle these issues. whereas the pre-filling of Li metal into structured anode is challenging. We proposed a coralloid silver-coated carbon fiber-based composite Li anode (CF/Ag-Li) through Ag electroplating and molten Li infusion. The molten Li can be infused into the carbon fiber framework due to the lithiophilic nature of Ag. In addition. a dendrite-free morphology and extraordinary electrochemical performance are achieved in Li-LiFePO4 and Li-sulfur cells. The CF/Ag-Li|Li symmetrical cells can cycle for 160 cycles at 10.0 mA cm−2 and 10.0 mAh cm−2. The CF/Ag-Li|S cells exhibited a high initial discharge capacity of 785 mAh g−1 and a large …,True,5kidFf8AAAAJ:pyW8ca7W8N0C,307,https://www.sciencedirect.com/science/article/pii/S2542435118300473,14987839315237013235,/scholar?cites=14987839315237013235,,,https://www.sciencedirect.com/science/article/pii/S2542435118300473,0,0,0
1233505,Nanostructured energy materials for electrochemical energy conversion and storage: a review,2016,Xueqiang Zhang and Xinbing Cheng and Qiang Zhang,25,,6,967-984,Elsevier,Nanostructured materials have received tremendous interest due to their unique mechanical/electrical properties and overall behavior contributed by the complex synergy of bulk and interfacial properties for efficient and effective energy conversion and storage. The booming development of nanotechnology affords emerging but effective tools in designing advanced energy material. We reviewed the significant progress and dominated nanostructured energy materials in electrochemical energy conversion and storage devices. including lithium ion batteries. lithium–sulfur batteries. lithium–oxygen batteries. lithium metal batteries. and supercapacitors. The use of nanostructured electrocatalyst for effective electrocatalysis in oxygen reduction and oxygen evolution reactions for fuel cells and metal–air batteries was also included. The challenges in the undesirable side reactions between electrolytes and electrode due …,True,5kidFf8AAAAJ:-f6ydRqryjwC,290,https://www.sciencedirect.com/science/article/pii/S2095495616303096,18381760811811957040,/scholar?cites=18381760811811957040,,,https://engine.scichina.com/publisher/scp/journal/JEC/25/6/10.1016/j.jechem.2016.11.003?slug=full%20text,0,0,0
1233506,Highly stable lithium metal batteries enabled by regulating the solvation of lithium ions in nonaqueous electrolytes,2018,Xue‐Qiang Zhang and Xiang Chen and Xin‐Bing Cheng and Bo‐Quan Li and Xin Shen and Chong Yan and Jia‐Qi Huang and Qiang Zhang,130,Angewandte Chemie,19,5399-5403,,Safe and rechargeable lithium metal batteries have been difficult to achieve because of the formation of lithium dendrites. Herein an emerging electrolyte based on a simple solvation strategy is proposed for highly stable lithium metal anodes in both coin and pouch cells. Fluoroethylene carbonate (FEC) and lithium nitrate (LiNO3) were concurrently introduced into an electrolyte. thus altering the solvation sheath of lithium ions. and forming a uniform solid electrolyte interphase (SEI). with an abundance of LiF and LiNxOy on a working lithium metal anode with dendrite‐free lithium deposition. Ultrahigh Coulombic efficiency (99.96 %) and long lifespans (1000 cycles) were achieved when the FEC/LiNO3 electrolyte was applied in working batteries. The solvation chemistry of electrolyte was further explored by molecular dynamics simulations and first‐principles calculations. This work provides insight into …,True,5kidFf8AAAAJ:D03iK_w7-QYC,275,https://onlinelibrary.wiley.com/doi/abs/10.1002/ange.201801513,17319535045098960545,/scholar?cites=17319535045098960545,,,https://www.researchgate.net/profile/Xue_Qiang_Zhang/publication/323330116_Highly_Stable_Lithium_Metal_Batteries_Enabled_by_Regulating_the_Solvation_of_Lithium_Ions_in_Nonaqueous_Electrolytes/links/5ab209b9aca2721710002a9f/Highly-Stable-Lithium-Metal-Batteries-Enabled-by-Regulating-the-Solvation-of-Lithium-Ions-in-Nonaqueous-Electrolytes.pdf,0,0,0
1233507,Janus separator of polypropylene‐supported cellular graphene framework for sulfur cathodes with high utilization in lithium–sulfur batteries,2016,Hong‐Jie Peng and Dai‐Wei Wang and Jia‐Qi Huang and Xin‐Bing Cheng and Zhe Yuan and Fei Wei and Qiang Zhang,3,Advanced Science,1,1500268,,Owing to the conversion chemistry of the sulfur cathode. the lithium–sulfur (Li–S) batteries exhibit high theoretical energy density. However. the intrinsic mobile redox centers during the sulfur/Li2S‐to‐lithium polysulfides solid‐to‐liquid phase transition induce low sulfur utilization and poor cycling life. Herein. the Janus separator of mesoporous cellular graphene framework (CGF)/polypropylene membrane to promote the utilization of sulfur cathode is introduced. The porous polypropylene membrane serves as an insulating substrate in contact with lithium anode while CGFs that possess high electrical conductivity of 100 S cm−1. a large mesopore volume of 3.1 cm3 g−1. and a huge surface area of 2120 m2 g−1 are adhered on cathode side to reactivate the shuttling‐back polysulfides and to preserve the ion channels. Therefore. the Li–S cell with the “two‐face” CGF Janus separator exhibit a high initial capacity of …,True,5kidFf8AAAAJ:Wp0gIr-vW9MC,269,https://onlinelibrary.wiley.com/doi/abs/10.1002/advs.201500268,12716019683952641571,/scholar?cites=12716019683952641571,,,https://onlinelibrary.wiley.com/doi/pdfdirect/10.1002/advs.201500268,0,0,0
1233508,Janus separator of polypropylene‐supported cellular graphene framework for sulfur cathodes with high utilization in lithium–sulfur batteries,2016,Hong‐Jie Peng and Dai‐Wei Wang and Jia‐Qi Huang and Xin‐Bing Cheng and Zhe Yuan and Fei Wei and Qiang Zhang,3,Advanced Science,1,1500268,,Owing to the conversion chemistry of the sulfur cathode. the lithium–sulfur (Li–S) batteries exhibit high theoretical energy density. However. the intrinsic mobile redox centers during the sulfur/Li2S‐to‐lithium polysulfides solid‐to‐liquid phase transition induce low sulfur utilization and poor cycling life. Herein. the Janus separator of mesoporous cellular graphene framework (CGF)/polypropylene membrane to promote the utilization of sulfur cathode is introduced. The porous polypropylene membrane serves as an insulating substrate in contact with lithium anode while CGFs that possess high electrical conductivity of 100 S cm−1. a large mesopore volume of 3.1 cm3 g−1. and a huge surface area of 2120 m2 g−1 are adhered on cathode side to reactivate the shuttling‐back polysulfides and to preserve the ion channels. Therefore. the Li–S cell with the “two‐face” CGF Janus separator exhibit a high initial capacity of …,True,5kidFf8AAAAJ:MXK_kJrjxJIC,269,https://onlinelibrary.wiley.com/doi/abs/10.1002/advs.201500268,12716019683952641571,/scholar?cites=12716019683952641571,,,https://onlinelibrary.wiley.com/doi/pdfdirect/10.1002/advs.201500268,0,0,0
1233509,Rational integration of polypropylene/graphene oxide/nafion as ternary‐layered separator to retard the shuttle of polysulfides for lithium–sulfur batteries,2016,Ting‐Zhou Zhuang and Jia‐Qi Huang and Hong‐Jie Peng and Lian‐Yuan He and Xin‐Bing Cheng and Cheng‐Meng Chen and Qiang Zhang,12,Small,3,381-389,,The reversible electrochemical transformation from lithium (Li) and sulfur (S) into Li2S through multielectron reactions can be utilized in secondary Li–S batteries with very high energy density. However. both the low Coulombic efficiency and severe capacity degradation limits the full utilization of active sulfur. which hinders the practical applications of Li–S battery system. The present study reports a ternary‐layered separator with a macroporous polypropylene (PP) matrix layer. graphene oxide (GO) barrier layer. and Nafion retarding layer as the separator for Li–S batteries with high Coulombic efficiency and superior cyclic stability. In the ternary‐layered separator. ultrathin layer of GO (0.0032 mg cm−2. estimated to be around 40 layers) blocks the macropores of PP matrix. and a dense ion selective Nafion layer with a very low loading amount of 0.05 mg cm−2 is attached as a retarding layer to suppress the crossover …,True,5kidFf8AAAAJ:4TOpqqG69KYC,248,https://onlinelibrary.wiley.com/doi/abs/10.1002/smll.201503133,5042633389997968219,/scholar?cites=5042633389997968219,,,https://www.researchgate.net/profile/Hong-Jie_Peng/publication/286094011_Rational_Integration_of_PolypropyleneGraphene_OxideNafi_on_as_Ternary-Layered_Separator_to_Retard_the_Shuttle_of_Polysulfi_des_for_Lithium-Sulfur_Batteries/links/5caa80494585157bd32a6200/Rational-Integration-of-Polypropylene-Graphene-Oxide-Nafi-on-as-Ternary-Layered-Separator-to-Retard-the-Shuttle-of-Polysulfi-des-for-Lithium-Sulfur-Batteries.pdf,0,0,0
1233510,Dual-phase lithium metal anode containing a polysulfide-induced solid electrolyte interphase and nanostructured graphene framework for lithium–sulfur batteries,2015,Xin-Bing Cheng and Hong-Jie Peng and Jia-Qi Huang and Rui Zhang and Chen-Zi Zhao and Qiang Zhang,9,ACS nano,6,6373-6382,American Chemical Society,Lithium–sulfur (Li–S) batteries. with a theoretical energy density of 2600 Wh kg–1. are a promising platform for high-energy and cost-effective electrochemical energy storage. However. great challenges such as fast capacity degradation and safety concerns prevent it from widespread application. With the adoption of Li metal as the anode. dendritic and mossy metal depositing on the negative electrode during repeated cycles leads to serious safety concerns and low Coulombic efficiency. Herein. we report a distinctive graphene framework structure coated by an in situ formed solid electrolyte interphase (SEI) with Li depositing in the pores as the anode of Li–S batteries. The graphene-based metal anode demonstated a superior dendrite-inhibition behavior in 70 h of lithiation. while the cell with a Cu foil based metal anode was short-circuited after only 4 h of lithiation at 0.5 mA cm–2. The graphene-modified Li anode …,True,5kidFf8AAAAJ:0EnyYjriUFMC,248,https://pubs.acs.org/doi/abs/10.1021/acsnano.5b01990,3481358728568993652,/scholar?cites=3481358728568993652,,,https://pubs.acs.org/doi/pdf/10.1021/acsnano.5b01990,0,0,0
