,title,pub_year,author,volume,journal,number,pages,publisher,abstract,filled,author_pub_id,num_citations,pub_url,cites_id,citedby_url,author_id,eprint_url,got_citations,got_author_ids,author_ids
86028,Conversion of alpha-helices into beta-sheets features in the formation of the scrapie prion proteins,1993,Keh-Ming Pan and Michael Baldwin and Jack Nguyen and Maria Gasset and ANA Serban and Darlene Groth and Ingrid Mehlhorn and Ziwei Huang and Robert J Fletterick and Fred E Cohen,90,Proceedings of the National Academy of Sciences,23,10962-10966,National Academy of Sciences,Prions are composed largely. if not entirely. of prion protein (PrPSc in the case of scrapie). Although the formation of PrPSc from the cellular prion protein (PrPC) is a post-translational process. no candidate chemical modification was identified. suggesting that a conformational change features in PrPSc synthesis. To assess this possibility. we purified both PrPC and PrPSc by using nondenaturing procedures and determined the secondary structure of each. Fourier-transform infrared (FTIR) spectroscopy demonstrated that PrPC has a high alpha-helix content (42%) and no beta-sheet (3%). findings that were confirmed by circular dichroism measurements. In contrast. the beta-sheet content of PrPSc was 43% and the alpha-helix 30% as measured by FTIR. As determined in earlier studies. N-terminally truncated PrPSc derived by limited proteolysis. designated PrP 27-30. has an even higher beta-sheet content (54 …,True,MAlNgd0AAAAJ:Bg7qf7VwUHIC,2831,https://www.pnas.org/content/90/23/10962.short,15049870570224063222,/scholar?cites=15049870570224063222,,https://www.pnas.org/content/pnas/90/23/10962.full.pdf,0,0,0
86029,Structure and specificity of nuclear receptor–coactivator interactions,1998,Beatrice D Darimont and Richard L Wagner and James W Apriletti and Michael R Stallcup and Peter J Kushner and John D Baxter and Robert J Fletterick and Keith R Yamamoto,12,Genes & development,21,3343-3356,Cold Spring Harbor Lab,Combinatorial regulation of transcription implies flexible yet precise assembly of multiprotein regulatory complexes in response to signals. Biochemical and crystallographic analyses revealed that hormone binding leads to the formation of a hydrophobic groove within the ligand binding domain (LBD) of the thyroid hormone receptor that interacts with an LxxLL motif-containing α-helix from GRIP1. a coactivator. Residues immediately adjacent to the motif modulate the affinity of the interaction; the motif and the adjacent sequences are employed to different extents in binding to different receptors. Such interactions of amphipathic α-helices with hydrophobic grooves define protein interfaces in other regulatory complexes as well. We suggest that these common structural elements impart flexibility to combinatorial regulation. whereas side chains at the interface impart specificity.,True,MAlNgd0AAAAJ:jU7OWUQzBzMC,1073,http://genesdev.cshlp.org/content/12/21/3343.short,16802197426011282688,/scholar?cites=16802197426011282688,,http://genesdev.cshlp.org/content/12/21/3343.full.pdf,0,0,0
86030,A structural role for hormone in the thyroid hormone receptor,1995,Richard L Wagner and James W Apriletti and Mary E McGrath and Brian L West and John D Baxter and Robert J Fletterick,378,Nature,6558,690-697,Nature Publishing Group,The crystal structure of the rat aα thyroid hormone receptor ligand-binding domain bound with a thyroid hormone agonist reveals that ligand is completely buried within the domain as part of the hydrophobic core. In addition. the carboxy-terminal activation domain forms an amphi-pathic helix. with its hydrophobic face constituting part of the hormone binding cavity. These observations suggest a structural role for ligand. in establishing the active conformation of the receptor. that is likely to underlie hormonal regulation of gene expression for the nuclear receptors.,True,MAlNgd0AAAAJ:Dem6FJhTUoYC,1033,https://www.nature.com/articles/378690a0,18171051517826055860,/scholar?cites=18171051517826055860,,,0,0,0
86031,Crystal structure of the kinesin motor domain reveals a structural similarity to myosin,1996,F Jon Kull and Elena P Sablin and Rebecca Lau and Robert J Fletterick and Ronald D Vale,380,Nature,6574,550-555,Nature Publishing Group,KINESIN is the founding member of a superfamily of microtubule-based motor proteins that perform force-generating tasks such as organelle transport and chromosome segregation 1. 2. It has two identical∼ 960-amino-acid chains containing an ammo-terminal globular motor domain. a central α-helical region that enables dimer formation through a coiled-coil. and a carboxy-terminal tail domain that binds light chains and possibly an organelle receptor 1. The kinesin motor domain of∼ 340 amino acids. which can produce movement in vitro 3. is much smaller than that of myosin (∼ 850 amino acids) and dynein (1.000 amino acids). and is the smallest known molecular motor. Here. we report the crystal structure of the human kinesin motor domain with bound ADP determined to 1.8-Å resolution by X-ray crystallography. The motor consists primarily of a single α/β arrowhead-shaped domain with dimensions of 70× …,True,MAlNgd0AAAAJ:u-x6o8ySG0sC,753,https://www.nature.com/articles/380550a0,72875703907556574,/scholar?cites=72875703907556574,,https://www.ncbi.nlm.nih.gov/pmc/articles/PMC2851642/,0,0,0
86032,Hormone-dependent coactivator binding to a hydrophobic cleft on nuclear receptors,1998,Weijun Feng and Ralff CJ Ribeiro and Richard L Wagner and Hoa Nguyen and James W Apriletti and Robert J Fletterick and John D Baxter and Peter J Kushner and Brian L West,280,Science,5370,1747-1749,American Association for the Advancement of Science,The ligand-binding domain of nuclear receptors contains a transcriptional activation function (AF-2) that mediates hormone-dependent binding of coactivator proteins. Scanning surface mutagenesis on the human thyroid hormone receptor was performed to define the site that binds the coactivators. glucocorticoid receptor–interacting protein 1 (GRIP1) and steroid receptor coactivator 1 (SRC-1). The residues involved encircle a small surface that contains a hydrophobic cleft. Ligand activation of transcription involves formation of this surface by folding the carboxyl-terminal α helix against a scaffold of three other helices. These features may represent general ones for nuclear receptors.,True,MAlNgd0AAAAJ:4MWp96NkSFoC,673,https://science.sciencemag.org/content/280/5370/1747.abstract,9766690254426350107,/scholar?cites=9766690254426350107,,,0,0,0
86033,Structural clues to prion replication,1994,Fred E Cohen and Keh-Ming Pan and Ziwei Huang and Michael Baldwin and Robert J Fletterick and Stanley B Prusiner,264,Science,5158,530-532,American Association for the Advancement of Science,Prion diseases generate when a protein with a pathological mutation converts other proteins to its form. A model for prion replication is presented that attempts to explain the pathogenesis of infectious. inherited and sporadic prion diseases.,True,MAlNgd0AAAAJ:UebtZRa9Y70C,664,https://go.gale.com/ps/i.do?id=GALE%7CA15425569&sid=googleScholar&v=2.1&it=r&linkaccess=abs&issn=00368075&p=HRCA&sw=w,1099708061147857575,/scholar?cites=1099708061147857575,,,0,0,0
86034,The design plan of kinesin motors,1997,Ronald D Vale and Robert J Fletterick,13,,1,745-777,Annual Reviews,The kinesin superfamily comprises a large and structurally diverse group of microtubule-based motor proteins that produce a variety of force-generating activities within cells. This review addresses how the structures of kinesin proteins provide clues as to their biological functions and motile properties. We discuss structural features common to all kinesin motors. as well as specialized features that enable subfamilies of related motors to carry out specialized activities. We also discuss how the kinesin motor domain uses chemical energy from ATP hydrolysis to move along microtubules.,True,MAlNgd0AAAAJ:L1USKYWJimsC,554,https://www.annualreviews.org/doi/abs/10.1146/annurev.cellbio.13.1.745,16850694763413983871,/scholar?cites=16850694763413983871,,http://valelab4.ucsf.edu/external/publications/1997valeannrevcelldevbio.pdf,0,0,0
86035,The structure of mammalian 15-lipoxygenase reveals similarity to the lipases and the determinants of substrate specificity,1997,Sarah A Gillmor and Armando Villaseñor and Robert Fletterick and Elliott Sigal and Michelle F Browner,4,Nature structural biology,12,1003-1009,Nature Publishing Group,Here we report the first structure of a mammalian 15-lipoxygenase. The protein is composed of two domains; a catalytic domain and a previously unrecognized β-barrel domain. The N-terminal β-barrel domain has topological and sequence identity to a domain in the mammalian lipases. suggesting that these domains may have similar functions in vivo. Within the C-terminal domain. the lipoxygenase substrate binding site is a hydrophobic pocket defined by a bound inhibitor. Arachidonic acid can be docked into this deep hydrophobic pocket with the methyl end extending down into the bottom of the pocket and the acid end tethered by a conserved basic residue on the surface of the enzyme. This structure provides a unifying hypothesis for the positional specificity of mammalian lipoxygenases.,True,MAlNgd0AAAAJ:7BrZ7Jt4UNcC,532,https://www.nature.com/articles/nsb1297-1003,16428970732866944300,/scholar?cites=16428970732866944300,,,0,0,0
86036,Viral cysteine proteases are homologous to the trypsin-like family of serine proteases: structural and functional implications,1988,J Fernando Bazan and Robert J Fletterick,85,Proceedings of the National Academy of Sciences,21,7872-7876,National Academy of Sciences,Proteases that are encoded by animal picornaviruses and plant como- and potyviruses form a related group of cysteine-active-center enzymes that are essential for virus maturation. We show that these proteins are homologous to the family of trypsin-like serine proteases. In our model. the active-site nucleophile of the trypsin catalytic triad. Ser-195. is changed to a Cys residue in these viral proteases. The other two residues of the triad. His-57 and Asp-102. are otherwise absolutely conserved in all the viral protease sequences. Secondary structure analysis of aligned sequences suggests the location of the component strands of the twin beta-barrel trypsin fold in the viral proteases. Unexpectedly. the 2a and 3c subclasses of viral cysteine proteases are. respectively. homologous to the small and large structural subclasses of trypsin-like serine proteases. This classification allows the molecular mapping of residues …,True,MAlNgd0AAAAJ:0N-VGjzr574C,505,https://www.pnas.org/content/85/21/7872.short,11510453046003622497,/scholar?cites=11510453046003622497,,https://www.pnas.org/content/pnas/85/21/7872.full.pdf,0,0,0
86037,Redesigning trypsin: alteration of substrate specificity,1985,Charles S Craik and Corey Largman and Thomas Fletcher and Steven Roczniak and Philip J Barr and Robert Fletterick and William J Rutter,228,Science,4697,291-297,American Association for the Advancement of Science,A general method for modifying eukaryotic genes by site-specific mutagenesis and subsequent expression in mammalian cells was developed to study the relation between structure and function of the proteolytic enzyme trypsin. Glycine residues at positions 216 and 226 in the binding cavity of trypsin were replaced by alanine residues. resulting in three trypsin mutants. Computer graphic analysis suggested that these substitutions would differentially affect arginine and lysine substrate binding of the enzyme. Although the mutant enzymes were reduced in catalytic rate. they showed enhanced substrate specificity relative to the native enzyme. This increased specificity was achieved by the unexpected differential effects on the catalytic activity toward arginine and lysine substrates. Mutants containing alanine at position 226 exhibited an altered conformation that may be converted to a trypsin-like structure upon …,True,MAlNgd0AAAAJ:b0M2c_1WBrUC,461,https://science.sciencemag.org/content/228/4697/291.abstract,4797234640124911678,/scholar?cites=4797234640124911678,,https://www.researchgate.net/profile/Charles_Craik/publication/19322530_Redesigning_trypsin_Alteration_of_substrate_specificity/links/00b7d5164ce671814f000000.pdf,0,0,0
86038,Structural analyses reveal phosphatidyl inositols as ligands for the NR5 orphan receptors SF-1 and LRH-1,2005,Irina N Krylova and Elena P Sablin and Jamie Moore and Robert X Xu and Gregory M Waitt and J Andrew MacKay and Dalia Juzumiene and Jane M Bynum and Kevin Madauss and Valerie Montana and Lioudmila Lebedeva and Miyuki Suzawa and Jon D Williams and Shawn P Williams and Rodney K Guy and Joseph W Thornton and Robert J Fletterick and Timothy M Willson and Holly A Ingraham,120,Cell,3,343-355,Cell Press,Vertebrate members of the nuclear receptor NR5A subfamily. which includes steroidogenic factor 1 (SF-1) and liver receptor homolog 1 (LRH-1). regulate crucial aspects of development. endocrine homeostasis. and metabolism. Mouse LRH-1 is believed to be a ligand-independent transcription factor with a large and empty hydrophobic pocket. Here we present structural and biochemical data for three other NR5A members—mouse and human SF-1 and human LRH-1—which reveal that these receptors bind phosphatidyl inositol second messengers and that ligand binding is required for maximal activity. Evolutionary analysis of structure-function relationships across the SF-1/LRH-1 subfamily indicates that ligand binding is the ancestral state of NR5A receptors and was uniquely diminished or altered in the rodent LRH-1 lineage. We propose that phospholipids regulate gene expression by directly binding to NR5A …,True,MAlNgd0AAAAJ:ufrVoPGSRksC,429,https://www.sciencedirect.com/science/article/pii/S009286740500098X,609514971343890447,/scholar?cites=609514971343890447,,https://www.sciencedirect.com/science/article/pii/S009286740500098X,0,0,0
86039,Predicted alpha-helical regions of the prion protein when synthesized as peptides form amyloid,1992,Maria Gasset and Michael A Baldwin and David H Lloyd and Jean-Marc Gabriel and David M Holtzman and Fred Cohen and Robert Fletterick and Stanley B Prusiner,89,Proceedings of the National Academy of Sciences,22,10940-10944,National Academy of Sciences,By comparing the amino acid sequences of 11 mammalian and 1 avian prion proteins (PrP). structural analyses predicted four alpha-helical regions. Peptides corresponding to these regions of Syrian hamster PrP were synthesized. and. contrary to predictions. three of the four spontaneously formed amyloids as shown by electron microscopy and Congo red staining. By IR spectroscopy. these amyloid peptides exhibited secondary structures composed largely of beta-sheets. The first of the predicted helices is the 14-amino acid peptide corresponding to residues 109-122; this peptide and the overlapping 15-residue sequence 113-127 both form amyloid. The most highly amyloidogenic peptide is AGAAAAGA. which corresponds to Syrian hamster PrP residues 113-120 and is conserved across all species for which the PrP sequence has been determined. Two other predicted alpha-helices corresponding to residues …,True,MAlNgd0AAAAJ:olpn-zPbct0C,423,https://www.pnas.org/content/89/22/10940.short,6992805009581650095,/scholar?cites=6992805009581650095,,https://www.pnas.org/content/pnas/89/22/10940.full.pdf,0,0,0
86040,Evidence that the N-terminal domain of nonstructural protein NS3 from yellow fever virus is a serine protease responsible for site-specific cleavages in the viral polyprotein.,1990,Thomas J Chambers and Ronald C Weir and Arash Grakoui and David W McCourt and J Fernando Bazan and Robert J Fletterick and Charles M Rice,87,Proceedings of the National Academy of Sciences,22,8898-8902,National Academy of Sciences,Sequence homology and molecular modeling studies have suggested that the N-terminal one-third of the flavirvirus nonstructural protein NS3 functions as a trypsin-like serine protease. To examine the putative proteolytic activity of NS3. segments of the yellow fever virus genome were subcloned into plasmid transcription/translation vectors and cell-free translation products were characterized. The results suggest that a protease activity encoded within NS2B and the N-terminal one-third of yellow fever virus NS3 is capable of cis-acting site-specific proteolysis at the NS2B-NS3 cleavage site and dilution-insensitive cleavage of the NS2A-NS2B site. Site-directed mutagenesis of the His-53. Asp-77. and Ser-138 residues of NS3 that compose the proposed catalytic triad implicates this domain as a serine protease. Infectious virus was not recovered from mammalian cells transfected with RNAs transcribed from full-length …,True,MAlNgd0AAAAJ:zCSUwVk65WsC,421,https://www.pnas.org/content/87/22/8898.short,15954665514354474537,/scholar?cites=15954665514354474537,,https://www.pnas.org/content/pnas/87/22/8898.full.pdf,0,0,0
86041,The family of glycogen phosphorylases: structure and functio,1989,Christopher B Newgard and Peter K Hwang and Robert J Fletterick,24,,1,69-99,Taylor & Francis,Glycogen phosphorylase (1. 4 aD-glucan: orthophosphate aD-glucosyltransferase. EC 2.4. 1.1) isozymes play a central role in the mobilization of carbohydrate reserves in a wide variety of organisms and tissues. By far. the best-studied phosphorylase isozyme is that from rabbit skeletal muscle. This enzyme was discovered in 1936 and shown to be dependent on AMP for activity in 1938.’e2 Demonstration of a covalent mechanism of interconversion of active and inactive forms of phosphorylase was demonstrated as early as 1943. 3* 4 but the role of phosphorylase b kinase and phosphorylase phosphatase in covalent phosphorylatiod dephosphorylation was first established in 1955.5* 6 The 6-A X-ray crystal structure of the inactive phosphorylase b enzyme was published in 1974.’followed by the 3-A structure of phosphorylase a in 1976? The atomic resolution structures for the a and b enzymes are now complete …,True,MAlNgd0AAAAJ:Dip1O2bNi0gC,407,https://www.tandfonline.com/doi/pdf/10.3109/10409238909082552,11038756436827225893,/scholar?cites=11038756436827225893,,,0,0,0
86042,Crystal structure of the motor domain of the kinesin-related motor ncd,1996,Elena P Sablin and F Jon Kull and Roger Cooke and Ronald D Vale and Robert J Fletterick,380,Nature,6574,555-559,Nature Publishing Group,MICROTUBULE-BASED ATPases of the kinesin superfamily 1. 2 provide the motile force for many animated features of living cells. Kinesin motors differ in their direction of movement along microtubules. Kinesin 3 and ncd 4. 5. a kinesin-related motor involved in formation and maintenance of mitotic and meiotic spindles. move in opposite directions along microtubules. even though their motor domains are 40% identical in amino-acid sequence. Here we report the crystal structure of the MgADP complex of the Drosophila ncd motor domain determined to 2.5 Å by X-ray crystallography. and compare it to the kinesin structure. The ncd and kinesin motor domains are remarkably similar in structure. and the locations of conserved surface amino acids suggest these motors share a common microtubule-binding site. Moreover. structural and functional comparisons of ncd. kinesin. myosin and G proteins indicate that these …,True,MAlNgd0AAAAJ:gsN89kCJA0AC,394,https://www.nature.com/articles/380555a0,10144148770382156469,/scholar?cites=10144148770382156469,,http://valelab.ucsf.edu/external/publications/1996sablinenature.pdf,0,0,0
86043,Detection of a trypsin-like serine protease domain in flaviviruses and pestviruses,1989,J Fernando Bazan and Robert J Fletterick,171,Virology,2,637-639,Academic Press,We propose through a sequence and structural-pattern analysis that a protein domain of undefined function encoded by the enveloped RNA flavi- and pestiviruses is a Ser active-center enzyme related to the cellular trypsin family. A further homology is emphasized with the group of (Cys active-center) viral proteases encoded by nonenveloped RNA viruses of the picorna-. como-. nepo-. and potyvirus classes. Structural modeling of the putative flaviviral protease domain suggests amino acids that are crucial for catalytic activity and substrate binding.,True,MAlNgd0AAAAJ:WF5omc3nYNoC,386,https://www.sciencedirect.com/science/article/pii/0042682289906399,563504915359618440,/scholar?cites=563504915359618440,,,0,0,0
86044,Nuclear-receptor ligands and ligand-binding domains,1999,Ross V Weatherman and Robert J Fletterick and Thomas S Scanlan,68,,1,559-581,Annual Reviews,The determination of several structures of nuclear receptor ligand binding domains (LBD) has led to new insights into the mechanism of action of this very important class of receptors. This review describes and compares the different LBD structures and their relationship to the function of the nuclear receptors. The role of the ligand in the LBD structures and the implications of ligand structure on receptor activity are also discussed. Structural information regarding interactions between the LBD and coactivator proteins and the potential role of these interactions in ligand agonism and antagonism is reviewed. Different pathways for nuclear receptor signaling and the use of new ligands to investigate these pathways are also described.,True,MAlNgd0AAAAJ:vDijr-p_gm4C,385,https://www.annualreviews.org/doi/abs/10.1146/annurev.biochem.68.1.559,9334927754874251061,/scholar?cites=9334927754874251061,,,0,0,0
86045,Switch-based mechanism of kinesin motors,2001,Masahide Kikkawa and Elena P Sablin and Yasushi Okada and Hiroaki Yajima and Robert J Fletterick and Nobutaka Hirokawa,411,Nature,6836,439-445,Nature Publishing Group,Kinesin motors are specialized enzymes that use hydrolysis of ATP to generate force and movement along their cellular tracks. the microtubules. Although numerous biochemical and biophysical studies have accumulated much data that link microtubule-assisted ATP hydrolysis to kinesin motion. the structural view of kinesin movement remains unclear. This study of the monomeric kinesin motor KIF1A combines X-ray crystallography and cryo-electron microscopy. and allows analysis of force-generating conformational changes at atomic resolution. The motor is revealed in its two functionally critical states—complexed with ADP and with a non-hydrolysable analogue of ATP. The conformational change observed between the ADP-bound and the ATP-like structures of the KIF1A catalytic core is modular. extends to all kinesins and is similar to the conformational change used by myosin motors and G proteins. Docking …,True,MAlNgd0AAAAJ:zYLM7Y9cAGgC,369,https://www.nature.com/articles/35078000,253931864295445896,/scholar?cites=253931864295445896,,,0,0,0
86046,Perturbation of the secondary structure of the scrapie prion protein under conditions that alter infectivity,1993,Maria Gasset and Michael A Baldwin and Robert J Fletterick and Stanley B Prusiner,90,Proceedings of the National Academy of Sciences,1,1-5,National Academy of Sciences,Limited proteolysis of the scrapie prion protein (PrPSc) generates PrP 27-30. which polymerizes into amyloid. By attenuated total reflection-Fourier transform infrared spectroscopy. PrP 27-30 polymers contained 54% beta-sheet. 25% alpha-helix. 10% turns. and 11% random coil; dispersion into detergent-lipid-protein-complexes preserved infectivity and secondary structure. Almost 60% of the beta-sheet was low-frequency infrared-absorbing. reflecting intermolecular aggregation. Decreased low-frequency beta-sheet and increased turn content were found after SDS/PAGE. which disassembled the amyloid polymers. denatured PrP 27-30. and diminished scrapie infectivity. Acid-induced transitions were reversible. whereas alkali produced an irreversible transition centered at pH 10 under conditions that diminished infectivity. Whether PrPSc synthesis involves a transition in the secondary structure of one or more …,True,MAlNgd0AAAAJ:BJbdYPG6LGMC,342,https://www.pnas.org/content/90/1/1.short,15002198070404132970,/scholar?cites=15002198070404132970,,https://www.pnas.org/content/pnas/90/1/1.full.pdf,0,0,0
86047,Structural changes in glycogen phosphorylase induced by phosphorylation,1988,SR Sprang and KR Acharya and EJ Goldsmith and DI Stuart and K Varvill and RJ Fletterick and NB Madsen and LN Johnson,336,Nature,6196,215-221,Nature Publishing Group,A comparison of the refined crystal structures of dimeric glycogen phosphorylase b and a reveals structural changes that represent the first step in the activation of the enzyme. On phosphorylation of serine-14. the N-terminus of each subunit assumes an ordered helical conformation and binds to the surface of the dimer. The consequent structural changes at the N-and C-terminal regions lead to strengthened interactions between subunits and alter the binding sites for allosteric effectors and substrates.,True,MAlNgd0AAAAJ:2P1L_qKh6hAC,318,https://www.nature.com/articles/336215a0,3787928003120862340,/scholar?cites=3787928003120862340,,,0,0,0
