,title,pub_year,author,volume,journal,number,pages,publisher,abstract,filled,author_pub_id,num_citations,pub_url,cites_id,citedby_url,author_id,eprint_url,got_citations
29855,Differential cognitive impairment in Alzheimer's disease and Huntington's disease,1988,Jason Brandt and Susan E Folstein and Marshal F Folstein,23,Annals of Neurology: Official Journal of the American Neurological Association and the Child Neurology Society,6,555-561,Wiley Subscription Services. Inc.. A Wiley Company,The differentiation between cortical and subcortical dementias requires that the cognitive characteristics of dementias attributable to different causes be discriminable. For large samples of Alzheimer's disease and Huntington's disease patients. distinct cognitive profiles were obtained on the Mini‐Mental State Exam. The profile differences were independent of severity of dementia and were sufficiently robust to classify patients as Alzheimer's disease or Huntington's disease with 84% accuracy. The qualitative differences in cognitive functioning may also be typical of other cortical and subcortical dementias.,True,3JsfnzsAAAAJ:ZzlSgRqYykMC,232,https://onlinelibrary.wiley.com/doi/abs/10.1002/ana.410230605,18117358598572960622,/scholar?cites=18117358598572960622,,,0
29856,MMSE-2: Mini-mental state examination,2010,Marshal F Folstein and Susan E Folstein and Travis White and Melissa A Messer,,,,,Psychological Assessment Resources,,True,3JsfnzsAAAAJ:8Xgff_V0N9gC,231,http://scholar.google.com/scholar?cluster=1970985377121341974&hl=en&oi=scholarr,1970985377121341974,/scholar?cites=1970985377121341974,,,0
29857,Memory complaint. memory performance. and psychiatric diagnosis: a community study,1993,Susan Spear Bassett and Marshal F Folstein,6,Journal of geriatric psychiatry and neurology,2,105-111,Sage Publications,This study examined the prevalence of memory complaint and poor memory performance on brief screening measures within a community sample of 810 adults. All individuals received an extensive household interview and a clinical psychiatric evaluation. Overall. 22% indicated that they currently had trouble with their memory. This percentage increased with age. rising to 43% for those 65 to 74 years old. 51% for those 75 to 84 years old. and 88% for those 85 years of age and older; the percentage indicating memory problems decreased with educational attainment. The prevalence of poor memory performance was 11%. also increasing with less education and increased age. rising to 26% for those 65 to 74 years old and to 40% for those older then 75. Those who complained of memory trouble were twice as likely to show poor memory performance (29%) compared with those who did not complain (15 …,True,3JsfnzsAAAAJ:artPoR2Yc-kC,228,https://journals.sagepub.com/doi/abs/10.1177/089198879300600207,3460475189464583661,/scholar?cites=3460475189464583661,,http://citeseerx.ist.psu.edu/viewdoc/download?doi=10.1.1.890.6988&rep=rep1&type=pdf,0
29858,DSM-III personality disorders in the community.,1994,Jack F Samuels and Gerald Nestadt and Alan J Romanoski and Marshal F Folstein and Paul R McHugh,,The American journal of psychiatry,,,American Psychiatric Assn,Estimated the prevalence of and comorbidity among Diagnostic and Statistical Manual of Mental Disorders-III (DSM-III) personality disorders (PDs) in 762 adults. Axis I comorbidity. life events. and treatment need were also examined among Ss with and without PDs. Ss were directly examined by psychiatrists to diagnose all DSM-III PDs and other DSM-III psychiatric disorders. 57 Ss were diagnosed with a DSM-III PD. and 38 Ss received a provisional diagnosis of PD. Men had higher rates of PD than women. and Ss who were separated or divorced had the highest rates of PD. There was little comorbidity among specific personality disorders. PDs were also associated with Axis I disorders. and Ss with PDs were more likely to have a history of sexual dysfunctions. alcohol-or drug-use disorders. or suicidal thoughts and attempts. These Ss also reported more life events in the past year. Only one-fifth of Ss diagnosed …,True,3JsfnzsAAAAJ:8xutWZnSdmoC,227,https://psycnet.apa.org/record/1994-45462-001,11214547820215996282,/scholar?cites=11214547820215996282,,,0
29859,Dementia syndrome of depression,1979,Marshal F Folstein,,"Alzheimer's disease, senile dementia and related disorders",,87-93,Raven Press,"CiNii 国立情報学研究所 学術情報ナビゲータ[サイニィ]. メニュー 検索 … 
",True,3JsfnzsAAAAJ:GFxP56DSvIMC,223,https://ci.nii.ac.jp/naid/10009176651/,11438714253619392070,/scholar?cites=11438714253619392070,,,0
29860,Vitamin D is associated with cognitive function in elders receiving home health services,2009,Jennifer S Buell and Tammy M Scott and Bess Dawson-Hughes and Gerard E Dallal and Irwin H Rosenberg and Marshal F Folstein and Katherine L Tucker,64,Journals of Gerontology Series A: Biomedical Sciences and Medical Sciences,8,888-895,Oxford University Press,The objective of this study was to examine the association between 25-hydroxyvitamin D. 25(OH)D. and cognitive function.A cross-sectional investigation of 25(OH)D and cognition was completed in 377 black and 703 non-black (mainly Caucasian) elders (65–99 years) participating in the nutrition and memory in elders study. Participants underwent a comprehensive neuropsychological battery. and 25(OH)D concentrations were obtained.More than 65% of elders had suboptimal 25(OH)D concentrations (≤20 ng/mL or ≤50 nmol/L). Approximately 18% were deficient in 25(OH)D (<10 ng/mL or <25 nmol/L). After adjusting for age. sex. race. body mass index. education. center. kidney function. seasonality. physical activity. and alcohol use. 25(OH)D was associated with better performance on trails A (β = –0.49. p < .03). trails B …,True,3JsfnzsAAAAJ:AHdEip9mkN0C,218,https://academic.oup.com/biomedgerontology/article-abstract/64A/8/888/664270,16974840089723592790,/scholar?cites=16974840089723592790,,https://academic.oup.com/biomedgerontology/article/64A/8/888/664270,0
29861,The diagnosis of Huntington's disease,1986,Susan E Folstein and R John Leigh and Irma M Parhad and Marshal F Folstein,36,Neurology,10,1279-1279,Wolters Kluwer Health. Inc. on behalf of the American Academy of Neurology,We investigated all patients in Maryland reported to have Huntington9s disease (HD). and found considerable diagnostic inaccuracy. Fifteen percent of cases reported as HD actually had some other diagnosable condition; 11% of cases that met diagnostic criteria for HD had been given some other diagnosis. Diagnostic errors could be reduced by documentation of the family history by systematic interviewing of relatives and by demonstration of the characteristic disorder of voluntary movement in addition to chorea.,True,3JsfnzsAAAAJ:fbc8zXXH2BUC,212,https://n.neurology.org/content/36/10/1279.short,2580713159648112993,/scholar?cites=2580713159648112993,,,0
29862,The measurement of abnormal movement: methods developed for Huntington's disease.,1983,Susan E Folstein and Barbara Jensen and R John Leigh and Marshal F Folstein,,Neurobehavioral Toxicology & Teratology,,,Elsevier Science,Developed clinical and laboratory methods to detect motor abnormalities in patients with Huntington's disease (HD). 116 Ss at-risk for HD were compared to HD patients and to age-matched controls. using a quantitated neurological examination. Mechanized methods of measuring involuntary movement (accelerometer) and voluntary movement (RT. tapping speed. and movement time) were also developed. The motor abnormalities detected on the clinical and mechanical tests were not specific to HD but were also present in at-risk Ss and in Ss with a variety of neurological disorders. The mechanized tests may be useful for screening for motor disorders in the population.(9 ref)(PsycINFO Database Record (c) 2016 APA. all rights reserved),True,3JsfnzsAAAAJ:Aul-kAQHnToC,199,https://psycnet.apa.org/record/1984-30350-001,722002904903878870,/scholar?cites=722002904903878870,,,0
29863,Alzheimer's disease in the national academy of sciences—national research council registry of aging twin veterans: Iii. detection of cases. longitudinal results. and …,1995,John CS Breitner and Kathleen A Welsh and Barbara A Gau and William M McDonald and David C Steffens and Ann M Saunders and Kathryn M Magruder and Michael J Helms and Brenda L Plassman and Marshal F Folstein and Jason Brandt and C Dennis Robinette and William F Page,52,Archives of Neurology,8,763-771,American Medical Association,To detect cases of Alzheimer's disease (AD) in a large population of twins living throughout the United States and to examine concordance for AD in twins as a function of age and genotype for apolipoprotein E (APOE).Nationwide survey.Multistage screening and field evaluation beginning with two telephone interviews and culminating with laboratory tests. longitudinal neuropsychological measures. physician examination. and diagnostic consensus among experts.Membership in 1990-1991 of intact pairs in the National Academy of Sciences—National Research Council Registry of veteran twins. then aged 62 to 73 years.Completeness of case detection was examined in collateral studies. Zygosity andAPOEgenotypes were determined by restriction mapping. Concordance was calculated by the proband method.Ninety subjects who screened …,True,3JsfnzsAAAAJ:5MTHONV0fEkC,197,https://jamanetwork.com/journals/jamaneurology/article-abstract/593579,1244856311900497613,/scholar?cites=1244856311900497613,,http://www.academia.edu/download/34441505/AD_in_Aging_Twin_Veterans_Breitner.pdf,0
29864,Dementia: case ascertainment in a community survey,1991,Marshal F Folstein and Susan Spear Bassett and James C Anthony and Alan J Romanoski and Gerald R Nestadt,46,Journal of Gerontology,4,M132-M138,The Gerontological Society of America,The three-stage East Baltimore Mental Health Survey. conducted in 1981 as part of the Epidemiological Catchment Area Program. provided an opportunity to assess the prevalence of dementia and specific dementing disorders in a community-based. cross-sectional sample of the population. From the 3.841 households originally sampled. 810 individuals were selected for clinical psychiatric evaluation. Forty-one individuals were given a provisional diagnosis and referred to Stage 3 for differential diagnosis. with 32 individuals completing this evaluation. Thorough clinical evaluation of these cases resulted in an overall prevalence of dementia of 4.5% in those 65 years of age and older. The prevalence of specific dementing disorders was Alzheimer's disease (AD) (2.0%). Multi-Infarct Dementia (MID) (2.0%) and Mixed Dementia (MD) (0.5%). Prevalence increased with age for all dementias: Non-Whites had …,True,3JsfnzsAAAAJ:lvd772isFD0C,191,https://academic.oup.com/geronj/article-abstract/46/4/M132/530394,3904538148344410996,/scholar?cites=3904538148344410996,,,0
29865,Psychiatric disturbances in neurological patients: detection. recognition. and hospital course,1978,JR DePaulo Jr and Marshal F Folstein,4,Annals of Neurology: Official Journal of the American Neurological Association and the Child Neurology Society,3,225-228,Wiley Subscription Services. Inc.. A Wiley Company,The Mini‐Mental State and General Health Questionnaire were used to detect cognitive defects and emotional disturbances. respectively. in 126 consecutively admitted neurological patients. The Mini‐Mental State was revalidated in this sample as a measure related to cerebral disorder. Sixty‐seven percent of the patients tested had cognitive defect. emotional disturbance. or both. Thirty percent of the patients with psychiatric disturbance were not recognized by their physician. The majority of psychiatric disturbances persisted at the time of discharge.Since psychiatric disturbances are common among neurological inpatients and are frequently unrecognized. further evaluation of the psychiatric training of neurologists is needed. Simple screening tests may help to increase the recognition of psychiatric disturbance. It is concluded that the Board requirement for neurologists to know psychiatry accurately reflects “the …,True,3JsfnzsAAAAJ:gKiMpY-AVTkC,190,https://onlinelibrary.wiley.com/doi/abs/10.1002/ana.410040306,6523843009542520755,/scholar?cites=6523843009542520755,,,0
29866,Delirium: phenomenologic and etiologic subtypes,1991,Christopher A Ross and Carol E Peyser and IRA Shapiro and Marshal F Folstein,3,International Psychogeriatrics,2,135-147,Cambridge University Press,While all delirious patients have clouding of consciousness (alteration of attention) and cognitive dysfunction. the level of alertness of different patients may range from stuporous to hyperalert. We. therefore. developed an analog scale to rate the alertness of delirious patients. and a separate scale to rate the severity of their clouding of consciousness. Based on these scales. patients were categorized overall as relatively “activated” (relatively alert despite clouding of consciousness). or “somnolent” (relatively stuporous along with clouding of consciousness). Cognitive function was estimated using the Mini-Mental Status Exam. Separate ratings were made of hallucinations. delusions. illusions. and agitated behavior. Activated and somnolent patients had similar ages. overall severity of delirium. and Mini-Mental Status Exam scores. Activated patients. however. were more likely to have hallucinations. delusions. and …,True,3JsfnzsAAAAJ:5icHVeHT4IsC,189,https://www.cambridge.org/core/journals/international-psychogeriatrics/article/delirium-phenomenologic-and-etiologic-subtypes/4CD8CA2C966C4F293971C0FEF17C3436,1646418963488999039,/scholar?cites=1646418963488999039,,,0
29867,Huntington disease in Maryland: clinical aspects of racial variation.,1987,Susan E Folstein and GARY A Chase and WE Wahl and ANNE M McDonnell and MARSHAL F Folstein,41,American Journal of Human Genetics,2,168,Elsevier,In a Maryland survey of Huntington disease. the prevalence in blacks was unexpectedly high and equal to that in whites. Age at onset was earlier in blacks. and their clinical features. at all ages at onset. were similar to those seen in juvenile-onset Huntington disease. Blacks had more severe bradykinesia and abnormalities of eye movement and less frequent psychiatric disorder. particularly depression.,True,3JsfnzsAAAAJ:gVv57TyPmFsC,185,https://www.ncbi.nlm.nih.gov/pmc/articles/PMC1684204/,7994050258059939996,/scholar?cites=7994050258059939996,,https://www.ncbi.nlm.nih.gov/pmc/articles/PMC1684204/pdf/ajhg00131-0084.pdf,0
29868,Amyloid-associated depression: a prodromal depression of Alzheimer disease?,2008,Xiaoyan Sun and David C Steffens and Rhoda Au and Marshal Folstein and Paul Summergrad and Jacqueline Yee and Irwin Rosenberg and D Mkaya Mwamburi and Wei Qiao Qiu,65,Archives of general psychiatry,5,542-550,American Medical Association,A high ratio of plasma amyloid-β peptide 40 (Aβ40) to Aβ42. determined by both high Aβ40and low Aβ42levels. increases the risk of Alzheimer disease. In a previous study. we reported that depression is also associated with low plasma Aβ42levels in the elderly population.To characterize plasma Aβ40:Aβ42ratio and cognitive function in elderly individuals with and without depression.Cross-sectional study.Homecare agencies.A total of 995 homebound elderly individuals of whom 348 were defined as depressed by a Center for Epidemiological Studies Depression score of 16 or greater.Cognitive domains of memory. language. executive. and visuospatial functions according to levels of plasma Aβ40and Aβ42peptides.Subjects with depression had lower plasma Aβ42levels (median. 14.1 vs 19.2 pg/mL;P = .006) and a higher plasma Aβ40 …,True,3JsfnzsAAAAJ:jgBuDB5drN8C,174,https://jamanetwork.com/journals/jamapsychiatry/article-abstract/482700,5419715724669908238,/scholar?cites=5419715724669908238,,https://jamanetwork.com/journals/jamapsychiatry/fullarticle/482700,0
29869,Assessing patient dependence in Alzheimer's disease,1994,Yaakov Stern and Steven M Albert and Mary Sano and Marcus Richards and Lisa Miller and Marshal Folstein and Marilyn Albert and Frederick W Bylsma and Ginette Lafleche,49,Journal of Gerontology,5,M216-M222,The Gerontological Society of America,While cognitive and functional deficits are the hallmark of Alzheimer's disease (AD). loss of social function (and the dependence this implies) is also critical. especially in early stages of disease. Little attention has been directed to this facet of dementing disease. We describe a scale for assessing dependency in AD and present a baseline profile of dependency in a cohort of AD patients.In a study of the predictors of the course of AD. 233 patients in early stages of disease (modified MMS 5* 30) were assessed. Psychometric properties of the dependence scale were established. To validate the scale. dependence scores at baseline were correlated with a series of measures assessing cognition and function. The course of dependency over 18 months of follow-up was also analyzed.The scale shows adequate reliability (test …,True,3JsfnzsAAAAJ:F1b5ZUV5XREC,166,https://academic.oup.com/geronj/article-abstract/49/5/M216/543899,1542558742629558419,/scholar?cites=1542558742629558419,,https://academiccommons.columbia.edu/doi/10.7916/D8P289PN/download,0
29870,Head injury as a risk factor in Alzheimer's disease,1995,DX Rasmusson and Jason Brandt and DB Martin and Marshal F Folstein,9,Brain Injury,3,213-219,Taylor & Francis,Several case-control studies have reported head injury to be more common among patients with Alzheimer's disease (AD) than healthy elderly controls. The present study sought to determine whether milder head injury is also a risk factor for AD. Furthermore. it was hypothesized that head injury would be more common among AD patients without a genetic risk for the disease. History of head injury in 68 consecutive cases of probable or definite AD and 34 non-demented control subjects was ascertained from their spouses. Head injury was reported in 20 of the AD patients (29%). and in only one control subject (2.9%) (odds ratio = 13.75). Twenty per cent of the familial and 43.5% of the sporadic AD cases reportedly had a premorbid head injury (odds ratio = 3.08). Head injury had no effect on age of dementia onset. The results indicate that head trauma may be a predisposing factor to AD. particularly in the absence …,True,3JsfnzsAAAAJ:Ak0FvsSvgGUC,159,https://www.tandfonline.com/doi/abs/10.3109/02699059509008194,16746978711884722745,/scholar?cites=16746978711884722745,,,0
29871,Association between family history of affective disorder and the depressive syndrome of Alzheimer’s disease,1990,Gary A Chase,147,Am J Psychiatry,4,452-456,,METHODWe selected index and comparison subjects from 400 consecutively referred patients who were evaluated at the Johns Hopkins Department of Psychiatry’s Dementia Research Clinic between January 1979 and January 1984 for symptoms of cognitive decline beginfling in late life. We examined the charts of all such individuals to determine which of them had met critena for a DSM-III diagnosis of primary degenerative dementia and a diagnosis of probable Alzheimer’s disease made according to the criteria of the National Institute of Neurological and Communicative Disordens and Stroke (NINCDS) and the Alzheimer’s Disease and Related Disorders Association(ADRDA)(15). At the time of assessment each patient was cxamined by an attending psychiatrist and underwent physical and neurological examinations and relevant blood testing; a detailed history was taken from one or more relatives. Patients with other causes of dementia. CT scans with focal findings. or Hachinski scores (16) higher than 4 were excluded from the study. Each patient’s score on the Mini-Mental State Examination (17) was recorded at the time of the initial visit. We identified 41 patients who were diagnosed by the attending psychiatrist at the time of initial evaluation or at subsequent follow-up as suffering from a major depressive episode. These index patients were mdcpendently judged by two of us (GDP and CAR) both to have met the criteria for a major depressive episode according to a DSM-III checklist and to have no prior personal history of affective disorder. Nega-tive personal history was initially determined by re-,True,3JsfnzsAAAAJ:kO05sadLmrgC,154,http://citeseerx.ist.psu.edu/viewdoc/download?doi=10.1.1.452.8769&rep=rep1&type=pdf,15222688872209897020,/scholar?cites=15222688872209897020,,http://citeseerx.ist.psu.edu/viewdoc/download?doi=10.1.1.452.8769&rep=rep1&type=pdf,0
29872,Univariate and multivariate analyses of the mental status examination,1985,Lawrence E Klein and Robert P Roca and Justin McArthur and Georgia Vogelsang and Gayle B Klein and Susan M Kirby and Marshal Folstein,33,Journal of the American Geriatrics Society,7,483-488,Blackwell Publishing Ltd,Investigators have reported poor recognition of dementia by primary physicians. For this reason. mental status examinations were performed on 72 demented and 144 nondemented medical inpatients to assess the sensitivity. specificity. and predictive value of components of this examination in the diagnosis of dementia. Sensitivity of individual level‐of‐orientation items was low (15.3 to 56.9%). though specificity was high (91.7 to 100%). Sensitivity of several nonorientation items was high (80.6 to 100%). though specificity was low. A multivariate discriminant equation using both orientation and nonorientation items achieved high sensitivity (89.6% test cases. 87.5% validation cases) and specificity (78.1% test cases. 87.5% validation cases). Adding the easily obtained patient characteristic of age to the equation further increased sensitivity (95.8%. 91.3%). while maintaining specificity (82.3%. 85.4%). From these …,True,3JsfnzsAAAAJ:2tRrZ1ZAMYUC,154,https://onlinelibrary.wiley.com/doi/abs/10.1111/j.1532-5415.1985.tb05460.x,13973324697503090535,/scholar?cites=13973324697503090535,,,0
29873,Trial of d-! a-tocopherol in Huntington's disease.,1995,Carol E Peyser and Marshal Folstein and Gary A Chase and Sergio Starkstein and Jason Brandt and Joseph R Cockrell and Fred Bylsma and Joseph T Coyle and Paul R McHugh and Susan E Folstein,,The American journal of psychiatry,,,American Psychiatric Assn,Suggests that the neuropathology of Huntington's disease. a neuropsychiatric disorder due to a mutation on chromosome 4. results from excessive activation of glutamate-gated ion channels. killing neurons by oxidative stress. 73 Ss with Huntington's disease were administered d-α-tocopherol in a 1-yr double-blind. placebo-controlled trial. and monitored for changes in neurologic and neuropsychologic symptoms. The treatment was found to have no effect on symptoms in the overall treatment group. but post hoc analysis revealed a significant selective therapeutic effect on neurologic symptoms of Ss early in the course of the disorder. It was concluded that antioxidant therapy may slow the rate of motor decline early in the course of the disease.(PsycINFO Database Record (c) 2016 APA. all rights reserved),True,3JsfnzsAAAAJ:Bg7qf7VwUHIC,150,https://psycnet.apa.org/record/1996-12456-001,13548302385428310856,/scholar?cites=13548302385428310856,,,0
29874,Personality and emotional disorder in a community sample of migraine headache sufferers.,1990,Jason Brandt and David Celentano and Walter Stewart and Martha Linet and Marshal F Folstein,,The American journal of psychiatry,,,American Psychiatric Assn,Investigated whether individuals who suffer from chronic. severe headaches have more personality abnormalities or emotional disorders than their healthy counterparts. 162 young adults (aged 22–29 yrs) with classical migraine (MG). contacted by a community telephone survey. were compared with matched controls without MG. On the General Health Questionnaire. the prevalence of psychological symptoms among MG Ss was 2.5 times the prevalence among the controls. Women with MG had significantly higher scores on the Psychoticism and Neuroticism scales. and lower scores on the Lie Scale. of the Eysenck Personality Questionnaire. Results suggest that classical MG is associated with psychological abnormalities.(PsycINFO Database Record (c) 2016 APA. all rights reserved),True,3JsfnzsAAAAJ:BJbdYPG6LGMC,147,https://psycnet.apa.org/record/1990-17526-001,6819091134109767441,/scholar?cites=6819091134109767441,,,0
29875,Mini-mental and son.,1998,Marshal Folstein,,International journal of geriatric psychiatry,,,John Wiley & Sons,The Mini-Mental State was designed (MF Folstein et al. 1975) as a practical clinical assessment of change in cognitive impairment in geriatric inpatients. The author discusses MMS scoring. limitations of sensitivity. and mentions several variations of the MMS.(PsycINFO Database Record (c) 2016 APA. all rights reserved),True,3JsfnzsAAAAJ:9NZAP19TdFAC,142,https://psycnet.apa.org/record/1998-04037-010,10710749769224661424,/scholar?cites=10710749769224661424,,,0
