,title,pub_year,author,volume,journal,number,pages,publisher,abstract,filled,author_pub_id,num_citations,pub_url,cites_id,citedby_url,author_id,eprint_url,got_citations,got_author_ids,author_ids
86345,Sa1803 Dissecting the Oncogenic Activity of the Nuclear Receptor LRH-1 in the Colon,2014,James R Bayrer and Sridevi Mukkamala and Elena Sablin and Robert Fletterick,146,Gastroenterology,5,S-299,Elsevier,BACKGROUND. Colorectal cancers (CRC) account for nearly 10% of cancer deaths in industrialized countries. Recent evidence points to a central role for the nuclear receptor Liver Receptor Homolog-1 (LRH-1) in intestinal tumorigenesis. Interaction of LRH-1 with the Wnt/β-catenin pathway. highly active in a critical subpopulation of CRC cancer cells. underscores the importance of elucidating LRH-1's role in this disease. Reduction of LRH-1 diminishes tumor burden in murine models of CRC. The central role of receptor LRH-1 in CRC pathogenesis and a wealth of structural data at atomic resolution make LRH-1 an attractive target. Methods: To evaluate the contributions of LRH-1 to CRC growth. we constructed stably transduced CRC cell lines expressing Tet-inducible shRNA directed against LRH-1. Cell growth of the LRH-1 knockdown lines was compared with growth of cells expressing a non-silencing control …,True,MAlNgd0AAAAJ:jE2MZjpN3IcC,0,https://www.gastrojournal.org/article/S0016-5085(14)61072-6/abstract,,,,,0,0,0
86346,MS93. P03,2014,D Das and F Yumoto and K Kuchenbecker and A Deacon and R Fletterick and I Wilson,70,Acta Cryst,,C1398,,SRY (Sex determining Region Y)-box or SOX transcription factors are important in early development and maintenance of different cell pools after birth. Of the~ 20 SOX proteins (SRY. SOX1-SOX15. SOX17. SOX18. SOX21 and SOX30). SOX2. SOX9 and SOX10 mutations are primarily disease-associated: SOX2 with Combined Pituitary Hormone Deficiency. Microphthalmia. Septo-optic dysplasia and anophthalmic syndrome; SOX9 with Campomelic Dysplasia (affects development of the reproductive and skeletal system); and SOX10 (~ 94% sequence identity to SOX9) with Waardenburg Syndrome (affects audition and pigmentation in hair. eyes and skin; and specifically with WS types 2 and 4). As part of our Protein Structure Initiative (PSI)-Biology partnership. we performed structural and mutational analyses including x-ray crystallography and surface plasmon resonance assays. on the DNA-binding HMG domain …,True,MAlNgd0AAAAJ:MXK_kJrjxJIC,0,https://scripts.iucr.org/cgi-bin/paper?S205327331408601X,,,,,0,0,0
86347,3P113 Structural basis of transcriptional co-activation of LRH-1 by beta-catenin (04. Nucleic acid binding proteins. Poster),2013,Fumiaki Yumoto and Robert Fletterick,53,Seibutsu Butsuri,supplement1-2,S230,The Biophysical Society of Japan General Incorporated Association,Structure determination of integral membrane proteins (IMPs) by the X-ray crystallography is very difficult due to their low thermal stability in detergents. Though the stability can be enhanced by introducing mutations into IMPs. a random search accompanying a heavy experimental burden is currently employed to obtain mutations leading to sufficient enhancement. In this study. we show that the entropic effect originating from the translational displacement of hydrocarbon groups constituting nonpolar chains of the lipid bilayer plays crucially important roles in the structural stability of IMPs. A theoretical method for finding mutations which present considerably higher stability is proposed. and its reliability is discussed on the basis of some test calculations.,True,MAlNgd0AAAAJ:QD3KBmkZPeQC,0,https://www.jstage.jst.go.jp/article/biophys/53/supplement1-2/53_KJ00009360866/_article/-char/ja/,,,,https://www.jstage.jst.go.jp/article/biophys/53/supplement1-2/53_KJ00009360866/_pdf,0,0,0
86348,3P113 LRH-1 の beta-catenin による転写活性化の構造基盤 (04. 核酸結合蛋白質. ポスター. 日本生物物理学会年会第 51 回 (2013 年度)),2013,Fumiaki Yumoto and Robert Fletterick,53,生物物理,1,S230,一般社団法人 日本生物物理学会,"CiNii 国立情報学研究所 学術情報ナビゲータ[サイニィ]. メニュー 検索 … 
",True,MAlNgd0AAAAJ:1lhNe0rCu4AC,0,https://ci.nii.ac.jp/naid/110009819917/,,,,,0,0,0
86349,JohN D. BAxter,2013,Paul Webb and RoBeRt J FletteRick,,,,,,He was a tireless advocate of The Endocrine Society (TES); of its educational arm. the Hormone Foundation (now the Hormone Health Network); and of the American Thyroid Association (ATA). John served as president of TES from 2002 to 2003. and served with great pride on the committees and Council of TES. It was fitting that he received major awards from both of his favorite professional organizations: the Koch award from TES at its Toronto meeting in 2007 and the Sydney H. Ingbar award from the ATA in 2009.John was among the first to develop and adopt early genetic engineering efforts in the late 1970s and early 1980s and. typically. he directed this research towards clear. achievable goals in medicine. This work. which focused mostly on growth hormone. had important consequences in medicine. the integration of science and business. and in our society at large.,True,MAlNgd0AAAAJ:W5xh706n7nkC,0,http://www.nasonline.org/publications/biographical-memoirs/memoir-pdfs/baxter-john.pdf,,,,http://www.nasonline.org/publications/biographical-memoirs/memoir-pdfs/baxter-john.pdf,0,0,0
86350,Analysis of a novel synergistic relationship between the FK506 binding protein FKBP52 and beta catenin in androgen receptor signaling pathways,2012,CL Storer and K Olivares and RJ Fletterick and P Webb and MB Cox,72,,,,AMER ASSOC CANCER RESEARCH,,True,MAlNgd0AAAAJ:cK4Rrx0J3m0C,0,http://scholar.google.com/scholar?cluster=16101985625021335226&hl=en&oi=scholarr,,,,,0,0,0
86351,Abstract P5-07-02: Analysis of a novel synergistic relationship between the FK506 binding protein FKBP52 and beta catenin in androgen receptor signaling pathways,2012,CL Storer and K Olivares and RJ Fletterick and P Webb and MB Cox,72,,24 Supplement,P5-07-02-P5-07-02,American Association for Cancer Research,Hormone-dependent cancers depend largely on folding and regulation by a chaperone-steroid receptor complex. The final stage of the receptor-chaperone complex consists of a receptor. a heat shock protein 90 (Hsp90) dimer. p23. and an immunophilin. Hormone-dependent prostate cancer progresses due to key interactions between the androgen receptor complex and the ligand dihydrotestosterone. While current treatments block androgen receptor-ligand interactions. these therapies are no longer effective in advanced stage. hormone independent prostate cancer (HRPC). when the receptor is activated even in miniscule levels of hormone. Therefore. we are interested in targeting other members of the androgen receptor complex and signaling cascade. namely the immunophilin FK506 binding protein (FKBP52) and the Wnt cell signaling protein β-catenin. FKBP52 has the ability to potentiate activity of the …,True,MAlNgd0AAAAJ:roLk4NBRz8UC,0,https://cancerres.aacrjournals.org/content/72/24_Supplement/P5-07-02.short,,,,,0,0,0
86352,Charles S. Craik. Orgad Laub. Graeme I. Bell,2012,Stephen Sprang and Robert Fletterick and William J Rutter,,Gene Regulation,,35,Elsevier,The cloning and sequencing of genes of proteins whose structure is known allows a comparison of the localization of intervening sequences with the structural features of the proteins. In some instances. the intron positions seem to demarcate structural and/or functional units. but in others. there is no obvious relationship between the protein and gene structure. Comparison with tertiary structures indicates that the intron positions in the gene correspond to the external boundary rather than the interior of the protein. This localization is confirmed by a solvent accessible sur-face analysis which shows that the intron junctions are almost always located at the protein-solvent interface. While the surface rule is based on observations of a few relatively small globular proteins with known tertiary structure. it is further supported by the observation that the consensus sequences at the 5'(but not the 3') intron/exon splice junctions predominantly code for hydrophilic and surface type amino acids. These results suggest that intron placements may have played a role in protein evolution. For example. intron junctions may be sites of hypervariability and hence of structural change. If so. such junctions would be better accommo-dated on the surface. rather than the interior where changes would likely result in distortion or destruction of the architecture of the molecule. Consistent with these ideas. certain evolutionary variations in the Serine protease family appear to correlate with intron location. Experimental studies on the expression of the human insul in gene in heterologous mammalian cells using SV40 viral vectors show that the normal splicing can occur. but that …,True,MAlNgd0AAAAJ:4vMrXwiscB8C,0,http://books.google.com/books?hl=en&lr=&id=Mv8rL9dhCDEC&oi=fnd&pg=PA35&dq=info:5vTv1JRpybcJ:scholar.google.com&ots=LUV69LfDXV&sig=Zg03-jaXSTcTTYdUQ7XNMev7AwE,,,,,0,0,0
86353,In MemoriamJohn D. Baxter. M.D.. 1940–2011,2012,Thomas S Scanlan and Robert J Fletterick,22,,2,228-230,Mary Ann Liebert. Inc.,John Baxter. a charismatic leader in the thyroid and endocrine worlds. died in San Francisco on October 5. 2011. following surgery for cancer. John was a celebrated member of the American Thyroid Association and The Endocrine Society and served as President of the Society in 2001–2002. John was awarded the Sydney H. Ingbar Award from the American Thyroid Association in 2009 and the Koch Award from the Endocrine Society in 2007. and he was elected to the National Academy of Sciences in 2002 and the Institute of Medicine of the National Academy of Sciences in 2003. John lived and breathed endocrinology throughout his career as a clinician-scientist and made fundamental and lasting contributions both to our knowledge of hormone action and the medicine we use for treating hormone-related disease. John grew up in Lexington. Kentucky. and was a high school letterman in both basketball and …,True,MAlNgd0AAAAJ:vbGhcppDl1QC,0,https://www.liebertpub.com/doi/full/10.1089/thy.2012.2202.obit,,,,,0,0,0
86354,John D. Baxter. MD. 1940-2011 In Memoriam,2012,Thomas S Scanlan and Robert J Fletterick,22,,2,228-230,MARY ANN LIEBERT INC,,True,MAlNgd0AAAAJ:dfsIfKJdRG4C,0,http://scholar.google.com/scholar?cluster=4441561719755517906&hl=en&oi=scholarr,,,,,0,0,0
86355,Structural basis of coactivation of liver receptor homolog-1 by Î²-catenin,2012,Fumiaki Yumoto and Phuong Nguyen and Elena P Sablin and John D Baxter and Paul Webb and Robert J Fletterick,,,,,,We report the three-dimensional structure of a Î²-catenin armadillo repeat in complex with the liver receptor homolog-1 (LRH-1) ligand binding domain at 2.8Â Ã   resolution as the first structure of Î²-catenin in complex with any nuclear receptor. The surface of Î²-catenin that binds LRH-1 partly overlaps defined contact sites for peptide segments of Î²-catenin partners. including T-cell factor-4. The surface of LRH-1 that engages Î²-catenin is comprised of helices 1. 9. and 10 and is distinct from known interaction surfaces of LRH-1. including corepressor and coactivator binding sites. Targeted mutagenesis of amino acids forming both sides of the LRH-1/Î²-catenin interface reveals that they are essential for stable interactions between these proteins in solution. The LRH-1 binding site in Î²-catenin is also required for association with androgen receptor. providing evidence that the observed LRH-1/Î²-catenin interaction may be prototypic.,True,MAlNgd0AAAAJ:xtoqd-5pKcoC,0,https://pubag.nal.usda.gov/catalog/398268,,,,,0,0,0
86356,Probing the Regulatory Mechanisms of KCBP using EPR Spectroscopy,2010,Maia V Vinogradova and Nariman I Naber and Robert J Fletterick and Roger Cooke,98,Biophysical Journal,3,164a,Elsevier,Our new experiments demonstrate that tail and motor of KCBP interact directly. Binding of tail has an inhibitory regulatory effect on KCBP motor. Interestingly. binding of KIC to motor tears the motor-tail complex apart suggesting that tail and KIC may share the binding site on the motor. including the neck mimic. To test the proposed regulatory mechanisms. we assessed the conformational freedom of the neck mimic in KCBP (aa 876-1261. no neck) in the presence and the absence of KIC or tail (aa 12-503) using EPR spectroscopy. Spectra of spin probes attached to single Cys (S1220C or S1215C) on the neck mimic showed a mobile and an immobilized component. There was a significantly higher content of the immobile component in the spectrum of the Cys1220 mutant. The addition of KIC resulted in a shift of the spectrum into more mobile region in the Cys1220 mutant but not in the Cys1215 mutant. When the tail …,True,MAlNgd0AAAAJ:SpbeaW3--B0C,0,https://www.cell.com/biophysj/pdf/S0006-3495(09)02689-7.pdf,,,,https://www.cell.com/biophysj/pdf/S0006-3495(09)02689-7.pdf,0,0,0
86357,Creating Steroidal Ligand-Receptor Pairs for Behavioral Studies of Androgen Receptor,2010,Leslie A Cruz and Marc B Cox and Robert J Fletterick,98,Biophysical Journal,3,244a,Elsevier,Leslie A. Cruz1. Marc B. Cox2. Robert J. Fletterick1. 1University of California San Francisco. San Francisco. CA. USA. 2University of Texas at El Paso. El Paso. TX. USA. Heterologous agonist-receptor pairs designed after high resolution structural studies have yielded insights into specificity of signaling by protein kinases and G-protein coupled receptors. We are extending this concept to the realm of steroid nuclear receptors with a goal to learning the behavioral effects of steroid activation of the androgen receptor in the brain. We are designing a steroidal ligand-hormone receptor pair such that the novel ligand does not bind to endogenous androgen receptors (AR). and the designer receptor does not bind to endogenous androgens. We have synthesized novel steroids that do not bind endogenous AR. Since steroid binding affects the folding of the receptor. prediction of amino acid mutations in the androgen …,True,MAlNgd0AAAAJ:geHnlv5EZngC,0,https://www.cell.com/biophysj/pdf/S0006-3495(09)03129-4.pdf,,,,https://www.cell.com/biophysj/pdf/S0006-3495(09)03129-4.pdf,0,0,0
86358,Conformational changes of cellular motors during movement along microtubules,2007,Rex P Hjelm and Deborah Bennett Stone and Robert J Fletterick and Robert A Mendelson,,,,308A-308A,BIOPHYSICAL SOCIETY,,True,MAlNgd0AAAAJ:5icHVeHT4IsC,0,http://scholar.google.com/scholar?cluster=14834631514232505650&hl=en&oi=scholarr,,,,,0,0,0
86359,Molecular motor mechanisms: The internal kinesin regime,2007,Bess-Carolina Dolmo and Krista Shipley and Maia Vinogradova and Robert Fletterick,,,,497A-497A,BIOPHYSICAL SOCIETY,,True,MAlNgd0AAAAJ:0EnyYjriUFMC,0,http://scholar.google.com/scholar?cluster=1238965968759313110&hl=en&oi=scholarr,,,,,0,0,0
86360,1: Shigeoka T. Kawaichi M. Ishida Y. Suppression of nonsense-mediated mRNA decay permits unbiased gene trapping in mouse embryonic stem cells. Nucleic Acids Res. 2005 Feb 1; 33 …,2006,JM Bynum and K Madauss and V Montana and L Lebedeva and M Suzawa and JD Williams and SP Williams and RK Guy and JW Thornton and RJ Fletterick and TM Willson and HA Ingraham,281,Biol Chem,51,39169-78,,,True,MAlNgd0AAAAJ:7H_MAutzIkAC,0,http://scholar.google.com/scholar?cluster=16650564007260783397&hl=en&oi=scholarr,,,,,0,0,0
86361,Inhibitors for Androgen Receptor Activation Surfaces,2006,Robert J Fletterick,,,,,CALIFORNIA UNIV SAN FRANCISCO,The androgen receptor AR is a proven therapeutic target for treating prostate cancer. Known therapeutics target the ligand binding domain LBD at the exact place where dihydrotestosterone DHT binds. Upon binding DHT. AR reorganizes to form new interaction surfaces such as the AF2 surface that attracts coregulators. AF2 has been proposed as a second therapeutic target as coactivator recruitment is a key step for AR function. We developed two screening methods to find compounds that bind to AF2. Our method has proved successful with the thyroid receptor. In solution. a competition assay reports coactivator displacement and 3D screening by X-ray crystallography visualizes the compounds on the receptor. Two classes of compounds have been identified that bind to AF2 the first class bind weakly and do not compete with coactivator binding 2-methylindole. and two protein kinase inhibitors. while the second class have micromolar affinity and compete with coactivator binding TRIAC. and three aspirin derivatives. Screening revealed a significant and undiscovered cryptic surface site that we call binding function 3 BF3. which might be implicated in AR regulation. These are the first compounds reported to block AR protein-protein interactions and might serve as starting templates for more selective and effective antiandrogens.Descriptors:,True,MAlNgd0AAAAJ:6ZxmRoH8BuwC,0,https://apps.dtic.mil/sti/citations/ADA462434,,,,https://apps.dtic.mil/sti/pdfs/ADA462434.pdf,0,0,0
86362,PMCID: PMC1301593.,2006,JM Bynum and K Madauss and V Montana and L Lebedeva and M Suzawa and JD Williams and SP Williams and RK Guy and JW Thornton and RJ Fletterick and TM Willson and HA Ingraham,147,Endocrinology,7,3249-59,,,True,MAlNgd0AAAAJ:70eg2SAEIzsC,0,http://scholar.google.com/scholar?cluster=3769253662498112216&hl=en&oi=scholarr,,,,,0,0,0
86363,Rearrangements in thyroid hormone receptor charge clusters that stabilize bound T3 and inhibit homodimer formation,2005,Marie Togashi and Phuong Nguyen and Robert J Fletterick and John D Baxter and Paul Webb,,Journal of Biological Chemistry,,,American Society for Biochemistry and Molecular Biology,Materials and MethodsTR Mutants-The pCMX vector was used for expression of the full-length human TRβ?(17). Mutations within TR-encoding sequences were created using the QuickChange XL Site-Directed Mutagenesis Kit (Stratagene). Mutation of target sequences was verified by automated DNA sequence (Elim Biopharmaceuticals. Inc.. Hayward. CA).Transfections-HeLa cells were maintained in DME H-21 4.5 g/l glucose. containing 10% fetal bovine serum. 2 mM glutamine. 50 units/ml penicillin. and 50 mg/ml streptomycin. For transfection. cells were collected and resuspended in Dulbecco’s phosphate-buffered saline (0.5 ml/4.5 x107 cells) containing 0.1% dextrose. and typically 4µg reporter. 1 µg of TR expression vector or empty vector control. and 2 µg of pCMV-β-galactosidase (17). Cells were electroporated at 240V and 960 microfarads. transferred to fresh media. and plated into 12-well plates. After incubation for 24h at 37 C with T3 or vehicle. cells were collected and pellets were lysed by addition of 150µl of 100 mM Tris-HCl. pH 7.8 containing 0.1% Triton X-100. The reporters contained 2 TREs (DR-4. F2 and TREpal) upstream of the herpes simplex virus TK promoter TATA box linked to luciferase coding sequence (LUC). LUC and βgalactosidase activities were measured by using the Luciferase Assay System (Promega) and Galacto-Light Plus beta-Galactosidase Reporter Gene Assay System (Applied Biosystems). GST Pull-Downs-Full-length hTRβ was expressed in a coupled transcription translation,True,MAlNgd0AAAAJ:XiSMed-E-HIC,0,http://scholar.google.com/scholar?cluster=5716739271259124679&hl=en&oi=scholarr,,,,,0,0,0
86364,Defining the positions of troponin and tropomyosin on thin filaments by EM and single particle analysis,2005,A Pirani and V Hatch and P Curmi and W King and M Vinogradova and R Fletterick and R Craig and LS Tobacman and C Xu and W Lehman,88,,1,18A-18A,BIOPHYSICAL SOCIETY,,True,MAlNgd0AAAAJ:4OULZ7Gr8RgC,0,http://scholar.google.com/scholar?cluster=4422207713455871433&hl=en&oi=scholarr,,,,,0,0,0
86365,The Molecular Mechanisms of Coactivator Utilization in Ligand-dependent Transactivation by the Androgen Receptor* DS,2005,Phuong Nguyen and John D Baxter and Benjamin M Buehrer and Paul Webb and Robert J Fletterick and R Kiplin Guy,,,,,,Androgens drive sex differentiation. bone and muscle development. and promote growth of hormone-dependent cancers by binding the nuclear androgen receptor (AR). which recruits coactivators to responsive genes. Most nuclear receptors recruit steroid receptor coactivators (SRCs) to their ligand binding domain (LBD) using a leucine-rich motif (LXXLL). AR is believed to recruit unique coactivators to its LBD using an aromaticrich motif (FXXLF) while recruiting SRCs to its N-terminal domain (NTD) through an alternate mechanism. Here. we report that the AR-LBD interacts with both FXXLF motifs and a subset of LXXLL motifs and that contacts with these LXXLL motifs are both necessary and sufficient for SRC-mediated AR regulation of transcription. Crystal structures of the activated AR in complex with both recruitment motifs reveal that side chains unique to the AR-LBD rearrange to bind either the bulky FXXLF motifs or the more compact LXXLL motifs and that AR utilizes subsidiary contacts with LXXLL flanking sequences to discriminate between LXXLL motifs.,True,MAlNgd0AAAAJ:YsMSGLbcyi4C,0,https://www.academia.edu/download/46424384/The_molecular_mechanisms_of_coactivator_20160612-12332-19bjywo.pdf,,,,https://www.academia.edu/download/46424384/The_molecular_mechanisms_of_coactivator_20160612-12332-19bjywo.pdf,0,0,0
86366,A 1.4 ANSTROM CRYSTAL STRUCTURE FOR THE HYPOXANTHINE PHOSPHORIBOSYLTRANSERASE OF TRYPANOSOMA CRUZI,2004,Pamela J Focia and Sydney P Craig III and Rene Nieves-Alicea and Robert J Fletterick and Ann E Eakin,,,SLAC-REPRINT-1998-134,,Stanford Linear Accelerator Center (SLAC),"The US Department of Energy's Office of Scientific and Technical Information.
",True,MAlNgd0AAAAJ:M7yex6snE4oC,0,https://www.osti.gov/biblio/892680,,,,,0,0,0
86367,LEARNING FROM NATURE'S EXPERIMENTS ON THE THYROID HORMONE RECEPTOR; X-RAY STRUCTURES OF RTH MUTANT LIGAND-BINDING DOMAINS,2004,Ben H Sandier and John D Baxter and Robert J Fletterick,,Syndromes of Hormone Resistance on the Hypothalamic-Pituitary-Thyroid Axis,,35,Kluwer Academic Pub,The syndrome of resistance to thyroid hormone (RTH) is characterized by unresponsiveness to thyroid hormone by the product (s) of one of the human thyroid hormone receptor-P (hTR P) genes. It is an uncommon disorder. but nonetheless one that requires diagnosis by the physician to avoid mismanagement of the patient. Study of the syndrome has resulted in substantial insights into the mechanisms for thyroid action. Most cases are due to mutations in the hTR P ligand-binding domain (LBD). Studies of X-ray crystal structures of this domain have provided additional insights into how these mutations affect receptor function. that in turn reveal more information about mechanisms of TR function in general. In this review. we discuss what has been learned from studies using X-ray crystallography of receptors containing mutations found in RTH.,True,MAlNgd0AAAAJ:hsZV8lGYWTMC,0,http://scholar.google.com/scholar?cluster=17108408147405703561&hl=en&oi=scholarr,,,,,0,0,0
86368,ENZYME CATALYSIS AND REGULATION-Characterization of Structural Determinants of Granzyme B Reveals Potent Mediators of Extended Substrate Specificity.,2004,Sandra Waugh Ruggles and Robert J Fletterick and Charles S Craik,279,Journal of Biological Chemistry,29,30751-30759,Baltimore [etc.],Granzymes are trypsin-like serine proteases mediating apoptotic cell death that are composed of two genetically distinct subfamilies: granzyme A-like proteases resemble trypsin in their active site architecture. while granzyme B-like proteases are quite distinct. Granzyme B prefers substrates containing P4 to P1 amino acids Ile/Val. Glu/Met/Gln. Pro/Xaa. and aspartic acid N-terminal to the proteolytic cleavage. By investigating the narrow extended specificity of the granzyme B-like proteases the mediators of their unique specificity are being defined. The foci of this study were the structural determinants Ile99. Tyr174. Arg192. and Asn218. Even modest mutations of these residues resulted in unique extended specificity profiles as determined using combinatorial substrate libraries and individual fluorogenic substrates. As with other serine proteases. Ile99 completely defines and predicts P2 specificity. primarily through …,True,MAlNgd0AAAAJ:XD-gHx7UXLsC,0,http://scholar.google.com/scholar?cluster=8815735195457796432&hl=en&oi=scholarr,,,,,0,0,0
86369,Structure and analysis of Plasmodium falciparum KinI,2004,K Shipley and M Hekmat-Nejad and J Turner and C Moores and R Fletterick,86,,1,410A-410A,BIOPHYSICAL SOCIETY,,True,MAlNgd0AAAAJ:lSLTfruPkqcC,0,http://scholar.google.com/scholar?cluster=3622962455545935213&hl=en&oi=scholarr,,,,,0,0,0
86370,Mechanisms of kinesin motility.,2003,R Fletterick,225,,,U450-U450,AMER CHEMICAL SOC,,True,MAlNgd0AAAAJ:4TOpqqG69KYC,0,http://scholar.google.com/scholar?cluster=1515661514050292864&hl=en&oi=scholarr,,,,,0,0,0
86371,Two new. highly ordered conformations of kinesin's putative force-delivering element,2003,CV Sindelar and S Rice and R Cooke and RJ Fletterick,84,,2,148A-148A,BIOPHYSICAL SOCIETY,,True,MAlNgd0AAAAJ:AXPGKjj_ei8C,0,http://scholar.google.com/scholar?cluster=7230793851198543198&hl=en&oi=scholarr,,,,,0,0,0
86372,Three-dimensional structural analysis of fibronectin heparin-binding domain mutations.(vol 81. pg 156. 1996),2003,YL Kapila and D Doan and E Tafolla and R Fletterick,88,JOURNAL OF CELLULAR BIOCHEMISTRY,1,205-205,WILEY-LISS,,True,MAlNgd0AAAAJ:HtS1dXgVpQUC,0,http://scholar.google.com/scholar?cluster=13337957986077091690&hl=en&oi=scholarr,,,,,0,0,0
