,title,pub_year,author,volume,journal,number,pages,publisher,abstract,filled,author_pub_id,num_citations,pub_url,cites_id,citedby_url,author_id,eprint_url,got_citations,got_author_ids,author_ids
1025159,Subcomponent Self-Assembly and Guest-Binding Properties of Face-Capped Fe4L48+ Capsules,2012,Rana A Bilbeisi and Jack K Clegg and Noémie Elgrishi and Xavier de Hatten and Marc Devillard and Boris Breiner and Prasenjit Mal and Jonathan R Nitschke,134,Journal of the American Chemical Society,11,5110-5119,American Chemical Society,A general method for preparing Fe4L4 face-capped tetrahedral cages through subcomponent self-assembly was developed and has been demonstrated using four different C3-symmetric triamines. 2-formylpyridine. and iron(II). Three of the triamines were shown also to form Fe2L3 helicates when the appropriate stoichiometry of subcomponents was used. Two of the cages were observed to have nearly identical Fe–Fe distances in the solid state. which enabled their ligands to be coincorporated into a collection of mixed cages. Only one of the cages combined a sufficiently large cavity with the sufficiently small pores required for guest binding. taking up a wide variety of guest species in size- and shape-selective fashion.,True,eE62kJoAAAAJ:Se3iqnhoufwC,134,https://pubs.acs.org/doi/abs/10.1021/ja2092272,573235141073197514,/scholar?cites=573235141073197514,,https://www.academia.edu/download/43075544/Subcomponent_self-assembly_and_guest-bin20160225-28626-pcth3m.pdf,0,0,0
1025160,Selective anion binding by a “Chameleon” capsule with a dynamically reconfigurable exterior,2011,Yana R Hristova and Maarten MJ Smulders and Jack K Clegg and Boris Breiner and Jonathan R Nitschke,2,Chemical Science,4,638-641,Royal Society of Chemistry,A new class of tetrahedral metal–organic capsules that can incorporate up to twelve different externally-directed amine residues is reported. allowing for very large dynamic libraries to be formed from mixtures of amines. Selectivity is observed both externally—more electron-rich amines are incorporated in favour of electron-poor amines—and internally—PF6− is bound in preference to CF3SO3− or BF4−.,True,eE62kJoAAAAJ:0EnyYjriUFMC,132,https://pubs.rsc.org/--/content/articlehtml/2011/sc/c0sc00495b,9603813885834711625,/scholar?cites=9603813885834711625,,,0,0,0
1025161,Five discrete multinuclear metal-organic assemblies from one ligand: deciphering the effects of different templates,2013,Imogen A Riddell and Yana R Hristova and Jack K Clegg and Christopher S Wood and Boris Breiner and Jonathan R Nitschke,135,Journal of the American Chemical Society,7,2723-2733,American Chemical Society,A rigid organic ligand. formed through the subcomponent self-assembly of p-toluidine and 6.6′-diformyl-3.3′-bipyridine. was employed in a systematic investigation into the synergistic and competing effects of metal and anion templation. A range of discrete and polymeric metal-organic complexes were formed. many of which represent structure types that have not previously been observed and whose formation would not be predicted on taking into account solely geometric considerations. These complex structures. capable of binding multiple guests within individual binding pockets. were characterized by NMR. ESI-MS. and single-crystal X-ray diffraction. The factors that stabilize individual complexes and lead to the formation of one over another are discussed.,True,eE62kJoAAAAJ:LkGwnXOMwfcC,127,https://pubs.acs.org/doi/abs/10.1021/ja311285b,7166380623539762311,/scholar?cites=7166380623539762311,,,0,0,0
1025162,Control of kinetics and thermodynamics of [1. 5]-shifts by aromaticity: a view through the prism of Marcus theory,2003,Igor V Alabugin and Mariappan Manoharan and Boris Breiner and Frederick D Lewis,125,,31,9329-9342,American Chemical Society,The effects of aromatic stabilization on the rates of [1.5]-hydrogen shifts in a series of carbo- and heterocyclic dihydroaromatic compounds were estimated by B3LYP/6-31G** computations. The aromatic stabilization energy of the product is directly translated into increased exothermicity of these reactions. Relative trends for a significant range of endothermic and exothermic [1.5]-shifts with different intrinsic activation energies are reliably described by Marcus theory. The effects of aromaticity or antiaromaticity are very large and can lead to dramatic acceleration or deceleration of [1.5]-hydrogen shifts and even to complete disappearance of the reaction barrier. Not only the activation energy but the shape and position of the reaction barrier can be efficiently controlled by changes in the aromaticity of the products. making these systems interesting models for studying hydrogen tunneling. Marcus theory can also be …,True,eE62kJoAAAAJ:kNdYIx-mwKoC,120,https://pubs.acs.org/doi/abs/10.1021/ja035729x,12169750256675489463,/scholar?cites=12169750256675489463,,https://www.academia.edu/download/45120668/Control_of_kinetics_and_thermodynamics_o20160426-475-1xy8cf2.pdf,0,0,0
1025163,A stimuli responsive system of self-assembled anion-binding Fe 4 L 6 8+ cages,2013,Jack K Clegg and Jonathan Cremers and Andrew J Hogben and Boris Breiner and Maarten MJ Smulders and John D Thoburn and Jonathan R Nitschke,4,Chemical Science,1,68-76,Royal Society of Chemistry,A new cationic Fe4L6 cage molecule was synthesised from 4.4′-diaminobiphenyl. 2-formylpyridine and iron(II). The cage exists as a system of interconverting diastereomers in solution. The system adapts to the addition of anionic guest molecules. expressing a new combination of diastereomers that synergistically bind the guest molecules. Not only do the cage diastereomers interconvert. the volume of the individual cages adapts physically through the rotation of bonds. providing a tailored binding pocket for the guest lined with hydrogen-bond donors. A model for the resulting complex network of species was developed that allowed the system to be fully described. The anion binding constants and the kinetics of both diastereomer interconversion and guest exchange were measured.,True,eE62kJoAAAAJ:u-x6o8ySG0sC,83,https://pubs.rsc.org/am/content/articlehtml/2013/sc/c2sc21486e,1340530614300379730,/scholar?cites=1340530614300379730,,https://pdfs.semanticscholar.org/e910/797e5914f1dcae3adfc3ead46ed88181b508.pdf,0,0,0
1025164,Synthesis of selectively deuterated fulvenes and indenes from enediynes,2005,Scott W Peabody and Boris Breiner and Serguei V Kovalenko and Satish Patil and Igor V Alabugin,3,Organic & biomolecular chemistry,2,218-221,Royal Society of Chemistry,A facile enediyne→fulvene→indene transformation provides a route to all possible isotopomers of substituted fulvenes and indenes.,True,eE62kJoAAAAJ:u5HHmVD_uO8C,69,https://pubs.rsc.org/en/content/articlehtml/2005/ob/b417493n,299583378832847445,/scholar?cites=299583378832847445,,https://www.chem.fsu.edu/~alabugin/PDF_Papers/b417493n_Deuterated_Fulvenes.pdf,0,0,0
1025165,Hybrids of amino acids and acetylenic DNA-photocleavers: optimising efficiency and selectivity for cancer phototherapy,2012,Boris Breiner and Kemal Kaya and Saumya Roy and Wang-Yong Yang and Igor V Alabugin,10,Organic & biomolecular chemistry,20,3974-3987,Royal Society of Chemistry,Hybrid agents which combine potent DNA-photocleavers with tunable amino acids or small peptides were designed to improve selectivity of Nature's most potent class of antibiotics towards cancer cells. The ability of these compounds to photocleave DNA is controlled by their incorporation into hybrid architectures with functional elements derived from natural amino acids. These conjugates are highly effective at inducing double-strand DNA cleavage and. in some cases. rival or even surpass both naturally occurring DNA cleavers and anticancer agents that are currently in clinical use. The possibility of triggering their activity in a photochemical and pH-sensitive fashion allows for a high degree of selectivity over activation. The conjugates were shown to penetrate cell membranes and induce efficient intracellular DNA cleavage. Initial in vitro tests against a variety of cancer cell lines confirm the potential of these …,True,eE62kJoAAAAJ:zYLM7Y9cAGgC,68,https://pubs.rsc.org/en/content/articlehtml/2012/ob/c2ob00052k,3385481801582585286,/scholar?cites=3385481801582585286,,,0,0,0
1025166,RNA tertiary structure mediation by adenosine platforms,1996,Jamie H Cate and Anne R Gooding and Elaine Podell and Kaihong Zhou and Barbara L Golden and Alexander A Szewczak and Craig E Kundrot and Thomas R Cech and Jennifer A Doudna,273,Science,5282,1696-1699,American Association for the Advancement of Science,The crystal structure of a group I intron domain reveals an unexpected motif that mediates both intra- and intermolecular interactions. At three separate locations in the 160-nucleotide domain. adjacent adenosines in the sequence lie side-by-side and form a pseudo-base pair within a helix. This adenosine platform opens the minor groove for base stacking or base pairing with nucleotides from a noncontiguous RNA strand. The platform motif has a distinctive chemical modification signature that may enable its detection in other structured RNAs. The ability of this motif to facilitate higher order folding provides oneexplanation for the abundance of adenosine residues in internal loops of many RNAs.,True,r52hlDEAAAAJ:RHpTSmoSYBkC,419,https://science.sciencemag.org/content/273/5282/1696.abstract,8902612014755565893,/scholar?cites=8902612014755565893,,https://doudnalab.org/Publications/science-273-1696.pdf,0,0,0
1025167,The conformation of the sarcin/ricin loop from 28S ribosomal RNA,1993,Alexander A Szewczak and Peter B Moore and YL Chang and Ira G Wool,90,Proceedings of the National Academy of Sciences,20,9581-9585,National Academy of Sciences,The sarcin/ricin loop is a highly conserved sequence found in the RNA of all large ribosomal subunits. The cytotoxins alpha-sarcin and ricin both inactivate ribosomes by cleaving a single bond in that loop. Once it has been attacked. ribosomes no longer interact with elongation factors properly. and translation stops. We have determined the conformation of the sarcin/ricin loop by multinuclear NMR spectroscopy using E73. a 29-nucleotide RNA that has the sarcin/ricin loop sequence and that is sensitive to both toxins in vitro. The sarcin/ricin loop has a compact structure that contains several purine.purine base pairs. a GAGA tetraloop. and a bulged guanosine adjacent to a reverse Hoogsteen A.U pair. It is stabilized by an unusual set of cross-strand base-stacking interactions and imino proton to phosphate oxygen hydrogen bonds. In addition to having interesting structural features. this model explains many of the …,True,r52hlDEAAAAJ:u5HHmVD_uO8C,280,https://www.pnas.org/content/90/20/9581.short,12858162367281170538,/scholar?cites=12858162367281170538,,https://www.pnas.org/content/pnas/90/20/9581.full.pdf,0,0,0
1025168,The sarcin/ricin loop. a modular RNA,1995,AA Szewczak and PB Moore,247,Journal of molecular biology,1,81-98,Academic Press,The conformation of a 29 base oligonucleotide called E73 has been determined in solution by NMR. E73 includes a 23 nucleotide sequence that is identical with that of a the α-sarcin and ricin-sensitive loop (SRL) from rat 28 rRNA. and like the SRL in intact ribosomes. E73 is a substrate for both toxins. The SRL includes a long. conserved sequence found in the RNA of all large ribosomal subunits. which plays a critical role in the factor-dependent steps of protein synthesis. The spectroscopic observations and analysis that led to the determination of the conformation of E73 are presented. The SRL in E73 has a highly structured conformation. which is stabilized by several non-Watson-Crick base-pairs. and many properties of the SRL in the ribosome can be understood assuming that the conformation of E73 and that of the SRL in the ribosome are the same. The role of the SRL in protein synthesis is discussed in light …,True,r52hlDEAAAAJ:u-x6o8ySG0sC,249,https://www.sciencedirect.com/science/article/pii/S0022283684701240,6988970084442611659,/scholar?cites=6988970084442611659,,https://pdfs.semanticscholar.org/58bb/45db585bb2ec784e8caffdb0d3562da62b2d.pdf,0,0,0
1025169,Exploration of the internal cavity of histone deacetylase (HDAC) with selective HDAC1/HDAC2 inhibitors (SHI-1: 2),2008,Joey L Methot and Prasun K Chakravarty and Melissa Chenard and Joshua Close and Jonathan C Cruz and William K Dahlberg and Judith Fleming and Christopher L Hamblett and Julie E Hamill and Paul Harrington and Andreas Harsch and Richard Heidebrecht and Bethany Hughes and Joon Jung and Candia M Kenific and Astrid M Kral and Peter T Meinke and Richard E Middleton and Nicole Ozerova and David L Sloman and Matthew G Stanton and Alexander A Szewczak and Sriram Tyagarajan and David J Witter and J Paul Secrist and Thomas A Miller,18,Bioorganic & medicinal chemistry letters,3,973-978,Pergamon,We report herein the initial exploration of novel selective HDAC1/HDAC2 inhibitors (SHI-1:2). Optimized SHI-1:2 structures exhibit enhanced intrinsic activity against HDAC1 and HDAC2. and are greater than 100-fold selective versus other HDACs. including HDAC3. Based on the SAR of these agents and our current understanding of the HDAC active site. we postulate that the SHI-1:2 extend the existing HDAC inhibitor pharmacophore to include an internal binding domain.,True,r52hlDEAAAAJ:roLk4NBRz8UC,171,https://www.sciencedirect.com/science/article/pii/S0960894X0701476X,6334742342025559093,/scholar?cites=6334742342025559093,,https://www.academia.edu/download/45816187/j.bmcl.2007.12.03120160520-29800-c09tmv.pdf,0,0,0
1025170,The chemical basis of adenosine conservation throughout the Tetrahymena ribozyme.,1998,Lori Ortoleva-Donnelly and ALEXANDER A Szewczak and ROBIN R Gutell and SCOTT A Strobel,4,Rna,5,498-519,Cold Spring Harbor Lab,Adenosines are present at a disproportionately high frequency within several RNA structural motifs. To explore the importance of individual adenosine functional groups for group I intron activity. we performed Nucleotide Analog Interference Mapping (NAIM) with a collection of adenosine analogues. This paper reports the synthesis. transcriptional incorporation. and the observed interference pattern throughout the Tetrahymena group I intron for eight adenosine derivatives tagged with an alpha-phosphorothioate linkage for use in NAIM. All of the analogues were accurately incorporated into the transcript as an A. The sites that interfere with the 3'-exon ligation reaction of the Tetrahymena intron are coincident with the sites of phylogenetic conservation. yet the interference patterns for each analogue are different. These interference data provide several biochemical constraints that improve our understanding of the …,True,r52hlDEAAAAJ:d1gkVwhDpl0C,114,https://rnajournal.cshlp.org/content/4/5/498.short,11081598554508952555,/scholar?cites=11081598554508952555,,https://rnajournal.cshlp.org/content/4/5/498.full.pdf,0,0,0
1025171,Direct Detection of Monovalent Metal Ion Binding to a DNA G-quartet by 205Tl NMR,2000,Soumitra Basu and Alexander A Szewczak and Melanie Cocco and Scott A Strobel,122,Journal of the American Chemical Society,13,3240-3241,American Chemical Society,Monovalent metal cations. such as K+ and Na+. are required for the proper folding of several classes of nucleic acids. The best documented example is the monovalent metal ion requirement for G-quartet formation. 1. 2 but monovalent cations are also essential for the in vitro activity of catalytic RNAs. 3 The identification of monovalent metal ions within RNA and DNA has been hindered by the lack of direct methods for metal ion observation. though 15N-labeled ammonium has recently been used as a nonmetallic substitute for monovalent cation detection. 4. 5 Here we utilize the well characterized DNA G-quartet as a model system to demonstrate that thallous ion (Tl+) can efficiently substitute for K+ in the promotion of G-quartet formation and that the bound Tl+ monovalent metal cations can be directly detected by 205Tl NMR.The chemical and spectroscopic characteristics of Tl+ make it an ideal substitute for a K …,True,r52hlDEAAAAJ:9yKSN-GCB0IC,93,https://pubs.acs.org/doi/full/10.1021/ja993614g,670902206865100320,/scholar?cites=670902206865100320,,,0,0,0
1025172,A minor groove RNA triple helix within the catalytic core of a group I intron,1998,Alexander A Szewczak and Lori Ortoleva-Donnelly and Sean P Ryder and Eileen Moncoeur and Scott A Strobel,5,Nature structural biology,12,1037-1042,Nature Publishing Group,Close packing of several double helical and single stranded RNA elements is required for the Tetrahymena group I ribozyme to achieve catalysis. The chemical basis of these packing interactions is largely unknown. Using nucleotide analog interference suppression (NAIS). we demonstrate that the P1 substrate helix and J8/7 single stranded segment form an extended minor groove triple helix within the catalytic core of the ribozyme. Because each triple in the complex is mediated by at least one 2'-OH group. this substrate recognition triplex is unique to RNA and is fundamentally different from major groove homopurine–homopyrimidine triplexes. We have incorporated these biochemical data into a structural model of the ribozyme core that explains how the J8/7 strand organizes several helices within this complex RNA tertiary structure.,True,r52hlDEAAAAJ:2osOgNQ5qMEC,85,https://www.nature.com/articles/nsb1298_1037,8989624567079824869,/scholar?cites=8989624567079824869,,,0,0,0
1025173,MK-2461. a novel multitargeted kinase inhibitor. preferentially inhibits the activated c-Met receptor,2010,Bo-Sheng Pan and Grace KY Chan and Melissa Chenard and An Chi and Lenora J Davis and Sujal V Deshmukh and Jackson B Gibbs and Susana Gil and Gaozhen Hang and Harold Hatch and James P Jewell and Ilona Kariv and Jason D Katz and Kaiko Kunii and Wei Lu and Bart A Lutterbach and Cloud P Paweletz and Xianlu Qu and John F Reilly and Alexander A Szewczak and Qinwen Zeng and Nancy E Kohl and Christopher J Dinsmore,70,Cancer research,4,1524-1533,American Association for Cancer Research,The receptor tyrosine kinase c-Met is an attractive target for therapeutic blockade in cancer. Here. we describe MK-2461. a novel ATP-competitive multitargeted inhibitor of activated c-Met. MK-2461 inhibited in vitro phosphorylation of a peptide substrate recognized by wild-type or oncogenic c-Met kinases (N1100Y. Y1230C. Y1230H. Y1235D. and M1250T) with IC50 values of 0.4 to 2.5 nmol/L. In contrast. MK-2461 was several hundredfold less potent as an inhibitor of c-Met autophosphorylation at the kinase activation loop. In tumor cells. MK-2461 effectively suppressed constitutive or ligand-induced phosphorylation of the juxtamembrane domain and COOH-terminal docking site of c-Met. and its downstream signaling to the phosphoinositide 3-kinase–AKT and Ras–extracellular signal-regulated kinase pathways. without inhibiting autophosphorylation of the c-Met activation loop. BIAcore studies indicated 6-fold …,True,r52hlDEAAAAJ:Se3iqnhoufwC,80,https://cancerres.aacrjournals.org/content/70/4/1524.short,4865665469558406659,/scholar?cites=4865665469558406659,,https://cancerres.aacrjournals.org/content/canres/70/4/1524.full.pdf,0,0,0
1025174,An RNA internal loop acts as a hinge to facilitate ribozyme folding and catalysis.,1997,ALEXANDER A Szewczak and THOMAS R Cech,3,Rna,8,838-849,Cold Spring Harbor Lab,RNA molecules commonly consist of helical regions separated by internal loops. and in many cases these internal loops have been found to assume stable structures. We have examined the function and dynamics of an internal loop. J5/5a. that joins the two halves of the P4-P6 domain of the Tetrahymena self-splicing group I intron. P4-P6 RNAs with mutations in the J5/5a region showed nondenaturing gel electrophoretic mobilities and levels of Fe(II)-EDTA cleavage protection intermediate between those of wild-type RNA and a mutant incapable of folding into the native P4-P6 tertiary structure. Mutants with the least structured J5/5a loops behaved the most like wild-type P4-P6. and required smaller amounts of Mg2+ to rescue folding. The activity of reconstituted introns containing mutant P4-P6 RNAs correlated similarly with the nature of the J5/5a mutation. Our results suggest that. in solution. the P4-P6 RNA is in a …,True,r52hlDEAAAAJ:qjMakFHDy7sC,79,https://rnajournal.cshlp.org/content/3/8/838.short,9897548926695941647,/scholar?cites=9897548926695941647,,https://rnajournal.cshlp.org/content/3/8/838.full.pdf,0,0,0
1025175,Discovery of 1-Amino-5H-pyrido[4.3-b]indol-4-carboxamide Inhibitors of Janus Kinase 2 (JAK2) for the Treatment of Myeloproliferative Disorders,2011,Jongwon Lim and Brandon Taoka and Ryan D Otte and Kerrie Spencer and Christopher J Dinsmore and Michael D Altman and Grace Chan and Craig Rosenstein and Sujata Sharma and Hua-Poo Su and Alexander A Szewczak and Lin Xu and Hong Yin and Joan Zugay-Murphy and C Gary Marshall and Jonathan R Young,54,Journal of medicinal chemistry,20,7334-7349,American Chemical Society,The JAK-STAT pathway mediates signaling by cytokines. which control survival. proliferation. and differentiation of a variety of cells. In recent years. a single point mutation (V617F) in the tyrosine kinase JAK2 was found to be present with a high incidence in myeloproliferative disorders (MPDs). This mutation led to hyperactivation of JAK2. cytokine-independent signaling. and subsequent activation of downstream signaling networks. The genetic. biological. and physiological evidence suggests that JAK2 inhibitors could be effective in treating MPDs. De novo design efforts of new scaffolds identified 1-amino-5H-pyrido[4.3-b]indol-4-carboxamides as a new viable lead series. Subsequent optimization of cell potency. metabolic stability. and off-target activities of the leads led to the discovery of 7-(2-aminopyrimidin-5-yl)-1-{[(1R)-1-cyclopropyl-2.2.2-trifluoroethyl]amino}-5H-pyrido[4.3-b]indole-4-carboxamide (65 …,True,r52hlDEAAAAJ:hqOjcs7Dif8C,69,https://pubs.acs.org/doi/abs/10.1021/jm200909u,11665572764856550248,/scholar?cites=11665572764856550248,,,0,0,0
1025176,Two-dimensional hetero-TOCSY-NOESY. Correlation of phosphorus-31 resonances with anomeric and aromatic proton resonances in RNA,1992,Gregory W Kellogg and Alexander A Szewczak and Peter B Moore,114,Journal of the American Chemical Society,7,2727-2728,American Chemical Society,"—Fe (CO) 3C60++ 2CO(2) apparently results from kinetically or internally excited C60+ and is completely absent when the Cm+ is subjected to the 1-s cooling period. For comparison. no reaction is observed for Cr (CO) 6. possibly due to steric or electronic reasons. CID21· 22 of Fe-(CO) 4C60+(19-92 eV. lab frame) resulted in the consecutive loss of carbonyls to eventually yield FeC60+. A further increase in CID energy (114-185 eV) gives Cm"" 1"" exclusively. consistent with our earlier study. 9 These resultsindicate that Z)(Fe+-C60)> D-(Fe+-CO)= 36.6±1.8 kcal/mol. 23 which is alsoconsistent with our previous findings. 9",True,r52hlDEAAAAJ:IjCSPb-OGe4C,65,https://pubs.acs.org/doi/pdf/10.1021/ja00033a062,5861652033366726342,/scholar?cites=5861652033366726342,,,0,0,0
1025177,Relative contribution of endogenous neurotrophins in hippocampal long-term potentiation,1999,Guiquan Chen and Roland Kolbeck and Yves-Alain Barde and Tobias Bonhoeffer and Albrecht Kossel,19,Journal of Neuroscience,18,7983-7990,Society for Neuroscience,Recent evidence has shown that brain-derived neurotrophic factor (BDNF) is involved in hippocampal long-term potentiation (LTP). Because the reagents used in acute experiments react not only with BDNF but also with neurotrophin-4/5 (NT4/5) and neurotrophin-3 (NT3). we examined the involvement of these neurotrophins in LTP using two highly specific. function-blocking monoclonal antibodies against BDNF and NT3. as well as a TrkB-IgG fusion protein. Our results show that NT3 antibodies did not have any effects on LTP. However. both TrkB-IgG fusion proteins and BDNF antibody similarly reduced LTP. suggesting that only BDNF but no other ligands of the TrkB-receptor are likely to be involved in LTP induction. The reduction in LTP depended on the inducing stimuli and was only observed with theta-burst stimulation (TBS) but not with tetanic stimulation. We further observed that LTP was only reduced if …,True,yps-fBcAAAAJ:lSLTfruPkqcC,262,https://www.jneurosci.org/content/19/18/7983.short,14319762577746636176,/scholar?cites=14319762577746636176,,https://www.jneurosci.org/content/jneuro/19/18/7983.full.pdf,0,0,0
1025178,Protamines and histones,1928,Albrecht Kossel,,,,,Longmans. Green and co.,,True,yps-fBcAAAAJ:RYcK_YlVTxYC,255,https://agris.fao.org/agris-search/search.do?recordID=US201300419043,15369880156783950118,/scholar?cites=15369880156783950118,,,0,0,0
1025179,Protamines and histones,1928,Albrecht Kossel,,,,118,Longmans. Green and co.,,True,yps-fBcAAAAJ:SeFeTyx0c_EC,247,https://agris.fao.org/agris-search/search.do?recordID=US201300419043,15369880156783950118,/scholar?cites=15369880156783950118,,,0,0,0
1025180,Beitrage zur kenntnis der eiweisskorper,1900,Albrecht Kossel and Fr Kutscher,31,Z. physiol. Chem,,165-214,,,True,yps-fBcAAAAJ:fPk4N6BV_jEC,143,http://scholar.google.com/scholar?cluster=3623730874050422016&hl=en&oi=scholarr,3623730874050422016,/scholar?cites=3623730874050422016,,,0,0,0
1025181,Über die arginase.,1904,Albrecht Kossel and HD Dakin,41,Biological Chemistry,4,321-331,,General note: By using the comment function on degruyter. com you agree to our Privacy Statement. A respectful treatment of one another is important to us. Therefore we would like to draw your attention to our House Rules.,True,yps-fBcAAAAJ:NhqRSupF_l8C,139,http://scholar.google.com/scholar?cluster=9978921389295480378&hl=en&oi=scholarr,9978921389295480378,/scholar?cites=9978921389295480378,,,0,0,0
