,title,pub_year,author,volume,journal,number,pages,publisher,abstract,filled,author_pub_id,num_citations,pub_url,cites_id,citedby_url,gsrank,author_id,eprint_url,got_citations,got_author_ids,author_ids
1265235,The control of major accident hazards: The land-use planning issue,1999,Michalis D Christou and Aniello Amendola and Maria Smeder,65,,1-2,151-178,Elsevier,Land-Use Planning with respect to major accident hazards constitutes one of the new requirements of the `Seveso II Directive'. The paper discusses the rationale and the requirements set by the Directive for the operators of the plants and the planning authorities to take into account the major accident hazards in the land-use planning procedure. Then. the paper focuses on approaches and criteria applied in the European Union. and gives information on procedures in other countries. wherever available. The approaches analysed are grouped into three broad categories. namely. establishing `generic distances'. `consequence based'. and `risk based'. Finally. two illustrative examples facilitate understanding and comparison of the analysed approaches.,True,B2B76wgAAAAJ:RHpTSmoSYBkC,139,https://www.sciencedirect.com/science/article/pii/S0304389498002611,11939385608369375810,/scholar?cites=11939385608369375810,,,,0,0,0
1265236,Statistical analysis of major accidents in petrochemical industry notified to the major accident reporting system (MARS),2006,Zoe Nivolianitou and Myrto Konstandinidou and Christou Michalis,137,Journal of hazardous materials,1,1-7,Elsevier,The European major accident reporting system (MARS) was created within the framework of European Union (EU) directive 82/501. the so-called “SEVESO” directive. and in order to register all the major industrial accidents notified to the European Union authorities from the member states. Statistical analysis of these accidents offers significant data to the understanding and prevention of industrial accidents. This paper makes an analysis of some characteristics of major accidents in the petrochemical sector included in MARS. The statistical analysis focused on the main categorization fields of the MARS short reports and additionally a refinement of the immediate causes of major accidents with focus on the organizational factors was attempted through the details provided in the full reports of the database.,True,B2B76wgAAAAJ:_kc_bZDykSQC,136,https://www.sciencedirect.com/science/article/pii/S0304389406003037,1193481718479440338,/scholar?cites=1193481718479440338,,,https://www.researchgate.net/profile/Myrto_Konstandinidou/publication/7133128_Statistical_analysis_of_major_accidents_in_petrochemical_industry_notified_to_the_major_accident_reporting_system_MARS/links/5a1c2f96aca272df0811806b/Statistical-analysis-of-major-accidents-in-petrochemical-industry-notified-to-the-major-accident-reporting-system-MARS.pdf,0,0,0
1265237,Application of land-use planning criteria for the control of major accident hazards: A case-study,2006,Valerio Cozzani and Riccardo Bandini and Claudia Basta and Michalis D Christou,136,Journal of hazardous materials,2,170-180,Elsevier,Land-use planning (LUP) with respect to major accident hazards is one of the more important requirements of Directive 96/82/EC (the so-called Seveso II Directive). Different approaches were developed by the Member States of the European Union in order to implement this aspect of the Directive. This study focuses on the comparison of the specific approaches developed for LUP with respect to major accidents hazards. An Italian industrial area has been selected to perform a case study. The different LUP criteria have been used both to evaluate the present state of the area and the effect of several proposed hazard reduction actions. The results obtained have allowed a comparison of the different LUP methodologies. Critical steps in the application of the different LUP criteria have been identified. and the different priorities of hazard reduction actions resulting from risk-based and consequence-based approaches …,True,B2B76wgAAAAJ:YOwf2qJgpHMC,126,https://www.sciencedirect.com/science/article/pii/S0304389405008241,9480929580207256401,/scholar?cites=9480929580207256401,,,,0,0,0
1265238,Probabilistic safety analysis in chemical installations,1992,Ioannis A Papazoglou and Zoe Nivolianitou and Olga Aneziris and Michalis Christou,5,Journal of Loss Prevention in the Process Industries,3,181-191,Elsevier,A set of procedures and corresponding methodologies for probabilistic safety assessment (PSA) in chemical installations is presented. State-of-the-art methodology for PSA in nuclear power plants is tested for suitability and applicability to chemical installations and applied on a refrigerated ammonia storage facility. The procedural steps comprise hazard identification. accident sequence modelling. data acquisition and parameter estimation. accident sequence quantification. hazardous substance release categories assessment. consequence assessment and integration of results. The results of the application indicate that the methodology applied is adequate from the procedural and completeness point of view and that no major aspect of PSA of a chemical installation is overlooked. A need for integrated computerized tools has. however. been identified.,True,B2B76wgAAAAJ:9yKSN-GCB0IC,98,https://www.sciencedirect.com/science/article/pii/095042309280022Z,5266150006383408976,/scholar?cites=5266150006383408976,,,,0,0,0
1265239,Safety of offshore oil and gas operations: Lessons from past accident analysis,2012,Michalis Christou and Myrto Konstantinidou,,Joint Research Centre of the European Commission,,1-60,,,True,B2B76wgAAAAJ:4JMBOYKVnBMC,96,http://scholar.google.com/scholar?cluster=4299506334135152953&hl=en&oi=scholarr,4299506334135152953,/scholar?cites=4299506334135152953,,,,0,0,0
1265240,The use of geographic information systems in major accident risk assessment and management,2000,Sergio Contini and Furio Bellezza and Michalis D Christou and Christian Kirchsteiger,78,Journal of Hazardous Materials,1-3,223-245,Elsevier,The paper discusses the use of modern information technologies. and in particular geographic information systems (GIS). in the management and control of major accident risk. For this purpose. the regulatory framework of the recent “Seveso II” Directive is briefly described. This asks for more transparent procedures and decision-making. and requires consultation of the public in land-use and off-site emergency planning. Correspondingly. new demands are put to support tools being developed. The main features of tools dealing with hazard sources mapping. risk assessment. risk management. and emergency planning are discussed and examples are given. Moreover. it is argued that. if appropriately designed. their use can enhance the dialog between plant operators. authorities and the public to facilitate a consensus on risk issues. Finally. limitations in the use of these tools and prospects for future developments …,True,B2B76wgAAAAJ:L8Ckcad2t8MC,96,https://www.sciencedirect.com/science/article/pii/S0304389400002247,9937538509247104679,/scholar?cites=9937538509247104679,,,,0,0,0
1265241,Land-use planning in the vicinity of chemical sites: Risk-informed decision making at a local community level,2000,Michalis D Christou and Marina Mattarelli,78,Journal of hazardous materials,1-3,191-222,Elsevier,Land-use planning with respect to major accident hazards is one of the new requirements of the ‘Seveso II Directive’. On top of this requirement. but also recognising the importance of the issue for the control of major accidents. the various European Member States have developed or are developing adequate procedures. approaches and criteria for the acceptability of hazards or risk. At a national level. various criteria are in use based either on ‘generic distances’. or on the level of consequences. or on the level of risk. At a regional and local level. however. local particularities and the presence of multiple and usually conflicting objectives — such as reduction of risk with simultaneous increase of the benefit from exploitation of land — seem to be of great importance in decision making. The paper focuses especially on the local level and it presents a methodological framework to take these conflicting objectives into …,True,B2B76wgAAAAJ:-f6ydRqryjwC,74,https://www.sciencedirect.com/science/article/pii/S0304389400002235,9168836906587560785,/scholar?cites=9168836906587560785,,,http://microkat.gr/microrisk2001/J3F-MikeLUPACS-Sev2k-z.doc,0,0,0
1265242,Risk assessment in support to land-use planning in Europe: Towards more consistent decisions?,2011,Michalis Christou and Zsuzsanna Gyenes and Michael Struckl,24,Journal of Loss Prevention in the Process Industries,3,219-226,Elsevier,Recognising the importance of establishing appropriate separation distances between hazardous installations and vulnerable residential areas for mitigating the effects of industrial accidents. the European legislation for the control of major accident hazards – the so-called Seveso II Directive – calls for procedures ensuring that technical advice is taken systematically into account for land-use planning (LUP) purposes. Due to historical. administrative. cultural and other reasons. these European Union’s Member States which have consolidated procedures for addressing this issue. have employed different approaches. methods and criteria. with a potential for great divergence in the resulting land-use planning decisions. In order to address this situation and to increase consistency and ‘defendability’ of land-use planning decisions in the EU. a European Working Group has been established and is operating under …,True,B2B76wgAAAAJ:j3f4tGmQtD8C,56,https://www.sciencedirect.com/science/article/pii/S0950423010001245,15949670273516711216,/scholar?cites=15949670273516711216,,,,0,0,0
1265243,Risk assessment and management in the context of the Seveso II Directive,1998,Michalis D Christou and Georgios A Papadakis,,,,,Elsevier,"Read the latest chapters of Industrial Safety Series at ScienceDirect.com.
Elsevier's leading platform of peer-reviewed scholarly literature.
",True,B2B76wgAAAAJ:2osOgNQ5qMEC,56,https://www.sciencedirect.com/bookseries/industrial-safety-series/vol/7/suppl/C375PDF?page-size=100&page=1,9177405258756382315,/scholar?cites=9177405258756382315,,,,0,0,0
1265244,Identification of reference accident scenarios in SEVESO establishments,2005,Christian Delvosalle and Cécile Fiévez and Aurore Pipart and J Casal Fabrega and Eulàlia Planas and Michalis Christou and Fesil Mushtaq,90,Reliability Engineering & System Safety,2-3,238-246,Elsevier,In the frame of the ESREL special session on ARAMIS project. this paper aims at presenting the work carried out in the first Work Package. devoted to the definition of accident scenarios. This topic is a key-point in risk assessment. and serves as basis for the whole risk quantification. A first part of the work aims at building a Methodology for the Identification of Major Accident Hazards (MIMAH). which is carried out with the development of generic fault and event trees based on a typology of equipment and substances. This work is coupled with an historical analysis of accidents. In a second part. influence of safety devices and policies will be considered. in order to build a Methodology for the Identification of Reference Accident Scenarios (MIRAS). This last one will take into account safety systems and lead to obtain more realistic scenarios.,True,B2B76wgAAAAJ:ZeXyd9-uunAC,52,https://www.sciencedirect.com/science/article/pii/S0951832004002625,11514114842023476528,/scholar?cites=11514114842023476528,,,,0,0,0
1265245,Study of major accidents involving chemical reactive substances: analysis and lessons learned,2007,J Sales and F Mushtaq and MD Christou and R Nomen,85,Process Safety and Environmental Protection,2,117-124,Elsevier,The objective of this paper is to present the results of the analysis performed on a selection of accidents included in the MARS database. This is a database of past accidents that occurred in Europe maintained by the European Commission. in order to help the Member States to meet the requirements of the Seveso and Seveso II directives. The study is focused on those accidents that involve reactions between chemical substances. whether wanted or unwanted. that generated a hazardous situation by loss of control of such reactions. Runaway reactions are known to be especially dangerous. given that many times they are unexpected. or their possible consequences underestimated. so sometimes chemical industries are not ready to cope with the effects of loss of control of reactive processes. The aim of the analysis is to obtain lessons learned from past accidents in order to prevent similar situations in the future …,True,B2B76wgAAAAJ:4TOpqqG69KYC,51,https://www.sciencedirect.com/science/article/pii/S0957582007713976,8413135319844883662,/scholar?cites=8413135319844883662,,,https://www.academia.edu/download/49991313/psep0601220161030-2646-1ct8p0u.pdf,0,0,0
1265246,Analysis and control of major accidents from the intermediate temporary storage of dangerous substances in marshalling yards and port areas,1999,Michalis D Christou,12,Journal of Loss Prevention in the Process Industries,1,109-119,Elsevier,This paper deals with the major accident hazards associated with the intermediate temporary storage of dangerous substances in transportation-related activities. In particular. the hazards related to the presence of dangerous substances in port areas and marshalling yards are identified and analysed. Furthermore. a number of past accidents in transport interfaces have been collated from various sources and have been statistically analysed. Finally. the framework for major accident control in these activities is reviewed and discussed.,True,B2B76wgAAAAJ:iH-uZ7U-co4C,48,https://www.sciencedirect.com/science/article/pii/S0950423098000436,17572998749192547309,/scholar?cites=17572998749192547309,,,,0,0,0
1265247,Guidane on Land Use Planning as Required by Council Directive 96/82/EC (Seveso-II),1999,Michalis CHRISTOU,,EUR 18695 EN,,,,"CiNii 国立情報学研究所 学術情報ナビゲータ[サイニィ]. メニュー 検索 … 
",True,B2B76wgAAAAJ:_FxGoFyzp5QC,48,https://ci.nii.ac.jp/naid/10004471880/,105172121404066823,/scholar?cites=105172121404066823,,,,0,0,0
1265248,Land use planning guidelines in the context of article 12 of the Seveso II Directive 96/82/EC as amended by Directive 105/2003/EC,2006,MD Christou and M Struckl and T Biermann,,Institute for the Protection and Security of the Citizen: Hazard Assessment Unit,,,,This document represents existing best practice drawn from the cumulative knowledge of experts in this field. Its use is not mandatory. but it can be used by Member States to achieve compliance with the legislation. This is a developing area of knowledge so there is a need to remain alert to progress.The document is intended to give guidance for risk assessment in Land Use Planning (LUP) in general as far as the major accident potential of industrial establishments is concerned. The main aim in this respect was to combine the understanding of the land use planners and the risk assessment experts in a coherent view. In this respect it may offer especially land use planners not familiar with industrial risk assessment considerations a quick and comprehensive information resource. It will also assist with the use of the risk/hazard assessment database which the Major Accident Hazards Bureau (MAHB) was assigned to develop and which shall provide proposals for key factors in this respect. By defining best practice of risk assessment in Land Use Planning the underlying principles of the risk/hazard assessment database are described.,True,B2B76wgAAAAJ:r0BpntZqJG4C,42,http://www.mit.gov.it/mit/media/seveso2/pages/documents/comunitari/E_LUP_EN_09_2006_MAHB.pdf,4281709053083386988,/scholar?cites=4281709053083386988,,,http://www.mit.gov.it/mit/media/seveso2/pages/documents/comunitari/E_LUP_EN_09_2006_MAHB.pdf,0,0,0
1265249,A decision support system for emergency response to major nuclear accidents,1997,Ioannis A Papazoglou and Michalis D Christou,118,Nuclear technology,2,97-122,Taylor & Francis,A methodology for the optimization of the shortterm emergency response in the event of a nuclear accident is presented. The method seeks an optimum combination of protective actions in the presence of a multitude of conflicting objectives and under uncertainty. Conflicting objectives arise in the attempt to minimize simultaneously the potential adverse effects of an accident and the associated socioeconomic impacts. Additional conflicting objectives arise whenever an emergency plan tends to decrease a particular health effect. such as acute deaths. while it increases another. such as latent deaths. The uncertainty is due to the multitude of possible accident scenarios and their respective probability of occurrence. the stochastic variability in the weather conditions. and the variability and/or lack of knowledge of the parameters of the risk assessment models. A multiobjective optimization approach is adopted. An …,True,B2B76wgAAAAJ:IWHjjKOFINEC,36,https://www.tandfonline.com/doi/abs/10.13182/NT97-A35371,10456610357321653876,/scholar?cites=10456610357321653876,,,,0,0,0
1265250,Assessment of uncertainties in risk analysis of chemical establishments,2002,Kurt Lauridsen and Igor Kozine and Frank Markert and Aniello Amendola and Michalis Christou and Monica Fiori,,"Summary Report of the ASSURANCE Project, Risk National Laboratory, Roskilde, Denmark",,,,This report summarises the results obtained in the ASSURANCE project (EU contract number ENV4-CT97-0627). Seven teams have performed risk analyses for the same chemical facility. an ammonia storage. The EC's Joint Research Centre at Ispra and Risø National Laboratory co-ordinated the exercise and led the comparison of results in order to reveal the causes for differences between the partners' results. The results of the project point to an increased awareness of the potential uncertainties in risk analyses and highlight a number of important sources of such uncertainties. In the hazard identification phase it was revealed that the ranking of hazardous scenarios by probabilistic and deterministic approaches could result in completely different conclusions.,True,B2B76wgAAAAJ:YFjsv_pBGBYC,33,http://scholar.google.com/scholar?cluster=2401141035134971418&hl=en&oi=scholarr,2401141035134971418,/scholar?cites=2401141035134971418,,,,0,0,0
1265251,SOCRATES: a computerized toolkit for quantification of the risk from accidental releases of toxic and/or flammable substances,1996,loannis A Papazoglou and Olga Aneziris and Gerasimos Bonanos and Michalis Christou,6,International Journal of Environment and pollution,4-6,500-533,Inderscience Publishers,A computerised toolkit for quantification of the risk from accident releases of toxic and/or flammable substances is presented. Methodological and procedural steps for quantifying the consequences and the associated risk to health is presented. along with their implementation in a user–friendly computer package. The methodology and the associated toolkit have the capability of integrated risk analysis. that is calculation of two risk indices: individual risk and group risk. The code is capable of handling multiple accident scenarios. complex terrain dispersion and uncertainty quantification (including parameter and model uncertainty). and is characterised by a user–friendly graphic user interface. An application of the methodology and the code in a case study is also provided.,True,B2B76wgAAAAJ:LkGwnXOMwfcC,31,https://www.inderscienceonline.com/doi/abs/10.1504/IJEP.1996.028331,4115684505590839719,/scholar?cites=4115684505590839719,,,,0,0,0
1265252,Assessing the uncertainties in the process of risk analysis of chemical establishments: Part 1 and 2,2001,Kurt Lauridsen and Michalis Christou and Aniello Amendola and Frank Markert and Igor Kozine and Monica Fiori,,Proceedings of the International Conference on ESREL,,,,The paper describes results of a European benchmark exercise in risk analysis of an ammonia storage facility. The comparison of results from the participants in the exercise showed significant differences. both in the frequency-and in the consequence assessment. The causes of some of these differences are discussed in the second part of the paper. This first part describes the project. the hazard identification phase and shows a summary of the QRA results.,True,B2B76wgAAAAJ:mB3voiENLucC,26,http://citeseerx.ist.psu.edu/viewdoc/download?doi=10.1.1.202.7445&rep=rep1&type=pdf,1287683619134247869,/scholar?cites=1287683619134247869,,,http://citeseerx.ist.psu.edu/viewdoc/download?doi=10.1.1.202.7445&rep=rep1&type=pdf,0,0,0
1265253,Reference criteria for the identification of accident scenarios in the framework of land use planning,2013,Alessandro Tugnoli and Zsuzsanna Gyenes and Lorenzo Van Wijk and Michalis Christou and Gigliola Spadoni and Valerio Cozzani,26,Journal of Loss Prevention in the Process Industries,4,614-627,Elsevier,Land use planning (LUP) around industrial sites at risk of major accidents requires the application of sound approaches in the selection of credible accident scenarios. In fact. the ‘technical’ phase of LUP is based on the identification and assessment of relevant accident scenarios. An improper choice of scenarios may critically affect both the ‘technical’ phase of risk assessment and the following ‘policy’ phase concerning decision making on land-use restrictions and/or licensing. The present study introduces a procedure aimed at the systematic identification of reference accident scenarios to be used in the gathering of technical data on potential major accidents. which is a necessary step for LUP around Seveso sites. Possible accident scenarios are generated by an improved version of the MIMAH methodology (Methodology for the Identification of Major Accident Hazards). The accident scenarios are then assessed …,True,B2B76wgAAAAJ:qUcmZB5y_30C,23,https://www.sciencedirect.com/science/article/pii/S0950423012001799,16177063742050041113,/scholar?cites=16177063742050041113,,,,0,0,0
1265254,Assessment of uncertainties in risk analysis of chemical establishments: The ASSURANCE project,2002,Kurt Lauridsen and Igor Kozine and Frank Markert and Aniello Amendola and Michalis Christou and Monica Fiori,,"Final Report, Risø",,,,This report summarises the results obtained in the ASSURANCE project (EU contract number ENV4-CT97-0627). Seven teams have performed risk analyses for the same chemical facility. an ammonia storage. The EC's Joint Research Centre at Ispra and Risø National Laboratory coordinated the exercise and led the comparison of results in order to reveal the causes for differences between the partners' results. The results of the project point to an increased awareness of the potential uncertainties in risk analyses and highlight a number of important sources of such uncertainties. In the hazard identification phase it was revealed that the ranking of hazardous scenarios by probabilistic and deterministic approaches could result in completely different conclusions. On the other hand. despite a large difference in frequency assessments of the same hazardous scenarios. there was good consensus on the ranking among the adherents of the probabilistic approach. Breaking down the modelling of both frequency and consequence assessments into suitably small elements and conducting case studies allowed identifying root causes of uncertainty in the final risk assessments. Large differences were found in both the frequency assessments and in the assessment of consequences. The report gives a qualitative assessment of the importance to the final calculated risk of uncertainties in assumptions made. in the data and the calculation methods used. This assessment can serve as a guide to areas where. in particular. caution must be taken when performing risk analyses.,True,B2B76wgAAAAJ:NMxIlDl6LWMC,23,http://riskprom.ru/_ld/2/265_ris-r-1344.pdf,17726314959790548398,/scholar?cites=17726314959790548398,,,http://riskprom.ru/_ld/2/265_ris-r-1344.pdf,0,0,0
1265255,Safety of offshore oil and gas operations: Lessons from past accident analysis: Ensuring EU hydrocarbon supply through better control of major hazards,2012,Michalis Christou and Myrto Konstantinidou,,"Publication JRC77767. Joint Research Centre, European Commission",,,,,True,B2B76wgAAAAJ:ns9cj8rnVeAC,21,http://scholar.google.com/scholar?cluster=6720049363914614780&hl=en&oi=scholarr,6720049363914614780,/scholar?cites=6720049363914614780,,,,0,0,0
1265256,Land Use Planning in the Context of Major Accident Hazards-An Analysis of Procedures and Criteria in Selected EU Member States,1996,M Smeder,,EUR 16452 EN,,,,"CiNii 国立情報学研究所 学術情報ナビゲータ[サイニィ]. メニュー 検索 … 
",True,B2B76wgAAAAJ:maZDTaKrznsC,19,https://ci.nii.ac.jp/naid/10004471879/,14159786987300496740,/scholar?cites=14159786987300496740,,,,0,0,0
