,title,pub_year,author,volume,journal,number,pages,publisher,abstract,filled,author_pub_id,num_citations,pub_url,cites_id,citedby_url,author_id,eprint_url,got_citations,got_author_ids,author_ids
88462,Pellagra. azathioprine and inflammatory bowel disease,1997,P Jarrett and M Duffill and A Oakley and A Smith,22,Clinical and experimental dermatology,1,44-45,Blackwell Publishing Ltd,Two patients are described who developed pellagra during treatment with azathioprine for inflammatory bowel disease.,True,8pK0oMgAAAAJ:VnuxuLaQPLMC,31,https://onlinelibrary.wiley.com/doi/abs/10.1046/j.1365-2230.1997.1930606.x,2330790992286862884,/scholar?cites=2330790992286862884,,,0,0,0
88463,Networking knowledge for information societies: Institutions and intervention,2002,Edited Robin Mansell and Rohan Samarajiva and Amy Mahan and Binod C Agrawal and Peter S Anderson and Peng Hwa Ang and Jens C Arnbak and Robert E Babe and Johannes M Bauer and Jörg Becker and Jean-claude Burgelman and Martin Cave and Sung Woon Cho and Edward Comor and James Cornford and James A Dewar and John DH Downing and Elizabeth Fox and Chris Freeman and David Gabel and Nicholas Garnham and Alison Gillwald and John B Goddard and Anders Henten and John W Houghton and Heather E Hudson and Meheroo Jussawalla and Tim Kelly and Rolf Künneke and John Langdale and Carleen F Maitland and Werner A Meier and Ian Miles and Bella Mody and Vincent Mosco and Edwin B Parker and Aileen A Pisciotta and Paschal Preston and Marc Raboy and Rivka Ribak and Liora Salter and Roderick Sanatan and BP Sanjay and Peter Sheehan and Peter Shields and Roger Silverstone and Supriya Singh and Knud Erik Skouby and Anthony Smith and Ricardo Tavares and Harry M Trebing and Gaëtan Tremblay and Joseph Turow and John Ure and Silvio Waisbord and Rudi Westerveld and Márcio Wohlers,,,,,,"CiteSeerX - Document Details (Isaac Councill. Lee Giles. Pradeep Teregowda): or mechanical..
",True,8pK0oMgAAAAJ:5p9vMBpPSXYC,30,http://citeseerx.ist.psu.edu/viewdoc/summary?doi=10.1.1.114.7725,2566594991449471144,/scholar?cites=2566594991449471144,,,0,0,0
88464,Raised serum aluminum concentration in Alzheimer's disease,1989,GJ Naylor and AH W SMITH and A McHarg and PJ Walker and B Shepherd,6,Trace elements in medicine,3,93-95,,Sauf mention contraire ci-dessus. le contenu de cette notice bibliographique peut être utilisé dans le cadre d’une licence CC BY 4.0 Inist-CNRS/Unless otherwise stated above. the content of this bibliographic record may be used under a CC BY 4.0 licence by Inist-CNRS/A menos que se haya señalado antes. el contenido de este registro bibliográfico puede ser utilizado al amparo de una licencia CC BY 4.0 Inist-CNRS,True,8pK0oMgAAAAJ:3pYxbvHKFu8C,30,https://pascal-francis.inist.fr/vibad/index.php?action=getRecordDetail&idt=19244774,5185597016893086478,/scholar?cites=5185597016893086478,,,0,0,0
88465,Uremia in sickle-cell anemia treated by maintenance hemodialysis,1974,Eli A Friedman and TK Sreepada Rao and Charles L Sprung and Albert Smith and Thomas Manis and Rita Bellevue and Khalid MH Butt and Richard D Levere and Dorothy M Holden,291,New England Journal of Medicine,9,431-435,Massachusetts Medical Society,"Renal failure. which developed in two patients with sickle-cell anemia. was treated by maintenance hemodialysis for six and seven months. Medullary cystic disease appeared to cause the uremia in a 32-year-old black man with sickle-cell anemia; in the second patient. a 24-year-old black woman. histologic changes in a renal biopsy were consistent with so-called ""sickle nephropathy.""When uremia supervened each patient's transfusion requirement. which had been stable at 2 units per month. increased abruptly to 5 and 6 units per month. and then fell. upon initiation of maintenance hemodialysis. to 1 unit per month. Vascular access for dialysis was provided by an internal arteriovenous fistula in one patient and an arterioarterial bovine carotid heterograft in the other. There were neither hemorrhagic nor thrombotic complications of the dialysis regimen. Coincident congestive heart failure in both patients …",True,8pK0oMgAAAAJ:1EqfMoDn7-AC,30,https://www.nejm.org/doi/full/10.1056/NEJM197408292910902,12900274233218101523,/scholar?cites=12900274233218101523,,,0,0,0
88466,Mariner 7 television pictures: First report,1969,Robert B Leighton and Norman H Horowitz and Bruce C Murray and Robert P Sharp and Alan G Herriman and Andrew T Young and Bradford A Smith and Merton E Davies and Conway B Leovy,165,Science,3895,787-795,American Association for the Advancement of Science,Initial results of the television experiment carried by Mariner 6 were recently reported (1). This is a similar report of the television experiment aboard Mariner 7. These reports are presented primarily to communicate significant results to the scientific community as rapidly as possible. A more comprehensive. but still preliminary. review of the results of both experiments. and of their implications concerning the atmosphere and surface of Mars. is in preparation for submission to this journal.,True,8pK0oMgAAAAJ:QD3KBmkZPeQC,30,https://authors.library.caltech.edu/52530/,6485492625680413596,/scholar?cites=6485492625680413596,,,0,0,0
88467,Performance of the GeneXpert® enterovirus assay for detection of enteroviral RNA in cerebrospinal fluid,2008,Elizabeth M Marlowe and Susan M Novak and James J Dunn and Amy Smith and Joven Cumpio and Edna Makalintal and Darryl Barnes and Raoul J Burchette,43,Journal of clinical virology,1,110-113,Elsevier,The GeneXpert® Dx System allows for automated extraction. processing. amplification and real-time detection of target nucleic acids.To evaluate the performance of the Cepheid Xpert™ enterovirus (EV) assay for detection of EV RNA compared to a nucleic acid sequence based amplification (NASBA®) assay and a user-developed TaqMan® RT-PCR assay.Assays were evaluated using a 12-member proficiency panel and up to 138 CSF specimens. Samples in which EV RNA was detected by two or more assays were considered true positives.The GeneXpert. NASBA. and TaqMan assays correctly identified 10. 8. and 7 of 12 proficiency panel members. respectively. For detection of EV RNA in CSF. the sensitivities of the GeneXpert. NASBA. and TaqMan were 100%. 87.5%. and 96%. respectively. There were no false positives. Two samples tested by GeneXpert and …,True,8pK0oMgAAAAJ:3UHJKpZgG5wC,29,https://www.sciencedirect.com/science/article/pii/S1386653208001522,9260494502520942814,/scholar?cites=9260494502520942814,,,0,0,0
88468,The contribution of adults' nonverbal cues and children's shyness to the development of rapport between adults and preschool children,2003,Ken J Rotenberg and Nancy Eisenberg and Christine Cumming and Ashlee Smith and Mike Singh and Elizabeth Terlicher,27,International Journal of Behavioral Development,1,21-30,Sage Publications,In the study. 63 American preschool children (mean age 4 years. 8 months) were                 approached and read stories by adult testers who displayed high versus low                 frequencies of smiling and gaze. After being read to. the testers elicited                 self-disclosure from the children and later the children rated the trustworthiness                 and likeability of the tester (rapport measures). As additional measures of rapport.                 the children's smiling. gaze. and lack of nervousness in the interactions were                 observed. The results indicated that the development of rapport with children was                 greater when the adult tester displayed high rather than low frequencies of smiling                 but not gaze. Children's shyness also contributed to the development of rapport.                 Shyness was negatively associated with rapport perceptions/behaviours and. in the                 case of attributed trustworthiness …,True,8pK0oMgAAAAJ:I__7AI8a974C,29,https://journals.sagepub.com/doi/abs/10.1080/01650250143000571,16812174669885631970,/scholar?cites=16812174669885631970,,,0,0,0
88469,Study of  and  meson production in B meson decays,2001,S Chen and J Fast and JW Hinson and J Lee and David Harry Miller and EI Shibata and IPJ Shipsey and V Pavlunin and D Cronin-Hennessy and Adam L Lyon and EH Thorndike and V Savinov and TE Coan and V Fadeyev and YS Gao and Y Maravin and I Narsky and R Stroynowski and J Ye and T Wlodek and M Artuso and R Ayad and C Boulahouache and K Bukin and E Dambasuren and S Karamov and G Majumder and GC Moneti and R Mountain and S Schuh and T Skwarnicki and S Stone and JC Wang and A Wolf and J Wu and S Kopp and M Kostin and AH Mahmood and SE Csorna and I Danko and KW McLean and Z Xu and R Godang and G Bonvicini and D Cinabro and M Dubrovin and S McGee and GJ Zhou and E Lipeles and SP Pappas and M Schmidtler and A Shapiro and WM Sun and AJ Weinstein and F Würthwein and DE Jaffe and G Masek and HP Paar and EM Potter and S Prell and DM Asner and A Eppich and TS Hill and RJ Morrison and RA Briere and GP Chen and A Gritsan and JP Alexander and R Baker and C Bebek and BE Berger and K Berkelman and F Blanc and V Boisvert and DG Cassel and Persis S Drell and JE Duboscq and Karl M Ecklund and R Ehrlich and AD Foland and P Gaidarev and L Gibbons and B Gittelman and SW Gray and DL Hartill and BK Heltsley and PI Hopman and L Hsu and CD Jones and J Kandaswamy and DL Kreinick and M Lohner and A Magerkurth and TO Meyer and NB Mistry and E Nordberg and M Palmer and JR Patterson and D Peterson and D Riley and A Romano and JG Thayer and D Urner and B Valant-Spaight and G Viehhauser and A Warburton and P Avery and C Prescott and AI Rubiera and H Stoeck and J Yelton and G Brandenburg and A Ershov and DY-J Kim and R Wilson and H Yamamoto and T Bergfeld and BI Eisenstein and J Ernst and GE Gladding and GD Gollin and RM Hans and E Johnson and I Karliner and MA Marsh and C Plager and C Sedlack and M Selen and JJ Thaler and J Williams and KW Edwards and R Janicek and PM Patel and AJ Sadoff and R Ammar and A Bean and D Besson and X Zhao and S Anderson and VV Frolov and Y Kubota and SJ Lee and R Mahapatra and JJ O’Neill and R Poling and T Riehle and A Smith and CJ Stepaniak and J Urheim and S Ahmed,63,Physical Review D,3,031102,American Physical Society,Using a sample of 9.7× 10 6 B B meson pairs collected with the CLEO detector. we study B decays to the χ c 1 and χ c 2 charmonia states. which are reconstructed via their radiative decays to J/ψ. We first measure the branching fraction for inclusive χ c 1 production in B decays to be B (B→ χ c 1 X)=(4.14±0.31±0. 4 0)× 10− 3. where the first uncertainty is statistical and the second one is systematic. We derive the branching fractions for direct χ c 1 and χ c 2 production in B decays by subtracting the known contribution of the decay chain B→ ψ (2 S) X with ψ (2 S)→ χ c 1. 2 γ. We obtain B [B→ χ c 1 (direct) X]=(3.83±0.31±0. 4 0)× 10− 3. No statistically significant signal for χ c 2 production is observed in either case. Using the Feldman-Cousins approach. we determine the 95% confidence intervals to be [0. 2. 2. 0]× 10− 3 for B (B→ χ c 2 X).[0. 0. 1. 7]× 10− 3 for B [B→ χ c 2 (direct) X]. and [0.00. 0.44] for the ratio Γ [B→ χ c 2 …,True,8pK0oMgAAAAJ:8_tS2Vw13FcC,29,https://journals.aps.org/prd/abstract/10.1103/PhysRevD.63.031102,16919947368598529448,/scholar?cites=16919947368598529448,,https://arxiv.org/pdf/hep-ex/0009044,0,0,0
88470,Black success in local runoff elections,1990,Charles S Bullock III and A Brock Smith,52,The Journal of Politics,4,1205-1220,University of Texas Press,To determine if the majority vote requirement disadvantages blacks. a set of runoffs for county offices is analyzed. For the period 1970-1984. blacks who led in the initial primary but faced a white in the runoff were less successful than were white primary frontrunners who faced another white in the runoff. Since 1977. however. black primary frontrunners do about as well as whites. The magnitude of the difference in the share of the vote polled by the two leading candidates and facing an incumbent are variables related to a stronger performance by black candidates. Black plurality leaders more often win nominations in more affluent counties.,True,8pK0oMgAAAAJ:rbGdIwl2e6cC,29,https://www.journals.uchicago.edu/doi/abs/10.2307/2131688,2215483482973253477,/scholar?cites=2215483482973253477,,,0,0,0
88471,Synthesis. characterization and thermochemistry of synthetic Pb–As. Pb–Cu and Pb–Zn jarosites,2014,Ferenc Lázár Forray and AML Smith and A Navrotsky and Kathleen Wright and Karen A Hudson-Edwards and WE Dubbin,127,Geochimica et Cosmochimica Acta,,107-119,Pergamon,The enthalpy of formation from the elements of well characterized Pb–As. Pb–Cu. and Pb–Zn synthetic jarosites. corresponding to chemical formulas (H3O)0.68±0.03Pb0.32±0.002Fe2.86±0.14(SO4)1.69±0.08(AsO4)0.31±0.02(OH)5.59±0.28(H2O)0.41±0.02. (H3O)0.67±0.03Pb0.33±0.02Fe2.71±0.14Cu0.25±0.01(SO4)2±0.00(OH)5.96±0.30(H2O)0.04±0.002 and (H3O)0.57±0.03Pb0.43±0.02Fe2.70±0.14Zn0.21±0.01(SO4)2±0.00(OH)5.95±0.30(H2O)0.05±0.002. was measured by high temperature oxide melt solution calorimetry and gave ΔH°f = −3691.2 ± 8.6 kJ/mol. ΔH°f = −3653.6 ± 8.2 kJ/mol. and ΔH°f = −3669.4 ± 8.4 kJ/mol. respectively. Using estimated entropies. the standard Gibbs free energy of formation from elements at 298 K ΔG°f of the three compounds were calculated to be −3164.8 ± 9.1. −3131.4 ± 8.7. and −3153.6 ± 8.9 kJ/mol. respectively. Based on these free energies. their log Ksp values are −13 …,True,8pK0oMgAAAAJ:DBa1UEJaJKAC,28,https://www.sciencedirect.com/science/article/pii/S0016703713006157,11131779439826188956,/scholar?cites=11131779439826188956,,https://espace.curtin.edu.au/bitstream/handle/20.500.11937/6393/194580_194580.pdf?sequence=2&isAllowed=y,0,0,0
88472,Soa in manufacturing guidebook,2008,Alan Boyd and D Noller and P Peters and D Salkeld and T Thomasma and C Gifford and S Pike and A Smith,,"MESA International, IBM Corporation and Capgemini co-branded white paper",,,,,True,8pK0oMgAAAAJ:bEWYMUwI8FkC,28,http://scholar.google.com/scholar?cluster=2106248965662335256&hl=en&oi=scholarr,2106248965662335256,/scholar?cites=2106248965662335256,,,0,0,0
88473,Acoustic tracking of the dispersal of organic matter by scavenging fishes in the deep-sea,1998,MA Collins and Imants George Priede and S Addison and A Smith and Philip Michael Bagley,,,,181-186,Springer. Dordrecht,Movements of the scavenging deep-sea fish Coryphaenoides (Nematonurus) armatus were tracked at depths of 2500–4800 m on the Porcupine Abyssal Plain and Porcupine Seabight in the NE Atlantic using the Aberdeen University Deep Ocean Submersible (AUDOS). The AUDOS was deployed with mackerel bait and three coded acoustic transponders (CATs) covered in mackerel flesh and each enclosed in a nylon bag. Time lapse photographs allowed identification of fish ingesting CATs and estimation of fish arrival times and staying times at the bait. The radial swimming speeds recorded were much slower than inferred in previous studies using older designs of tracking equipment.It was found that C.(N.) armatus moved away from the bait source at an average rate of 1.05 m min-1 and separated from one another at an average rate of 1.32 m min-1 indicating solitary independent movement …,True,8pK0oMgAAAAJ:vYYylRVofzEC,28,https://link.springer.com/chapter/10.1007/978-94-011-5090-3_21,14069386991895393923,/scholar?cites=14069386991895393923,,,0,0,0
88474,Immunophenotypic study of lymphocyte predominance Hodgkin's disease,1991,PW Bishop and Martin Harris and AP Smith and KJ Elsam,18,Histopathology,1,19-24,Blackwell Publishing Ltd,An immunophenotypic study of 17 cases of diffuse lymphocyte predominance Hodgkin's disease and 20 cases of nodular lymphocyte predominance Hodgkin's disease. along with eight of mixed cellularity and five of nodular sclerosing Hodgkin's disease. is reported. The atypical cells in nodular lymphocyte predominance Hodgkin's disease showed only minor differences from the published consensus. However. the atypical cells in diffuse lymphocyte predominance Hodgkin's disease showed an immunophenotype which was commonly B‐cell positive (59%). but in a minority of cases (24%) or epithelial membrane antigen (12%) positive; none of the cases was Ber‐H2 positive. These results do not differ greatly from our findings in nodular lymphocyte predominance Hodgkin's disease. but do diverge from the published consensus for diffuse lymphocyte predominance Hodgkin's disease. The question as to whether …,True,8pK0oMgAAAAJ:n1qY4L4uFdgC,28,https://onlinelibrary.wiley.com/doi/abs/10.1111/j.1365-2559.1991.tb00809.x,16730713019871725420,/scholar?cites=16730713019871725420,,,0,0,0
88475,Growth of skipjack,1979,E Josse and JC Le Guen and R Kearney and A Lewis and A Smith and L Marec and PK Tomlinson,11,"South Pac. Comm., Occas. Pap",,83,,For more than twenty years fishery biologists have assiduously investigated the problem of growth in skipjack tuna. particularly in the Pacific. The. variou~ teams of tuna specialists. national and international. have'furnished more or less exhaustive-accounts of the numerous studies undertaken and results published on growth. Nowhere have we found an examination in depth of these results. an examination which has now become necessary with the reawakening of interest in the biological and ecological parameters in the models of production. The variety of growth rates estimated for skipjack. ranging from simple to double.-or even triple. certainly poses a problem of choice for students of population dynamics.,True,8pK0oMgAAAAJ:rzmi0EmCOGEC,28,https://core.ac.uk/download/pdf/39878388.pdf,11378736977423507045,/scholar?cites=11378736977423507045,,https://core.ac.uk/download/pdf/39878388.pdf,0,0,0
88476,State of the sulfur in oxidized wool,1937,Milton Harris and A Smith,18,J Res Natl Bur Stand,,623-628,,During treatment with oxidizing agents. the disulfide sulfur in wool appears to be changed to higher states of oxidation. The existence of oxidation derivatives of the disulfide compounds is indicated by the alkali-solubility determination. the lead acetate test. by reduction with hydrochloric acid-potassium iodide solutions. and by cystine analyses.The intermediate oxidation derivatives of cystine are unstable under the conditions necessary for protein hydrolysis. and at least one of them. cystine disulfoxide. is partially converted to cystine. The results indicate that the values obtained for the cystine content of oxidized wool may be expected to be higher than the actual cystine content since they represent the amount of cystine formed from the partially oxidized cystine compounds as well as from unoxidized cystine groups.,True,8pK0oMgAAAAJ:2TuIPqOg0e0C,28,https://nvlpubs.nist.gov/nistpubs/jres/18/jresv18n5p623_A1b.pdf,15925177103489645701,/scholar?cites=15925177103489645701,,https://nvlpubs.nist.gov/nistpubs/jres/18/jresv18n5p623_A1b.pdf,0,0,0
88477,Forecasting the future of cardiovascular disease in the United States: a policy statement from the American Heart Association,2018,EJ Benjamin and SS Virani and CW Callaway and AM Chamberlain and AR Chang and S Cheng and R Deo,137,Circulation,12,e67-e492,,,True,8pK0oMgAAAAJ:bzhzIcV5SW4C,27,http://scholar.google.com/scholar?cluster=17347205870285292278&hl=en&oi=scholarr,17347205870285292278,/scholar?cites=17347205870285292278,,,0,0,0
88478,Simultaneous Release of Fe and As during the Reductive Dissolution of Pb–As Jarosite by Shewanella putrefaciens CN32,2012,Christina M Smeaton and Gillian E Walshe and Adrian ML Smith and Karen A Hudson-Edwards and William E Dubbin and Kate Wright and Andrew M Beale and Brian J Fryer and Christopher G Weisener,46,Environmental science & technology,23,12823-12831,American Chemical Society,Jarosites are produced during metallurgical processing. on oxidized sulfide deposits. and in acid mine drainage environments. Despite the environmental relevance of jarosites. few studies have examined their biogeochemical stability. This study demonstrates the simultaneous reduction of structural Fe(III) and aqueous As(V) during the dissolution of synthetic Pb–As jarosite (PbFe3(SO4.AsO4)2(OH)6) by Shewanella putrefaciens using batch experiments under anaerobic circumneutral conditions. Fe(III) reduction occurred immediately in inoculated samples while As(V) reduction was observed after 72 h. XANES spectra showed As(III) (14.7%) in the solid phase at 168 h coincident with decreased aqueous As(V). At 336 h. XANES spectra and aqueous speciation analysis demonstrated 20.2% and 3.0% of total As was present as As(III) in the solid and aqueous phase. respectively. In contrast. 12.4% of total Fe was …,True,8pK0oMgAAAAJ:L1USKYWJimsC,27,https://pubs.acs.org/doi/abs/10.1021/es3021809,4610383677772024718,/scholar?cites=4610383677772024718,,https://www.academia.edu/download/39683420/Simultaneous_Release_of_Fe_and_As_during20151104-7970-fmg5d9.pdf,0,0,0
88479,Evaluation of camera trap sampling designs used to determine change in occupancy rate and abundance of feral cats,2010,Alan Robley and A Gormley and L Woodford and M Lindeman and B Whitehead and R Albert and M Bowd and A Smith,,,,,Arthur Rylah Institute for Environmental Research in partnership with Australian Government Department of the Environment. Water. Heritage and the Arts,Although many agencies and organisations commit resources to managing feral cats. there remains a high degree of uncertainty about our ability to accurately and precisely estimate the relative or absolute abundance of feral cats. or the kill rates obtained in control operations.In 2007 the Commonwealth Department of Environment. Water. Heritage and the Arts (DEWHA) commissioned the Arthur Rylah Institute for Environmental Research (ARIER) to undertake research to evaluate detection methods and sampling designs used to determine the abundance of feral cats (Felis catus) that have established wild populations in Australia. Stage one of the project. undertaken at Anglesea in Victoria in September 2007. investigated the detection probability of cage traps. leghold traps. a DNA sampling device. heat-in-motion activated digital cameras and sand plots (Robley et al. 2008). This required the capture of feral cats. fitting GPS data-logging collars. mapping their areas of activity and monitoring their encounter with the various devices. Digital cameras provided the most robust detection data for feral cats. Modelling of control efficacy determined that the probability of correctly concluding that a cat population had decreased was highest for the highest level of monitoring (49 cameras for 20 nights. set at one camera per 2 km2).,True,8pK0oMgAAAAJ:H_jBuBxbQIAC,27,https://www.researchgate.net/profile/Alan_Robley/publication/275155842_Evaluation_of_camera_trap_sampling_designs_used_to_determine_change_in_occupancy_rate_and_abundance_of_feral_cats/links/55dbb9b508ae9d6594936883/Evaluation-of-camera-trap-sampling-designs-used-to-determine-change-in-occupancy-rate-and-abundance-of-feral-cats.pdf,9670327622172929149,/scholar?cites=9670327622172929149,,https://www.researchgate.net/profile/Alan_Robley/publication/275155842_Evaluation_of_camera_trap_sampling_designs_used_to_determine_change_in_occupancy_rate_and_abundance_of_feral_cats/links/55dbb9b508ae9d6594936883/Evaluation-of-camera-trap-sampling-designs-used-to-determine-change-in-occupancy-rate-and-abundance-of-feral-cats.pdf,0,0,0
88480,Practical use of anticoagulants,1989,Robert M Lindsay and Anne M Smith,,,,246-275,Springer. Dordrecht,To use anticoagulants optimally during dialysis it is necessary to understand hemostasis. how to evaluate it and how therapeutic agents interfere with it. Knowledge of the hemostatic defects found in uremia and the influence of dialysis upon these is necessary. as is an understanding of foreign surface induced coagulation. This chapter presents such information before providing a practical guide to anticoagulant use.,True,8pK0oMgAAAAJ:eGYfIraVYiQC,27,https://link.springer.com/chapter/10.1007/978-94-009-1087-4_11,10583858508710713846,/scholar?cites=10583858508710713846,,,0,0,0
88481,The effect of isotonic amino acid infusions on serum proteins and muscle breakdown following surgery,1983,OJ Garden and A Smith and NWS Harris and A Shenkin and AJW Sim and DC Carter,70,British Journal of Surgery,2,79-82,John Wiley & Sons. Ltd.,Twenty patients undergoing major surgical procedures received constant infusion (2 l/day) of either 3·5 per cent amino acid (AA) or 5 per cent dextrose (D5W) solutions in addition to other fluid requirements for 4 postoperative days. Ketosis was evident in A A patients as a mean daily β‐hydroxy butyrate excretion of 2·16 ± 1·39 mmol and respiratory quotient of 0·708 ± 0·013 compared with 0·28 ± 0·45 mmol/day and 0·754 ± 0·015 respectively in the D5W group. The serum total protein and albumin concentrations (but not those of transferrin and prealbumin) were significantly higher in the A A than the D5W group on day 4. However. the mean fluid balance for days 3 and 4 was significantly less positive in AA patients. The mean daily nitrogen balance of −6·6 ± 7·7 gN/day in A A patients and −9·5 ± 5·8 gN/day in D5W patients was not significantly different. Mean daily 3‐methyl histidine excretion (38·2 ± 12·3 μmol …,True,8pK0oMgAAAAJ:J6qkoyn5ZssC,27,https://bjssjournals.onlinelibrary.wiley.com/doi/abs/10.1002/bjs.1800700208,16570353922362880188,/scholar?cites=16570353922362880188,,,0,0,0
