,title,pub_year,author,volume,journal,number,pages,publisher,abstract,filled,author_pub_id,num_citations,pub_url,cites_id,citedby_url,gsrank,author_id,eprint_url,got_citations,got_author_ids,author_ids
1265350,Comparison of linear and point focus collectors in solar power plants,2014,F Rinaldi and Marco Binotti and Andrea Giostri and Giampaolo Manzolini,49,Energy Procedia,,1491-1500,Elsevier,Solar tower based plants are seen as a promising technology to reduce the cost of electricity from solar radiation. This paper assesses the design and overall yearly performances of two different solar tower concepts featuring two commercial plants running in Spain. The first plant investigated is based on Direct Steam Generation and a cavity receiver (PS-10 type). The second plant considers an external cylindrical receiver with molten salts as heat transfer fluid and storage system (Gemasolar type). About the optical assessment performed with DELSOL3. a calibration of heliostat aim points was performed to match available flux maps on the receiver. Moving to results. the PS-10 type has higher optical performances both nominal design and yearly average. This is due both to the field size and orientation which guarantee a higher efficiency and to the receiver concept itself. About power production. the molten salts …,True,VOYih0IAAAAJ:fPk4N6BV_jEC,46,https://www.sciencedirect.com/science/article/pii/S1876610214006122,13200918538503640681,/scholar?cites=13200918538503640681,,,https://www.sciencedirect.com/science/article/pii/S1876610214006122/pdf?md5=58c522db9ad9df2c7d8062c9fb5539c8&pid=1-s2.0-S1876610214006122-main.pdf,0,0,0
1265351,Low methanol crossover and high efficiency direct methanol fuel cell: the influence of diffusion layers,2011,Andrea Casalegno and C Santoro and Fabio Rinaldi and Renzo Marchesi,196,Journal of Power Sources,5,2669-2675,Elsevier,This experimental work aims to investigate the possibility to reduce methanol crossover in DMFC modifying diffusion layer characteristics. Improvements in crossover measurement are firstly proposed. permitting to conclude that in the investigated conditions carbon dioxide flow through the membrane can be neglected. The experimental results evidence that introducing appropriate anode and cathode microporous layers determines: a strong reduction in methanol crossover. approximately 45% at low current density; a considerable increment of efficiency; a moderate decrease of power density. The complete experimental analysis demonstrates that methanol transport in both liquid and vapour phases can be controlled modifying properly diffusion layer characteristics in order to increase DMFC efficiency.,True,VOYih0IAAAAJ:3fE2CSJIrl8C,42,https://www.sciencedirect.com/science/article/pii/S0378775310019567,2018069769949553767,/scholar?cites=2018069769949553767,,,,0,0,0
1265352,Design of an innovative enthalpy wheel based humidification system for polymer electrolyte fuel cell,2011,Andrea Casalegno and Stefano De Antonellis and L Colombo and Fabio Rinaldi,36,International Journal of Hydrogen Energy,8,5000-5009,Pergamon,Water management plays a crucial role to ensure high performance and to limit degradation of PEFC systems. Thus. a reliable and accurate humidification system is necessary. The most common types. especially membrane humidifiers. are characterized by large pressure drop. affecting compressor power consumption. and make use of special expensive materials. To overcome these problems. many current researches deal with modeling of the heat and mass transfer processes occurring in such humidifiers. in order to find the best compromise between performance and cost. Conversely. in this work a different solution to the humidification requirement is proposed. An innovative low cost and low pressure drop humidification system based on a properly designed enthalpy wheel is presented and discussed. System design and performance evaluation are reported in both nominal and off-design operating …,True,VOYih0IAAAAJ:KlAtU1dfN6UC,38,https://www.sciencedirect.com/science/article/pii/S036031991100022X,5600987873615155780,/scholar?cites=5600987873615155780,,,,0,0,0
1265353,Process modeling of a reversible solid oxide cell (r-SOC) energy storage system utilizing commercially available SOC reactor,2017,Pegah Mottaghizadeh and Srikanth Santhanama and K. Marc P. Heddrich and Andreas Friedrich and Fabio Rinaldi,142,Energy conversion and management,,477-493,Elsevier,The increase of intermittent renewable energy contribution in power grids has urged us to seek means for temporal decoupling of electricity production and consumption. A reversible solid oxide cell (r-SOC) enables storage of surplus electricity through electrochemical reactions when it is in electrolysis mode. The reserved energy in form of chemical compounds is then converted to electricity when the cell operates as a fuel cell. A process system model was implemented using Aspen Plus® V8.8 based on a commercially available r-SOC reactor experimentally characterized at DLR. In this study a complete self-sustaining system configuration is designed by optimal thermal integration and balance of plant. Under reference conditions a round trip efficiency of 54.3% was achieved. Generated heat in fuel cell mode is exploited by latent heat storage tanks to enable endothermic operation of reactor in its electrolysis …,True,VOYih0IAAAAJ:BqipwSGYUEgC,35,https://www.sciencedirect.com/science/article/pii/S0196890417302121,5217739390814259069,/scholar?cites=5217739390814259069,,,https://re.public.polimi.it/bitstream/11311/1027469/1/14-031-17%20CorrectedProof_ECM_9044%20%282%29.pdf,0,0,0
1265354,Long-term economic analysis and optimization of an HT-PEM fuel cell based micro combined heat and power plant,2016,Alireza Haghighat Mamaghani and Behzad Najafi and Andrea Casalegno and Fabio Rinaldi,99,Applied Thermal Engineering,,1201-1211,Pergamon,Multi-objective optimization method using genetic algorithm is employed in order to optimize design and operating parameters of a high temperature proton exchange membrane (HT-PEM) fuel cell based combined heat and power system. Net electrical efficiency of the plant. indicating the system's performance (to be maximized) and the total capital cost (to be minimized) are considered as optimization objectives. Current density (indicating the stack size). steam to carbon ratio. burner outlet temperature and auxiliary to process fuel ratio have been chosen as design parameters. Two different multi-objective optimization approaches have been utilized: steady state (without degradation) and long-term optimization while considering the degradation in fuel cell stack and the fuel processor. The results of the optimization procedures are Pareto frontiers which are a set of optimal points each of which is a trade-off …,True,VOYih0IAAAAJ:bEWYMUwI8FkC,35,https://www.sciencedirect.com/science/article/pii/S1359431116301545,3334281584499026847,/scholar?cites=3334281584499026847,,,,0,0,0
1265355,Optimization of an HT-PEM fuel cell based residential micro combined heat and power system: A multi-objective approach,2018,Alireza Haghighat Mamaghani and Behzad Najafi and Andrea Casalegno and Fabio Rinaldi,180,Journal of Cleaner Production,,126-138,Elsevier,This article presents multi-objective optimization of an HT-PEM fuel cell based micro CHP system under steady-state operation by employing the mathematical model of the plant previously developed by our group. Different optimization procedures have been carried out to find the optimal points while considering two sets of objective functions: I) thermal power generation and net electrical output and II) net electrical efficiency and thermal efficiency. In the first part of the work. optimization has been performed at full load operation with electrical and thermal generation as objectives. The obtained Pareto frontier shows the capability of the system to cater a broad range of electrical demand (21.0 kW-29.4 kW) while offering the maximum achievable thermal generation. In the next step. in order to find the optimal operating conditions of the system while addressing specific thermal and electrical load profiles. a series of …,True,VOYih0IAAAAJ:NaGl4SEjCO4C,30,https://www.sciencedirect.com/science/article/pii/S095965261830146X,8340422251127914284,/scholar?cites=8340422251127914284,,,,0,0,0
1265356,Efficiency analysis of independent and centralized heating systems for residential buildings in Northern Italy,2011,Matteo Zago and Andrea Casalegno and Renzo Marchesi and Fabio Rinaldi,4,Energies,11,2115-2131,Molecular Diversity Preservation International,The primary energy consumption in residential buildings is determined by the envelope thermal characteristics. air change. outside climatic data. users’ behaviour and the adopted heating system and its control. The new Italian regulations strongly suggest the installation of centralized boilers in renovated buildings with more than four apartments. This work aims to investigate the differences in primary energy consumption and efficiency among several independent and centralized heating systems installed in Northern Italy. The analysis is carried out through the following approach: firstly building heating loads are evaluated using the software TRNSYS® and. then. heating system performances are estimated through a simplified model based on the European Standard EN 15316. Several heating systems have been analyzed. evaluating: independent and centralized configurations. condensing and traditional boilers. radiator and radiant floor emitters and solar plant integration. The heating systems are applied to four buildings dating back to 2010. 2006. 1960s and 1930s. All the combinations of heating systems and buildings are analyzed in detail. evaluating efficiency and primary energy consumption. In most of the cases the choice between centralized and independent heating systems has minor effects on primary energy consumption. less than 3%: the introduction of condensing technology and the integration with solar heating plant can reduce energy consumption by 11% and 29%. respectively. View Full-Text,True,VOYih0IAAAAJ:Zph67rFs4hoC,27,https://www.mdpi.com/1996-1073/4/11/2115,16377731218441040247,/scholar?cites=16377731218441040247,,,https://www.mdpi.com/1996-1073/4/11/2115/htm,0,0,0
1265357,Temperature measurement in WTE boilers using suction pyrometers,2013,Fabio Rinaldi and Behzad Najafi,13,Sensors,11,15633-15655,Multidisciplinary Digital Publishing Institute,The temperature of the flue-gas in the post combustion zone of a waste to energy (WTE) plant has to be maintained within a fairly narrow range of values. the minimum of which is prescribed by the European Waste Directive 2000/76/CE. whereas the maximum value must be such as to ensure the preservation of the materials and the energy efficiency of the plant. A high degree of accuracy in measuring and controlling the aforementioned temperature is therefore required. In almost the totality of WTE plants this measurement process is carried out by using practical industrial thermometers. such as bare thermocouples and infrared radiation (IR) pyrometers. even if affected by different physical contributions which can make the gas temperature measurements incorrect. The objective of this paper is to analyze errors and uncertainties that can arise when using a bare thermocouple or an IR pyrometer in a WTE plant and to provide a method for the in situ calibration of these industrial sensors through the use of suction pyrometers. The paper describes principle of operation. design. and uncertainty contributions of suction pyrometers. it also provides the best estimation of the flue-gas temperature in the post combustion zone of a WTE plant and the estimation of its expanded uncertainty. View Full-Text,True,VOYih0IAAAAJ:_kc_bZDykSQC,25,https://www.mdpi.com/1424-8220/13/11/15633,7873393557485887737,/scholar?cites=7873393557485887737,,,https://www.mdpi.com/1424-8220/13/11/15633/pdf,0,0,0
1265358,Fuel partialization and power/heat shifting strategies applied to a 30 kWel high temperature PEM fuel cell based residential micro cogeneration plant,2015,Behzad Najafi and Alireza Haghighat Mamaghani and Fabio Rinaldi and Andrea Casalegno,40,International Journal of Hydrogen Energy,41,14224-14234,Pergamon,The present study is dedicated to the investigation of applying different strategies on an HT-PEM fuel cell based micro cogeneration plant in order to evaluate the capability of this system to cope with intermittent electrical and thermal load profiles. The performance of the system under fuel partialization strategy is first studied and the thermal and electrical efficiencies of the plant at different partial loads are determined. It was found that due to partialization of the fuel down to 50% of the initial value. the electrical efficiency increases from 29.3% to 33.6% while the thermal efficiency decreases from 53.0% to 47.6%. Power to heat shifting strategy. as a faster approach. is then employed in which. by altering the anodic stoichiometric ratio. the electrical generation is decreased while higher thermal power is produced. The results showed that this partialization method leads to harsh drop. around 13%. in the electrical …,True,VOYih0IAAAAJ:r0BpntZqJG4C,24,https://www.sciencedirect.com/science/article/pii/S0360319915022351,15246906410018781680,/scholar?cites=15246906410018781680,,,https://re.public.polimi.it/retrieve/handle/11311/978963/451043/Fuel%20partialization%20and%20power-heat%20shifting%20strategies_11311-978963_Rinaldi.pdf,0,0,0
1265359,Mathematical modeling and multi-objective optimization of a mini-channel heat exchanger via genetic algorithm,2013,Tommaso Selleri and Behzad Najafi and Fabio Rinaldi and Guido Colombo,5,Journal of Thermal Science and Engineering Applications,3,,American Society of Mechanical Engineers Digital Collection,In the present paper a mathematical model for a mini-channel heat exchanger is proposed. Multiobjective optimization using genetic algorithm is performed in the next step in order to obtain a set of geometrical design parameters. leading to minimum pressure drops and maximum overall heat transfer coefficient. Multiobjective optimization procedure provides a set of optimal solutions. called Pareto front. each of which is a trade-off between the objective functions and can be freely selected by the user according to the specifications of the project. A sensitivity analysis is also carried out to study the effects of different geometrical parameters on the considered functions. The whole system has been modeled based on advanced experimental correlations in MATLAB environment using a modular approach.[DOI: 10.1115/1.4023893],True,VOYih0IAAAAJ:4TOpqqG69KYC,24,https://asmedigitalcollection.asme.org/thermalscienceapplication/article-abstract/5/3/031013/379236,17515716146875684067,/scholar?cites=17515716146875684067,,,,0,0,0
1265360,Challenges in bioenergy production from sugarcane mills in developing countries: a case study,2014,Guido Colombo and William Ocampo-Duque and Fabio Rinaldi,7,Energies,9,5874-5898,Multidisciplinary Digital Publishing Institute,Worldwide energy policies are moving towards a reduction of fossil fuels’ share in the energy mix and to invest in renewable and green energy sources. Biomass is one of these. and it represents. in the form of sugarcane. a strategic source in Colombia. especially in the Valle del Cauca. In this region. the sugarcane industry is able to convert the energy content of the cane into different energy products. such as ethanol. electricity. and high-pressure steam. which are cogenerated via bagasse combustion. In this work. the case of a sucrose and ethanol production plant. which mills ten thousand tons of sugarcane per day. is considered. A tailor-made computational model was developed to assess the energy and material process balances in order to estimate the effect of different operating conditions on cogeneration boilers and turbines. and to optimize the overall process efficiency. The current situation was modeled with good precision from the developed model. Likewise. the concept of “Renewable Efficiency” was introduced to explain the degree of green power. which a process plant is able to produce. Consequently. new innovative solutions and process layouts were proposed in order to increase their renewable efficiency. With the new configurations. a convenient energy surplus of up to 33 MW can be reached. which could be sold in the national electricity grid. representing long-term interesting economic benefits for the company. View Full-Text,True,VOYih0IAAAAJ:mVmsd5A6BfQC,17,https://www.mdpi.com/1996-1073/7/9/5874,16229595444114751933,/scholar?cites=16229595444114751933,,,https://www.mdpi.com/1996-1073/7/9/5874/pdf,0,0,0
1265361,Data analytics for energy disaggregation: methods and applications,2018,Behzad Najafi and Sadaf Moaveninejad and Fabio Rinaldi,,,,377-408,Elsevier,Energy disaggregation. or nonintrusive load monitoring (NILM). aims at estimating the power demand of individual appliances from a household's aggregate electricity consumption. Due to the notable rise in the number of installed smart meters and owing to the numerous advantages of this approach over intrusive methods. NILM has received growing attention in the recent years. In this chapter. after reviewing different categories of household appliances. the state-of-the-art load signatures. including both macroscopic and microscopic features. are introduced. Next. commonly used supervised and unsupervised disaggregation algorithms. which are employed to classify the appliances based on the extracted features. are discussed. Publically accessible datasets and open-source tools. which have been released in the recent years to assist the NILM research and to facilitate the comparison of …,True,VOYih0IAAAAJ:rO6llkc54NcC,16,https://www.sciencedirect.com/science/article/pii/B9780128119686000176,8564243959659199910,/scholar?cites=8564243959659199910,,,https://www.researchgate.net/profile/Behzad_Najafi2/publication/322184674_Data_Analytics_for_Energy_Disaggregation_Methods_and_Applications/links/5bd2d147299bf1124fa39c0a/Data-Analytics-for-Energy-Disaggregation-Methods-and-Applications.pdf,0,0,0
1265362,Machine learning-based short-term prediction of air-conditioning load through smart meter analytics,2017,Manoj Manivannan and Behzad Najafi and Fabio Rinaldi,10,Energies,11,1905,Multidisciplinary Digital Publishing Institute,The present paper is focused on short-term prediction of air-conditioning (AC) load of residential buildings using the data obtained from a conventional smart meter. The AC load. at each time step. is separated from smart meter’s aggregate consumption through energy disaggregation methodology. The obtained air-conditioning load and the corresponding historical weather data are then employed as input features for the prediction procedure. In the prediction step. different machine learning algorithms. including Artificial Neural Networks. Support Vector Machines. and Random Forests. are used in order to conduct hour-ahead and day-ahead predictions. The predictions obtained using Random Forests have been demonstrated to be the most accurate ones leading to hour-ahead and day-ahead prediction with R 2 scores of 87.3% and 83.2%. respectively. The main advantage of the present methodology is separating the AC consumption from the consumptions of other residential appliances. which can then be predicted employing short-term weather forecasts. The other devices’ consumptions are largely dependent upon the occupant’s behaviour and are thus more difficult to predict. Therefore. the harsh alterations in the consumption of AC equipment. due to variations in the weather conditions. can be predicted with a higher accuracy; which in turn enhances the overall load prediction accuracy. View Full-Text,True,VOYih0IAAAAJ:ns9cj8rnVeAC,15,https://www.mdpi.com/1996-1073/10/11/1905,7984720973781704499,/scholar?cites=7984720973781704499,,,https://www.mdpi.com/1996-1073/10/11/1905/pdf,0,0,0
1265363,Systematic experimental analysis of a direct methanol fuel cell,2007,Andrea Casalegno and Renzo Marchesi and Fabio Rinaldi,4,,4,418-424,,Different studies are carried out to compare the performances of different fuel cell constructive materials and operating conditions. In this work. a methodology for the characterization of DMFC experimental results in term of uncertainty and repeatability and for a systematic analysis of operating condition influence on performance is presented. The measurement system (composed of calibrated instruments) and experimental and data elaboration procedures are described. Experimental results. characterized by uncertainty and repeatability. are discussed for different operating conditions: fuel cell temperature. anode flow rate. and methanol concentration. The influence of operating condition history on performance is observed. It arises also from accumulation. both of methanol and carbon dioxide at the anode side; consequently. the operating condition history has to be considered in evaluating direct methanol fuel …,True,VOYih0IAAAAJ:kNdYIx-mwKoC,15,https://asmedigitalcollection.asme.org/electrochemical/article-abstract/4/4/418/451173,14575692286539833223,/scholar?cites=14575692286539833223,,,,0,0,0
1265364,Costi di produzione di energia elettrica da fonti rinnovabili,2010,R Marchesi and P Bombarda and A Casalegno and L Colombo and A Rota,,"Report ordered by aeeg to politecnico di milano-dipartimento di energia, Politecnico di Milano-Dipartimento di Energia",,,,,True,VOYih0IAAAAJ:zA6iFVUQeVQC,13,http://scholar.google.com/scholar?cluster=4050597052620596422&hl=en&oi=scholarr,4050597052620596422,/scholar?cites=4050597052620596422,,,,0,0,0
1265365,Economic growth and energy consumption revisited—evidence from linear and nonlinear Granger causality,2008,Song Zan Chiou-Wei and Ching-Fu Chen and Zhen Zhu,30,Energy Economics,6,3063-3076,North-Holland,The relationship between energy consumption and economic growth is considered as an imperative issue in energy economics. Previous studies have ignored the nonlinear behavior which could be caused by structural breaks. In this study. both linear and nonlinear Granger causality tests are applied to examine the causal relationship between energy consumption and economic growth for a sample of Asian newly industrialized countries as well as the U.S. This study finds evidence supporting a neutrality hypothesis for the United States. Thailand. and South Korea. However. empirical evidence on Philippines and Singapore reveals a unidirectional causality running from economic growth to energy consumption while energy consumption may have affected economic growth for Taiwan. Hong Kong. Malaysia and Indonesia. Policy implications are also discussed.,True,9yJghFYAAAAJ:u5HHmVD_uO8C,458,https://www.sciencedirect.com/science/article/pii/S0140988308000406,17589794752500268403,/scholar?cites=17589794752500268403,,,http://research.ncku.edu.tw/re/articles/e../20100305/all.pdf,0,0,0
1265366,Natural gas prices. LNG transport costs. and the dynamics of LNG imports,2011,Don Maxwell and Zhen Zhu,33,Energy Economics,2,217-226,North-Holland,According to the U.S. Energy Information Administration. LNG is projected to become a much larger share of U.S. natural gas consumption. rising from current levels of around 2.5% of total natural gas consumption to 12.4% by 2030. Because natural gas and LNG are substitutes. natural gas prices are expected to be an important determinant of LNG imports. Furthermore. an increasing share of LNG is traded under short-term contracts with spot shipments being diverted to markets offering the highest returns (netbacks). Relative natural gas prices as well as LNG transportation costs are important determinants of LNG netbacks. This paper examines the empirical relationship between U.S. LNG imports. the Henry Hub price of natural gas relative to U.K. and Asia gas prices. and a proxy for LNG transportation costs using monthly data from 1997 to 2007. Granger causality tests. error variance decomposition. and …,True,9yJghFYAAAAJ:Y0pCki6q_DkC,112,https://www.sciencedirect.com/science/article/pii/S0140988310001088,13549197401358149497,/scholar?cites=13549197401358149497,,,http://citeseerx.ist.psu.edu/viewdoc/download?doi=10.1.1.911.4846&rep=rep1&type=pdf,0,0,0
1265367,Natural gas prices and the gas storage report: Public news and volatility in energy futures markets,2004,Scott C Linn and Zhen Zhu,24,"Journal of Futures Markets: Futures, Options, and Other Derivative Products",3,283-313,Wiley Subscription Services. Inc.. A Wiley Company,This study examines the short‐term volatility of natural gas prices through an examination of the intraday prices of the nearby natural gas futures contract traded on the New York Mercantile Exchange. The influence on volatility of what many regard as a key element of the information set influencing the natural gas market is investigated. Specifically. we examine the impact on natural gas futures price volatility of the Weekly American Gas Storage Survey report compiled and issued by the American Gas Association during the period January 1. 1999 through May 3. 2002 and the subsequent weekly report compiled and issued by the U.S. Energy Information Administration after May 6. 2002. We find that the weekly gas storage report announcement was responsible for considerable volatility at the time of its release and that volatility up to 30 minutes following the announcement was also higher than normal. Aside from …,True,9yJghFYAAAAJ:9yKSN-GCB0IC,97,https://onlinelibrary.wiley.com/doi/abs/10.1002/fut.10115,15892131032296385194,/scholar?cites=15892131032296385194,,,https://www.ou.edu/dam/price/Management/Energy%20Institute/docs/Linn%20and%20Zhu%20JFM%202004.pdf,0,0,0
