,title,pub_year,author,volume,journal,number,pages,publisher,abstract,filled,author_pub_id,num_citations,pub_url,cites_id,citedby_url,gsrank,author_id,eprint_url,got_citations,got_author_ids,author_ids
1265464,Three- and four--thick  layers with high critical-current densities on flexible metallic substrates by the  process,2006,Vyacheslav F Solovyov and Harold J Wiesmann and Qiang Li and David O Welch and Masaki Suenaga,99,Journal of applied physics,1,013902,American Institute of Physics,We report on the synthesis and performance of 3- and 4‐μm-thick YBa2Cu3O7 films on buffered metallic tapes. The precursor films were deposited by vacuum coevaporation of BaF2. Y. and Cu on the substrates and converted to YBa2Cu3O7 by the BaF2 ex situ process at reduced processing gas pressures. The best value of critical-current density Jc for these films was ∼3.8×103A∕mm2 at 77K and in 1T external magnetic field perpendicular to the film plane. Also. estimated critical-current densities per width of tape Jcw at zero magnetic field were ∼60 and ∼80A∕mm for 3- and 4‐μm-thick films. respectively. In order to achieve these high-Jc values. the films were processed at high growth rates (∼0.7nm∕s) and the oxygen partial pressure p(O2) was varied to minimize the growth of the “granular” c axis and randomly oriented YBa2Cu3O7 grains. A simple thermodynamic argument is also given to describe the …,True,fJbr3mkAAAAJ:W7OEmFMy1HYC,25,https://aip.scitation.org/doi/abs/10.1063/1.2150590,3451222932463726025,/scholar?cites=3451222932463726025,,,https://www.researchgate.net/profile/Harold_Wiesmann/publication/252396131_Three-_and_four-mm-thick_YBa2Cu3O7_layers_with_high_critical-current_densities_on_flexible_metallic_substrates_by_the_BaF2_process/links/00b4952c5b80e94846000000/Three-and-four-mm-thick-YBa2Cu3O7-layers-with-high-critical-current-densities-on-flexible-metallic-substrates-by-the-BaF2-process.pdf,0,0,0
1265465,Nanoscale abnormal grain growth in (001) epitaxial ceria,2009,Vyacheslav F Solovyov and Katherine Develos-Bagarinao and Dmytro Nykypanchuk,80,Physical Review B,10,104102,American Physical Society,X-ray reciprocal-space mapping and atomic force microscopy (AFM) are used to study kinetics and mechanisms of lateral grain growth in epitaxial (001) ceria (CeO 2) deposited by pulsed laser deposition on (001) yttria-stabilized zirconia (YSZ) and (1 2 ̱ 10)(r-cut) sapphire. Rate and character of the grain growth during postannealing at 1050 C are found to be strongly dependent on the type of the epitaxial substrate. Films deposited on YSZ exhibit signatures of normal grain growth. which stagnated after the lateral grain size reaches 40 nm. consistent with the grain-boundary pinning by the thermal grooving. In contrast. when r-cut sapphire substrate was used. abnormal (secondary) grain growth is observed. A small population of grains grow to well over 100 nm consuming smaller.< 10 nm. grains. thus forming well-defined> 100 nm large (001) terminations and rendering the sample single-crystalline quality. The …,True,fJbr3mkAAAAJ:_FxGoFyzp5QC,23,https://journals.aps.org/prb/abstract/10.1103/PhysRevB.80.104102,815242327837474533,/scholar?cites=815242327837474533,,,https://www.researchgate.net/profile/Vyacheslav_Solovyov/publication/255811446_Nanoscale_Abnormal_Grain_Growth_in_001_Epitaxial_Ceria/links/5693db8608ae425c68960c30/Nanoscale-Abnormal-Grain-Growth-in-001-Epitaxial-Ceria.pdf,0,0,0
1265466,Influence of defect-induced biaxial strain on flux pinning in thick YBa 2 Cu 3 O 7 layers,2012,Vyacheslav F Solovyov and Qiang Li and Weidong Si and Boris Maiorov and Timothy J Haugan and JL MacManus-Driscoll and H Yao and QX Jia and Eliot D Specht,86,Physical Review B,9,094511,American Physical Society,This work reports a detailed structural study by synchrotron x-ray diffraction of several sets of thick YBa 2 Cu 3 O 7 layers. The samples represent recent advances in flux-pinning design. containing various concentrations of artificial pinning centers:(i) BaZrO 3 nanorods.(ii) BaZrO 3 nanoparticles. and (iii) Y 2 O 3 nanoparticles. A statistical analysis was performed in order to separate the effects of defect-induced and intrinsic pinning. We report a statistically significant correlation between the orthorhombic distortion of the YBCO matrix and the pinning strength. Our result implies that the in-plane ordering of oxygen ions in the chain positions accounts for approximately 60% of the pinning force. The strain-induced pinning mechanism analysis. based on the Eshelby model of elastically strained composites. predicts that small YBCO grain size is a critical component of a strong pinning architecture that can enable critical …,True,fJbr3mkAAAAJ:KlAtU1dfN6UC,21,https://journals.aps.org/prb/abstract/10.1103/PhysRevB.86.094511,17232676854247060840,/scholar?cites=17232676854247060840,,,https://www.researchgate.net/profile/Eliot_Specht/publication/235511482_Influence_of_defect-induced_biaxial_strain_on_flux_pinning_in_thick_YBa_2_Cu_3_O_7_layers/links/02e7e5346a542df240000000/Influence-of-defect-induced-biaxial-strain-on-flux-pinning-in-thick-YBa-2-Cu-3-O-7-layers.pdf,0,0,0
1265467,Synthesis of YBa2CU3O7 using sub-atmospheric processing,2004,Harold Wiesmann and Vyacheslav Solovyov,,,,,,The present invention is a method of forming thick films of crystalline YBa 2 Cu 3 O 7 that includes forming a precursor film comprising barium fluoride (BaF 2). yttrium (Y) and copper (Cu). The precursor film is heat-treated at a temperature above 500 C. in the presence of oxygen. nitrogen and water vapor at sub-atmospheric pressure to form a crystalline structure. The crystalline structure is then annealed at about 500 C. in the presence of oxygen to form the crystalline YBa 2 Cu 3 O 7 film. The YBa 2 Cu 3 O 7 film formed by this method has a resistivity of from about 100 to about 600 μOhm-cm at room temperature and a critical current density measured at 77 K in a magnetic field of 1 Tesla of about 1.0× 10 5 Ampere per square centimeter (0.1 MA/cm 2) or greater.,True,fJbr3mkAAAAJ:hqOjcs7Dif8C,21,https://patents.google.com/patent/US6794339B2/en,2024503551425138527,/scholar?cites=2024503551425138527,,,https://patentimages.storage.googleapis.com/54/42/cf/2f3361be0420a9/US6794339.pdf,0,0,0
1265468,Strong influence of the YBa2Cu3O7 grain size on critical current densities of thick YBa2Cu3O7 layers made by a metal–organic deposition process,2008,Vyacheslav F Solovyov and Qiang Li and Harold Wiesmann and Peter Oleynikov and Yimei Zhu,21,Superconductor Science and Technology,12,125013,IOP Publishing,We correlate the critical current performance of thick film second-generation YBa 2 Cu 3 O 7 (YBCO) coated conductors. made by metal–organic deposition. with specimen grain size. The transport critical current densities. J c T. of these conductors were observed to be inversely proportional to YBCO grain size in the 5–40 µm size range. Analysis of magnetic hysteresis curves of the conductors and transmission electron microscopy data from a large YBCO grain revealed that the reduced J c T in tapes with large YBCO grain size is due to the accumulation of secondary phase precipitates within the grains near the periphery of. and in. the grain boundaries. Grain size is determined to be one of the important factors in determining J c T of YBCO coated conductors made by the metal–organic processes.,True,fJbr3mkAAAAJ:ufrVoPGSRksC,20,https://iopscience.iop.org/article/10.1088/0953-2048/21/12/125013/meta,17239958401722822804,/scholar?cites=17239958401722822804,,,https://www.researchgate.net/profile/Vyacheslav_Solovyov/publication/231013113_Strong_influence_of_the_YBa2Cu3O7_grain_size_on_critical_current_densities_of_thick_YBa2Cu3O7_layers_made_by_a_metal-organic_deposition_process/links/5693dcba08ae820ff0728df5.pdf,0,0,0
1265469,The effects of carbon electrode surface properties on bacteria attachment and start up time of microbial fuel cells,2014,Carlo Santoro and M Guilizzoni and JP Correa Baena and U Pasaogullari and Andrea Casalegno and B Li and S Babanova and K Artyushkova and P Atanassov,67,Carbon,,128-139,Pergamon,Surface roughness. porosity and contact angles of different carbon paper materials (TORAY paper with PTFE from 0% to 60% of and SGL paper with 0% and 20% of PTFE) suitable as electrodes in microbial fuel cells were investigated. The changes of contact angle between dry and clean anode surfaces and the ones after exposure to wastewater were measured using different liquids (pure water and sodium acetate solutions). The results showed that bacterial attachment to the carbon papers caused a significant decrease in the contact angle. shifting the surface property from highly hydrophobic to slightly hydrophobic or even hydrophilic. The quantity of biofilm attached on the anode surface decreased with the increase in PTFE content. Positive correlation between dry biomass content and the amount of pores at the small scale (5–10 μm) was observed. The start up time of MFCs was shortened by using the …,True,o-bXXSUAAAAJ:L8Ckcad2t8MC,102,https://www.sciencedirect.com/science/article/pii/S0008622313009251,18070496447315840902,/scholar?cites=18070496447315840902,,,https://www.academia.edu/download/32834279/carbon__attachment_2013.pdf,0,0,0
1265470,Degradation in phosphoric acid doped polymer fuel cells: A 6000 h parametric investigation,2013,Samuele Galbiati and Andrea Baricci and Andrea Casalegno and Renzo Marchesi,38,International Journal of Hydrogen Energy,15,6469-6480,Pergamon,This paper reports an experimental study of the degradation of single PBI-based high temperature MEAs doped with phosphoric acid. The study is carried out by operating the single MEAs for long periods in steady state. the degradation is quantified considering the voltage decay rate. Besides the most common operating condition suggested by the MEAs producer (T= 160° C. i= 0.2 A cm− 2. λ H 2= 1.2. λ air= 2). the study also investigates higher operating temperature (T= 180° C). higher current density (i= 0.4 A cm− 2) and double air flow rate (λ air= 4). A temperature of 180° C accelerates the degradation of the MEA which increases from around 8 μV h− 1 up to around 19 μV h− 1. On the opposite side. operating the MEA at i= 0.4 A cm− 2 reduces the voltage degradation rate down to 4 μV h− 1 and increases the power output making this condition particularly interesting. EIS. CV and LSV are used to clarify the …,True,o-bXXSUAAAAJ:4DMP91E08xMC,96,https://www.sciencedirect.com/science/article/pii/S0360319913005867,164267027720391859,/scholar?cites=164267027720391859,,,,0,0,0
1265471,DMFC performance and methanol cross-over: Experimental analysis and model validation,2008,Andrea Casalegno and Renzo Marchesi,185,Journal of Power Sources,1,318-330,Elsevier,A combined experimental and modelling approach is proposed to analyze methanol cross-over and its effect on DMFC performance. The experimental analysis is performed in order to allow an accurate investigation of methanol cross-over influence on DMFC performance. hence measurements were characterized in terms of uncertainty and reproducibility. The findings suggest that methanol cross-over is mainly determined by diffusion transport and affects cell performance partly via methanol electro-oxidation at the cathode. The modelling analysis is carried out to further investigate methanol cross-over phenomenon. A simple model evaluates the effectiveness of two proposed interpretations regarding methanol cross-over and its effects. The model is validated using the experimental data gathered. Both the experimental analysis and the proposed and validated model allow a substantial step forward in the …,True,o-bXXSUAAAAJ:0EnyYjriUFMC,73,https://www.sciencedirect.com/science/article/pii/S0378775308013414,15068990800368010463,/scholar?cites=15068990800368010463,,,,0,0,0
1265472,Analysis of flow field design on vanadium redox flow battery performance: Development of 3D computational fluid dynamic model and experimental validation,2018,Mirko Messaggi and Patrizio Canzi and R Mereu and A Baricci and F Inzoli and A Casalegno and M Zago,228,Applied energy,,1057-1070,Elsevier,Homogeneous distribution of the electrolyte over the porous electrode is a critical issue hindering the commercialization of vanadium redox flow batteries. owing to increased overpotential at high current and limited power density of the system. Therefore. an understanding of the physical phenomena regulating mass transport of the electrolyte is crucial to improving system performance. The present work describes the development and experimental validation of a 3D computational fluid dynamic model of a vanadium redox flow battery in a half-cell configuration with an active area of 25 cm2. The model simulates the influence of a single serpentine and an interdigitated flow field. The adoption of the half-cell configuration allows the negative electrode to be considered as a pseudo-reference electrode with zero potential loss. leading to a reduction in computation time and the number of fitting parameters. which can …,True,o-bXXSUAAAAJ:J-pR_7NvFogC,57,https://www.sciencedirect.com/science/article/pii/S0306261918310183,14904920175605178938,/scholar?cites=14904920175605178938,,,,0,0,0
1265473,Long-term performance analysis of an HT-PEM fuel cell based micro-CHP system: Operational strategies,2015,Behzad Najafi and Alireza Haghighat Mamaghani and Fabio Rinaldi and Andrea Casalegno,147,Applied Energy,,582-592,Elsevier,In the present study. long term performance of an HT-PEM fuel cell based micro CHP system. considering the degradation within the HT-PEM fuel cell stack and the steam methane reformer has been investigated. The variations in the generated electrical and thermal power and the corresponding efficiencies. in the first 15.000 h of operation of the plant. have been studied. Two strategies have been proposed and applied in order to remedy the excursion of thermal and electrical generation of the plant from the steady state production. In the partialization strategy. by means of reducing the fuel fed to the system. the thermal generation of the plant is kept in a specified range. On the other hand. in the recovery strategy. the supplied fuel is gradually increased to suppress the progressive reduction in the power production.The long term performance analysis of the system in normal condition reveals that. due to the …,True,o-bXXSUAAAAJ:4JMBOYKVnBMC,56,https://www.sciencedirect.com/science/article/pii/S030626191500327X,14908533848560174288,/scholar?cites=14908533848560174288,,,https://re.public.polimi.it/retrieve/handle/11311/928955/450964/Long-term%20performance%20analysis%20of%20an%20HT-PEM%20fuel%20cell%20based%20micro-CHP%20system_11311-928955_Rinaldi.pdf,0,0,0
1265474,Experimental study of water transport in a polybenzimidazole-based high temperature PEMFC,2012,Samuele Galbiati and Andrea Baricci and Andrea Casalegno and Renzo Marchesi,37,International Journal of Hydrogen Energy,3,2462-2469,Pergamon,The present work reports a systematic experimental analysis on water transport in a phosphoric acid doped polybenzimidazole-based high temperature PEM fuel cell. Two sets of polarization curves are run with dry and alternatively humidified reactants. covering a wide range of fuel cell operating temperatures and stoichiometries. With dry feed streams. up to 18% of water produced by electrochemical reaction is found on anode side proving the presence of water transport from cathode electrode. Under the investigated conditions. water transport across the membrane is independent of fuel cell temperature but strongly dependent on reactants stoichiometry and humidification. Such parameters can even determine a change in water transport direction. Humidification causes a limited drop in membrane proton resistivity (around 6 mΩ cm2); conversely a slight decrease in fuel cell performances (−5 to −20 mV) is …,True,o-bXXSUAAAAJ:MXK_kJrjxJIC,56,https://www.sciencedirect.com/science/article/pii/S0360319911024463,698949747412307411,/scholar?cites=698949747412307411,,,,0,0,0
1265475,Experimental analysis of methanol cross-over in a direct methanol fuel cell,2007,Andrea Casalegno and Paolo Grassini and Renzo Marchesi,27,Applied thermal engineering,4,748-754,Pergamon,Methanol cross-over through the polymeric membrane is one of the main causes limiting direct methanol fuel cell performances. It causes fuel wasting and enhances cathode overpotential. A repeatable and reproducible measurement system. that assures the traceability of the measurement to international reference standards. is necessary to compare different fuel cell construction materials. In this work a method to evaluate methanol cross-over rate and operating condition influence is presented and qualified in term of measurement uncertainty. In the investigated range. the methanol cross-over rate results mainly due to diffusion through the membrane. in fact it is strongly affected by temperature. Moreover the cross-over influence on fuel utilization and fuel cell efficiency is investigated. The methanol cross-over rate appears linearly proportional to electrochemical fuel utilization and values. obtained by …,True,o-bXXSUAAAAJ:5nxA0vEk-isC,56,https://www.sciencedirect.com/science/article/pii/S1359431106003644,14852821321843967453,/scholar?cites=14852821321843967453,,,,0,0,0
1265476,Predictive modelling and adaptive long-term performance optimization of an HT-PEM fuel cell based micro combined heat and power (CHP) plant,2017,Alireza Haghighat Mamaghani and Behzad Najafi and Andrea Casalegno and Fabio Rinaldi,192,Applied Energy,,519-529,Elsevier,In fuel cell based combined heat and power (CHP) plants. degradation within the fuel cell stack and the steam methane reformer significantly affects the generated electrical and thermal power. As a consequence. incorporating system’s degradation within the model of the plant could be of great importance in order to estimate the resulting variations in the electrical and thermal power generation and taking appropriate measures to mitigate such deviations. To this end. in the present article. a multi-objective optimization approach has been proposed and employed to find the optimal operating parameters of an HT-PEM fuel cell based micro-CHP system within the first 15.000 h of operation while considering the impact of degradation. Two different optimization procedures with the following objective functions have been applied: (I) net electrical efficiency and thermal generation; and (II) net electrical efficiency and …,True,o-bXXSUAAAAJ:D03iK_w7-QYC,49,https://www.sciencedirect.com/science/article/pii/S0306261916311370,2394497032422244769,/scholar?cites=2394497032422244769,,,,0,0,0
1265477,Mathematical modelling and parametric study on a 30 kWel high temperature PEM fuel cell based residential micro cogeneration plant,2015,Behzad Najafi and Alireza Haghighat Mamaghani and Andrea Baricci and Fabio Rinaldi and Andrea Casalegno,40,International Journal of Hydrogen Energy,3,1569-1583,Pergamon,A new configuration for an existing PEM fuel cell based residential micro-cogeneration system has been proposed in which the conventional low temperature PEM fuel cell is replaced with a high temperature one. Detailed mathematical models for the fuel processor. HT- PEM fuel cell stack and all other components of the plant have been developed. The electrical and thermal performance of the system have been determined and the corresponding results have been compared with the performance indices achieved for the previous plant. The electrical efficiency and the primary energy savings index obtained for the proposed system are 29.21% and 17.50% respectively which are considerably higher than the ones obtained for the existing LT-PEM based plant (21.18% and 6.07%). In order to enlighten our understanding of the behaviour of the system a parametric study on the key parameters of the system has …,True,o-bXXSUAAAAJ:_Qo2XoVZTnwC,46,https://www.sciencedirect.com/science/article/pii/S0360319914032273,14072960399994893459,/scholar?cites=14072960399994893459,,,https://re.public.polimi.it/retrieve/handle/11311/883564/451018/Mathematical%20modelling%20and%20parametric%20study_11311-883564_Rinaldi.pdf,0,0,0
1265478,DMFC anode polarization: Experimental analysis and model validation,2008,Andrea Casalegno and Renzo Marchesi,175,Journal of power sources,1,372-382,Elsevier,Anode two-phase flow has an important influence on DMFC performance and methanol crossover. In order to elucidate two-phase flow influence on anode performance. in this work. anode polarization is investigated combining experimental and modelling approach. A systematic experimental analysis of operating conditions influence on anode polarization is presented. Hysteresis due to operating condition is observed; experimental results suggest that it arises from methanol accumulation and has to be considered in evaluating DMFC performances and measurements reproducibility. A model of DMFC anode polarization is presented and utilised as tool to investigate anode two-phase flow. The proposed analysis permits one to produce a confident interpretation of the main involved phenomena. In particular. it confirms that methanol electro-oxidation kinetics is weakly dependent on methanol concentration and …,True,o-bXXSUAAAAJ:8k81kl-MbHgC,45,https://www.sciencedirect.com/science/article/pii/S0378775307018782,5819142217543238414,/scholar?cites=5819142217543238414,,,,0,0,0
1265479,Low methanol crossover and high efficiency direct methanol fuel cell: the influence of diffusion layers,2011,Andrea Casalegno and C Santoro and Fabio Rinaldi and Renzo Marchesi,196,Journal of Power Sources,5,2669-2675,Elsevier,This experimental work aims to investigate the possibility to reduce methanol crossover in DMFC modifying diffusion layer characteristics. Improvements in crossover measurement are firstly proposed. permitting to conclude that in the investigated conditions carbon dioxide flow through the membrane can be neglected. The experimental results evidence that introducing appropriate anode and cathode microporous layers determines: a strong reduction in methanol crossover. approximately 45% at low current density; a considerable increment of efficiency; a moderate decrease of power density. The complete experimental analysis demonstrates that methanol transport in both liquid and vapour phases can be controlled modifying properly diffusion layer characteristics in order to increase DMFC efficiency.,True,o-bXXSUAAAAJ:kNdYIx-mwKoC,42,https://www.sciencedirect.com/science/article/pii/S0378775310019567,2018069769949553767,/scholar?cites=2018069769949553767,,,,0,0,0
1265480,Design of an innovative enthalpy wheel based humidification system for polymer electrolyte fuel cell,2011,Andrea Casalegno and Stefano De Antonellis and L Colombo and Fabio Rinaldi,36,International Journal of Hydrogen Energy,8,5000-5009,Pergamon,Water management plays a crucial role to ensure high performance and to limit degradation of PEFC systems. Thus. a reliable and accurate humidification system is necessary. The most common types. especially membrane humidifiers. are characterized by large pressure drop. affecting compressor power consumption. and make use of special expensive materials. To overcome these problems. many current researches deal with modeling of the heat and mass transfer processes occurring in such humidifiers. in order to find the best compromise between performance and cost. Conversely. in this work a different solution to the humidification requirement is proposed. An innovative low cost and low pressure drop humidification system based on a properly designed enthalpy wheel is presented and discussed. System design and performance evaluation are reported in both nominal and off-design operating …,True,o-bXXSUAAAAJ:Zph67rFs4hoC,38,https://www.sciencedirect.com/science/article/pii/S036031991100022X,5600987873615155780,/scholar?cites=5600987873615155780,,,,0,0,0
1265481,Long-term economic analysis and optimization of an HT-PEM fuel cell based micro combined heat and power plant,2016,Alireza Haghighat Mamaghani and Behzad Najafi and Andrea Casalegno and Fabio Rinaldi,99,Applied Thermal Engineering,,1201-1211,Pergamon,Multi-objective optimization method using genetic algorithm is employed in order to optimize design and operating parameters of a high temperature proton exchange membrane (HT-PEM) fuel cell based combined heat and power system. Net electrical efficiency of the plant. indicating the system's performance (to be maximized) and the total capital cost (to be minimized) are considered as optimization objectives. Current density (indicating the stack size). steam to carbon ratio. burner outlet temperature and auxiliary to process fuel ratio have been chosen as design parameters. Two different multi-objective optimization approaches have been utilized: steady state (without degradation) and long-term optimization while considering the degradation in fuel cell stack and the fuel processor. The results of the optimization procedures are Pareto frontiers which are a set of optimal points each of which is a trade-off …,True,o-bXXSUAAAAJ:SeFeTyx0c_EC,35,https://www.sciencedirect.com/science/article/pii/S1359431116301545,3334281584499026847,/scholar?cites=3334281584499026847,,,,0,0,0
