,title,pub_year,author,volume,journal,number,pages,publisher,abstract,filled,author_pub_id,num_citations,pub_url,cites_id,citedby_url,gsrank,author_id,eprint_url,got_citations,got_author_ids,author_ids
1278018,The FLARE™ intraoperative near-infrared fluorescence imaging system: a first-in-human clinical trial in breast cancer sentinel lymph node mapping,2009,Susan L Troyan and Vida Kianzad and Summer L Gibbs-Strauss and Sylvain Gioux and Aya Matsui and Rafiou Oketokoun and Long Ngo and Ali Khamene and Fred Azar and John V Frangioni,16,Annals of Surgical Oncology,10,2943-2952,Springer New York,Invisible NIR fluorescent light can provide high sensitivity. high-resolution. and real-time image-guidance during oncologic surgery. but imaging systems that are presently available do not display this invisible light in the context of surgical anatomy. The FLARE™ imaging system overcomes this major obstacle.Color video was acquired simultaneously. and in real-time. along with two independent channels of NIR fluorescence. Grayscale NIR fluorescence images were converted to visible “pseudo-colors” and overlaid onto the color video image. Yorkshire pigs weighing 35 kg (n = 5) were used for final preclinical validation of the imaging system. A six-patient pilot study was conducted in women undergoing sentinel lymph node (SLN) mapping for breast cancer. Subjects received 99mTc-sulfur colloid lymphoscintigraphy. In addition …,True,j41ocikAAAAJ:u-x6o8ySG0sC,691,https://link.springer.com/article/10.1245/s10434-009-0594-2,16604290576264846668,/scholar?cites=16604290576264846668,,,https://www.ncbi.nlm.nih.gov/pmc/articles/pmc2772055/,0,0,0
1278019,Automatic CT-ultrasound registration for diagnostic imaging and image-guided intervention,2008,Wolfgang Wein and Shelby Brunke and Ali Khamene and Matthew R Callstrom and Nassir Navab,12,Medical Image Analysis,5,577-585,Elsevier,The fusion of tracked ultrasound with CT has benefits for a variety of clinical applications. however extensive manual effort is usually required for correct registration. We developed new methods that allow one to simulate medical ultrasound from CT in real-time. reproducing the majority of ultrasonic imaging effects. They are combined with a robust similarity measure that assesses the correlation of a combination of signals extracted from CT with ultrasound. without knowing the influence of each signal. This serves as the foundation of a fully automatic registration. that aligns a 3D ultrasound sweep with the corresponding tomographic modality using a rigid or an affine transformation model. without any manual interaction.These techniques were evaluated in a study involving 25 patients with indeterminate lesions in liver and kidney. The clinical setup. acquisition and registration workflow is described. along with the …,True,j41ocikAAAAJ:9yKSN-GCB0IC,470,https://www.sciencedirect.com/science/article/pii/S1361841508000637,16782031562727993010,/scholar?cites=16782031562727993010,,,https://www.researchgate.net/profile/Ali_Kamen/publication/272352969_wein2008ctusfusion/links/54e26ef30cf2edaea092ea91/wein2008ctusfusion.pdf,0,0,0
1278020,A new method for the extraction of fetal ECG from the composite abdominal signal,2000,Ali Khamene and Shahriar Negahdaripour,47,IEEE Transactions on Biomedical Engineering,4,507-516,IEEE,We developed a wavelet transform-based method to extract the fetal electrocardiogram (ECG) from the composite abdominal signal. This is based on the detection of the singularities obtained from the composite abdominal signal. using the modulus maxima in the wavelet domain. Modulus maxima locations of the abdominal signal are used to discriminate between maternal and fetal ECG signals. Two different approaches have been considered. In the first approach. at least one thoracic signal is used as the a prior to perform the classification whereas in the second approach no thoracic signal is needed. A reconstruction method is utilized to obtain the fetal ECG signal from the detected fetal modulus maxima. The proposed technique is different from the classical time-domain methods. in that we exploit the most distinct features of the signal. leading to more robustness with respect to signal perturbations. Results of …,True,j41ocikAAAAJ:u5HHmVD_uO8C,255,https://ieeexplore.ieee.org/abstract/document/828150/,14309528410263199158,/scholar?cites=14309528410263199158,,,,0,0,0
1278021,Method and apparatus for ultrasound guidance of needle biopsies,2004,Frank Sauer and Gianluca Paladini and Ali Khamene,,,,,,An ultrasound scanning system having an ultrasound transducer (10) which provides ultrasound images (33). a computer to process the ultrasound information and to render the ultrasound image (33) correctly positioned and scaled for display on a flat panel monitor (29) which has a display size similar to the actual physical size of the ultrasound image (33). A half silvered mirror (30) redirects the image (33) so that the user (32) perceives the image (33) as if it occupied the actual physical location of the structures (34. 35) appearing in the image (33). An illumination (22) unit projects onto a patient (13) a line of light (3) that is within the imaging plane (4) projected by the ultrasound transducer (10) into the patient (13). Alternatively a video camera may be used to display a guide line (15) that is coplanar with the imaging plane (4). A mechanical mount (16) combines the transducer (10). monitor (29). mirror (30). and …,True,j41ocikAAAAJ:PZE8UkGerEcC,182,https://patents.google.com/patent/US6689067B2/en,14302400050318200263,/scholar?cites=14302400050318200263,,,https://patentimages.storage.googleapis.com/77/45/46/e95c73c328bda3/US6689067B2.pdf,0,0,0
1278022,Automatic registration of portal images and volumetric CT for patient positioning in radiation therapy,2006,Ali Khamene and Peter Bloch and Wolfgang Wein and Michelle Svatos and Frank Sauer,10,Medical Image Analysis,1,96-112,Elsevier,The efficacy of radiation therapy treatment depends on the patient setup accuracy at each daily fraction. A significant problem is reproducing the patient position during treatment planning for every fraction of the treatment process. We propose and evaluate an intensity based automatic registration method using multiple portal images and the pre-treatment CT volume. We perform both geometric and radiometric calibrations to generate high quality digitally reconstructed radiographs (DRRs) that can be compared against portal images acquired right before treatment dose delivery. We use a graphics processing unit (GPU) to generate the DRRs in order to gain computational efficiency. We also perform a comparative study on various similarity measures and optimization procedures. Simple similarity measure such as local normalized correlation (LNC) performs best as long as the radiometric calibration is carefully …,True,j41ocikAAAAJ:3BvdIg-l-ZAC,176,https://www.sciencedirect.com/science/article/pii/S1361841505000678,13057669431817763733,/scholar?cites=13057669431817763733,,,http://citeseerx.ist.psu.edu/viewdoc/download?doi=10.1.1.205.4506&rep=rep1&type=pdf,0,0,0
1278023,System and method for augmented reality navigation in a medical intervention procedure,2010,Frank Sauer and Ali Khamene and Sebastian Vogt,,,,,,A method for augmented reality navigation of a medical intervention includes providing a stereoscopic head mounted display. the display including a pair of stereo viewing cameras. at least one tracking camera. and a stereoscopic guidance display. During a medical intervention on a patient. the patient's body pose is determined from a rigid body transformation between the tracking camera and frame markers on the scanning table. and the pose of an intervention instrument with respect to the table is determined. A visual representation of the patient overlaid with an image of the intervention target. the instrument. and a path for guiding the instrument to perform said medical intervention is displayed in the stereoscopic guidance display.,True,j41ocikAAAAJ:1xBWf43XMUgC,147,https://patents.google.com/patent/US7774044B2/en,16907489873381176067,/scholar?cites=16907489873381176067,,,https://patentimages.storage.googleapis.com/a9/c2/47/9facf399b51262/US7774044.pdf,0,0,0
1278024,An Augmented Reality System for MR Image–guided Needle Biopsy: Initial Results in a Swine Model1,2006,Frank K Wacker and Sebastian Vogt and Ali Khamene and John A Jesberger and Sherif G Nour and Daniel R Elgort and Frank Sauer and Jeffrey L Duerk and Jonathan S Lewin,238,Radiology,2,497-504,Radiological Society of North America,Purpose: To evaluate an augmented reality (AR) system in combination with a 1.5-T closed-bore magnetic resonance (MR) imager as a navigation tool for needle biopsies.Materials and Methods: The experimental protocol had institutional animal care and use committee approval. Seventy biopsies were performed in phantoms by using 20 tube targets. each with a diameter of 6 mm. and 50 virtual targets. The position of the needle tip in AR and MR space was compared in multiple imaging planes. and virtual and real needle tip localization errors were calculated. Ten AR-guided biopsies were performed in three pigs. and the duration of each procedure was determined. After successful puncture. the distance to the target was measured on MR images. The confidence limits for the achieved in-plane hit rate and for lateral deviation were calculated. A repeated measures analysis of variance was used to determine …,True,j41ocikAAAAJ:MGPUR4WVBMEC,138,https://pubs.rsna.org/doi/abs/10.1148/radiol.2382041441,15047803332825271729,/scholar?cites=15047803332825271729,,,,0,0,0
1278025,An artificial agent for robust image registration,2017,Rui Liao and Shun Miao and Pierre de Tournemire and Sasa Grbic and Ali Kamen and Tommaso Mansi and Dorin Comaniciu,,,,,,"3-D image registration. which involves aligning two or more images. is a critical step in a variety of medical applications from diagnosis to therapy. Image registration is commonly performed by optimizing an image matching metric as a cost function. However this task is challenging due to the non-convex nature of the matching metric over the plausible registration parameter space and insufficient approches for a robust optimization. As a result. current approaches are often customized to a specific problem and sensitive to image quality and artifacts. In this paper. we propose a completely different approach to image registration. inspired by how experts perform the task. We first cast the image registration problem as a"" strategic learning"" process. where the goal is to find the best sequence of motion actions (eg up. down. etc) that yields image alignment. Within this approach. an artificial agent is learned. modeled using deep convolutional neural networks. with 3D raw image data as the input. and the next optimal action as the output. To copy with the dimensionality of the problem. we propose a greedy supervised approach for an end-to-end training. coupled with attention-driven hierarchical strategy. The resulting registration approach inherently encodes both a data-driven matching metric and an optimal registration strategy (policy). We demonstrate on two 3-D/3-D medical image registration examples with drastically different nature of challenges. that the artificial agent outperforms several state-of-the-art registration methods by a large margin in terms of both accuracy and robustness.",True,j41ocikAAAAJ:T_0gP6tLVL0C,133,https://ojs.aaai.org/index.php/AAAI/article/view/11230,13789426669412137738,/scholar?cites=13789426669412137738,,,https://ojs.aaai.org/index.php/AAAI/article/download/11230/11089,0,0,0
1278026,Robust non-rigid registration through agent-based action learning,2017,Julian Krebs and Tommaso Mansi and Hervé Delingette and Li Zhang and Florin C Ghesu and Shun Miao and Andreas K Maier and Nicholas Ayache and Rui Liao and Ali Kamen,,,,344-352,Springer. Cham,Robust image registration in medical imaging is essential for comparison or fusion of images. acquired from various perspectives. modalities or at different times. Typically. an objective function needs to be minimized assuming specific a priori deformation models and predefined or learned similarity measures. However. these approaches have difficulties to cope with large deformations or a large variability in appearance. Using modern deep learning (DL) methods with automated feature design. these limitations could be resolved by learning the intrinsic mapping solely from experience. We investigate in this paper how DL could help organ-specific (ROI-specific) deformable registration. to solve motion compensation or atlas-based segmentation problems for instance in prostate diagnosis. An artificial agent is trained to solve the task of non-rigid registration by exploring the parametric space of a statistical …,True,j41ocikAAAAJ:Dmoar05iI2YC,120,https://link.springer.com/chapter/10.1007/978-3-319-66182-7_40,6297155798520631821,/scholar?cites=6297155798520631821,,,https://hal.inria.fr/hal-01569447/document,0,0,0
1278027,System and method for patient positioning for radiotherapy in the presence of respiratory motion,2010,Frank Sauer and Ali Khamene,,,,,,A system and method for positioning a patient for radiotherapy is provided. The method comprises: acquiring a first x-ray image sequence of a target inside the patient at a first angle; acquiring first respiratory signals of the patient while acquiring the first x-ray image sequence; acquiring a second x-ray image sequence of the target at a second angle; acquiring second respiratory signals of the patient while acquiring the second x-ray image sequence; synchronizing the first and second x-ray image sequences with the first and second respiratory signals to form synchronized first and second x-ray image sequences; identifying the target in the synchronized first and second x-ray image sequences; and determining three-dimensional (3D) positions of the target through time in the synchronized first and second x-ray image sequences.,True,j41ocikAAAAJ:VjBpw8Hezy4C,113,https://patents.google.com/patent/US7853308B2/en,1491842018390446951,/scholar?cites=1491842018390446951,,,https://patentimages.storage.googleapis.com/a2/d1/f5/d87aebab200264/US7853308.pdf,0,0,0
1278028,A survey of medical image registration on graphics hardware,2011,O Fluck and C Vetter and W Wein and A Kamen and B Preim and R Westermann,104,Computer Methods and Programs in Biomedicine,3,45-57,Elsevier,The rapidly increasing performance of graphics processors. improving programming support and excellent performance-price ratio make graphics processing units (GPUs) a good option for a variety of computationally intensive tasks. Within this survey. we give an overview of GPU accelerated image registration. We address both. GPU experienced readers with an interest in accelerated image registration. as well as registration experts who are interested in using GPUs. We survey programming models and interfaces and analyze different approaches to programming on the GPU. We furthermore discuss the inherent advantages and challenges of current hardware architectures. which leads to a description of the details of the important building blocks for successful implementations.,True,j41ocikAAAAJ:M0j1y4EgrScC,109,https://www.sciencedirect.com/science/article/pii/S0169260710002713,18193700807429056957,/scholar?cites=18193700807429056957,,,https://www.researchgate.net/profile/Bernhard_Preim/publication/49639970_A_survey_of_medical_image_registration_on_graphics_hardware/links/5a13008f0f7e9b1e572c2525/A-survey-of-medical-image-registration-on-graphics-hardware.pdf,0,0,0
1278029,Diffusion kernels on graphs and other discrete structures,2002,Risi Imre Kondor and John Lafferty,2002,Proceedings of the 19th international conference on machine learning,,315-322,,The application of kernel-based learning algorithms has. so far. largely been confined to realvalued data and a few special data types. such as strings. In this paper we propose a general method of constructing natural families of kernels over discrete structures. based on the matrix exponentiation idea. In particular. we focus on generating kernels on graphs. for which we propose a special class of exponential kernels. based on the heat equation. called diffusion kernels. and show that these can be regarded as the discretisation of the familiar Gaussian kernel of Euclidean space.,True,v12-jLUAAAAJ:u5HHmVD_uO8C,1429,http://people.cs.uchicago.edu/~risi/papers/diffusion-kernels.pdf,6737969268261813970,/scholar?cites=6737969268261813970,,,http://people.cs.uchicago.edu/~risi/papers/diffusion-kernels.pdf,0,0,0
1278030,Gaussian approximation potentials: The accuracy of quantum mechanics. without the electrons,2010,Albert P Bartók and Mike C Payne and Risi Kondor and Gábor Csányi,104,Physical review letters,13,136403,American Physical Society,We introduce a class of interatomic potential models that can be automatically generated from data consisting of the energies and forces experienced by atoms. as derived from quantum mechanical calculations. The models do not have a fixed functional form and hence are capable of modeling complex potential energy landscapes. They are systematically improvable with more data. We apply the method to bulk crystals. and test it by calculating properties at high temperatures. Using the interatomic potential to generate the long molecular dynamics trajectories required for such calculations saves orders of magnitude in computational cost.,True,v12-jLUAAAAJ:UeHWp8X0CEIC,1134,https://journals.aps.org/prl/abstract/10.1103/PhysRevLett.104.136403,4745823905145029648,/scholar?cites=4745823905145029648,,,https://arxiv.org/pdf/0910.1019,0,0,0
1278031,Graph kernels,2010,S Vichy N Vishwanathan and Nicol N Schraudolph and Risi Kondor and Karsten M Borgwardt,11,Journal of Machine Learning Research,,1201-1242,MIT Press,We present a unified framework to study graph kernels. special cases of which include the random walk (Gärtner et al.. 2003; Borgwardt et al.. 2005) and marginalized (Kashima et al.. 2003. 2004; Mahé et al.. 2004) graph kernels. Through reduction to a Sylvester equation we improve the time complexity of kernel computation between unlabeled graphs with n vertices from O(n^6) to O(n^3). We find a spectral decomposition approach even more efficient when computing entire kernel matrices. For labeled graphs we develop conjugate gradient and fixed-point methods that take O(dn^3) time per iteration. where d is the size of the label set. By extending the necessary linear algebra to Reproducing Kernel Hilbert Spaces (RKHS) we obtain the same result for d-dimensional edge kernels. and O(n^4) in the infinite-dimensional case; on sparse graphs these algorithms only take O(n^2) time per iteration in all cases. Experiments on graphs from bioinformatics and other application domains show that these techniques can speed up computation of the kernel by an order of magnitude or more. We also show that certain rational kernels (Cortes et al.. 2002. 2003. 2004) when specialized to graphs reduce to our random walk graph kernel. Finally. we relate our framework to R-convolution kernels (Haussler. 1999) and provide a kernel that is close to the optimal assignment kernel of Fröhlich et al. (2006) yet provably positive semi-definite.,True,v12-jLUAAAAJ:2osOgNQ5qMEC,968,https://authors.library.caltech.edu/20528,11932573160154031862,/scholar?cites=11932573160154031862,,,https://authors.library.caltech.edu/20528/1/Vishwanathan2010p11646J_Mach_Learn_Res.pdf,0,0,0
1278032,Kernels and regularization on graphs,2003,Alexander J Smola and Risi Kondor,,,,144-158,Springer. Berlin. Heidelberg,We introduce a family of kernels on graphs based on the notion of regularization operators. This generalizes in a natural way the notion of regularization and Greens functions. as commonly used for real valued functions. to graphs. It turns out that diffusion kernels can be found as a special case of our reasoning. We show that the class of positive. monotonically decreasing functions on the unit interval leads to kernels and corresponding regularization operators.,True,v12-jLUAAAAJ:u-x6o8ySG0sC,937,https://link.springer.com/chapter/10.1007/978-3-540-45167-9_12,10853394597336247098,/scholar?cites=10853394597336247098,,,https://www.shivani-agarwal.net/Teaching/E0371/Papers/colt03-kernels-regularization-graphs.pdf,0,0,0
1278033,On representing chemical environments,2013,Albert P Bartók and Risi Kondor and Gábor Csányi,87,Physical Review B,18,184115,American Physical Society,We review some recently published methods to represent atomic neighborhood environments. and analyze their relative merits in terms of their faithfulness and suitability for fitting potential energy surfaces. The crucial properties that such representations (sometimes called descriptors) must have are differentiability with respect to moving the atoms and invariance to the basic symmetries of physics: rotation. reflection. translation. and permutation of atoms of the same species. We demonstrate that certain widely used descriptors that initially look quite different are specific cases of a general approach. in which a finite set of basis functions with increasing angular wave numbers are used to expand the atomic neighborhood density function. Using the example system of small clusters. we quantitatively show that this expansion needs to be carried to higher and higher wave numbers as the number of neighbors …,True,v12-jLUAAAAJ:Y0pCki6q_DkC,873,https://journals.aps.org/prb/abstract/10.1103/PhysRevB.87.184115,3134398014064745426,/scholar?cites=3134398014064745426,,,https://arxiv.org/pdf/1209.3140.pdf;,0,0,0
1278034,Probability product kernels,2004,Tony Jebara and Risi Kondor and Andrew Howard,5,The Journal of Machine Learning Research,,819-844,JMLR. org,The advantages of discriminative learning algorithms and kernel machines are combined with generative modeling using a novel kernel between distributions. In the probability product kernel. data points in the input space are mapped to distributions over the sample space and a general inner product is then evaluated as the integral of the product of pairs of distributions. The kernel is straightforward to evaluate for all exponential family models such as multinomials and Gaussians and yields interesting nonlinear kernels. Furthermore. the kernel is computable in closed form for latent distributions such as mixture models. hidden Markov models and linear dynamical systems. For intractable models. such as switching linear dynamical systems. structured mean-field approximations can be brought to bear on the kernel evaluation. For general distributions. even if an analytic expression for the kernel is not feasible. we show a straightforward sampling method to evaluate it. Thus. the kernel permits discriminative learning methods. including support vector machines. to exploit the properties. metrics and invariances of the generative models we infer from each datum. Experiments are shown using multinomial models for text. hidden Markov models for biological data sets and linear dynamical systems for time series data.,True,v12-jLUAAAAJ:d1gkVwhDpl0C,613,https://www.jmlr.org/papers/volume5/jebara04a/jebara04a.pdf,3848151407572273068,/scholar?cites=3848151407572273068,,,https://www.jmlr.org/papers/volume5/jebara04a/jebara04a.pdf,0,0,0
1278035,A kernel between sets of vectors,2003,Risi Kondor and Tony Jebara,,,,361-368,,In various application domains. including image recognition. it is natural to represent each example as a set of vectors. With a base kernel we can implicitly map these vectors to a Hilbert space and fit a Gaussian distribution to the whole set using Kernel PCA. We define our kernel between examples as Bhattacharyya’s measure of affinity between such Gaussians. The resulting kernel is computable in closed form and enjoys many favorable properties. including graceful behavior under transformations. potentially justifying the vector set representation even in cases when more conventional representations also exist.,True,v12-jLUAAAAJ:9yKSN-GCB0IC,339,https://www.aaai.org/Papers/ICML/2003/ICML03-049.pdf,10184135545233010818,/scholar?cites=10184135545233010818,,,https://www.aaai.org/Papers/ICML/2003/ICML03-049.pdf,0,0,0
1278036,On the generalization of equivariance and convolution in neural networks to the action of compact groups,2018,Risi Kondor and Shubhendu Trivedi,,,,2747-2755,PMLR,Convolutional neural networks have been extremely successful in the image recognition domain because they ensure equivariance with respect to translations. There have been many recent attempts to generalize this framework to other domains. including graphs and data lying on manifolds. In this paper we give a rigorous. theoretical treatment of convolution and equivariance in neural networks with respect to not just translations. but the action of any compact group. Our main result is to prove that (given some natural constraints) convolutional structure is not just a sufficient. but also a necessary condition for equivariance to the action of a compact group. Our exposition makes use of concepts from representation theory and noncommutative harmonic analysis and derives new generalized convolution formulae.,True,v12-jLUAAAAJ:TFP_iSt0sucC,170,http://proceedings.mlr.press/v80/kondor18a.html,9202958939197040845,/scholar?cites=9202958939197040845,,,http://proceedings.mlr.press/v80/kondor18a/kondor18a.pdf,0,0,0
