,title,pub_year,author,volume,journal,number,pages,publisher,abstract,filled,author_pub_id,num_citations,pub_url,cites_id,citedby_url,gsrank,author_id,eprint_url,got_citations,got_author_ids,author_ids
1276917,Moments and moment invariants in pattern recognition,2009,Jan Flusser and Barbara Zitova and Tomas Suk,,,,,John Wiley & Sons,Moments as projections of an image’s intensity onto a proper polynomial basis can be applied to many different aspects of image processing. These include invariant pattern recognition. image normalization. image registration. focus/defocus measurement. and watermarking. This book presents a survey of both recent and traditional image analysis and pattern recognition methods. based on image moments. and offers new concepts of invariants to linear filtering and implicit invariants. In addition to the theory. attention is paid to efficient algorithms for moment computation in a discrete domain. and to computational aspects of orthogonal moments. The authors also illustrate the theory through practical examples. demonstrating moment invariants in real applications across computer vision. remote sensing and medical imaging. Key features: Presents a systematic review of the basic definitions and properties of moments covering geometric moments and complex moments. Considers invariants to traditional transforms–translation. rotation. scaling. and affine transform-from a new point of view. which offers new possibilities of designing optimal sets of invariants. Reviews and extends a recent field of invariants with respect to convolution/blurring. Introduces implicit moment invariants as a tool for recognizing elastically deformed objects. Compares various classes of orthogonal moments (Legendre. Zernike. Fourier-Mellin. Chebyshev. among others) and demonstrates their application to image reconstruction from moments. Offers comprehensive advice on the construction of various invariants illustrated with practical examples. Includes an …,True,399TNdkAAAAJ:MXK_kJrjxJIC,768,http://books.google.com/books?hl=en&lr=&id=IAFDvarv-AAC&oi=fnd&pg=PR7&dq=info:MbbGQ8-uS3MJ:scholar.google.com&ots=uA_xFGbF3k&sig=0GkbDKWXjrfcSdKbcPqrAz6-r28,8307926142833571377,/scholar?cites=8307926142833571377,,,"ftp://nozdr.ru/biblio/kolxoz/Cs/CsIp/Flusser%20J.,%20et%20al.%20Moments%20and%20moment%20invariants%20in%20pattern%20recognition%20(Wiley,%202009)(ISBN%200470699876)(O)(314s)_CsIp_.pdf",0,0,0
1276918,Moments and moment invariants in pattern recognition,2009,Jan Flusser and Barbara Zitova and Tomas Suk,,,,,John Wiley & Sons,Moments as projections of an image’s intensity onto a proper polynomial basis can be applied to many different aspects of image processing. These include invariant pattern recognition. image normalization. image registration. focus/defocus measurement. and watermarking. This book presents a survey of both recent and traditional image analysis and pattern recognition methods. based on image moments. and offers new concepts of invariants to linear filtering and implicit invariants. In addition to the theory. attention is paid to efficient algorithms for moment computation in a discrete domain. and to computational aspects of orthogonal moments. The authors also illustrate the theory through practical examples. demonstrating moment invariants in real applications across computer vision. remote sensing and medical imaging. Key features: Presents a systematic review of the basic definitions and properties of moments covering geometric moments and complex moments. Considers invariants to traditional transforms–translation. rotation. scaling. and affine transform-from a new point of view. which offers new possibilities of designing optimal sets of invariants. Reviews and extends a recent field of invariants with respect to convolution/blurring. Introduces implicit moment invariants as a tool for recognizing elastically deformed objects. Compares various classes of orthogonal moments (Legendre. Zernike. Fourier-Mellin. Chebyshev. among others) and demonstrates their application to image reconstruction from moments. Offers comprehensive advice on the construction of various invariants illustrated with practical examples. Includes an …,True,399TNdkAAAAJ:u-x6o8ySG0sC,768,http://books.google.com/books?hl=en&lr=&id=IAFDvarv-AAC&oi=fnd&pg=PR7&dq=info:MbbGQ8-uS3MJ:scholar.google.com&ots=uA_xFGbGWd&sig=0Qer3lLAtCO_YitHX3IU9G7W-9s,8307926142833571377,/scholar?cites=8307926142833571377,,,"ftp://nozdr.ru/biblio/kolxoz/Cs/CsIp/Flusser%20J.,%20et%20al.%20Moments%20and%20moment%20invariants%20in%20pattern%20recognition%20(Wiley,%202009)(ISBN%200470699876)(O)(314s)_CsIp_.pdf",0,0,0
1276919,A new wavelet-based measure of image focus,2002,Jaroslav Kautsky and Jan Flusser and Barbara Zitova and Stanislava Šimberová,23,Pattern recognition letters,14,1785-1794,North-Holland,We present a new measure of image focus. It is based on wavelet transform of the image and is defined as a ratio of high-pass band and low-pass band norms. We show this measure is monotonic with respect to the degree of defocusation and sufficiently robust. We experimentally illustrate its performance on simulated as well as real data and compare it with existing focus measures (gray-level variance and energy of Laplacian). Finally. an application of the new measure in astronomical imaging is shown.,True,399TNdkAAAAJ:d1gkVwhDpl0C,186,https://www.sciencedirect.com/science/article/pii/S0167865502001526,14696952748656913855,/scholar?cites=14696952748656913855,,,https://www.academia.edu/download/42825753/20020126.pdf,0,0,0
1276920,Affine moment invariants: a new tool for character recognition,1994,Jan Flusser and Tomáš Suk,15,Pattern recognition letters,4,433-436,North-Holland,Affine moment invariants (AMIs) have been derived recently by Flusser and Suk (1992). In this paper. the AMIs are used as the features for recognition of handwritten characters independent of their size. slant and other variations. A comparison with classical moment invariants is also given.,True,399TNdkAAAAJ:qUcmZB5y_30C,179,https://www.sciencedirect.com/science/article/pii/0167865594900922,4052049918798312278,/scholar?cites=4052049918798312278,,,http://citeseerx.ist.psu.edu/viewdoc/download?doi=10.1.1.30.2369&rep=rep1&type=pdf,0,0,0
1276921,Moment forms invariant to rotation and blur in arbitrary number of dimensions,2003,Jan Flusser and Jirí Boldys and Barbara Zitová,25,IEEE Transactions on Pattern Analysis and Machine Intelligence,2,234-246,IEEE,We present the construction of combined blur and rotation moment invariants in arbitrary number of dimensions. Moment invariants to convolution with an arbitrary centrosymmetric filter are derived first. and then their rotationally invariant forms are found by means of group representation theory to achieve the desired combined invariance. Several examples of the invariants are calculated explicitly to illustrate the proposed procedure. Their invariance. robustness. and capability of using in template matching and in image registration are demonstrated on 3D MRI data and 2D indoor images.,True,399TNdkAAAAJ:9yKSN-GCB0IC,139,https://ieeexplore.ieee.org/abstract/document/1177154/,4419827175240093228,/scholar?cites=4419827175240093228,,,,0,0,0
1276922,2D and 3D image analysis by moments,2016,Jan Flusser and Tomas Suk and Barbara Zitová,,,,,John Wiley & Sons,"Presents recent significant and rapid development in the field of 2D and 3D image analysis 2D and 3D Image Analysis by Moments. is a unique compendium of moment-based image analysis which includes traditional methods and also reflects the latest development of the field. The book presents a survey of 2D and 3D moment invariants with respect to similarity and affine spatial transformations and to image blurring and smoothing by various filters. The book comprehensively describes the mathematical background and theorems about the invariants but a large part is also devoted to practical usage of moments. Applications from various fields of computer vision. remote sensing. medical imaging. image retrieval. watermarking. and forensic analysis are demonstrated. Attention is also paid to efficient algorithms of moment computation. Key features: Presents a systematic overview of moment-based features used in 2D and 3D image analysis. Demonstrates invariant properties of moments with respect to various spatial and intensity transformations. Reviews and compares several orthogonal polynomials and respective moments. Describes efficient numerical algorithms for moment computation. It is a"" classroom ready"" textbook with a self-contained introduction to classifier design. The accompanying website contains around 300 lecture slides. Matlab codes. complete lists of the invariants. test images. and other supplementary material. 2D and 3D Image Analysis by Moments. is ideal for mathematicians. computer scientists. engineers. software developers. and Ph. D students involved in image analysis and recognition. Due to the addition of two …",True,399TNdkAAAAJ:vV6vV6tmYwMC,129,http://books.google.com/books?hl=en&lr=&id=jwKLDQAAQBAJ&oi=fnd&pg=PP18&dq=info:a-SakamnA44J:scholar.google.com&ots=sVOtQkP0ua&sig=a7TfJblhYRY-X9DpJdR-CjaoTO8,10233207125050057835,/scholar?cites=10233207125050057835,,,,0,0,0
1276923,Robust detection of significant points in multiframe images,1999,Barbara Zitova and Jaroslav Kautsky and Gabriele Peters and Jan Flusser,20,Pattern Recognition Letters,2,199-206,North-Holland,Significant point (SP) detection is an important pre-processing step in image registration. data fusion. object recognition and in many other tasks. This paper deals with multiframe SP detection. i.e. detection in two or more images of the same scene which are supposed to be blurred. noisy. rotated and shifted with respect to each other. We present a new method invariant under rotation that can handle differently blurred images. Thanks to this. the point sets extracted from different frames have relatively high number of common elements. This property is highly desirable for further multiframe processing. The performance of the method is demonstrated experimentally on satellite images.,True,399TNdkAAAAJ:2osOgNQ5qMEC,101,https://www.sciencedirect.com/science/article/pii/S0167865598001354,14227275827491815424,/scholar?cites=14227275827491815424,,,http://citeseerx.ist.psu.edu/viewdoc/download?doi=10.1.1.1038.1663&rep=rep1&type=pdf,0,0,0
1276924,Combined invariants to linear filtering and rotation,1999,Jan Flusser and Barbara Zitova,13,International Journal of Pattern Recognition and Artificial Intelligence,08,1123-1135,World Scientific Publishing Company,A new class of moment-based features invariant to image rotation. translation. scaling. contrast changes and also to  convolution with an unknown PSF are introduced in this paper. These features can be used for the recognition of objects captured by a nonideal imaging system of unknown position and blurring parameters.,True,399TNdkAAAAJ:qjMakFHDy7sC,95,https://www.worldscientific.com/doi/abs/10.1142/S021800149900063X,12154235741307915717,/scholar?cites=12154235741307915717,,,http://library.utia.cas.cz/prace/990162.pdf,0,0,0
1276925,Recognition of images degraded by Gaussian blur,2015,Jan Flusser and Sajad Farokhi and Cyril Höschl and Tomáš Suk and Barbara Zitová and Matteo Pedone,25,IEEE transactions on Image Processing,2,790-806,IEEE,In this paper. we propose a new theory of invariants to Gaussian blur. We introduce a notion of a primordial image as a canonical form of all Gaussian blur-equivalent images. The primordial image is defined in spectral domain by means of projection operators. We prove that the moments of the primordial image are invariant to Gaussian blur and we derive recursive formulas for their direct computation without actually constructing the primordial image itself. We show how to extend their invariance also to image rotation. The application of these invariants is in blur-invariant image comparison and recognition. In the experimental part. we perform an exhaustive comparison with two main competitors: 1) the Zhang distance and 2) the local phase quantization.,True,399TNdkAAAAJ:ns9cj8rnVeAC,71,https://ieeexplore.ieee.org/abstract/document/7364266/,111245232242095359,/scholar?cites=111245232242095359,,,http://library.utia.cas.cz/separaty/2016/ZOI/flusser-0454335.pdf,0,0,0
1276926,Invariant-based registration of rotated and blurred images,1999,Jan Flusser and Barbara Zitová and Toms Suk,2,,,1262-1264,IEEE,Image registration is a classical problem in remotely sensed image analysis. In this paper. attention is paid to control point matching for the case when the images are blurred and rotated compared to one another. The matching is performed by means of a new class of moment invariants. which are calculated over the neighborhood of each candidate. The proposed invariants are invariant not only to rotation and translation but also to image blurring by any symmetric point spread function. Thanks to this. the authors can register blurred images directly without any de-blurring.,True,399TNdkAAAAJ:UeHWp8X0CEIC,51,https://ieeexplore.ieee.org/abstract/document/774598/,16009071410559793842,/scholar?cites=16009071410559793842,,,,0,0,0
1276927,Gradient domain high dynamic range compression,2002,Raanan Fattal and Dani Lischinski and Michael Werman,,,,249-256,,We present a new method for rendering high dynamic range images on conventional displays. Our method is conceptually simple. computationally efficient. robust. and easy to use. We manipulate the gradient field of the luminance image by attenuating the magnitudes of large gradients. A new. low dynamic range image is then obtained by solving a Poisson equation on the modified gradient field. Our results demonstrate that the method is capable of drastic dynamic range compression. while preserving fine details and avoiding common artifacts. such as halos. gradient reversals. or loss of local contrast. The method is also able to significantly enhance ordinary images by bringing out detail in dark regions.,True,WBeDvikAAAAJ:u5HHmVD_uO8C,1732,https://dl.acm.org/doi/abs/10.1145/566570.566573,9048873609684779932,/scholar?cites=9048873609684779932,,,https://www.researchgate.net/profile/Dani_Lischinski/publication/2530899_Gradient_Domain_High_Dynamic_Range_Compression/links/00463524c3f5cd2e34000000/Gradient-Domain-High-Dynamic-Range-Compression.pdf,0,0,0
1276928,Fast and robust earth mover's distances,2009,Ofir Pele and Michael Werman,,,,460-467,IEEE,We present a new algorithm for a robust family of Earth Mover's Distances - EMDs with thresholded ground distances. The algorithm transforms the flow-network of the EMD so that the number of edges is reduced by an order of magnitude. As a result. we compute the EMD by an order of magnitude faster than the original algorithm. which makes it possible to compute the EMD on large histograms and databases. In addition. we show that EMDs with thresholded ground distances have many desirable properties. First. they correspond to the way humans perceive distances. Second. they are robust to outlier noise and quantization effects. Third. they are metrics. Finally. experimental results on image retrieval show that thresholding the ground distance of the EMD improves both accuracy and speed.,True,WBeDvikAAAAJ:5nxA0vEk-isC,809,https://ieeexplore.ieee.org/abstract/document/5459199/,6760390442247339511,/scholar?cites=6760390442247339511,,,https://www.researchgate.net/profile/Ofir_Pele/publication/224135940_Fast_and_Robust_Earth_Mover's_Distances/links/5ba9e805a6fdccd3cb70c18d/Fast-and-Robust-Earth-Movers-Distances.pdf,0,0,0
1276929,Linear time Euclidean distance transform algorithms,1995,Heinz Breu and Joseph Gil and David Kirkpatrick and Michael Werman,17,IEEE Transactions on Pattern Analysis and Machine Intelligence,5,529-533,IEEE,Two linear time (and hence asymptotically optimal) algorithms for computing the Euclidean distance transform of a two-dimensional binary image are presented. The algorithms are based on the construction and regular sampling of the Voronoi diagram whose sites consist of the unit (feature) pixels in the image. The first algorithm. which is of primarily theoretical interest. constructs the complete Voronoi diagram. The second. more practical. algorithm constructs the Voronoi diagram where it intersects the horizontal lines passing through the image pixel centers. Extensions to higher dimensional images and to other distance functions are also discussed.< >,True,WBeDvikAAAAJ:u-x6o8ySG0sC,568,https://ieeexplore.ieee.org/abstract/document/391389/,14743928323120202675,/scholar?cites=14743928323120202675,,,https://www.academia.edu/download/48158525/Linear_Time_Euclidean_Distance_Transform20160818-5739-1lfk2ks.pdf,0,0,0
1276930,Texture mixing and texture movie synthesis using statistical learning,2001,Ziv Bar-Joseph and Ran El-Yaniv and Dani Lischinski and Michael Werman,7,IEEE Transactions on visualization and computer graphics,2,120-135,IEEE,We present an algorithm based on statistical learning for synthesizing static and time-varying textures matching the appearance of an input texture. Our algorithm is general and automatic and it works well on various types of textures. including 1D sound textures. 2D texture images. and 3D texture movies. The same method is also used to generate 2D texture mixtures that simultaneously capture the appearance of a number of different input textures. In our approach. input textures are treated as sample signals generated by a stochastic process. We first construct a tree representing a hierarchical multiscale transform of the signal using wavelets. From this tree. new random trees are generated by learning and sampling the conditional probabilities of the paths in the original tree. Transformation of these random trees back into signals results in new random textures. In the case of 2D texture synthesis. our algorithm …,True,WBeDvikAAAAJ:d1gkVwhDpl0C,328,https://ieeexplore.ieee.org/abstract/document/928165/,7202452522119397608,/scholar?cites=7202452522119397608,,,https://www.cs.huji.ac.il/~werman/Papers/texsyn.pdf,0,0,0
1276931,A linear time histogram metric for improved sift matching,2008,Ofir Pele and Michael Werman,,,,495-508,Springer. Berlin. Heidelberg,We present a new metric between histograms such as SIFT descriptors and a linear time algorithm for its computation. It is common practice to use the L 2 metric for comparing SIFT descriptors. This practice assumes that SIFT bins are aligned. an assumption which is often not correct due to quantization. distortion. occlusion etc.In this paper we present a new Earth Mover’s Distance (EMD) variant. We show that it is a metric (unlike the original EMD [1] which is a metric only for normalized histograms). Moreover. it is a natural extension of the L 1 metric. Second. we propose a linear time algorithm for the computation of the EMD variant. with a robust ground distance for oriented gradients. Finally. extensive experimental results on the Mikolajczyk and Schmid dataset [2] show that our method outperforms state of the art distances.,True,WBeDvikAAAAJ:kNdYIx-mwKoC,321,https://link.springer.com/chapter/10.1007/978-3-540-88690-7_37,2768073473526189798,/scholar?cites=2768073473526189798,,,https://link.springer.com/content/pdf/10.1007/978-3-540-88690-7_37.pdf,0,0,0
1276932,Color lines: Image specific color representation,2004,Ido Omer and Michael Werman,2,,,II-II,IEEE,The problem of deciding whether two pixels in an image have the same real world color is a fundamental problem in computer vision. Many color spaces are used in different applications for discriminating color from intensity to create an informative representation of color. The major drawback of all of these representations is that they assume no color distortion. In practice the colors of real world images are distorted both in the scene itself and in the image capturing process. In this work we introduce color lines. an image specific color representation that is robust to color distortion and provides a compact and useful representation of the colors in a scene.,True,WBeDvikAAAAJ:eQOLeE2rZwMC,308,https://ieeexplore.ieee.org/abstract/document/1315267/,6744754647269251782,/scholar?cites=6744754647269251782,,,http://www.howardzzh.com/research/papers/vision/2004.CVPR.Omer.ColorLines.pdf,0,0,0
1276933,The quadratic-chi histogram distance family,2010,Ofir Pele and Michael Werman,,,,749-762,Springer. Berlin. Heidelberg,We present a new histogram distance family. the Quadratic-Chi (QC). QC members are Quadratic-Form distances with a cross-bin χ 2-like normalization. The cross-bin χ 2-like normalization reduces the effect of large bins having undo influence. Normalization was shown to be helpful in many cases. where the χ 2 histogram distance outperformed the L 2 norm. However. χ 2 is sensitive to quantization effects. such as caused by light changes. shape deformations etc. The Quadratic-Form part of QC members takes care of cross-bin relationships (e.g. red and orange). alleviating the quantization problem. We present two new cross-bin histogram distance properties: Similarity-Matrix-Quantization-Invariance and Sparseness-Invariance and show that QC distances have these properties. We also show that experimentally they boost performance. QC distances …,True,WBeDvikAAAAJ:35N4QoGY0k4C,297,https://link.springer.com/chapter/10.1007/978-3-642-15552-9_54,17953515489045259860,/scholar?cites=17953515489045259860,,,https://link.springer.com/content/pdf/10.1007/978-3-642-15552-9_54.pdf,0,0,0
1276934,Self-organization in vision: stochastic clustering for image segmentation. perceptual grouping. and image database organization,2001,Yoram Gdalyahu and Daphna Weinshall and Michael Werman,23,IEEE Transactions on Pattern Analysis and Machine Intelligence,10,1053-1074,IEEE,"We present a stochastic clustering algorithm which uses pairwise similarity of elements and show how it can be used to address various problems in computer vision. including the low-level image segmentation. mid-level perceptual grouping. and high-level image database organization. The clustering problem is viewed as a graph partitioning problem. where nodes represent data elements and the weights of the edges represent pairwise similarities. We generate samples of cuts in this graph. by using Karger's contraction algorithm (1996). and compute an ""average"" cut which provides the basis for our solution to the clustering problem. The stochastic nature of our method makes it robust against noise. including accidental edges and small spurious clusters. The complexity of our algorithm is very low: O(|E| log/sup 2/ N) for N objects. |E| similarity relations. and a fixed accuracy level. In addition. and without …",True,WBeDvikAAAAJ:2osOgNQ5qMEC,244,https://ieeexplore.ieee.org/abstract/document/954598/,2792070488511988308,/scholar?cites=2792070488511988308,,,,0,0,0
1276935,Computing 2-D min. median. and max filters,1993,Joseph Gil and Michael Werman,15,IEEE Transactions on Pattern Analysis and Machine Intelligence,5,504-507,IEEE,Fast algorithms for computing min. median. max. or any other order statistic filter transforms are described. The algorithms take constant time per pixel to compute min or max filters and polylog time per pixel. in the size of the filter. to compute the median filter. A logarithmic time per pixel lower bound for the computation of the median filter is shown.< >,True,WBeDvikAAAAJ:UeHWp8X0CEIC,227,https://ieeexplore.ieee.org/abstract/document/211471/,10670451193239233210,/scholar?cites=10670451193239233210,,,http://citeseerx.ist.psu.edu/viewdoc/download?doi=10.1.1.49.1287&rep=rep1&type=pdf,0,0,0
1276936,A distance metric for multidimensional histograms,1985,Michael Werman and Shmuel Peleg and Azriel Rosenfeld,32,"Computer Vision, Graphics, and Image Processing",3,328-336,Academic Press,A metric is defined on the space of multidimensional histograms. Such histograms store in thexth location the number of events with feature vectorx; examples are gray level histograms and co-occurrence matrices of digital images. Given two multidimensional histograms. each is “unfolded” and a minimum distance pairing is performed using a distance metric on the feature vectorsx. The sum of the distances in the minimal pairing is used as the “match distance” between the histograms. This distance is shown to be a metric. and in the one-dimensional case is equal to the absolute difference of the two cumulative distribution functions. Among other applications. it facilitates direct computation of the distance between co-occurrence matrices or between point patterns. The problem of finding a translation to minimize the distance between point patterns is also discussed.,True,WBeDvikAAAAJ:IjCSPb-OGe4C,208,https://www.sciencedirect.com/science/article/pii/0734189X85900556,938234612124861681,/scholar?cites=938234612124861681,,,http://w3.cs.huji.ac.il/~peleg/papers/cvgip85-Distance.pdf,0,0,0
