,title,pub_year,author,volume,journal,number,pages,publisher,abstract,filled,author_pub_id,num_citations,pub_url,cites_id,citedby_url,gsrank,author_id,eprint_url,got_citations,got_author_ids,author_ids
1278113,A deep architecture for matching short texts,2013,Zhengdong Lu and Hang Li,26,Advances in neural information processing systems,,1367-1375,,Many machine learning problems can be interpreted as learning for matching two types of objects (eg. images and captions. users and products. queries and documents. etc.). The matching level of two objects is usually measured as the inner product in a certain feature space. while the modeling effort focuses on mapping of objects from the original space to the feature space. This schema. although proven successful on a range of matching tasks. is insufficient for capturing the rich structure in the matching process of more complicated objects. In this paper. we propose a new deep architecture to more effectively model the complicated matching relations between two objects from heterogeneous domains. More specifically. we apply this model to matching tasks in natural language. eg. finding sensible responses for a tweet. or relevant answers to a given question. This new architecture naturally combines the localness and hierarchy intrinsic to the natural language problems. and therefore greatly improves upon the state-of-the-art models.,True,x5lXo2YAAAAJ:eQOLeE2rZwMC,222,http://hangli-hl.com/uploads/3/1/6/8/3168008/nips_2013.pdf,9706401483814083653,/scholar?cites=9706401483814083653,,,http://hangli-hl.com/uploads/3/1/6/8/3168008/nips_2013.pdf,0,0,0
1278114,An information retrieval approach to short text conversation,2014,Zongcheng Ji and Zhengdong Lu and Hang Li,,arXiv preprint arXiv:1408.6988,,,,"Human computer conversation is regarded as one of the most difficult problems in artificial intelligence. In this paper. we address one of its key sub-problems. referred to as short text conversation. in which given a message from human. the computer returns a reasonable response to the message. We leverage the vast amount of short conversation data available on social media to study the issue. We propose formalizing short text conversation as a search problem at the first step. and employing state-of-the-art information retrieval (IR) techniques to carry out the task. We investigate the significance as well as the limitation of the IR approach. Our experiments demonstrate that the retrieval-based model can make the system behave rather"" intelligently"". when combined with a huge repository of conversation data from social media.",True,x5lXo2YAAAAJ:Zph67rFs4hoC,211,https://arxiv.org/abs/1408.6988,690543487409622269,/scholar?cites=690543487409622269,,,https://arxiv.org/pdf/1408.6988,0,0,0
1278115,Constrained spectral clustering through affinity propagation,2008,Zhengdong Lu and Miguel A Carreira-Perpinan,,,,1-8,IEEE,Pairwise constraints specify whether or not two samples should be in one cluster. Although it has been successful to incorporate them into traditional clustering methods. such as K-means. little progress has been made in combining them with spectral clustering. The major challenge in designing an effective constrained spectral clustering is a sensible combination of the scarce pairwise constraints with the original affinity matrix. We propose to combine the two sources of affinity by propagating the pairwise constraints information over the original affinity matrix. Our method has a Gaussian process interpretation and results in a closed-form expression for the new affinity matrix. Experiments show it outperforms state-of-the-art constrained clustering methods in getting good clusterings with fewer constraints. and yields good image segmentation with user-specified pairwise constraints.,True,x5lXo2YAAAAJ:u5HHmVD_uO8C,199,https://ieeexplore.ieee.org/abstract/document/4587451/,16477327230063693048,/scholar?cites=16477327230063693048,,,http://engr.case.edu/ray_soumya/mlrg/constrained_spectral_clustering_lu.cvpr08.pdf,0,0,0
1278116,Self-adaptive hierarchical sentence model,2015,Han Zhao and Zhengdong Lu and Pascal Poupart,,arXiv preprint arXiv:1504.05070,,,,The ability to accurately model a sentence at varying stages (eg. word-phrase-sentence) plays a central role in natural language processing. As an effort towards this goal we propose a self-adaptive hierarchical sentence model (AdaSent). AdaSent effectively forms a hierarchy of representations from words to phrases and then to sentences through recursive gated local composition of adjacent segments. We design a competitive mechanism (through gating networks) to allow the representations of the same sentence to be engaged in a particular learning task (eg. classification). therefore effectively mitigating the gradient vanishing problem persistent in other recursive models. Both qualitative and quantitative analysis shows that AdaSent can automatically form and select the representations suitable for the task at hand during training. yielding superior classification performance over competitor models on 5 benchmark data sets.,True,x5lXo2YAAAAJ:Se3iqnhoufwC,196,https://arxiv.org/abs/1504.05070,17759270433860780143,/scholar?cites=17759270433860780143,,,https://arxiv.org/pdf/1504.05070,0,0,0
1278117,Multi-messenger observations of a binary neutron star merger,2017,Benjamin P Abbott and S Bloemen and P Canizares and H Falcke and RP Fender and S Ghosh and P Groot and T Hinderer and JR Hörandel and PG Jonker and Z Kostrzewa-Rutkowska and G Nelemans and D Nichols and S Nissanke and P Schmidt and C Timmermans and AR van Vliet and AR Williamson,,,,,,On 2017 August 17 a binary neutron star coalescence candidate (later designated GW170817) with merger time 12: 41: 04 UTC was observed through gravitational waves by the Advanced LIGO and Advanced Virgo detectors. The Fermi Gamma-ray Burst Monitor independently detected a gamma-ray burst (GRB 170817A) with a time delay of 1.7 s~ with respect to the merger time. From the gravitational-wave signal. the source was initially localized to a sky region of 31 deg2 at a luminosity distance of 40 8 8-+ Mpc and with component masses consistent with neutron stars. The component masses were later measured to be in the range 0.86 to 2.26 M. An extensive observing campaign was launched across the electromagnetic spectrum leading to the discovery of a bright optical transient (SSS17a. now with the IAU identification of AT 2017gfo) in NGC 4993 (at 40 Mpc~) less than 11 hours after the merger by the …,True,SAzirToAAAAJ:p2g8aNsByqUC,2389,https://iopscience.iop.org/article/10.3847/2041-8213/aa91c9/meta,2461611103499596342,/scholar?cites=2461611103499596342,,,https://arxiv.org/pdf/1710.05833,0,0,0
1278118,Depth of maximum of air-shower profiles at the Pierre Auger Observatory. I. Measurements at energies above ,2014,Alexander Aab and P Abreu and MARCO Aglietta and EJ Ahn and I Al Samarai and Ivone Freire da Mota Albuquerque and I Allekotte and J Allen and P Allison and A Almela and J Alvarez Castillo and J Alvarez-Muniz and R Alves Batista and M Ambrosio and A Aminaei and L Anchordoqui and S Andringa and C Aramo and VM Aranda and F Arqueros and H Asorey and P Assis and J Aublin and M Ave and M Avenier and G Avila and N Awal and AM Badescu and KB Barber and J Baeuml and C Baus and JJ Beatty and KH Becker and JA Bellido and C Berat and Mario Edoardo Bertaina and X Bertou and PL Biermann and P Billoir and S Blaess and M Blanco and C Bleve and H Bluemer and M Boháčová and D Boncioli and C Bonifazi and Raffaella Bonino and N Borodai and J Brack and I Brancus and A Bridgeman and P Brogueira and WC Brown and P Buchholz and A Bueno and S Buitink and M Buscemi and KS Caballero-Mora and B Caccianiga and L Caccianiga and M Candusso and L Caramete and R Caruso and ANTONELLA Castellina and G Cataldi and L Cazon and Rosanna Cester and AG Chavez and Andrea Chiavassa and JA Chinellato and J Chudoba and M Cilmo and RW Clay and G Cocciolo and R Colalillo and A Coleman and L Collica and MR Coluccia and R Conceicao and F Contreras and MJ Cooper and A Cordier and S Coutu and CE Covault and J Cronin and A Curutiu and R Dallier and B Daniel and S Dasso and K Daumiller and BR Dawson and RM De Almeida and M De Domenico and SJ De Jong and JRT de Mello Neto and I De Mitri and J De Oliveira and V De Souza and L Del Peral and O Deligny and H Dembinski and N Dhital and C Di Giulio and A Di Matteo and JC Diaz and ML Díaz Castro and F Diogo and C Dobrigkeit and W Docters and JC D’Olivo and A Dorofeev and Q Dorosti Hasankiadeh and MT Dova and J Ebr and R Engel and M Erdmann and M Erfani and CO Escobar and J Espadanal and A Etchegoyen and P Facal San Luis and H Falcke and K Fang and G Farrar and AC Fauth and N Fazzini and AP Ferguson and M Fernandes and B Fick and JM Figueira and A Filevich and A Filipčič and BD Fox and O Fratu and U Fröhlich and B Fuchs and T Fujii and R Gaior and B García and ST Garcia Roca and D Garcia-Gamez and D Garcia-Pinto and G Garilli and A Gascon Bravo and F Gate and H Gemmeke and PL Ghia and U Giaccari and M Giammarchi and M Giller,90,Physical Review D,12,122005,American Physical Society,We report a study of the distributions of the depth of maximum. X max. of extensive air-shower profiles with energies above 1 0 17.8 eV as observed with the fluorescence telescopes of the Pierre Auger Observatory. The analysis method for selecting a data sample with minimal sampling bias is described in detail as well as the experimental cross-checks and systematic uncertainties. Furthermore. we discuss the detector acceptance and the resolution of the X max measurement and provide parametrizations thereof as a function of energy. The energy dependence of the mean and standard deviation of the X max distributions are compared to air-shower simulations for different nuclear primaries and interpreted in terms of the mean and variance of the logarithmic mass distribution at the top of the atmosphere.,True,SAzirToAAAAJ:u-x6o8ySG0sC,429,https://journals.aps.org/prd/abstract/10.1103/PhysRevD.90.122005,428436654746512107,/scholar?cites=428436654746512107,,,https://arxiv.org/pdf/1409.4809,0,0,0
1278119,Measurement of the Proton-Air Cross Section at  with the Pierre Auger Observatory,2012,Pedro Abreu and M Aglietta and EJ Ahn and Ivone Freire da Mota Albuquerque and D Allard and I Allekotte and J Allen and P Allison and A Almeda and J Alvarez Castillo and J Alvarez-Muñiz and M Ambrosio and A Aminaei and L Anchordoqui and S Andringa and T Antičić and C Aramo and E Arganda and F Arqueros and H Asorey and P Assis and J Aublin and M Ave and M Avenier and G Avila and T Bäcker and M Balzer and KB Barber and AF Barbosa and R Bardenet and SLC Barroso and B Baughman and J Bäuml and JJ Beatty and BR Becker and KH Becker and A Bellétoile and JA Bellido and S BenZvi and C Berat and X Bertou and PL Biermann and P Billoir and F Blanco and M Blanco and C Bleve and H Blümer and M Boháčová and D Boncioli and C Bonifazi and R Bonino and N Borodai and J Brack and P Brogueira and WC Brown and R Bruijn and P Buchholz and A Bueno and RE Burton and KS Caballero-Mora and L Caramete and R Caruso and A Castellina and O Catalano and G Cataldi and L Cazon and R Cester and J Chauvin and SH Cheng and A Chiavassa and JA Chinellato and J Chirinos Diaz and J Chudoba and RW Clay and MR Coluccia and R Conceição and F Contreras and H Cook and MJ Cooper and J Coppens and A Cordier and S Coutu and CE Covault and A Creusot and A Criss and J Cronin and A Curutiu and S Dagoret-Campagne and R Dallier and S Dasso and K Daumiller and BR Dawson and RM De Almeida and M De Domenico and C De Donato and SJ De Jong and G De La Vega and WJM de Mello Junior and JRT de Mello Neto and I De Mitri and V De Souza and KD De Vries and G Decerprit and L Del Peral and M Del Río and O Deligny and H Dembinski and N Dhital and C Di Giulio and ML Díaz Castro and PN Diep and C Dobrigkeit and W Docters and JC D’Olivo and PN Dong and A Dorofeev and JC Dos Anjos and MT Dova and D D’Urso and I Dutan and J Ebr and R Engel and M Erdmann and CO Escobar and J Espadanal and A Etchegoyen and P Facal San Luis and I Fajardo Tapia and H Falcke and G Farrar and AC Fauth and N Fazzini and AP Ferguson and A Ferrero and B Fick and A Filevich and A Filipčič and S Fliescher and CE Fracchiolla and ED Fraenkel and U Fröhlich and B Fuchs and R Gaior and RF Gamarra and S Gambetta and B García and D Garcia-Gamez and D Garcia-Pinto and A Gascon and H Gemmeke,109,Physical review letters,6,062002,American Physical Society,We report a measurement of the proton-air cross section for particle production at the center-of-mass energy per nucleon of 57 TeV. This is derived from the distribution of the depths of shower maxima observed with the Pierre Auger Observatory: systematic uncertainties are studied in detail. Analyzing the tail of the distribution of the shower maxima. a proton-air cross section of [505±22 (stat)− 36+ 28 (syst)] mb is found.,True,SAzirToAAAAJ:LkGwnXOMwfcC,328,https://journals.aps.org/prl/abstract/10.1103/PhysRevLett.109.062002,2202905696621146860,/scholar?cites=2202905696621146860,,,https://arxiv.org/pdf/1208.1520,0,0,0
1278120,Depth of maximum of air-shower profiles at the Pierre Auger Observatory. II. Composition implications,2014,A Aab and P Abreu and MARCO Aglietta and EJ Ahn and I Al Samarai and IFM Albuquerque and I Allekotte and J Allen and P Allison and A Almela and J Alvarez Castillo and J Alvarez-Muñiz and R Alves Batista and M Ambrosio and A Aminaei and L Anchordoqui and S Andringa and C Aramo and VM Aranda and F Arqueros and H Asorey and P Assis and J Aublin and M Ave and M Avenier and G Avila and N Awal and AM Badescu and KB Barber and J Bäuml and C Baus and JJ Beatty and KH Becker and JA Bellido and C Berat and ME Bertania and X Bertou and PL Biermann and P Billoir and S Blaess and M Blanco and C Bleve and H Blümer and M Boháčová and D Boncioli and C Bonifazi and Raffaella Bonino and N Borodai and J Brack and I Brancus and A Bridgeman and P Brogueira and WC Brown and P Buchholz and A Bueno and S Buitink and M Buscemi and KS Caballero-Mora and B Caccianiga and L Caccianiga and M Candusso and L Caramete and R Caruso and ANTONELLA Castellina and G Cataldi and L Cazon and Rosanna Cester and AG Chavez and Andrea Chiavassa and JA Chinellato and J Chudoba and M Cilmo and RW Clay and G Cocciolo and R Colalillo and A Coleman and L Collica and MR Coluccia and R Conceição and F Contreras and MJ Cooper and A Cordier and S Coutu and CE Covault and J Cronin and A Curutiu and R Dallier and B Daniel and S Dasso and K Daumiller and BR Dawson and RM De Almeida and M De Domenico and SJ De Jong and JRT de Mello Neto and I De Mitri and J De Oliveira and V De Souza and L Del Peral and O Deligny and H Dembinski and N Dhital and C Di Giulio and A Di Matteo and JC Diaz and ML Díaz Castro and F Diogo and C Dobrigkeit and W Docters and JC D’Olivo and A Dorofeev and Q Dorosti Hasankiadeh and MT Dova and J Ebr and R Engel and M Erdmann and M Erfani and CO Escobar and J Espadanal and A Etchegoyen and P Facal San Luis and H Falcke and K Fang and G Farrar and AC Fauth and N Fazzini and AP Ferguson and M Fernandes and B Fick and JM Figueira and A Filevich and A Filipčič and BD Fox and O Fratu and U Fröhlich and B Fuchs and T Fuji and R Gaior and B García and ST Garcia Roca and D Garcia-Gamez and D Garcia-Pinto and G Garilli and A Gascon Bravo and F Gate and H Gemmeke and PL Ghia and U Giaccari and M Giammarchi and M Giller,90,Physical Review D,12,122006,American Physical Society,Using the data taken at the Pierre Auger Observatory between December 2004 and December 2012. we have examined the implications of the distributions of depths of atmospheric shower maximum (X max). using a hybrid technique. for composition and hadronic interaction models. We do this by fitting the distributions with predictions from a variety of hadronic interaction models for variations in the composition of the primary cosmic rays and examining the quality of the fit. Regardless of what interaction model is assumed. we find that our data are not well described by a mix of protons and iron nuclei over most of the energy range. Acceptable fits can be obtained when intermediate masses are included. and when this is done consistent results for the proton and iron-nuclei contributions can be found using the available models. We observe a strong energy dependence of the resulting proton fractions. and find no …,True,SAzirToAAAAJ:a0OBvERweLwC,326,https://journals.aps.org/prd/abstract/10.1103/PhysRevD.90.122006,723801533738185668,/scholar?cites=723801533738185668,,,https://arxiv.org/pdf/1409.5083,0,0,0
1278121,Observation of a large-scale anisotropy in the arrival directions of cosmic rays above 8× 1018 eV,2017,Alexander Aab and Pedro Abreu and Marco Aglietta and Imen Al Samarai and IFM Albuquerque and Ingomar Allekotte and Alejandro Almela and J Alvarez Castillo and Jaime Alvarez-Muñiz and Gioacchino Alex Anastasi and Luis Anchordoqui and Belén Andrada and Sofia Andringa and Carla Aramo and Fernando Arqueros and Nicusor Arsene and H Asorey and Pedro Assis and Julien Aublin and Gualberto Avila and Alina Mihaela Badescu and Alexandru Balaceanu and Felicia Barbato and RJ Barreira Luz and JJ Beatty and Karl-Heinz Becker and Jose A Bellido and Corinne Berat and Mario Edoardo Bertaina and Xavier Bertou and PL Biermann and Pierre Billoir and Jonathan Biteau and Simon G Blaess and Alberto Blanco and Jiri Blazek and Carla Bleve and Martina Boháčová and Denise Boncioli and Carla Bonifazi and Nataliia Borodai and Ana Martina Botti and Jeffrey Brack and Iliana Brancus and Thomas Bretz and Ariel Bridgeman and Florian Lukas Briechle and Peter Buchholz and Antonio Bueno and Stijn Buitink and Mario Buscemi and Karen S Caballero-Mora and Lorenzo Caccianiga and A Cancio and Fabrizia Canfora and Laurentiu Caramete and Rossella Caruso and Antonella Castellina and Gabriella Cataldi and Lorenzo Cazon and Alan G Chavez and Jose Augusto Chinellato and Jiri Chudoba and Roger W Clay and Agustín Cobos and Roberta Colalillo and Alan Coleman and Laura Collica and Maria Rita Coluccia and Ruben Conceição and Giovanni Consolati and Fernando Contreras and Mathew J Cooper and Stephane Coutu and CE Covault and James Cronin and Stefano D’Amico and Bruno Daniel and Sergio Dasso and Kai Daumiller and Bruce R Dawson and Rogerio M de Almeida and Sijbrand J de Jong and Giuseppe De Mauro and JRT de Mello Neto and Ivan De Mitri and Jaime de Oliveira and Vitor de Souza and Joachim Debatin and Olivier Deligny and Claudio Di Giulio and Armando Di Matteo and ML Díaz Castro and Francisco Diogo and Carola Dobrigkeit and Juan Carlos D’Olivo and Qader Dorosti and RC Dos Anjos and Maria Teresa Dova and Andrej Dundovic and Jan Ebr and Ralph Engel and Martin Erdmann and Mona Erfani and Carlos O Escobar and João Espadanal and Alberto Etchegoyen and Heino Falcke and Glennys Farrar and AC Fauth and Norberto Fazzini and Francesco Fenu and Brian Fick and Juan Manuel Figueira and Andrej Filipčič and Octavian Fratu and Martín Miguel Freire and Toshihiro Fujii and Alan Fuster and Romain Gaior and Beatriz García and Diego Garcia-Pinto and Florian Gaté and Hartmut Gemmeke and Alexandru Gherghel-Lascu and Piera Luisa Ghia and Ugo Giaccari and Marco Giammarchi and Maria Giller and Dariusz Głas and Christian Glaser and Geraldina Golup and M Gómez Berisso and PF Gómez Vitale and Nicolás González and Alessio Gorgi and Peter Gorham and AF Grillo and Trent D Grubb and Fausto Guarino and GP Guedes and Matías Rolf Hampel and Patricia Hansen and Diego Harari and Thomas A Harrison and JL Harton and Andreas Haungs and Thomas Hebbeker and Dieter Heck and Philipp Heimann,357,Science,6357,1266-1270,American Association for the Advancement of Science,Cosmic rays are atomic nuclei arriving from outer space that reach the highest energies observed in nature. Clues to their origin come from studying the distribution of their arrival directions. Using 3 × 104 cosmic rays with energies above 8 × 1018 electron volts. recorded with the Pierre Auger Observatory from a total exposure of 76.800 km2 sr year. we determined the existence of anisotropy in arrival directions. The anisotropy. detected at more than a 5.2σ level of significance. can be described by a dipole with an amplitude of 6.5−0.9+1.3 percent toward right ascension αd = 100 ± 10 degrees and declination δd = −24−13+12 degrees. That direction indicates an extragalactic origin for these ultrahigh-energy particles.,True,SAzirToAAAAJ:7PzlFSSx8tAC,284,https://science.sciencemag.org/content/357/6357/1266.abstract,10673236251651763112,/scholar?cites=10673236251651763112,,,https://arxiv.org/pdf/1709.07321,0,0,0
1278122,Muons in air showers at the Pierre Auger Observatory: Mean number in highly inclined events,2015,Alexander Aab and P Abreu and MARCO Aglietta and EJ Ahn and I Al Samarai and IFM Albuquerque and I Allekotte and J Allen and P Allison and A Almela and J Alvarez Castillo and J Alvarez-Muñiz and R Alves Batista and M Ambrosio and A Aminaei and L Anchordoqui and S Andringa and C Aramo and VM Aranda and F Arqueros and H Asorey and P Assis and J Aublin and M Ave and M Avenier and G Avila and AM Badescu and KB Barber and J Bäuml and C Baus and JJ Beatty and KH Becker and JA Bellido and C Berat and Mario Edoardo Bertaina and X Bertou and PL Biermann and P Billoir and M Blanco and C Bleve and H Blümer and M Boháčová and D Boncioli and C Bonifazi and Raffaella Bonino and N Borodai and J Brack and I Brancus and P Brogueira and WC Brown and P Buchholz and A Bueno and S Buitink and M Buscemi and KS Caballero-Mora and B Caccianiga and L Caccianiga and M Candusso and L Caramete and R Caruso and ANTONELLA Castellina and G Cataldi and L Cazon and R Cester and AG Chavez and Andrea Chiavassa and JA Chinellato and J Chudoba and M Cilmo and RW Clay and G Cocciolo and R Colalillo and A Coleman and L Collica and MR Coluccia and R Conceição and F Contreras and MJ Cooper and A Cordier and S Coutu and CE Covault and J Cronin and A Curutiu and R Dallier and B Daniel and S Dasso and K Daumiller and BR Dawson and RM De Almeida and M De Domenico and SJ De Jong and JRT de Mello Neto and I De Mitri and J De Oliveira and V De Souza and L Del Peral and O Deligny and H Dembinski and N Dhital and C Di Giulio and A Di Matteo and JC Diaz and ML Díaz Castro and F Diogo and C Dobrigkeit and W Docters and JC D’Olivo and A Dorofeev and Q Dorosti Hasankiadeh and MT Dova and J Ebr and R Engel and M Erdmann and M Erfani and CO Escobar and J Espadanal and A Etchegoyen and P Facal San Luis and H Falcke and K Fang and G Farrar and AC Fauth and N Fazzini and AP Ferguson and M Fernandes and B Fick and JM Figueira and A Filevich and A Filipčič and BD Fox and O Fratu and U Fröhlich and B Fuchs and T Fujii and R Gaior and B García and ST Garcia Roca and D Garcia-Gamez and D Garcia-Pinto and G Garilli and A Gascon Bravo and F Gate and H Gemmeke and PL Ghia and U Giaccari and M Giammarchi and M Giller and C Glaser and H Glass and M Gómez Berisso,91,Physical Review D,3,032003,American Physical Society,We present the first hybrid measurement of the average muon number in air showers at ultrahigh energies. initiated by cosmic rays with zenith angles between 62 and 80. The measurement is based on 174 hybrid events recorded simultaneously with the surface detector array and the fluorescence detector of the Pierre Auger Observatory. The muon number for each shower is derived by scaling a simulated reference profile of the lateral muon density distribution at the ground until it fits the data. A 10 19 eV shower with a zenith angle of 67. which arrives at the surface detector array at an altitude of 1450 m above sea level. contains on average (2.68±0.04±0.48 (sys))× 10 7 muons with energies larger than 0.3 GeV. The logarithmic gain d ln N μ/d ln E of muons with increasing energy between 4× 10 18 eV and 5× 10 19 eV is measured to be (1.029±0.024±0.030 (sys)).,True,SAzirToAAAAJ:pyW8ca7W8N0C,264,https://journals.aps.org/prd/abstract/10.1103/PhysRevD.91.032003,3324830671523810657,/scholar?cites=3324830671523810657,,,https://arxiv.org/pdf/1408.1421,0,0,0
