,title,pub_year,author,volume,journal,number,pages,publisher,abstract,filled,author_pub_id,num_citations,pub_url,cites_id,citedby_url,gsrank,author_id,eprint_url,got_citations,got_author_ids,author_ids
1278293,A survey on deep learning in medical image analysis,2017,Geert Litjens and Thijs Kooi and Babak Ehteshami Bejnordi and Arnaud Arindra Adiyoso Setio and Francesco Ciompi and Mohsen Ghafoorian and Jeroen Awm Van Der Laak and Bram Van Ginneken and Clara I Sánchez,42,,,60-88,Elsevier,Deep learning algorithms. in particular convolutional networks. have rapidly become a methodology of choice for analyzing medical images. This paper reviews the major deep learning concepts pertinent to medical image analysis and summarizes over 300 contributions to the field. most of which appeared in the last year. We survey the use of deep learning for image classification. object detection. segmentation. registration. and other tasks. Concise overviews are provided of studies per application area: neuro. retinal. pulmonary. digital pathology. breast. cardiac. abdominal. musculoskeletal. We end with a summary of the current state-of-the-art. a critical discussion of open challenges and directions for future research.,True,TxLhvpcAAAAJ:ufrVoPGSRksC,5437,https://www.sciencedirect.com/science/article/pii/S1361841517301135,17186798094825352745,/scholar?cites=17186798094825352745,,,https://arxiv.org/pdf/1702.05747.pdf?source=post_page---------------------------,0,0,0
1278294,Pulmonary nodule detection in CT images: false positive reduction using multi-view convolutional networks,2016,AAA Setio and F Ciompi and G Litjens and P Gerke and C Jacobs and S van Riel and M Winkler Wille and M Naqibullah and C Sanchez and B van Ginneken,,IEEE Transactions on Medical Imaging,,,IEEE,We propose a novel Computer-Aided Detection (CAD) system for pulmonary nodules using multi-view convolutional networks (ConvNets). for which discriminative features are automatically learnt from the training data. The network is fed with nodule candidates obtained by combining three candidate detectors specifically designed for solid. subsolid. and large nodules. For each candidate. a set of 2-D patches from differently oriented planes is extracted. The proposed architecture comprises multiple streams of 2-D ConvNets. for which the outputs are combined using a dedicated fusion method to get the final classification. Data augmentation and dropout are applied to avoid overfitting. On 888 scans of the publicly available LIDC-IDRI dataset. our method reaches high detection sensitivities of 85.4% and 90.1% at 1 and 4 false positives per scan. respectively. An additional evaluation on independent datasets from …,True,TxLhvpcAAAAJ:Tyk-4Ss8FVUC,769,https://ieeexplore.ieee.org/abstract/document/7422783/,8158189024082045415,/scholar?cites=8158189024082045415,,,https://geertlitjens.nl/publication/seti-16/seti-16.pdf,0,0,0
1278295,Validation. comparison. and combination of algorithms for automatic detection of pulmonary nodules in computed tomography images: the LUNA16 challenge,2017,Arnaud Arindra Adiyoso Setio and Alberto Traverso and Thomas De Bel and Moira SN Berens and Cas van den Bogaard and Piergiorgio Cerello and Hao Chen and Qi Dou and Maria Evelina Fantacci and Bram Geurts and Robbert van der Gugten and Pheng Ann Heng and Bart Jansen and Michael MJ De Kaste and Valentin Kotov and Jack Yu-Hung Lin and Jeroen TMC Manders and Alexander Sónora-Mengana and Juan Carlos García-Naranjo and Evgenia Papavasileiou and Mathias Prokop and Marco Saletta and Cornelia M Schaefer-Prokop and Ernst T Scholten and Luuk Scholten and Miranda M Snoeren and Ernesto Lopez Torres and Jef Vandemeulebroucke and Nicole Walasek and Guido CA Zuidhof and Bram van Ginneken and Colin Jacobs,42,Medical image analysis,,1-13,Elsevier,Automatic detection of pulmonary nodules in thoracic computed tomography (CT) scans has been an active area of research for the last two decades. However. there have only been few studies that provide a comparative performance evaluation of different systems on a common database. We have therefore set up the LUNA16 challenge. an objective evaluation framework for automatic nodule detection algorithms using the largest publicly available reference database of chest CT scans. the LIDC-IDRI data set. In LUNA16. participants develop their algorithm and upload their predictions on 888 CT scans in one of the two tracks: 1) the complete nodule detection track where a complete CAD system should be developed. or 2) the false positive reduction track where a provided set of nodule candidates should be classified. This paper describes the setup of LUNA16 and presents the results of the challenge so far …,True,TxLhvpcAAAAJ:eQOLeE2rZwMC,414,https://www.sciencedirect.com/science/article/pii/S1361841517301020,2084538205545992787,/scholar?cites=2084538205545992787,,,https://arxiv.org/pdf/1612.08012.pdf).,0,0,0
1278296,Memory-centric accelerator design for Convolutional Neural Networks,2013,Maurice Peemen and Arnaud Arindra Adiyoso Setio and Bart Mesman and Henk Corporaal,,,,13-19,IEEE,In the near future. cameras will be used everywhere as flexible sensors for numerous applications. For mobility and privacy reasons. the required image processing should be local on embedded computer platforms with performance requirements and energy constraints. Dedicated acceleration of Convolutional Neural Networks (CNN) can achieve these targets with enough flexibility to perform multiple vision tasks. A challenging problem for the design of efficient accelerators is the limited amount of external memory bandwidth. We show that the effects of the memory bottleneck can be reduced by a flexible memory hierarchy that supports the complex data access patterns in CNN workload. The efficiency of the on-chip memories is maximized by our scheduler that uses tiling to optimize for data locality. Our design flow ensures that on-chip memory size is minimized. which reduces area and energy usage. The design …,True,TxLhvpcAAAAJ:u-x6o8ySG0sC,336,https://ieeexplore.ieee.org/abstract/document/6657019/,18388805989005877979,/scholar?cites=18388805989005877979,,,https://pure.tue.nl/ws/files/3997958/580711006684801.pdf,0,0,0
1278297,Off-the-shelf Convolutional Neural Network features for pulmonary nodule detection in computed tomography scans,2015,Bram van Ginneken and Arnaud Arindra Adiyoso Setio and Colin Jacobs and Francesco Ciompi,,IEEE International Symposium on Biomedical Imaging,,,,Convolutional neural networks (CNNs) have emerged as the most powerful technique for a range of different tasks in computer vision. Recent work suggested that CNN features are generic and can be used for classification tasks outside the exact domain for which the networks were trained. In this work we use the features from one such network. OverFeat. trained for object detection in natural images. for nodule detection in computed tomography scans. We use 865 scans from the publicly available LIDC data set. read by four thoracic radiologists. Nodule candidates are generated by a state-of-the-art nodule detection system. We extract 2D sagittal. coronal and axial patches for each nodule candidate and extract 4096 features from the penultimate layer of OverFeat and classify these with linear support vector machines. We show for various configurations that the off-the-shelf CNN features perform surprisingly well …,True,TxLhvpcAAAAJ:UeHWp8X0CEIC,261,https://ieeexplore.ieee.org/abstract/document/7163869/,3459188085599203383,/scholar?cites=3459188085599203383,,,,0,0,0
1278298,Towards automatic pulmonary nodule management in lung cancer screening with deep learning,2017,Francesco Ciompi and Kaman Chung and Sarah J Van Riel and Arnaud Arindra Adiyoso Setio and Paul K Gerke and Colin Jacobs and Ernst Th Scholten and Cornelia Schaefer-Prokop and Mathilde MW Wille and Alfonso Marchiano and Ugo Pastorino and Mathias Prokop and Bram Van Ginneken,7,Scientific reports,1,1-11,Nature Publishing Group,The introduction of lung cancer screening programs will produce an unprecedented amount of chest CT scans in the near future. which radiologists will have to read in order to decide on a patient follow-up strategy. According to the current guidelines. the workup of screen-detected nodules strongly relies on nodule size and nodule type. In this paper. we present a deep learning system based on multi-stream multi-scale convolutional networks. which automatically classifies all nodule types relevant for nodule workup. The system processes raw CT data containing a nodule without the need for any additional information such as nodule segmentation or nodule size and learns a representation of 3D data by analyzing an arbitrary number of 2D views of a given nodule. The deep learning system was trained with data from the Italian MILD screening trial and validated on an independent set of data from the Danish …,True,TxLhvpcAAAAJ:W7OEmFMy1HYC,223,https://www.nature.com/articles/srep46479,8567006734401252147,/scholar?cites=8567006734401252147,,,https://www.nature.com/articles/srep46479,0,0,0
1278299,Using deep learning to segment breast and fibroglandular tissue in MRI volumes,2017,Mehmet Ufuk Dalmış and Geert Litjens and Katharina Holland and Arnaud Setio and Ritse Mann and Nico Karssemeijer and Albert Gubern‐Mérida,44,Medical physics,2,533-546,,"Automated segmentation of breast and fibroglandular tissue (FGT) is required for various computer‐aided applications of breast MRI. Traditional image analysis and computer vision techniques. such atlas. template matching. or. edge and surface detection. have been applied to solve this task. However. applicability of these methods is usually limited by the characteristics of the images used in the study datasets. while breast MRI varies with respect to the different MRI protocols used. in addition to the variability in breast shapes. All this variability. in addition to various MRI artifacts. makes it a challenging task to develop a robust breast and FGT segmentation method using traditional approaches. Therefore. in this study. we investigated the use of a deep‐learning approach known as ""U‐net.""We used a dataset of 66 breast MRI's randomly selected from our scientific archive. which …",True,TxLhvpcAAAAJ:WF5omc3nYNoC,127,https://aapm.onlinelibrary.wiley.com/doi/abs/10.1002/mp.12079,9993343296257816404,/scholar?cites=9993343296257816404,,,https://www.researchgate.net/profile/Geert_Litjens/publication/311991068_Using_Deep_Learning_to_Segment_Breast_and_Fibroglanduar_Tissue_in_MRI_Volumes/links/5ad85164a6fdcc293584c986/Using-Deep-Learning-to-Segment-Breast-and-Fibroglanduar-Tissue-in-MRI-Volumes.pdf,0,0,0
1278300,Automatic detection of large pulmonary solid nodules in thoracic CT images,2015,Arnaud AA Setio and Colin Jacobs and Jaap Gelderblom and Bram van Ginneken,42,Medical physics,10,5642-5653,American Association of Physicists in Medicine,Current computer‐aided detection (CAD) systems for pulmonary nodules in computed tomography (CT) scans have a good performance for relatively small nodules. but often fail to detect the much rarer larger nodules. which are more likely to be cancerous. We present a novel CAD system specifically designed to detect solid nodules larger than 10 mm.The proposed detection pipeline is initiated by a three‐dimensional lung segmentation algorithm optimized to include large nodules attached to the pleural wall via morphological processing. An additional preprocessing is used to mask out structures outside the pleural space to ensure that pleural and parenchymal nodules have a similar appearance. Next. nodule candidates are obtained via a multistage process of thresholding and morphological operations. to detect both larger and smaller candidates. After segmenting each candidate. a set …,True,TxLhvpcAAAAJ:IjCSPb-OGe4C,103,https://aapm.onlinelibrary.wiley.com/doi/abs/10.1118/1.4929562,14121163271329355688,/scholar?cites=14121163271329355688,,,,0,0,0
1278301,Improving airway segmentation in computed tomography using leak detection with convolutional networks,2017,Jean-Paul Charbonnier and Eva M Van Rikxoort and Arnaud AA Setio and Cornelia M Schaefer-Prokop and Bram van Ginneken and Francesco Ciompi,36,Medical image analysis,,52-60,Elsevier,We propose a novel method to improve airway segmentation in thoracic computed tomography (CT) by detecting and removing leaks. Leak detection is formulated as a classification problem. in which a convolutional network (ConvNet) is trained in a supervised fashion to perform the classification task. In order to increase the segmented airway tree length. we take advantage of the fact that multiple segmentations can be extracted from a given airway segmentation algorithm by varying the parameters that influence the tree length and the amount of leaks. We propose a strategy in which the combination of these segmentations after removing leaks can increase the airway tree length while limiting the amount of leaks. This strategy therefore largely circumvents the need for parameter fine-tuning of a given airway segmentation algorithm.The ConvNet was trained and evaluated using a subset of inspiratory thoracic CT …,True,TxLhvpcAAAAJ:YsMSGLbcyi4C,71,https://www.sciencedirect.com/science/article/pii/S136184151630202X,10119306392018768738,/scholar?cites=10119306392018768738,,,https://drive.google.com/file/d/1yXfI7RDPlL61LuxieDhY3Bp4XiSwrKb8/view,0,0,0
1278302,Deep convolutional neural networks for automatic coronary calcium scoring in a screening study with low-dose chest CT,2016,N Lessmann and I Isgum and AAA Setio and BD de Vos and F Ciompi and PA de Jong and M Oudkerk and WP Th M Mali and MA Viergever and B van Ginneken,,SPIE Medical Imaging,,,,The amount of calcifications in the coronary arteries is a powerful and independent predictor of cardiovascular events and is used to identify subjects at high risk who might benefit from preventive treatment. Routine quantification of coronary calcium scores can complement screening programs using low-dose chest CT. such as lung cancer screening. We present a system for automatic coronary calcium scoring based on deep convolutional neural networks (CNNs). The system uses three independently trained CNNs to estimate a bounding box around the heart. In this region of interest. connected components above 130 HU are considered candidates for coronary artery calcifications. To separate them from other high intensity lesions. classification of all extracted voxels is performed by feeding two-dimensional 50 mm × 50 mm patches from three orthogonal planes into three concurrent CNNs. The networks consist …,True,TxLhvpcAAAAJ:zYLM7Y9cAGgC,31,https://www.spiedigitallibrary.org/conference-proceedings-of-spie/9785/978511/Deep-convolutional-neural-networks-for-automatic-coronary-calcium-scoring-in/10.1117/12.2216978.short,11932712040638875797,/scholar?cites=11932712040638875797,,,,0,0,0
1278303,Efficient organ localization using multi-label convolutional neural networks in thorax-abdomen CT scans,2018,Gabriel Efrain Humpire-Mamani and Arnaud Arindra Adiyoso Setio and Bram van Ginneken and Colin Jacobs,63,Physics in Medicine & Biology,8,085003,IOP Publishing,Automatic localization of organs and other structures in medical images is an important preprocessing step that can improve and speed up other algorithms such as organ segmentation. lesion detection. and registration. This work presents an efficient method for simultaneous localization of multiple structures in 3D thorax-abdomen CT scans.,True,TxLhvpcAAAAJ:hqOjcs7Dif8C,17,https://iopscience.iop.org/article/10.1088/1361-6560/aab4b3/meta,16888189080982033735,/scholar?cites=16888189080982033735,,,,0,0,0
1278304,Activity recognition and abnormality detection with the switching hidden semi-markov model,2005,Thi V Duong and Hung Hai Bui and Dinh Q Phung and Svetha Venkatesh,1,,,838-845,IEEE,This paper addresses the problem of learning and recognizing human activities of daily living (ADL). which is an important research issue in building a pervasive and smart environment. In dealing with ADL. we argue that it is beneficial to exploit both the inherent hierarchical organization of the activities and their typical duration. To this end. we introduce the switching hidden semi-markov model (S-HSMM). a two-layered extension of the hidden semi-Markov model (HSMM) for the modeling task. Activities are modeled in the S-HSMM in two ways: the bottom layer represents atomic activities and their duration using HSMMs; the top layer represents a sequence of high-level activities where each high-level activity is made of a sequence of atomic activities. We consider two methods for modeling duration: the classic explicit duration model using multinomial distribution. and the novel use of the discrete Coxian …,True,OtA9SwIAAAAJ:u5HHmVD_uO8C,703,https://ieeexplore.ieee.org/abstract/document/1467354/,8953661248773357609,/scholar?cites=8953661248773357609,,,https://espace.curtin.edu.au/bitstream/handle/20.500.11937/10349/116823_Activity%20recognition%20PID%20116823.pdf?sequence=2,0,0,0
1278305,Labeled random finite sets and the Bayes multi-target tracking filter,2014,Ba-Ngu Vo and Ba-Tuong Vo and Dinh Phung,,IEEE Transaction on Signal Processing,,,,An analytic solution to the multi-target Bayes recursion known as the δ-Generalized Labeled Multi-Bernoulli ( δ-GLMB) filter has been recently proposed by Vo and Vo in [“Labeled Random Finite Sets and Multi-Object Conjugate Priors.” IEEE Trans. Signal Process.. vol. 61. no. 13. pp. 3460-3475. 2014]. As a sequel to that paper. the present paper details efficient implementations of the δ-GLMB multi-target tracking filter. Each iteration of this filter involves an update operation and a prediction operation. both of which result in weighted sums of multi-target exponentials with intractably large number of terms. To truncate these sums. the ranked assignment and K-th shortest path algorithms are used in the update and prediction. respectively. to determine the most significant terms without exhaustively computing all of the terms. In addition. using tools derived from the same framework. such as probability hypothesis …,True,OtA9SwIAAAAJ:GO2DTSf4MZMC,527,https://ieeexplore.ieee.org/abstract/document/6928494/,4798077724436124236,/scholar?cites=4798077724436124236,,,https://arxiv.org/pdf/1312.2372,0,0,0
1278306,Learning and detecting activities from movement trajectories using the hierarchical hidden Markov model,2005,N. Nguyen and Dinh Q Phung and Svetha Venkatesh and Hung Bui,2,,,955-960,IEEE,Directly modeling the inherent hierarchy and shared structures of human behaviors. we present an application of the hierarchical hidden Markov model (HHMM) for the problem of activity recognition. We argue that to robustly model and recognize complex human activities. it is crucial to exploit both the natural hierarchical decomposition and shared semantics embedded in the movement trajectories. To this end. we propose the use of the HHMM. a rich stochastic model that has been recently extended to handle shared structures. for representing and recognizing a set of complex indoor activities. Furthermore. in the need of real-time recognition. we propose a Rao-Blackwellised particle filter (RBPF) that efficiently computes the filtering distribution at a constant time complexity for each new observation arrival. The main contributions of this paper lie in the application of the shared-structure HHMM. the estimation of …,True,OtA9SwIAAAAJ:u-x6o8ySG0sC,451,https://ieeexplore.ieee.org/abstract/document/1467545/,4468408870888640438,/scholar?cites=4468408870888640438,,,https://espace.curtin.edu.au/bitstream/handle/20.500.11937/15305/116822_Learning%20and%20detecting%20activities%20PID%20116822.pdf?sequence=2,0,0,0
1278307,Guidelines for developing and reporting machine learning predictive models in biomedical research: a multidisciplinary view,2016,Wei Luo and Dinh Phung and Truyen Tran and Sunil Gupta and Santu Rana and Chandan Karmakar and Alistair Shilton and John Yearwood and Nevenka Dimitrova and Tu Bao Ho and Svetha Venkatesh and Michael Berk,18,Journal of medical Internet research,12,e323,JMIR Publications Inc.. Toronto. Canada,As more and more researchers are turning to big data for new opportunities of biomedical discoveries. machine learning models. as the backbone of big data analysis. are mentioned more often in biomedical journals. However. owing to the inherent complexity of machine learning methods. they are prone to misuse. Because of the flexibility in specifying machine learning models. the results are often insufficiently reported in research articles. hindering reliable assessment of model validity and consistent interpretation of model outputs.To attain a set of guidelines on the use of machine learning predictive models within clinical settings to make sure the models are correctly applied and sufficiently reported so that true discoveries can be distinguished from random coincidence.A multidisciplinary panel of machine learning experts. clinicians. and traditional statisticians were interviewed. using an iterative process in accordance with the Delphi method.The process produced a set of guidelines that consists of (1) a list of reporting items to be included in a research article and (2) a set of practical sequential steps for developing predictive models.A set of guidelines was generated to enable correct application of machine learning models and consistent reporting of model specifications and results in biomedical research. We believe that such guidelines will accelerate the adoption of big data analysis. particularly with machine learning methods. in the biomedical research community.,True,OtA9SwIAAAAJ:W91e3rS6dHEC,239,https://www.jmir.org/2016/12/e323/,7020580512974096533,/scholar?cites=7020580512974096533,,,https://www.jmir.org/2016/12/e323/,0,0,0
1278308,A novel embedding model for knowledge base completion based on convolutional neural network,2017,Dai Quoc Nguyen and Tu Dinh Nguyen and Dat Quoc Nguyen and Dinh Phung,,arXiv preprint arXiv:1712.02121,,,,In this paper. we propose a novel embedding model. named ConvKB. for knowledge base completion. Our model ConvKB advances state-of-the-art models by employing a convolutional neural network. so that it can capture global relationships and transitional characteristics between entities and relations in knowledge bases. In ConvKB. each triple (head entity. relation. tail entity) is represented as a 3-column matrix where each column vector represents a triple element. This 3-column matrix is then fed to a convolution layer where multiple filters are operated on the matrix to generate different feature maps. These feature maps are then concatenated into a single feature vector representing the input triple. The feature vector is multiplied with a weight vector via a dot product to return a score. This score is then used to predict whether the triple is valid or not. Experiments show that ConvKB achieves better link prediction performance than previous state-of-the-art embedding models on two benchmark datasets WN18RR and FB15k-237.,True,OtA9SwIAAAAJ:BulkYocH2doC,229,https://arxiv.org/abs/1712.02121,5515928500707541108,/scholar?cites=5515928500707541108,,,https://arxiv.org/pdf/1712.02121,0,0,0
1278309,Deepcare: A deep dynamic memory model for predictive medicine,2016,Trang Pham and Truyen Tran and Dinh Phung and Svetha Venkatesh,,,,30-41,Springer. Cham,Personalized predictive medicine necessitates modeling of patient illness and care processes. which inherently have long-term temporal dependencies. Healthcare observations. recorded in electronic medical records. are episodic and irregular in time. We introduce DeepCare. a deep dynamic neural network that reads medical records and predicts future medical outcomes. At the data level. DeepCare models patient health state trajectories with explicit memory of illness. Built on Long Short-Term Memory (LSTM). DeepCare introduces time parameterizations to handle irregular timing by moderating the forgetting and consolidation of illness memory. DeepCare also incorporates medical interventions that change the course of illness and shape future medical risk. Moving up to the health state level. historical and present health states are then aggregated through multiscale temporal pooling. before …,True,OtA9SwIAAAAJ:cAUKuAERoUMC,219,https://link.springer.com/chapter/10.1007/978-3-319-31750-2_3,7556765048088716476,/scholar?cites=7556765048088716476,,,https://arxiv.org/pdf/1602.00357,0,0,0
1278310,Predicting healthcare trajectories from medical records: A deep learning approach,2017,Trang Pham and Truyen Tran and Dinh Phung and Svetha Venkatesh,69,Journal of biomedical informatics,,218-229,Academic Press,Personalized predictive medicine necessitates the modeling of patient illness and care processes. which inherently have long-term temporal dependencies. Healthcare observations. stored in electronic medical records are episodic and irregular in time. We introduce DeepCare. an end-to-end deep dynamic neural network that reads medical records. stores previous illness history. infers current illness states and predicts future medical outcomes. At the data level. DeepCare represents care episodes as vectors and models patient health state trajectories by the memory of historical records. Built on Long Short-Term Memory (LSTM). DeepCare introduces methods to handle irregularly timed events by moderating the forgetting and consolidation of memory. DeepCare also explicitly models medical interventions that change the course of illness and shape future medical risk. Moving up to the health state level …,True,OtA9SwIAAAAJ:ae0xyBWlIcIC,216,https://www.sciencedirect.com/science/article/pii/S1532046417300710,3180052582482977332,/scholar?cites=3180052582482977332,,,https://www.sciencedirect.com/science/article/pii/S1532046417300710,0,0,0
