,title,pub_year,author,volume,journal,number,pages,publisher,abstract,filled,author_pub_id,num_citations,pub_url,cites_id,citedby_url,gsrank,author_id,eprint_url,got_citations,got_author_ids,author_ids
1276753,The emerging MVC standard for 3D video services,2008,Ying Chen and Ye-Kui Wang and Kemal Ugur and Miska M Hannuksela and Jani Lainema and Moncef Gabbouj,2009,,1,786015,Springer International Publishing,Multiview video has gained a wide interest recently. The huge amount of data needed to be processed by multiview applications is a heavy burden for both transmission and decoding. The joint video team has recently devoted part of its effort to extend the widely deployed H.264/AVC standard to handle multiview video coding (MVC). The MVC extension of H.264/AVC includes a number of new techniques for improved coding efficiency. reduced decoding complexity. and new functionalities for multiview operations. MVC takes advantage of some of the interfaces and transport mechanisms introduced for the scalable video coding (SVC) extension of H.264/AVC. but the system level integration of MVC is conceptually more challenging as the decoder output may contain more than one view and can consist of any combination of the views with any temporal level. The generation of all the output views also …,True,NpTmcKEAAAAJ:3fE2CSJIrl8C,283,https://link.springer.com/content/pdf/10.1155/2009/786015.pdf,4133761087127425298,/scholar?cites=4133761087127425298,,,https://link.springer.com/content/pdf/10.1155/2009/786015.pdf,0,0,0
1276754,M2det: A single-shot object detector based on multi-level feature pyramid network,2019,Qijie Zhao and Tao Sheng and Yongtao Wang and Zhi Tang and Ying Chen and Ling Cai and Haibin Ling,33,Proceedings of the AAAI Conference on Artificial Intelligence,,9259-9266,,Feature pyramids are widely exploited by both the state-of-the-art one-stage object detectors (eg. DSSD. RetinaNet. RefineDet) and the two-stage object detectors (eg. Mask RCNN. DetNet) to alleviate the problem arising from scale variation across object instances. Although these object detectors with feature pyramids achieve encouraging results. they have some limitations due to that they only simply construct the feature pyramid according to the inherent multiscale. pyramidal architecture of the backbones which are originally designed for object classification task. Newly. in this work. we present Multi-Level Feature Pyramid Network (MLFPN) to construct more effective feature pyramids for detecting objects of different scales. First. we fuse multi-level features (ie multiple layers) extracted by backbone as the base feature. Second. we feed the base feature into a block of alternating joint Thinned U-shape Modules and Feature Fusion Modules and exploit the decoder layers of each Ushape module as the features for detecting objects. Finally. we gather up the decoder layers with equivalent scales (sizes) to construct a feature pyramid for object detection. in which every feature map consists of the layers (features) from multiple levels. To evaluate the effectiveness of the proposed MLFPN. we design and train a powerful end-to-end one-stage object detector we call M2Det by integrating it into the architecture of SSD. and achieve better detection performance than state-of-the-art one-stage detectors. Specifically. on MSCOCO benchmark. M2Det achieves AP of 41.0 at speed of 11.8 FPS with single-scale inference strategy and AP of 44.2 with multi …,True,NpTmcKEAAAAJ:Dip1O2bNi0gC,255,https://ojs.aaai.org/index.php/AAAI/article/view/4962,13359963855282714219,/scholar?cites=13359963855282714219,,,https://ojs.aaai.org/index.php/AAAI/article/view/4962/4835,0,0,0
1276755,Enhanced block-request streaming using scalable encoding,2011,Ying Chen and Thomas Stockhammer and Michael G Luby,,,,,,A block-request streaming system provides for improvements in the user experience and bandwidth efficiency of such systems. typically using an ingestion system that generates data in a form to be served by a conventional file server (HTTP. FTP. or the like). wherein the ingestion system intakes content and prepares it as files or data elements to be served by the file server. A client device can be adapted to take advantage of the ingestion process as well as including improvements that make for a better presentation independent of the ingestion process. The files or data elements are organized as blocks that are transmitted and decoded as a unit. and the system is configured to provide and consume scalable blocks such that the quality of the presentation increases as more of the block is downloaded. Encoding and decoding blocks with multiple independent scalability layers can be done as well.,True,NpTmcKEAAAAJ:mB3voiENLucC,242,https://patents.google.com/patent/US20110096828A1/en,4306211230427339634,/scholar?cites=4306211230427339634,,,https://patentimages.storage.googleapis.com/pdfs/US20110096828.pdf,0,0,0
1276756,Overview of HEVC high-level syntax and reference picture management,2012,Rickard Sjoberg and Ying Chen and Akira Fujibayashi and Miska M Hannuksela and Jonatan Samuelsson and Thiow Keng Tan and Ye-Kui Wang and Stephan Wenger,22,IEEE transactions on circuits and systems for video technology,12,1858-1870,IEEE,The increasing proportion of video traffic in telecommunication networks puts an emphasis on efficient video compression technology. High Efficiency Video Coding (HEVC) is the forthcoming video coding standard that provides substantial bit rate reductions compared to its predecessors. In the HEVC standardization process. technologies such as picture partitioning. reference picture management. and parameter sets are categorized as “high-level syntax.” The design of the high-level syntax impacts the interface to systems and error resilience. and provides new functionalities. This paper presents an overview of the HEVC high-level syntax. including network abstraction layer unit headers. parameter sets. picture partitioning schemes. reference picture management. and supplemental enhancement information messages.,True,NpTmcKEAAAAJ:9vf0nzSNQJEC,200,https://ieeexplore.ieee.org/abstract/document/6324417/,12100373256048991237,/scholar?cites=12100373256048991237,,,https://ieeexplore.ieee.org/iel5/76/4358651/06324417.pdf,0,0,0
1276757,Coding motion depth maps with depth range variation,2016,Ying Chen and Marta Karczewicz,,,,,,This disclosure describes techniques for coding 3D video block units. In one example. a video encoder is configured to determine a first real-world depth range for a first depth view component comprising a reference view component. determine a second real-world depth range for a second depth view component comprising a current view component. wherein the current view component is predicted relative to the reference view component. determine a predictive block for a portion of the current view component from the reference view component. adjust values of the predictive block based on a difference between the first real-world depth range and the second real-world depth range. and predict the portion of the current view based on the adjusted values of the predictive block.,True,NpTmcKEAAAAJ:UxriW0iASnsC,181,https://patents.google.com/patent/US9363535B2/en,9087603939885682319,/scholar?cites=9087603939885682319,,,https://patentimages.storage.googleapis.com/44/7c/4c/98b0fb185f6442/US9363535.pdf,0,0,0
1276758,Enhanced block-request streaming system for handling low-latency streaming,2016,Michael G Luby and Mark Watson and Lorenzo Vicisano and Payam Pakzad and Bin Wang and Ying Chen and Thomas Stockhammer and Jaber Mohammad Borran,,,,,,A block-request streaming system provides for low-latency streaming of a media presentation. A plurality of media segments are generated according to an encoding protocol. Each media segment includes a random access point. A plurality of media fragments are encoded according to the same protocol. The media segments are aggregated from a plurality of media fragments.,True,NpTmcKEAAAAJ:SpbeaW3--B0C,167,https://patents.google.com/patent/US9380096B2/en,18317394424970426508,/scholar?cites=18317394424970426508,,,https://patentimages.storage.googleapis.com/5a/2f/41/1c8efaf5520cd0/US9380096.pdf,0,0,0
1276759,Manifest file updates for network streaming of coded multimedia data,2014,Ying Chen and Thomas Stockhammer and Mark Watson,,,,,,In one example. a device for retrieving multimedia data. the device comprising one or more processors configured to retrieve data of a first segment of a representation of multimedia content in accordance with data of a copy of a manifest file stored by the device. retrieve a portion of a second segment of the representation in accordance with the manifest file. wherein the second segment occurs after the first segment in the representation. and wherein the portion of the second segment indicates that the manifest file is to be updated. update the copy of the manifest file stored by the device based on the indication that the manifest file is to be updated. and retrieve media data of the second segment in accordance with the updated manifest file.,True,NpTmcKEAAAAJ:HoB7MX3m0LUC,165,https://patents.google.com/patent/US8806050B2/en,7389563664938371350,/scholar?cites=7389563664938371350,,,https://patentimages.storage.googleapis.com/1d/6a/ba/253d5dbb8f1a30/US8806050.pdf,0,0,0
1276760,3D-HEVC test model 2,2013,Gerhard Tech and Krzysztof Wegner and Ying Chen and Sehoon Yea,16,Joint Collaborative Team on 3D Video Coding Extension Development of ITU-T SG,,13-19,,,True,NpTmcKEAAAAJ:hMod-77fHWUC,162,http://scholar.google.com/scholar?cluster=5686392971276498081&hl=en&oi=scholarr,5686392971276498081,/scholar?cites=5686392971276498081,,,,0,0,0
1276761,Enhanced block-request streaming system using signaling or block creation,2016,Michael G Luby and Mark Watson and Lorenzo Vicisano and Payam Pakzad and Bin Wang and Ying Chen and Thomas Stockhammer,,,,,,A block-request streaming system provides for improvements in the user experience and bandwidth efficiency of such systems. typically using an ingestion system that generates data in a form to be served by a conventional file server (HTTP. FTP. or the like). wherein the ingestion system intakes content and prepares it as files or data elements to be served by the file server. The system might include controlling the sequence. timing and construction of block requests. time based indexing. variable block sizing. optimal block partitioning. control of random access point placement. including across multiple presentation versions. dynamically updating presentation data. and/or efficiently presenting live content and time shifting.,True,NpTmcKEAAAAJ:_Qo2XoVZTnwC,150,https://patents.google.com/patent/US9432433B2/en,4559950686706641256,/scholar?cites=4559950686706641256,,,https://patentimages.storage.googleapis.com/0d/8e/17/bce6464a28a6f3/US9432433.pdf,0,0,0
1276762,Nations within a nation: variations in epidemiological transition across the states of India. 1990–2016 in the Global Burden of Disease Study,2017,Lalit Dandona and Rakhi Dandona and G Anil Kumar and DK Shukla and Vinod K Paul and Kalpana Balakrishnan and Dorairaj Prabhakaran and Nikhil Tandon and Sundeep Salvi and AP Dash and A Nandakumar and Vikram Patel and Sanjay K Agarwal and Prakash C Gupta and RS Dhaliwal and Prashant Mathur and Avula Laxmaiah and Preet K Dhillon and Subhojit Dey and Manu R Mathur and Ashkan Afshin and Christina Fitzmaurice and Emmanuela Gakidou and Peter Gething and Simon I Hay and Nicholas J Kassebaum and Hmwe Kyu and Stephen S Lim and Mohsen Naghavi and Gregory A Roth and Jeffrey D Stanaway and Harvey Whiteford and Vineet K Chadha and Sunil D Khaparde and Raghuram Rao and Kirankumar Rade and Puneet Dewan and Melissa Furtado and Eliza Dutta and Chris M Varghese and Ravi Mehrotra and P Jambulingam and Tanvir Kaur and Meenakshi Sharma and Shalini Singh and Rashmi Arora and Reeta Rasaily and Ranjit M Anjana and Viswanathan Mohan and Anurag Agrawal and Arvind Chopra and Ashish J Mathew and Deeksha Bhardwaj and Pallavi Muraleedharan and Parul Mutreja and Kelly Bienhoff and Scott Glenn and Rizwan S Abdulkader and Ashutosh N Aggarwal and Rakesh Aggarwal and Sandra Albert and Atul Ambekar and Monika Arora and Damodar Bachani and Ashish Bavdekar and Gufran Beig and Anil Bhansali and Anurag Bhargava and Eesh Bhatia and Bilali Camara and DJ Christopher and Siddharth K Das and Paresh V Dave and Sagnik Dey and Aloke G Ghoshal and N Gopalakrishnan and Randeep Guleria and Rajeev Gupta and Subodh S Gupta and Tarun Gupta and MD Gupte and G Gururaj and Sivadasanpillai Harikrishnan and Veena Iyer and Sudhir K Jain and Panniyamamkal Jeemon and Vasna Joshua and Rajni Kant and Anita Kar and Amal C Kataki and Kiran Katoch and Tripti Khanna and Ajay Khera and Sanjay Kinra and Parvaiz A Koul and Anand Krishnan and Avdhesh Kumar and Raman K Kumar and Rashmi Kumar and Anura Kurpad and Laishram Ladusingh and Rakesh Lodha and PA Mahesh and Rajesh Malhotra and Matthews Mathai and Dileep Mavalankar and Murali Mohan BV and Satinath Mukhopadhyay and Manoj Murhekar and GVS Murthy and Sanjeev Nair and Sreenivas A Nair and Lipika Nanda and Romi S Nongmaithem and Anu M Oommen and Jeyaraj D Pandian and Sapan Pandya and Sreejith Parameswaran and Sanghamitra Pati and Kameshwar Prasad and Narayan Prasad and Manorama Purwar and Asma Rahim and Sreebhushan Raju and Siddarth Ramji and Thara Rangaswamy and Goura K Rath and Ambuj Roy and Yogesh Sabde and KS Sachdeva and Harsiddha Sadhu and Rajesh Sagar and Mari J Sankar and Rajendra Sharma and Anita Shet and Shreya Shirude and Rajan Shukla and Sharvari R Shukla and Gagandeep Singh and Narinder P Singh and Virendra Singh and Anju Sinha and Dhirendra N Sinha and RK Srivastava and A Srividya and Vanita Suri and Rajaraman Swaminathan and PN Sylaja and Babasaheb Tandale and JS Thakur,390,The Lancet,10111,2437-2460,Elsevier,18% of the world's population lives in India. and many states of India have populations similar to those of large countries. Action to effectively improve population health in India requires availability of reliable and comprehensive state-level estimates of disease burden and risk factors over time. Such comprehensive estimates have not been available so far for all major diseases and risk factors. Thus. we aimed to estimate the disease burden and risk factors in every state of India as part of the Global Burden of Disease (GBD) Study 2016.Using all available data sources. the India State-Level Disease Burden Initiative estimated burden (metrics were deaths. disability-adjusted life-years [DALYs]. prevalence. incidence. and life expectancy) from 333 disease conditions and injuries and 84 risk factors for each state of India from 1990 to 2016 as part of GBD 2016. We divided the states of India into four …,True,DN5AdIEAAAAJ:0N-VGjzr574C,436,https://www.sciencedirect.com/science/article/pii/S0140673617328040,4358908765241137805,/scholar?cites=4358908765241137805,,,https://www.sciencedirect.com/science/article/pii/S0140673617328040,0,0,0
1276763,Overlapping demyelinating syndromes and anti–N‐methyl‐D‐aspartate receptor encephalitis,2014,Maarten J Titulaer and Romana Höftberger and Takahiro Iizuka and Frank Leypoldt and Lindsey McCracken and Tania Cellucci and Leslie A Benson and Huidy Shu and Takashi Irioka and Makito Hirano and Gagandeep Singh and Alvaro Cobo Calvo and Kenichi Kaida and Pamela S Morales and Paul W Wirtz and Tomotaka Yamamoto and Markus Reindl and Myrna R Rosenfeld and Francesc Graus and Albert Saiz and Josep Dalmau,75,Annals of neurology,3,411-428,,To report the clinical. radiological. and immunological association of demyelinating disorders with anti–N‐methyl‐D‐aspartate receptor (NMDAR) encephalitis.Clinical and radiological analysis was done of a cohort of 691 patients with anti‐NMDAR encephalitis. Determination of antibodies to NMDAR. aquaporin‐4 (AQP4). and myelin oligodendrocyte glycoprotein (MOG) was performed using brain immunohistochemistry and cell‐based assays.Twenty‐three of 691 patients with anti‐NMDAR encephalitis had prominent magnetic resonance imaging (MRI) and/or clinical features of demyelination. Group 1 included 12 patients in whom anti‐NMDAR encephalitis was preceded or followed by independent episodes of neuromyelitis optica (NMO) spectrum disorder (5 cases. 4 anti‐AQP4 positive) or brainstem or multifocal demyelinating syndromes (7 cases. all anti‐MOG positive). Group 2 …,True,DN5AdIEAAAAJ:ibZ2AwG9z6wC,357,https://onlinelibrary.wiley.com/doi/abs/10.1002/ana.24117,17304018869229811461,/scholar?cites=17304018869229811461,,,https://www.ncbi.nlm.nih.gov/pmc/articles/pmc4016175/,0,0,0
1276764,Risk factors for graft survival after liver transplantation from donation after cardiac death donors: an analysis of OPTN/UNOS data,2006,R Mateo and Y Cho and G Singh and M Stapfer and J Donovan and J Kahn and T‐L Fong and L Sher and Nicolas Jabbour and S Aswad and RR Selby and Y Genyk,6,American journal of transplantation,4,791-796,Blackwell Publishing Ltd, Due to increasing use of allografts from donation after cardiac death (DCD) donors. we evaluated DCD liver transplants and impact of recipient and donor factors on graft survival. Liver transplants from DCD donors reported to UNOS were analyzed against donation after brain death (DBD) donor liver transplants performed between 1996 and 2003. We defined a recipient cumulative relative risk (RCRR) using significant risk factors identified from a Cox regression analysis: age; medical condition at transplantation; regraft status; dialysis received and serum creatinine. Graft survival from DCD donors (71% at 1 year and 60% at 3 years) were significantly inferior to DBD donors (80% at 1 year and 72% at 3 years. p < 0.001). Low‐risk recipients (RCRR ≤ 1.5) with low‐risk DCD livers (DWIT < 30 min and CIT < 10 h. n = 226) achieved graft survival rates (81% and 67% at 1 and 3 years. respectively) not significantly …,True,DN5AdIEAAAAJ:0EnyYjriUFMC,301,https://onlinelibrary.wiley.com/doi/abs/10.1111/j.1600-6143.2006.01243.x,297974925779737430,/scholar?cites=297974925779737430,,,https://onlinelibrary.wiley.com/doi/pdfdirect/10.1111/j.1600-6143.2006.01243.x,0,0,0
1276765,Global. regional. and national burden of epilepsy. 1990–2016: a systematic analysis for the Global Burden of Disease Study 2016,2019,Ettore Beghi and Giorgia Giussani and Emma Nichols and Foad Abd-Allah and Jemal Abdela and Ahmed Abdelalim and Haftom Niguse Abraha and Mina G Adib and Sutapa Agrawal and Fares Alahdab and Ashish Awasthi and Yohanes Ayele and Miguel A Barboza and Abate Bekele Belachew and Belete Biadgo and Ali Bijani and Helen Bitew and Félix Carvalho and Yazan Chaiah and Ahmad Daryani and Huyen Phuc Do and Manisha Dubey and Aman Yesuf Yesuf Endries and Sharareh Eskandarieh and Andre Faro and Farshad Farzadfar and Seyed-Mohammad Fereshtehnejad and Eduarda Fernandes and Daniel Obadare Fijabi and Irina Filip and Florian Fischer and Abadi Kahsu Gebre and Afewerki Gebremeskel Tsadik and Teklu Gebrehiwo Gebremichael and Kebede Embaye Gezae and Maryam Ghasemi-Kasman and Kidu Gidey Weldegwergs and Meaza Girma Degefa and Elena V Gnedovskaya and Tekleberhan B Hagos and Arvin Haj-Mirzaian and Arya Haj-Mirzaian and Hamid Yimam Hassen and Simon I Hay and Mihajlo Jakovljevic and Amir Kasaeian and Tesfaye Dessale Kassa and Yousef Saleh Khader and Ibrahim Khalil and Ejaz Ahmad Khan and Jagdish Khubchandani and Adnan Kisa and Kristopher J Krohn and Chanda Kulkarni and Yirga Legesse Nirayo and Mark T Mackay and Marek Majdan and Azeem Majeed and Treh Manhertz and Man Mohan Mehndiratta and Tesfa Mekonen and Hagazi Gebre Meles and Getnet Mengistu and Shafiu Mohammed and Mohsen Naghavi and Ali H Mokdad and Ghulam Mustafa and Seyed Sina Naghibi Irvani and Long Hoang Nguyen and Molly R Nixon and Felix Akpojene Ogbo and Andrew T Olagunju and Tinuke O Olagunju and Mayowa Ojo Owolabi and Michael R Phillips and Gabriel David Pinilla-Monsalve and Mostafa Qorbani and Amir Radfar and Anwar Rafay and Vafa Rahimi-Movaghar and Nickolas Reinig and Perminder S Sachdev and Hosein Safari and Saeed Safari and Saeid Safiri and Mohammad Ali Sahraian and Abdallah M Samy and Shahabeddin Sarvi and Monika Sawhney and Masood A Shaikh and Mehdi Sharif and Gagandeep Singh and Mari Smith and Cassandra EI Szoeke and Rafael Tabarés-Seisdedos and Mohamad-Hani Temsah and Omar Temsah and Miguel Tortajada-Girbés and Bach Xuan Tran and Amanuel Amanuel Tesfay Tsegay and Irfan Ullah and Narayanaswamy Venketasubramanian and Ronny Westerman and Andrea Sylvia Winkler and Ebrahim M Yimer and Naohiro Yonemoto and Valery L Feigin and Theo Vos and Christopher JL Murray,18,The Lancet Neurology,4,357-375,Elsevier,Seizures and their consequences contribute to the burden of epilepsy because they can cause health loss (premature mortality and residual disability). Data on the burden of epilepsy are needed for health-care planning and resource allocation. The aim of this study was to quantify health loss due to epilepsy by age. sex. year. and location using data from the Global Burden of Diseases. Injuries. and Risk Factors Study.We assessed the burden of epilepsy in 195 countries and territories from 1990 to 2016. Burden was measured as deaths. prevalence. and disability-adjusted life-years (DALYs; a summary measure of health loss defined by the sum of years of life lost [YLLs] for premature mortality and years lived with disability). by age. sex. year. location. and Socio-demographic Index (SDI; a compound measure of income per capita. education. and fertility). Vital registrations and verbal autopsies …,True,DN5AdIEAAAAJ:KsTgnNRry18C,263,https://www.sciencedirect.com/science/article/pii/S147444221830454X,14979125421020951486,/scholar?cites=14979125421020951486,,,https://www.sciencedirect.com/science/article/pii/S147444221830454X,0,0,0
1276766,Estimation of stature from hand and phalange length,2004,OP Jasuja and G Singh,26,JIAFM,3,0971-3,,Personal identification is an integral part of the investigation in cases of mass disasters where disintegrated and amputated body organs are found very frequently. Plastic and latent fingerprints and palm prints are also available very commonly at most of the scene of crime. Estimating stature from various parameters based on the above mentioned evidences becomes one of the most important and essential exercise for personal identification. In present paper. study on stature estimation from hand and phalanges length has been reported.Stature and phalanges length of all the fingers of both the hands of 60 individuals have been measured. The inked palm prints were also obtained and the same measurements were recorded from it also. The regression equations have been drawn from the data collected. It has been observed that stature can be estimated from the phalangeal lengths.,True,DN5AdIEAAAAJ:TIZ-Mc8IlK0C,208,http://www.forensicindia.net/journals/jiafm/t04/i3/jalt04i3p100.pdf,3876607936180442088,/scholar?cites=3876607936180442088,,,http://www.forensicindia.net/journals/jiafm/t04/i3/jalt04i3p100.pdf,0,0,0
1276767,NCCN guidelines insights: hepatobiliary cancers. version 1.2017,2017,Al B Benson and Michael I D'Angelica and Daniel E Abbott and Thomas A Abrams and Steven R Alberts and Daniel A Anaya and Chandrakanth Are and Daniel B Brown and Daniel T Chang and Anne M Covey and William Hawkins and Renuka Iyer and Rojymon Jacob and Andrea Karachristos and R Kate Kelley and Robin Kim and Manisha Palta and James O Park and Vaibhav Sahai and Tracey Schefter and Carl Schmidt and Jason K Sicklick and Gagandeep Singh and Davendra Sohal and Stacey Stein and G Gary Tian and Jean-Nicolas Vauthey and Alan P Venook and Andrew X Zhu and Karin G Hoffmann and Susan Darlow,15,Journal of the National Comprehensive Cancer Network,5,563-573,Harborside Press. LLC,The NCCN Guidelines for Hepatobiliary Cancers provide treatment recommendations for cancers of the liver. gallbladder. and bile ducts. The NCCN Hepatobiliary Cancers Panel meets at least annually to review comments from reviewers within their institutions. examine relevant new data from publications and abstracts. and reevaluate and update their recommendations. These NCCN Guidelines Insights summarize the panel's discussion and most recent recommendations regarding locoregional therapy for treatment of patients with hepatocellular carcinoma.,True,DN5AdIEAAAAJ:xm1hsP5ya-EC,204,https://jnccn.org/abstract/journals/jnccn/15/5/article-p563.xml,17927710439381139288,/scholar?cites=17927710439381139288,,,,0,0,0
1276768,Treatment of neurocysticercosis: current status and future research needs,2006,TE Nash and G Singh and AC White and V Rajshekhar and JA Loeb and JV Proano and OM Takayanagui and AE Gonzalez and JA Butman and C DeGiorgio and OH Del Brutto and A Delgado-Escueta and CAW Evans and RH Gilman and SM Martinez and MT Medina and EJ Pretell and J Teale and HH Garcia,67,,7,1120-1127,Wolters Kluwer Health. Inc. on behalf of the American Academy of Neurology,Here we put forward a roadmap that summarizes important questions that need to be answered to determine more effective and safer treatments. A key concept in management of neurocysticercosis is the understanding that infection and disease due to neurocysticercosis are variable and thus different clinical approaches and treatments are required. Despite recent advances. treatments remain either suboptimal or based on poorly controlled or anecdotal experience. A better understanding of basic pathophysiologic mechanisms including parasite survival and evolution. nature of the inflammatory response. and the genesis of seizures. epilepsy. and mechanisms of anthelmintic action should lead to improved therapies.,True,DN5AdIEAAAAJ:cB__R-XWw9UC,198,https://n.neurology.org/content/67/7/1120.short,12310486947977721508,/scholar?cites=12310486947977721508,,,https://www.ncbi.nlm.nih.gov/pmc/articles/PMC2923067/,0,0,0
